Nippon India Nifty AAA CPSE Bond Plus SDL - Apr 2027 Maturity 60:40 Index Fund(G),46532,Nippon India Mutual Fund,0.5,1.59,2.92,7.86,Nifty AAA CPSE Bond Plus SDL Apr 2027 60:40 Index,7.39,,,7.29,34,33,49,8,37,23,,,Nippon India Nifty AAA CPSE Bond Plus SDL - Apr 2027 Maturity 60:40 Index Fund(G),Debt : Medium to Long Duration,59,60,60,60,59,36,11,11,7.12,0.47,1.78,2.14,7.78,7.42,5.24,6.26,,,,,,,,
Kotak Nifty SDL Apr 2032 Top 12 Equal Weight Index Fund-Reg(G),46390,Kotak Mahindra Mutual Fund,0.43,2.05,0.84,7.42,Nifty SDL Apr 2032 Top 12 Equal Weight Index,8.24,,,6.58,9,11,9,4,9,2,,,Kotak Nifty SDL Apr 2032 Top 12 Equal Weight Index Fund-Reg(G),Debt : Long Duration,26,26,26,26,24,8,3,2,4.95,0.12,1.9,-0.73,6.0,7.66,4.7,6.78,,,,,,,,
Kotak Nifty 50 ETF,8469,Kotak Mahindra Mutual Fund,1.09,7.12,6.76,10.89,NIFTY 50 - TRI,13.36,16.33,13.88,12.05,54,100,83,75,49,81,39,21,Kotak Nifty 50 ETF,Equity : ETFs,170,214,205,191,168,122,72,33,9.0,0.95,7.36,7.03,7.92,16.94,18.01,13.8,,,,,,,,
Franklin India Liquid Fund-Super Inst(G),3406,Franklin Templeton Mutual Fund,0.49,1.46,2.97,6.68,Nifty Liquid Fund Index,6.99,5.74,6.21,6.06,1,10,6,1,1,4,5,2,Franklin India Liquid Fund-Super Inst(G),Debt : Liquid,38,42,41,38,38,35,34,29,5.89,0.48,1.42,2.89,6.49,6.89,5.66,6.05,,,,,,,,
Tata Multicap Fund-Reg(G),47480,Tata Mutual Fund,0.42,6.11,7.15,2.63,Nifty500 Multicap 50:25:25 - TRI,,,,2.82,27,14,9,10,31,,,,Tata Multicap Fund-Reg(G),Equity : Multi Cap,42,45,45,44,41,29,21,14,4.04,0.0,4.76,5.42,4.2,16.99,18.85,14.4,,,,,,,,
Aditya Birla SL Nifty 50 ETF,12811,Aditya Birla Sun Life Mutual Fund,1.07,7.1,6.74,10.88,NIFTY 50 - TRI,13.41,16.41,13.9,12.15,48,110,90,79,52,76,30,19,Aditya Birla SL Nifty 50 ETF,Equity : ETFs,170,214,205,191,168,122,72,33,9.0,0.95,7.36,7.03,7.92,16.94,18.01,13.8,,,,,,,,
ICICI Pru Commodities Fund-Reg(G),41999,ICICI Prudential Mutual Fund,-1.92,3.04,7.35,11.04,NIFTY COMMODITIES - TRI,17.13,27.82,,13.27,3,96,85,18,5,18,5,,ICICI Pru Commodities Fund-Reg(G),Equity : Thematic,88,110,107,99,80,39,23,9,3.21,-0.12,4.96,5.16,3.32,17.86,21.22,14.57,,,,,,,,
ICICI Pru Nifty Bank ETF,32451,ICICI Prudential Mutual Fund,2.63,10.97,8.42,15.87,NIFTY BANK - TRI,12.34,15.74,,18.14,27,30,21,41,22,100,48,,ICICI Pru Nifty Bank ETF,Equity : ETFs,170,214,205,191,168,122,72,33,9.0,0.95,7.36,7.03,7.92,16.94,18.01,13.8,,,,,,,,
HDFC Silver ETF,46223,HDFC Mutual Fund,15.08,39.23,65.73,85.33,Silver,35.66,,,100.29,5,11,8,10,1,5,,,HDFC Silver ETF,Gold : ETFs,31,38,37,35,31,17,11,11,77.55,10.0,30.15,44.9,71.32,33.37,20.02,16.23,,,,,,,,
UTI Balanced Advantage Fund-Reg(G),48102,UTI Mutual Fund,0.7,4.44,4.43,8.33,NIFTY 50 Hybrid Composite Debt 50:50 Index,,,,8.75,5,16,12,15,5,,,,UTI Balanced Advantage Fund-Reg(G),Hybrid : Dynamic Asset Allocation,33,34,34,34,33,24,19,11,5.92,0.51,4.18,4.26,6.0,11.95,11.65,10.15,,,,,,,,
LIC MF Large & Midcap Fund-Reg(G),31950,LIC Mutual Fund,-0.11,4.45,2.48,1.21,NIFTY LargeMidcap 250 - TRI,16.46,17.74,15.12,0.58,26,23,25,28,27,17,22,10,LIC MF Large & Midcap Fund-Reg(G),Equity : Large & Mid Cap,31,33,33,31,31,26,26,19,4.9,0.29,5.29,5.8,5.38,18.04,20.1,14.95,,,,,,,,
DSP Healthcare Fund-Reg(G),36002,DSP Mutual Fund,1.41,2.37,5.57,-2.2,BSE Health Care - TRI,21.48,17.0,,-3.85,16,4,11,11,14,6,3,,DSP Healthcare Fund-Reg(G),Equity : Sectoral - Pharma,18,20,20,18,16,10,9,3,-1.68,0.6,2.52,5.57,3.36,22.11,16.87,12.4,,,,,,,,
Tata Banking & Financial Services Fund-Reg(G),33726,Tata Mutual Fund,1.43,9.87,7.72,16.02,Nifty Financial Services - TRI,16.84,16.78,,18.17,7,12,13,11,6,6,7,,Tata Banking & Financial Services Fund-Reg(G),Equity : Sectoral - Financial Services,21,23,23,22,21,14,11,10,16.64,1.61,9.82,7.89,15.04,16.29,17.14,14.0,,,,,,,,
SBI Retirement Benefit Fund-Aggressive Plan-Reg(G),30398,SBI Mutual Fund,0.02,4.66,3.78,2.32,BSE 500 - TRI,12.88,,,5.83,16,33,15,15,38,17,,,SBI Retirement Benefit Fund-Aggressive Plan-Reg(G),Hybrid : Solution Oriented,43,43,43,43,42,38,33,15,5.31,0.32,4.01,3.84,5.32,12.71,13.12,10.61,,,,,,,,
Kotak Debt Hybrid Fund(G),2051,Kotak Mahindra Mutual Fund,0.11,2.93,1.18,5.22,CRISIL Hybrid 85+15 - Conservative Index,9.93,10.02,9.49,4.77,14,16,4,15,14,5,4,1,Kotak Debt Hybrid Fund(G),Hybrid : Debt Oriented (Conservative),18,18,18,18,18,18,17,17,5.92,0.38,2.42,2.08,6.3,8.89,8.61,7.76,,,,,,,,
Baroda BNP Paribas Multi Cap Fund-Reg(G),500,Baroda BNP Paribas Mutual Fund,0.19,4.13,5.41,0.61,Nifty500 Multicap 50:25:25 - TRI,18.37,21.09,14.53,-1.47,39,20,33,23,36,11,5,7,Baroda BNP Paribas Multi Cap Fund-Reg(G),Equity : Multi Cap,42,45,45,44,41,29,21,14,4.04,0.0,4.76,5.42,4.2,16.99,18.85,14.4,,,,,,,,
Edelweiss Multi Cap Fund-Reg(G),48147,Edelweiss Mutual Fund,-0.04,5.5,5.16,1.52,Nifty500 Multicap 50:25:25 - TRI,,,,1.56,32,26,16,27,34,,,,Edelweiss Multi Cap Fund-Reg(G),Equity : Multi Cap,42,45,45,44,41,29,21,14,4.04,0.0,4.76,5.42,4.2,16.99,18.85,14.4,,,,,,,,
Parag Parikh Conservative Hybrid Fund-Reg(G),45338,PPFAS Mutual Fund,0.14,2.57,2.13,7.39,CRISIL Hybrid 85+15 - Conservative Index,11.18,,,7.38,4,14,10,8,4,1,,,Parag Parikh Conservative Hybrid Fund-Reg(G),Hybrid : Debt Oriented (Conservative),18,18,18,18,18,18,17,17,5.92,0.38,2.42,2.08,6.3,8.89,8.61,7.76,,,,,,,,
Franklin Build India Fund(G),7864,Franklin Templeton Mutual Fund,-0.87,4.86,4.65,2.6,BSE India Infrastructure Index - TRI,25.55,29.26,17.43,4.47,5,7,7,4,6,3,4,2,Franklin Build India Fund(G),Equity : Sectoral - Infrastructure,20,21,21,21,19,19,19,18,0.16,-1.29,3.78,2.38,-0.48,22.04,26.89,15.69,,,,,,,,
Kotak Business Cycle Fund-Reg(G),46472,Kotak Mahindra Mutual Fund,-0.8,1.91,6.12,6.63,NIFTY 500 - TRI,17.13,,,5.31,37,77,93,39,21,19,,,Kotak Business Cycle Fund-Reg(G),Equity : Thematic,88,110,107,99,80,39,23,9,3.21,-0.12,4.96,5.16,3.32,17.86,21.22,14.57,,,,,,,,
ICICI Pru Transportation and Logistics Fund-Reg(G),46979,ICICI Prudential Mutual Fund,0.82,7.01,16.69,16.69,Nifty Transportation & Logistics - TRI,27.87,,,18.86,8,6,7,8,5,2,,,ICICI Pru Transportation and Logistics Fund-Reg(G),Equity : Sectoral - Auto,10,10,10,10,8,4,1,1,19.76,1.26,7.96,17.57,17.0,26.33,24.09,12.81,,,,,,,,
UTI MEPUS,3617,UTI Mutual Fund,0.73,5.01,5.25,7.71,BSE 100 - TRI,12.72,15.47,12.27,8.7,10,16,24,27,11,49,45,26,UTI MEPUS,Equity : Tax Saving (ELSS),56,57,57,57,56,52,51,29,4.28,-0.01,4.87,4.88,4.07,16.65,19.66,14.01,,,,,,,,
Edelweiss Flexi Cap Fund-Reg(G),31778,Edelweiss Mutual Fund,0.73,6.43,7.57,4.59,NIFTY 500 - TRI,18.19,19.67,14.99,4.91,24,12,11,6,24,11,10,5,Edelweiss Flexi Cap Fund-Reg(G),Equity : Flexi Cap,48,51,50,48,48,39,29,21,4.09,0.1,4.98,5.21,4.11,16.03,18.06,14.12,,,,,,,,
HDFC Business Cycle Fund-Reg(G),46445,HDFC Mutual Fund,-2.0,1.85,5.0,3.31,NIFTY 500 - TRI,,,,2.65,52,97,96,56,48,,,,HDFC Business Cycle Fund-Reg(G),Equity : Thematic,88,110,107,99,80,39,23,9,3.21,-0.12,4.96,5.16,3.32,17.86,21.22,14.57,,,,,,,,
Kotak Floating Rate Fund-Reg(G),42597,Kotak Mahindra Mutual Fund,0.67,1.77,3.29,8.43,NIFTY Ultra Short Duration Debt Index,7.89,6.22,,7.84,1,3,6,3,2,4,5,,Kotak Floating Rate Fund-Reg(G),Debt : Floater,12,12,12,12,12,12,8,5,7.29,0.6,1.81,2.73,7.89,7.75,6.19,7.06,,,,,,,,
HDFC Gilt Fund(G),1269,HDFC Mutual Fund,-0.21,1.61,-1.1,5.55,Nifty All Duration G-Sec Index,6.96,4.99,6.63,4.52,18,25,18,21,17,14,8,13,HDFC Gilt Fund(G),Debt : Gilt,36,39,39,38,36,30,21,21,4.82,-0.05,1.46,-0.56,5.61,6.82,4.85,6.89,,,,,,,,
Motilal Oswal Large Cap Fund-Reg(G),48488,Motilal Oswal Mutual Fund,0.59,5.52,6.52,12.71,NIFTY 100 - TRI,,,,9.14,8,25,23,12,2,,,,Motilal Oswal Large Cap Fund-Reg(G),Equity : Large Cap,38,39,39,39,38,35,32,28,7.27,0.57,5.63,5.36,6.37,14.46,16.38,13.01,,,,,,,,
Sundaram Multi Cap Fund(G),2370,Sundaram Mutual Fund,-0.65,4.75,6.18,6.32,Nifty500 Multicap 50:25:25 - TRI,17.16,20.47,15.18,5.62,14,33,22,18,11,16,8,5,Sundaram Multi Cap Fund(G),Equity : Multi Cap,42,45,45,44,41,29,21,14,4.04,0.0,4.76,5.42,4.2,16.99,18.85,14.4,,,,,,,,
Sundaram Multi Asset Allocation Fund-Reg(G),48460,Sundaram Mutual Fund,2.41,9.26,9.95,18.06,NIFTY 500 - TRI,,,,19.22,4,7,7,13,3,,,,Sundaram Multi Asset Allocation Fund-Reg(G),Hybrid : Multi Asset Allocation,27,33,32,29,25,9,9,7,14.35,1.7,7.63,8.95,13.67,17.27,17.69,13.21,,,,,,,,
Tata Business Cycle Fund-Reg(G),45373,Tata Mutual Fund,-0.38,3.93,3.72,0.69,NIFTY 500 - TRI,16.94,,,1.39,59,64,76,72,58,22,,,Tata Business Cycle Fund-Reg(G),Equity : Thematic,88,110,107,99,80,39,23,9,3.21,-0.12,4.96,5.16,3.32,17.86,21.22,14.57,,,,,,,,
UTI MNC Fund-Reg(G),3634,UTI Mutual Fund,-0.31,2.7,6.83,2.87,NIFTY MNC - TRI,13.31,14.04,10.36,3.43,3,5,4,3,3,2,2,2,UTI MNC Fund-Reg(G),Equity : Thematic - MNC,6,7,7,6,6,4,4,3,1.79,-0.03,3.12,5.02,1.26,12.02,13.83,9.91,,,,,,,,
Axis Gold ETF,12461,Axis Mutual Fund,4.91,22.95,31.57,62.54,Gold-India,32.01,20.03,15.97,67.08,16,37,36,15,29,10,5,11,Axis Gold ETF,Gold : ETFs,31,38,37,35,31,17,11,11,77.55,10.0,30.15,44.9,71.32,33.37,20.02,16.23,,,,,,,,
Nippon India ETF Nifty IT,44506,Nippon India Mutual Fund,4.34,6.14,1.41,-11.02,NIFTY IT - TRI,9.2,13.36,,-11.42,165,14,133,174,163,117,67,,Nippon India ETF Nifty IT,Equity : ETFs,170,214,205,191,168,122,72,33,9.0,0.95,7.36,7.03,7.92,16.94,18.01,13.8,,,,,,,,
ICICI Pru Bond Fund(G),6197,ICICI Prudential Mutual Fund,0.13,1.61,0.65,6.94,CRISIL Medium to Long Term Debt Index,7.59,5.71,7.17,6.21,50,57,46,51,49,17,2,2,ICICI Pru Bond Fund(G),Debt : Medium to Long Duration,59,60,60,60,59,36,11,11,7.12,0.47,1.78,2.14,7.78,7.42,5.24,6.26,,,,,,,,
Invesco India ELSS Tax Saver Fund-Reg(G),2270,Invesco Mutual Fund,-1.74,2.45,2.42,-0.15,BSE 500 - TRI,16.29,16.4,13.7,-0.94,49,54,53,48,48,26,43,15,Invesco India ELSS Tax Saver Fund-Reg(G),Equity : Tax Saving (ELSS),56,57,57,57,56,52,51,29,4.28,-0.01,4.87,4.88,4.07,16.65,19.66,14.01,,,,,,,,
Nippon India Index Fund-Nifty 50 Plan(G),12860,Nippon India Mutual Fund,1.04,6.99,6.52,10.41,NIFTY 50 - TRI,12.8,15.52,12.85,11.59,36,96,79,49,31,61,24,15,Nippon India Index Fund-Nifty 50 Plan(G),Equity : Index Funds,175,219,215,198,167,83,34,18,5.22,0.54,6.23,4.78,4.35,16.09,16.83,13.09,,,,,,,,
Nippon India Innovation Fund-Reg(G),48169,Nippon India Mutual Fund,-0.7,1.04,6.88,5.35,NIFTY 500 - TRI,,,,7.7,23,73,100,26,29,,,,Nippon India Innovation Fund-Reg(G),Equity : Thematic,88,110,107,99,80,39,23,9,3.21,-0.12,4.96,5.16,3.32,17.86,21.22,14.57,,,,,,,,
UTI Gold ETF,3564,UTI Mutual Fund,7.35,24.65,30.4,65.0,Gold-India,32.43,20.07,16.3,64.74,26,18,17,33,14,8,3,3,UTI Gold ETF,Gold : ETFs,31,38,37,35,31,17,11,11,77.55,10.0,30.15,44.9,71.32,33.37,20.02,16.23,,,,,,,,
Canara Rob Focused Fund-Reg(G),45510,Canara Robeco Mutual Fund,0.24,4.28,6.91,8.09,BSE 500 - TRI,17.03,,,7.42,8,16,32,11,6,17,,,Canara Rob Focused Fund-Reg(G),Equity : Multi Cap,42,45,45,44,41,29,21,14,4.04,0.0,4.76,5.42,4.2,16.99,18.85,14.4,,,,,,,,
Bandhan Multi Cap Fund-Reg(G),45867,Bandhan Mutual Fund,0.02,4.47,4.34,4.28,Nifty500 Multicap 50:25:25 - TRI,17.2,,,5.01,19,25,28,31,21,15,,,Bandhan Multi Cap Fund-Reg(G),Equity : Multi Cap,42,45,45,44,41,29,21,14,4.04,0.0,4.76,5.42,4.2,16.99,18.85,14.4,,,,,,,,
Franklin India Balanced Advantage Fund-Reg(G),46625,Franklin Templeton Mutual Fund,0.02,2.89,2.92,5.73,NIFTY 50 Hybrid Composite Debt 50:50 Index,12.43,,,4.8,25,28,29,31,21,8,,,Franklin India Balanced Advantage Fund-Reg(G),Hybrid : Dynamic Asset Allocation,33,34,34,34,33,24,19,11,5.92,0.51,4.18,4.26,6.0,11.95,11.65,10.15,,,,,,,,
ITI Small Cap Fund-Reg(G),44399,ITI Mutual Fund,-1.81,3.06,3.37,-1.06,Nifty Smallcap 250 - TRI,25.2,21.96,,-2.0,13,15,12,15,12,2,19,,ITI Small Cap Fund-Reg(G),Equity : Small Cap,29,31,31,30,29,23,21,13,-2.97,-1.8,2.52,3.17,-2.44,19.01,24.91,16.73,,,,,,,,
Quant Large Cap Fund-Reg(G),46678,Quant Mutual Fund,-0.66,5.56,5.51,3.43,NIFTY 100 - TRI,14.35,,,4.46,33,35,22,23,33,19,,,Quant Large Cap Fund-Reg(G),Equity : Large Cap,38,39,39,39,38,35,32,28,7.27,0.57,5.63,5.36,6.37,14.46,16.38,13.01,,,,,,,,
Mirae Asset Healthcare Fund-Reg(G),39122,Mirae Asset Mutual Fund,-0.39,1.47,5.87,4.09,BSE Health Care - TRI,20.81,16.91,,-2.58,13,17,15,6,6,8,6,,Mirae Asset Healthcare Fund-Reg(G),Equity : Sectoral - Pharma,18,20,20,18,16,10,9,3,-1.68,0.6,2.52,5.57,3.36,22.11,16.87,12.4,,,,,,,,
Motilal Oswal Nifty Midcap 150 Index Fund-Reg(G),43810,Motilal Oswal Mutual Fund,1.52,7.18,6.3,7.08,Nifty Midcap 150 - TRI,22.59,24.06,,5.54,95,40,60,65,72,7,1,,Motilal Oswal Nifty Midcap 150 Index Fund-Reg(G),Equity : Index Funds,175,219,215,198,167,83,34,18,5.22,0.54,6.23,4.78,4.35,16.09,16.83,13.09,,,,,,,,
UTI Low Duration Fund-Reg(G),3601,UTI Mutual Fund,0.57,1.67,3.27,7.75,NIFTY Low Duration Debt Index,7.5,7.11,6.16,7.1,3,5,3,4,3,3,1,16,UTI Low Duration Fund-Reg(G),Debt : Low Duration,20,26,25,23,20,20,20,19,6.83,0.53,1.55,3.09,7.44,7.2,5.82,6.43,,,,,,,,
Aditya Birla SL Medium Term Plan-Reg(G),7683,Aditya Birla Sun Life Mutual Fund,0.67,2.26,3.36,11.52,CRISIL Medium Duration Debt Index,9.51,11.92,8.55,10.72,1,5,3,4,1,1,1,1,Aditya Birla SL Medium Term Plan-Reg(G),Debt : Medium Duration,26,26,26,26,26,19,12,12,7.16,0.54,1.75,2.68,7.85,7.46,6.62,6.7,,,,,,,,
Nippon India Consumption Fund(G),2644,Nippon India Mutual Fund,-1.42,0.25,3.91,3.16,Nifty India Consumption - TRI,15.66,21.3,13.77,4.19,8,13,18,18,9,8,2,6,Nippon India Consumption Fund(G),Equity : Thematic - Consumption,20,24,22,22,18,13,13,9,1.96,-1.38,1.53,5.2,1.74,15.46,18.14,14.07,,,,,,,,
Kotak Dynamic Bond Fund-Reg(G),5430,Kotak Mahindra Mutual Fund,-0.35,2.12,-0.07,5.77,NIFTY Composite Debt Index,7.07,5.38,7.6,5.08,13,21,4,12,13,11,11,2,Kotak Dynamic Bond Fund-Reg(G),Debt : Dynamic Bond,22,22,22,22,22,22,21,19,5.32,0.16,1.62,0.11,6.06,6.95,5.48,6.83,,,,,,,,
DSP Overnight Fund-Reg(G),41945,DSP Mutual Fund,0.45,1.34,2.68,5.88,CRISIL Liquid Overnight Index,6.36,5.3,,5.28,15,8,14,14,7,7,9,,DSP Overnight Fund-Reg(G),Debt : Overnight,34,35,35,34,34,30,27,3,5.25,0.44,1.33,2.67,5.82,6.32,5.28,5.45,,,,,,,,
Tata Large Cap Fund-Reg(G),3281,Tata Mutual Fund,0.88,7.43,6.26,7.66,NIFTY 100 - TRI,14.5,17.78,12.57,9.04,11,15,3,15,16,18,6,19,Tata Large Cap Fund-Reg(G),Equity : Large Cap,38,39,39,39,38,35,32,28,7.27,0.57,5.63,5.36,6.37,14.46,16.38,13.01,,,,,,,,
Aditya Birla SL Nifty Bank ETF,34434,Aditya Birla Sun Life Mutual Fund,2.63,10.98,8.43,15.83,NIFTY BANK - TRI,12.32,15.7,,18.25,25,29,20,38,26,101,49,,Aditya Birla SL Nifty Bank ETF,Equity : ETFs,170,214,205,191,168,122,72,33,9.0,0.95,7.36,7.03,7.92,16.94,18.01,13.8,,,,,,,,
Mahindra Manulife Large & Mid Cap Fund-Reg(G),43915,Mahindra Manulife Mutual Fund,-0.11,5.94,4.34,4.17,NIFTY LargeMidcap 250 - TRI,15.78,20.21,,2.95,21,22,15,23,21,20,11,,Mahindra Manulife Large & Mid Cap Fund-Reg(G),Equity : Large & Mid Cap,31,33,33,31,31,26,26,19,4.9,0.29,5.29,5.8,5.38,18.04,20.1,14.95,,,,,,,,
HDFC NIFTY Bank ETF,33563,HDFC Mutual Fund,2.63,10.97,8.41,15.83,NIFTY BANK - TRI,12.29,15.66,,18.1,30,31,23,44,27,102,52,,HDFC NIFTY Bank ETF,Equity : ETFs,170,214,205,191,168,122,72,33,9.0,0.95,7.36,7.03,7.92,16.94,18.01,13.8,,,,,,,,
HDFC Innovation Fund-Reg(G),49691,HDFC Mutual Fund,-0.14,5.17,,,NIFTY 500 - TRI,,,,,,55,52,,,,,,HDFC Innovation Fund-Reg(G),Equity : Thematic,88,110,107,99,80,39,23,9,3.21,-0.12,4.96,5.16,3.32,17.86,21.22,14.57,,,,,,,,
Baroda BNP Paribas Large Cap Fund-Reg(G),23,Baroda BNP Paribas Mutual Fund,1.73,5.48,4.44,4.15,NIFTY 100 - TRI,15.15,16.59,13.11,5.07,30,1,25,31,29,12,14,15,Baroda BNP Paribas Large Cap Fund-Reg(G),Equity : Large Cap,38,39,39,39,38,35,32,28,7.27,0.57,5.63,5.36,6.37,14.46,16.38,13.01,,,,,,,,
Mirae Asset Small Cap Fund-Reg(G),49453,Mirae Asset Mutual Fund,-1.43,4.66,8.26,,Nifty Smallcap 250 - TRI,,,,,,9,6,3,,,,,Mirae Asset Small Cap Fund-Reg(G),Equity : Small Cap,29,31,31,30,29,23,21,13,-2.97,-1.8,2.52,3.17,-2.44,19.01,24.91,16.73,,,,,,,,
Motilal Oswal Nifty Microcap 250 Index Fund-Reg(G),41176,Motilal Oswal Mutual Fund,-2.96,-0.16,-1.56,-8.79,Nifty Microcap 250 - TRI,,,,-9.29,167,203,210,189,160,,,,Motilal Oswal Nifty Microcap 250 Index Fund-Reg(G),Equity : Index Funds,175,219,215,198,167,83,34,18,5.22,0.54,6.23,4.78,4.35,16.09,16.83,13.09,,,,,,,,
DSP Corp Bond Fund-Reg(G),37709,DSP Mutual Fund,0.51,1.59,2.99,8.02,CRISIL Corporate Bond Index,7.31,5.41,,7.35,13,15,21,1,14,17,17,,DSP Corp Bond Fund-Reg(G),Debt : Corporate Bond,21,21,21,21,21,20,18,12,7.47,0.56,1.87,2.41,8.17,7.58,5.85,7.09,,,,,,,,
SBI CRISIL IBX Gilt Index - June 2036 Fund-Reg(G),46941,SBI Mutual Fund,1.03,2.66,0.21,7.47,CRISIL IBX Gilt Index - June 2036,8.43,,,6.54,10,1,2,12,8,1,,,SBI CRISIL IBX Gilt Index - June 2036 Fund-Reg(G),Debt : Long Duration,26,26,26,26,24,8,3,2,4.95,0.12,1.9,-0.73,6.0,7.66,4.7,6.78,,,,,,,,
Nippon India ETF Nifty Midcap 150,40028,Nippon India Mutual Fund,1.6,7.42,6.72,7.83,Nifty Midcap 150 - TRI,23.44,25.13,,6.23,114,55,66,86,103,17,7,,Nippon India ETF Nifty Midcap 150,Equity : ETFs,170,214,205,191,168,122,72,33,9.0,0.95,7.36,7.03,7.92,16.94,18.01,13.8,,,,,,,,
Nippon India Nifty Smallcap 250 Index Fund-Reg(G),44504,Nippon India Mutual Fund,-3.54,0.87,0.04,-5.79,Nifty Smallcap 250 - TRI,19.18,23.35,,-6.43,164,211,206,184,147,18,3,,Nippon India Nifty Smallcap 250 Index Fund-Reg(G),Equity : Index Funds,175,219,215,198,167,83,34,18,5.22,0.54,6.23,4.78,4.35,16.09,16.83,13.09,,,,,,,,
SBI Nifty Next 50 ETF,30248,SBI Mutual Fund,-1.31,5.23,4.16,-1.41,NIFTY NEXT 50 - TRI,17.22,18.6,14.3,2.6,127,196,151,150,139,49,20,7,SBI Nifty Next 50 ETF,Equity : ETFs,170,214,205,191,168,122,72,33,9.0,0.95,7.36,7.03,7.92,16.94,18.01,13.8,,,,,,,,
Parag Parikh Dynamic Asset Allocation Fund-Reg(G),48512,PPFAS Mutual Fund,0.01,1.52,1.47,5.65,CRISIL Hybrid 50+50 - Moderate Index,,,,5.42,21,29,33,33,22,,,,Parag Parikh Dynamic Asset Allocation Fund-Reg(G),Hybrid : Dynamic Asset Allocation,33,34,34,34,33,24,19,11,5.92,0.51,4.18,4.26,6.0,11.95,11.65,10.15,,,,,,,,
Mirae Asset Low Duration Fund-Reg Savings Plan(G),4609,Mirae Asset Mutual Fund,0.52,1.54,3.06,7.34,NIFTY Low Duration Debt Index,7.07,5.57,5.98,6.73,13,18,16,13,13,14,18,18,Mirae Asset Low Duration Fund-Reg Savings Plan(G),Debt : Low Duration,20,26,25,23,20,20,20,19,6.83,0.53,1.55,3.09,7.44,7.2,5.82,6.43,,,,,,,,
ICICI Pru NASDAQ 100 Index Fund(G),45683,ICICI Prudential Mutual Fund,-0.95,9.37,24.06,29.35,Nasdaq-100,33.32,,,25.73,3,6,3,2,3,2,,,ICICI Pru NASDAQ 100 Index Fund(G),Equity : International,8,8,8,8,8,8,6,5,23.3,0.49,7.6,21.83,25.07,21.89,10.76,10.91,-2.22,7.3,19.31,22.61,29.93,15.7,,23.51
Motilal Oswal Nifty 500 Index Fund-Reg(G),43809,Motilal Oswal Mutual Fund,0.49,6.09,5.34,6.51,NIFTY 500 - TRI,14.81,17.31,,7.19,80,124,122,104,82,46,12,,Motilal Oswal Nifty 500 Index Fund-Reg(G),Equity : Index Funds,175,219,215,198,167,83,34,18,5.22,0.54,6.23,4.78,4.35,16.09,16.83,13.09,,,,,,,,
Tata India Consumer Fund-Reg(G),33728,Tata Mutual Fund,-1.45,2.57,7.68,1.53,Nifty India Consumption - TRI,18.38,18.72,,-0.92,17,15,6,3,14,2,6,,Tata India Consumer Fund-Reg(G),Equity : Thematic - Consumption,20,24,22,22,18,13,13,9,1.96,-1.38,1.53,5.2,1.74,15.46,18.14,14.07,,,,,,,,
Nippon India ETF Nifty 8-13 yr G-Sec Long Term Gilt,35459,Nippon India Mutual Fund,0.49,1.65,0.73,8.09,Nifty 8-13 yr G-Sec,8.28,5.49,,7.0,10,8,10,26,10,4,3,,Nippon India ETF Nifty 8-13 yr G-Sec Long Term Gilt,Debt : ETFs,30,33,32,32,30,13,8,2,6.58,0.51,1.65,2.37,7.34,7.52,5.44,5.9,0.27,1.9,0.72,7.71,8.23,5.74,,7.87
Bandhan Dynamic Bond Fund-Reg(G),7455,Bandhan Mutual Fund,0.48,2.82,-1.27,3.72,NIFTY Composite Debt Index,6.63,4.57,6.91,3.34,20,7,1,19,22,16,18,8,Bandhan Dynamic Bond Fund-Reg(G),Debt : Dynamic Bond,22,22,22,22,22,22,21,19,5.32,0.16,1.62,0.11,6.06,6.95,5.48,6.83,,,,,,,,
WOC Multi Cap Fund-Reg(G),48199,WhiteOak Capital Mutual Fund,1.09,6.43,9.37,8.99,Nifty500 Multicap 50:25:25 - TRI,,,,7.78,7,5,7,3,4,,,,WOC Multi Cap Fund-Reg(G),Equity : Multi Cap,42,45,45,44,41,29,21,14,4.04,0.0,4.76,5.42,4.2,16.99,18.85,14.4,,,,,,,,
UTI Focused Fund-Reg(G),45685,UTI Mutual Fund,-0.3,4.64,4.12,4.69,NIFTY 500 - TRI,14.86,,,7.18,16,35,31,35,22,26,,,UTI Focused Fund-Reg(G),Equity : Flexi Cap,48,51,50,48,48,39,29,21,4.09,0.1,4.98,5.21,4.11,16.03,18.06,14.12,,,,,,,,
DSP Focused Fund-Reg(G),8463,DSP Mutual Fund,1.55,7.47,3.73,6.7,NIFTY 500 - TRI,18.39,16.54,12.64,8.12,5,4,3,35,9,10,16,12,DSP Focused Fund-Reg(G),Equity : Multi Cap,42,45,45,44,41,29,21,14,4.04,0.0,4.76,5.42,4.2,16.99,18.85,14.4,,,,,,,,
DSP Multicap Fund-Reg(G),48040,DSP Mutual Fund,-0.67,2.06,3.39,0.58,Nifty500 Multicap 50:25:25 - TRI,,,,0.93,33,34,44,37,37,,,,DSP Multicap Fund-Reg(G),Equity : Multi Cap,42,45,45,44,41,29,21,14,4.04,0.0,4.76,5.42,4.2,16.99,18.85,14.4,,,,,,,,
Kotak Manufacture in India Fund-Reg(G),46107,Kotak Mahindra Mutual Fund,-0.14,6.09,7.47,8.35,Nifty India Manufacturing - TRI,20.19,,,6.38,33,54,32,17,12,10,,,Kotak Manufacture in India Fund-Reg(G),Equity : Thematic,88,110,107,99,80,39,23,9,3.21,-0.12,4.96,5.16,3.32,17.86,21.22,14.57,,,,,,,,
HDFC Infrastructure Fund(G),4253,HDFC Mutual Fund,-0.88,3.54,1.63,2.67,BSE India Infrastructure Index - TRI,25.65,31.21,11.46,3.27,6,8,13,13,5,2,2,18,HDFC Infrastructure Fund(G),Equity : Sectoral - Infrastructure,20,21,21,21,19,19,19,18,0.16,-1.29,3.78,2.38,-0.48,22.04,26.89,15.69,,,,,,,,
ICICI Pru Constant Maturity Gilt Fund(G),30426,ICICI Prudential Mutual Fund,0.57,1.94,0.68,8.25,CRISIL 10 Year Gilt Index,8.17,5.71,8.2,7.15,1,3,3,2,1,2,1,2,ICICI Pru Constant Maturity Gilt Fund(G),Debt : Gilt (10 Yr Constant Duration),6,6,6,6,6,5,4,4,6.67,0.56,1.82,0.51,7.59,7.92,5.35,7.85,,,,,,,,
Edelweiss Greater China Equity Off-shore Fund-Reg(G),7869,Edelweiss Mutual Fund,-2.37,8.93,27.72,41.51,MSCI Golden Dragon Index (Total Return Net),15.41,1.05,10.31,34.55,15,44,22,10,6,39,27,11,Edelweiss Greater China Equity Off-shore Fund-Reg(G),FoFs : Overseas,56,56,56,56,56,53,27,23,27.59,0.05,7.93,20.79,27.7,22.16,11.19,10.41,,,,,,,,
Mirae Asset Multi Asset Allocation Fund-Reg(G),48465,Mirae Asset Mutual Fund,2.08,7.56,8.88,15.53,NIFTY 500 - TRI,,,,16.09,13,9,18,18,9,,,,Mirae Asset Multi Asset Allocation Fund-Reg(G),Hybrid : Multi Asset Allocation,27,33,32,29,25,9,9,7,14.35,1.7,7.63,8.95,13.67,17.27,17.69,13.21,,,,,,,,
Mirae Asset NYSE FANG+ETF FoF-Reg(G),45496,Mirae Asset Mutual Fund,1.56,10.29,26.45,57.11,NYSE FANG+ TRI,65.41,,,26.8,19,10,12,12,2,1,,,Mirae Asset NYSE FANG+ETF FoF-Reg(G),FoFs : Overseas,56,56,56,56,56,53,27,23,27.59,0.05,7.93,20.79,27.7,22.16,11.19,10.41,,,,,,,,
ICICI Pru Bharat 22 FOF-(G),40232,ICICI Prudential Mutual Fund,0.71,10.9,6.24,3.04,BSE Bharat 22 Index,26.47,31.49,,8.3,34,38,13,30,52,5,1,,ICICI Pru Bharat 22 FOF-(G),FoFs : Domestic,60,87,81,72,60,50,31,23,18.18,2.64,8.7,12.84,17.0,15.61,13.73,10.63,-0.71,8.79,5.46,0.51,23.23,27.42,,5.49
NJ Flexi Cap Fund-Reg(G),48135,NJ Mutual Fund,-0.59,-0.15,1.29,-3.54,NIFTY 500 - TRI,,,,-2.55,43,41,50,46,46,,,,NJ Flexi Cap Fund-Reg(G),Equity : Flexi Cap,48,51,50,48,48,39,29,21,4.09,0.1,4.98,5.21,4.11,16.03,18.06,14.12,,,,,,,,
Kotak Infra & Eco Reform Fund(G),4228,Kotak Mahindra Mutual Fund,-1.58,3.23,1.21,-1.96,Nifty Infrastructure - TRI,20.39,27.75,16.01,-3.3,16,13,16,15,13,14,9,8,Kotak Infra & Eco Reform Fund(G),Equity : Sectoral - Infrastructure,20,21,21,21,19,19,19,18,0.16,-1.29,3.78,2.38,-0.48,22.04,26.89,15.69,,,,,,,,
Edelweiss Multi Asset Allocation Fund-Reg(G),47994,Edelweiss Mutual Fund,0.48,1.62,2.52,7.49,CRISIL Short Term Bond Index,,,,6.74,25,31,32,29,25,,,,Edelweiss Multi Asset Allocation Fund-Reg(G),Hybrid : Multi Asset Allocation,27,33,32,29,25,9,9,7,14.35,1.7,7.63,8.95,13.67,17.27,17.69,13.21,,,,,,,,
Franklin India Dividend Yield Fund(G),3367,Franklin Templeton Mutual Fund,-0.52,4.07,1.16,-0.6,NIFTY 500 - TRI,16.76,21.75,15.17,0.89,10,9,10,10,10,7,2,2,Franklin India Dividend Yield Fund(G),Equity : Thematic - Dividend Yield,10,10,10,10,10,8,6,5,4.89,0.34,5.74,4.68,3.34,18.7,21.3,14.72,,,,,,,,
Union Flexi Cap Fund-Reg(G),14559,Union Mutual Fund,-0.89,4.32,4.38,4.8,BSE 500 - TRI,14.65,17.57,13.27,3.48,28,44,34,32,21,27,13,16,Union Flexi Cap Fund-Reg(G),Equity : Flexi Cap,48,51,50,48,48,39,29,21,4.09,0.1,4.98,5.21,4.11,16.03,18.06,14.12,,,,,,,,
HSBC Multi Asset Allocation Fund-Reg(G),48468,HSBC Mutual Fund,1.17,7.82,13.14,9.26,BSE 200 - TRI,,,,6.96,24,29,16,2,21,,,,HSBC Multi Asset Allocation Fund-Reg(G),Hybrid : Multi Asset Allocation,27,33,32,29,25,9,9,7,14.35,1.7,7.63,8.95,13.67,17.27,17.69,13.21,,,,,,,,
HSBC Arbitrage Fund-Reg(G),29550,HSBC Mutual Fund,0.51,1.4,2.85,6.32,Nifty 50 Arbitrage,6.92,5.58,5.71,5.65,19,16,4,14,14,17,16,9,HSBC Arbitrage Fund-Reg(G),Hybrid : Arbitrage,30,33,32,31,28,24,24,14,5.64,0.51,1.35,2.8,6.31,6.89,5.53,5.69,0.54,1.77,3.46,7.65,7.66,6.19,,7.51
Bandhan Multi Asset Allocation Fund-Reg(G),48252,Bandhan Mutual Fund,1.33,7.41,10.53,14.5,NIFTY 500 - TRI,,,,15.75,14,25,19,10,12,,,,Bandhan Multi Asset Allocation Fund-Reg(G),Hybrid : Multi Asset Allocation,27,33,32,29,25,9,9,7,14.35,1.7,7.63,8.95,13.67,17.27,17.69,13.21,,,,,,,,
DSP Nifty 50 Equal Weight Index Fund-Reg(G),38179,DSP Mutual Fund,0.34,6.59,7.42,12.11,NIFTY50 Equal Weight - TRI,16.51,20.03,,13.39,19,139,109,29,18,36,4,,DSP Nifty 50 Equal Weight Index Fund-Reg(G),Equity : Index Funds,175,219,215,198,167,83,34,18,5.22,0.54,6.23,4.78,4.35,16.09,16.83,13.09,,,,,,,,
Aditya Birla SL Quant Fund-Reg(G),48491,Aditya Birla Sun Life Mutual Fund,1.52,8.1,9.4,6.26,NIFTY 200 - TRI,,,,5.04,39,16,10,8,26,,,,Aditya Birla SL Quant Fund-Reg(G),Equity : Thematic,88,110,107,99,80,39,23,9,3.21,-0.12,4.96,5.16,3.32,17.86,21.22,14.57,,,,,,,,
SBI Long Duration Fund-Reg(G),46864,SBI Mutual Fund,0.18,1.97,-1.94,3.49,CRISIL Long Duration Debt Index,,,,2.71,20,16,12,20,19,,,,SBI Long Duration Fund-Reg(G),Debt : Long Duration,26,26,26,26,24,8,3,2,4.95,0.12,1.9,-0.73,6.0,7.66,4.7,6.78,,,,,,,,
HSBC Infrastructure Fund-Reg(G),594,HSBC Mutual Fund,-0.97,3.48,-0.54,-5.25,Nifty Infrastructure - TRI,22.35,26.38,15.73,-3.58,17,10,14,17,16,10,10,11,HSBC Infrastructure Fund-Reg(G),Equity : Sectoral - Infrastructure,20,21,21,21,19,19,19,18,0.16,-1.29,3.78,2.38,-0.48,22.04,26.89,15.69,,,,,,,,
