Union Income Plus Arbitrage Active FOF-Reg(G),49932,Union Mutual Fund,0.37,0.26,,,CRISIL Composite Bond Index,,,,,,67,63,,,,,,Union Income Plus Arbitrage Active FOF-Reg(G),FoFs : Domestic,60,80,74,61,59,47,29,23,10.54,3.51,4.02,13.87,8.94,14.44,14.59,10.5,,,,,,,,
Bank of India Money Market Fund-Reg(G),49468,Bank of India Mutual Fund,0.41,1.38,3.88,,CRISIL Money Market Index,,,,,,21,21,18,,,,,Bank of India Money Market Fund-Reg(G),Debt : Money Market,22,23,23,23,22,21,17,13,5.33,0.43,1.45,3.97,7.58,7.2,5.84,6.56,,,,,,,,
Edelweiss MSCI India Domestic & World Healthcare 45 Index Fund-Reg(G),45117,Edelweiss Mutual Fund,3.18,2.77,7.77,-1.64,MSCI India Domestic & World Healthcare 45 Index,18.5,,,0.72,113,72,24,181,51,15,,,Edelweiss MSCI India Domestic & World Healthcare 45 Index Fund-Reg(G),Equity : Index Funds,175,212,201,189,140,78,32,18,2.07,2.9,0.13,15.23,-4.21,15.11,18.82,12.86,,,,,,,,
Groww Multicap Fund-Reg(G),49400,Groww Mutual Fund,3.58,4.67,23.74,,Nifty500 Multicap 50:25:25 - TRI,,,,5.22,5,10,3,1,,,,,Groww Multicap Fund-Reg(G),Equity : Multi Cap,42,45,44,43,40,28,21,14,2.14,3.01,2.04,16.03,-1.53,16.5,21.27,14.62,,,,,,,,
Samco Special Opportunities Fund-Reg(G),48744,Samco Mutual Fund,2.08,3.39,22.27,-13.08,NIFTY 500 - TRI,,,,-7.24,83,82,34,11,70,,,,Samco Special Opportunities Fund-Reg(G),Equity : Thematic,88,105,100,96,75,38,20,9,1.43,3.27,2.11,15.95,-3.54,17.48,23.49,14.56,,,,,,,,
SBI FMP-74-1243D-Reg(G),47381,SBI Mutual Fund,0.43,1.28,3.68,7.35,CRISIL Medium Duration Debt Index,,,,5.3,41,26,32,61,43,,,,SBI FMP-74-1243D-Reg(G),Debt : FTP/FMP,81,82,82,81,81,44,10,4,5.31,0.4,1.2,3.85,7.48,7.27,6.17,6.14,,,,,,,,
HDFC FMP-Sr 47-2638D-Feb 2023-Reg(G),47642,HDFC Mutual Fund,0.53,0.17,4.47,8.37,NIFTY Long Duration Debt Index,,,,6.17,1,3,81,4,3,,,,HDFC FMP-Sr 47-2638D-Feb 2023-Reg(G),Debt : FTP/FMP,81,82,82,81,81,44,10,4,5.31,0.4,1.2,3.85,7.48,7.27,6.17,6.14,,,,,,,,
Nippon India ETF Nifty Infrastructure BeES,12859,Nippon India Mutual Fund,1.2,0.6,13.7,-3.24,Nifty Infrastructure - TRI,19.54,23.04,12.44,7.27,73,169,114,106,107,23,11,28,Nippon India ETF Nifty Infrastructure BeES,Equity : ETFs,170,203,194,180,162,114,68,32,4.39,3.14,1.21,15.06,-0.96,16.22,20.4,13.54,,,,,,,,
Tata Nifty G-Sec Dec 2029 Index Fund-Reg(G),47405,Tata Mutual Fund,0.46,0.79,4.56,8.28,Nifty G-Sec Dec 2029 Index,,,,6.29,8,10,34,11,5,,,,Tata Nifty G-Sec Dec 2029 Index Fund-Reg(G),Debt : Medium to Long Duration,59,60,60,60,52,26,11,11,5.62,0.27,0.76,4.08,7.55,7.06,5.48,6.31,,,,,,,,
HDFC Retirement Savings Fund-Hybrid-Debt Plan-Reg(G),24807,HDFC Mutual Fund,0.46,0.24,5.04,3.1,NIFTY 50 Hybrid Composite Debt 15:85 Index,8.48,8.68,,3.47,18,40,30,39,12,30,27,,HDFC Retirement Savings Fund-Hybrid-Debt Plan-Reg(G),Hybrid : Solution Oriented,43,43,43,43,42,37,32,15,3.24,1.94,0.99,11.11,0.74,12.03,13.95,10.76,,,,,,,,
Mahindra Manulife Overnight Fund-Reg(G),42560,Mahindra Manulife Mutual Fund,0.45,1.31,2.8,6.06,CRISIL Liquid Overnight Index,6.35,5.18,,4.09,17,19,24,21,22,19,11,,Mahindra Manulife Overnight Fund-Reg(G),Debt : Overnight,34,35,34,34,34,29,27,3,4.07,0.44,1.32,2.79,6.05,6.36,5.17,5.49,0.46,1.35,2.86,6.18,,,,5.91
Nippon India Nifty Bank Index Fund-Reg(G),48148,Nippon India Mutual Fund,-0.47,-1.85,14.41,5.71,NIFTY BANK - TRI,,,,7.91,19,205,165,119,10,,,,Nippon India Nifty Bank Index Fund-Reg(G),Equity : Index Funds,175,212,201,189,140,78,32,18,2.07,2.9,0.13,15.23,-4.21,15.11,18.82,12.86,,,,,,,,
HSBC Conservative Hybrid Fund(G),1458,HSBC Mutual Fund,0.96,1.59,8.32,5.36,NIFTY 50 Hybrid Composite Debt 15:85 Index,10.03,9.25,7.87,3.14,15,3,3,1,6,3,8,8,HSBC Conservative Hybrid Fund(G),Hybrid : Debt Oriented (Conservative),18,18,18,18,18,18,17,17,4.32,0.76,0.65,5.57,4.64,8.67,9.28,7.8,,,,,,,,
Edelweiss Nifty Smallcap 250 Index Fund-Reg(G),47167,Edelweiss Mutual Fund,3.16,-0.64,20.57,-7.14,Nifty Smallcap 250 - TRI,,,,-3.66,143,79,140,11,97,,,,Edelweiss Nifty Smallcap 250 Index Fund-Reg(G),Equity : Index Funds,175,212,201,189,140,78,32,18,2.07,2.9,0.13,15.23,-4.21,15.11,18.82,12.86,,,,,,,,
Aditya Birla SL CRISIL IBX SDL Jun 2032 Index Fund-Reg(G),47592,Aditya Birla Sun Life Mutual Fund,-1.44,-0.85,3.43,6.91,CRISIL IBX SDL Index - June 2032,,,,4.69,9,23,13,9,9,,,,Aditya Birla SL CRISIL IBX SDL Jun 2032 Index Fund-Reg(G),Debt : Long Duration,26,26,26,26,24,5,3,2,3.83,-0.1,-0.72,2.57,5.82,7.05,5.02,6.85,,,,,,,,
Tata Nifty MidSmall Healthcare Index Fund-Reg(G),48764,Tata Mutual Fund,1.98,5.99,18.11,4.86,Nifty MidSmall Healthcare - TRI,,,,1.81,101,181,3,41,12,,,,Tata Nifty MidSmall Healthcare Index Fund-Reg(G),Equity : Index Funds,175,212,201,189,140,78,32,18,2.07,2.9,0.13,15.23,-4.21,15.11,18.82,12.86,,,,,,,,
Edelweiss Nifty 100 Quality 30 Index Fund-Reg(G),45961,Edelweiss Mutual Fund,5.53,3.27,14.72,-7.04,NIFTY100 Quality 30 - TRI,13.81,,,4.61,73,9,21,100,93,44,,,Edelweiss Nifty 100 Quality 30 Index Fund-Reg(G),Equity : Index Funds,175,212,201,189,140,78,32,18,2.07,2.9,0.13,15.23,-4.21,15.11,18.82,12.86,,,,,,,,
Quantum Small Cap Fund-Reg(G),48248,Quantum Mutual Fund,1.3,-0.32,18.58,-1.73,BSE 250 Small Cap - TRI,,,,3.05,2,31,28,18,7,,,,Quantum Small Cap Fund-Reg(G),Equity : Small Cap,29,31,30,30,28,23,21,13,-2.48,3.04,1.33,19.4,-4.67,18.98,28.82,17.66,,,,,,,,
Edelweiss Nifty Next 50 Index Fund-Reg(G),47171,Edelweiss Mutual Fund,3.02,1.36,15.13,-9.71,NIFTY NEXT 50 - TRI,,,,0.33,127,94,47,81,121,,,,Edelweiss Nifty Next 50 Index Fund-Reg(G),Equity : Index Funds,175,212,201,189,140,78,32,18,2.07,2.9,0.13,15.23,-4.21,15.11,18.82,12.86,,,,,,,,
Aditya Birla SL Long Duration Fund-Reg(G),46711,Aditya Birla Sun Life Mutual Fund,-0.12,-1.07,2.3,5.0,NIFTY Long Duration Debt Index,7.25,,,3.24,17,18,17,16,16,3,,,Aditya Birla SL Long Duration Fund-Reg(G),Debt : Long Duration,26,26,26,26,24,5,3,2,3.83,-0.1,-0.72,2.57,5.82,7.05,5.02,6.85,,,,,,,,
DSP Nifty 50 ETF,36811,DSP Mutual Fund,2.62,1.43,12.66,0.1,NIFTY 50 - TRI,13.07,,,7.32,67,133,74,133,51,74,,,DSP Nifty 50 ETF,Equity : ETFs,170,203,194,180,162,114,68,32,4.39,3.14,1.21,15.06,-0.96,16.22,20.4,13.54,,,,,,,,
LIC MF Short Duration Fund-Reg(G),34304,LIC Mutual Fund,0.23,0.82,4.17,7.53,CRISIL Short Duration Debt Index,6.71,5.09,,5.44,24,31,30,27,22,20,19,,LIC MF Short Duration Fund-Reg(G),Debt : Short Duration,29,34,33,33,25,23,20,18,5.63,0.36,1.15,4.35,7.9,7.22,6.05,6.72,,,,,,,,
ICICI Pru Nifty Metal ETF,33835,ICICI Prudential Mutual Fund,7.16,6.13,11.93,6.87,NIFTY METAL - TRI,,,,14.5,13,10,21,138,10,,,,ICICI Pru Nifty Metal ETF,Equity : ETFs,170,203,194,180,162,114,68,32,4.39,3.14,1.21,15.06,-0.96,16.22,20.4,13.54,,,,,,,,
Bandhan CRISIL IBX 90:10 SDL Plus Gilt - Sep 2027 Index Fund-Reg(G),46212,Bandhan Mutual Fund,0.19,0.87,4.21,7.93,CRISIL IBX 90:10 SDL Plus Gilt Index - September 2027,,,,5.91,8,35,9,8,6,,,,Bandhan CRISIL IBX 90:10 SDL Plus Gilt - Sep 2027 Index Fund-Reg(G),Debt : Gilt,36,38,38,37,36,24,21,21,4.06,0.4,-0.15,2.66,5.71,6.68,5.24,7.02,,,,,,,,
Invesco India Credit Risk Fund(G),21522,Invesco Mutual Fund,0.5,0.96,3.96,9.37,NIFTY Credit Risk Bond Index,9.15,6.56,5.83,7.39,4,9,13,12,4,4,12,11,Invesco India Credit Risk Fund(G),Debt : Credit Risk,15,15,15,15,15,15,15,13,7.92,0.54,1.34,5.27,10.14,8.33,8.93,6.48,,,,,,,,
Canara Rob Gilt Fund-Reg(G),538,Canara Robeco Mutual Fund,0.51,-0.41,1.9,4.25,CRISIL Dynamic Gilt Index,6.49,4.99,6.89,3.04,25,8,20,25,26,14,14,12,Canara Rob Gilt Fund-Reg(G),Debt : Gilt,36,38,38,37,36,24,21,21,4.06,0.4,-0.15,2.66,5.71,6.68,5.24,7.02,,,,,,,,
Edelweiss Nifty Alpha Low Volatility 30 Index Fund-Reg(G),48808,Edelweiss Mutual Fund,3.3,0.45,11.31,-12.25,NIFTY Alpha Low-Volatility 30 - TRI,,,,-1.75,132,61,114,170,125,,,,Edelweiss Nifty Alpha Low Volatility 30 Index Fund-Reg(G),Equity : Index Funds,175,212,201,189,140,78,32,18,2.07,2.9,0.13,15.23,-4.21,15.11,18.82,12.86,,,,,,,,
ICICI Pru Nifty Auto ETF,46229,ICICI Prudential Mutual Fund,12.65,15.44,30.22,4.93,NIFTY AUTO - TRI,27.28,,,18.5,7,2,5,6,29,7,,,ICICI Pru Nifty Auto ETF,Equity : ETFs,170,203,194,180,162,114,68,32,4.39,3.14,1.21,15.06,-0.96,16.22,20.4,13.54,,,,,,,,
Motilal Oswal Nifty 500 ETF,48267,Motilal Oswal Mutual Fund,2.82,1.04,15.11,-2.17,NIFTY 500 - TRI,,,,4.43,100,110,95,70,96,,,,Motilal Oswal Nifty 500 ETF,Equity : ETFs,170,203,194,180,162,114,68,32,4.39,3.14,1.21,15.06,-0.96,16.22,20.4,13.54,,,,,,,,
Edelweiss CRISIL IBX 50:50 Gilt Plus SDL Sep 2028 Index Fund-Reg(G),47075,Edelweiss Mutual Fund,0.1,0.63,4.19,7.98,CRISIL IBX 50:50 Gilt Plus SDL Index - Sep 2028,,,,5.95,18,50,42,29,16,,,,Edelweiss CRISIL IBX 50:50 Gilt Plus SDL Sep 2028 Index Fund-Reg(G),Debt : Medium to Long Duration,59,60,60,60,52,26,11,11,5.62,0.27,0.76,4.08,7.55,7.06,5.48,6.31,,,,,,,,
Nippon India Retirement Fund-Income Generation(G),17166,Nippon India Mutual Fund,0.51,-0.3,4.47,2.97,CRISIL Hybrid 85+15 - Conservative Index,8.26,7.3,7.18,2.87,30,39,37,40,14,32,29,15,Nippon India Retirement Fund-Income Generation(G),Hybrid : Solution Oriented,43,43,43,43,42,37,32,15,3.24,1.94,0.99,11.11,0.74,12.03,13.95,10.76,,,,,,,,
ICICI Pru Nifty Auto Index Fund-Reg(G),45995,ICICI Prudential Mutual Fund,12.58,15.21,29.71,4.17,NIFTY AUTO - TRI,,,,17.86,4,1,2,5,4,,,,ICICI Pru Nifty Auto Index Fund-Reg(G),Equity : Sectoral - Auto,10,10,10,10,8,1,1,1,16.31,10.47,14.04,29.68,3.17,22.55,26.82,13.31,,,,,,,,
Kotak Long Duration Fund-Reg(G),48538,Kotak Mahindra Mutual Fund,0.2,-1.74,0.76,3.06,NIFTY Long Duration Debt Index,,,,1.87,23,15,25,24,20,,,,Kotak Long Duration Fund-Reg(G),Debt : Long Duration,26,26,26,26,24,5,3,2,3.83,-0.1,-0.72,2.57,5.82,7.05,5.02,6.85,,,,,,,,
Union Equity Savings Fund-Reg(G),40627,Union Mutual Fund,0.84,1.14,5.63,2.86,Crisil Equity Savings Index,7.99,8.23,,3.24,37,48,30,46,24,49,48,,Union Equity Savings Fund-Reg(G),Hybrid : Equity Oriented,53,55,54,54,53,52,49,33,3.83,1.68,1.45,9.83,1.87,11.84,14.33,10.42,,,,,,,,
Franklin India G-Sec Fund(G),3373,Franklin Templeton Mutual Fund,0.54,-0.53,1.64,5.13,Nifty All Duration G-Sec Index,5.66,4.51,5.78,3.23,23,6,24,27,19,24,20,21,Franklin India G-Sec Fund(G),Debt : Gilt,36,38,38,37,36,24,21,21,4.06,0.4,-0.15,2.66,5.71,6.68,5.24,7.02,,,,,,,,
Samco Large & Mid Cap Fund-Reg(G),49779,Samco Mutual Fund,-1.67,,,,NIFTY LargeMidcap 250 - TRI,,,,,,33,,,,,,,Samco Large & Mid Cap Fund-Reg(G),Equity : Large & Mid Cap,31,33,31,31,30,26,26,19,2.21,2.82,1.47,16.33,-1.96,17.24,22.56,15.03,,,,,,,,
Nippon India Nifty IT Index Fund-Reg(G),48568,Nippon India Mutual Fund,4.06,-5.98,0.13,-15.18,NIFTY IT - TRI,,,,-15.74,170,35,191,186,130,,,,Nippon India Nifty IT Index Fund-Reg(G),Equity : Index Funds,175,212,201,189,140,78,32,18,2.07,2.9,0.13,15.23,-4.21,15.11,18.82,12.86,,,,,,,,
Samco Large Cap Fund-Reg(G),49506,Samco Mutual Fund,-0.93,-2.24,,,NIFTY 100 - TRI,,,,,,39,39,,,,,,Samco Large Cap Fund-Reg(G),Equity : Large Cap,38,39,39,38,38,35,31,28,3.96,2.6,1.27,13.54,-2.51,14.0,18.44,12.92,,,,,,,,
Groww Nifty EV & New Age Automotive ETF FOF-Reg(G),48990,Groww Mutual Fund,10.15,7.19,21.3,-6.85,Nifty EV and New Age Automotive - TRI,,,,5.74,33,11,13,11,54,,,,Groww Nifty EV & New Age Automotive ETF FOF-Reg(G),FoFs : Domestic,60,80,74,61,59,47,29,23,10.54,3.51,4.02,13.87,8.94,14.44,14.59,10.5,,,,,,,,
Union Gold ETF,49576,Union Mutual Fund,9.76,12.5,26.33,,Gold-India,,,,,,29,28,27,,,,,Union Gold ETF,Gold : ETFs,31,37,35,33,29,16,11,11,44.24,10.93,15.85,27.59,51.06,28.77,15.16,13.86,,,,,,,,
Bajaj Finserv Banking and PSU Fund-Reg(G),48214,Bajaj Finserv Mutual Fund,0.26,0.73,4.51,7.91,NIFTY Banking and PSU Debt Index,,,,5.73,8,20,18,5,9,,,,Bajaj Finserv Banking and PSU Fund-Reg(G),Debt : Banking & PSU,26,26,26,26,26,22,17,16,5.54,0.32,0.93,4.29,7.75,7.11,5.91,7.12,,,,,,,,
DSP World Mining Overseas Equity Omni FoF-Reg(G),8359,DSP Mutual Fund,11.01,22.9,32.57,34.53,MSCI ACWI Metals & Mining 30% Buffer 10/40 (1994) Net TRI,13.69,14.82,14.79,40.94,4,2,3,5,11,38,8,3,DSP World Mining Overseas Equity Omni FoF-Reg(G),FoFs : Overseas,57,57,57,57,57,53,27,23,21.88,4.79,12.69,20.82,28.62,19.43,11.99,9.93,,,,,,,,
Mirae Asset CRISIL-IBX Financial Services 9-12 Months Debt Index Fund-Reg(G),49980,Mirae Asset Mutual Fund,0.43,,,,CRISIL-IBX Financial Services 9-12 Months Debt Index,,,,,,6,,,,,,,Mirae Asset CRISIL-IBX Financial Services 9-12 Months Debt Index Fund-Reg(G),Debt : Low Duration,20,25,23,21,20,20,20,19,5.36,0.4,1.39,4.06,7.6,7.06,5.81,6.47,,,,,,,,
ICICI Pru Nifty50 Equal Weight Index Fund-Reg(G),46902,ICICI Prudential Mutual Fund,4.19,3.29,15.2,-1.56,NIFTY50 Equal Weight - TRI,,,,9.92,7,29,18,76,48,,,,ICICI Pru Nifty50 Equal Weight Index Fund-Reg(G),Equity : Index Funds,175,212,201,189,140,78,32,18,2.07,2.9,0.13,15.23,-4.21,15.11,18.82,12.86,,,,,,,,
Edelweiss Europe Dynamic Equity Off-shore Fund-Reg(G),24618,Edelweiss Mutual Fund,2.33,4.45,16.86,28.82,MSCI Europe Index (Total Return Net),22.56,16.51,9.08,36.47,6,45,54,37,24,17,5,13,Edelweiss Europe Dynamic Equity Off-shore Fund-Reg(G),FoFs : Overseas,57,57,57,57,57,53,27,23,21.88,4.79,12.69,20.82,28.62,19.43,11.99,9.93,,,,,,,,
UTI Gilt Fund with 10 year Constant Duration-Reg(G),40967,UTI Mutual Fund,0.64,0.13,3.84,7.39,CRISIL 10 Year Gilt Index,7.5,,,5.42,6,4,5,5,6,5,,,UTI Gilt Fund with 10 year Constant Duration-Reg(G),Debt : Gilt (10 Yr Constant Duration),6,6,6,6,6,5,4,4,5.75,0.66,0.17,4.05,7.79,7.73,5.68,7.95,,,,,,,,
SBI FMP-47-1434D-Reg(G),45660,SBI Mutual Fund,0.47,1.57,3.23,6.91,CRISIL Medium Duration Debt Index,7.13,,,3.12,80,11,5,73,74,28,,,SBI FMP-47-1434D-Reg(G),Debt : FTP/FMP,81,82,82,81,81,44,10,4,5.31,0.4,1.2,3.85,7.48,7.27,6.17,6.14,,,,,,,,
Nippon India Nifty G-Sec Oct 2028 Maturity Index Fund-Reg(G),47629,Nippon India Mutual Fund,0.47,1.08,4.6,8.39,Nifty G-Sec Oct 2028 Index,,,,6.36,6,9,19,10,3,,,,Nippon India Nifty G-Sec Oct 2028 Maturity Index Fund-Reg(G),Debt : Medium to Long Duration,59,60,60,60,52,26,11,11,5.62,0.27,0.76,4.08,7.55,7.06,5.48,6.31,,,,,,,,
Edelweiss CRISIL IBX 50:50 Gilt Plus SDL Short Duration Index Fund-Reg(G),47430,Edelweiss Mutual Fund,0.33,0.72,3.96,7.53,CRISIL IBX 50:50 Gilt Plus SDL Short Duration Index,,,,5.55,23,23,33,29,21,,,,Edelweiss CRISIL IBX 50:50 Gilt Plus SDL Short Duration Index Fund-Reg(G),Debt : Short Duration,29,34,33,33,25,23,20,18,5.63,0.36,1.15,4.35,7.9,7.22,6.05,6.72,,,,,,,,
ICICI Pru Nifty 100 ETF,22404,ICICI Prudential Mutual Fund,2.67,1.33,12.96,-2.01,NIFTY 100 - TRI,12.65,18.06,13.32,5.84,91,118,82,114,93,84,51,22,ICICI Pru Nifty 100 ETF,Equity : ETFs,170,203,194,180,162,114,68,32,4.39,3.14,1.21,15.06,-0.96,16.22,20.4,13.54,,,,,,,,
ICICI Pru Nifty Healthcare ETF,45383,ICICI Prudential Mutual Fund,2.52,3.32,12.85,0.62,Nifty Healthcare Index - TRI,22.95,,,-0.9,135,140,36,116,37,14,,,ICICI Pru Nifty Healthcare ETF,Equity : ETFs,170,203,194,180,162,114,68,32,4.39,3.14,1.21,15.06,-0.96,16.22,20.4,13.54,,,,,,,,
Bandhan Long Duration Fund-Reg(G),48582,Bandhan Mutual Fund,0.41,-1.04,0.81,2.92,NIFTY Long Duration Debt Index,,,,1.89,22,9,15,23,22,,,,Bandhan Long Duration Fund-Reg(G),Debt : Long Duration,26,26,26,26,24,5,3,2,3.83,-0.1,-0.72,2.57,5.82,7.05,5.02,6.85,,,,,,,,
Union Gilt Fund-Reg(G),46221,Union Mutual Fund,0.44,-1.02,1.16,3.51,CRISIL Dynamic Gilt Index,6.2,,,2.21,31,18,34,32,30,18,,,Union Gilt Fund-Reg(G),Debt : Gilt,36,38,38,37,36,24,21,21,4.06,0.4,-0.15,2.66,5.71,6.68,5.24,7.02,,,,,,,,
Motilal Oswal Active Momentum Fund-Reg(G),49517,Motilal Oswal Mutual Fund,5.24,5.79,,,NIFTY 500 - TRI,,,,,,11,11,,,,,,Motilal Oswal Active Momentum Fund-Reg(G),Equity : Thematic,88,105,100,96,75,38,20,9,1.43,3.27,2.11,15.95,-3.54,17.48,23.49,14.56,,,,,,,,
SBI FMP-52-1848D-Reg(G),45915,SBI Mutual Fund,0.48,1.34,4.07,7.73,CRISIL Medium to Long Term Debt Index,7.33,,,5.66,28,10,12,29,29,20,,,SBI FMP-52-1848D-Reg(G),Debt : FTP/FMP,81,82,82,81,81,44,10,4,5.31,0.4,1.2,3.85,7.48,7.27,6.17,6.14,,,,,,,,
Unifi Flexi Cap Fund-Reg(G),49807,Unifi Mutual Fund,0.63,0.01,,,NIFTY 500 - TRI,,,,,,48,44,,,,,,Unifi Flexi Cap Fund-Reg(G),Equity : Flexi Cap,48,50,49,48,48,39,27,21,1.89,2.96,1.77,15.22,-2.72,15.45,20.21,14.26,,,,,,,,
Motilal Oswal Quant Fund-Reg(G),48806,Motilal Oswal Mutual Fund,1.58,-0.51,16.95,-11.63,NIFTY 200 - TRI,,,,-5.43,79,91,80,35,67,,,,Motilal Oswal Quant Fund-Reg(G),Equity : Thematic,88,105,100,96,75,38,20,9,1.43,3.27,2.11,15.95,-3.54,17.48,23.49,14.56,,,,,,,,
Kotak Nifty Smallcap 50 Index Fund-Reg(G),46631,Kotak Mahindra Mutual Fund,2.05,-2.74,18.84,-7.17,Nifty Smallcap 50 - TRI,,,,-3.38,135,176,175,35,98,,,,Kotak Nifty Smallcap 50 Index Fund-Reg(G),Equity : Index Funds,175,212,201,189,140,78,32,18,2.07,2.9,0.13,15.23,-4.21,15.11,18.82,12.86,,,,,,,,
Bank of India Balanced Advantage Fund-Reg(G),21917,Bank of India Mutual Fund,1.85,0.79,9.32,-1.6,NIFTY 50 Hybrid Composite Debt 50:50 Index,9.88,11.15,7.17,4.26,13,11,23,20,29,20,12,11,Bank of India Balanced Advantage Fund-Reg(G),Hybrid : Dynamic Asset Allocation,33,34,34,33,33,24,19,11,3.38,1.65,1.23,9.24,0.83,11.46,12.52,10.06,,,,,,,,
Axis Nifty Bank Index Fund-Reg(G),48680,Axis Mutual Fund,-0.49,-1.9,14.35,5.74,NIFTY BANK - TRI,,,,7.9,22,211,168,120,9,,,,Axis Nifty Bank Index Fund-Reg(G),Equity : Index Funds,175,212,201,189,140,78,32,18,2.07,2.9,0.13,15.23,-4.21,15.11,18.82,12.86,,,,,,,,
Tata Floating Rate Fund-Reg(G),45375,Tata Mutual Fund,0.22,0.84,4.21,7.76,CRISIL Short Duration Debt Index,7.17,,,5.29,11,10,11,8,8,11,,,Tata Floating Rate Fund-Reg(G),Debt : Floater,12,12,12,12,12,12,7,5,5.66,0.34,1.12,4.28,7.93,7.58,6.28,7.08,,,,,,,,
Groww Short Duration Fund-Reg(G),23158,Groww Mutual Fund,0.33,0.97,4.56,7.61,CRISIL Short Duration Debt Index,6.42,4.95,5.91,5.76,14,22,25,5,19,23,20,16,Groww Short Duration Fund-Reg(G),Debt : Short Duration,29,34,33,33,25,23,20,18,5.63,0.36,1.15,4.35,7.9,7.22,6.05,6.72,,,,,,,,
ICICI Pru Quant Fund(G),42805,ICICI Prudential Mutual Fund,3.05,1.5,11.82,-0.95,BSE 200 - TRI,17.11,,,6.39,17,57,57,80,28,20,,,ICICI Pru Quant Fund(G),Equity : Thematic,88,105,100,96,75,38,20,9,1.43,3.27,2.11,15.95,-3.54,17.48,23.49,14.56,,,,,,,,
WOC Equity Savings Fund-Reg(G),49513,WhiteOak Capital Mutual Fund,1.07,3.93,9.19,,NIFTY 50 Equity Savings Index - TRI,,,,,,42,3,32,,,,,WOC Equity Savings Fund-Reg(G),Hybrid : Equity Oriented,53,55,54,54,53,52,49,33,3.83,1.68,1.45,9.83,1.87,11.84,14.33,10.42,,,,,,,,
Edelweiss Emerging Markets Opp Eq. Offshore Fund-Reg(G),20281,Edelweiss Mutual Fund,7.21,14.72,21.73,29.17,MSCI Emerging Market Index,13.95,5.99,8.08,27.98,15,9,18,24,23,36,24,17,Edelweiss Emerging Markets Opp Eq. Offshore Fund-Reg(G),FoFs : Overseas,57,57,57,57,57,53,27,23,21.88,4.79,12.69,20.82,28.62,19.43,11.99,9.93,,,,,,,,
HSBC Brazil Fund(G),8587,HSBC Mutual Fund,5.82,11.32,26.45,16.26,MSCI Brazil 10/40 Index,5.53,4.79,5.26,40.93,5,17,36,10,42,51,25,22,HSBC Brazil Fund(G),FoFs : Overseas,57,57,57,57,57,53,27,23,21.88,4.79,12.69,20.82,28.62,19.43,11.99,9.93,,,,,,,,
ICICI Pru FMP-88-1226D-F(G),47232,ICICI Prudential Mutual Fund,0.4,1.22,3.77,7.28,CRISIL Medium Duration Debt Index,,,,5.21,53,53,59,45,55,,,,ICICI Pru FMP-88-1226D-F(G),Debt : FTP/FMP,81,82,82,81,81,44,10,4,5.31,0.4,1.2,3.85,7.48,7.27,6.17,6.14,,,,,,,,
DSP Gold ETF FoF-Reg(G),48322,DSP Mutual Fund,9.88,11.93,25.88,49.73,Gold-London AM (INR),,,,41.65,13,12,12,13,13,,,,DSP Gold ETF FoF-Reg(G),Gold : MFs,17,18,18,18,16,10,10,10,42.81,10.44,13.56,25.84,50.09,27.49,14.83,13.58,,,,,,,,
Aditya Birla SL Nifty Next 50 ETF,38262,Aditya Birla Sun Life Mutual Fund,3.09,1.44,15.65,-8.82,NIFTY NEXT 50 - TRI,15.87,20.9,,0.96,131,93,69,60,127,50,17,,Aditya Birla SL Nifty Next 50 ETF,Equity : ETFs,170,203,194,180,162,114,68,32,4.39,3.14,1.21,15.06,-0.96,16.22,20.4,13.54,,,,,,,,
HSBC Nifty Next 50 Index Fund-Reg(G),33548,HSBC Mutual Fund,3.04,1.31,15.1,-9.75,NIFTY NEXT 50 - TRI,14.8,19.77,,0.36,123,89,62,82,122,39,8,,HSBC Nifty Next 50 Index Fund-Reg(G),Equity : Index Funds,175,212,201,189,140,78,32,18,2.07,2.9,0.13,15.23,-4.21,15.11,18.82,12.86,,,,,,,,
SBI FMP-46-1850D-Reg(G),45620,SBI Mutual Fund,0.44,1.26,3.86,7.41,CRISIL Medium to Long Term Debt Index,7.09,,,5.41,36,20,36,35,39,30,,,SBI FMP-46-1850D-Reg(G),Debt : FTP/FMP,81,82,82,81,81,44,10,4,5.31,0.4,1.2,3.85,7.48,7.27,6.17,6.14,,,,,,,,
TRUSTMF Banking & PSU Fund-Reg(G),45242,Trust Mutual Fund,0.35,1.03,4.3,7.71,CRISIL Banking and PSU Debt Index,6.94,,,5.6,13,10,8,16,16,20,,,TRUSTMF Banking & PSU Fund-Reg(G),Debt : Banking & PSU,26,26,26,26,26,22,17,16,5.54,0.32,0.93,4.29,7.75,7.11,5.91,7.12,0.35,0.89,4.22,7.65,,,,7.72
Bandhan US Treasury Bond 0-1 year specific Debt Passive FOF-Reg(G),47724,Bandhan Mutual Fund,1.11,4.3,3.26,9.5,ICE 0-1 Year US Treasury Securities Index,,,,6.22,55,55,55,56,53,,,,Bandhan US Treasury Bond 0-1 year specific Debt Passive FOF-Reg(G),FoFs : Overseas,57,57,57,57,57,53,27,23,21.88,4.79,12.69,20.82,28.62,19.43,11.99,9.93,,,,,,,,
Shriram Multi Asset Allocation Fund-Reg(G),48029,Shriram Mutual Fund,3.09,2.18,10.11,-3.22,NIFTY 50 - TRI,,,,0.15,27,15,25,26,25,,,,Shriram Multi Asset Allocation Fund-Reg(G),Hybrid : Multi Asset Allocation,28,32,31,29,26,10,9,7,8.5,3.01,3.24,12.27,6.05,15.18,18.26,12.89,,,,,,,,
Shriram Flexi Cap Fund-Reg(G),38781,Shriram Mutual Fund,1.16,0.61,11.43,-12.94,NIFTY 500 - TRI,9.09,14.02,,-9.29,47,44,38,45,46,38,27,,Shriram Flexi Cap Fund-Reg(G),Equity : Flexi Cap,48,50,49,48,48,39,27,21,1.89,2.96,1.77,15.22,-2.72,15.45,20.21,14.26,,,,,,,,
Kotak FMP-310-1131D(G),47871,Kotak Mahindra Mutual Fund,0.4,1.21,3.7,7.17,NIFTY Medium Duration Debt Index,,,,5.11,66,54,60,60,65,,,,Kotak FMP-310-1131D(G),Debt : FTP/FMP,81,82,82,81,81,44,10,4,5.31,0.4,1.2,3.85,7.48,7.27,6.17,6.14,,,,,,,,
Motilal Oswal Nifty 5 Year Benchmark G-Sec ETF,45196,Motilal Oswal Mutual Fund,0.29,0.47,4.32,8.01,Nifty 5 yr Benchmark G-Sec Index TRI,7.67,,,6.11,7,28,23,7,15,8,,,Motilal Oswal Nifty 5 Year Benchmark G-Sec ETF,Debt : ETFs,30,32,32,31,28,13,8,2,5.25,0.48,1.12,3.64,7.31,7.34,5.55,5.96,,,,,,,,
Axis BSE Sensex ETF,47768,Axis Mutual Fund,2.14,0.75,11.59,-0.12,BSE SENSEX - TRI,,,,5.87,87,155,104,151,58,,,,Axis BSE Sensex ETF,Equity : ETFs,170,203,194,180,162,114,68,32,4.39,3.14,1.21,15.06,-0.96,16.22,20.4,13.54,,,,,,,,
Sundaram Global Brand Theme - Equity Active FoF(G),3005,Sundaram Mutual Fund,3.51,9.08,13.3,23.26,MSCI AC World Index,18.98,13.38,11.34,14.12,44,36,43,47,34,27,10,7,Sundaram Global Brand Theme - Equity Active FoF(G),FoFs : Overseas,57,57,57,57,57,53,27,23,21.88,4.79,12.69,20.82,28.62,19.43,11.99,9.93,,,,,,,,
Bandhan Nifty200 Momentum 30 Index Fund-Reg(G),46608,Bandhan Mutual Fund,3.24,-1.42,14.46,-16.09,Nifty200 Momentum 30 - TRI,14.79,,,-6.71,160,69,155,115,140,40,,,Bandhan Nifty200 Momentum 30 Index Fund-Reg(G),Equity : Index Funds,175,212,201,189,140,78,32,18,2.07,2.9,0.13,15.23,-4.21,15.11,18.82,12.86,,,,,,,,
JM Overnight Fund-Reg(G),44156,JM Financial Mutual Fund,0.44,1.3,2.75,6.0,CRISIL Liquid Overnight Index,6.33,5.16,,4.03,27,30,31,31,29,25,17,,JM Overnight Fund-Reg(G),Debt : Overnight,34,35,34,34,34,29,27,3,4.07,0.44,1.32,2.79,6.05,6.36,5.17,5.49,0.46,1.35,2.86,6.18,,,,5.91
DSP FMP 268-1281D-Reg(G),47124,DSP Mutual Fund,0.42,1.25,3.64,7.28,CRISIL Medium Duration Debt Index,,,,5.21,54,40,39,66,57,,,,DSP FMP 268-1281D-Reg(G),Debt : FTP/FMP,81,82,82,81,81,44,10,4,5.31,0.4,1.2,3.85,7.48,7.27,6.17,6.14,,,,,,,,
Axis Floater Fund-Reg(G),45632,Axis Mutual Fund,0.46,0.42,4.06,7.29,NIFTY Long Duration Debt Index,7.76,,,5.47,9,2,12,10,11,3,,,Axis Floater Fund-Reg(G),Debt : Floater,12,12,12,12,12,12,7,5,5.66,0.34,1.12,4.28,7.93,7.58,6.28,7.08,,,,,,,,
SBI FMP-78-1170D-Reg(G),47638,SBI Mutual Fund,0.43,1.3,3.73,7.36,CRISIL Medium Duration Debt Index,,,,5.26,44,29,22,53,42,,,,SBI FMP-78-1170D-Reg(G),Debt : FTP/FMP,81,82,82,81,81,44,10,4,5.31,0.4,1.2,3.85,7.48,7.27,6.17,6.14,,,,,,,,
Taurus Mid Cap Fund-Reg(G),3306,Taurus Mutual Fund,4.04,1.05,20.3,-5.62,Nifty Midcap 150 - TRI,16.6,21.21,15.35,3.02,6,5,23,14,26,23,23,17,Taurus Mid Cap Fund-Reg(G),Equity : Mid Cap,30,31,31,30,30,27,24,20,0.89,3.1,2.17,19.27,-2.01,19.72,26.01,16.41,,,,,,,,
SBI Magnum Childrens Benefit Fund-Savings Plan,2748,SBI Mutual Fund,0.89,0.59,5.36,3.6,NIFTY 50 Hybrid Composite Debt 15:85 Index,12.19,13.36,11.79,2.17,35,35,23,38,8,17,17,6,SBI Magnum Childrens Benefit Fund-Savings Plan,Hybrid : Solution Oriented,43,43,43,43,42,37,32,15,3.24,1.94,0.99,11.11,0.74,12.03,13.95,10.76,,,,,,,,
Axis NIFTY IT Index Fund-Reg(G),47983,Axis Mutual Fund,4.05,-6.03,-0.04,-15.41,NIFTY IT - TRI,,,,-15.97,172,37,193,189,132,,,,Axis NIFTY IT Index Fund-Reg(G),Equity : Index Funds,175,212,201,189,140,78,32,18,2.07,2.9,0.13,15.23,-4.21,15.11,18.82,12.86,,,,,,,,
Edelweiss ASEAN Equity Off-Shore Fund-Reg(G),13404,Edelweiss Mutual Fund,1.91,10.26,16.24,14.48,MSCI AC ASEAN 10/40 Index,10.99,11.5,8.38,14.63,42,51,38,38,45,44,17,15,Edelweiss ASEAN Equity Off-Shore Fund-Reg(G),FoFs : Overseas,57,57,57,57,57,53,27,23,21.88,4.79,12.69,20.82,28.62,19.43,11.99,9.93,,,,,,,,
Groww Largecap Fund-Reg(G),15997,Groww Mutual Fund,2.18,2.44,15.12,-3.14,NIFTY 100 - TRI,13.2,16.07,11.65,4.78,18,28,6,6,25,21,27,23,Groww Largecap Fund-Reg(G),Equity : Large Cap,38,39,39,38,38,35,31,28,3.96,2.6,1.27,13.54,-2.51,14.0,18.44,12.92,,,,,,,,
Quantum Diversified Equity All Cap Active FOF-Reg(G),19904,Quantum Mutual Fund,2.22,-0.09,13.64,0.25,BSE 500 - TRI,15.4,19.08,13.31,3.95,45,44,67,27,42,17,7,3,Quantum Diversified Equity All Cap Active FOF-Reg(G),FoFs : Domestic,60,80,74,61,59,47,29,23,10.54,3.51,4.02,13.87,8.94,14.44,14.59,10.5,,,,,,,,
Mirae Asset Gold ETF FoF-Reg(G),49290,Mirae Asset Mutual Fund,9.71,12.2,25.71,,Gold-India,,,,41.64,31,32,31,32,,,,,Mirae Asset Gold ETF FoF-Reg(G),Gold : ETFs,31,37,35,33,29,16,11,11,44.24,10.93,15.85,27.59,51.06,28.77,15.16,13.86,,,,,,,,
Motilal Oswal Nifty 200 Momentum 30 ETF,46325,Motilal Oswal Mutual Fund,3.31,-1.26,14.88,-15.47,Nifty200 Momentum 30 - TRI,16.02,,,-6.21,156,77,150,84,160,45,,,Motilal Oswal Nifty 200 Momentum 30 ETF,Equity : ETFs,170,203,194,180,162,114,68,32,4.39,3.14,1.21,15.06,-0.96,16.22,20.4,13.54,,,,,,,,
