HSBC Ultra Short Duration Fund-Reg(G),44328,HSBC Mutual Fund,0.56,1.81,3.96,7.58,NIFTY Ultra Short Duration Debt Index,7.1,5.68,,4.27,7,12,9,7,5,4,7,,HSBC Ultra Short Duration Fund-Reg(G),Debt : Ultra Short Duration,26,30,29,26,24,24,22,13,4.1,0.55,1.75,3.81,7.28,6.76,5.5,6.17,,,,,,,,
HDFC Gilt Fund(G),1269,HDFC Mutual Fund,0.81,0.79,5.16,9.04,Nifty All Duration G-Sec Index,7.99,5.41,7.06,5.18,15,15,18,9,9,7,8,13,HDFC Gilt Fund(G),Debt : Gilt,36,38,37,37,36,23,21,21,4.96,0.72,0.97,4.9,8.57,7.75,5.38,7.35,,,,,,,,
Aditya Birla SL CRISIL-IBX Financial Services 3 to 6 Months Debt Index Fund-Reg(G),49477,Aditya Birla Sun Life Mutual Fund,0.59,1.79,3.97,,CRISIL-IBX Financial Services 3 to 6 Months Debt Index,,,,4.28,6,5,11,6,,,,,Aditya Birla SL CRISIL-IBX Financial Services 3 to 6 Months Debt Index Fund-Reg(G),Debt : Ultra Short Duration,26,30,29,26,24,24,22,13,4.1,0.55,1.75,3.81,7.28,6.76,5.5,6.17,,,,,,,,
Edelweiss US Technology Equity FOF-Reg(G),44630,Edelweiss Mutual Fund,7.09,34.45,7.07,26.74,Russell 1000 Equal Weighted Technology Index,30.31,17.93,,12.69,22,5,2,32,8,2,3,,Edelweiss US Technology Equity FOF-Reg(G),FoFs : Overseas,57,57,57,57,57,51,27,23,12.31,3.83,18.25,9.74,17.36,17.69,10.6,8.38,,,,,,,,
UTI Balanced Advantage Fund-Reg(G),48102,UTI Mutual Fund,0.57,3.32,6.26,6.23,NIFTY 50 Hybrid Composite Debt 50:50 Index,,,,5.15,7,33,29,9,7,,,,UTI Balanced Advantage Fund-Reg(G),Hybrid : Dynamic Asset Allocation,33,34,34,33,32,22,19,11,3.21,1.21,4.48,5.12,3.17,13.66,13.0,9.48,,,,,,,,
Kotak Nifty SDL Apr 2032 Top 12 Equal Weight Index Fund-Reg(G),46390,Kotak Mahindra Mutual Fund,0.32,1.51,5.5,10.42,Nifty SDL Apr 2032 Top 12 Equal Weight Index,9.04,,,5.91,10,20,5,11,7,2,,,Kotak Nifty SDL Apr 2032 Top 12 Equal Weight Index Fund-Reg(G),Debt : Long Duration,26,26,26,26,24,4,3,2,5.2,0.61,0.81,5.16,9.3,8.49,4.96,7.16,,,,,,,,
UTI MEPUS,3617,UTI Mutual Fund,0.29,4.57,6.08,-0.43,BSE 100 - TRI,15.51,18.41,11.22,4.25,18,59,55,32,43,50,48,26,UTI MEPUS,Equity : Tax Saving (ELSS),58,59,59,58,58,53,53,29,2.21,2.0,8.18,5.97,1.65,20.26,24.17,13.11,,,,,,,,
SBI Retirement Benefit Fund-Aggressive Plan-Reg(G),30398,SBI Mutual Fund,1.72,8.1,6.18,-1.5,BSE 500 - TRI,17.0,,,3.75,19,11,12,15,41,13,,,SBI Retirement Benefit Fund-Aggressive Plan-Reg(G),Hybrid : Solution Oriented,43,43,43,43,42,37,32,15,3.53,1.45,6.02,5.95,4.17,14.88,14.71,10.33,,,,,,,,
UTI Low Duration Fund-Reg(G),3601,UTI Mutual Fund,0.58,2.02,4.45,8.32,NIFTY Low Duration Debt Index,7.37,7.01,6.25,4.76,3,10,4,3,3,3,1,16,UTI Low Duration Fund-Reg(G),Debt : Low Duration,20,23,23,20,20,20,20,19,4.63,0.58,1.99,4.33,7.97,7.12,5.77,6.51,,,,,,,,
Tata Business Cycle Fund-Reg(G),45373,Tata Mutual Fund,2.61,6.92,5.7,-2.58,NIFTY 500 - TRI,23.48,,,0.97,53,35,67,45,48,13,,,Tata Business Cycle Fund-Reg(G),Equity : Thematic,89,101,98,89,70,38,21,9,1.17,2.11,8.57,4.92,-0.47,21.6,24.24,13.58,,,,,,,,
Mirae Asset Flexi Cap Fund-Reg(G),47596,Mirae Asset Mutual Fund,1.66,9.13,7.7,4.03,NIFTY 500 - TRI,,,,4.07,12,28,11,14,15,,,,Mirae Asset Flexi Cap Fund-Reg(G),Equity : Flexi Cap,48,49,48,48,48,35,27,21,1.56,1.72,7.48,5.87,0.93,19.41,21.42,13.2,,,,,,,,
Franklin Build India Fund(G),7864,Franklin Templeton Mutual Fund,3.71,9.48,7.96,-1.32,BSE India Infrastructure Index - TRI,32.56,33.55,16.81,4.05,4,3,13,2,6,4,6,2,Franklin Build India Fund(G),Equity : Sectoral - Infrastructure,20,21,20,20,19,19,19,18,1.53,2.73,10.17,5.93,-4.11,28.6,31.63,14.92,,,,,,,,
Tata Banking & Financial Services Fund-Reg(G),33726,Tata Mutual Fund,1.1,5.19,17.64,13.2,Nifty Financial Services - TRI,22.75,21.08,,13.2,3,14,11,2,3,3,8,,Tata Banking & Financial Services Fund-Reg(G),Equity : Sectoral - Financial Services,21,22,22,21,21,14,11,10,11.1,1.61,6.01,15.59,9.73,20.92,22.04,12.4,,,,,,,,
Kotak Pioneer Fund-Reg(G),43927,Kotak Mahindra Mutual Fund,3.0,13.51,7.03,6.92,NIFTY 500 - TRI,23.76,25.27,,3.96,27,25,6,31,6,11,10,,Kotak Pioneer Fund-Reg(G),Equity : Thematic,89,101,98,89,70,38,21,9,1.17,2.11,8.57,4.92,-0.47,21.6,24.24,13.58,,,,,,,,
HDFC Business Cycle Fund-Reg(G),46445,HDFC Mutual Fund,3.06,8.25,6.1,0.97,NIFTY 500 - TRI,,,,1.94,44,24,48,41,28,,,,HDFC Business Cycle Fund-Reg(G),Equity : Thematic,89,101,98,89,70,38,21,9,1.17,2.11,8.57,4.92,-0.47,21.6,24.24,13.58,,,,,,,,
Edelweiss Multi Cap Fund-Reg(G),48147,Edelweiss Mutual Fund,1.77,9.06,4.88,2.45,Nifty500 Multicap 50:25:25 - TRI,,,,-0.02,32,33,23,31,23,,,,Edelweiss Multi Cap Fund-Reg(G),Equity : Multi Cap,42,44,43,42,38,28,20,14,2.05,2.23,8.86,6.52,2.95,20.66,22.63,13.74,,,,,,,,
Baroda BNP Paribas Multi Cap Fund-Reg(G),500,Baroda BNP Paribas Mutual Fund,2.05,6.8,1.93,1.46,Nifty500 Multicap 50:25:25 - TRI,22.2,25.3,13.48,-3.43,42,26,34,40,24,10,6,9,Baroda BNP Paribas Multi Cap Fund-Reg(G),Equity : Multi Cap,42,44,43,42,38,28,20,14,2.05,2.23,8.86,6.52,2.95,20.66,22.63,13.74,,,,,,,,
Nippon India ETF Nifty 8-13 yr G-Sec Long Term Gilt,35459,Nippon India Mutual Fund,0.25,1.62,6.18,10.99,Nifty 8-13 yr G-Sec,9.3,5.64,,6.39,3,27,14,2,1,1,2,,Nippon India ETF Nifty 8-13 yr G-Sec Long Term Gilt,Debt : ETFs,31,33,33,31,28,14,7,2,4.6,0.36,1.59,4.3,8.36,7.84,5.26,6.08,0.25,1.64,6.21,11.09,9.49,5.92,,12.02
Edelweiss Aggressive Hybrid Fund-Reg(G),7922,Edelweiss Mutual Fund,1.13,5.74,6.3,4.69,CRISIL Hybrid 35+65 - Aggressive Index,19.85,20.62,12.12,3.6,25,17,14,22,18,4,3,3,Edelweiss Aggressive Hybrid Fund-Reg(G),Hybrid : Multi Asset Allocation,28,31,29,28,25,10,8,7,6.64,1.23,5.61,7.89,5.53,17.22,19.22,12.41,,,,,,,,
ICICI Pru Commodities Fund-Reg(G),41999,ICICI Prudential Mutual Fund,4.75,10.87,11.51,-0.82,NIFTY COMMODITIES - TRI,23.44,34.45,,10.58,2,6,22,3,38,14,1,,ICICI Pru Commodities Fund-Reg(G),Equity : Thematic,89,101,98,89,70,38,21,9,1.17,2.11,8.57,4.92,-0.47,21.6,24.24,13.58,,,,,,,,
Invesco India ELSS Tax Saver Fund(G),2270,Invesco Mutual Fund,2.16,8.49,4.19,2.63,BSE 500 - TRI,20.57,20.43,13.18,-0.47,49,25,22,47,22,25,42,14,Invesco India ELSS Tax Saver Fund(G),Equity : Tax Saving (ELSS),58,59,59,58,58,53,53,29,2.21,2.0,8.18,5.97,1.65,20.26,24.17,13.11,,,,,,,,
ICICI Pru Bond Fund(G),6197,ICICI Prudential Mutual Fund,0.77,1.66,5.58,9.9,CRISIL Medium to Long Term Debt Index,8.49,6.11,7.54,5.77,19,1,49,10,8,2,2,2,ICICI Pru Bond Fund(G),Debt : Medium to Long Duration,59,60,60,59,52,26,11,11,5.43,0.47,1.94,5.12,9.04,7.69,5.48,6.54,,,,,,,,
UTI MNC Fund-Reg(G),3634,UTI Mutual Fund,2.58,10.81,3.72,-3.87,NIFTY MNC - TRI,13.86,15.01,9.64,0.82,3,5,3,3,4,3,3,2,UTI MNC Fund-Reg(G),Equity : Thematic - MNC,6,6,6,6,5,4,4,3,0.71,3.06,10.54,4.2,-3.53,13.91,16.78,9.58,,,,,,,,
Kotak Dynamic Bond Fund-Reg(G),5430,Kotak Mahindra Mutual Fund,1.03,1.36,4.98,8.7,NIFTY Composite Debt Index,7.91,5.92,7.96,5.04,10,2,8,10,10,9,7,2,Kotak Dynamic Bond Fund-Reg(G),Debt : Dynamic Bond,22,22,22,22,22,22,21,19,4.92,0.6,1.04,4.9,8.51,7.58,5.76,7.12,,,,,,,,
Bandhan Dynamic Bond Fund-Reg(G),7455,Bandhan Mutual Fund,1.47,0.04,4.21,6.64,NIFTY Composite Debt Index,7.4,4.97,7.3,3.74,22,1,22,20,22,15,18,7,Bandhan Dynamic Bond Fund-Reg(G),Debt : Dynamic Bond,22,22,22,22,22,22,21,19,4.92,0.6,1.04,4.9,8.51,7.58,5.76,7.12,,,,,,,,
Sundaram Multi Cap Fund(G),2370,Sundaram Mutual Fund,3.27,9.32,8.18,3.06,Nifty500 Multicap 50:25:25 - TRI,20.26,24.23,14.55,3.01,18,6,20,12,18,16,9,4,Sundaram Multi Cap Fund(G),Equity : Multi Cap,42,44,43,42,38,28,20,14,2.05,2.23,8.86,6.52,2.95,20.66,22.63,13.74,,,,,,,,
HSBC Overnight Fund-Reg(G),42784,HSBC Mutual Fund,0.42,1.35,2.9,6.24,Nifty 1D Rate Index,6.34,5.09,,3.23,25,23,18,17,18,15,17,,HSBC Overnight Fund-Reg(G),Debt : Overnight,34,34,34,34,34,28,27,3,3.24,0.42,1.35,2.89,6.22,6.35,5.1,5.53,0.43,1.4,2.97,6.34,6.48,5.24,,6.01
Kotak Business Cycle Fund-Reg(G),46472,Kotak Mahindra Mutual Fund,2.4,10.58,7.01,6.52,NIFTY 500 - TRI,,,,3.24,36,37,26,32,8,,,,Kotak Business Cycle Fund-Reg(G),Equity : Thematic,89,101,98,89,70,38,21,9,1.17,2.11,8.57,4.92,-0.47,21.6,24.24,13.58,,,,,,,,
HDFC NIFTY Bank ETF,33563,HDFC Mutual Fund,1.13,4.14,16.43,7.58,NIFTY BANK - TRI,17.46,,,11.11,21,108,166,20,20,54,,,HDFC NIFTY Bank ETF,Equity : ETFs,170,195,184,170,155,103,64,29,3.89,1.23,8.34,7.09,1.04,19.42,21.52,12.29,,,,,,,,
SBI Long Duration Fund-Reg(G),46864,SBI Mutual Fund,1.03,-0.14,4.11,7.16,CRISIL Long Duration Debt Index,,,,3.75,24,7,25,24,22,,,,SBI Long Duration Fund-Reg(G),Debt : Long Duration,26,26,26,26,24,4,3,2,5.2,0.61,0.81,5.16,9.3,8.49,4.96,7.16,,,,,,,,
Edelweiss Flexi Cap Fund-Reg(G),31778,Edelweiss Mutual Fund,1.18,6.83,4.95,0.12,NIFTY 500 - TRI,21.07,23.07,13.75,0.22,37,35,30,34,31,12,8,5,Edelweiss Flexi Cap Fund-Reg(G),Equity : Flexi Cap,48,49,48,48,48,35,27,21,1.56,1.72,7.48,5.87,0.93,19.41,21.42,13.2,,,,,,,,
Mirae Asset Healthcare Fund-Reg(G),39122,Mirae Asset Mutual Fund,5.65,9.23,5.96,14.47,BSE Health Care - TRI,23.28,21.98,,0.01,6,2,5,3,7,7,4,,Mirae Asset Healthcare Fund-Reg(G),Equity : Sectoral - Pharma,18,18,18,18,16,10,9,3,-1.2,4.63,7.85,4.04,14.42,24.56,21.46,12.18,,,,,,,,
Mahindra Manulife Large & Mid Cap Fund-Reg(G),43915,Mahindra Manulife Mutual Fund,3.24,10.56,7.95,0.67,NIFTY LargeMidcap 250 - TRI,20.16,24.35,,3.46,10,3,4,11,22,15,9,,Mahindra Manulife Large & Mid Cap Fund-Reg(G),Equity : Large & Mid Cap,31,31,31,31,29,26,25,19,2.24,1.83,8.71,6.7,2.46,21.5,23.98,14.1,,,,,,,,
Parag Parikh Conservative Hybrid Fund-Reg(G),45338,PPFAS Mutual Fund,0.56,2.21,5.2,8.56,CRISIL Hybrid 85+15 - Conservative Index,11.98,,,5.63,2,13,11,9,2,1,,,Parag Parikh Conservative Hybrid Fund-Reg(G),Hybrid : Debt Oriented (Conservative),18,18,18,18,18,18,17,17,4.39,0.7,2.51,4.96,6.71,9.88,9.59,7.73,,,,,,,,
Quant Large Cap Fund-Reg(G),46678,Quant Mutual Fund,2.38,8.32,4.24,-4.05,NIFTY 100 - TRI,,,,2.44,27,3,3,33,33,,,,Quant Large Cap Fund-Reg(G),Equity : Large Cap,38,39,39,38,37,34,31,28,3.44,1.2,5.76,6.5,0.22,17.57,19.3,11.84,,,,,,,,
Canara Rob Focused Fund-Reg(G),45510,Canara Robeco Mutual Fund,0.61,7.2,6.57,6.57,BSE 500 - TRI,20.27,,,2.75,19,44,33,25,7,15,,,Canara Rob Focused Fund-Reg(G),Equity : Multi Cap,42,44,43,42,38,28,20,14,2.05,2.23,8.86,6.52,2.95,20.66,22.63,13.74,,,,,,,,
Franklin India Balanced Advantage Fund-Reg(G),46625,Franklin Templeton Mutual Fund,0.65,3.8,4.78,5.19,NIFTY 50 Hybrid Composite Debt 50:50 Index,,,,2.88,25,31,26,23,13,,,,Franklin India Balanced Advantage Fund-Reg(G),Hybrid : Dynamic Asset Allocation,33,34,34,33,32,22,19,11,3.21,1.21,4.48,5.12,3.17,13.66,13.0,9.48,,,,,,,,
Aditya Birla SL Nifty Bank ETF,34434,Aditya Birla Sun Life Mutual Fund,1.14,4.15,16.43,7.58,NIFTY BANK - TRI,17.5,21.28,,11.11,22,103,164,21,21,50,22,,Aditya Birla SL Nifty Bank ETF,Equity : ETFs,170,195,184,170,155,103,64,29,3.89,1.23,8.34,7.09,1.04,19.42,21.52,12.29,,,,,,,,
Bandhan Multi Cap Fund-Reg(G),45867,Bandhan Mutual Fund,1.66,8.16,8.03,1.32,Nifty500 Multicap 50:25:25 - TRI,21.61,,,3.66,13,35,29,15,26,11,,,Bandhan Multi Cap Fund-Reg(G),Equity : Multi Cap,42,44,43,42,38,28,20,14,2.05,2.23,8.86,6.52,2.95,20.66,22.63,13.74,,,,,,,,
Baroda BNP Paribas Large Cap Fund-Reg(G),23,Baroda BNP Paribas Mutual Fund,1.22,5.84,4.81,-1.63,NIFTY 100 - TRI,18.81,19.26,11.98,1.88,33,16,20,32,28,8,15,14,Baroda BNP Paribas Large Cap Fund-Reg(G),Equity : Large Cap,38,39,39,38,37,34,31,28,3.44,1.2,5.76,6.5,0.22,17.57,19.3,11.84,,,,,,,,
Tata Large Cap Fund-Reg(G),3281,Tata Mutual Fund,1.15,4.82,6.51,-1.11,NIFTY 100 - TRI,17.47,20.06,11.28,3.95,18,19,27,22,25,18,9,19,Tata Large Cap Fund-Reg(G),Equity : Large Cap,38,39,39,38,37,34,31,28,3.44,1.2,5.76,6.5,0.22,17.57,19.3,11.84,,,,,,,,
Nippon India Innovation Fund-Reg(G),48169,Nippon India Mutual Fund,2.73,9.12,7.95,-0.42,NIFTY 500 - TRI,,,,4.54,23,30,39,20,37,,,,Nippon India Innovation Fund-Reg(G),Equity : Thematic,89,101,98,89,70,38,21,9,1.17,2.11,8.57,4.92,-0.47,21.6,24.24,13.58,,,,,,,,
Sundaram Multi Asset Allocation Fund-Reg(G),48460,Sundaram Mutual Fund,0.7,3.81,10.14,7.3,NIFTY 500 - TRI,,,,9.67,4,25,26,2,11,,,,Sundaram Multi Asset Allocation Fund-Reg(G),Hybrid : Multi Asset Allocation,28,31,29,28,25,10,8,7,6.64,1.23,5.61,7.89,5.53,17.22,19.22,12.41,,,,,,,,
Franklin India Liquid Fund-Super Inst(G),3406,Franklin Templeton Mutual Fund,0.49,1.57,3.49,7.17,Nifty Liquid Fund Index,6.99,5.55,6.3,3.88,1,3,4,1,1,4,7,2,Franklin India Liquid Fund-Super Inst(G),Debt : Liquid,38,39,38,38,37,35,34,29,3.76,0.48,1.53,3.38,6.99,6.88,5.47,6.12,,,,,,,,
UTI Focused Fund-Reg(G),45685,UTI Mutual Fund,0.05,4.92,5.47,-1.53,NIFTY 500 - TRI,17.13,,,3.87,14,47,45,31,36,26,,,UTI Focused Fund-Reg(G),Equity : Flexi Cap,48,49,48,48,48,35,27,21,1.56,1.72,7.48,5.87,0.93,19.41,21.42,13.2,,,,,,,,
ITI Small Cap Fund-Reg(G),44399,ITI Mutual Fund,3.5,12.06,5.95,3.24,Nifty Smallcap 250 - TRI,31.23,28.07,,0.03,15,21,24,13,15,2,21,,ITI Small Cap Fund-Reg(G),Equity : Small Cap,29,30,30,29,28,23,21,13,-0.08,4.05,13.69,5.69,3.33,25.1,33.16,17.18,,,,,,,,
Nippon India Consumption Fund(G),2644,Nippon India Mutual Fund,2.1,3.74,5.29,-1.02,Nifty India Consumption - TRI,19.37,24.02,14.03,3.1,2,15,16,5,12,4,2,5,Nippon India Consumption Fund(G),Equity : Thematic - Consumption,20,22,22,20,17,13,13,9,0.03,2.67,5.04,3.6,0.01,17.88,20.88,13.54,,,,,,,,
DSP Corp Bond Fund-Reg(G),37709,DSP Mutual Fund,0.55,2.18,4.9,8.75,CRISIL Corporate Bond Index,7.35,5.43,,5.2,19,6,4,20,19,17,17,,DSP Corp Bond Fund-Reg(G),Debt : Corporate Bond,21,21,21,21,21,20,18,12,5.52,0.52,2.05,5.28,9.29,7.62,5.97,7.21,,,,,,,,
DSP Focused Fund-Reg(G),8463,DSP Mutual Fund,1.7,6.03,8.6,3.73,NIFTY 500 - TRI,20.93,19.59,11.53,5.13,6,34,39,8,12,13,16,13,DSP Focused Fund-Reg(G),Equity : Multi Cap,42,44,43,42,38,28,20,14,2.05,2.23,8.86,6.52,2.95,20.66,22.63,13.74,,,,,,,,
Aditya Birla SL Medium Term Plan-Reg(G),7683,Aditya Birla Sun Life Mutual Fund,0.66,2.35,7.71,13.92,CRISIL Medium Duration Debt Index,9.61,12.24,8.69,8.08,1,3,3,1,1,1,1,1,Aditya Birla SL Medium Term Plan-Reg(G),Debt : Medium Duration,28,28,28,28,28,17,12,12,4.98,0.56,1.93,4.75,8.69,7.48,6.83,6.83,,,,,,,,
Aditya Birla SL Quant Fund-Reg(G),48491,Aditya Birla Sun Life Mutual Fund,2.03,6.12,5.54,-5.92,NIFTY 200 - TRI,,,,0.0,60,47,77,47,57,,,,Aditya Birla SL Quant Fund-Reg(G),Equity : Thematic,89,101,98,89,70,38,21,9,1.17,2.11,8.57,4.92,-0.47,21.6,24.24,13.58,,,,,,,,
HDFC Infrastructure Fund(G),4253,HDFC Mutual Fund,2.14,7.95,7.74,-2.11,BSE India Infrastructure Index - TRI,33.57,34.97,11.11,3.43,5,16,17,4,7,2,3,18,HDFC Infrastructure Fund(G),Equity : Sectoral - Infrastructure,20,21,20,20,19,19,19,18,1.53,2.73,10.17,5.93,-4.11,28.6,31.63,14.92,,,,,,,,
Nippon India Index Fund-Nifty 50 Plan(G),12860,Nippon India Mutual Fund,0.87,5.18,8.15,1.43,NIFTY 50 - TRI,15.93,18.38,11.36,6.2,34,129,146,40,34,52,24,15,Nippon India Index Fund-Nifty 50 Plan(G),Equity : Index Funds,175,201,193,175,129,68,32,18,2.77,1.26,8.58,6.78,-1.07,18.99,19.99,11.7,,,,,,,,
WOC Multi Asset Allocation Fund-Reg(G),47946,WhiteOak Capital Mutual Fund,0.81,4.34,8.95,13.33,CRISIL Short Term Bond Index,,,,9.16,6,22,22,13,1,,,,WOC Multi Asset Allocation Fund-Reg(G),Hybrid : Multi Asset Allocation,28,31,29,28,25,10,8,7,6.64,1.23,5.61,7.89,5.53,17.22,19.22,12.41,,,,,,,,
SBI Nifty Next 50 ETF,30248,SBI Mutual Fund,2.26,6.36,5.23,-6.09,NIFTY NEXT 50 - TRI,20.62,21.55,13.51,0.68,127,56,98,118,130,32,18,6,SBI Nifty Next 50 ETF,Equity : ETFs,170,195,184,170,155,103,64,29,3.89,1.23,8.34,7.09,1.04,19.42,21.52,12.29,,,,,,,,
SBI CRISIL IBX Gilt Index - June 2036 Fund-Reg(G),46941,SBI Mutual Fund,0.33,1.5,5.95,10.38,CRISIL IBX Gilt Index - June 2036,,,,6.22,5,19,6,6,9,,,,SBI CRISIL IBX Gilt Index - June 2036 Fund-Reg(G),Debt : Long Duration,26,26,26,26,24,4,3,2,5.2,0.61,0.81,5.16,9.3,8.49,4.96,7.16,,,,,,,,
Motilal Oswal Large Cap Fund-Reg(G),48488,Motilal Oswal Mutual Fund,2.72,7.73,9.56,13.23,NIFTY 100 - TRI,,,,6.6,3,1,4,2,1,,,,Motilal Oswal Large Cap Fund-Reg(G),Equity : Large Cap,38,39,39,38,37,34,31,28,3.44,1.2,5.76,6.5,0.22,17.57,19.3,11.84,,,,,,,,
Kotak Manufacture in India Fund-Reg(G),46107,Kotak Mahindra Mutual Fund,3.87,11.46,6.05,-1.35,Nifty India Manufacturing - TRI,21.52,,,2.59,40,10,16,44,41,18,,,Kotak Manufacture in India Fund-Reg(G),Equity : Thematic,89,101,98,89,70,38,21,9,1.17,2.11,8.57,4.92,-0.47,21.6,24.24,13.58,,,,,,,,
Motilal Oswal Nifty Microcap 250 Index Fund-Reg(G),41176,Motilal Oswal Mutual Fund,4.21,14.56,2.61,1.91,Nifty Microcap 250 - TRI,,,,-2.72,148,17,23,151,24,,,,Motilal Oswal Nifty Microcap 250 Index Fund-Reg(G),Equity : Index Funds,175,201,193,175,129,68,32,18,2.77,1.26,8.58,6.78,-1.07,18.99,19.99,11.7,,,,,,,,
HSBC Infrastructure Fund-Reg(G),594,HSBC Mutual Fund,2.03,9.99,4.44,-6.29,Nifty Infrastructure - TRI,28.45,30.66,15.23,-0.79,14,18,12,16,16,11,14,9,HSBC Infrastructure Fund-Reg(G),Equity : Sectoral - Infrastructure,20,21,20,20,19,19,19,18,1.53,2.73,10.17,5.93,-4.11,28.6,31.63,14.92,,,,,,,,
Nippon India Nifty Smallcap 250 Index Fund-Reg(G),44504,Nippon India Mutual Fund,4.44,15.79,6.33,0.7,Nifty Smallcap 250 - TRI,27.04,,,0.0,138,14,15,115,64,6,,,Nippon India Nifty Smallcap 250 Index Fund-Reg(G),Equity : Index Funds,175,201,193,175,129,68,32,18,2.77,1.26,8.58,6.78,-1.07,18.99,19.99,11.7,,,,,,,,
Motilal Oswal Nifty 500 Index Fund-Reg(G),43809,Motilal Oswal Mutual Fund,1.66,7.56,7.56,0.42,NIFTY 500 - TRI,18.4,20.99,,4.24,72,89,93,76,66,33,5,,Motilal Oswal Nifty 500 Index Fund-Reg(G),Equity : Index Funds,175,201,193,175,129,68,32,18,2.77,1.26,8.58,6.78,-1.07,18.99,19.99,11.7,,,,,,,,
ICICI Pru Constant Maturity Gilt Fund(G),30426,ICICI Prudential Mutual Fund,0.27,1.58,6.34,10.94,Crisil 10 Yr Gilt Index,9.1,6.03,8.52,6.5,1,3,2,1,1,1,1,2,ICICI Pru Constant Maturity Gilt Fund(G),Debt : Gilt (10 Yr Constant Duration),6,6,6,6,6,4,4,4,6.15,0.26,1.42,5.97,10.44,8.94,5.57,8.14,,,,,,,,
Motilal Oswal Nifty Midcap 150 Index Fund-Reg(G),43810,Motilal Oswal Mutual Fund,2.36,12.45,8.11,2.48,Nifty Midcap 150 - TRI,26.26,29.73,,3.24,93,44,30,44,17,9,2,,Motilal Oswal Nifty Midcap 150 Index Fund-Reg(G),Equity : Index Funds,175,201,193,175,129,68,32,18,2.77,1.26,8.58,6.78,-1.07,18.99,19.99,11.7,,,,,,,,
Tata India Consumer Fund-Reg(G),33728,Tata Mutual Fund,3.3,4.55,1.18,3.47,Nifty India Consumption - TRI,20.01,21.17,,-4.5,20,6,11,18,3,2,5,,Tata India Consumer Fund-Reg(G),Equity : Thematic - Consumption,20,22,22,20,17,13,13,9,0.03,2.67,5.04,3.6,0.01,17.88,20.88,13.54,,,,,,,,
Mirae Asset Money Market Fund-Reg(G),45753,Mirae Asset Mutual Fund,0.58,1.93,4.25,7.99,Nifty Money Market Index,7.08,,,4.57,12,13,13,13,11,15,,,Mirae Asset Money Market Fund-Reg(G),Debt : Money Market,22,23,23,22,22,19,17,13,4.52,0.58,1.91,4.21,7.85,7.25,5.79,6.6,,,,,,,,
Kotak Infra & Eco Reform Fund(G),4228,Kotak Mahindra Mutual Fund,3.44,13.14,4.29,-6.17,Nifty Infrastructure - TRI,27.01,31.75,15.34,-1.78,19,5,3,17,15,13,9,8,Kotak Infra & Eco Reform Fund(G),Equity : Sectoral - Infrastructure,20,21,20,20,19,19,19,18,1.53,2.73,10.17,5.93,-4.11,28.6,31.63,14.92,,,,,,,,
Nippon India ETF Nifty IT,44506,Nippon India Mutual Fund,-4.69,12.24,-10.91,-5.34,NIFTY IT - TRI,12.75,19.14,,-13.13,170,193,41,170,121,98,47,,Nippon India ETF Nifty IT,Equity : ETFs,170,195,184,170,155,103,64,29,3.89,1.23,8.34,7.09,1.04,19.42,21.52,12.29,,,,,,,,
Axis Business Cycles Fund-Reg(G),47580,Axis Mutual Fund,1.79,7.92,6.18,0.79,NIFTY 500 - TRI,,,,2.17,42,55,51,38,30,,,,Axis Business Cycles Fund-Reg(G),Equity : Thematic,89,101,98,89,70,38,21,9,1.17,2.11,8.57,4.92,-0.47,21.6,24.24,13.58,,,,,,,,
HSBC Arbitrage Fund-Reg(G),29550,HSBC Mutual Fund,0.45,1.36,3.2,6.63,Nifty 50 Arbitrage,6.75,5.46,5.75,3.59,17,17,18,20,18,17,13,7,HSBC Arbitrage Fund-Reg(G),Hybrid : Arbitrage,30,31,31,30,26,24,23,14,3.58,0.45,1.37,3.2,6.67,6.74,5.4,5.72,0.37,1.49,3.72,7.28,7.34,5.84,,7.62
Franklin India Dividend Yield Fund(G),3367,Franklin Templeton Mutual Fund,1.2,4.41,2.23,-4.29,NIFTY 500 - TRI,19.12,26.84,14.99,0.59,8,6,9,10,9,7,2,2,Franklin India Dividend Yield Fund(G),Equity : Thematic - Dividend Yield,10,10,10,10,9,8,6,5,2.37,1.41,6.86,5.22,-1.67,22.26,24.59,14.04,,,,,,,,
Nippon India ETF Nifty Midcap 150,40028,Nippon India Mutual Fund,2.39,12.57,8.42,3.08,Nifty Midcap 150 - TRI,27.18,30.99,,3.58,109,51,23,54,39,11,6,,Nippon India ETF Nifty Midcap 150,Equity : ETFs,170,195,184,170,155,103,64,29,3.89,1.23,8.34,7.09,1.04,19.42,21.52,12.29,,,,,,,,
Union Flexi Cap Fund-Reg(G),14559,Union Mutual Fund,1.72,7.83,7.07,2.37,BSE 500 - TRI,18.28,21.35,12.04,1.62,25,25,17,18,21,19,11,17,Union Flexi Cap Fund-Reg(G),Equity : Flexi Cap,48,49,48,48,48,35,27,21,1.56,1.72,7.48,5.87,0.93,19.41,21.42,13.2,,,,,,,,
ICICI Pru Bharat 22 FOF-(G),40232,ICICI Prudential Mutual Fund,-0.12,3.2,3.46,-7.51,BSE Bharat 22 Index,30.97,33.04,,1.34,53,72,48,55,56,1,1,,ICICI Pru Bharat 22 FOF-(G),FoFs : Domestic,61,76,66,62,58,47,28,23,7.79,1.03,6.92,8.6,7.34,15.95,15.45,10.25,0.1,2.61,2.29,-9.5,27.51,29.06,,-1.2
ICICI Pru Housing Opp Fund-Reg(G),46546,ICICI Prudential Mutual Fund,2.71,7.64,10.79,2.95,Nifty Housing - TRI,20.76,,,6.46,14,31,57,5,19,19,,,ICICI Pru Housing Opp Fund-Reg(G),Equity : Thematic,89,101,98,89,70,38,21,9,1.17,2.11,8.57,4.92,-0.47,21.6,24.24,13.58,,,,,,,,
DSP Multicap Fund-Reg(G),48040,DSP Mutual Fund,3.08,12.54,6.95,2.6,Nifty500 Multicap 50:25:25 - TRI,,,,2.28,22,8,2,21,22,,,,DSP Multicap Fund-Reg(G),Equity : Multi Cap,42,44,43,42,38,28,20,14,2.05,2.23,8.86,6.52,2.95,20.66,22.63,13.74,,,,,,,,
Sundaram Ultra Short Duration Fund(G),4186,Sundaram Mutual Fund,0.5,1.58,3.46,6.61,NIFTY Ultra Short Duration Debt Index,6.14,4.77,5.22,3.73,25,28,28,25,23,23,21,12,Sundaram Ultra Short Duration Fund(G),Debt : Ultra Short Duration,26,30,29,26,24,24,22,13,4.1,0.55,1.75,3.81,7.28,6.76,5.5,6.17,,,,,,,,
NJ Flexi Cap Fund-Reg(G),48135,NJ Mutual Fund,3.32,9.78,3.16,-9.4,NIFTY 500 - TRI,,,,-0.44,39,3,9,42,45,,,,NJ Flexi Cap Fund-Reg(G),Equity : Flexi Cap,48,49,48,48,48,35,27,21,1.56,1.72,7.48,5.87,0.93,19.41,21.42,13.2,,,,,,,,
BHARAT Bond ETF FOF - April 2033 -Reg(G),47284,Edelweiss Mutual Fund,0.16,1.9,5.63,10.61,NIFTY BHARAT Bond Index - April 2033,,,,5.93,28,70,58,41,14,,,,BHARAT Bond ETF FOF - April 2033 -Reg(G),FoFs : Domestic,61,76,66,62,58,47,28,23,7.79,1.03,6.92,8.6,7.34,15.95,15.45,10.25,,,,,,,,
Bandhan Balanced Advantage Fund-Reg(G),30671,Bandhan Mutual Fund,1.36,3.99,4.75,5.01,NIFTY 50 Hybrid Composite Debt 50:50 Index,12.27,11.18,8.39,2.33,26,9,24,24,14,18,13,8,Bandhan Balanced Advantage Fund-Reg(G),Hybrid : Dynamic Asset Allocation,33,34,34,33,32,22,19,11,3.21,1.21,4.48,5.12,3.17,13.66,13.0,9.48,,,,,,,,
Edelweiss Nifty PSU Bond Plus SDL Apr 2027 50:50 Index Fund-Reg(G),45387,Edelweiss Mutual Fund,0.45,2.16,4.9,8.75,Nifty PSU Bond Plus SDL Apr 2027 50:50 Index,7.53,,,5.21,38,33,18,40,34,21,,,Edelweiss Nifty PSU Bond Plus SDL Apr 2027 50:50 Index Fund-Reg(G),Debt : Medium to Long Duration,59,60,60,59,52,26,11,11,5.43,0.47,1.94,5.12,9.04,7.69,5.48,6.54,,,,,,,,
Templeton India Value Fund(G),3379,Franklin Templeton Mutual Fund,1.66,6.17,5.85,-3.53,NIFTY 500 - TRI,22.37,28.84,14.04,3.56,8,17,20,10,18,14,3,10,Templeton India Value Fund(G),Equity : Value / Contra,22,23,23,22,22,21,17,14,2.2,2.26,8.04,5.76,-0.15,23.28,25.47,14.49,,,,,,,,
Tata Infrastructure Fund-Reg(G),3254,Tata Mutual Fund,3.36,11.28,5.33,-10.85,BSE India Infrastructure Index - TRI,24.78,30.83,14.58,-1.06,17,7,5,12,18,15,12,13,Tata Infrastructure Fund-Reg(G),Equity : Sectoral - Infrastructure,20,21,20,20,19,19,19,18,1.53,2.73,10.17,5.93,-4.11,28.6,31.63,14.92,,,,,,,,
Kotak MNC Fund-Reg(G),49046,Kotak Mahindra Mutual Fund,3.18,11.82,5.19,,NIFTY MNC - TRI,,,,1.31,2,3,2,2,,,,,Kotak MNC Fund-Reg(G),Equity : Thematic - MNC,6,6,6,6,5,4,4,3,0.71,3.06,10.54,4.2,-3.53,13.91,16.78,9.58,,,,,,,,
Aditya Birla SL Income Fund(G),405,Aditya Birla Sun Life Mutual Fund,0.69,1.09,4.72,8.46,CRISIL Medium to Long Term Debt Index,7.56,5.71,7.26,4.75,54,7,55,50,40,18,4,3,Aditya Birla SL Income Fund(G),Debt : Medium to Long Duration,59,60,60,59,52,26,11,11,5.43,0.47,1.94,5.12,9.04,7.69,5.48,6.54,,,,,,,,
ICICI Pru Regular Gold Savings Fund(FOF)(G),14885,ICICI Prudential Mutual Fund,-1.21,2.87,22.31,29.66,Gold-India,23.01,13.46,12.71,27.55,7,10,9,10,4,3,5,5,ICICI Pru Regular Gold Savings Fund(FOF)(G),Gold : MFs,17,18,18,17,16,10,10,10,27.75,-0.55,5.51,22.44,27.71,22.92,13.46,12.65,,,,,,,,
UTI Infrastructure Fund-Reg(G),3582,UTI Mutual Fund,2.16,5.8,7.63,-3.8,Nifty Infrastructure - TRI,24.57,26.6,12.09,4.45,3,15,19,6,11,16,17,17,UTI Infrastructure Fund-Reg(G),Equity : Sectoral - Infrastructure,20,21,20,20,19,19,19,18,1.53,2.73,10.17,5.93,-4.11,28.6,31.63,14.92,,,,,,,,
Aditya Birla SL G-Sec Fund(G),399,Aditya Birla Sun Life Mutual Fund,1.22,0.21,4.48,7.64,Nifty All Duration G-Sec Index,7.66,5.52,7.98,4.22,28,2,29,26,27,17,7,4,Aditya Birla SL G-Sec Fund(G),Debt : Gilt,36,38,37,37,36,23,21,21,4.96,0.72,0.97,4.9,8.57,7.75,5.38,7.35,,,,,,,,
Franklin India Aggressive Hybrid Fund(G),999,Franklin Templeton Mutual Fund,0.59,4.55,5.27,3.92,CRISIL Hybrid 35+65 - Aggressive Index,17.36,18.8,11.29,2.52,41,50,28,26,37,12,10,10,Franklin India Aggressive Hybrid Fund(G),Hybrid : Equity Oriented,55,56,56,55,55,54,51,31,7.94,5.64,9.07,9.75,8.7,14.73,15.16,9.88,,,,,,,,
DSP BSE Liquid Rate ETF,48724,DSP Mutual Fund,0.41,1.3,2.79,6.02,BSE Liquid Rate Index,,,,3.14,21,13,24,22,22,,,,DSP BSE Liquid Rate ETF,Debt : ETFs,31,33,33,31,28,14,7,2,4.6,0.36,1.59,4.3,8.36,7.84,5.26,6.08,,,,,,,,
Parag Parikh Dynamic Asset Allocation Fund-Reg(G),48512,PPFAS Mutual Fund,0.81,1.65,4.48,7.18,CRISIL Hybrid 50+50 - Moderate Index,,,,4.65,9,25,34,27,3,,,,Parag Parikh Dynamic Asset Allocation Fund-Reg(G),Hybrid : Dynamic Asset Allocation,33,34,34,33,32,22,19,11,3.21,1.21,4.48,5.12,3.17,13.66,13.0,9.48,,,,,,,,
SBI Credit Risk Fund-Reg(G),2770,SBI Mutual Fund,0.71,2.15,5.0,8.9,NIFTY Credit Risk Bond Index,8.16,7.03,7.46,5.28,9,6,9,10,10,6,10,6,SBI Credit Risk Fund-Reg(G),Debt : Credit Risk,15,15,15,15,15,15,15,13,7.32,0.66,2.88,7.0,11.08,8.53,9.04,6.55,,,,,,,,
