Edelweiss MSCI India Domestic & World Healthcare 45 Index Fund-Reg(G),45117,Edelweiss Mutual Fund,3.65,-3.46,8.71,29.75,MSCI India Domestic & World Healthcare 45 Index,15.8,,,26.28,35,94,60,8,24,25,,,Edelweiss MSCI India Domestic & World Healthcare 45 Index Fund-Reg(G),Equity : Index Funds,105,161,140,125,103,51,28,18,20.36,5.49,-3.55,2.97,22.6,16.34,16.95,12.34,,,,,,,,
SBI FMP-74-1243D-Reg(G),47381,SBI Mutual Fund,0.58,1.74,4.0,8.02,CRISIL Medium Duration Debt Index,,,,7.74,34,26,37,37,32,,,,SBI FMP-74-1243D-Reg(G),Debt : FTP/FMP,91,91,91,91,91,40,17,12,7.59,0.6,1.71,3.94,7.85,5.82,5.63,6.04,,,,,,,,
Axis Silver ETF,46369,Axis Mutual Fund,-0.09,1.92,3.47,19.76,Silver,,,,17.59,25,23,19,19,21,,,,Axis Silver ETF,Gold : ETFs,25,31,29,28,25,11,11,11,18.87,1.56,3.36,5.0,21.48,15.11,14.03,9.91,,,,,,,,
Edelweiss CRISIL IBX 50:50 Gilt Plus SDL Short Duration Index Fund-Reg(G),47430,Edelweiss Mutual Fund,0.67,1.63,4.05,7.86,CRISIL IBX 50:50 Gilt Plus SDL Short Duration Index,,,,7.53,12,5,20,9,11,,,,Edelweiss CRISIL IBX 50:50 Gilt Plus SDL Short Duration Index Fund-Reg(G),Debt : Short Duration,25,29,26,26,25,23,21,19,7.18,0.6,1.74,3.86,7.44,6.05,6.14,6.68,,,,,,,,
Bandhan Nifty 100 Index Fund-Reg(G),46119,Bandhan Mutual Fund,3.39,-4.88,1.98,16.84,NIFTY 100 - TRI,,,,13.93,65,114,92,78,61,,,,Bandhan Nifty 100 Index Fund-Reg(G),Equity : Index Funds,105,161,140,125,103,51,28,18,20.36,5.49,-3.55,2.97,22.6,16.34,16.95,12.34,,,,,,,,
Kotak Nifty 100 Low Volatility 30 ETF,45688,Kotak Mahindra Mutual Fund,2.74,-7.76,2.98,17.26,Nifty100 Low Volatility 30 - TRI,,,,13.17,87,144,140,93,84,,,,Kotak Nifty 100 Low Volatility 30 ETF,Equity : ETFs,141,169,163,154,141,89,61,25,19.33,4.65,-2.61,4.77,21.76,16.68,17.59,12.52,,,,,,,,
ICICI Pru Nifty Healthcare ETF,45383,ICICI Prudential Mutual Fund,5.06,-0.85,15.17,39.88,Nifty Healthcare Index - TRI,20.57,,,37.77,5,46,28,17,4,19,,,ICICI Pru Nifty Healthcare ETF,Equity : ETFs,141,169,163,154,141,89,61,25,19.33,4.65,-2.61,4.77,21.76,16.68,17.59,12.52,,,,,,,,
UTI Silver ETF,46881,UTI Mutual Fund,-0.39,0.96,0.28,18.12,Silver,,,,19.08,13,31,28,28,25,,,,UTI Silver ETF,Gold : ETFs,25,31,29,28,25,11,11,11,18.87,1.56,3.36,5.0,21.48,15.11,14.03,9.91,,,,,,,,
Franklin India G-Sec Fund(G),3373,Franklin Templeton Mutual Fund,0.66,1.43,4.14,7.27,Nifty All Duration G-Sec Index,5.03,5.33,5.78,7.14,34,28,19,21,34,23,21,21,Franklin India G-Sec Fund(G),Debt : Gilt,35,36,36,36,35,23,21,21,8.48,0.89,1.4,4.24,8.85,5.91,6.5,7.12,,,,,,,,
HDFC FMP-Sr 47-2638D-Feb 2023-Reg(G),47642,HDFC Mutual Fund,1.01,1.8,5.15,9.3,NIFTY Long Duration Debt Index,,,,9.02,4,2,17,2,4,,,,HDFC FMP-Sr 47-2638D-Feb 2023-Reg(G),Debt : FTP/FMP,91,91,91,91,91,40,17,12,7.59,0.6,1.71,3.94,7.85,5.82,5.63,6.04,,,,,,,,
ICICI Pru India Equity (FOF)(G),44626,ICICI Prudential Mutual Fund,3.55,-3.66,5.61,27.47,BSE 500 - TRI,22.04,,,26.13,4,18,48,7,4,2,,,ICICI Pru India Equity (FOF)(G),FoFs : Domestic,53,61,60,57,53,41,25,23,15.75,2.77,-0.84,3.91,16.97,12.94,14.04,10.42,3.22,-4.77,2.44,19.32,16.79,19.39,,18.03
Bandhan CRISIL IBX 90:10 SDL Plus Gilt - Sep 2027 Index Fund-Reg(G),46212,Bandhan Mutual Fund,0.58,1.68,4.13,8.26,CRISIL IBX 90:10 SDL Plus Gilt Index - September 2027,,,,7.92,26,34,2,22,26,,,,Bandhan CRISIL IBX 90:10 SDL Plus Gilt - Sep 2027 Index Fund-Reg(G),Debt : Gilt,35,36,36,36,35,23,21,21,8.48,0.89,1.4,4.24,8.85,5.91,6.5,7.12,,,,,,,,
TRUSTMF Overnight Fund-Reg(G),45719,Trust Mutual Fund,0.53,1.63,3.26,6.67,CRISIL Liquid Overnight Index,,,,6.44,5,8,2,3,7,,,,TRUSTMF Overnight Fund-Reg(G),Debt : Overnight,35,35,35,35,35,27,25,3,6.34,0.53,1.57,3.19,6.6,5.89,4.81,5.65,0.54,1.62,3.27,,,,,6.61
Nippon India Nifty IT Index Fund-Reg(G),48568,Nippon India Mutual Fund,9.84,8.51,31.09,,NIFTY IT - TRI,,,,,,16,1,2,,,,,Nippon India Nifty IT Index Fund-Reg(G),Equity : Index Funds,105,161,140,125,103,51,28,18,20.36,5.49,-3.55,2.97,22.6,16.34,16.95,12.34,,,,,,,,
UTI Gold ETF FoF-Reg(G),47003,UTI Mutual Fund,2.4,4.23,6.56,22.54,Gold-India,,,,20.17,1,3,4,2,2,,,,UTI Gold ETF FoF-Reg(G),Gold : MFs,16,17,16,16,16,10,10,10,18.19,1.7,3.75,5.1,21.48,14.77,13.58,9.53,,,,,,,,
JM Overnight Fund-Reg(G),44156,JM Financial Mutual Fund,0.53,1.58,3.19,6.58,CRISIL Liquid Overnight Index,5.88,4.83,,6.35,28,20,23,29,28,20,10,,JM Overnight Fund-Reg(G),Debt : Overnight,35,35,35,35,35,27,25,3,6.34,0.53,1.57,3.19,6.6,5.89,4.81,5.65,0.54,1.62,3.27,,,,,6.61
ICICI Pru Nifty Oil & Gas ETF,33836,ICICI Prudential Mutual Fund,1.71,-14.02,,,NIFTY OIL & GAS - TRI,,,,,,158,163,,,,,,ICICI Pru Nifty Oil & Gas ETF,Equity : ETFs,141,169,163,154,141,89,61,25,19.33,4.65,-2.61,4.77,21.76,16.68,17.59,12.52,,,,,,,,
Invesco India Gold ETF,8505,Invesco Mutual Fund,2.87,4.39,7.21,22.23,Gold-India,15.19,14.18,10.01,19.64,4,4,16,3,14,2,2,2,Invesco India Gold ETF,Gold : ETFs,25,31,29,28,25,11,11,11,18.87,1.56,3.36,5.0,21.48,15.11,14.03,9.91,,,,,,,,
HSBC Conservative Hybrid Fund(G),1458,HSBC Mutual Fund,3.73,2.71,5.98,16.65,NIFTY 50 Hybrid Composite Debt 15:85 Index,9.49,9.5,7.82,16.4,1,1,1,1,1,7,8,9,HSBC Conservative Hybrid Fund(G),Hybrid : Debt Oriented (Conservative),19,19,19,19,19,19,18,17,10.21,1.41,0.58,4.21,11.0,8.57,8.88,7.86,,,,,,,,
LIC MF Focused Fund-Reg(G),32627,LIC Mutual Fund,4.61,-6.8,3.9,17.8,NIFTY 500 - TRI,12.07,15.85,,15.27,23,11,35,14,23,30,20,,LIC MF Focused Fund-Reg(G),Equity : Large Cap,36,38,38,37,36,34,31,28,17.34,3.93,-4.1,3.37,19.86,15.23,16.7,12.96,,,,,,,,
Quantum Gold Saving Fund-Reg(G),19961,Quantum Mutual Fund,2.4,4.45,6.52,22.38,Gold-India,14.93,13.58,9.66,18.58,4,4,2,5,4,4,6,3,Quantum Gold Saving Fund-Reg(G),Gold : MFs,16,17,16,16,16,10,10,10,18.19,1.7,3.75,5.1,21.48,14.77,13.58,9.53,,,,,,,,
LIC MF Value Fund-Reg(G),39956,LIC Mutual Fund,10.41,1.35,12.03,32.69,NIFTY 500 - TRI,19.87,20.98,,31.19,2,1,1,1,2,14,13,,LIC MF Value Fund-Reg(G),Equity : Value / Contra,22,22,22,22,22,21,17,14,23.21,4.48,-3.58,4.06,25.48,21.59,22.9,15.6,,,,,,,,
Invesco India Credit Risk Fund(G),21522,Invesco Mutual Fund,0.72,1.55,3.65,7.35,NIFTY Credit Risk Bond Index,6.9,6.32,5.76,7.05,13,2,12,13,12,4,9,9,Invesco India Credit Risk Fund(G),Debt : Credit Risk,15,15,15,15,15,15,15,10,7.84,0.65,1.82,4.05,8.11,8.79,6.48,6.43,,,,,,,,
Tata Floating Rate Fund-Reg(G),45375,Tata Mutual Fund,0.76,2.09,4.14,7.89,CRISIL Short Term Bond Index,6.37,,,7.57,11,3,2,7,12,8,,,Tata Floating Rate Fund-Reg(G),Debt : Floater,13,13,13,13,13,12,7,5,7.86,0.57,1.92,4.21,8.29,6.45,6.41,7.06,,,,,,,,
Axis All Seasons Debt FOFs-Reg(G),43840,Axis Mutual Fund,0.97,1.32,4.38,9.04,NIFTY Composite Debt Index,6.28,,,8.85,45,45,17,26,48,35,,,Axis All Seasons Debt FOFs-Reg(G),FoFs : Domestic,53,61,60,57,53,41,25,23,15.75,2.77,-0.84,3.91,16.97,12.94,14.04,10.42,,,,,,,,
Franklin India Arbitrage Fund-Reg(G),49339,Franklin Templeton Mutual Fund,,,,,Nifty 50 Arbitrage - TRI,,,,,,,,,,,,,Franklin India Arbitrage Fund-Reg(G),Hybrid : Arbitrage,26,27,27,26,26,24,22,14,7.12,0.47,1.58,3.32,7.41,6.03,5.11,5.84,,,,,,,,
Bandhan US Treasury Bond 0-1 year FoF-Reg(G),47724,Bandhan Mutual Fund,1.05,2.47,4.27,7.49,ICE 0-1 Year US Treasury Securities Index,,,,7.15,42,37,36,36,45,,,,Bandhan US Treasury Bond 0-1 year FoF-Reg(G),FoFs : Overseas,57,58,58,58,57,47,27,24,18.86,2.84,5.95,8.0,20.53,6.03,8.48,7.27,,,,,,,,
Shriram Flexi Cap Fund-Reg(G),38781,Shriram Mutual Fund,7.05,-3.42,-0.77,18.88,NIFTY 500 - TRI,15.71,15.66,,17.36,35,9,33,44,38,22,22,,Shriram Flexi Cap Fund-Reg(G),Equity : Flexi Cap,46,48,48,48,46,33,26,19,22.65,5.59,-2.55,5.16,24.67,17.29,19.25,14.36,,,,,,,,
Union Gilt Fund-Reg(G),46221,Union Mutual Fund,1.02,1.15,4.2,9.09,CRISIL Dynamic Gilt Index,,,,8.61,16,9,30,13,14,,,,Union Gilt Fund-Reg(G),Debt : Gilt,35,36,36,36,35,23,21,21,8.48,0.89,1.4,4.24,8.85,5.91,6.5,7.12,,,,,,,,
Union Equity Savings Fund-Reg(G),40627,Union Mutual Fund,1.73,0.3,3.26,9.66,Crisil Equity Savings Index,7.59,8.35,,8.82,47,39,14,42,48,49,45,,Union Equity Savings Fund-Reg(G),Hybrid : Equity Oriented,55,55,55,55,55,54,51,29,14.77,3.01,-0.76,4.42,15.97,11.85,13.02,10.64,,,,,,,,
Edelweiss US Value Equity Offshore Fund-Reg(G),21920,Edelweiss Mutual Fund,-1.85,3.53,9.99,18.32,Russell 1000 Index,9.89,12.4,10.51,17.53,30,50,33,18,32,14,8,4,Edelweiss US Value Equity Offshore Fund-Reg(G),FoFs : Overseas,57,58,58,58,57,47,27,24,18.86,2.84,5.95,8.0,20.53,6.03,8.48,7.27,,,,,,,,
Axis NIFTY IT Index Fund-Reg(G),47983,Axis Mutual Fund,9.85,8.48,31.06,28.71,NIFTY IT - TRI,,,,27.74,27,15,4,3,32,,,,Axis NIFTY IT Index Fund-Reg(G),Equity : Index Funds,105,161,140,125,103,51,28,18,20.36,5.49,-3.55,2.97,22.6,16.34,16.95,12.34,,,,,,,,
Edelweiss Nifty 100 Quality 30 Index Fund-Reg(G),45961,Edelweiss Mutual Fund,2.67,-7.58,0.43,16.8,NIFTY100 Quality 30 - TRI,14.79,,,12.06,69,147,125,83,62,26,,,Edelweiss Nifty 100 Quality 30 Index Fund-Reg(G),Equity : Index Funds,105,161,140,125,103,51,28,18,20.36,5.49,-3.55,2.97,22.6,16.34,16.95,12.34,,,,,,,,
SBI FMP-47-1434D-Reg(G),45660,SBI Mutual Fund,0.51,1.66,3.61,7.54,CRISIL Medium Duration Debt Index,5.46,,,7.31,66,81,61,77,64,37,,,SBI FMP-47-1434D-Reg(G),Debt : FTP/FMP,91,91,91,91,91,40,17,12,7.59,0.6,1.71,3.94,7.85,5.82,5.63,6.04,,,,,,,,
Bandhan Nifty200 Momentum 30 Index Fund-Reg(G),46608,Bandhan Mutual Fund,4.75,-5.5,-5.53,24.87,Nifty200 Momentum 30 - TRI,,,,24.33,48,77,117,124,48,,,,Bandhan Nifty200 Momentum 30 Index Fund-Reg(G),Equity : Index Funds,105,161,140,125,103,51,28,18,20.36,5.49,-3.55,2.97,22.6,16.34,16.95,12.34,,,,,,,,
Motilal Oswal BSE Enhanced Value ETF,46740,Motilal Oswal Mutual Fund,2.45,-7.35,-5.06,27.58,BSE Enhanced Value Index - TRI,,,,23.78,49,153,138,143,43,,,,Motilal Oswal BSE Enhanced Value ETF,Equity : ETFs,141,169,163,154,141,89,61,25,19.33,4.65,-2.61,4.77,21.76,16.68,17.59,12.52,2.34,-6.5,-4.19,,,,,-4.32
DSP World Mining FoF-Reg(G),8359,DSP Mutual Fund,-3.74,-4.66,-3.46,-3.47,MSCI ACWI Metals & Mining 30% Buffer 10/40 (1994) Net TRI,2.21,11.85,8.7,-5.53,55,55,46,55,55,31,9,8,DSP World Mining FoF-Reg(G),FoFs : Overseas,57,58,58,58,57,47,27,24,18.86,2.84,5.95,8.0,20.53,6.03,8.48,7.27,,,,,,,,
TRUSTMF Short Duration Fund-Reg(G),45652,Trust Mutual Fund,0.61,1.61,3.82,7.22,CRISIL Short Duration Debt Index,5.56,,,6.88,22,19,24,20,22,16,,,TRUSTMF Short Duration Fund-Reg(G),Debt : Short Duration,25,29,26,26,25,23,21,19,7.18,0.6,1.74,3.86,7.44,6.05,6.14,6.68,,,,,,,,
Bank of India Balanced Advantage Fund-Reg(G),21917,Bank of India Mutual Fund,1.88,-3.51,-1.51,9.83,NIFTY 50 Hybrid Composite Debt 50:50 Index,14.47,11.19,7.72,7.97,30,26,30,31,29,2,14,11,Bank of India Balanced Advantage Fund-Reg(G),Hybrid : Dynamic Asset Allocation,30,33,33,32,29,21,18,11,13.97,2.86,-1.26,3.9,15.52,12.34,12.69,10.08,,,,,,,,
Helios Financial Services Fund-Reg(G),48897,Helios Mutual Fund,6.3,2.2,,,Nifty Financial Services - TRI,,,,,,1,1,,,,,,Helios Financial Services Fund-Reg(G),Equity : Sectoral - Financial Services,18,21,21,20,18,14,11,8,13.42,4.3,-2.48,4.9,13.91,16.29,12.73,12.64,,,,,,,,
Navi Aggressive Hybrid Fund-Reg(G),39479,Navi Mutual Fund,3.83,-1.93,5.41,16.92,CRISIL Hybrid 35+65 - Aggressive Index,13.32,12.91,,15.05,25,15,42,16,25,19,25,,Navi Aggressive Hybrid Fund-Reg(G),Hybrid : Equity Oriented,55,55,55,55,55,54,51,29,14.77,3.01,-0.76,4.42,15.97,11.85,13.02,10.64,,,,,,,,
HSBC Nifty Next 50 Index Fund-Reg(G),33548,HSBC Mutual Fund,5.56,-5.06,-1.62,35.64,NIFTY NEXT 50 - TRI,19.5,,,31.86,12,62,104,103,8,16,,,HSBC Nifty Next 50 Index Fund-Reg(G),Equity : Index Funds,105,161,140,125,103,51,28,18,20.36,5.49,-3.55,2.97,22.6,16.34,16.95,12.34,,,,,,,,
ICICI Pru Nifty Auto Index Fund-Reg(G),45995,ICICI Prudential Mutual Fund,0.81,-10.08,-9.48,28.2,NIFTY AUTO - TRI,,,,23.55,4,6,7,7,4,,,,ICICI Pru Nifty Auto Index Fund-Reg(G),Equity : Sectoral - Auto,6,8,8,8,6,1,1,1,25.05,1.92,-9.39,-6.8,28.07,25.4,22.37,12.16,,,,,,,,
Canara Rob Corp Bond Fund-Reg(G),23504,Canara Robeco Mutual Fund,0.65,1.74,3.89,7.63,CRISIL Corporate Bond Index,5.42,5.78,6.57,7.34,21,12,20,21,21,18,16,9,Canara Rob Corp Bond Fund-Reg(G),Debt : Corporate Bond,21,21,21,21,21,20,18,12,7.79,0.66,1.85,4.19,8.09,5.86,6.41,7.06,,,,,,,,
WOC Arbitrage Fund-Reg(G),48900,WhiteOak Capital Mutual Fund,0.44,1.41,,,Nifty 50 Arbitrage - TRI,,,,,,22,26,,,,,,WOC Arbitrage Fund-Reg(G),Hybrid : Arbitrage,26,27,27,26,26,24,22,14,7.12,0.47,1.58,3.32,7.41,6.03,5.11,5.84,,,,,,,,
Axis CRISIL-IBX AAA Bond Financial Services - Sep 2027 Index Fund-Reg(G),49254,Axis Mutual Fund,,,,,CRISIL IBX AAA Financial Services Index - Sep 2027,,,,,,,,,,,,,Axis CRISIL-IBX AAA Bond Financial Services - Sep 2027 Index Fund-Reg(G),Debt : Medium to Long Duration,52,57,53,52,52,15,11,11,7.95,0.7,1.68,4.22,8.26,5.62,6.18,6.25,,,,,,,,
SBI FMP-52-1848D-Reg(G),45915,SBI Mutual Fund,0.58,1.76,4.09,8.18,CRISIL Medium to Long Term Debt Index,5.71,,,7.88,25,27,29,29,26,18,,,SBI FMP-52-1848D-Reg(G),Debt : FTP/FMP,91,91,91,91,91,40,17,12,7.59,0.6,1.71,3.94,7.85,5.82,5.63,6.04,,,,,,,,
Edelweiss CRISIL IBX AAA Financial Services - Jan 2028 Index Fund-Reg(G),49393,Edelweiss Mutual Fund,,,,,CRISIL-IBX AAA Financial Services Index - Jan 2028,,,,,,,,,,,,,Edelweiss CRISIL IBX AAA Financial Services - Jan 2028 Index Fund-Reg(G),Debt : Medium to Long Duration,52,57,53,52,52,15,11,11,7.95,0.7,1.68,4.22,8.26,5.62,6.18,6.25,,,,,,,,
SBI Nifty 200 Quality 30 ETF,41015,SBI Mutual Fund,3.49,-7.1,3.48,20.29,NIFTY200 Quality 30 - TRI,14.71,18.19,,15.85,79,106,136,70,73,40,25,,SBI Nifty 200 Quality 30 ETF,Equity : ETFs,141,169,163,154,141,89,61,25,19.33,4.65,-2.61,4.77,21.76,16.68,17.59,12.52,,,,,,,,
Taurus Mid Cap Fund-Reg(G),3306,Taurus Mutual Fund,5.19,-5.02,-2.72,15.19,Nifty Midcap 150 - TRI,19.48,23.23,16.3,13.8,30,28,29,29,30,20,22,16,Taurus Mid Cap Fund-Reg(G),Equity : Mid Cap,30,30,30,30,30,25,23,20,30.9,7.18,-1.12,5.91,32.39,23.2,26.97,17.43,,,,,,,,
Nippon India ETF Nifty India Consumption,17478,Nippon India Mutual Fund,3.4,-7.83,2.39,24.8,Nifty India Consumption - TRI,19.63,19.28,14.17,19.94,58,117,148,107,55,26,22,6,Nippon India ETF Nifty India Consumption,Equity : ETFs,141,169,163,154,141,89,61,25,19.33,4.65,-2.61,4.77,21.76,16.68,17.59,12.52,,,,,,,,
Nippon India Nifty Bank Index Fund-Reg(G),48148,Nippon India Mutual Fund,3.44,-1.39,3.27,,NIFTY BANK - TRI,,,,,,109,23,44,,,,,Nippon India Nifty Bank Index Fund-Reg(G),Equity : Index Funds,105,161,140,125,103,51,28,18,20.36,5.49,-3.55,2.97,22.6,16.34,16.95,12.34,,,,,,,,
Axis BSE Sensex ETF,47768,Axis Mutual Fund,3.67,-3.18,4.24,13.6,BSE SENSEX - TRI,,,,10.81,120,81,70,47,120,,,,Axis BSE Sensex ETF,Equity : ETFs,141,169,163,154,141,89,61,25,19.33,4.65,-2.61,4.77,21.76,16.68,17.59,12.52,2.11,-4.6,3.0,12.25,13.0,15.08,,11.32
ICICI Pru FMP-88-1226D-F(G),47232,ICICI Prudential Mutual Fund,0.56,1.63,3.86,7.67,CRISIL Medium Duration Debt Index,,,,7.41,54,46,72,55,54,,,,ICICI Pru FMP-88-1226D-F(G),Debt : FTP/FMP,91,91,91,91,91,40,17,12,7.59,0.6,1.71,3.94,7.85,5.82,5.63,6.04,,,,,,,,
Quantum Equity FoF-Reg(G),19904,Quantum Mutual Fund,4.8,-2.95,4.8,23.57,BSE 200 - TRI,15.68,17.6,13.51,22.32,6,8,46,17,7,12,6,3,Quantum Equity FoF-Reg(G),FoFs : Domestic,53,61,60,57,53,41,25,23,15.75,2.77,-0.84,3.91,16.97,12.94,14.04,10.42,2.78,-5.04,2.23,18.25,16.1,18.39,,17.03
SBI FMP-46-1850D-Reg(G),45620,SBI Mutual Fund,0.56,1.7,3.99,7.96,CRISIL Medium to Long Term Debt Index,5.54,,,7.68,37,51,48,39,38,32,,,SBI FMP-46-1850D-Reg(G),Debt : FTP/FMP,91,91,91,91,91,40,17,12,7.59,0.6,1.71,3.94,7.85,5.82,5.63,6.04,,,,,,,,
Groww Largecap Fund-Reg(G),15997,Groww Mutual Fund,4.09,-5.03,0.62,17.58,NIFTY 100 - TRI,14.48,13.31,11.97,14.86,26,17,29,32,25,22,29,23,Groww Largecap Fund-Reg(G),Equity : Large Cap,36,38,38,37,36,34,31,28,17.34,3.93,-4.1,3.37,19.86,15.23,16.7,12.96,,,,,,,,
ICICI Pru Nifty 200 Quality 30 ETF,48118,ICICI Prudential Mutual Fund,3.5,-7.06,3.59,20.56,NIFTY200 Quality 30 - TRI,,,,16.11,78,104,135,68,71,,,,ICICI Pru Nifty 200 Quality 30 ETF,Equity : ETFs,141,169,163,154,141,89,61,25,19.33,4.65,-2.61,4.77,21.76,16.68,17.59,12.52,,,,,,,,
Axis Nifty Bank Index Fund-Reg(G),48680,Axis Mutual Fund,3.43,-1.39,3.18,,NIFTY BANK - TRI,,,,,,110,25,49,,,,,Axis Nifty Bank Index Fund-Reg(G),Equity : Index Funds,105,161,140,125,103,51,28,18,20.36,5.49,-3.55,2.97,22.6,16.34,16.95,12.34,,,,,,,,
Zerodha Gold ETF,48500,Zerodha Mutual Fund,2.48,4.64,7.17,,Gold-India,,,,,,9,2,6,,,,,Zerodha Gold ETF,Gold : ETFs,25,31,29,28,25,11,11,11,18.87,1.56,3.36,5.0,21.48,15.11,14.03,9.91,,,,,,,,
Quant Gilt Fund-Reg(G),47345,Quant Mutual Fund,0.76,1.56,3.92,7.64,CRISIL Dynamic Gilt Index,,,,7.34,32,26,14,32,32,,,,Quant Gilt Fund-Reg(G),Debt : Gilt,35,36,36,36,35,23,21,21,8.48,0.89,1.4,4.24,8.85,5.91,6.5,7.12,,,,,,,,
Mirae Asset Nifty 100 ESG Sector Leaders ETF,45134,Mirae Asset Mutual Fund,3.69,-4.77,3.28,15.72,Nifty100 ESG Sector Leaders - TRI,12.22,,,13.39,86,72,113,71,94,80,,,Mirae Asset Nifty 100 ESG Sector Leaders ETF,Equity : ETFs,141,169,163,154,141,89,61,25,19.33,4.65,-2.61,4.77,21.76,16.68,17.59,12.52,,,,,,,,
Kotak FMP-310-1131D(G),47871,Kotak Mahindra Mutual Fund,0.56,1.63,3.84,7.6,NIFTY Medium Duration Debt Index,,,,7.34,59,53,73,56,58,,,,Kotak FMP-310-1131D(G),Debt : FTP/FMP,91,91,91,91,91,40,17,12,7.59,0.6,1.71,3.94,7.85,5.82,5.63,6.04,,,,,,,,
JM Short Duration Fund-Reg(G),46751,JM Financial Mutual Fund,0.58,1.63,3.72,7.1,CRISIL Short Duration Debt Index,,,,6.84,23,20,21,22,23,,,,JM Short Duration Fund-Reg(G),Debt : Short Duration,25,29,26,26,25,23,21,19,7.18,0.6,1.74,3.86,7.44,6.05,6.14,6.68,,,,,,,,
Tata Nifty MidSmall Healthcare Index Fund-Reg(G),48764,Tata Mutual Fund,5.75,2.4,20.4,,Nifty MidSmall Healthcare - TRI,,,,,,50,9,5,,,,,Tata Nifty MidSmall Healthcare Index Fund-Reg(G),Equity : Index Funds,105,161,140,125,103,51,28,18,20.36,5.49,-3.55,2.97,22.6,16.34,16.95,12.34,,,,,,,,
Canara Rob Gilt Fund-Reg(G),538,Canara Robeco Mutual Fund,0.93,1.12,4.06,8.98,CRISIL Dynamic Gilt Index,5.82,6.02,7.05,8.53,17,23,33,27,17,14,15,12,Canara Rob Gilt Fund-Reg(G),Debt : Gilt,35,36,36,36,35,23,21,21,8.48,0.89,1.4,4.24,8.85,5.91,6.5,7.12,,,,,,,,
Tata Silver ETF,48436,Tata Mutual Fund,0.13,1.85,1.18,,Silver,,,,,,21,24,27,,,,,Tata Silver ETF,Gold : ETFs,25,31,29,28,25,11,11,11,18.87,1.56,3.36,5.0,21.48,15.11,14.03,9.91,,,,,,,,
SBI Magnum Childrens Benefit Fund-Savings Plan,2748,SBI Mutual Fund,2.13,2.15,9.35,19.64,NIFTY 50 Hybrid Composite Debt 15:85 Index,12.32,13.94,11.79,18.18,16,33,1,2,15,20,12,7,SBI Magnum Childrens Benefit Fund-Savings Plan,Hybrid : Solution Oriented,40,42,42,42,39,37,29,13,16.5,3.99,-1.05,5.06,18.07,12.7,13.59,11.24,,,,,,,,
ICICI Pru BSE 500 ETF FOF-Reg(G),45726,ICICI Prudential Mutual Fund,4.47,-4.31,2.41,19.12,BSE 500 - TRI,15.82,,,16.71,23,10,52,46,20,11,,,ICICI Pru BSE 500 ETF FOF-Reg(G),FoFs : Domestic,53,61,60,57,53,41,25,23,15.75,2.77,-0.84,3.91,16.97,12.94,14.04,10.42,3.22,-4.77,2.44,19.32,16.79,19.39,,18.03
DSP FMP 268-1281D-Reg(G),47124,DSP Mutual Fund,0.57,1.75,3.96,7.95,CRISIL Medium Duration Debt Index,,,,7.65,39,42,34,41,39,,,,DSP FMP 268-1281D-Reg(G),Debt : FTP/FMP,91,91,91,91,91,40,17,12,7.59,0.6,1.71,3.94,7.85,5.82,5.63,6.04,,,,,,,,
Bajaj Finserv Banking and PSU Fund-Reg(G),48214,Bajaj Finserv Mutual Fund,0.61,1.7,4.15,7.9,NIFTY Banking and PSU Debt Index,,,,7.65,8,14,25,5,10,,,,Bajaj Finserv Banking and PSU Fund-Reg(G),Debt : Banking & PSU,26,26,26,26,26,21,16,15,7.56,0.6,1.78,3.98,7.84,5.81,6.33,7.12,,,,,,,,
Samco ELSS Tax Saver Fund-Reg(G),46606,Samco Mutual Fund,8.42,-0.33,0.4,14.79,NIFTY 500 - TRI,,,,11.87,56,2,11,56,56,,,,Samco ELSS Tax Saver Fund-Reg(G),Equity : Tax Saving (ELSS),59,59,59,59,59,54,54,28,21.4,5.34,-2.7,4.79,23.61,18.59,21.53,14.3,,,,,,,,
Tata Gold ETF FoF-Reg(G),48437,Tata Mutual Fund,2.21,5.21,6.09,,Gold-India,,,,,,33,1,4,,,,,Tata Gold ETF FoF-Reg(G),FoFs : Domestic,53,61,60,57,53,41,25,23,15.75,2.77,-0.84,3.91,16.97,12.94,14.04,10.42,,,,,,,,
SBI FMP-78-1170D-Reg(G),47638,SBI Mutual Fund,0.54,1.73,3.84,7.67,CRISIL Medium Duration Debt Index,,,,7.41,55,71,39,57,55,,,,SBI FMP-78-1170D-Reg(G),Debt : FTP/FMP,91,91,91,91,91,40,17,12,7.59,0.6,1.71,3.94,7.85,5.82,5.63,6.04,,,,,,,,
Kotak Nifty SDL Jul 2026 Index Fund-Reg(G),46729,Kotak Mahindra Mutual Fund,0.55,1.72,3.95,7.89,Nifty SDL Jul 2026 Index,,,,7.62,44,51,30,46,45,,,,Kotak Nifty SDL Jul 2026 Index Fund-Reg(G),Debt : Medium to Long Duration,52,57,53,52,52,15,11,11,7.95,0.7,1.68,4.22,8.26,5.62,6.18,6.25,,,,,,,,
ICICI Pru Global Stable Equity Fund(FOF)(G),16718,ICICI Prudential Mutual Fund,0.04,-3.9,6.56,8.55,MSCI World,7.05,8.81,8.76,6.63,44,44,45,30,43,18,14,7,ICICI Pru Global Stable Equity Fund(FOF)(G),FoFs : Overseas,57,58,58,58,57,47,27,24,18.86,2.84,5.95,8.0,20.53,6.03,8.48,7.27,,,,,,,,
Tata Nifty500 Multicap India Manufacturing 50:30:20 Index Fund-Reg(G),48782,Tata Mutual Fund,3.59,-5.07,-0.88,,Nifty500 Multicap India Manufacturing 50:30:20 - TRI,,,,,,101,106,92,,,,,Tata Nifty500 Multicap India Manufacturing 50:30:20 Index Fund-Reg(G),Equity : Index Funds,105,161,140,125,103,51,28,18,20.36,5.49,-3.55,2.97,22.6,16.34,16.95,12.34,,,,,,,,
Canara Rob Income Fund-Reg(G),542,Canara Robeco Mutual Fund,0.78,1.18,3.66,7.73,CRISIL Medium to Long Term Debt Index,4.8,5.44,6.31,7.45,49,18,52,51,49,14,10,6,Canara Rob Income Fund-Reg(G),Debt : Medium to Long Duration,52,57,53,52,52,15,11,11,7.95,0.7,1.68,4.22,8.26,5.62,6.18,6.25,,,,,,,,
Mirae Asset Dynamic Bond Fund-Reg(G),36556,Mirae Asset Mutual Fund,0.51,1.62,3.63,7.21,CRISIL Dynamic Bond Index,4.56,5.32,,6.86,20,21,5,20,20,22,20,,Mirae Asset Dynamic Bond Fund-Reg(G),Debt : Dynamic Bond,22,22,22,22,22,22,21,18,8.36,0.85,1.42,4.2,8.73,6.01,6.42,6.87,0.9,1.85,4.6,,,,,8.67
Bandhan Conservative Hybrid Fund-Reg(G),8465,Bandhan Mutual Fund,1.22,-0.69,2.93,8.94,NIFTY AAA Short Duration Bond Index,6.08,6.49,6.86,8.07,15,13,19,18,15,16,16,15,Bandhan Conservative Hybrid Fund-Reg(G),Hybrid : Debt Oriented (Conservative),19,19,19,19,19,19,18,17,10.21,1.41,0.58,4.21,11.0,8.57,8.88,7.86,,,,,,,,
Canara Rob Dynamic Bond Fund-Reg(G),7792,Canara Robeco Mutual Fund,0.88,0.9,3.48,7.96,CRISIL Dynamic Bond Index,5.3,5.41,6.28,7.5,19,10,21,21,19,19,18,16,Canara Rob Dynamic Bond Fund-Reg(G),Debt : Dynamic Bond,22,22,22,22,22,22,21,18,8.36,0.85,1.42,4.2,8.73,6.01,6.42,6.87,0.9,1.85,4.6,,,,,8.67
Helios Overnight Fund-Reg(G),48295,Helios Mutual Fund,0.54,1.59,3.2,6.6,CRISIL Liquid Overnight Index,,,,6.37,24,2,13,26,24,,,,Helios Overnight Fund-Reg(G),Debt : Overnight,35,35,35,35,35,27,25,3,6.34,0.53,1.57,3.19,6.6,5.89,4.81,5.65,0.54,1.62,3.27,,,,,6.61
UTI Long Duration Fund-Reg(G),47733,UTI Mutual Fund,0.94,1.01,3.97,10.34,NIFTY Long Duration Debt Index,,,,10.57,5,19,24,23,11,,,,UTI Long Duration Fund-Reg(G),Debt : Long Duration,21,24,24,24,20,3,3,2,9.94,1.0,1.6,4.79,10.26,5.7,6.45,6.86,,,,,,,,
Motilal Oswal Nifty 200 Momentum 30 ETF,46325,Motilal Oswal Mutual Fund,4.81,-5.28,-4.86,26.67,Nifty200 Momentum 30 - TRI,,,,25.74,43,51,126,141,44,,,,Motilal Oswal Nifty 200 Momentum 30 ETF,Equity : ETFs,141,169,163,154,141,89,61,25,19.33,4.65,-2.61,4.77,21.76,16.68,17.59,12.52,,,,,,,,
Nippon India Nifty G-Sec Oct 2028 Maturity Index Fund-Reg(G),47629,Nippon India Mutual Fund,0.72,1.61,4.16,7.98,Nifty G-Sec Oct 2028 Index,,,,7.7,39,27,40,28,40,,,,Nippon India Nifty G-Sec Oct 2028 Maturity Index Fund-Reg(G),Debt : Medium to Long Duration,52,57,53,52,52,15,11,11,7.95,0.7,1.68,4.22,8.26,5.62,6.18,6.25,,,,,,,,
Edelweiss Nifty 50 Index Fund-Reg(G),45957,Edelweiss Mutual Fund,3.13,-4.65,2.87,13.3,NIFTY 50 - TRI,12.85,,,10.56,94,131,86,65,93,46,,,Edelweiss Nifty 50 Index Fund-Reg(G),Equity : Index Funds,105,161,140,125,103,51,28,18,20.36,5.49,-3.55,2.97,22.6,16.34,16.95,12.34,,,,,,,,
SBI FMP-50-1843D-Reg(G),45842,SBI Mutual Fund,0.58,1.74,4.06,8.07,CRISIL Medium to Long Term Debt Index,5.49,,,7.78,32,25,36,30,30,36,,,SBI FMP-50-1843D-Reg(G),Debt : FTP/FMP,91,91,91,91,91,40,17,12,7.59,0.6,1.71,3.94,7.85,5.82,5.63,6.04,,,,,,,,
Nippon India Strategic Debt Fund(G),21911,Nippon India Mutual Fund,0.76,1.94,4.36,8.3,CRISIL Medium Duration Debt Index,5.71,1.24,3.34,8.08,4,7,4,4,4,9,13,10,Nippon India Strategic Debt Fund(G),Debt : Medium Duration,30,30,30,30,30,15,13,10,7.57,0.64,1.76,4.01,7.89,6.11,6.1,6.7,,,,,,,,
HDFC NIFTY Realty Index Fund-Reg(G),48654,HDFC Mutual Fund,16.71,4.37,-3.52,,NIFTY REALTY - TRI,,,,,,2,5,113,,,,,HDFC NIFTY Realty Index Fund-Reg(G),Equity : Index Funds,105,161,140,125,103,51,28,18,20.36,5.49,-3.55,2.97,22.6,16.34,16.95,12.34,,,,,,,,
PGIM India Gilt Fund(G),7012,PGIM India Mutual Fund,0.98,1.19,4.19,9.18,CRISIL Dynamic Gilt Index,5.73,6.04,6.91,8.71,13,17,26,17,12,16,14,13,PGIM India Gilt Fund(G),Debt : Gilt,35,36,36,36,35,23,21,21,8.48,0.89,1.4,4.24,8.85,5.91,6.5,7.12,,,,,,,,
ICICI Pru Nifty Infrastructure ETF,45998,ICICI Prudential Mutual Fund,3.46,-6.9,-3.67,21.8,Nifty Infrastructure - TRI,,,,18.53,70,107,132,136,67,,,,ICICI Pru Nifty Infrastructure ETF,Equity : ETFs,141,169,163,154,141,89,61,25,19.33,4.65,-2.61,4.77,21.76,16.68,17.59,12.52,,,,,,,,
ICICI Pru Debt Mgmt Fund(FOF)(G),1707,ICICI Prudential Mutual Fund,0.65,1.78,4.06,8.17,CRISIL Composite Bond Index,6.44,6.69,7.65,7.91,50,50,13,32,50,33,22,18,ICICI Pru Debt Mgmt Fund(FOF)(G),FoFs : Domestic,53,61,60,57,53,41,25,23,15.75,2.77,-0.84,3.91,16.97,12.94,14.04,10.42,,,,,,,,
SBI FMP-43-1616D-Reg(G),45525,SBI Mutual Fund,0.51,1.67,3.72,7.65,CRISIL Medium Duration Debt Index,5.59,,,7.4,56,79,53,69,56,29,,,SBI FMP-43-1616D-Reg(G),Debt : FTP/FMP,91,91,91,91,91,40,17,12,7.59,0.6,1.71,3.94,7.85,5.82,5.63,6.04,,,,,,,,
Bank of India Credit Risk Fund-Reg(G),30390,Bank of India Mutual Fund,0.42,1.51,2.49,6.21,CRISIL Credit Risk Debt Index,39.57,10.49,,5.99,15,15,13,15,15,1,1,,Bank of India Credit Risk Fund-Reg(G),Debt : Credit Risk,15,15,15,15,15,15,15,10,7.84,0.65,1.82,4.05,8.11,8.79,6.48,6.43,,,,,,,,
Sundaram Global Brand Fund(G),3005,Sundaram Mutual Fund,5.45,7.84,9.73,15.6,MSCI AC World Index,7.98,12.84,8.98,14.68,32,13,19,19,35,17,7,6,Sundaram Global Brand Fund(G),FoFs : Overseas,57,58,58,58,57,47,27,24,18.86,2.84,5.95,8.0,20.53,6.03,8.48,7.27,,,,,,,,
