Sundaram Multi Cap Fund(G),2370,Sundaram Mutual Fund,5.26,-3.08,4.74,21.5,Nifty500 Multicap 50:25:25 - TRI,16.94,21.13,15.34,19.81,27,25,24,23,27,20,8,4,Sundaram Multi Cap Fund(G),Equity : Multi Cap,36,41,40,38,36,27,20,14,23.98,5.77,-1.79,6.71,25.93,18.39,20.33,14.84,,,,,,,,
Mirae Asset Healthcare Fund-Reg(G),39122,Mirae Asset Mutual Fund,4.63,-1.26,16.71,39.22,BSE Health Care - TRI,19.41,28.56,,36.1,10,7,13,10,9,8,4,,Mirae Asset Healthcare Fund-Reg(G),Equity : Sectoral - Pharma,14,16,16,16,14,10,9,3,37.83,4.23,-0.13,18.11,41.01,21.66,27.59,13.83,5.2,2.19,21.51,46.18,22.83,27.88,,42.98
HSBC Ultra Short Duration Fund-Reg(G),44328,HSBC Mutual Fund,0.53,1.78,3.56,7.4,NIFTY Ultra Short Duration Debt Index,6.25,,,7.16,9,9,7,7,9,5,,,HSBC Ultra Short Duration Fund-Reg(G),Debt : Ultra Short Duration,24,25,25,24,24,24,21,13,6.88,0.51,1.72,3.42,7.11,5.95,5.33,6.24,,,,,,,,
Canara Rob Mid Cap Fund-Reg(G),46001,Canara Robeco Mutual Fund,7.85,-1.84,5.32,31.1,BSE 150 MidCap - TRI,,,,30.16,16,9,17,16,17,,,,Canara Rob Mid Cap Fund-Reg(G),Equity : Mid Cap,30,30,30,30,30,25,23,20,30.9,7.18,-1.12,5.91,32.39,23.2,26.97,17.43,5.88,-3.16,4.77,31.01,24.71,29.37,,29.43
HDFC NIFTY Bank ETF,33563,HDFC Mutual Fund,3.51,-1.19,3.64,9.68,NIFTY BANK - TRI,14.23,,,7.55,130,98,36,62,130,47,,,HDFC NIFTY Bank ETF,Equity : ETFs,141,169,163,154,141,89,61,25,19.33,4.65,-2.61,4.77,21.76,16.68,17.59,12.52,,,,,,,,
Nippon India ETF Nifty PSU Bank BeES,3722,Nippon India Mutual Fund,3.94,1.64,-9.26,19.1,NIFTY PSU BANK - TRI,38.97,22.26,5.46,18.55,68,66,23,153,78,3,11,23,Nippon India ETF Nifty PSU Bank BeES,Equity : ETFs,141,169,163,154,141,89,61,25,19.33,4.65,-2.61,4.77,21.76,16.68,17.59,12.52,,,,,,,,
HDFC Gold ETF FoF(G),15381,HDFC Mutual Fund,2.51,4.08,6.09,22.06,Gold-India,14.77,13.68,9.63,18.48,5,1,7,10,10,7,3,5,HDFC Gold ETF FoF(G),Gold : MFs,16,17,16,16,16,10,10,10,18.19,1.7,3.75,5.1,21.48,14.77,13.58,9.53,,,,,,,,
Aditya Birla SL Nifty Bank ETF,34434,Aditya Birla Sun Life Mutual Fund,3.51,-1.2,3.64,9.68,NIFTY BANK - TRI,14.27,10.45,,7.55,129,101,39,61,129,44,54,,Aditya Birla SL Nifty Bank ETF,Equity : ETFs,141,169,163,154,141,89,61,25,19.33,4.65,-2.61,4.77,21.76,16.68,17.59,12.52,,,,,,,,
Kotak Pioneer Fund-Reg(G),43927,Kotak Mahindra Mutual Fund,6.08,-0.27,6.43,32.5,NIFTY 500 - TRI,18.77,24.71,,31.36,8,26,16,19,8,17,7,,Kotak Pioneer Fund-Reg(G),Equity : Thematic,56,80,76,64,54,36,18,9,23.24,5.19,-3.36,2.84,25.08,19.14,23.06,14.72,,,,,,,,
UTI Focused Fund-Reg(G),45685,UTI Mutual Fund,3.84,-7.62,0.66,18.44,NIFTY 500 - TRI,15.21,,,16.1,39,36,46,43,40,24,,,UTI Focused Fund-Reg(G),Equity : Flexi Cap,46,48,48,48,46,33,26,19,22.65,5.59,-2.55,5.16,24.67,17.29,19.25,14.36,,,,,,,,
WOC Mid Cap Fund-Reg(G),46769,WhiteOak Capital Mutual Fund,8.23,2.91,13.54,35.72,BSE 150 MidCap - TRI,,,,35.03,7,8,4,3,8,,,,WOC Mid Cap Fund-Reg(G),Equity : Mid Cap,30,30,30,30,30,25,23,20,30.9,7.18,-1.12,5.91,32.39,23.2,26.97,17.43,5.88,-3.16,4.77,31.01,24.71,29.37,,29.43
Kotak Business Cycle Fund-Reg(G),46472,Kotak Mahindra Mutual Fund,5.54,-1.21,8.04,31.39,NIFTY 500 - TRI,,,,28.99,12,30,19,13,11,,,,Kotak Business Cycle Fund-Reg(G),Equity : Thematic,56,80,76,64,54,36,18,9,23.24,5.19,-3.36,2.84,25.08,19.14,23.06,14.72,,,,,,,,
SBI Long Duration Fund-Reg(G),46864,SBI Mutual Fund,0.97,1.12,4.43,11.31,CRISIL Long Duration Debt Index,,,,10.99,3,15,21,19,2,,,,SBI Long Duration Fund-Reg(G),Debt : Long Duration,21,24,24,24,20,3,3,2,9.94,1.0,1.6,4.79,10.26,5.7,6.45,6.86,,,,,,,,
HSBC Money Market Fund-Reg(G),621,HSBC Mutual Fund,0.54,1.8,3.61,7.48,Nifty Money Market Index,6.09,5.3,6.71,7.24,12,11,13,12,12,14,14,8,HSBC Money Market Fund-Reg(G),Debt : Money Market,22,22,22,22,22,19,16,13,7.17,0.54,1.78,3.57,7.42,6.3,5.67,6.6,,,,,,,,
UTI Short Duration Fund-Reg(G),3656,UTI Mutual Fund,0.62,1.82,3.99,7.88,CRISIL Short Duration Debt Index,6.13,7.48,6.33,7.72,5,16,8,13,9,5,2,14,UTI Short Duration Fund-Reg(G),Debt : Short Duration,25,29,26,26,25,23,21,19,7.18,0.6,1.74,3.86,7.44,6.05,6.14,6.68,,,,,,,,
ICICI Pru Constant Maturity Gilt Fund(G),30426,ICICI Prudential Mutual Fund,0.99,1.56,4.75,9.12,Crisil 10 Yr Gilt Index,5.73,7.11,8.14,8.85,4,6,1,2,4,3,1,3,ICICI Pru Constant Maturity Gilt Fund(G),Debt : Gilt (10 Yr Constant Duration),6,6,6,6,6,4,4,4,8.9,1.01,1.51,4.64,9.19,5.67,6.63,7.89,,,,,,,,
Nippon India ETF Nifty IT,44506,Nippon India Mutual Fund,9.93,8.71,31.62,29.7,NIFTY IT - TRI,9.3,,,28.7,31,13,14,8,29,84,,,Nippon India ETF Nifty IT,Equity : ETFs,141,169,163,154,141,89,61,25,19.33,4.65,-2.61,4.77,21.76,16.68,17.59,12.52,,,,,,,,
Axis Business Cycles Fund-Reg(G),47580,Axis Mutual Fund,6.17,-2.25,4.56,24.6,NIFTY 500 - TRI,,,,21.56,33,25,24,27,28,,,,Axis Business Cycles Fund-Reg(G),Equity : Thematic,56,80,76,64,54,36,18,9,23.24,5.19,-3.36,2.84,25.08,19.14,23.06,14.72,,,,,,,,
Axis Balanced Advantage Fund-Reg(G),37918,Axis Mutual Fund,2.86,-0.44,6.65,20.48,NIFTY 50 Hybrid Composite Debt 50:50 Index,12.84,12.59,,18.39,2,15,12,4,2,7,8,,Axis Balanced Advantage Fund-Reg(G),Hybrid : Dynamic Asset Allocation,30,33,33,32,29,21,18,11,13.97,2.86,-1.26,3.9,15.52,12.34,12.69,10.08,,,,,,,,
Aditya Birla SL Quant Fund-Reg(G),48491,Aditya Birla Sun Life Mutual Fund,4.13,-7.45,,,NIFTY 200 - TRI,,,,,,49,67,,,,,,Aditya Birla SL Quant Fund-Reg(G),Equity : Thematic,56,80,76,64,54,36,18,9,23.24,5.19,-3.36,2.84,25.08,19.14,23.06,14.72,,,,,,,,
HSBC Infrastructure Fund-Reg(G),594,HSBC Mutual Fund,6.56,-2.4,-2.15,34.62,Nifty Infrastructure - TRI,28.0,26.81,17.66,31.14,7,7,5,14,7,10,13,5,HSBC Infrastructure Fund-Reg(G),Equity : Sectoral - Infrastructure,19,19,19,19,19,19,19,18,30.13,6.06,-3.55,-1.2,33.08,28.2,27.82,16.49,,,,,,,,
Kotak Nifty 50 ETF,8469,Kotak Mahindra Mutual Fund,3.17,-4.5,3.2,14.23,NIFTY 50 - TRI,13.69,15.72,12.85,11.44,101,130,92,78,98,66,43,14,Kotak Nifty 50 ETF,Equity : ETFs,141,169,163,154,141,89,61,25,19.33,4.65,-2.61,4.77,21.76,16.68,17.59,12.52,,,,,,,,
Navi Nifty 50 Index Fund-Reg(G),45614,Navi Mutual Fund,3.15,-4.59,3.02,13.78,NIFTY 50 - TRI,13.35,,,11.02,78,122,76,52,78,29,,,Navi Nifty 50 Index Fund-Reg(G),Equity : Index Funds,105,161,140,125,103,51,28,18,20.36,5.49,-3.55,2.97,22.6,16.34,16.95,12.34,,,,,,,,
Edelweiss Multi Cap Fund-Reg(G),48147,Edelweiss Mutual Fund,7.15,-0.8,8.94,33.22,Nifty500 Multicap 50:25:25 - TRI,,,,30.78,7,9,12,10,6,,,,Edelweiss Multi Cap Fund-Reg(G),Equity : Multi Cap,36,41,40,38,36,27,20,14,23.98,5.77,-1.79,6.71,25.93,18.39,20.33,14.84,,,,,,,,
Edelweiss US Technology Equity FOF-Reg(G),44630,Edelweiss Mutual Fund,10.86,21.77,17.08,37.65,Russell 1000 Equal Weighted Technology Index,12.22,,,35.97,6,4,6,6,7,9,,,Edelweiss US Technology Equity FOF-Reg(G),FoFs : Overseas,57,58,58,58,57,47,27,24,18.86,2.84,5.95,8.0,20.53,6.03,8.48,7.27,,,,,,,,
Mirae Asset NYSE FANG+ ETF,45379,Mirae Asset Mutual Fund,7.96,19.19,17.16,52.8,NYSE FANG+ TRI,25.96,,,59.61,1,25,2,14,1,5,,,Mirae Asset NYSE FANG+ ETF,Equity : ETFs,141,169,163,154,141,89,61,25,19.33,4.65,-2.61,4.77,21.76,16.68,17.59,12.52,,,,,,,,
Canara Rob Focused Equity Fund-Reg(G),45510,Canara Robeco Mutual Fund,4.96,-1.16,9.52,27.79,BSE 500 - TRI,17.53,,,25.47,13,26,13,8,12,17,,,Canara Rob Focused Equity Fund-Reg(G),Equity : Multi Cap,36,41,40,38,36,27,20,14,23.98,5.77,-1.79,6.71,25.93,18.39,20.33,14.84,3.22,-4.77,2.44,19.32,16.79,19.39,,18.03
DSP Corp Bond Fund-Reg(G),37709,DSP Mutual Fund,0.54,1.86,3.96,7.74,CRISIL Corporate Bond Index,5.33,5.77,,7.41,19,21,11,20,17,20,17,,DSP Corp Bond Fund-Reg(G),Debt : Corporate Bond,21,21,21,21,21,20,18,12,7.79,0.66,1.85,4.19,8.09,5.86,6.41,7.06,,,,,,,,
ICICI Pru BSE Liquid Rate ETF,35122,ICICI Prudential Mutual Fund,0.52,1.55,3.14,6.47,BSE Liquid Rate Index,5.76,4.5,,6.22,14,20,16,20,16,7,4,,ICICI Pru BSE Liquid Rate ETF,Debt : ETFs,22,32,30,27,22,15,6,1,7.38,0.72,1.54,4.0,7.79,5.75,5.16,4.87,,,,,,,,
Quant Large Cap Fund-Reg(G),46678,Quant Mutual Fund,0.43,-8.0,-3.01,19.69,NIFTY 100 - TRI,,,,14.2,29,37,36,36,17,,,,Quant Large Cap Fund-Reg(G),Equity : Large Cap,36,38,38,37,36,34,31,28,17.34,3.93,-4.1,3.37,19.86,15.23,16.7,12.96,,,,,,,,
Mahindra Manulife Large & Mid Cap Fund-Reg(G),43915,Mahindra Manulife Mutual Fund,5.2,-4.27,0.99,19.17,NIFTY LargeMidcap 250 - TRI,17.58,,,17.96,22,22,27,28,25,18,,,Mahindra Manulife Large & Mid Cap Fund-Reg(G),Equity : Large & Mid Cap,27,31,30,29,26,26,24,18,25.81,6.08,-1.98,5.44,27.68,19.37,21.61,15.36,,,,,,,,
DSP Focus Fund-Reg(G),8463,DSP Mutual Fund,3.46,-4.2,4.8,21.96,NIFTY 500 - TRI,16.95,15.77,12.87,20.69,25,36,33,22,26,19,19,13,DSP Focus Fund-Reg(G),Equity : Multi Cap,36,41,40,38,36,27,20,14,23.98,5.77,-1.79,6.71,25.93,18.39,20.33,14.84,,,,,,,,
Tata Treasury Advantage Fund-Reg(G),3205,Tata Mutual Fund,0.54,1.83,3.64,7.45,CRISIL Low Duration Debt Index,6.07,5.86,6.29,7.2,6,6,6,7,6,9,7,13,Tata Treasury Advantage Fund-Reg(G),Debt : Low Duration,20,20,20,20,20,20,20,18,7.16,0.51,1.8,3.62,7.4,6.04,5.99,6.5,0.6,1.89,3.88,,,,,7.79
SBI Gold-Reg(G),14666,SBI Mutual Fund,2.38,4.07,6.27,22.62,Gold-London Bullion Market association (LBMA),15.03,13.7,9.71,19.09,2,5,8,8,1,1,2,1,SBI Gold-Reg(G),Gold : MFs,16,17,16,16,16,10,10,10,18.19,1.7,3.75,5.1,21.48,14.77,13.58,9.53,,,,,,,,
DSP BSE Liquid Rate ETF,48724,DSP Mutual Fund,0.52,1.54,3.11,,BSE Liquid Rate Index,,,,,,21,20,22,,,,,DSP BSE Liquid Rate ETF,Debt : ETFs,22,32,30,27,22,15,6,1,7.38,0.72,1.54,4.0,7.79,5.75,5.16,4.87,,,,,,,,
HDFC Infrastructure Fund(G),4253,HDFC Mutual Fund,5.64,-3.52,-0.56,28.9,BSE India Infrastructure Index - TRI,33.54,25.64,11.68,25.87,13,10,11,8,12,3,15,18,HDFC Infrastructure Fund(G),Equity : Sectoral - Infrastructure,19,19,19,19,19,19,19,18,30.13,6.06,-3.55,-1.2,33.08,28.2,27.82,16.49,1.89,-8.65,-3.67,,,,,-4.62
ICICI Pru Housing Opp Fund-Reg(G),46546,ICICI Prudential Mutual Fund,3.95,-3.27,2.31,19.42,Nifty Housing - TRI,,,,17.19,42,52,30,35,43,,,,ICICI Pru Housing Opp Fund-Reg(G),Equity : Thematic,56,80,76,64,54,36,18,9,23.24,5.19,-3.36,2.84,25.08,19.14,23.06,14.72,,,,,,,,
UTI-Nifty Next 50 ETF,37338,UTI Mutual Fund,5.63,-4.89,-1.23,36.88,NIFTY NEXT 50,20.61,21.18,,34.22,11,39,119,128,11,17,17,,UTI-Nifty Next 50 ETF,Equity : ETFs,141,169,163,154,141,89,61,25,19.33,4.65,-2.61,4.77,21.76,16.68,17.59,12.52,4.21,-5.1,-1.27,34.81,19.47,20.09,,33.33
Mirae Asset Flexi Cap Fund-Reg(G),47596,Mirae Asset Mutual Fund,5.71,-1.71,4.9,20.32,NIFTY 500 - TRI,,,,19.7,26,23,14,28,30,,,,Mirae Asset Flexi Cap Fund-Reg(G),Equity : Flexi Cap,46,48,48,48,46,33,26,19,22.65,5.59,-2.55,5.16,24.67,17.29,19.25,14.36,,,,,,,,
Kotak Manufacture in India Fund-Reg(G),46107,Kotak Mahindra Mutual Fund,4.88,-3.93,-1.11,30.22,Nifty India Manufacturing - TRI,,,,26.69,16,41,41,48,14,,,,Kotak Manufacture in India Fund-Reg(G),Equity : Thematic,56,80,76,64,54,36,18,9,23.24,5.19,-3.36,2.84,25.08,19.14,23.06,14.72,,,,,,,,
Bandhan Multi Cap Fund-Reg(G),45867,Bandhan Mutual Fund,4.18,-4.81,2.87,23.11,Nifty500 Multicap 50:25:25 - TRI,19.48,,,21.01,24,32,37,33,23,11,,,Bandhan Multi Cap Fund-Reg(G),Equity : Multi Cap,36,41,40,38,36,27,20,14,23.98,5.77,-1.79,6.71,25.93,18.39,20.33,14.84,,,,,,,,
HSBC Arbitrage Fund-Reg(G),29550,HSBC Mutual Fund,0.45,1.53,3.27,7.36,Nifty 50 Arbitrage,6.02,5.3,5.88,7.04,19,20,20,19,18,16,9,7,HSBC Arbitrage Fund-Reg(G),Hybrid : Arbitrage,26,27,27,26,26,24,22,14,7.12,0.47,1.58,3.32,7.41,6.03,5.11,5.84,0.73,1.8,3.14,7.54,6.53,5.19,,7.47
Edelweiss Flexi Cap Fund-Reg(G),31778,Edelweiss Mutual Fund,5.87,-2.28,6.26,30.46,NIFTY 500 - TRI,19.92,20.85,,27.84,11,21,21,15,10,10,7,,Edelweiss Flexi Cap Fund-Reg(G),Equity : Flexi Cap,46,48,48,48,46,33,26,19,22.65,5.59,-2.55,5.16,24.67,17.29,19.25,14.36,,,,,,,,
Sundaram Multi Asset Allocation Fund-Reg(G),48460,Sundaram Mutual Fund,3.12,-2.2,3.26,,NIFTY 500 - TRI,,,,,,11,21,15,,,,,Sundaram Multi Asset Allocation Fund-Reg(G),Hybrid : Multi Asset Allocation,17,26,26,25,17,10,7,7,16.35,2.98,-1.09,3.77,17.72,14.83,17.81,12.45,,,,,,,,
LIC MF Nifty 8-13 yr G-Sec ETF,31581,LIC Mutual Fund,1.03,1.63,4.89,9.45,Nifty 8-13 yr G-Sec,5.92,6.32,,9.09,5,6,11,5,6,5,2,,LIC MF Nifty 8-13 yr G-Sec ETF,Debt : ETFs,22,32,30,27,22,15,6,1,7.38,0.72,1.54,4.0,7.79,5.75,5.16,4.87,0.88,1.23,4.68,9.41,6.1,6.61,,9.67
ITI Small Cap Fund-Reg(G),44399,ITI Mutual Fund,9.67,1.23,9.07,39.08,Nifty Smallcap 250 - TRI,26.05,,,36.53,5,6,7,11,4,8,,,ITI Small Cap Fund-Reg(G),Equity : Small Cap,27,29,28,28,26,23,19,13,29.5,8.09,-0.33,9.12,30.17,23.73,32.15,18.77,,,,,,,,
Tata Large Cap Fund-Reg(G),3281,Tata Mutual Fund,3.99,-4.17,1.17,16.99,NIFTY 100 - TRI,14.9,16.33,12.4,14.95,25,21,21,31,29,18,18,17,Tata Large Cap Fund-Reg(G),Equity : Large Cap,36,38,38,37,36,34,31,28,17.34,3.93,-4.1,3.37,19.86,15.23,16.7,12.96,,,,,,,,
SBI CRISIL IBX Gilt Index - June 2036 Fund-Reg(G),46941,SBI Mutual Fund,1.19,1.85,4.89,10.34,CRISIL IBX Gilt Index - June 2036,,,,9.96,11,2,9,12,10,,,,SBI CRISIL IBX Gilt Index - June 2036 Fund-Reg(G),Debt : Long Duration,21,24,24,24,20,3,3,2,9.94,1.0,1.6,4.79,10.26,5.7,6.45,6.86,,,,,,,,
Franklin India Balanced Advantage Fund-Reg(G),46625,Franklin Templeton Mutual Fund,3.0,0.5,4.9,17.01,NIFTY 50 Hybrid Composite Debt 50:50 Index,,,,15.56,9,14,7,12,9,,,,Franklin India Balanced Advantage Fund-Reg(G),Hybrid : Dynamic Asset Allocation,30,33,33,32,29,21,18,11,13.97,2.86,-1.26,3.9,15.52,12.34,12.69,10.08,,,,,,,,
Invesco India Flexi Cap Fund-Reg(G),45945,Invesco Mutual Fund,8.84,1.79,12.9,39.04,BSE 500 - TRI,,,,36.73,3,3,5,2,3,,,,Invesco India Flexi Cap Fund-Reg(G),Equity : Flexi Cap,46,48,48,48,46,33,26,19,22.65,5.59,-2.55,5.16,24.67,17.29,19.25,14.36,3.22,-4.77,2.44,19.32,16.79,19.39,,18.03
Tata India Consumer Fund-Reg(G),33728,Tata Mutual Fund,7.34,-2.59,13.13,31.5,Nifty India Consumption - TRI,21.95,22.23,,27.03,2,2,2,1,4,2,3,,Tata India Consumer Fund-Reg(G),Equity : Thematic - Consumption,16,18,18,17,16,13,13,8,21.52,4.16,-6.41,4.92,25.31,19.22,19.74,14.69,,,,,,,,
Kotak MNC Fund-Reg(G),49046,Kotak Mahindra Mutual Fund,3.72,,,,NIFTY MNC - TRI,,,,,,3,,,,,,,Kotak MNC Fund-Reg(G),Equity : Thematic - MNC,5,6,5,5,5,4,4,3,15.76,3.63,-4.2,-0.23,17.97,12.73,16.42,11.63,,,,,,,,
Tata Infrastructure Fund-Reg(G),3254,Tata Mutual Fund,4.11,-6.78,-7.11,27.59,BSE India Infrastructure Index - TRI,26.39,27.83,16.62,26.15,12,19,19,19,15,13,11,12,Tata Infrastructure Fund-Reg(G),Equity : Sectoral - Infrastructure,19,19,19,19,19,19,19,18,30.13,6.06,-3.55,-1.2,33.08,28.2,27.82,16.49,1.89,-8.65,-3.67,,,,,-4.62
Baroda BNP Paribas Large Cap Fund-Reg(G),23,Baroda BNP Paribas Mutual Fund,3.97,-4.25,2.84,24.33,NIFTY 100 - TRI,17.45,17.74,13.69,21.59,5,22,24,23,5,7,8,9,Baroda BNP Paribas Large Cap Fund-Reg(G),Equity : Large Cap,36,38,38,37,36,34,31,28,17.34,3.93,-4.1,3.37,19.86,15.23,16.7,12.96,,,,,,,,
ICICI Pru Commodities Fund(G),41999,ICICI Prudential Mutual Fund,3.56,-4.36,-5.83,14.56,NIFTY COMMODITIES - TRI,18.82,31.5,,11.82,53,60,44,56,51,15,1,,ICICI Pru Commodities Fund(G),Equity : Thematic,56,80,76,64,54,36,18,9,23.24,5.19,-3.36,2.84,25.08,19.14,23.06,14.72,,,,,,,,
Templeton India Equity Income Fund(G),3367,Franklin Templeton Mutual Fund,3.19,-4.2,2.77,25.98,NIFTY 500 - TRI,20.38,25.14,15.85,23.44,3,7,4,6,3,5,2,1,Templeton India Equity Income Fund(G),Equity : Thematic - Dividend Yield,9,10,10,9,9,8,6,5,21.9,3.78,-4.62,2.84,24.09,20.58,23.5,14.55,,,,,,,,
Kotak Infra & Eco Reform Fund(G),4228,Kotak Mahindra Mutual Fund,9.09,-2.25,-0.5,38.78,Nifty Infrastructure - TRI,29.67,28.89,17.06,34.93,6,2,3,7,6,8,8,11,Kotak Infra & Eco Reform Fund(G),Equity : Sectoral - Infrastructure,19,19,19,19,19,19,19,18,30.13,6.06,-3.55,-1.2,33.08,28.2,27.82,16.49,,,,,,,,
Tata Banking & Financial Services Fund-Reg(G),33726,Tata Mutual Fund,3.4,-2.97,4.93,11.08,Nifty Financial Services - TRI,16.53,12.9,,10.65,14,18,13,11,14,6,5,,Tata Banking & Financial Services Fund-Reg(G),Equity : Sectoral - Financial Services,18,21,21,20,18,14,11,8,13.42,4.3,-2.48,4.9,13.91,16.29,12.73,12.64,,,,,,,,
Parag Parikh Liquid Fund-Reg(G),38735,PPFAS Mutual Fund,0.53,1.65,3.35,6.94,CRISIL Liquid Debt Index,5.97,4.93,,6.7,35,36,35,35,35,34,32,,Parag Parikh Liquid Fund-Reg(G),Debt : Liquid,37,38,37,37,37,35,34,29,6.99,0.55,1.72,3.48,7.27,6.26,5.21,6.22,,,,,,,,
DSP Multi Asset Allocation Fund-Reg(G),48206,DSP Mutual Fund,1.73,-0.11,5.81,18.97,NIFTY 500 - TRI,,,,18.35,5,22,6,4,7,,,,DSP Multi Asset Allocation Fund-Reg(G),Hybrid : Multi Asset Allocation,17,26,26,25,17,10,7,7,16.35,2.98,-1.09,3.77,17.72,14.83,17.81,12.45,,,,,,,,
Motilal Oswal Nifty India Defence Index Fund-Reg(G),48892,Motilal Oswal Mutual Fund,14.45,3.01,,,Nifty India Defence - TRI,,,,,,4,8,,,,,,Motilal Oswal Nifty India Defence Index Fund-Reg(G),Equity : Index Funds,105,161,140,125,103,51,28,18,20.36,5.49,-3.55,2.97,22.6,16.34,16.95,12.34,,,,,,,,
Quant Quantamental Fund-Reg(G),45480,Quant Mutual Fund,1.41,-10.76,-8.72,19.48,NIFTY 200 - TRI,26.72,,,15.06,47,75,72,61,42,7,,,Quant Quantamental Fund-Reg(G),Equity : Thematic,56,80,76,64,54,36,18,9,23.24,5.19,-3.36,2.84,25.08,19.14,23.06,14.72,,,,,,,,
DSP Overnight Fund-Reg(G),41945,DSP Mutual Fund,0.53,1.59,3.23,6.65,CRISIL Liquid Overnight Index,5.92,4.87,,6.41,11,14,11,11,11,7,5,,DSP Overnight Fund-Reg(G),Debt : Overnight,35,35,35,35,35,27,25,3,6.34,0.53,1.57,3.19,6.6,5.89,4.81,5.65,0.54,1.62,3.27,,,,,6.61
Kotak Special Opportunities Fund-Reg(G),48809,Kotak Mahindra Mutual Fund,4.16,-4.66,,,NIFTY 500 - TRI,,,,,,48,47,,,,,,Kotak Special Opportunities Fund-Reg(G),Equity : Thematic,56,80,76,64,54,36,18,9,23.24,5.19,-3.36,2.84,25.08,19.14,23.06,14.72,,,,,,,,
Helios Flexi Cap Fund-Reg(G),48299,Helios Mutual Fund,7.61,1.96,8.49,32.33,NIFTY 500 - TRI,,,,30.49,7,7,4,8,8,,,,Helios Flexi Cap Fund-Reg(G),Equity : Flexi Cap,46,48,48,48,46,33,26,19,22.65,5.59,-2.55,5.16,24.67,17.29,19.25,14.36,,,,,,,,
Parag Parikh Conservative Hybrid Fund-Reg(G),45338,PPFAS Mutual Fund,0.68,0.84,4.24,13.12,CRISIL Hybrid 85+15 - Conservative Index,11.07,,,12.52,2,18,6,10,2,2,,,Parag Parikh Conservative Hybrid Fund-Reg(G),Hybrid : Debt Oriented (Conservative),19,19,19,19,19,19,18,17,10.21,1.41,0.58,4.21,11.0,8.57,8.88,7.86,,,,,,,,
Nippon India Innovation Fund-Reg(G),48169,Nippon India Mutual Fund,4.62,-6.64,0.04,25.77,NIFTY 500 - TRI,,,,22.44,28,43,66,43,21,,,,Nippon India Innovation Fund-Reg(G),Equity : Thematic,56,80,76,64,54,36,18,9,23.24,5.19,-3.36,2.84,25.08,19.14,23.06,14.72,,,,,,,,
Motilal Oswal Multi Cap Fund-Reg(G),48489,Motilal Oswal Mutual Fund,14.58,12.52,39.05,,Nifty500 Multicap 50:25:25 - TRI,,,,,,1,1,1,,,,,Motilal Oswal Multi Cap Fund-Reg(G),Equity : Multi Cap,36,41,40,38,36,27,20,14,23.98,5.77,-1.79,6.71,25.93,18.39,20.33,14.84,,,,,,,,
ICICI Pru PSU Equity Fund-Reg(G),46106,ICICI Prudential Mutual Fund,1.99,-4.93,-3.85,30.48,BSE PSU - TRI,,,,27.45,32,155,93,115,21,,,,ICICI Pru PSU Equity Fund-Reg(G),Equity : Index Funds,105,161,140,125,103,51,28,18,20.36,5.49,-3.55,2.97,22.6,16.34,16.95,12.34,2.64,-4.24,-7.05,30.0,38.33,28.45,,28.25
Nippon India ETF Nifty 8-13 yr G-Sec Long Term Gilt,35459,Nippon India Mutual Fund,1.04,1.65,4.92,9.5,Nifty 8-13 yr G-Sec,5.91,6.34,,9.14,3,4,9,3,4,6,1,,Nippon India ETF Nifty 8-13 yr G-Sec Long Term Gilt,Debt : ETFs,22,32,30,27,22,15,6,1,7.38,0.72,1.54,4.0,7.79,5.75,5.16,4.87,0.88,1.23,4.68,9.41,6.1,6.61,,9.67
Franklin India Liquid Fund-Super Inst(G),3406,Franklin Templeton Mutual Fund,0.56,1.75,3.55,7.41,Nifty Liquid Fund Index,6.34,5.33,6.4,7.13,3,5,3,2,2,9,5,2,Franklin India Liquid Fund-Super Inst(G),Debt : Liquid,37,38,37,37,37,35,34,29,6.99,0.55,1.72,3.48,7.27,6.26,5.21,6.22,,,,,,,,
SBI Credit Risk Fund-Reg(G),2770,SBI Mutual Fund,0.67,1.8,3.87,8.04,NIFTY Credit Risk Bond Index,6.78,7.08,7.48,7.77,9,7,7,9,8,6,7,3,SBI Credit Risk Fund-Reg(G),Debt : Credit Risk,15,15,15,15,15,15,15,10,7.84,0.65,1.82,4.05,8.11,8.79,6.48,6.43,,,,,,,,
Edelweiss Nifty PSU Bond Plus SDL Apr 2027 50:50 Index Fund-Reg(G),45387,Edelweiss Mutual Fund,0.57,1.81,4.02,8.05,Nifty PSU Bond Plus SDL Apr 2027 50:50 Index,5.42,,,7.65,42,47,9,40,37,7,,,Edelweiss Nifty PSU Bond Plus SDL Apr 2027 50:50 Index Fund-Reg(G),Debt : Medium to Long Duration,52,57,53,52,52,15,11,11,7.95,0.7,1.68,4.22,8.26,5.62,6.18,6.25,,,,,,,,
Bandhan Balanced Advantage Fund-Reg(G),30671,Bandhan Mutual Fund,3.77,0.94,6.0,16.67,NIFTY 50 Hybrid Composite Debt 50:50 Index,9.79,11.29,8.81,15.23,11,7,4,7,11,19,13,8,Bandhan Balanced Advantage Fund-Reg(G),Hybrid : Dynamic Asset Allocation,30,33,33,32,29,21,18,11,13.97,2.86,-1.26,3.9,15.52,12.34,12.69,10.08,,,,,,,,
SBI CRISIL IBX Gilt Index - Apr 2029 Fund-Reg(G),46971,SBI Mutual Fund,0.93,1.63,4.42,8.42,CRISIL IBX Gilt Index - April 2029,,,,8.05,21,5,39,13,19,,,,SBI CRISIL IBX Gilt Index - Apr 2029 Fund-Reg(G),Debt : Medium to Long Duration,52,57,53,52,52,15,11,11,7.95,0.7,1.68,4.22,8.26,5.62,6.18,6.25,,,,,,,,
HSBC Overnight Fund-Reg(G),42784,HSBC Mutual Fund,0.53,1.58,3.21,6.63,Nifty 1D Rate Index,5.88,4.81,,6.39,16,26,17,17,16,15,12,,HSBC Overnight Fund-Reg(G),Debt : Overnight,35,35,35,35,35,27,25,3,6.34,0.53,1.57,3.19,6.6,5.89,4.81,5.65,0.54,1.62,3.27,6.75,6.04,4.96,,6.71
Franklin India Money Market Fund(G),3361,Franklin Templeton Mutual Fund,0.56,1.84,3.69,7.65,Nifty Money Market Index,6.38,5.75,6.82,7.41,9,2,5,5,9,9,9,4,Franklin India Money Market Fund(G),Debt : Money Market,22,22,22,22,22,19,16,13,7.17,0.54,1.78,3.57,7.42,6.3,5.67,6.6,,,,,,,,
Union Flexi Cap Fund-Reg(G),14559,Union Mutual Fund,6.6,-0.92,5.75,20.1,BSE 500 - TRI,15.32,20.0,12.66,18.35,31,14,12,18,32,23,9,16,Union Flexi Cap Fund-Reg(G),Equity : Flexi Cap,46,48,48,48,46,33,26,19,22.65,5.59,-2.55,5.16,24.67,17.29,19.25,14.36,3.22,-4.77,2.44,19.32,16.79,19.39,,18.03
Edelweiss Aggressive Hybrid Fund-Reg(G),7922,Edelweiss Mutual Fund,3.98,-2.06,5.64,21.74,CRISIL Hybrid 35+65 - Aggressive Index,17.62,18.01,12.85,20.89,4,4,20,5,3,4,3,3,Edelweiss Aggressive Hybrid Fund-Reg(G),Hybrid : Multi Asset Allocation,17,26,26,25,17,10,7,7,16.35,2.98,-1.09,3.77,17.72,14.83,17.81,12.45,,,,,,,,
ICICI Pru Bharat 22 FOF-(G),40232,ICICI Prudential Mutual Fund,1.71,-4.65,-0.92,24.81,BSE Bharat 22 Index,35.43,26.28,,20.5,10,38,54,54,6,1,1,,ICICI Pru Bharat 22 FOF-(G),FoFs : Domestic,53,61,60,57,53,41,25,23,15.75,2.77,-0.84,3.91,16.97,12.94,14.04,10.42,0.35,-5.56,-1.96,20.24,31.15,21.74,,17.8
BHARAT Bond ETF FOF - April 2033 -Reg(G),47284,Edelweiss Mutual Fund,0.78,2.25,4.92,10.41,NIFTY BHARAT Bond Index - April 2033,,,,10.19,41,46,5,16,41,,,,BHARAT Bond ETF FOF - April 2033 -Reg(G),FoFs : Domestic,53,61,60,57,53,41,25,23,15.75,2.77,-0.84,3.91,16.97,12.94,14.04,10.42,,,,,,,,
DSP Equity Savings Fund-Reg(G),34871,DSP Mutual Fund,0.89,0.14,5.89,12.87,NIFTY 50 Equity Savings Index - TRI,10.27,9.96,,12.25,36,50,17,11,37,36,38,,DSP Equity Savings Fund-Reg(G),Hybrid : Equity Oriented,55,55,55,55,55,54,51,29,14.77,3.01,-0.76,4.42,15.97,11.85,13.02,10.64,,,,,,,,
UTI Infrastructure Fund-Reg(G),3582,UTI Mutual Fund,4.87,-6.53,-4.45,23.73,Nifty Infrastructure - TRI,22.6,21.53,13.21,21.41,17,15,17,17,18,18,18,17,UTI Infrastructure Fund-Reg(G),Equity : Sectoral - Infrastructure,19,19,19,19,19,19,19,18,30.13,6.06,-3.55,-1.2,33.08,28.2,27.82,16.49,,,,,,,,
Kotak Gold Fund(G),14148,Kotak Mahindra Mutual Fund,2.41,4.18,6.44,22.25,Gold-India,14.33,13.51,9.65,18.31,9,2,6,6,5,10,8,4,Kotak Gold Fund(G),Gold : MFs,16,17,16,16,16,10,10,10,18.19,1.7,3.75,5.1,21.48,14.77,13.58,9.53,,,,,,,,
DSP Nifty SDL Plus G-Sec Jun 2028 30:70 Index Fund-Reg(G),45863,DSP Mutual Fund,0.67,1.69,4.25,8.18,Nifty SDL Plus G-Sec Jun 2028 70:30 Index,,,,7.87,31,29,32,21,33,,,,DSP Nifty SDL Plus G-Sec Jun 2028 30:70 Index Fund-Reg(G),Debt : Medium to Long Duration,52,57,53,52,52,15,11,11,7.95,0.7,1.68,4.22,8.26,5.62,6.18,6.25,,,,,,,,
Axis CRISIL IBX SDL May 2027 Index Fund-Reg(G),45999,Axis Mutual Fund,0.65,1.81,4.21,8.48,CRISIL IBX SDL Index - May 2027,,,,8.07,17,31,13,23,13,,,,Axis CRISIL IBX SDL May 2027 Index Fund-Reg(G),Debt : Medium to Long Duration,52,57,53,52,52,15,11,11,7.95,0.7,1.68,4.22,8.26,5.62,6.18,6.25,,,,,,,,
Templeton India Value Fund(G),3379,Franklin Templeton Mutual Fund,2.2,-6.68,-1.41,19.78,NIFTY 500 - TRI,22.04,24.0,14.65,16.17,20,21,21,21,20,12,7,10,Templeton India Value Fund(G),Equity : Value / Contra,22,22,22,22,22,21,17,14,23.21,4.48,-3.58,4.06,25.48,21.59,22.9,15.6,,,,,,,,
Quant Absolute Fund(G),865,Quant Mutual Fund,0.13,-8.24,-5.78,14.28,NIFTY 50 Hybrid Composite Debt 65:35 Index,13.94,23.77,15.45,11.23,41,53,55,55,31,16,3,1,Quant Absolute Fund(G),Hybrid : Equity Oriented,55,55,55,55,55,54,51,29,14.77,3.01,-0.76,4.42,15.97,11.85,13.02,10.64,,,,,,,,
Nippon India Gold Savings Fund(G),14108,Nippon India Mutual Fund,2.32,4.28,6.52,22.22,Gold-India,14.72,13.48,9.48,18.45,7,6,3,4,6,8,9,8,Nippon India Gold Savings Fund(G),Gold : MFs,16,17,16,16,16,10,10,10,18.19,1.7,3.75,5.1,21.48,14.77,13.58,9.53,,,,,,,,
Nippon India Consumption Fund(G),2644,Nippon India Mutual Fund,2.39,-9.62,-0.22,23.29,Nifty India Consumption - TRI,21.16,23.6,14.19,19.3,12,15,16,15,12,3,2,6,Nippon India Consumption Fund(G),Equity : Thematic - Consumption,16,18,18,17,16,13,13,8,21.52,4.16,-6.41,4.92,25.31,19.22,19.74,14.69,,,,,,,,
Aditya Birla SL Income Fund(G),405,Aditya Birla Sun Life Mutual Fund,0.85,1.58,4.33,8.45,CRISIL Medium to Long Term Debt Index,5.69,6.91,6.92,8.2,11,11,41,20,17,6,3,3,Aditya Birla SL Income Fund(G),Debt : Medium to Long Duration,52,57,53,52,52,15,11,11,7.95,0.7,1.68,4.22,8.26,5.62,6.18,6.25,,,,,,,,
Tata Retirement Sav Fund - Mod Plan(G),15379,Tata Mutual Fund,6.03,-0.29,7.66,22.69,CRISIL Hybrid 25+75 - Aggressive Index,15.15,15.64,13.54,21.3,8,7,17,9,9,11,11,3,Tata Retirement Sav Fund - Mod Plan(G),Hybrid : Solution Oriented,40,42,42,42,39,37,29,13,16.5,3.99,-1.05,5.06,18.07,12.7,13.59,11.24,,,,,,,,
Aditya Birla SL G-Sec Fund(G),399,Aditya Birla Sun Life Mutual Fund,1.01,1.17,4.16,9.35,Nifty All Duration G-Sec Index,5.87,6.82,7.78,8.86,11,11,27,19,10,13,9,4,Aditya Birla SL G-Sec Fund(G),Debt : Gilt,35,36,36,36,35,23,21,21,8.48,0.89,1.4,4.24,8.85,5.91,6.5,7.12,,,,,,,,
