ICICI Pru Bharat 22 FOF-(G),40232,ICICI Prudential Mutual Fund,2.33,5.5,13.29,17.9,BSE Bharat 22 Index,28.01,27.04,,3.73,14,15,18,13,12,5,1,,ICICI Pru Bharat 22 FOF-(G),FoFs : Domestic,92,92,87,79,61,51,32,23,1.54,0.18,9.05,17.8,25.95,16.98,12.12,10.94,2.39,6.21,12.83,17.0,24.87,23.32,,40.84
Abakkus Flexi Cap Fund-Reg(G),50546,Abakkus Mutual Fund,-0.31,,,,BSE 500 - TRI,,,,-0.61,5,1,,,,,,,Abakkus Flexi Cap Fund-Reg(G),Equity : Flexi Cap,52,52,51,50,48,39,29,21,-1.8,-2.61,-1.86,1.4,5.76,16.58,14.29,14.73,,,,,,,,
Kotak Manufacture in India Fund-Reg(G),46107,Kotak Mahindra Mutual Fund,-1.26,0.82,7.18,14.94,Nifty India Manufacturing - TRI,21.42,,,0.15,15,16,21,15,9,9,,,Kotak Manufacture in India Fund-Reg(G),Equity : Thematic,113,112,110,105,91,41,28,9,-1.66,-2.76,-1.73,1.98,6.04,18.73,17.11,15.41,,,,,,,,
ICICI Pru Income plus Arbitrage Omni FOF(G),1701,ICICI Prudential Mutual Fund,0.47,1.37,2.76,6.53,NIFTY Composite Debt Index,11.01,10.0,9.24,0.35,44,28,30,40,47,39,22,16,ICICI Pru Income plus Arbitrage Omni FOF(G),FoFs : Domestic,92,92,87,79,61,51,32,23,1.54,0.18,9.05,17.8,25.95,16.98,12.12,10.94,,,,,,,,
Edelweiss Multi Asset Allocation Fund-Reg(G),47994,Edelweiss Mutual Fund,0.95,1.66,2.88,7.21,CRISIL Short Term Bond Index,,,,1.07,27,15,30,30,26,,,,Edelweiss Multi Asset Allocation Fund-Reg(G),Hybrid : Multi Asset Allocation,35,35,33,31,27,11,9,7,1.84,0.79,4.93,10.61,17.78,18.51,16.3,13.72,,,,,,,,
HDFC Infrastructure Fund(G),4253,HDFC Mutual Fund,-1.64,-3.01,0.3,8.26,BSE India Infrastructure Index - TRI,26.9,24.47,13.2,-0.31,14,10,13,13,10,3,4,18,HDFC Infrastructure Fund(G),Equity : Sectoral - Infrastructure,22,22,21,21,20,19,19,18,-0.29,-1.81,-2.83,0.33,6.79,22.91,21.98,16.7,,,,,,,,
Franklin India Multi Asset Allocation Fund-Reg(G),50069,Franklin Templeton Mutual Fund,0.74,6.92,11.13,,NIFTY 500 - TRI,,,,2.24,15,19,8,16,,,,,Franklin India Multi Asset Allocation Fund-Reg(G),Hybrid : Multi Asset Allocation,35,35,33,31,27,11,9,7,1.84,0.79,4.93,10.61,17.78,18.51,16.3,13.72,,,,,,,,
DSP Nifty 50 Equal Weight Index Fund-Reg(G),38179,DSP Mutual Fund,-1.41,1.5,7.07,12.38,NIFTY50 Equal Weight - TRI,18.31,16.21,,-0.31,32,32,34,26,28,41,4,,DSP Nifty 50 Equal Weight Index Fund-Reg(G),Equity : Index Funds,227,228,219,210,179,86,34,18,-1.71,-2.69,-1.24,2.6,6.66,17.61,13.34,13.56,,,,,,,,
Union Flexi Cap Fund-Reg(G),14559,Union Mutual Fund,-2.68,-1.71,1.31,6.85,BSE 500 - TRI,15.41,13.93,14.02,-1.79,21,25,26,28,21,25,14,15,Union Flexi Cap Fund-Reg(G),Equity : Flexi Cap,52,52,51,50,48,39,29,21,-1.8,-2.61,-1.86,1.4,5.76,16.58,14.29,14.73,,,,,,,,
Franklin India Dividend Yield Fund(G),3367,Franklin Templeton Mutual Fund,-0.18,1.33,4.77,4.17,NIFTY 500 - TRI,17.29,18.46,16.57,0.98,2,1,3,6,10,7,3,2,Franklin India Dividend Yield Fund(G),Equity : Thematic - Dividend Yield,10,10,10,10,10,8,7,5,-0.52,-1.39,0.3,4.34,7.32,19.12,18.37,15.91,,,,,,,,
Old Bridge Focused Fund-Reg(G),48527,Old Bridge Mutual Fund,-2.29,2.99,8.58,10.42,BSE 500 - TRI,,,,-1.35,12,15,1,1,5,,,,Old Bridge Focused Fund-Reg(G),Equity : Flexi Cap,52,52,51,50,48,39,29,21,-1.8,-2.61,-1.86,1.4,5.76,16.58,14.29,14.73,,,,,,,,
Franklin India Aggressive Hybrid Fund(G),999,Franklin Templeton Mutual Fund,-1.83,-1.37,1.14,4.86,CRISIL Hybrid 35+65 - Aggressive Index,14.54,12.37,11.99,-0.98,39,40,46,41,45,14,10,12,Franklin India Aggressive Hybrid Fund(G),Hybrid : Equity Oriented,63,56,56,55,53,52,50,33,-0.79,-1.24,-0.35,1.98,6.37,12.34,10.81,10.69,,,,,,,,
SBI Dynamic Asset Allocation Active FoF-Reg(G),49973,SBI Mutual Fund,-1.16,0.11,,,NIFTY 50 Hybrid Composite Debt 50:50 Index,,,,-0.57,64,58,55,,,,,,SBI Dynamic Asset Allocation Active FoF-Reg(G),FoFs : Domestic,92,92,87,79,61,51,32,23,1.54,0.18,9.05,17.8,25.95,16.98,12.12,10.94,,,,,,,,
Kotak Infra & Eco Reform Fund(G),4228,Kotak Mahindra Mutual Fund,-2.52,-3.52,0.09,5.13,Nifty Infrastructure - TRI,20.06,22.51,16.62,-1.46,18,18,16,14,12,15,10,10,Kotak Infra & Eco Reform Fund(G),Equity : Sectoral - Infrastructure,22,22,21,21,20,19,19,18,-0.29,-1.81,-2.83,0.33,6.79,22.91,21.98,16.7,,,,,,,,
HSBC Arbitrage Fund-Reg(G),29550,HSBC Mutual Fund,0.47,1.53,2.85,6.06,Nifty 50 Arbitrage,6.83,5.7,5.74,0.65,18,25,14,14,17,16,15,9,HSBC Arbitrage Fund-Reg(G),Hybrid : Arbitrage,34,34,33,31,30,24,24,14,0.66,0.48,1.51,2.79,6.04,6.81,5.66,5.72,0.72,2.03,3.79,7.5,7.73,6.38,,9.4
Bajaj Finserv Large and Mid Cap Fund-Reg(G),48063,Bajaj Finserv Mutual Fund,-3.17,-1.45,1.49,6.11,NIFTY LargeMidcap 250 - TRI,,,,-2.91,29,26,14,21,23,,,,Bajaj Finserv Large and Mid Cap Fund-Reg(G),Equity : Large & Mid Cap,33,33,33,33,31,26,26,20,-1.84,-2.7,-2.02,1.59,7.39,18.72,16.43,15.37,,,,,,,,
Templeton India Value Fund(G),3379,Franklin Templeton Mutual Fund,-2.21,0.51,4.31,6.99,NIFTY 500 - TRI,18.19,18.46,15.69,-1.55,13,9,8,10,12,16,6,10,Templeton India Value Fund(G),Equity : Value / Contra,23,23,23,23,22,21,18,15,-1.35,-2.31,-0.29,3.73,7.13,19.4,17.29,15.63,,,,,,,,
ICICI Pru Quality Fund-Reg(G),49893,ICICI Prudential Mutual Fund,-2.45,-0.67,3.09,,NIFTY200 Quality 30 - TRI,,,,-2.36,72,52,43,41,,,,,ICICI Pru Quality Fund-Reg(G),Equity : Thematic,113,112,110,105,91,41,28,9,-1.66,-2.76,-1.73,1.98,6.04,18.73,17.11,15.41,,,,,,,,
Baroda BNP Paribas Mid Cap Fund-Reg(G),172,Baroda BNP Paribas Mutual Fund,-1.68,-0.43,4.67,9.37,Nifty Midcap 150 - TRI,21.07,19.47,16.27,0.31,3,8,8,3,14,17,11,11,Baroda BNP Paribas Mid Cap Fund-Reg(G),Equity : Mid Cap,32,32,32,31,30,30,24,20,-1.8,-2.78,-2.65,1.02,7.6,21.75,19.35,16.8,,,,,,,,
Bandhan Balanced Advantage Fund-Reg(G),30671,Bandhan Mutual Fund,-1.64,-0.23,2.43,5.75,NIFTY 50 Hybrid Composite Debt 50:50 Index,11.08,8.75,9.04,-1.21,24,19,14,18,22,16,16,8,Bandhan Balanced Advantage Fund-Reg(G),Hybrid : Dynamic Asset Allocation,36,34,34,34,33,24,20,11,-1.05,-1.53,-0.6,2.1,6.11,12.01,9.86,10.54,,,,,,,,
ICICI Pru Rural Opportunities Fund-Reg(G),49521,ICICI Prudential Mutual Fund,-2.38,-1.29,3.24,13.8,Nifty Rural - TRI,,,,-1.03,38,47,50,40,11,,,,ICICI Pru Rural Opportunities Fund-Reg(G),Equity : Thematic,113,112,110,105,91,41,28,9,-1.66,-2.76,-1.73,1.98,6.04,18.73,17.11,15.41,,,,,,,,
LIC MF Nifty 8-13 yr G-Sec ETF,31581,LIC Mutual Fund,0.44,0.73,1.04,6.29,Nifty 8-13 yr G-Sec,7.94,5.75,7.04,-0.21,33,10,26,29,14,7,4,1,LIC MF Nifty 8-13 yr G-Sec ETF,Debt : ETFs,33,33,33,32,30,14,9,2,0.38,0.4,1.07,2.15,6.23,7.36,5.68,5.83,-0.27,0.05,0.97,5.8,7.99,5.9,,-2.53
Mirae Asset NYSE FANG+ETF FoF-Reg(G),45496,Mirae Asset Mutual Fund,-4.0,-9.21,5.07,16.06,NYSE FANG+ TRI,50.0,,,-2.17,48,46,54,45,36,1,,,Mirae Asset NYSE FANG+ETF FoF-Reg(G),FoFs : Overseas,56,56,56,56,56,53,30,23,2.99,0.23,4.59,15.05,25.51,19.42,10.34,12.21,,,,,,,,
Bandhan Dynamic Bond Fund-Reg(G),7455,Bandhan Mutual Fund,0.38,0.55,0.6,3.29,NIFTY Composite Debt Index,6.28,4.84,6.85,0.21,9,6,12,14,17,17,18,10,Bandhan Dynamic Bond Fund-Reg(G),Debt : Dynamic Bond,22,22,22,22,22,22,21,19,-0.01,0.29,0.54,0.93,4.98,6.71,5.68,6.82,,,,,,,,
HSBC Infrastructure Fund-Reg(G),594,HSBC Mutual Fund,-2.09,-2.56,-1.11,4.68,Nifty Infrastructure - TRI,22.38,21.44,16.67,-0.02,11,14,12,17,13,10,11,9,HSBC Infrastructure Fund-Reg(G),Equity : Sectoral - Infrastructure,22,22,21,21,20,19,19,18,-0.29,-1.81,-2.83,0.33,6.79,22.91,21.98,16.7,,,,,,,,
Bandhan Nifty 50 Index Fund-Reg(G),9078,Bandhan Mutual Fund,-2.3,0.13,4.09,8.81,NIFTY 50 - TRI,13.34,12.03,13.9,-1.65,110,91,65,65,68,72,23,4,Bandhan Nifty 50 Index Fund-Reg(G),Equity : Index Funds,227,228,219,210,179,86,34,18,-1.71,-2.69,-1.24,2.6,6.66,17.61,13.34,13.56,,,,,,,,
HDFC Income Plus Arbitrage Active FOF-Reg(G),16034,HDFC Mutual Fund,0.38,1.07,2.24,3.25,NIFTY Composite Debt Index,12.11,12.15,12.25,0.39,42,40,44,56,55,37,17,10,HDFC Income Plus Arbitrage Active FOF-Reg(G),FoFs : Domestic,92,92,87,79,61,51,32,23,1.54,0.18,9.05,17.8,25.95,16.98,12.12,10.94,,,,,,,,
Kotak Multi Asset Omni FOF(G),1981,Kotak Mahindra Mutual Fund,0.54,4.2,11.83,17.48,NIFTY 50 - TRI,19.66,18.42,16.13,3.57,17,26,21,15,13,12,3,2,Kotak Multi Asset Omni FOF(G),FoFs : Domestic,92,92,87,79,61,51,32,23,1.54,0.18,9.05,17.8,25.95,16.98,12.12,10.94,,,,,,,,
Edelweiss Nifty PSU Bond Plus SDL Apr 2027 50:50 Index Fund-Reg(G),45387,Edelweiss Mutual Fund,0.35,1.28,2.54,7.32,Nifty PSU Bond Plus SDL Apr 2027 50:50 Index,7.37,,,0.47,26,37,30,28,35,23,,,Edelweiss Nifty PSU Bond Plus SDL Apr 2027 50:50 Index Fund-Reg(G),Debt : Medium to Long Duration,60,60,60,60,59,42,11,11,0.36,0.38,1.13,2.16,6.96,7.28,5.45,6.31,,,,,,,,
ICICI Pru Housing Opp Fund-Reg(G),46546,ICICI Prudential Mutual Fund,-2.08,-1.75,1.16,9.7,Nifty Housing - TRI,17.33,,,0.0,18,37,59,57,25,21,,,ICICI Pru Housing Opp Fund-Reg(G),Equity : Thematic,113,112,110,105,91,41,28,9,-1.66,-2.76,-1.73,1.98,6.04,18.73,17.11,15.41,,,,,,,,
Kotak Nifty PSU Bank ETF,3723,Kotak Mahindra Mutual Fund,2.1,6.99,30.0,41.13,NIFTY PSU BANK - TRI,32.02,31.83,15.01,4.03,17,14,12,6,8,4,2,12,Kotak Nifty PSU Bank ETF,Equity : ETFs,232,233,215,204,173,124,73,38,-1.19,-2.21,-0.08,5.13,9.63,17.32,14.32,14.76,,,,,,,,
Aditya Birla SL Quant Fund-Reg(G),48491,Aditya Birla Sun Life Mutual Fund,-0.88,2.94,8.57,12.92,NIFTY 200 - TRI,,,,0.0,19,8,9,8,12,,,,Aditya Birla SL Quant Fund-Reg(G),Equity : Thematic,113,112,110,105,91,41,28,9,-1.66,-2.76,-1.73,1.98,6.04,18.73,17.11,15.41,,,,,,,,
Bank of India Flexi Cap Fund-Reg(G),44987,Bank of India Mutual Fund,-3.05,-3.42,2.72,5.79,BSE 500 - TRI,21.65,19.43,,-1.64,15,37,42,17,27,4,3,,Bank of India Flexi Cap Fund-Reg(G),Equity : Flexi Cap,52,52,51,50,48,39,29,21,-1.8,-2.61,-1.86,1.4,5.76,16.58,14.29,14.73,,,,,,,,
Mahindra Manulife Focused Fund-Reg(G),45141,Mahindra Manulife Mutual Fund,-0.61,0.89,5.13,7.99,NIFTY 500 - TRI,19.38,18.41,,0.25,2,3,3,4,15,8,4,,Mahindra Manulife Focused Fund-Reg(G),Equity : Flexi Cap,52,52,51,50,48,39,29,21,-1.8,-2.61,-1.86,1.4,5.76,16.58,14.29,14.73,,,,,,,,
Mirae Asset Banking and Financial Services Fund-Reg(G),45174,Mirae Asset Mutual Fund,-0.44,3.19,8.53,22.25,Nifty Financial Services - TRI,18.63,14.07,,0.43,8,5,4,9,2,5,5,,Mirae Asset Banking and Financial Services Fund-Reg(G),Equity : Sectoral - Financial Services,24,24,23,23,21,14,12,11,0.13,-1.14,2.02,7.33,18.19,17.59,13.58,15.41,,,,,,,,
Axis Business Cycles Fund-Reg(G),47580,Axis Mutual Fund,-2.19,-1.61,0.43,6.46,NIFTY 500 - TRI,,,,-1.08,41,40,54,70,41,,,,Axis Business Cycles Fund-Reg(G),Equity : Thematic,113,112,110,105,91,41,28,9,-1.66,-2.76,-1.73,1.98,6.04,18.73,17.11,15.41,,,,,,,,
BHARAT Bond ETF FOF - April 2033 -Reg(G),47284,Edelweiss Mutual Fund,-0.8,-0.53,1.05,5.99,NIFTY BHARAT Bond Index - April 2033,7.85,,,-0.49,62,56,64,70,51,44,,,BHARAT Bond ETF FOF - April 2033 -Reg(G),FoFs : Domestic,92,92,87,79,61,51,32,23,1.54,0.18,9.05,17.8,25.95,16.98,12.12,10.94,,,,,,,,
UTI-Nifty Next 50 ETF,37338,UTI Mutual Fund,-2.03,-1.67,3.52,8.63,NIFTY NEXT 50 - TRI,22.2,16.13,,-0.55,73,79,167,130,88,30,15,,UTI-Nifty Next 50 ETF,Equity : ETFs,232,233,215,204,173,124,73,38,-1.19,-2.21,-0.08,5.13,9.63,17.32,14.32,14.76,,,,,,,,
DSP Silver ETF,46354,DSP Mutual Fund,5.35,70.76,120.92,157.32,Silver,49.85,,,22.77,1,27,2,3,3,6,,,DSP Silver ETF,Gold : ETFs,40,40,39,36,31,18,11,11,12.24,8.95,42.76,77.39,107.44,41.8,25.15,17.25,,,,,,,,
Axis Gold Fund-Reg(G),15330,Axis Mutual Fund,10.78,25.7,49.67,74.18,Gold-India,35.79,24.6,16.99,14.15,4,14,15,14,14,11,6,7,Axis Gold Fund-Reg(G),Gold : MFs,22,22,20,18,17,14,10,10,12.2,10.06,34.32,61.97,90.13,38.24,24.62,17.09,,,,,,,,
Tata Retirement Sav Fund - Mod Plan(G),15379,Tata Mutual Fund,-2.16,-1.98,-0.56,3.5,CRISIL Hybrid 25+75 - Aggressive Index,14.79,11.17,12.65,-2.23,37,30,33,37,36,11,13,5,Tata Retirement Sav Fund - Mod Plan(G),Hybrid : Solution Oriented,43,43,43,43,43,38,33,17,-1.19,-1.69,-1.08,1.4,5.78,13.02,10.9,10.77,,,,,,,,
SBI Credit Risk Fund-Reg(G),2770,SBI Mutual Fund,0.57,1.3,2.77,7.59,NIFTY Credit Risk Bond Index,8.09,6.87,7.31,0.55,6,4,7,9,11,7,9,6,SBI Credit Risk Fund-Reg(G),Debt : Credit Risk,15,15,15,15,15,15,15,13,0.85,0.67,1.65,3.21,10.1,8.64,8.94,6.46,,,,,,,,
HDFC NIFTY Next 50 Index Fund-Reg(G),45985,HDFC Mutual Fund,-2.08,-1.82,3.19,7.86,NIFTY NEXT 50 - TRI,21.18,,,-0.61,55,56,148,99,78,21,,,HDFC NIFTY Next 50 Index Fund-Reg(G),Equity : Index Funds,227,228,219,210,179,86,34,18,-1.71,-2.69,-1.24,2.6,6.66,17.61,13.34,13.56,,,,,,,,
Nippon India Nifty Midcap 150 Index Fund-Reg(G),44503,Nippon India Mutual Fund,-2.79,-1.0,2.85,9.36,Nifty Midcap 150 - TRI,23.49,,,-1.59,91,131,115,122,40,9,,,Nippon India Nifty Midcap 150 Index Fund-Reg(G),Equity : Index Funds,227,228,219,210,179,86,34,18,-1.71,-2.69,-1.24,2.6,6.66,17.61,13.34,13.56,,,,,,,,
Sundaram Flexi Cap Fund-Reg(G),46622,Sundaram Mutual Fund,-2.62,-1.12,1.84,7.51,NIFTY 500 - TRI,14.94,,,-2.02,34,22,18,24,17,30,,,Sundaram Flexi Cap Fund-Reg(G),Equity : Flexi Cap,52,52,51,50,48,39,29,21,-1.8,-2.61,-1.86,1.4,5.76,16.58,14.29,14.73,,,,,,,,
WOC Balanced Advantage Fund-Reg(G),46990,WhiteOak Capital Mutual Fund,-1.71,-0.75,1.66,7.31,CRISIL Hybrid 50+50 - Moderate Index,,,,-1.18,23,25,24,24,12,,,,WOC Balanced Advantage Fund-Reg(G),Hybrid : Dynamic Asset Allocation,36,34,34,34,33,24,20,11,-1.05,-1.53,-0.6,2.1,6.11,12.01,9.86,10.54,,,,,,,,
Magnum Hybrid Long Short Fund-Reg(G),75013,SBI - Magnum SIF,,,,,NIFTY 50 Hybrid Composite Debt 50:50 Index,,,,-0.39,26,,,,,,,,Magnum Hybrid Long Short Fund-Reg(G),Hybrid : Equity Oriented,63,56,56,55,53,52,50,33,-0.79,-1.24,-0.35,1.98,6.37,12.34,10.81,10.69,,,,,,,,
Motilal Oswal Business Cycle Fund-Reg(G),48959,Motilal Oswal Mutual Fund,-7.04,-10.52,-6.91,0.54,NIFTY 500 - TRI,,,,-6.97,112,111,109,103,74,,,,Motilal Oswal Business Cycle Fund-Reg(G),Equity : Thematic,113,112,110,105,91,41,28,9,-1.66,-2.76,-1.73,1.98,6.04,18.73,17.11,15.41,,,,,,,,
UTI Infrastructure Fund-Reg(G),3582,UTI Mutual Fund,-1.24,-1.11,2.42,8.44,Nifty Infrastructure - TRI,20.63,17.71,15.03,0.17,9,9,5,6,9,14,17,17,UTI Infrastructure Fund-Reg(G),Equity : Sectoral - Infrastructure,22,22,21,21,20,19,19,18,-0.29,-1.81,-2.83,0.33,6.79,22.91,21.98,16.7,,,,,,,,
UTI Silver ETF,46881,UTI Mutual Fund,5.26,69.41,116.99,151.42,Silver,,,,9.23,32,37,15,14,12,,,,UTI Silver ETF,Gold : ETFs,40,40,39,36,31,18,11,11,12.24,8.95,42.76,77.39,107.44,41.8,25.15,17.25,,,,,,,,
Mahindra Manulife Aggressive Hybrid Fund-Reg(G),43978,Mahindra Manulife Mutual Fund,-1.84,-0.49,2.02,7.95,CRISIL Hybrid 35+65 - Aggressive Index,16.75,15.1,,-1.42,50,41,33,30,11,4,5,,Mahindra Manulife Aggressive Hybrid Fund-Reg(G),Hybrid : Equity Oriented,63,56,56,55,53,52,50,33,-0.79,-1.24,-0.35,1.98,6.37,12.34,10.81,10.69,,,,,,,,
Tata Retirement Sav Fund - Prog Plan(G),15380,Tata Mutual Fund,-2.36,-2.31,-1.22,2.14,NIFTY 500 - TRI,15.9,11.53,13.66,-2.42,40,35,36,39,40,9,10,2,Tata Retirement Sav Fund - Prog Plan(G),Hybrid : Solution Oriented,43,43,43,43,43,38,33,17,-1.19,-1.69,-1.08,1.4,5.78,13.02,10.9,10.77,,,,,,,,
360 ONE Flexicap Fund-Reg(G),47567,360 ONE Mutual Fund,-2.56,-3.45,0.3,3.93,BSE 500 - TRI,,,,-1.93,30,20,44,38,37,,,,360 ONE Flexicap Fund-Reg(G),Equity : Flexi Cap,52,52,51,50,48,39,29,21,-1.8,-2.61,-1.86,1.4,5.76,16.58,14.29,14.73,,,,,,,,
SBI Medium to Long Duration Fund-Reg(G),2776,SBI Mutual Fund,0.3,0.49,1.04,5.12,CRISIL Medium to Long Term Debt Index,6.8,5.76,7.4,0.15,50,47,53,51,52,35,3,1,SBI Medium to Long Duration Fund-Reg(G),Debt : Medium to Long Duration,60,60,60,60,59,42,11,11,0.36,0.38,1.13,2.16,6.96,7.28,5.45,6.31,,,,,,,,
Parag Parikh Arbitrage Fund-Reg(G),48215,PPFAS Mutual Fund,0.51,1.57,2.89,6.15,Nifty 50 Arbitrage - TRI,,,,0.65,20,7,5,8,15,,,,Parag Parikh Arbitrage Fund-Reg(G),Hybrid : Arbitrage,34,34,33,31,30,24,24,14,0.66,0.48,1.51,2.79,6.04,6.81,5.66,5.72,,,,,,,,
Kotak MNC Fund-Reg(G),49046,Kotak Mahindra Mutual Fund,-1.16,0.34,6.04,11.2,NIFTY MNC - TRI,,,,0.02,2,2,2,1,1,,,,Kotak MNC Fund-Reg(G),Equity : Thematic - MNC,7,7,7,7,6,4,4,3,-1.4,-2.45,-2.01,1.93,4.79,12.08,11.03,10.25,,,,,,,,
Quant Aggressive Hybrid Fund(G),865,Quant Mutual Fund,-2.5,-1.58,2.71,9.93,NIFTY 50 Hybrid Composite Debt 65:35 Index,13.43,16.68,15.83,-1.91,55,52,47,17,5,19,3,2,Quant Aggressive Hybrid Fund(G),Hybrid : Equity Oriented,63,56,56,55,53,52,50,33,-0.79,-1.24,-0.35,1.98,6.37,12.34,10.81,10.69,,,,,,,,
WOC Large & Mid Cap Fund-Reg(G),48333,WhiteOak Capital Mutual Fund,-2.5,-1.37,3.32,10.64,BSE 250 LargeMidCap Index - TRI,,,,-1.47,12,15,13,11,5,,,,WOC Large & Mid Cap Fund-Reg(G),Equity : Large & Mid Cap,33,33,33,33,31,26,26,20,-1.84,-2.7,-2.02,1.59,7.39,18.72,16.43,15.37,,,,,,,,
Aditya Birla SL Gold ETF,13056,Aditya Birla Sun Life Mutual Fund,11.37,25.75,50.64,77.21,Gold-India,36.22,25.2,17.32,13.96,11,5,19,15,15,12,5,3,Aditya Birla SL Gold ETF,Gold : ETFs,40,40,39,36,31,18,11,11,12.24,8.95,42.76,77.39,107.44,41.8,25.15,17.25,,,,,,,,
Sundaram Money Market Fund-Reg(G),39625,Sundaram Mutual Fund,0.41,1.39,2.81,7.12,Nifty Money Market Index,7.24,6.0,,0.46,15,14,11,11,10,10,10,,Sundaram Money Market Fund-Reg(G),Debt : Money Market,24,24,23,23,23,21,17,13,0.47,0.42,1.38,2.78,6.99,7.18,6.04,6.48,,,,,,,,
Mirae Asset Gold ETF,47117,Mirae Asset Mutual Fund,11.31,25.6,50.29,76.69,Gold-India,,,,13.88,21,13,27,26,23,,,,Mirae Asset Gold ETF,Gold : ETFs,40,40,39,36,31,18,11,11,12.24,8.95,42.76,77.39,107.44,41.8,25.15,17.25,,,,,,,,
Bandhan Focused Fund-Reg(G),2896,Bandhan Mutual Fund,-2.28,-3.6,-0.22,3.1,BSE 500 - TRI,18.96,12.93,13.8,-1.39,13,13,37,36,35,12,17,11,Bandhan Focused Fund-Reg(G),Equity : Multi Cap,45,45,45,45,42,31,21,14,-1.86,-2.7,-2.41,1.07,5.97,17.73,14.96,15.03,,,,,,,,
Bandhan Large Cap Fund-Reg(G),2860,Bandhan Mutual Fund,-2.64,-0.83,3.45,9.07,BSE 100 - TRI,17.35,13.05,13.89,-1.81,24,27,22,16,9,9,14,12,Bandhan Large Cap Fund-Reg(G),Equity : Large Cap,39,39,39,39,38,36,33,28,-1.66,-2.46,-0.85,2.78,7.34,15.25,12.64,13.51,,,,,,,,
Axis Strategic Bond Fund-Reg(G),8136,Axis Mutual Fund,0.49,1.21,2.7,7.82,NIFTY Medium Duration Debt Index,7.93,6.77,7.65,0.27,20,5,17,13,5,5,4,3,Axis Strategic Bond Fund-Reg(G),Debt : Medium Duration,25,25,25,25,25,19,12,12,0.46,0.43,1.24,2.54,7.27,7.37,6.78,6.71,,,,,,,,
ICICI Pru Nifty Next 50 ETF,39950,ICICI Prudential Mutual Fund,-2.03,-1.65,3.56,8.6,NIFTY NEXT 50 - TRI,22.18,16.1,,-0.4,64,78,163,125,89,32,17,,ICICI Pru Nifty Next 50 ETF,Equity : ETFs,232,233,215,204,173,124,73,38,-1.19,-2.21,-0.08,5.13,9.63,17.32,14.32,14.76,,,,,,,,
Kotak Bond Fund-Reg(G),1968,Kotak Mahindra Mutual Fund,0.18,0.36,0.57,4.64,CRISIL Medium to Long Term Debt Index,6.58,5.1,6.73,-0.3,60,56,56,56,53,37,7,5,Kotak Bond Fund-Reg(G),Debt : Medium to Long Duration,60,60,60,60,59,42,11,11,0.36,0.38,1.13,2.16,6.96,7.28,5.45,6.31,,,,,,,,
DSP Nifty SDL Plus G-Sec Jun 2028 30:70 Index Fund-Reg(G),45863,DSP Mutual Fund,0.42,1.42,2.69,7.67,Nifty SDL Plus G-Sec Jun 2028 70:30 Index,7.72,,,0.51,19,18,4,14,13,8,,,DSP Nifty SDL Plus G-Sec Jun 2028 30:70 Index Fund-Reg(G),Debt : Medium to Long Duration,60,60,60,60,59,42,11,11,0.36,0.38,1.13,2.16,6.96,7.28,5.45,6.31,,,,,,,,
Canara Rob Consumer Trends Fund-Reg(G),7876,Canara Robeco Mutual Fund,-4.5,-5.02,-2.32,1.79,BSE 100 - TRI,15.44,13.73,16.55,-3.83,7,6,2,7,5,5,7,1,Canara Rob Consumer Trends Fund-Reg(G),Equity : Thematic - Consumption,26,26,24,22,20,13,13,10,-4.64,-5.01,-6.51,-3.3,-1.2,14.47,13.75,14.31,,,,,,,,
Mirae Asset Balanced Advantage Fund-Reg(G),46224,Mirae Asset Mutual Fund,-0.77,0.69,3.35,8.58,NIFTY 50 Hybrid Composite Debt 50:50 Index,12.62,,,-0.38,5,4,7,9,6,9,,,Mirae Asset Balanced Advantage Fund-Reg(G),Hybrid : Dynamic Asset Allocation,36,34,34,34,33,24,20,11,-1.05,-1.53,-0.6,2.1,6.11,12.01,9.86,10.54,,,,,,,,
Axis Nifty 100 Index Fund-Reg(G),43785,Axis Mutual Fund,-2.28,-0.27,3.8,8.38,NIFTY 100 - TRI,14.17,11.97,,-1.48,88,82,93,78,75,56,24,,Axis Nifty 100 Index Fund-Reg(G),Equity : Index Funds,227,228,219,210,179,86,34,18,-1.71,-2.69,-1.24,2.6,6.66,17.61,13.34,13.56,,,,,,,,
SBI CRISIL IBX Gilt Index - Apr 2029 Fund-Reg(G),46971,SBI Mutual Fund,0.41,1.34,2.51,7.84,CRISIL IBX Gilt Index - April 2029,7.92,,,0.54,13,20,20,33,8,3,,,SBI CRISIL IBX Gilt Index - Apr 2029 Fund-Reg(G),Debt : Medium to Long Duration,60,60,60,60,59,42,11,11,0.36,0.38,1.13,2.16,6.96,7.28,5.45,6.31,,,,,,,,
Tata Infrastructure Fund-Reg(G),3254,Tata Mutual Fund,-1.94,-3.47,-2.87,2.52,BSE India Infrastructure Index - TRI,19.23,19.56,15.67,-0.26,12,13,15,19,18,17,16,13,Tata Infrastructure Fund-Reg(G),Equity : Sectoral - Infrastructure,22,22,21,21,20,19,19,18,-0.29,-1.81,-2.83,0.33,6.79,22.91,21.98,16.7,,,,,,,,
Bandhan Gilt Fund-Reg(G),7483,Bandhan Mutual Fund,0.47,0.6,0.64,3.58,CRISIL Dynamic Gilt Index,6.7,5.24,7.49,0.27,16,10,18,18,23,20,9,5,Bandhan Gilt Fund-Reg(G),Debt : Gilt,39,39,39,38,37,35,21,21,-0.09,0.31,0.64,0.67,4.6,6.73,5.09,6.97,,,,,,,,
ICICI Pru BSE Sensex Index Fund(G),36396,ICICI Prudential Mutual Fund,-2.48,-0.18,3.42,7.38,BSE SENSEX - TRI,12.0,11.31,,-1.91,147,106,83,83,97,80,29,,ICICI Pru BSE Sensex Index Fund(G),Equity : Index Funds,227,228,219,210,179,86,34,18,-1.71,-2.69,-1.24,2.6,6.66,17.61,13.34,13.56,,,,,,,,
Franklin India Technology Fund(G),961,Franklin Templeton Mutual Fund,-6.86,-4.63,-0.62,-6.81,BSE TECk Index,18.44,12.67,16.12,-6.33,9,10,8,7,7,1,5,5,Franklin India Technology Fund(G),Equity : Sectoral - Technology,12,12,12,12,12,5,5,5,-5.98,-5.95,-4.3,-1.33,-6.31,13.32,13.7,16.7,-5.19,-0.03,4.26,-8.78,8.02,8.53,17.82,-57.14
Bandhan Income Plus Arbitrage Active FOF-Reg(G),2850,Bandhan Mutual Fund,0.39,1.11,2.3,6.7,NIFTY Composite Debt Index,7.11,5.83,6.97,0.37,43,37,38,52,46,51,31,22,Bandhan Income Plus Arbitrage Active FOF-Reg(G),FoFs : Domestic,92,92,87,79,61,51,32,23,1.54,0.18,9.05,17.8,25.95,16.98,12.12,10.94,,,,,,,,
Axis Income Plus Arbitrage Active FOF-Reg(G),43840,Axis Mutual Fund,0.43,1.13,2.42,7.4,NIFTY Composite Debt Index,7.65,6.46,,0.39,41,32,36,48,37,47,28,,Axis Income Plus Arbitrage Active FOF-Reg(G),FoFs : Domestic,92,92,87,79,61,51,32,23,1.54,0.18,9.05,17.8,25.95,16.98,12.12,10.94,,,,,,,,
Kotak Medium Term Fund(G),22514,Kotak Mahindra Mutual Fund,0.64,1.41,3.47,8.47,CRISIL Medium Duration Debt Index,8.17,6.63,7.02,0.55,2,1,6,2,3,3,5,6,Kotak Medium Term Fund(G),Debt : Medium Duration,25,25,25,25,25,19,12,12,0.46,0.43,1.24,2.54,7.27,7.37,6.78,6.71,,,,,,,,
Axis CRISIL IBX SDL May 2027 Index Fund-Reg(G),45999,Axis Mutual Fund,0.39,1.44,2.72,7.44,CRISIL IBX SDL Index - May 2027,7.6,,,0.57,6,23,3,7,29,13,,,Axis CRISIL IBX SDL May 2027 Index Fund-Reg(G),Debt : Medium to Long Duration,60,60,60,60,59,42,11,11,0.36,0.38,1.13,2.16,6.96,7.28,5.45,6.31,,,,,,,,
HDFC Pharma and Healthcare Fund-Reg(G),48220,HDFC Mutual Fund,-2.94,-3.46,-2.29,2.45,BSE Health Care - TRI,,,,-2.12,3,5,2,4,1,,,,HDFC Pharma and Healthcare Fund-Reg(G),Equity : Sectoral - Pharma,21,21,20,20,18,11,9,4,-3.43,-3.89,-5.37,-4.15,-1.94,21.8,13.88,11.94,,,,,,,,
Bandhan Innovation Fund-Reg(G),48656,Bandhan Mutual Fund,-3.73,-5.01,1.57,7.59,NIFTY 500 - TRI,,,,-3.04,90,79,94,55,34,,,,Bandhan Innovation Fund-Reg(G),Equity : Thematic,113,112,110,105,91,41,28,9,-1.66,-2.76,-1.73,1.98,6.04,18.73,17.11,15.41,,,,,,,,
DSP Income Plus Arbitrage Omni FoF-Reg(G),14756,DSP Mutual Fund,0.36,0.93,2.02,2.14,NIFTY Composite Debt Index,8.54,5.67,7.95,0.22,34,28,36,51,53,49,24,22,DSP Income Plus Arbitrage Omni FoF-Reg(G),FoFs : Overseas,56,56,56,56,56,53,30,23,2.99,0.23,4.59,15.05,25.51,19.42,10.34,12.21,,,,,,,,
Invesco India Low Duration Fund(G),2253,Invesco Mutual Fund,0.36,1.24,2.64,6.9,NIFTY Low Duration Debt Index,7.12,5.89,6.66,0.42,9,15,7,8,8,6,8,7,Invesco India Low Duration Fund(G),Debt : Low Duration,26,26,26,25,20,20,20,19,0.39,0.37,1.21,2.61,6.93,7.07,5.91,6.39,,,,,,,,
Aditya Birla SL Income Fund(G),405,Aditya Birla Sun Life Mutual Fund,0.16,0.31,0.47,4.4,CRISIL Medium to Long Term Debt Index,6.41,5.58,7.13,0.03,52,57,57,59,57,39,4,3,Aditya Birla SL Income Fund(G),Debt : Medium to Long Duration,60,60,60,60,59,42,11,11,0.36,0.38,1.13,2.16,6.96,7.28,5.45,6.31,,,,,,,,
Bandhan Midcap Fund-Reg(G),45868,Bandhan Mutual Fund,-2.78,-4.99,-2.42,4.44,BSE 150 MidCap - TRI,20.35,,,-2.22,23,17,27,26,23,22,,,Bandhan Midcap Fund-Reg(G),Equity : Mid Cap,32,32,32,31,30,30,24,20,-1.8,-2.78,-2.65,1.02,7.6,21.75,19.35,16.8,,,,,,,,
HSBC CRISIL IBX 50:50 Gilt Plus SDL Apr 2028 Index Fund-Reg(G),46506,HSBC Mutual Fund,0.37,1.37,2.54,7.57,CRISIL IBX 50:50 Gilt Plus SDL Index - April 2028,7.65,,,0.41,36,34,13,29,19,10,,,HSBC CRISIL IBX 50:50 Gilt Plus SDL Apr 2028 Index Fund-Reg(G),Debt : Medium to Long Duration,60,60,60,60,59,42,11,11,0.36,0.38,1.13,2.16,6.96,7.28,5.45,6.31,,,,,,,,
Edelweiss Gold and Silver ETF FoF-Reg(G),46800,Edelweiss Mutual Fund,10.7,49.5,86.2,117.79,Gold-India,44.2,,,22.35,2,3,10,10,7,4,,,Edelweiss Gold and Silver ETF FoF-Reg(G),FoFs : Domestic,92,92,87,79,61,51,32,23,1.54,0.18,9.05,17.8,25.95,16.98,12.12,10.94,,,,,,,,
Bank of India Small Cap Fund-Reg(G),41323,Bank of India Mutual Fund,-3.26,-7.39,-5.43,-2.64,Nifty Smallcap 250 - TRI,18.56,20.92,,-2.16,11,8,26,26,24,13,12,,Bank of India Small Cap Fund-Reg(G),Equity : Small Cap,33,33,31,31,30,24,22,13,-2.82,-3.77,-6.01,-3.42,1.25,18.8,20.61,17.1,,,,,,,,
HDFC Diversified Equity All Cap Active FOF-Reg(G),50229,HDFC Mutual Fund,-1.93,-1.06,,,NIFTY 500 - TRI,,,,-1.09,74,70,71,,,,,,HDFC Diversified Equity All Cap Active FOF-Reg(G),FoFs : Domestic,92,92,87,79,61,51,32,23,1.54,0.18,9.05,17.8,25.95,16.98,12.12,10.94,,,,,,,,
HSBC Large Cap Fund(G),1348,HSBC Mutual Fund,-1.4,1.59,5.28,7.72,NIFTY 100 - TRI,15.8,11.93,13.63,-0.53,3,3,3,5,18,13,21,14,HSBC Large Cap Fund(G),Equity : Large Cap,39,39,39,39,38,36,33,28,-1.66,-2.46,-0.85,2.78,7.34,15.25,12.64,13.51,,,,,,,,
Bandhan Nifty100 Low Volatility 30 Index Fund-Reg(G),46607,Bandhan Mutual Fund,-3.18,-0.11,2.95,6.75,Nifty100 Low Volatility 30 - TRI,15.5,,,-2.37,171,172,78,118,110,49,,,Bandhan Nifty100 Low Volatility 30 Index Fund-Reg(G),Equity : Index Funds,227,228,219,210,179,86,34,18,-1.71,-2.69,-1.24,2.6,6.66,17.61,13.34,13.56,,,,,,,,
ICICI Pru FMCG Fund(G),1517,ICICI Prudential Mutual Fund,-4.45,-9.28,-9.41,-8.36,NIFTY FMCG - TRI,3.28,9.14,10.93,-7.25,25,5,22,22,19,13,13,10,ICICI Pru FMCG Fund(G),Equity : Thematic - Consumption,26,26,24,22,20,13,13,10,-4.64,-5.01,-6.51,-3.3,-1.2,14.47,13.75,14.31,,,,,,,,
