Invesco India Aggressive Hybrid Fund-Reg(G),39893,Invesco Mutual Fund,3.55,1.32,-2.11,13.39,CRISIL Hybrid 35+65 - Aggressive Index,15.73,18.56,,-3.87,51,18,47,43,6,8,15,,Invesco India Aggressive Hybrid Fund-Reg(G),Hybrid : Equity Oriented,55,56,55,55,55,54,51,29,4.63,7.33,6.98,4.7,13.32,12.48,16.48,9.96,,,,,,,,
PGIM India Large and Mid Cap Fund(G),48543,PGIM India Mutual Fund,4.13,3.94,-0.42,12.1,NIFTY LargeMidcap 250 - TRI,,,,-1.42,7,17,5,3,12,,,,PGIM India Large and Mid Cap Fund(G),Equity : Large & Mid Cap,31,31,31,30,29,26,25,19,-3.68,4.18,1.97,-3.46,10.58,17.29,25.85,13.92,,,,,,,,
Mahindra Manulife Large Cap Fund-Reg(G),38073,Mahindra Manulife Mutual Fund,5.27,6.05,0.54,10.04,NIFTY 100 - TRI,13.55,21.52,,3.0,2,5,3,3,16,22,17,,Mahindra Manulife Large Cap Fund-Reg(G),Equity : Large Cap,38,38,38,38,37,34,31,28,-0.54,4.17,3.42,-2.39,8.22,14.54,21.57,11.86,,,,,,,,
Aditya Birla SL Silver ETF,46194,Aditya Birla Sun Life Mutual Fund,-0.96,6.24,-2.61,19.9,Silver,12.03,,,13.03,21,23,21,19,20,13,,,Aditya Birla SL Silver ETF,Gold : ETFs,31,34,31,30,28,14,11,11,20.58,4.84,14.21,11.69,27.82,18.97,14.0,12.76,,,,,,,,
Aditya Birla SL ESG Integration Strategy Fund-Reg(G),44736,Aditya Birla Sun Life Mutual Fund,4.52,0.65,-4.25,14.9,NIFTY100 ESG - TRI,11.42,,,-3.78,43,32,45,33,3,33,,,Aditya Birla SL ESG Integration Strategy Fund-Reg(G),Equity : Thematic,89,98,90,79,60,38,21,9,-4.61,3.78,0.45,-5.44,6.93,17.04,26.27,13.41,,,,,,,,
Edelweiss Technology Fund-Reg(G),43844,Edelweiss Mutual Fund,-1.36,-13.58,-13.14,7.08,BSE TECk Index - TRI,,,,-17.8,11,11,11,9,5,,,,Edelweiss Technology Fund-Reg(G),Equity : Sectoral - Technology,12,12,12,11,9,5,5,4,-15.23,0.35,-10.99,-11.01,7.84,10.22,27.94,15.87,,,,,,,,
HSBC Credit Risk Fund-Reg(G),8016,HSBC Mutual Fund,1.52,3.92,5.57,9.59,NIFTY Credit Risk Bond Index,6.9,6.17,6.27,4.35,4,9,4,4,5,10,12,9,HSBC Credit Risk Fund-Reg(G),Debt : Credit Risk,15,15,15,15,15,15,15,13,4.62,1.56,4.15,5.76,10.39,7.71,7.62,6.45,,,,,,,,
JM Small Cap Fund-Reg(G),48452,JM Financial Mutual Fund,4.3,-1.28,-9.23,,Nifty Smallcap 250 - TRI,,,,-10.13,16,9,8,17,,,,,JM Small Cap Fund-Reg(G),Equity : Small Cap,29,30,29,28,27,23,21,13,-9.98,3.77,-2.64,-8.47,6.59,18.06,34.02,16.3,,,,,,,,
Motilal Oswal Nifty Bank Index Fund-Reg(G),43789,Motilal Oswal Mutual Fund,9.35,13.68,7.59,15.36,NIFTY BANK - TRI,15.22,21.57,,8.21,8,9,6,10,5,22,22,,Motilal Oswal Nifty Bank Index Fund-Reg(G),Equity : Index Funds,175,190,176,151,115,68,32,18,-2.57,4.67,2.21,-3.96,6.58,14.83,22.71,11.63,,,,,,,,
Motilal Oswal Arbitrage Fund-Reg(G),49485,Motilal Oswal Mutual Fund,0.73,1.75,,,Nifty 50 Arbitrage - TRI,,,,2.12,27,23,25,,,,,,Motilal Oswal Arbitrage Fund-Reg(G),Hybrid : Arbitrage,30,30,30,27,26,24,22,14,2.23,0.76,1.79,3.49,7.02,6.46,5.23,5.78,,,,,,,,
Navi Nifty Bank Index Fund-Reg(G),45873,Navi Mutual Fund,9.35,13.7,7.57,15.38,NIFTY BANK - TRI,15.12,,,8.23,7,7,4,11,4,27,,,Navi Nifty Bank Index Fund-Reg(G),Equity : Index Funds,175,190,176,151,115,68,32,18,-2.57,4.67,2.21,-3.96,6.58,14.83,22.71,11.63,,,,,,,,
HDFC Silver ETF,46223,HDFC Mutual Fund,-1.63,5.9,-2.95,21.03,Silver,,,,12.98,24,33,30,30,18,,,,HDFC Silver ETF,Gold : ETFs,31,34,31,30,28,14,11,11,20.58,4.84,14.21,11.69,27.82,18.97,14.0,12.76,,,,,,,,
Baroda BNP Paribas Overnight Fund-Reg(G),43376,Baroda BNP Paribas Mutual Fund,0.51,1.53,3.18,6.53,CRISIL Liquid Overnight Index,6.28,5.01,,1.96,9,9,11,13,10,5,6,,Baroda BNP Paribas Overnight Fund-Reg(G),Debt : Overnight,34,34,34,34,34,28,27,3,1.94,0.51,1.51,3.15,6.48,6.24,4.97,5.57,0.51,1.53,3.21,6.61,,,,6.3
SBI FMP-67-1467D-Reg(G),46703,SBI Mutual Fund,1.11,2.33,3.97,8.41,CRISIL Medium to Long Term Debt Index,,,,2.85,33,36,36,35,34,,,,SBI FMP-67-1467D-Reg(G),Debt : FTP/FMP,92,93,92,91,91,49,17,8,2.77,1.11,2.32,3.96,8.33,6.9,5.66,6.0,,,,,,,,
Edelweiss Equity Savings Fund-Reg(G),30730,Edelweiss Mutual Fund,1.93,2.57,3.06,10.53,NIFTY 50 Equity Savings Index,10.24,11.56,8.77,1.41,20,49,25,6,19,38,40,20,Edelweiss Equity Savings Fund-Reg(G),Hybrid : Equity Oriented,55,56,55,55,55,54,51,29,4.63,7.33,6.98,4.7,13.32,12.48,16.48,9.96,,,,,,,,
Mirae Asset S&P 500 Top 50 ETF FoF-Reg(G),45836,Mirae Asset Mutual Fund,-7.03,-18.49,7.1,13.13,S&P 500 Top 50 TRI,18.64,,,-15.41,54,47,54,5,10,2,,,Mirae Asset S&P 500 Top 50 ETF FoF-Reg(G),FoFs : Overseas,57,57,57,57,57,51,27,24,-4.25,-4.25,-6.34,-2.49,10.02,9.01,11.06,6.14,,,,,,,,
Bandhan CRISIL IBX 90:10 SDL Plus Gilt - April 2032 Index Fund-Reg(G),46814,Bandhan Mutual Fund,2.58,4.11,5.82,11.84,CRISIL IBX 90:10 SDL Plus Gilt Index - April 2032,,,,4.67,23,23,23,14,20,,,,Bandhan CRISIL IBX 90:10 SDL Plus Gilt - April 2032 Index Fund-Reg(G),Debt : Long Duration,26,26,26,24,24,4,3,2,5.06,2.9,4.53,5.95,12.39,8.19,5.77,7.06,,,,,,,,
DSP NIFTY 1D Rate Liquid ETF,38904,DSP Mutual Fund,0.49,1.46,3.04,6.24,Nifty 1D Rate Index,5.94,4.61,,1.87,22,21,21,24,22,13,6,,DSP NIFTY 1D Rate Liquid ETF,Debt : ETFs,31,32,31,30,25,14,7,2,3.22,1.36,2.69,4.52,9.22,7.37,5.41,6.03,0.55,1.53,3.21,6.61,6.38,5.12,,6.3
DSP Nifty Top 10 Equal Weight ETF,49012,DSP Mutual Fund,3.61,4.35,1.88,,Nifty Top 10 Equal Weight - TRI,,,,2.4,50,143,83,31,,,,,DSP Nifty Top 10 Equal Weight ETF,Equity : ETFs,170,182,170,167,148,103,63,28,-1.32,4.21,2.34,-2.65,9.31,15.77,23.97,11.98,,,,,,,,
PGIM India Large Cap Fund(G),758,PGIM India Mutual Fund,4.36,4.67,-0.55,6.97,NIFTY 100 - TRI,12.03,18.57,10.06,1.0,12,12,10,8,26,29,28,26,PGIM India Large Cap Fund(G),Equity : Large Cap,38,38,38,38,37,34,31,28,-0.54,4.17,3.42,-2.39,8.22,14.54,21.57,11.86,,,,,,,,
ICICI Pru Nifty 200 Momentum 30 ETF,46682,ICICI Prudential Mutual Fund,3.94,-2.96,-16.26,-5.76,Nifty200 Momentum 30 - TRI,,,,-10.56,150,137,144,167,141,,,,ICICI Pru Nifty 200 Momentum 30 ETF,Equity : ETFs,170,182,170,167,148,103,63,28,-1.32,4.21,2.34,-2.65,9.31,15.77,23.97,11.98,,,,,,,,
Kotak Nifty SDL Plus AAA PSU Bond Jul 2028 60:40 Index Fund-Reg(G),46730,Kotak Mahindra Mutual Fund,1.95,3.22,4.82,9.77,Nifty SDL Plus AAA PSU Bond Jul 2028 60:40 Index,,,,3.65,26,21,22,24,25,,,,Kotak Nifty SDL Plus AAA PSU Bond Jul 2028 60:40 Index Fund-Reg(G),Debt : Medium to Long Duration,59,60,59,55,52,26,11,11,3.68,1.82,3.14,4.78,9.75,7.25,6.14,6.43,,,,,,,,
Edelweiss Overnight Fund-Reg(G),42955,Edelweiss Mutual Fund,0.51,1.51,3.16,6.47,CRISIL Liquid Overnight Index,6.23,4.99,,1.94,23,24,23,23,26,22,11,,Edelweiss Overnight Fund-Reg(G),Debt : Overnight,34,34,34,34,34,28,27,3,1.94,0.51,1.51,3.15,6.48,6.24,4.97,5.57,0.51,1.53,3.21,6.61,,,,6.3
Mahindra Manulife Multi Asset Allocation Fund-Reg(G),48449,Mahindra Manulife Mutual Fund,3.46,4.28,1.75,12.33,NIFTY 500 - TRI,,,,4.09,8,20,14,11,10,,,,Mahindra Manulife Multi Asset Allocation Fund-Reg(G),Hybrid : Multi Asset Allocation,28,29,28,26,24,10,8,7,2.5,3.63,4.18,0.78,9.92,14.0,20.7,12.08,,,,,,,,
ICICI Pru Nifty Bank Index Fund-Reg(G),45994,ICICI Prudential Mutual Fund,9.36,13.74,7.59,15.42,NIFTY BANK - TRI,15.05,,,8.26,5,5,3,9,3,30,,,ICICI Pru Nifty Bank Index Fund-Reg(G),Equity : Index Funds,175,190,176,151,115,68,32,18,-2.57,4.67,2.21,-3.96,6.58,14.83,22.71,11.63,,,,,,,,
Mirae Asset Nifty 1D Rate Liquid ETF(IDCW),48119,Mirae Asset Mutual Fund,0.49,1.44,3.02,6.24,Nifty 1D Rate Index,,,,1.83,28,23,27,27,21,,,,Mirae Asset Nifty 1D Rate Liquid ETF(IDCW),Debt : ETFs,31,32,31,30,25,14,7,2,3.22,1.36,2.69,4.52,9.22,7.37,5.41,6.03,0.55,1.53,3.21,6.61,6.38,5.12,,6.3
Quant BFSI Fund-Reg(G),47989,Quant Mutual Fund,7.51,4.66,0.54,-1.62,Nifty Financial Services - TRI,,,,1.02,20,11,21,20,20,,,,Quant BFSI Fund-Reg(G),Equity : Sectoral - Financial Services,21,22,21,21,20,14,11,10,6.67,7.78,12.22,5.83,16.3,18.59,23.93,12.64,,,,,,,,
Kotak Nifty Next 50 Index Fund-Reg(G),44443,Kotak Mahindra Mutual Fund,4.95,3.86,-6.78,5.09,NIFTY NEXT 50 - TRI,15.4,,,-3.18,99,58,75,99,75,19,,,Kotak Nifty Next 50 Index Fund-Reg(G),Equity : Index Funds,175,190,176,151,115,68,32,18,-2.57,4.67,2.21,-3.96,6.58,14.83,22.71,11.63,,,,,,,,
HDFC MNC Fund-Reg(G),47648,HDFC Mutual Fund,3.72,-2.77,-11.27,-1.98,NIFTY MNC - TRI,,,,-7.79,5,2,3,5,5,,,,HDFC MNC Fund-Reg(G),Equity : Thematic - MNC,6,6,6,5,5,4,4,3,-7.19,2.76,-3.06,-8.88,2.54,11.07,17.42,9.06,,,,,,,,
Mahindra Manulife Equity Savings Fund-Reg(G),36671,Mahindra Manulife Mutual Fund,1.94,1.68,0.64,5.98,NIFTY 50 Equity Savings Index - TRI,8.39,13.43,,0.89,27,48,44,29,50,48,35,,Mahindra Manulife Equity Savings Fund-Reg(G),Hybrid : Equity Oriented,55,56,55,55,55,54,51,29,4.63,7.33,6.98,4.7,13.32,12.48,16.48,9.96,,,,,,,,
Mahindra Manulife Low Duration Fund-Reg(G),36894,Mahindra Manulife Mutual Fund,1.17,2.26,3.91,7.6,CRISIL Low Duration Debt Index,6.45,5.5,,2.67,19,17,19,17,17,18,19,,Mahindra Manulife Low Duration Fund-Reg(G),Debt : Low Duration,20,23,20,20,20,20,20,19,2.76,1.2,2.33,4.0,7.8,6.67,6.11,6.53,1.06,2.32,4.16,8.21,,,,8.95
Aditya Birla SL Gold Fund(G),16220,Aditya Birla Sun Life Mutual Fund,8.95,19.23,21.53,33.69,Gold-India,20.72,13.27,12.38,25.24,10,2,4,3,1,3,5,6,Aditya Birla SL Gold Fund(G),Gold : MFs,17,18,17,16,16,10,10,10,22.92,7.02,16.69,16.44,29.99,20.7,13.35,12.35,,,,,,,,
ICICI Pru CRISIL-IBX Financial Services 3-6 Months Debt Index Fund-Reg(G),49708,ICICI Prudential Mutual Fund,0.93,,,,CRISIL-IBX Financial Services 3 to 6 Months Debt Index,,,,,,21,,,,,,,ICICI Pru CRISIL-IBX Financial Services 3-6 Months Debt Index Fund-Reg(G),Debt : Ultra Short Duration,26,29,26,25,24,24,22,13,2.47,0.95,2.05,3.7,7.24,6.46,5.47,6.2,,,,,,,,
ICICI Pru Nifty 10 yr Benchmark G-Sec ETF,47331,ICICI Prudential Mutual Fund,2.62,4.45,6.43,12.36,Nifty 10 yr Benchmark G-Sec,,,,5.15,3,5,4,3,3,,,,ICICI Pru Nifty 10 yr Benchmark G-Sec ETF,Debt : Gilt (10 Yr Constant Duration),6,6,6,6,6,4,4,4,5.16,2.75,4.52,6.4,12.28,8.5,6.08,8.09,2.44,4.2,6.37,12.65,8.71,5.57,,16.32
Kotak Nifty Alpha 50 ETF,45687,Kotak Mahindra Mutual Fund,3.97,-3.12,-13.03,-1.02,Nifty Alpha 50 - TRI,10.89,,,-13.74,157,134,145,149,137,94,,,Kotak Nifty Alpha 50 ETF,Equity : ETFs,170,182,170,167,148,103,63,28,-1.32,4.21,2.34,-2.65,9.31,15.77,23.97,11.98,,,,,,,,
Union Business Cycle Fund-Reg(G),48599,Union Mutual Fund,3.9,1.91,-5.75,4.72,NIFTY 500 - TRI,,,,-5.26,52,50,30,45,41,,,,Union Business Cycle Fund-Reg(G),Equity : Thematic,89,98,90,79,60,38,21,9,-4.61,3.78,0.45,-5.44,6.93,17.04,26.27,13.41,,,,,,,,
Baroda BNP Paribas Business Cycle Fund-Reg(G),45686,Baroda BNP Paribas Mutual Fund,3.82,-0.66,-6.95,3.95,BSE 500 - TRI,15.58,,,-6.26,59,53,61,53,44,20,,,Baroda BNP Paribas Business Cycle Fund-Reg(G),Equity : Thematic,89,98,90,79,60,38,21,9,-4.61,3.78,0.45,-5.44,6.93,17.04,26.27,13.41,,,,,,,,
ICICI Pru Nifty FMCG ETF,45651,ICICI Prudential Mutual Fund,8.45,3.61,-3.56,8.49,NIFTY FMCG - TRI,16.72,,,0.66,89,28,92,108,92,30,,,ICICI Pru Nifty FMCG ETF,Equity : ETFs,170,182,170,167,148,103,63,28,-1.32,4.21,2.34,-2.65,9.31,15.77,23.97,11.98,,,,,,,,
Mirae Asset Nifty Smallcap 250 Momentum Quality 100 ETF,48496,Mirae Asset Mutual Fund,2.68,-4.49,-13.53,-6.16,Nifty Smallcap250 Momentum Quality 100 - TRI,,,,-12.97,154,150,154,150,147,,,,Mirae Asset Nifty Smallcap 250 Momentum Quality 100 ETF,Equity : ETFs,170,182,170,167,148,103,63,28,-1.32,4.21,2.34,-2.65,9.31,15.77,23.97,11.98,,,,,,,,
Franklin India Banking & PSU Debt Fund(G),28458,Franklin Templeton Mutual Fund,1.82,3.18,4.75,8.99,NIFTY Banking and PSU Debt Index,6.88,6.08,7.23,3.56,15,17,14,16,16,10,11,9,Franklin India Banking & PSU Debt Fund(G),Debt : Banking & PSU,26,26,26,26,26,21,16,15,3.5,1.85,3.08,4.7,9.12,6.99,6.36,7.2,,,,,,,,
Union Short Duration Fund-Reg(G),49467,Union Mutual Fund,1.75,,,,CRISIL Short Duration Debt Index,,,,,,20,,,,,,,Union Short Duration Fund-Reg(G),Debt : Short Duration,30,34,30,28,26,23,21,19,3.52,1.81,3.07,4.78,9.01,6.85,6.32,6.77,,,,,,,,
Motilal Oswal Nifty Midcap 100 ETF,13595,Motilal Oswal Mutual Fund,6.11,1.82,-2.5,11.47,Nifty Midcap 100 - TRI,22.55,33.95,15.83,-3.82,115,42,104,92,37,9,5,2,Motilal Oswal Nifty Midcap 100 ETF,Equity : ETFs,170,182,170,167,148,103,63,28,-1.32,4.21,2.34,-2.65,9.31,15.77,23.97,11.98,,,,,,,,
Mirae Asset Nifty Next 50 ETF,44314,Mirae Asset Mutual Fund,5.01,4.11,-6.54,5.78,NIFTY NEXT 50 - TRI,15.92,23.46,,-2.9,108,59,86,122,116,47,23,,Mirae Asset Nifty Next 50 ETF,Equity : ETFs,170,182,170,167,148,103,63,28,-1.32,4.21,2.34,-2.65,9.31,15.77,23.97,11.98,,,,,,,,
HSBC Low Duration Fund-Reg(G),13350,HSBC Mutual Fund,1.15,2.39,4.04,7.88,NIFTY Low Duration Debt Index,6.76,5.9,6.75,2.81,4,21,4,5,4,5,11,9,HSBC Low Duration Fund-Reg(G),Debt : Low Duration,20,23,20,20,20,20,20,19,2.76,1.2,2.33,4.0,7.8,6.67,6.11,6.53,,,,,,,,
Kotak Technology Fund-Reg(G),48587,Kotak Mahindra Mutual Fund,0.3,-10.86,-12.73,12.12,BSE TECk Index - TRI,,,,-15.44,7,6,7,8,3,,,,Kotak Technology Fund-Reg(G),Equity : Sectoral - Technology,12,12,12,11,9,5,5,4,-15.23,0.35,-10.99,-11.01,7.84,10.22,27.94,15.87,,,,,,,,
Motilal Oswal Nifty 500 Momentum 50 Index Fund-Reg(G),48961,Motilal Oswal Mutual Fund,5.29,-2.26,-15.46,,Nifty500 Momentum 50 - TRI,,,,-12.2,163,34,149,139,,,,,Motilal Oswal Nifty 500 Momentum 50 Index Fund-Reg(G),Equity : Index Funds,175,190,176,151,115,68,32,18,-2.57,4.67,2.21,-3.96,6.58,14.83,22.71,11.63,,,,,,,,
DSP Floater Fund-Reg(G),45396,DSP Mutual Fund,2.1,3.34,5.12,10.35,CRISIL Short Duration Debt Index,7.88,,,3.81,3,3,2,2,2,2,,,DSP Floater Fund-Reg(G),Debt : Floater,12,12,12,12,12,12,7,5,3.52,1.77,3.03,4.72,9.33,7.4,6.59,7.12,,,,,,,,
UTI BSE Low Volatility Index Fund-Reg(G),46409,UTI Mutual Fund,4.41,1.75,-3.43,3.78,BSE Low Volatility Index - TRI,16.16,,,1.19,66,91,104,78,94,13,,,UTI BSE Low Volatility Index Fund-Reg(G),Equity : Index Funds,175,190,176,151,115,68,32,18,-2.57,4.67,2.21,-3.96,6.58,14.83,22.71,11.63,,,,,,,,
Unifi Dynamic Asset Allocation Fund-Reg(G),49692,Unifi Mutual Fund,1.09,,,,CRISIL Hybrid 50+50 - Moderate Index,,,,,,33,,,,,,,Unifi Dynamic Asset Allocation Fund-Reg(G),Hybrid : Dynamic Asset Allocation,33,34,33,33,32,22,19,11,0.08,2.83,2.52,-0.34,7.64,11.63,14.43,9.5,,,,,,,,
UTI Nifty200 Quality 30 Index Fund-Reg(G),49144,UTI Mutual Fund,4.82,-1.63,-9.0,,NIFTY200 Quality 30 - TRI,,,,-4.28,114,74,142,124,,,,,UTI Nifty200 Quality 30 Index Fund-Reg(G),Equity : Index Funds,175,190,176,151,115,68,32,18,-2.57,4.67,2.21,-3.96,6.58,14.83,22.71,11.63,,,,,,,,
DSP Nifty Bank ETF,46468,DSP Mutual Fund,9.42,13.91,7.97,16.21,NIFTY BANK - TRI,,,,8.48,17,5,13,21,20,,,,DSP Nifty Bank ETF,Equity : ETFs,170,182,170,167,148,103,63,28,-1.32,4.21,2.34,-2.65,9.31,15.77,23.97,11.98,,,,,,,,
Nippon India Nifty Next 50 Junior BeES FoF-Reg(G),40664,Nippon India Mutual Fund,4.8,3.64,-7.16,4.96,NIFTY NEXT 50,15.46,23.13,,-3.39,54,10,26,55,53,10,5,,Nippon India Nifty Next 50 Junior BeES FoF-Reg(G),FoFs : Domestic,61,64,62,61,56,47,28,23,2.55,3.16,3.62,0.43,11.38,12.86,16.38,10.07,,,,,,,,
Bajaj Finserv Multi Cap Fund-Reg(G),49459,Bajaj Finserv Mutual Fund,4.51,,,,Nifty500 Multicap 50:25:25 - TRI,,,,,,14,,,,,,,Bajaj Finserv Multi Cap Fund-Reg(G),Equity : Multi Cap,42,43,42,40,37,28,20,14,-4.24,3.93,1.4,-3.94,9.47,16.46,24.57,13.59,,,,,,,,
Quantum Liquid Fund-Reg(G),19756,Quantum Mutual Fund,0.63,1.69,3.39,6.89,CRISIL Liquid Debt Index,6.48,5.13,5.76,2.13,34,34,34,34,34,32,31,28,Quantum Liquid Fund-Reg(G),Debt : Liquid,38,38,38,37,37,35,34,29,2.27,0.7,1.81,3.57,7.18,6.71,5.35,6.17,,,,,,,,
Motilal Oswal Ultra Short Term Fund-Reg(G),22532,Motilal Oswal Mutual Fund,0.65,1.53,2.93,5.96,CRISIL Ultra Short Term Debt Index,5.47,4.4,3.76,1.9,26,29,26,25,24,24,22,13,Motilal Oswal Ultra Short Term Fund-Reg(G),Debt : Ultra Short Duration,26,29,26,25,24,24,22,13,2.47,0.95,2.05,3.7,7.24,6.46,5.47,6.2,0.93,2.16,4.01,7.96,,,,8.44
Bank of India Business Cycle Fund-Reg(G),48964,Bank of India Mutual Fund,5.18,0.11,-10.15,,NIFTY 500 - TRI,,,,-9.37,75,12,50,70,,,,,Bank of India Business Cycle Fund-Reg(G),Equity : Thematic,89,98,90,79,60,38,21,9,-4.61,3.78,0.45,-5.44,6.93,17.04,26.27,13.41,,,,,,,,
Canara Rob Ultra Short Term Fund-Reg(G),5902,Canara Robeco Mutual Fund,0.98,2.04,3.62,7.04,CRISIL Ultra Short Term Debt Index,6.18,4.98,5.77,2.44,16,10,16,18,17,19,20,11,Canara Rob Ultra Short Term Fund-Reg(G),Debt : Ultra Short Duration,26,29,26,25,24,24,22,13,2.47,0.95,2.05,3.7,7.24,6.46,5.47,6.2,0.93,2.16,4.01,7.96,,,,8.44
Bank of India Mfg & Infra Fund-Reg(G),8484,Bank of India Mutual Fund,2.25,-1.69,-7.73,3.37,BSE India Infrastructure Index - TRI,21.1,31.38,15.29,-5.98,11,18,17,12,12,12,12,4,Bank of India Mfg & Infra Fund-Reg(G),Equity : Sectoral - Infrastructure,20,20,20,19,19,19,19,18,-6.07,3.79,0.23,-7.45,3.23,22.88,32.44,14.33,,,,,,,,
Tata Gold ETF,48435,Tata Mutual Fund,8.11,19.32,21.03,34.74,Gold-India,,,,24.67,19,18,14,15,1,,,,Tata Gold ETF,Gold : ETFs,31,34,31,30,28,14,11,11,20.58,4.84,14.21,11.69,27.82,18.97,14.0,12.76,,,,,,,,
UTI Nifty 500 Value 50 Index Fund-Reg(G),47577,UTI Mutual Fund,2.66,3.66,-3.91,2.24,NIFTY500 Value 50 - TRI,,,,1.73,55,170,81,86,98,,,,UTI Nifty 500 Value 50 Index Fund-Reg(G),Equity : Index Funds,175,190,176,151,115,68,32,18,-2.57,4.67,2.21,-3.96,6.58,14.83,22.71,11.63,,,,,,,,
Tata Housing Opportunities Fund-Reg(G),46764,Tata Mutual Fund,5.03,-0.01,-9.78,-0.2,Nifty Housing - TRI,,,,-8.48,72,16,52,69,53,,,,Tata Housing Opportunities Fund-Reg(G),Equity : Thematic,89,98,90,79,60,38,21,9,-4.61,3.78,0.45,-5.44,6.93,17.04,26.27,13.41,,,,,,,,
TRUSTMF Liquid Fund-Reg(G),45451,Trust Mutual Fund,0.7,1.81,3.55,7.15,CRISIL Liquid Debt Index,6.69,,,2.26,29,28,29,29,29,26,,,TRUSTMF Liquid Fund-Reg(G),Debt : Liquid,38,38,38,37,37,35,34,29,2.27,0.7,1.81,3.57,7.18,6.71,5.35,6.17,,,,,,,,
Bajaj Finserv Consumption Fund-Reg(G),49345,Bajaj Finserv Mutual Fund,6.72,0.04,,,Nifty India Consumption - TRI,,,,-6.23,17,6,18,,,,,,Bajaj Finserv Consumption Fund-Reg(G),Equity : Thematic - Consumption,20,22,20,18,17,13,13,9,-3.28,5.9,2.07,-5.13,9.91,16.91,22.83,13.66,,,,,,,,
Samco Dynamic Asset Allocation Fund-Reg(G),48331,Samco Mutual Fund,-0.68,-2.86,-5.57,0.2,NIFTY 50 Hybrid Composite Debt 50:50 Index,,,,-6.87,32,34,32,32,29,,,,Samco Dynamic Asset Allocation Fund-Reg(G),Hybrid : Dynamic Asset Allocation,33,34,33,33,32,22,19,11,0.08,2.83,2.52,-0.34,7.64,11.63,14.43,9.5,,,,,,,,
Franklin India Pension Plan(G),3396,Franklin Templeton Mutual Fund,2.63,2.8,1.76,9.37,CRISIL Short Term Debt Hybrid 60+40 Index,10.61,11.16,8.16,0.83,15,32,18,11,20,24,24,12,Franklin India Pension Plan(G),Hybrid : Solution Oriented,43,43,43,42,41,37,32,15,-0.73,3.36,2.24,-0.74,9.55,12.38,15.93,10.16,,,,,,,,
DSP Nifty 50 Equal Weight ETF,45715,DSP Mutual Fund,4.37,4.78,-1.79,9.05,NIFTY50 Equal Weight,16.56,,,3.84,27,85,75,80,84,32,,,DSP Nifty 50 Equal Weight ETF,Equity : ETFs,170,182,170,167,148,103,63,28,-1.32,4.21,2.34,-2.65,9.31,15.77,23.97,11.98,3.25,5.24,-1.78,7.86,15.6,26.98,,10.57
LIC MF Multi Asset Allocation Fund-Reg(G),49465,LIC Mutual Fund,4.19,,,,NIFTY 500 - TRI,,,,,,4,,,,,,,LIC MF Multi Asset Allocation Fund-Reg(G),Hybrid : Multi Asset Allocation,28,29,28,26,24,10,8,7,2.5,3.63,4.18,0.78,9.92,14.0,20.7,12.08,,,,,,,,
LIC MF Aggressive Hybrid Fund(G),2085,LIC Mutual Fund,3.2,2.06,-2.13,8.57,CRISIL Hybrid 35+65 - Aggressive Index,12.04,14.98,7.87,-1.89,46,27,40,44,32,24,29,24,LIC MF Aggressive Hybrid Fund(G),Hybrid : Equity Oriented,55,56,55,55,55,54,51,29,4.63,7.33,6.98,4.7,13.32,12.48,16.48,9.96,,,,,,,,
Bandhan Transportation and Logistics Fund-Reg(G),46986,Bandhan Mutual Fund,3.27,-0.63,-9.49,0.7,Nifty Transportation & Logistics - TRI,,,,-4.34,7,2,7,6,5,,,,Bandhan Transportation and Logistics Fund-Reg(G),Equity : Sectoral - Auto,10,10,10,8,6,1,1,1,-3.62,2.9,-0.24,-8.87,2.99,21.85,30.62,11.1,,,,,,,,
LIC MF Small Cap Fund(G),36914,LIC Mutual Fund,1.98,-8.75,-10.18,8.08,Nifty Smallcap 250 - TRI,17.53,32.29,,-15.35,29,28,29,24,9,14,16,,LIC MF Small Cap Fund(G),Equity : Small Cap,29,30,29,28,27,23,21,13,-9.98,3.77,-2.64,-8.47,6.59,18.06,34.02,16.3,,,,,,,,
ICICI Pru Nifty IT Index Fund-Reg(G),46707,ICICI Prudential Mutual Fund,-3.47,-18.34,-15.58,6.4,NIFTY IT - TRI,,,,-18.19,172,186,173,141,62,,,,ICICI Pru Nifty IT Index Fund-Reg(G),Equity : Index Funds,175,190,176,151,115,68,32,18,-2.57,4.67,2.21,-3.96,6.58,14.83,22.71,11.63,,,,,,,,
HDFC BSE Sensex ETF,34084,HDFC Mutual Fund,4.18,4.82,0.31,9.87,BSE SENSEX - TRI,13.22,21.55,,2.26,55,113,67,36,72,79,51,,HDFC BSE Sensex ETF,Equity : ETFs,170,182,170,167,148,103,63,28,-1.32,4.21,2.34,-2.65,9.31,15.77,23.97,11.98,,,,,,,,
JM Large Cap Fund-Reg(G),1858,JM Financial Mutual Fund,3.92,0.98,-6.69,1.72,BSE 100 - TRI,15.51,18.94,10.34,-3.73,36,25,34,35,33,9,26,24,JM Large Cap Fund-Reg(G),Equity : Large Cap,38,38,38,38,37,34,31,28,-0.54,4.17,3.42,-2.39,8.22,14.54,21.57,11.86,,,,,,,,
Bandhan Bond Fund - Income Plan-Reg(G),1090,Bandhan Mutual Fund,2.08,3.32,4.31,9.47,NIFTY Medium to Long Duration Debt Index,6.37,4.93,6.61,3.71,26,26,26,24,24,4,3,2,Bandhan Bond Fund - Income Plan-Reg(G),Debt : Long Duration,26,26,26,24,24,4,3,2,5.06,2.9,4.53,5.95,12.39,8.19,5.77,7.06,,,,,,,,
LIC MF Dividend Yield Fund-Reg(G),41332,LIC Mutual Fund,3.96,1.7,-4.07,13.2,NIFTY 500 - TRI,19.48,25.65,,-3.22,9,5,4,2,2,2,4,,LIC MF Dividend Yield Fund-Reg(G),Equity : Thematic - Dividend Yield,10,10,10,10,9,8,6,5,-2.21,3.6,1.42,-4.84,8.14,18.12,27.34,13.81,,,,,,,,
ICICI Pru Nifty 200 Momentum 30 Index Fund-Reg(G),46683,ICICI Prudential Mutual Fund,3.88,-3.22,-16.45,-6.3,Nifty200 Momentum 30 - TRI,,,,-10.82,157,157,162,150,112,,,,ICICI Pru Nifty 200 Momentum 30 Index Fund-Reg(G),Equity : Index Funds,175,190,176,151,115,68,32,18,-2.57,4.67,2.21,-3.96,6.58,14.83,22.71,11.63,,,,,,,,
Kotak Global Innovation FoF-Reg(G),45334,Kotak Mahindra Mutual Fund,-6.18,-15.4,-9.34,1.9,MSCI AC World Index,8.07,,,-13.28,43,43,48,53,48,30,,,Kotak Global Innovation FoF-Reg(G),FoFs : Overseas,57,57,57,57,57,51,27,24,-4.25,-4.25,-6.34,-2.49,10.02,9.01,11.06,6.14,,,,,,,,
ITI Focused Equity Fund-Reg(G),45722,ITI Mutual Fund,4.0,2.78,-3.08,10.38,NIFTY 500 - TRI,,,,-2.87,22,32,23,21,21,,,,ITI Focused Equity Fund-Reg(G),Equity : Flexi Cap,48,48,48,48,47,35,26,21,-3.57,4.17,1.94,-4.02,8.9,15.42,23.38,13.13,,,,,,,,
SBI FMP-42-1857D-Reg(G),45447,SBI Mutual Fund,0.94,2.15,3.78,8.07,CRISIL Medium to Long Term Debt Index,6.7,,,2.67,66,70,67,64,58,30,,,SBI FMP-42-1857D-Reg(G),Debt : FTP/FMP,92,93,92,91,91,49,17,8,2.77,1.11,2.32,3.96,8.33,6.9,5.66,6.0,,,,,,,,
Sundaram Overnight Fund-Reg(G),42000,Sundaram Mutual Fund,0.52,1.54,3.17,6.5,Nifty 1D Rate Index,6.24,4.95,,1.96,6,5,5,14,18,13,23,,Sundaram Overnight Fund-Reg(G),Debt : Overnight,34,34,34,34,34,28,27,3,1.94,0.51,1.51,3.15,6.48,6.24,4.97,5.57,0.55,1.53,3.21,6.61,6.38,5.12,,6.3
ITI Large Cap Fund-Reg(G),44400,ITI Mutual Fund,2.6,2.97,-2.34,2.24,NIFTY 100 - TRI,13.65,,,-1.81,30,37,29,24,32,21,,,ITI Large Cap Fund-Reg(G),Equity : Large Cap,38,38,38,38,37,34,31,28,-0.54,4.17,3.42,-2.39,8.22,14.54,21.57,11.86,,,,,,,,
LIC MF ULIS,2154,LIC Mutual Fund,3.88,3.27,0.31,9.49,CRISIL Hybrid 35+65 - Aggressive Index,10.19,17.65,9.35,0.98,13,11,10,17,17,25,12,10,LIC MF ULIS,Hybrid : Solution Oriented,43,43,43,42,41,37,32,15,-0.73,3.36,2.24,-0.74,9.55,12.38,15.93,10.16,,,,,,,,
HDFC FMP-Sr 46-1861D-Mar 2022-Reg(G),46453,HDFC Mutual Fund,1.4,2.62,4.26,9.18,NIFTY Medium to Long Duration Debt Index,7.18,,,3.17,15,15,15,18,18,12,,,HDFC FMP-Sr 46-1861D-Mar 2022-Reg(G),Debt : FTP/FMP,92,93,92,91,91,49,17,8,2.77,1.11,2.32,3.96,8.33,6.9,5.66,6.0,,,,,,,,
Bajaj Finserv Nifty 1D Rate Liquid ETF(G),48746,Bajaj Finserv Mutual Fund,0.48,1.46,3.03,,Nifty 1D Rate Index,,,,1.88,21,25,22,25,,,,,Bajaj Finserv Nifty 1D Rate Liquid ETF(G),Debt : ETFs,31,32,31,30,25,14,7,2,3.22,1.36,2.69,4.52,9.22,7.37,5.41,6.03,0.55,1.53,3.21,6.61,6.38,5.12,,6.3
Axis Global Innovation FoF-Reg(G),45539,Axis Mutual Fund,-3.79,-12.63,-6.24,7.5,MSCI ACWI Net TRI,10.11,,,-13.45,45,25,34,43,36,24,,,Axis Global Innovation FoF-Reg(G),FoFs : Overseas,57,57,57,57,57,51,27,24,-4.25,-4.25,-6.34,-2.49,10.02,9.01,11.06,6.14,,,,,,,,
Axis CRISIL IBX 70:30 CPSE Plus SDL April 2025 Index Fund-Reg(G),45992,Axis Mutual Fund,0.59,1.68,3.41,7.16,CRISIL IBX 70:30 CPSE Plus SDL - April 2025,6.09,,,2.13,27,28,28,27,28,15,,,Axis CRISIL IBX 70:30 CPSE Plus SDL April 2025 Index Fund-Reg(G),Debt : Medium Duration,29,29,29,29,29,18,12,12,3.24,1.45,2.79,4.44,8.99,7.13,6.96,6.77,,,,,,,,
Kotak FMP-292-1735D(G),45679,Kotak Mahindra Mutual Fund,1.01,2.16,3.76,8.11,CRISIL Composite Bond Index,6.7,,,2.7,60,61,66,69,56,31,,,Kotak FMP-292-1735D(G),Debt : FTP/FMP,92,93,92,91,91,49,17,8,2.77,1.11,2.32,3.96,8.33,6.9,5.66,6.0,,,,,,,,
Kotak FMP-292-1735D(IDCW),45790,Kotak Mahindra Mutual Fund,1.01,2.16,3.76,8.11,NIFTY Medium to Long Duration Debt Index,6.7,,,2.7,59,60,65,68,55,32,,,Kotak FMP-292-1735D(IDCW),Debt : FTP/FMP,92,93,92,91,91,49,17,8,2.77,1.11,2.32,3.96,8.33,6.9,5.66,6.0,,,,,,,,
Invesco India ESG Integration Strategy Fund-Reg(G),45348,Invesco Mutual Fund,4.71,-0.87,-5.1,10.03,NIFTY100 ESG - TRI,11.6,,,-4.69,50,24,65,40,18,32,,,Invesco India ESG Integration Strategy Fund-Reg(G),Equity : Thematic,89,98,90,79,60,38,21,9,-4.61,3.78,0.45,-5.44,6.93,17.04,26.27,13.41,,,,,,,,
ICICI Pru FMP-85-10Y-I(G),43023,ICICI Prudential Mutual Fund,2.25,3.74,5.46,11.02,CRISIL Composite Bond Index,8.23,7.1,,4.17,4,5,4,4,4,2,1,,ICICI Pru FMP-85-10Y-I(G),Debt : FTP/FMP,92,93,92,91,91,49,17,8,2.77,1.11,2.32,3.96,8.33,6.9,5.66,6.0,,,,,,,,
Axis Greater China Equity FoF-Reg(G),44318,Axis Mutual Fund,-7.06,0.28,-5.11,12.25,MSCI Golden Dragon Index (Total Return Net),1.81,,,-3.17,23,48,15,30,15,44,,,Axis Greater China Equity FoF-Reg(G),FoFs : Overseas,57,57,57,57,57,51,27,24,-4.25,-4.25,-6.34,-2.49,10.02,9.01,11.06,6.14,,,,,,,,
Samco Flexi Cap Fund-Reg(G),46217,Samco Mutual Fund,2.49,-9.61,-17.11,-14.46,NIFTY 500 - TRI,0.03,,,-19.59,48,45,48,48,47,35,,,Samco Flexi Cap Fund-Reg(G),Equity : Flexi Cap,48,48,48,48,47,35,26,21,-3.57,4.17,1.94,-4.02,8.9,15.42,23.38,13.13,,,,,,,,
Bandhan CRISIL IBX Gilt April 2032 Index Fund-Reg(G),47601,Bandhan Mutual Fund,2.61,4.56,6.4,12.24,CRISIL IBX Gilt Index - April 2032,,,,5.21,10,21,15,6,15,,,,Bandhan CRISIL IBX Gilt April 2032 Index Fund-Reg(G),Debt : Long Duration,26,26,26,24,24,4,3,2,5.06,2.9,4.53,5.95,12.39,8.19,5.77,7.06,,,,,,,,
