Tata Business Cycle Fund-Reg(G),45373,Tata Mutual Fund,-5.96,-7.11,-6.92,8.33,NIFTY 500 - TRI,18.1,,,-5.05,55,53,57,48,38,12,,,Tata Business Cycle Fund-Reg(G),Equity : Thematic,89,89,80,71,56,36,20,9,-5.1,-5.97,-5.34,-4.72,11.49,15.97,20.38,12.86,,,,,,,,
Mirae Asset Healthcare Fund-Reg(G),39122,Mirae Asset Mutual Fund,-6.06,-3.63,4.1,23.46,BSE Health Care - TRI,17.81,26.59,,-5.07,9,13,11,11,9,8,4,,Mirae Asset Healthcare Fund-Reg(G),Equity : Sectoral - Pharma,18,18,16,16,15,10,9,3,-4.75,-5.29,-2.8,5.83,24.01,19.96,25.61,12.88,-3.91,-2.87,8.02,25.24,21.16,25.95,,-50.64
Baroda BNP Paribas Multi Cap Fund-Reg(G),500,Baroda BNP Paribas Mutual Fund,-7.19,-3.73,1.11,17.45,Nifty500 Multicap 50:25:25 - TRI,16.59,21.89,13.0,-7.25,39,32,19,11,9,9,5,9,Baroda BNP Paribas Multi Cap Fund-Reg(G),Equity : Multi Cap,42,42,41,39,37,27,20,14,-4.96,-5.8,-4.15,-1.28,13.42,15.06,18.3,13.13,,,,,,,,
WOC Mid Cap Fund-Reg(G),46769,WhiteOak Capital Mutual Fund,-9.14,-3.61,1.54,18.22,BSE 150 MidCap - TRI,,,,-8.3,23,25,6,3,10,,,,WOC Mid Cap Fund-Reg(G),Equity : Mid Cap,30,30,30,30,30,25,23,20,-7.66,-8.0,-5.16,-3.03,15.87,18.79,22.89,15.24,-5.55,-7.64,-5.3,11.29,20.43,25.08,,-72.16
Aditya Birla SL Nifty 50 ETF,12811,Aditya Birla Sun Life Mutual Fund,-1.16,-1.97,-1.07,10.11,NIFTY 50 - TRI,11.86,15.62,11.57,-0.04,29,15,51,60,101,50,31,10,Aditya Birla SL Nifty 50 ETF,Equity : ETFs,171,171,169,157,145,97,63,25,-2.48,-3.34,-3.07,-1.08,12.77,14.56,16.96,11.23,,,,,,,,
UTI MNC Fund-Reg(G),3634,UTI Mutual Fund,-6.6,-7.8,-7.5,10.32,NIFTY MNC - TRI,10.96,12.58,9.9,-4.94,4,4,4,3,2,2,3,2,UTI MNC Fund-Reg(G),Equity : Thematic - MNC,6,6,6,5,5,4,4,3,-4.9,-6.1,-5.98,-6.95,7.63,10.34,14.09,9.72,,,,,,,,
Franklin Build India Fund(G),7864,Franklin Templeton Mutual Fund,-6.94,-8.03,-6.88,10.98,BSE India Infrastructure Index - TRI,25.36,25.42,15.84,-6.38,7,7,6,3,10,5,6,2,Franklin Build India Fund(G),Equity : Sectoral - Infrastructure,20,20,19,19,19,19,19,18,-7.86,-8.42,-8.97,-9.86,10.47,21.91,24.02,13.89,-5.6,-13.65,-18.32,,,,,-79.9
Canara Rob Mid Cap Fund-Reg(G),46001,Canara Robeco Mutual Fund,-7.05,-5.3,-4.78,15.01,BSE 150 MidCap - TRI,,,,-7.42,15,9,16,22,16,,,,Canara Rob Mid Cap Fund-Reg(G),Equity : Mid Cap,30,30,30,30,30,25,23,20,-7.66,-8.0,-5.16,-3.03,15.87,18.79,22.89,15.24,-5.55,-7.64,-5.3,11.29,20.43,25.08,,-72.16
ICICI Pru Nifty Bank ETF,32451,ICICI Prudential Mutual Fund,-1.27,-3.61,0.65,10.65,NIFTY BANK - TRI,9.81,10.48,,-0.95,71,50,100,29,67,79,57,,ICICI Pru Nifty Bank ETF,Equity : ETFs,171,171,169,157,145,97,63,25,-2.48,-3.34,-3.07,-1.08,12.77,14.56,16.96,11.23,,,,,,,,
Sundaram Multi Cap Fund(G),2370,Sundaram Mutual Fund,-5.7,-4.24,-2.22,11.38,Nifty500 Multicap 50:25:25 - TRI,13.52,19.41,13.51,-4.84,19,19,23,19,26,18,8,5,Sundaram Multi Cap Fund(G),Equity : Multi Cap,42,42,41,39,37,27,20,14,-4.96,-5.8,-4.15,-1.28,13.42,15.06,18.3,13.13,,,,,,,,
DSP Short Term Fund-Reg(G),729,DSP Mutual Fund,0.8,1.83,3.71,7.72,CRISIL Short Duration Debt Index,6.01,5.82,6.66,0.9,12,15,10,11,12,13,13,11,DSP Short Term Fund-Reg(G),Debt : Short Duration,30,30,29,26,25,23,21,19,0.84,0.75,1.74,3.6,7.41,6.38,6.12,6.64,,,,,,,,
HDFC Gold ETF FoF(G),15381,HDFC Mutual Fund,9.49,7.9,20.87,33.99,Gold-India,19.33,14.86,10.06,11.27,6,10,8,9,9,8,3,5,HDFC Gold ETF FoF(G),Gold : MFs,17,17,16,16,16,10,10,10,10.8,9.34,6.65,20.26,34.09,19.45,14.78,9.95,,,,,,,,
Mirae Asset NYSE FANG+ ETF,45379,Mirae Asset Mutual Fund,4.31,19.25,40.31,49.52,NYSE FANG+ TRI,33.05,,,5.68,3,3,1,2,2,2,,,Mirae Asset NYSE FANG+ ETF,Equity : ETFs,171,171,169,157,145,97,63,25,-2.48,-3.34,-3.07,-1.08,12.77,14.56,16.96,11.23,,,,,,,,
Kotak Pioneer Fund-Reg(G),43927,Kotak Mahindra Mutual Fund,-5.09,-1.92,1.98,21.1,NIFTY 500 - TRI,17.39,22.43,,-3.85,31,35,11,9,7,14,8,,Kotak Pioneer Fund-Reg(G),Equity : Thematic,89,89,80,71,56,36,20,9,-5.1,-5.97,-5.34,-4.72,11.49,15.97,20.38,12.86,,,,,,,,
Tata ST Bond Fund-Reg(G),3286,Tata Mutual Fund,0.77,1.75,3.52,7.34,CRISIL Short Duration Debt Index,5.95,5.78,6.01,0.81,24,20,20,21,20,14,14,16,Tata ST Bond Fund-Reg(G),Debt : Short Duration,30,30,29,26,25,23,21,19,0.84,0.75,1.74,3.6,7.41,6.38,6.12,6.64,,,,,,,,
SBI Retirement Benefit Fund-Aggressive Plan-Reg(G),30398,SBI Mutual Fund,-3.02,-4.67,-4.67,9.03,BSE 500 - TRI,12.98,,,-2.07,24,26,39,41,27,10,,,SBI Retirement Benefit Fund-Aggressive Plan-Reg(G),Hybrid : Solution Oriented,43,43,42,42,40,37,32,13,-2.21,-2.88,-1.95,0.03,11.42,11.0,12.26,10.07,-2.37,-5.86,-3.43,8.91,13.88,18.0,,-35.26
Kotak Business Cycle Fund-Reg(G),46472,Kotak Mahindra Mutual Fund,-5.6,-3.06,1.62,23.19,NIFTY 500 - TRI,,,,-3.92,34,46,22,11,3,,,,Kotak Business Cycle Fund-Reg(G),Equity : Thematic,89,89,80,71,56,36,20,9,-5.1,-5.97,-5.34,-4.72,11.49,15.97,20.38,12.86,,,,,,,,
Edelweiss US Technology Equity FOF-Reg(G),44630,Edelweiss Mutual Fund,7.75,20.03,46.14,33.22,Russell 1000 Equal Weighted Technology Index,20.45,,,9.71,5,8,5,4,8,4,,,Edelweiss US Technology Equity FOF-Reg(G),FoFs : Overseas,58,58,58,58,57,48,27,24,4.76,4.64,6.57,18.39,23.28,9.57,9.02,7.33,,,,,,,,
Kotak Nifty 50 ETF,8469,Kotak Mahindra Mutual Fund,-1.16,-1.97,-1.07,10.14,NIFTY 50 - TRI,11.77,15.52,11.51,-0.04,31,20,57,61,95,62,41,13,Kotak Nifty 50 ETF,Equity : ETFs,171,171,169,157,145,97,63,25,-2.48,-3.34,-3.07,-1.08,12.77,14.56,16.96,11.23,,,,,,,,
Axis Balanced Advantage Fund-Reg(G),37918,Axis Mutual Fund,-1.27,-0.44,2.85,15.56,NIFTY 50 Hybrid Composite Debt 50:50 Index,12.28,11.89,,-0.39,5,8,6,2,1,4,8,,Axis Balanced Advantage Fund-Reg(G),Hybrid : Dynamic Asset Allocation,33,33,33,33,30,22,19,11,-1.9,-2.41,-1.65,-0.51,8.86,10.83,11.46,9.11,,,,,,,,
Edelweiss Multi Cap Fund-Reg(G),48147,Edelweiss Mutual Fund,-8.17,-6.36,-1.63,15.01,Nifty500 Multicap 50:25:25 - TRI,,,,-7.36,40,40,36,17,14,,,,Edelweiss Multi Cap Fund-Reg(G),Equity : Multi Cap,42,42,41,39,37,27,20,14,-4.96,-5.8,-4.15,-1.28,13.42,15.06,18.3,13.13,,,,,,,,
HSBC Ultra Short Duration Fund-Reg(G),44328,HSBC Mutual Fund,0.62,1.71,3.53,7.39,NIFTY Ultra Short Duration Debt Index,6.43,5.57,,0.72,6,7,6,6,8,4,8,,HSBC Ultra Short Duration Fund-Reg(G),Debt : Ultra Short Duration,26,26,25,24,24,24,22,13,0.69,0.59,1.65,3.41,7.1,6.12,5.37,6.21,,,,,,,,
Aditya Birla SL Nifty Bank ETF,34434,Aditya Birla Sun Life Mutual Fund,-1.28,-3.62,0.62,10.61,NIFTY BANK - TRI,9.78,10.54,,-0.96,78,57,107,35,71,80,56,,Aditya Birla SL Nifty Bank ETF,Equity : ETFs,171,171,169,157,145,97,63,25,-2.48,-3.34,-3.07,-1.08,12.77,14.56,16.96,11.23,,,,,,,,
DSP Corp Bond Fund-Reg(G),37709,DSP Mutual Fund,0.73,1.8,3.71,7.65,CRISIL Corporate Bond Index,5.72,5.71,,0.88,14,17,15,18,17,19,17,,DSP Corp Bond Fund-Reg(G),Debt : Corporate Bond,21,21,21,21,21,20,18,12,0.89,0.79,1.82,3.84,7.98,6.26,6.3,6.98,,,,,,,,
Nippon India ETF Nifty PSU Bank BeES,3722,Nippon India Mutual Fund,-4.42,-8.2,-8.54,-3.59,NIFTY PSU BANK - TRI,29.19,23.2,4.71,-3.98,121,118,151,132,144,3,7,23,Nippon India ETF Nifty PSU Bank BeES,Equity : ETFs,171,171,169,157,145,97,63,25,-2.48,-3.34,-3.07,-1.08,12.77,14.56,16.96,11.23,,,,,,,,
Helios Flexi Cap Fund-Reg(G),48299,Helios Mutual Fund,-6.75,-3.25,-0.07,16.61,NIFTY 500 - TRI,,,,-6.19,38,37,22,14,14,,,,Helios Flexi Cap Fund-Reg(G),Equity : Flexi Cap,48,48,48,48,47,34,26,20,-4.64,-5.48,-4.2,-2.15,12.96,13.66,17.23,12.69,,,,,,,,
SBI Gold-Reg(G),14666,SBI Mutual Fund,9.77,8.14,21.56,34.55,Gold-London Bullion Market association (LBMA),19.54,14.68,10.14,11.33,5,5,5,3,6,5,8,3,SBI Gold-Reg(G),Gold : MFs,17,17,16,16,16,10,10,10,10.8,9.34,6.65,20.26,34.09,19.45,14.78,9.95,,,,,,,,
Navi Nifty 50 Index Fund-Reg(G),45614,Navi Mutual Fund,-1.19,-2.04,-1.24,9.72,NIFTY 50 - TRI,11.43,,,-0.07,18,6,25,29,54,31,,,Navi Nifty 50 Index Fund-Reg(G),Equity : Index Funds,175,175,161,132,108,56,30,18,-4.24,-5.01,-4.81,-3.99,9.79,13.41,15.97,10.86,,,,,,,,
Invesco India Flexi Cap Fund-Reg(G),45945,Invesco Mutual Fund,-8.45,-3.15,2.51,21.62,BSE 500 - TRI,,,,-7.78,44,44,20,6,3,,,,Invesco India Flexi Cap Fund-Reg(G),Equity : Flexi Cap,48,48,48,48,47,34,26,20,-4.64,-5.48,-4.2,-2.15,12.96,13.66,17.23,12.69,-2.37,-5.86,-3.43,8.91,13.88,18.0,,-35.26
Mahindra Manulife Large & Mid Cap Fund-Reg(G),43915,Mahindra Manulife Mutual Fund,-5.66,-5.28,-4.49,3.32,NIFTY LargeMidcap 250 - TRI,13.95,20.12,,-5.46,18,16,25,24,26,19,7,,Mahindra Manulife Large & Mid Cap Fund-Reg(G),Equity : Large & Mid Cap,31,31,31,29,27,26,25,18,-5.39,-6.01,-4.07,-2.09,14.36,15.64,19.14,13.46,,,,,,,,
UTI Focused Fund-Reg(G),45685,UTI Mutual Fund,-1.34,-2.37,-2.32,14.68,NIFTY 500 - TRI,13.61,,,-0.37,3,3,7,29,19,14,,,UTI Focused Fund-Reg(G),Equity : Flexi Cap,48,48,48,48,47,34,26,20,-4.64,-5.48,-4.2,-2.15,12.96,13.66,17.23,12.69,,,,,,,,
Aditya Birla SL Quant Fund-Reg(G),48491,Aditya Birla Sun Life Mutual Fund,-6.94,-6.56,-9.11,,NIFTY 200 - TRI,,,,-6.4,67,62,52,58,,,,,Aditya Birla SL Quant Fund-Reg(G),Equity : Thematic,89,89,80,71,56,36,20,9,-5.1,-5.97,-5.34,-4.72,11.49,15.97,20.38,12.86,,,,,,,,
HDFC NIFTY Bank ETF,33563,HDFC Mutual Fund,-1.28,-3.62,0.64,10.61,NIFTY BANK - TRI,9.75,,,-0.95,77,56,102,32,70,84,,,HDFC NIFTY Bank ETF,Equity : ETFs,171,171,169,157,145,97,63,25,-2.48,-3.34,-3.07,-1.08,12.77,14.56,16.96,11.23,,,,,,,,
Canara Rob Focused Equity Fund-Reg(G),45510,Canara Robeco Mutual Fund,-3.89,-2.09,3.65,19.41,BSE 500 - TRI,14.89,,,-3.43,9,9,5,3,7,13,,,Canara Rob Focused Equity Fund-Reg(G),Equity : Multi Cap,42,42,41,39,37,27,20,14,-4.96,-5.8,-4.15,-1.28,13.42,15.06,18.3,13.13,-2.37,-5.86,-3.43,8.91,13.88,18.0,,-35.26
Franklin India Money Market Fund(G),3361,Franklin Templeton Mutual Fund,0.64,1.78,3.66,7.63,Nifty Money Market Index,6.57,5.8,6.8,0.76,4,6,4,4,9,9,9,4,Franklin India Money Market Fund(G),Debt : Money Market,22,22,22,22,22,19,16,13,0.72,0.62,1.72,3.54,7.4,6.47,5.72,6.59,,,,,,,,
Axis Business Cycles Fund-Reg(G),47580,Axis Mutual Fund,-5.14,-3.67,-2.39,12.25,NIFTY 500 - TRI,,,,-4.58,46,39,29,28,25,,,,Axis Business Cycles Fund-Reg(G),Equity : Thematic,89,89,80,71,56,36,20,9,-5.1,-5.97,-5.34,-4.72,11.49,15.97,20.38,12.86,,,,,,,,
Quant Large Cap Fund-Reg(G),46678,Quant Mutual Fund,-5.28,-8.14,-8.68,2.3,NIFTY 100 - TRI,,,,-3.38,28,35,37,35,34,,,,Quant Large Cap Fund-Reg(G),Equity : Large Cap,38,38,38,37,36,34,31,28,-2.54,-3.56,-3.46,-2.73,10.97,12.57,15.55,11.28,,,,,,,,
HSBC Infrastructure Fund-Reg(G),594,HSBC Mutual Fund,-9.77,-9.89,-9.72,12.51,Nifty Infrastructure - TRI,21.3,22.2,14.61,-9.65,15,13,12,11,8,11,15,8,HSBC Infrastructure Fund-Reg(G),Equity : Sectoral - Infrastructure,20,20,19,19,19,19,19,18,-7.86,-8.42,-8.97,-9.86,10.47,21.91,24.02,13.89,,,,,,,,
Mirae Asset Flexi Cap Fund-Reg(G),47596,Mirae Asset Mutual Fund,-4.07,-1.97,0.56,12.55,NIFTY 500 - TRI,,,,-2.98,14,15,4,11,30,,,,Mirae Asset Flexi Cap Fund-Reg(G),Equity : Flexi Cap,48,48,48,48,47,34,26,20,-4.64,-5.48,-4.2,-2.15,12.96,13.66,17.23,12.69,,,,,,,,
Franklin India Balanced Advantage Fund-Reg(G),46625,Franklin Templeton Mutual Fund,-2.15,0.06,1.28,11.7,NIFTY 50 Hybrid Composite Debt 50:50 Index,,,,-1.65,15,14,4,10,7,,,,Franklin India Balanced Advantage Fund-Reg(G),Hybrid : Dynamic Asset Allocation,33,33,33,33,30,22,19,11,-1.9,-2.41,-1.65,-0.51,8.86,10.83,11.46,9.11,,,,,,,,
DSP Focus Fund-Reg(G),8463,DSP Mutual Fund,-3.21,-3.33,1.1,15.99,NIFTY 500 - TRI,14.74,14.63,11.19,-1.72,4,4,15,12,12,14,18,12,DSP Focus Fund-Reg(G),Equity : Multi Cap,42,42,41,39,37,27,20,14,-4.96,-5.8,-4.15,-1.28,13.42,15.06,18.3,13.13,,,,,,,,
Kotak Manufacture in India Fund-Reg(G),46107,Kotak Mahindra Mutual Fund,-7.41,-5.96,-6.86,13.91,Nifty India Manufacturing - TRI,,,,-6.18,63,67,47,46,20,,,,Kotak Manufacture in India Fund-Reg(G),Equity : Thematic,89,89,80,71,56,36,20,9,-5.1,-5.97,-5.34,-4.72,11.49,15.97,20.38,12.86,,,,,,,,
Tata India Consumer Fund-Reg(G),33728,Tata Mutual Fund,-7.85,-3.07,0.28,21.14,Nifty India Consumption - TRI,18.49,18.67,,-6.7,19,20,8,4,3,2,3,,Tata India Consumer Fund-Reg(G),Equity : Thematic - Consumption,20,20,18,17,17,13,13,9,-3.85,-4.74,-3.3,-2.4,16.51,16.57,17.58,13.48,,,,,,,,
ITI Small Cap Fund-Reg(G),44399,ITI Mutual Fund,-9.97,-6.48,-1.21,14.67,Nifty Smallcap 250 - TRI,21.56,,,-9.29,20,18,10,10,8,4,,,ITI Small Cap Fund-Reg(G),Equity : Small Cap,29,29,29,28,27,23,19,13,-8.07,-9.09,-7.32,-2.37,12.26,18.09,26.94,16.48,,,,,,,,
Edelweiss Flexi Cap Fund-Reg(G),31778,Edelweiss Mutual Fund,-6.51,-5.31,-2.16,16.51,NIFTY 500 - TRI,15.53,18.35,13.43,-5.78,35,36,36,28,15,11,7,5,Edelweiss Flexi Cap Fund-Reg(G),Equity : Flexi Cap,48,48,48,48,47,34,26,20,-4.64,-5.48,-4.2,-2.15,12.96,13.66,17.23,12.69,,,,,,,,
ICICI Pru Constant Maturity Gilt Fund(G),30426,ICICI Prudential Mutual Fund,1.19,2.33,4.24,9.1,Crisil 10 Yr Gilt Index,7.14,6.79,8.04,1.13,3,3,3,2,3,1,1,3,ICICI Pru Constant Maturity Gilt Fund(G),Debt : Gilt (10 Yr Constant Duration),6,6,6,6,6,4,4,4,1.18,1.22,2.32,4.17,9.05,7.01,6.28,7.81,,,,,,,,
HDFC Infrastructure Fund(G),4253,HDFC Mutual Fund,-6.53,-8.24,-8.55,8.24,BSE India Infrastructure Index - TRI,26.86,23.62,9.75,-6.16,6,5,7,5,15,2,12,18,HDFC Infrastructure Fund(G),Equity : Sectoral - Infrastructure,20,20,19,19,19,19,19,18,-7.86,-8.42,-8.97,-9.86,10.47,21.91,24.02,13.89,-5.6,-13.65,-18.32,,,,,-79.9
DSP Overnight Fund-Reg(G),41945,DSP Mutual Fund,0.55,1.63,3.26,6.63,CRISIL Liquid Overnight Index,6.06,4.92,,0.65,12,12,15,12,12,8,6,,DSP Overnight Fund-Reg(G),Debt : Overnight,35,35,35,35,35,28,27,3,0.63,0.54,1.61,3.23,6.57,6.03,4.87,5.61,0.56,1.66,3.3,,,,,6.53
Bandhan Multi Cap Fund-Reg(G),45867,Bandhan Mutual Fund,-5.19,-5.06,-4.02,10.67,Nifty500 Multicap 50:25:25 - TRI,16.29,,,-4.01,13,15,29,30,28,10,,,Bandhan Multi Cap Fund-Reg(G),Equity : Multi Cap,42,42,41,39,37,27,20,14,-4.96,-5.8,-4.15,-1.28,13.42,15.06,18.3,13.13,,,,,,,,
HSBC Money Market Fund-Reg(G),621,HSBC Mutual Fund,0.63,1.74,3.59,7.49,Nifty Money Market Index,6.29,5.35,6.69,0.74,12,12,12,13,12,13,14,8,HSBC Money Market Fund-Reg(G),Debt : Money Market,22,22,22,22,22,19,16,13,0.72,0.62,1.72,3.54,7.4,6.47,5.72,6.59,,,,,,,,
ICICI Pru Equity Minimum Variance Fund-Reg(G),48947,ICICI Prudential Mutual Fund,-0.51,,,,NIFTY 50 - TRI,,,,0.1,2,2,,,,,,,ICICI Pru Equity Minimum Variance Fund-Reg(G),Equity : Thematic,89,89,80,71,56,36,20,9,-5.1,-5.97,-5.34,-4.72,11.49,15.97,20.38,12.86,,,,,,,,
SBI CRISIL IBX Gilt Index - June 2036 Fund-Reg(G),46941,SBI Mutual Fund,1.12,2.07,4.19,9.24,CRISIL IBX Gilt Index - June 2036,,,,1.17,4,3,7,14,9,,,,SBI CRISIL IBX Gilt Index - June 2036 Fund-Reg(G),Debt : Long Duration,26,26,24,24,21,3,3,2,1.0,0.88,1.66,3.91,8.92,6.95,5.89,6.73,,,,,,,,
DSP Multi Asset Allocation Fund-Reg(G),48206,DSP Mutual Fund,0.73,-0.04,5.84,16.68,NIFTY 500 - TRI,,,,0.86,9,8,9,2,3,,,,DSP Multi Asset Allocation Fund-Reg(G),Hybrid : Multi Asset Allocation,28,28,26,25,20,10,7,7,-0.37,-1.04,-1.13,1.57,12.51,13.32,17.17,11.66,,,,,,,,
Nippon India Gold Savings Fund(G),14108,Nippon India Mutual Fund,9.95,8.44,21.61,34.6,Gold-India,19.34,14.75,9.9,11.41,4,1,3,2,5,7,7,6,Nippon India Gold Savings Fund(G),Gold : MFs,17,17,16,16,16,10,10,10,10.8,9.34,6.65,20.26,34.09,19.45,14.78,9.95,,,,,,,,
ICICI Pru Commodities Fund-Reg(G),41999,ICICI Prudential Mutual Fund,-1.8,-6.02,-4.7,4.64,NIFTY COMMODITIES - TRI,14.51,29.76,,-0.89,11,5,48,37,46,19,1,,ICICI Pru Commodities Fund-Reg(G),Equity : Thematic,89,89,80,71,56,36,20,9,-5.1,-5.97,-5.34,-4.72,11.49,15.97,20.38,12.86,,,,,,,,
Kotak Infra & Eco Reform Fund(G),4228,Kotak Mahindra Mutual Fund,-9.92,-8.36,-10.11,12.63,Nifty Infrastructure - TRI,23.15,23.8,14.36,-10.19,18,15,9,13,7,7,11,10,Kotak Infra & Eco Reform Fund(G),Equity : Sectoral - Infrastructure,20,20,19,19,19,19,19,18,-7.86,-8.42,-8.97,-9.86,10.47,21.91,24.02,13.89,,,,,,,,
Sundaram Multi Asset Allocation Fund-Reg(G),48460,Sundaram Mutual Fund,0.83,0.72,3.14,13.82,NIFTY 500 - TRI,,,,1.89,5,7,5,8,10,,,,Sundaram Multi Asset Allocation Fund-Reg(G),Hybrid : Multi Asset Allocation,28,28,26,25,20,10,7,7,-0.37,-1.04,-1.13,1.57,12.51,13.32,17.17,11.66,,,,,,,,
HSBC Arbitrage Fund-Reg(G),29550,HSBC Mutual Fund,0.57,1.7,3.31,7.04,Nifty 50 Arbitrage,6.2,5.33,5.84,0.76,13,20,8,19,18,16,9,7,HSBC Arbitrage Fund-Reg(G),Hybrid : Arbitrage,30,30,27,26,26,24,22,14,0.74,0.59,1.66,3.35,7.07,6.19,5.15,5.8,0.78,2.16,3.85,7.49,6.72,5.27,,10.18
LIC MF Nifty 8-13 yr G-Sec ETF,31581,LIC Mutual Fund,1.26,2.46,4.48,9.42,Nifty 8-13 yr G-Sec,7.37,6.12,6.99,1.24,7,8,8,5,6,4,3,1,LIC MF Nifty 8-13 yr G-Sec ETF,Debt : ETFs,31,31,30,28,24,14,7,2,0.99,0.95,2.13,3.76,8.1,6.55,5.47,5.92,1.21,2.51,4.64,9.62,7.74,6.37,,13.64
Baroda BNP Paribas Large Cap Fund-Reg(G),23,Baroda BNP Paribas Mutual Fund,-4.91,-4.73,-4.85,11.42,NIFTY 100 - TRI,14.07,16.1,11.78,-4.1,35,33,31,30,21,9,10,9,Baroda BNP Paribas Large Cap Fund-Reg(G),Equity : Large Cap,38,38,38,37,36,34,31,28,-2.54,-3.56,-3.46,-2.73,10.97,12.57,15.55,11.28,,,,,,,,
Tata Large Cap Fund-Reg(G),3281,Tata Mutual Fund,-2.04,-2.79,-3.84,10.37,NIFTY 100 - TRI,12.31,15.56,10.88,-0.85,5,6,14,27,24,19,16,18,Tata Large Cap Fund-Reg(G),Equity : Large Cap,38,38,38,37,36,34,31,28,-2.54,-3.56,-3.46,-2.73,10.97,12.57,15.55,11.28,,,,,,,,
ICICI Pru BSE Liquid Rate ETF(IDCW),35122,ICICI Prudential Mutual Fund,0.53,1.59,3.16,6.45,BSE Liquid Rate Index,5.9,4.59,,0.62,26,21,21,18,18,12,5,,ICICI Pru BSE Liquid Rate ETF(IDCW),Debt : ETFs,31,31,30,28,24,14,7,2,0.99,0.95,2.13,3.76,8.1,6.55,5.47,5.92,,,,,,,,
ICICI Pru Housing Opp Fund-Reg(G),46546,ICICI Prudential Mutual Fund,-3.76,-6.2,-3.64,10.51,Nifty Housing - TRI,,,,-3.54,28,19,49,32,32,,,,ICICI Pru Housing Opp Fund-Reg(G),Equity : Thematic,89,89,80,71,56,36,20,9,-5.1,-5.97,-5.34,-4.72,11.49,15.97,20.38,12.86,,,,,,,,
Parag Parikh Conservative Hybrid Fund-Reg(G),45338,PPFAS Mutual Fund,0.59,0.88,3.0,10.01,CRISIL Hybrid 85+15 - Conservative Index,11.24,,,0.78,5,1,4,4,5,2,,,Parag Parikh Conservative Hybrid Fund-Reg(G),Hybrid : Debt Oriented (Conservative),19,19,19,19,19,19,18,17,-0.01,-0.33,0.42,2.42,8.91,8.21,8.53,7.43,,,,,,,,
Kotak MNC Fund-Reg(G),49046,Kotak Mahindra Mutual Fund,-5.92,-3.71,,,NIFTY MNC - TRI,,,,-4.85,3,3,2,,,,,,Kotak MNC Fund-Reg(G),Equity : Thematic - MNC,6,6,6,5,5,4,4,3,-4.9,-6.1,-5.98,-6.95,7.63,10.34,14.09,9.72,,,,,,,,
Tata Treasury Advantage Fund-Reg(G),3205,Tata Mutual Fund,0.67,1.73,3.59,7.42,CRISIL Low Duration Debt Index,6.26,5.88,6.27,0.74,9,2,5,7,7,9,7,13,Tata Treasury Advantage Fund-Reg(G),Debt : Low Duration,20,20,20,20,20,20,20,18,0.73,0.63,1.68,3.52,7.38,6.24,5.98,6.48,0.65,1.85,3.8,,,,,7.64
Templeton India Equity Income Fund(G),3367,Franklin Templeton Mutual Fund,-2.75,-3.7,-4.45,8.66,NIFTY 500 - TRI,17.75,23.73,14.69,-2.17,3,3,3,4,5,5,2,1,Templeton India Equity Income Fund(G),Equity : Thematic - Dividend Yield,10,10,10,9,9,8,6,5,-3.16,-4.14,-5.0,-4.7,10.35,17.6,21.68,13.32,,,,,,,,
Edelweiss Aggressive Hybrid Fund-Reg(G),7922,Edelweiss Mutual Fund,-3.33,-1.14,0.55,14.6,CRISIL Hybrid 35+65 - Aggressive Index,15.54,17.04,11.62,-2.79,24,24,16,19,9,4,3,3,Edelweiss Aggressive Hybrid Fund-Reg(G),Hybrid : Multi Asset Allocation,28,28,26,25,20,10,7,7,-0.37,-1.04,-1.13,1.57,12.51,13.32,17.17,11.66,,,,,,,,
Tata Banking & Financial Services Fund-Reg(G),33726,Tata Mutual Fund,-1.78,-3.4,2.96,11.3,Nifty Financial Services - TRI,13.86,12.38,,-0.62,6,6,7,7,7,5,5,,Tata Banking & Financial Services Fund-Reg(G),Equity : Sectoral - Financial Services,21,21,21,21,18,14,11,8,-1.8,-2.8,-3.98,1.37,9.93,12.8,12.16,10.94,,,,,,,,
UTI Short Duration Fund-Reg(G),3656,UTI Mutual Fund,0.77,1.8,3.81,7.72,CRISIL Short Duration Debt Index,6.43,7.39,6.27,0.88,16,19,16,7,13,5,2,14,UTI Short Duration Fund-Reg(G),Debt : Short Duration,30,30,29,26,25,23,21,19,0.84,0.75,1.74,3.6,7.41,6.38,6.12,6.64,,,,,,,,
Tata Infrastructure Fund-Reg(G),3254,Tata Mutual Fund,-10.11,-13.42,-16.97,3.99,BSE India Infrastructure Index - TRI,19.54,23.11,13.49,-9.59,14,16,19,19,17,14,13,12,Tata Infrastructure Fund-Reg(G),Equity : Sectoral - Infrastructure,20,20,19,19,19,19,19,18,-7.86,-8.42,-8.97,-9.86,10.47,21.91,24.02,13.89,-5.6,-13.65,-18.32,,,,,-79.9
DSP Equity Savings Fund-Reg(G),34871,DSP Mutual Fund,-0.29,-0.22,2.9,11.88,NIFTY 50 Equity Savings Index - TRI,8.8,9.63,,0.29,9,12,20,8,21,40,37,,DSP Equity Savings Fund-Reg(G),Hybrid : Equity Oriented,55,55,55,55,55,54,51,29,-1.66,-2.21,-1.28,0.42,10.31,10.23,12.12,9.63,,,,,,,,
Motilal Oswal Nifty India Defence Index Fund-Reg(G),48892,Motilal Oswal Mutual Fund,-7.39,-3.8,-14.79,,Nifty India Defence - TRI,,,,-8.28,141,123,74,131,,,,,Motilal Oswal Nifty India Defence Index Fund-Reg(G),Equity : Index Funds,175,175,161,132,108,56,30,18,-4.24,-5.01,-4.81,-3.99,9.79,13.41,15.97,10.86,,,,,,,,
Nippon India ETF Nifty 8-13 yr G-Sec Long Term Gilt,35459,Nippon India Mutual Fund,1.27,2.47,4.51,9.47,Nifty 8-13 yr G-Sec,7.41,6.13,,1.24,6,6,6,4,3,2,2,,Nippon India ETF Nifty 8-13 yr G-Sec Long Term Gilt,Debt : ETFs,31,31,30,28,24,14,7,2,0.99,0.95,2.13,3.76,8.1,6.55,5.47,5.92,1.21,2.51,4.64,9.62,7.74,6.37,,13.64
Nippon India ETF Nifty IT,44506,Nippon India Mutual Fund,-1.39,6.6,12.7,17.64,NIFTY IT - TRI,8.86,,,-0.2,64,73,12,14,31,89,,,Nippon India ETF Nifty IT,Equity : ETFs,171,171,169,157,145,97,63,25,-2.48,-3.34,-3.07,-1.08,12.77,14.56,16.96,11.23,,,,,,,,
Union Flexi Cap Fund-Reg(G),14559,Union Mutual Fund,-6.19,-3.41,-1.74,8.06,BSE 500 - TRI,12.51,17.71,10.93,-5.78,36,31,24,26,40,21,10,17,Union Flexi Cap Fund-Reg(G),Equity : Flexi Cap,48,48,48,48,47,34,26,20,-4.64,-5.48,-4.2,-2.15,12.96,13.66,17.23,12.69,-2.37,-5.86,-3.43,8.91,13.88,18.0,,-35.26
Kotak Gold Fund(G),14148,Kotak Mahindra Mutual Fund,9.71,8.05,21.24,34.72,Gold-India,19.05,14.79,10.07,11.04,10,6,7,6,4,10,5,4,Kotak Gold Fund(G),Gold : MFs,17,17,16,16,16,10,10,10,10.8,9.34,6.65,20.26,34.09,19.45,14.78,9.95,,,,,,,,
Edelweiss Nifty PSU Bond Plus SDL Apr 2027 50:50 Index Fund-Reg(G),45387,Edelweiss Mutual Fund,0.79,1.76,3.67,7.85,Nifty PSU Bond Plus SDL Apr 2027 50:50 Index,6.07,,,0.93,38,47,44,30,39,11,,,Edelweiss Nifty PSU Bond Plus SDL Apr 2027 50:50 Index Fund-Reg(G),Debt : Medium to Long Duration,59,59,56,52,52,16,11,11,0.95,0.89,1.85,3.68,8.03,6.31,6.03,6.12,,,,,,,,
Nippon India Innovation Fund-Reg(G),48169,Nippon India Mutual Fund,-5.62,-5.35,-6.62,14.16,NIFTY 500 - TRI,,,,-4.25,38,47,43,45,19,,,,Nippon India Innovation Fund-Reg(G),Equity : Thematic,89,89,80,71,56,36,20,9,-5.1,-5.97,-5.34,-4.72,11.49,15.97,20.38,12.86,,,,,,,,
BHARAT Bond ETF FOF - April 2033 -Reg(G),47284,Edelweiss Mutual Fund,0.92,2.21,5.25,9.07,NIFTY BHARAT Bond Index - April 2033,,,,0.97,15,14,6,13,42,,,,BHARAT Bond ETF FOF - April 2033 -Reg(G),FoFs : Domestic,61,62,61,59,55,46,27,23,-0.13,-0.76,-0.9,2.66,14.18,12.14,12.79,9.72,,,,,,,,
Bandhan Balanced Advantage Fund-Reg(G),30671,Bandhan Mutual Fund,-2.63,-0.52,1.56,11.29,NIFTY 50 Hybrid Composite Debt 50:50 Index,8.78,10.1,7.87,-1.98,19,23,8,8,10,18,14,8,Bandhan Balanced Advantage Fund-Reg(G),Hybrid : Dynamic Asset Allocation,33,33,33,33,30,22,19,11,-1.9,-2.41,-1.65,-0.51,8.86,10.83,11.46,9.11,,,,,,,,
SBI CRISIL IBX Gilt Index - Apr 2029 Fund-Reg(G),46971,SBI Mutual Fund,1.01,2.17,3.86,8.39,CRISIL IBX Gilt Index - April 2029,,,,1.05,5,8,3,8,9,,,,SBI CRISIL IBX Gilt Index - Apr 2029 Fund-Reg(G),Debt : Medium to Long Duration,59,59,56,52,52,16,11,11,0.95,0.89,1.85,3.68,8.03,6.31,6.03,6.12,,,,,,,,
UTI-Nifty Next 50 ETF,37338,UTI Mutual Fund,-7.45,-8.08,-9.51,15.73,NIFTY NEXT 50,15.82,18.32,,-6.52,152,155,140,139,39,32,18,,UTI-Nifty Next 50 ETF,Equity : ETFs,171,171,169,157,145,97,63,25,-2.48,-3.34,-3.07,-1.08,12.77,14.56,16.96,11.23,-5.16,-11.0,-9.6,12.52,14.75,17.07,,-69.99
SBI Credit Risk Fund-Reg(G),2770,SBI Mutual Fund,0.82,2.05,3.84,8.23,NIFTY Credit Risk Bond Index,7.09,6.98,7.4,0.89,8,3,1,8,3,5,7,4,SBI Credit Risk Fund-Reg(G),Debt : Credit Risk,15,15,15,15,15,15,15,11,0.89,0.74,1.7,3.81,7.93,8.93,6.56,6.51,,,,,,,,
DSP BSE Liquid Rate ETF,48724,DSP Mutual Fund,0.53,1.58,3.14,,BSE Liquid Rate Index,,,,0.63,24,26,23,20,,,,,DSP BSE Liquid Rate ETF,Debt : ETFs,31,31,30,28,24,14,7,2,0.99,0.95,2.13,3.76,8.1,6.55,5.47,5.92,,,,,,,,
Kotak Special Opportunities Fund-Reg(G),48809,Kotak Mahindra Mutual Fund,-6.26,-4.8,-3.05,,NIFTY 500 - TRI,,,,-4.99,53,58,39,31,,,,,Kotak Special Opportunities Fund-Reg(G),Equity : Thematic,89,89,80,71,56,36,20,9,-5.1,-5.97,-5.34,-4.72,11.49,15.97,20.38,12.86,,,,,,,,
Parag Parikh Liquid Fund-Reg(G),38735,PPFAS Mutual Fund,0.57,1.67,3.38,6.95,CRISIL Liquid Debt Index,6.13,4.99,,0.69,33,34,35,35,34,34,32,,Parag Parikh Liquid Fund-Reg(G),Debt : Liquid,38,38,37,37,37,35,34,29,0.71,0.58,1.73,3.51,7.24,6.43,5.27,6.2,,,,,,,,
Axis CRISIL IBX SDL May 2027 Index Fund-Reg(G),45999,Axis Mutual Fund,0.91,1.8,3.72,8.27,CRISIL IBX SDL Index - May 2027,,,,0.99,16,23,32,20,10,,,,Axis CRISIL IBX SDL May 2027 Index Fund-Reg(G),Debt : Medium to Long Duration,59,59,56,52,52,16,11,11,0.95,0.89,1.85,3.68,8.03,6.31,6.03,6.12,,,,,,,,
HSBC Multi Asset Allocation Fund-Reg(G),48468,HSBC Mutual Fund,-9.33,-3.71,-1.38,,BSE 200 - TRI,,,,-9.09,28,28,24,22,,,,,HSBC Multi Asset Allocation Fund-Reg(G),Hybrid : Multi Asset Allocation,28,28,26,25,20,10,7,7,-0.37,-1.04,-1.13,1.57,12.51,13.32,17.17,11.66,-1.58,-5.11,-2.94,9.57,13.58,17.39,,-25.19
ICICI Pru Bharat 22 FOF-(G),40232,ICICI Prudential Mutual Fund,-5.38,-8.74,-10.88,3.78,BSE Bharat 22 Index,28.42,25.56,,-5.13,54,55,58,56,55,1,1,,ICICI Pru Bharat 22 FOF-(G),FoFs : Domestic,61,62,61,59,55,46,27,23,-0.13,-0.76,-0.9,2.66,14.18,12.14,12.79,9.72,-4.01,-11.82,-11.77,-0.46,24.19,20.69,,-61.15
Aditya Birla SL Income Fund(G),405,Aditya Birla Sun Life Mutual Fund,0.78,1.56,3.6,7.93,CRISIL Medium to Long Term Debt Index,6.2,6.68,6.82,0.86,54,50,54,44,32,6,2,3,Aditya Birla SL Income Fund(G),Debt : Medium to Long Duration,59,59,56,52,52,16,11,11,0.95,0.89,1.85,3.68,8.03,6.31,6.03,6.12,,,,,,,,
Quant Quantamental Fund-Reg(G),45480,Quant Mutual Fund,-3.98,-7.52,-12.6,-0.33,NIFTY 200 - TRI,22.07,,,-2.87,19,24,62,64,55,7,,,Quant Quantamental Fund-Reg(G),Equity : Thematic,89,89,80,71,56,36,20,9,-5.1,-5.97,-5.34,-4.72,11.49,15.97,20.38,12.86,,,,,,,,
