ICICI Pru FMP-88-1226D-F(G),47232,ICICI Prudential Mutual Fund,0.46,1.36,2.7,7.06,CRISIL Medium Duration Debt Index,,,,6.48,54,56,66,59,55,,,,ICICI Pru FMP-88-1226D-F(G),Debt : FTP/FMP,79,79,79,79,79,49,10,4,6.73,0.49,1.57,2.74,7.36,7.48,6.19,6.09,,,,,,,,
Shriram Multi Asset Allocation Fund-Reg(G),48029,Shriram Mutual Fund,2.32,9.1,9.01,7.97,NIFTY 50 - TRI,,,,6.54,26,8,9,17,24,,,,Shriram Multi Asset Allocation Fund-Reg(G),Hybrid : Multi Asset Allocation,27,33,32,29,25,9,9,7,14.35,1.7,7.63,8.95,13.67,17.27,17.69,13.21,,,,,,,,
Nippon India Nifty G-Sec Oct 2028 Maturity Index Fund-Reg(G),47629,Nippon India Mutual Fund,0.47,1.96,2.57,8.75,Nifty G-Sec Oct 2028 Index,,,,8.01,8,42,17,29,6,,,,Nippon India Nifty G-Sec Oct 2028 Maturity Index Fund-Reg(G),Debt : Medium to Long Duration,59,60,60,60,59,36,11,11,7.12,0.47,1.78,2.14,7.78,7.42,5.24,6.26,,,,,,,,
Axis BSE Sensex ETF,47768,Axis Mutual Fund,1.59,7.57,6.04,8.64,BSE SENSEX - TRI,,,,10.87,70,56,58,121,89,,,,Axis BSE Sensex ETF,Equity : ETFs,170,214,205,191,168,122,72,33,9.0,0.95,7.36,7.03,7.92,16.94,18.01,13.8,,,,,,,,
SBI FMP-46-1850D-Reg(G),45620,SBI Mutual Fund,0.47,1.5,2.82,7.19,CRISIL Medium to Long Term Debt Index,7.3,,,6.71,37,42,36,32,39,30,,,SBI FMP-46-1850D-Reg(G),Debt : FTP/FMP,79,79,79,79,79,49,10,4,6.73,0.49,1.57,2.74,7.36,7.48,6.19,6.09,,,,,,,,
Axis NIFTY IT Index Fund-Reg(G),47983,Axis Mutual Fund,4.18,6.89,1.03,-12.16,NIFTY IT - TRI,,,,-12.12,172,7,95,171,165,,,,Axis NIFTY IT Index Fund-Reg(G),Equity : Index Funds,175,219,215,198,167,83,34,18,5.22,0.54,6.23,4.78,4.35,16.09,16.83,13.09,,,,,,,,
Bandhan US Treasury Bond 0-1 year specific Debt Passive FOF-Reg(G),47724,Bandhan Mutual Fund,1.25,2.79,6.7,10.09,ICE 0-1 Year US Treasury Securities Index,,,,8.45,54,14,47,54,50,,,,Bandhan US Treasury Bond 0-1 year specific Debt Passive FOF-Reg(G),FoFs : Overseas,56,56,56,56,56,53,27,23,27.59,0.05,7.93,20.79,27.7,22.16,11.19,10.41,,,,,,,,
Motilal Oswal Nifty 200 Momentum 30 ETF,46325,Motilal Oswal Mutual Fund,1.51,8.02,6.13,-5.22,Nifty200 Momentum 30 - TRI,17.27,,,-2.04,150,64,53,119,151,47,,,Motilal Oswal Nifty 200 Momentum 30 ETF,Equity : ETFs,170,214,205,191,168,122,72,33,9.0,0.95,7.36,7.03,7.92,16.94,18.01,13.8,,,,,,,,
Taurus Mid Cap Fund-Reg(G),3306,Taurus Mutual Fund,-1.41,2.9,2.4,0.9,Nifty Midcap 150 - TRI,16.31,18.66,14.92,2.62,18,31,27,29,27,26,23,17,Taurus Mid Cap Fund-Reg(G),Equity : Mid Cap,30,32,32,31,30,28,24,20,2.98,0.26,4.82,6.46,4.54,21.34,22.91,16.24,,,,,,,,
Kotak FMP-310-1131D(G),47871,Kotak Mahindra Mutual Fund,0.46,1.36,2.7,6.96,NIFTY Medium Duration Debt Index,,,,6.37,65,58,67,60,62,,,,Kotak FMP-310-1131D(G),Debt : FTP/FMP,79,79,79,79,79,49,10,4,6.73,0.49,1.57,2.74,7.36,7.48,6.19,6.09,,,,,,,,
Quantum Diversified Equity All Cap Active FOF-Reg(G),19904,Quantum Mutual Fund,0.68,5.78,5.69,7.32,BSE 500 - TRI,16.26,17.16,13.25,7.58,36,40,33,35,42,17,8,4,Quantum Diversified Equity All Cap Active FOF-Reg(G),FoFs : Domestic,60,87,81,72,60,50,31,23,18.18,2.64,8.7,12.84,17.0,15.61,13.73,10.63,,,,,,,,
Kotak NIFTY 100 Low Volatility 30 Index Fund-Reg(G),45716,Kotak Mahindra Mutual Fund,0.86,3.92,7.2,10.06,Nifty100 Low Volatility 30 - TRI,,,,9.89,59,114,178,38,41,,,,Kotak NIFTY 100 Low Volatility 30 Index Fund-Reg(G),Equity : Index Funds,175,219,215,198,167,83,34,18,5.22,0.54,6.23,4.78,4.35,16.09,16.83,13.09,,,,,,,,
Groww Largecap Fund-Reg(G),15997,Groww Mutual Fund,0.41,5.49,6.42,6.29,NIFTY 100 - TRI,13.2,14.0,11.84,8.13,19,29,24,13,24,25,27,23,Groww Largecap Fund-Reg(G),Equity : Large Cap,38,39,39,39,38,35,32,28,7.27,0.57,5.63,5.36,6.37,14.46,16.38,13.01,,,,,,,,
Edelweiss ASEAN Equity Off-Shore Fund-Reg(G),13404,Edelweiss Mutual Fund,0.45,1.87,7.42,13.22,MSCI AC ASEAN 10/40 Index,10.02,7.75,7.93,13.95,47,22,50,53,45,49,19,17,Edelweiss ASEAN Equity Off-Shore Fund-Reg(G),FoFs : Overseas,56,56,56,56,56,53,27,23,27.59,0.05,7.93,20.79,27.7,22.16,11.19,10.41,,,,,,,,
Sundaram Nifty 100 Equal Weight Fund(G),2384,Sundaram Mutual Fund,0.1,5.36,5.35,6.38,Nifty100 Equal Weight - TRI,16.74,18.51,12.61,8.11,71,153,139,102,83,33,5,16,Sundaram Nifty 100 Equal Weight Fund(G),Equity : Index Funds,175,219,215,198,167,83,34,18,5.22,0.54,6.23,4.78,4.35,16.09,16.83,13.09,,,,,,,,
Tata Nifty India Digital ETF FoF-Reg(G),46355,Tata Mutual Fund,0.91,5.64,9.11,-0.47,Nifty India Digital - TRI,18.43,,,-2.38,57,33,36,17,55,11,,,Tata Nifty India Digital ETF FoF-Reg(G),FoFs : Domestic,60,87,81,72,60,50,31,23,18.18,2.64,8.7,12.84,17.0,15.61,13.73,10.63,,,,,,,,
SBI Magnum Childrens Benefit Fund-Savings Plan,2748,SBI Mutual Fund,0.71,1.85,1.5,3.48,NIFTY 50 Hybrid Composite Debt 15:85 Index,12.26,12.69,11.44,3.16,36,11,39,35,32,21,15,6,SBI Magnum Childrens Benefit Fund-Savings Plan,Hybrid : Solution Oriented,43,43,43,43,42,38,33,15,5.31,0.32,4.01,3.84,5.32,12.71,13.12,10.61,,,,,,,,
DSP FMP 268-1281D-Reg(G),47124,DSP Mutual Fund,0.46,1.45,2.8,7.02,CRISIL Medium Duration Debt Index,7.31,,,6.47,56,52,44,41,57,29,,,DSP FMP 268-1281D-Reg(G),Debt : FTP/FMP,79,79,79,79,79,49,10,4,6.73,0.49,1.57,2.74,7.36,7.48,6.19,6.09,,,,,,,,
SBI FMP-78-1170D-Reg(G),47638,SBI Mutual Fund,0.49,1.45,2.89,7.09,CRISIL Medium Duration Debt Index,,,,6.56,44,30,45,20,47,,,,SBI FMP-78-1170D-Reg(G),Debt : FTP/FMP,79,79,79,79,79,49,10,4,6.73,0.49,1.57,2.74,7.36,7.48,6.19,6.09,,,,,,,,
TRUSTMF Banking & PSU Fund-Reg(G),45242,Trust Mutual Fund,0.49,1.7,2.53,7.74,CRISIL Banking and PSU Debt Index,7.19,,,7.13,15,18,18,12,17,19,,,TRUSTMF Banking & PSU Fund-Reg(G),Debt : Banking & PSU,26,26,26,26,26,24,18,16,7.1,0.55,1.76,2.45,7.78,7.35,5.77,7.11,,,,,,,,
SBI Nifty Bank Index Fund-Reg(G),49104,SBI Mutual Fund,2.91,11.17,7.47,,NIFTY BANK - TRI,,,,,,13,9,27,,,,,SBI Nifty Bank Index Fund-Reg(G),Equity : Index Funds,175,219,215,198,167,83,34,18,5.22,0.54,6.23,4.78,4.35,16.09,16.83,13.09,,,,,,,,
Union Income Plus Arbitrage Active FOF-Reg(G),49932,Union Mutual Fund,0.19,1.39,,,CRISIL Composite Bond Index,,,,,,76,77,,,,,,Union Income Plus Arbitrage Active FOF-Reg(G),FoFs : Domestic,60,87,81,72,60,50,31,23,18.18,2.64,8.7,12.84,17.0,15.61,13.73,10.63,,,,,,,,
Motilal Oswal Nifty Smallcap 250 ETF,48657,Motilal Oswal Mutual Fund,-3.49,1.14,0.49,-4.52,Nifty Smallcap 250 - TRI,,,,-5.24,156,207,199,180,148,,,,Motilal Oswal Nifty Smallcap 250 ETF,Equity : ETFs,170,214,205,191,168,122,72,33,9.0,0.95,7.36,7.03,7.92,16.94,18.01,13.8,,,,,,,,
Axis Floater Fund-Reg(G),45632,Axis Mutual Fund,0.47,2.32,1.42,7.67,NIFTY Long Duration Debt Index,7.95,,,6.96,10,12,1,12,10,3,,,Axis Floater Fund-Reg(G),Debt : Floater,12,12,12,12,12,12,8,5,7.29,0.6,1.81,2.73,7.89,7.75,6.19,7.06,,,,,,,,
Kotak Nifty Commodities Index Fund-Reg(G),49317,Kotak Mahindra Mutual Fund,-1.32,6.67,6.3,,NIFTY COMMODITIES - TRI,,,,,,87,21,34,,,,,Kotak Nifty Commodities Index Fund-Reg(G),Equity : Thematic,88,110,107,99,80,39,23,9,3.21,-0.12,4.96,5.16,3.32,17.86,21.22,14.57,,,,,,,,
Tata Nifty500 Multicap India Manufacturing 50:30:20 Index Fund-Reg(G),48782,Tata Mutual Fund,0.25,6.51,7.95,8.35,Nifty500 Multicap India Manufacturing 50:30:20 - TRI,,,,7.97,74,144,114,23,59,,,,Tata Nifty500 Multicap India Manufacturing 50:30:20 Index Fund-Reg(G),Equity : Index Funds,175,219,215,198,167,83,34,18,5.22,0.54,6.23,4.78,4.35,16.09,16.83,13.09,,,,,,,,
SBI FMP-50-1843D-Reg(G),45842,SBI Mutual Fund,0.5,1.59,2.86,7.5,CRISIL Medium to Long Term Debt Index,7.48,,,6.99,30,24,30,24,31,24,,,SBI FMP-50-1843D-Reg(G),Debt : FTP/FMP,79,79,79,79,79,49,10,4,6.73,0.49,1.57,2.74,7.36,7.48,6.19,6.09,,,,,,,,
Navi Aggressive Hybrid Fund-Reg(G),39479,Navi Mutual Fund,0.83,3.82,5.79,5.97,CRISIL Hybrid 35+65 - Aggressive Index,12.41,13.55,,6.42,24,10,27,6,32,22,22,,Navi Aggressive Hybrid Fund-Reg(G),Hybrid : Equity Oriented,53,56,56,54,53,52,49,33,5.87,0.34,3.53,4.08,6.08,12.09,12.93,10.38,,,,,,,,
HDFC NIFTY Realty Index Fund-Reg(G),48654,HDFC Mutual Fund,-4.46,2.12,-4.55,-12.38,NIFTY REALTY - TRI,,,,-15.43,174,218,194,193,166,,,,HDFC NIFTY Realty Index Fund-Reg(G),Equity : Index Funds,175,219,215,198,167,83,34,18,5.22,0.54,6.23,4.78,4.35,16.09,16.83,13.09,,,,,,,,
Tata Nifty Next 50 Index Fund-Reg(G),50239,Tata Mutual Fund,-0.19,,,,NIFTY NEXT 50 - TRI,,,,,,170,,,,,,,Tata Nifty Next 50 Index Fund-Reg(G),Equity : Index Funds,175,219,215,198,167,83,34,18,5.22,0.54,6.23,4.78,4.35,16.09,16.83,13.09,,,,,,,,
Nippon India Medium Duration Fund(G),21911,Nippon India Mutual Fund,0.6,1.92,4.42,10.19,CRISIL Medium Duration Debt Index,8.36,8.9,3.46,9.36,2,6,7,1,2,2,2,12,Nippon India Medium Duration Fund(G),Debt : Medium Duration,26,26,26,26,26,19,12,12,7.16,0.54,1.75,2.68,7.85,7.46,6.62,6.7,,,,,,,,
Samco ELSS Tax Saver Fund-Reg(G),46606,Samco Mutual Fund,-2.65,0.08,-2.87,-10.87,NIFTY 500 - TRI,,,,-11.46,56,57,56,57,56,,,,Samco ELSS Tax Saver Fund-Reg(G),Equity : Tax Saving (ELSS),56,57,57,57,56,52,51,29,4.28,-0.01,4.87,4.88,4.07,16.65,19.66,14.01,,,,,,,,
Motilal Oswal NASDAQ Q 50 ETF,46181,Motilal Oswal Mutual Fund,0.75,5.12,22.83,16.56,NASDAQ Q-50-TRI,18.21,,,19.62,19,138,154,10,18,34,,,Motilal Oswal NASDAQ Q 50 ETF,Equity : ETFs,170,214,205,191,168,122,72,33,9.0,0.95,7.36,7.03,7.92,16.94,18.01,13.8,,,,,,,,
Baroda BNP Paribas Multi Asset Active FoF-Reg(G),49872,Baroda BNP Paribas Mutual Fund,2.54,6.86,,,NIFTY Composite Debt Index,,,,,,17,23,,,,,,Baroda BNP Paribas Multi Asset Active FoF-Reg(G),FoFs : Domestic,60,87,81,72,60,50,31,23,18.18,2.64,8.7,12.84,17.0,15.61,13.73,10.63,,,,,,,,
Canara Rob Income Fund-Reg(G),542,Canara Robeco Mutual Fund,0.03,0.91,-0.24,4.85,CRISIL Medium to Long Term Debt Index,5.88,4.23,6.2,4.15,59,58,59,58,59,36,10,7,Canara Rob Income Fund-Reg(G),Debt : Medium to Long Duration,59,60,60,60,59,36,11,11,7.12,0.47,1.78,2.14,7.78,7.42,5.24,6.26,,,,,,,,
Groww Nifty Smallcap 250 Index Fund-Reg(G),48617,Groww Mutual Fund,-3.4,1.01,0.15,-5.18,Nifty Smallcap 250 - TRI,,,,-5.82,157,207,201,176,140,,,,Groww Nifty Smallcap 250 Index Fund-Reg(G),Equity : Index Funds,175,219,215,198,167,83,34,18,5.22,0.54,6.23,4.78,4.35,16.09,16.83,13.09,,,,,,,,
SBI FMP-43-1616D-Reg(G),45525,SBI Mutual Fund,0.44,1.32,3.06,6.4,CRISIL Medium Duration Debt Index,7.16,,,4.81,77,68,75,7,74,39,,,SBI FMP-43-1616D-Reg(G),Debt : FTP/FMP,79,79,79,79,79,49,10,4,6.73,0.49,1.57,2.74,7.36,7.48,6.19,6.09,,,,,,,,
Mirae Asset CRISIL-IBX Financial Services 9-12 Months Debt Index Fund-Reg(G),49980,Mirae Asset Mutual Fund,0.52,1.48,,,CRISIL-IBX Financial Services 9-12 Months Debt Index,,,,,,16,19,,,,,,Mirae Asset CRISIL-IBX Financial Services 9-12 Months Debt Index Fund-Reg(G),Debt : Low Duration,20,26,25,23,20,20,20,19,6.83,0.53,1.55,3.09,7.44,7.2,5.82,6.43,,,,,,,,
Motilal Oswal BSE Enhanced Value ETF,46740,Motilal Oswal Mutual Fund,2.15,14.31,10.55,13.84,BSE Enhanced Value Index - TRI,33.55,,,18.01,34,43,9,21,39,2,,,Motilal Oswal BSE Enhanced Value ETF,Equity : ETFs,170,214,205,191,168,122,72,33,9.0,0.95,7.36,7.03,7.92,16.94,18.01,13.8,,,,,,,,
Union Gilt Fund-Reg(G),46221,Union Mutual Fund,-1.03,0.6,-3.52,2.62,CRISIL Dynamic Gilt Index,5.8,,,1.68,34,37,37,38,34,25,,,Union Gilt Fund-Reg(G),Debt : Gilt,36,39,39,38,36,30,21,21,4.82,-0.05,1.46,-0.56,5.61,6.82,4.85,6.89,,,,,,,,
Nippon India FMP-XLV-4-1111D(G),47822,Nippon India Mutual Fund,0.46,1.38,2.75,7.07,CRISIL Medium Duration Debt Index,,,,6.48,55,51,62,53,51,,,,Nippon India FMP-XLV-4-1111D(G),Debt : FTP/FMP,79,79,79,79,79,49,10,4,6.73,0.49,1.57,2.74,7.36,7.48,6.19,6.09,,,,,,,,
Quantum Dynamic Bond Fund-Reg(G),37428,Quantum Mutual Fund,0.14,1.62,0.14,6.82,CRISIL Dynamic Bond Index,7.55,6.08,7.54,5.74,10,12,11,11,9,5,5,3,Quantum Dynamic Bond Fund-Reg(G),Debt : Dynamic Bond,22,22,22,22,22,22,21,19,5.32,0.16,1.62,0.11,6.06,6.95,5.48,6.83,,,,,,,,
Kotak FMP-304-3119D(G),47401,Kotak Mahindra Mutual Fund,0.37,2.1,0.83,8.63,NIFTY Long Duration Debt Index,,,,7.7,11,78,9,79,2,,,,Kotak FMP-304-3119D(G),Debt : FTP/FMP,79,79,79,79,79,49,10,4,6.73,0.49,1.57,2.74,7.36,7.48,6.19,6.09,,,,,,,,
Aditya Birla SL Retirement Fund-40-Reg(G),42770,Aditya Birla Sun Life Mutual Fund,-0.6,4.12,4.62,7.71,CRISIL Hybrid 35+65 - Aggressive Index,13.04,11.59,,5.22,23,41,20,13,7,16,19,,Aditya Birla SL Retirement Fund-40-Reg(G),Hybrid : Solution Oriented,43,43,43,43,42,38,33,15,5.31,0.32,4.01,3.84,5.32,12.71,13.12,10.61,,,,,,,,
Mirae Asset Nifty 100 ESG Sector Leaders ETF,45134,Mirae Asset Mutual Fund,1.05,5.67,5.97,10.14,Nifty100 ESG Sector Leaders - TRI,12.99,14.74,,11.31,63,118,140,125,67,90,64,,Mirae Asset Nifty 100 ESG Sector Leaders ETF,Equity : ETFs,170,214,205,191,168,122,72,33,9.0,0.95,7.36,7.03,7.92,16.94,18.01,13.8,,,,,,,,
ITI Dynamic Bond Fund-Reg(G),45597,ITI Mutual Fund,0.12,0.78,-0.89,4.55,CRISIL Dynamic Bond Index,6.17,,,3.69,18,13,22,15,18,20,,,ITI Dynamic Bond Fund-Reg(G),Debt : Dynamic Bond,22,22,22,22,22,22,21,19,5.32,0.16,1.62,0.11,6.06,6.95,5.48,6.83,,,,,,,,
Mirae Asset Dynamic Bond Fund-Reg(G),36556,Mirae Asset Mutual Fund,0.44,1.42,2.51,7.24,CRISIL Dynamic Bond Index,6.65,4.69,,6.72,5,9,14,2,7,15,17,,Mirae Asset Dynamic Bond Fund-Reg(G),Debt : Dynamic Bond,22,22,22,22,22,22,21,19,5.32,0.16,1.62,0.11,6.06,6.95,5.48,6.83,,,,,,,,
Quant Gilt Fund-Reg(G),47345,Quant Mutual Fund,-0.09,1.35,-0.89,4.45,CRISIL Dynamic Gilt Index,,,,3.53,24,23,23,20,22,,,,Quant Gilt Fund-Reg(G),Debt : Gilt,36,39,39,38,36,30,21,21,4.82,-0.05,1.46,-0.56,5.61,6.82,4.85,6.89,,,,,,,,
UTI NIFTY50 Equal Weight Index Fund-Reg(G),47962,UTI Mutual Fund,0.37,6.64,7.47,12.08,NIFTY50 Equal Weight - TRI,,,,13.37,20,133,106,26,20,,,,UTI NIFTY50 Equal Weight Index Fund-Reg(G),Equity : Index Funds,175,219,215,198,167,83,34,18,5.22,0.54,6.23,4.78,4.35,16.09,16.83,13.09,,,,,,,,
ICICI Pru Strategic Metal and Energy Equity FoF-Reg(G),46205,ICICI Prudential Mutual Fund,13.49,18.18,37.47,52.02,NYSE Arca Gold Miners Index,20.38,,,62.76,3,2,3,4,3,29,,,ICICI Pru Strategic Metal and Energy Equity FoF-Reg(G),FoFs : Overseas,56,56,56,56,56,53,27,23,27.59,0.05,7.93,20.79,27.7,22.16,11.19,10.41,,,,,,,,
Motilal Oswal BSE Low Volatility Index Fund-Reg(G),46438,Motilal Oswal Mutual Fund,0.77,4.07,4.45,7.28,BSE Low Volatility Index - TRI,14.29,,,7.1,82,119,176,128,68,48,,,Motilal Oswal BSE Low Volatility Index Fund-Reg(G),Equity : Index Funds,175,219,215,198,167,83,34,18,5.22,0.54,6.23,4.78,4.35,16.09,16.83,13.09,,,,,,,,
Mirae Asset Nifty India Manufacturing ETF FoF-Reg(G),46053,Mirae Asset Mutual Fund,0.62,7.22,8.04,9.5,Nifty India Manufacturing - TRI,21.43,,,10.74,23,42,21,20,26,6,,,Mirae Asset Nifty India Manufacturing ETF FoF-Reg(G),FoFs : Domestic,60,87,81,72,60,50,31,23,18.18,2.64,8.7,12.84,17.0,15.61,13.73,10.63,,,,,,,,
Canara Rob Corp Bond Fund-Reg(G),23504,Canara Robeco Mutual Fund,0.46,1.63,1.82,6.79,CRISIL Corporate Bond Index,6.69,5.11,6.46,6.07,21,21,20,21,21,20,18,11,Canara Rob Corp Bond Fund-Reg(G),Debt : Corporate Bond,21,21,21,21,21,20,18,12,7.47,0.56,1.87,2.41,8.17,7.58,5.85,7.09,,,,,,,,
JM Overnight Fund-Reg(G),44156,JM Financial Mutual Fund,0.43,1.31,2.63,5.75,CRISIL Liquid Overnight Index,6.29,5.26,,5.19,28,30,31,28,30,26,22,,JM Overnight Fund-Reg(G),Debt : Overnight,34,35,35,34,34,30,27,3,5.25,0.44,1.33,2.67,5.82,6.32,5.28,5.45,,,,,,,,
Edelweiss CRISIL IBX AAA Financial Services Bond - Jan 2028 Index Fund-Reg(G),49393,Edelweiss Mutual Fund,0.64,1.87,3.54,8.83,CRISIL-IBX AAA Financial Services Index - Jan 2028,,,,8.15,3,3,21,2,4,,,,Edelweiss CRISIL IBX AAA Financial Services Bond - Jan 2028 Index Fund-Reg(G),Debt : Medium to Long Duration,59,60,60,60,59,36,11,11,7.12,0.47,1.78,2.14,7.78,7.42,5.24,6.26,,,,,,,,
SBI Nifty200 Momentum 30 Index Fund-Reg(G),49727,SBI Mutual Fund,1.57,8.25,,,Nifty200 Momentum 30 - TRI,,,,,,35,35,,,,,,SBI Nifty200 Momentum 30 Index Fund-Reg(G),Equity : Index Funds,175,219,215,198,167,83,34,18,5.22,0.54,6.23,4.78,4.35,16.09,16.83,13.09,,,,,,,,
Motilal Oswal Asset Allocation Passive FoF-Aggressive-Reg(G),45344,Motilal Oswal Mutual Fund,1.55,7.6,10.62,15.27,NIFTY 500 - TRI,17.14,,,15.64,11,24,19,12,11,16,,,Motilal Oswal Asset Allocation Passive FoF-Aggressive-Reg(G),FoFs : Domestic,60,87,81,72,60,50,31,23,18.18,2.64,8.7,12.84,17.0,15.61,13.73,10.63,,,,,,,,
ICICI Pru Diversified Debt Strategy Active FOF(G),1707,ICICI Prudential Mutual Fund,0.4,1.84,2.26,7.86,NIFTY Composite Debt Index,7.73,6.32,7.33,7.18,41,68,60,66,39,46,28,20,ICICI Pru Diversified Debt Strategy Active FOF(G),FoFs : Domestic,60,87,81,72,60,50,31,23,18.18,2.64,8.7,12.84,17.0,15.61,13.73,10.63,,,,,,,,
Axis Nifty500 Momentum 50 Index Fund-Reg(G),49216,Axis Mutual Fund,1.69,8.74,3.72,,Nifty500 Momentum 50 - TRI,,,,,,34,29,135,,,,,Axis Nifty500 Momentum 50 Index Fund-Reg(G),Equity : Index Funds,175,219,215,198,167,83,34,18,5.22,0.54,6.23,4.78,4.35,16.09,16.83,13.09,,,,,,,,
DSP Global Clean Energy Overseas Equity Omni FoF-Reg(G),7866,DSP Mutual Fund,-0.96,9.73,28.23,29.17,MSCI ACWI IMI Clean Energy Infrastructure Index,11.29,10.94,6.64,34.65,14,31,14,9,23,46,14,21,DSP Global Clean Energy Overseas Equity Omni FoF-Reg(G),FoFs : Overseas,56,56,56,56,56,53,27,23,27.59,0.05,7.93,20.79,27.7,22.16,11.19,10.41,,,,,,,,
Navi ELSS Tax Saver Nifty 50 Index Fund-Reg(G),47657,Navi Mutual Fund,0.99,6.86,6.23,9.77,NIFTY 50 - TRI,,,,11.01,5,12,11,19,5,,,,Navi ELSS Tax Saver Nifty 50 Index Fund-Reg(G),Equity : Tax Saving (ELSS),56,57,57,57,56,52,51,29,4.28,-0.01,4.87,4.88,4.07,16.65,19.66,14.01,,,,,,,,
Canara Rob Dynamic Bond Fund-Reg(G),7792,Canara Robeco Mutual Fund,0.03,1.18,-2.01,4.05,CRISIL Dynamic Bond Index,5.67,4.12,6.05,3.23,21,15,18,21,21,21,21,18,Canara Rob Dynamic Bond Fund-Reg(G),Debt : Dynamic Bond,22,22,22,22,22,22,21,19,5.32,0.16,1.62,0.11,6.06,6.95,5.48,6.83,,,,,,,,
ICICI Pru Nifty200 Value 30 Index Fund-Reg(G),49113,ICICI Prudential Mutual Fund,1.36,13.51,10.15,9.79,Nifty200 Value 30 - TRI,,,,14.45,18,61,6,7,43,,,,ICICI Pru Nifty200 Value 30 Index Fund-Reg(G),Equity : Index Funds,175,219,215,198,167,83,34,18,5.22,0.54,6.23,4.78,4.35,16.09,16.83,13.09,,,,,,,,
ICICI Pru Nifty50 Value 20 Index Fund-Reg(G),48523,ICICI Prudential Mutual Fund,0.65,5.11,3.07,-2.4,Nifty50 Value 20 - TRI,,,,-0.68,126,122,143,152,132,,,,ICICI Pru Nifty50 Value 20 Index Fund-Reg(G),Equity : Index Funds,175,219,215,198,167,83,34,18,5.22,0.54,6.23,4.78,4.35,16.09,16.83,13.09,,,,,,,,
Nippon India Quant Fund(G),5153,Nippon India Mutual Fund,0.85,6.62,6.24,7.4,BSE 200 - TRI,19.61,21.15,14.75,7.8,22,34,22,37,14,12,11,4,Nippon India Quant Fund(G),Equity : Thematic,88,110,107,99,80,39,23,9,3.21,-0.12,4.96,5.16,3.32,17.86,21.22,14.57,,,,,,,,
PGIM India Healthcare Fund-Reg(G),48975,PGIM India Mutual Fund,0.7,3.59,5.76,,BSE Health Care - TRI,,,,-0.1,6,9,6,8,,,,,PGIM India Healthcare Fund-Reg(G),Equity : Sectoral - Pharma,18,20,20,18,16,10,9,3,-1.68,0.6,2.52,5.57,3.36,22.11,16.87,12.4,,,,,,,,
Bank of India Credit Risk Fund-Reg(G),30390,Bank of India Mutual Fund,0.51,1.85,3.07,6.46,CRISIL Credit Risk Debt Index,6.04,25.89,1.6,6.16,13,11,10,9,15,15,1,13,Bank of India Credit Risk Fund-Reg(G),Debt : Credit Risk,15,15,15,15,15,15,15,13,9.69,0.57,2.0,3.13,10.3,8.6,8.79,6.44,,,,,,,,
Axis Nifty500 Value 50 Index Fund-Reg(G),37710,Axis Mutual Fund,-1.32,10.35,8.64,5.54,NIFTY500 Value 50 - TRI,,,,11.9,27,191,19,13,94,,,,Axis Nifty500 Value 50 Index Fund-Reg(G),Equity : Index Funds,175,219,215,198,167,83,34,18,5.22,0.54,6.23,4.78,4.35,16.09,16.83,13.09,,,,,,,,
Union Dynamic Bond Fund(G),16032,Union Mutual Fund,-0.56,0.94,-2.28,4.09,CRISIL Dynamic Bond Index,6.17,4.15,5.81,3.19,22,22,20,22,20,19,20,19,Union Dynamic Bond Fund(G),Debt : Dynamic Bond,22,22,22,22,22,22,21,19,5.32,0.16,1.62,0.11,6.06,6.95,5.48,6.83,,,,,,,,
PGIM India Gilt Fund(G),7012,PGIM India Mutual Fund,-0.62,1.03,-1.87,4.26,CRISIL Dynamic Gilt Index,6.41,4.79,6.55,3.59,23,31,28,24,24,20,11,14,PGIM India Gilt Fund(G),Debt : Gilt,36,39,39,38,36,30,21,21,4.82,-0.05,1.46,-0.56,5.61,6.82,4.85,6.89,,,,,,,,
Baroda BNP Paribas Income Plus Arbitrage Active FoF-Reg(G),49897,Baroda BNP Paribas Mutual Fund,0.6,1.85,2.87,,NIFTY Composite Debt Index,,,,,,43,59,52,,,,,Baroda BNP Paribas Income Plus Arbitrage Active FoF-Reg(G),FoFs : Domestic,60,87,81,72,60,50,31,23,18.18,2.64,8.7,12.84,17.0,15.61,13.73,10.63,,,,,,,,
PGIM India Overnight Fund-Reg(G),24529,PGIM India Mutual Fund,0.44,1.32,2.66,5.85,Nifty 1D Rate Index,6.34,5.31,,5.27,21,27,26,25,16,11,5,,PGIM India Overnight Fund-Reg(G),Debt : Overnight,34,35,35,34,34,30,27,3,5.25,0.44,1.33,2.67,5.82,6.32,5.28,5.45,0.45,1.36,2.73,5.95,6.46,5.43,,5.84
Kotak Nifty SDL Jul 2026 Index Fund-Reg(G),46729,Kotak Mahindra Mutual Fund,0.44,1.51,2.8,7.22,Nifty SDL Jul 2026 Index,,,,6.71,47,44,54,13,47,,,,Kotak Nifty SDL Jul 2026 Index Fund-Reg(G),Debt : Medium to Long Duration,59,60,60,60,59,36,11,11,7.12,0.47,1.78,2.14,7.78,7.42,5.24,6.26,,,,,,,,
Union Gold ETF FoF-Reg(G),49466,Union Mutual Fund,7.75,22.9,29.56,,Gold-India,,,,,,16,14,16,,,,,Union Gold ETF FoF-Reg(G),Gold : MFs,17,20,18,18,17,14,10,10,70.73,9.27,25.93,36.35,65.53,32.37,19.19,15.95,,,,,,,,
DSP Nifty Midcap 150 Quality 50 ETF,46157,DSP Mutual Fund,-0.33,2.74,0.3,0.61,NIFTY Midcap150 Quality 50 - TRI,14.24,,,0.22,135,183,192,184,127,63,,,DSP Nifty Midcap 150 Quality 50 ETF,Equity : ETFs,170,214,205,191,168,122,72,33,9.0,0.95,7.36,7.03,7.92,16.94,18.01,13.8,,,,,,,,
PGIM India Dynamic Bond Fund(G),15247,PGIM India Mutual Fund,-0.12,1.58,-0.38,5.65,CRISIL Dynamic Bond Index,6.74,4.97,6.87,4.99,14,16,12,13,14,14,14,10,PGIM India Dynamic Bond Fund(G),Debt : Dynamic Bond,22,22,22,22,22,22,21,19,5.32,0.16,1.62,0.11,6.06,6.95,5.48,6.83,,,,,,,,
Baroda BNP Paribas Childrens Fund-Reg(G),49110,Baroda BNP Paribas Mutual Fund,1.98,7.74,9.87,,NIFTY 500 - TRI,,,,12.26,2,2,3,4,,,,,Baroda BNP Paribas Childrens Fund-Reg(G),Hybrid : Solution Oriented,43,43,43,43,42,38,33,15,5.31,0.32,4.01,3.84,5.32,12.71,13.12,10.61,,,,,,,,
Bandhan CRISIL IBX 90:10 SDL Plus Gilt - Nov 2026 Index Fund-Reg(G),46213,Bandhan Mutual Fund,0.5,1.63,2.87,7.6,CRISIL IBX 90:10 SDL Plus Gilt Index - November 2026,7.43,,,7.09,42,35,43,10,42,21,,,Bandhan CRISIL IBX 90:10 SDL Plus Gilt - Nov 2026 Index Fund-Reg(G),Debt : Medium to Long Duration,59,60,60,60,59,36,11,11,7.12,0.47,1.78,2.14,7.78,7.42,5.24,6.26,,,,,,,,
Invesco India - Invesco Pan European Equity FoF-Reg(G),24619,Invesco Mutual Fund,2.18,6.37,12.73,36.19,MSCI Europe Index (Total Return Net),16.53,13.8,7.84,35.61,10,8,35,44,14,37,10,18,Invesco India - Invesco Pan European Equity FoF-Reg(G),FoFs : Overseas,56,56,56,56,56,53,27,23,27.59,0.05,7.93,20.79,27.7,22.16,11.19,10.41,,,,,,,,
Quantum ESG Best In Class Strategy Fund-Reg(G),43878,Quantum Mutual Fund,-0.08,1.89,2.36,1.76,NIFTY100 ESG - TRI,12.58,14.25,,2.57,54,53,94,82,55,37,21,,Quantum ESG Best In Class Strategy Fund-Reg(G),Equity : Thematic,88,110,107,99,80,39,23,9,3.21,-0.12,4.96,5.16,3.32,17.86,21.22,14.57,,,,,,,,
Baroda BNP Paribas Gold ETF FoF-Reg(G),50181,Baroda BNP Paribas Mutual Fund,9.56,22.79,,,Gold-India,,,,,,12,12,,,,,,Baroda BNP Paribas Gold ETF FoF-Reg(G),FoFs : Domestic,60,87,81,72,60,50,31,23,18.18,2.64,8.7,12.84,17.0,15.61,13.73,10.63,,,,,,,,
Bandhan Conservative Hybrid Fund-Reg(G),8465,Bandhan Mutual Fund,0.67,2.91,1.8,5.95,NIFTY AAA Short Duration Bond Index,7.64,6.31,6.73,6.31,8,4,5,11,11,14,16,14,Bandhan Conservative Hybrid Fund-Reg(G),Hybrid : Debt Oriented (Conservative),18,18,18,18,18,18,17,17,5.92,0.38,2.42,2.08,6.3,8.89,8.61,7.76,,,,,,,,
PGIM India Arbitrage Fund-Reg(G),28514,PGIM India Mutual Fund,0.5,1.35,2.44,6.11,Nifty 50 Arbitrage,6.61,5.38,5.45,5.44,26,27,18,30,24,22,18,13,PGIM India Arbitrage Fund-Reg(G),Hybrid : Arbitrage,30,33,32,31,28,24,24,14,5.64,0.51,1.35,2.8,6.31,6.89,5.53,5.69,0.54,1.77,3.46,7.65,7.68,6.19,,7.51
LIC MF Nifty Next 50 Index Fund(G),12836,LIC Mutual Fund,-0.21,4.68,3.49,-1.49,NIFTY NEXT 50 - TRI,16.83,17.69,13.02,1.87,114,175,164,140,119,31,9,11,LIC MF Nifty Next 50 Index Fund(G),Equity : Index Funds,175,219,215,198,167,83,34,18,5.22,0.54,6.23,4.78,4.35,16.09,16.83,13.09,,,,,,,,
TRUSTMF Short Duration Fund-Reg(G),45652,Trust Mutual Fund,0.49,1.61,2.49,8.03,CRISIL Short Duration Debt Index,7.18,,,7.34,11,29,24,20,11,17,,,TRUSTMF Short Duration Fund-Reg(G),Debt : Short Duration,28,33,33,32,27,23,20,18,7.25,0.54,1.72,2.71,7.91,7.33,5.92,6.67,,,,,,,,
Kotak FMP-308-1125D(G),47570,Kotak Mahindra Mutual Fund,0.55,1.63,3.38,7.86,NIFTY Medium Duration Debt Index,,,,7.19,23,10,24,4,19,,,,Kotak FMP-308-1125D(G),Debt : FTP/FMP,79,79,79,79,79,49,10,4,6.73,0.49,1.57,2.74,7.36,7.48,6.19,6.09,,,,,,,,
Groww Nifty 1D Rate Liquid ETF,49128,Groww Mutual Fund,0.42,1.26,2.49,5.56,Nifty 1D Rate Index,,,,4.96,26,22,27,18,26,,,,Groww Nifty 1D Rate Liquid ETF,Debt : ETFs,30,33,32,32,30,13,8,2,6.58,0.51,1.65,2.37,7.34,7.52,5.44,5.9,0.45,1.36,2.73,5.95,6.46,5.43,,5.84
Mirae Asset Hang Seng TECH ETF FoF-Reg(G),46071,Mirae Asset Mutual Fund,-5.98,3.15,14.79,40.33,Hang Seng TECH TRI,26.78,,,38.39,6,55,44,38,8,15,,,Mirae Asset Hang Seng TECH ETF FoF-Reg(G),FoFs : Overseas,56,56,56,56,56,53,27,23,27.59,0.05,7.93,20.79,27.7,22.16,11.19,10.41,,,,,,,,
Motilal Oswal Nifty Capital Market ETF,49686,Motilal Oswal Mutual Fund,3.05,14.7,16.11,,Nifty Capital Markets Index - TRI,,,,,,19,8,15,,,,,Motilal Oswal Nifty Capital Market ETF,Equity : ETFs,170,214,205,191,168,122,72,33,9.0,0.95,7.36,7.03,7.92,16.94,18.01,13.8,,,,,,,,
SBI BSE PSU Bank Index Fund-Reg(G),49726,SBI Mutual Fund,5.65,26.13,21.2,,BSE PSU Bank - TRI,,,,,,1,1,1,,,,,SBI BSE PSU Bank Index Fund-Reg(G),Equity : Index Funds,175,219,215,198,167,83,34,18,5.22,0.54,6.23,4.78,4.35,16.09,16.83,13.09,,,,,,,,
HDFC NIFTY200 Momentum 30 ETF,46042,HDFC Mutual Fund,1.5,7.99,6.23,-5.1,Nifty200 Momentum 30 - TRI,17.23,,,-1.89,147,65,55,112,150,48,,,HDFC NIFTY200 Momentum 30 ETF,Equity : ETFs,170,214,205,191,168,122,72,33,9.0,0.95,7.36,7.03,7.92,16.94,18.01,13.8,,,,,,,,
Axis FTP-113-1228D-Reg(G),47799,Axis Mutual Fund,0.51,1.51,3.14,7.48,CRISIL Medium Duration Debt Index,,,,6.87,32,19,33,5,32,,,,Axis FTP-113-1228D-Reg(G),Debt : FTP/FMP,79,79,79,79,79,49,10,4,6.73,0.49,1.57,2.74,7.36,7.48,6.19,6.09,,,,,,,,
