HDFC Nifty G-Sec Jul 2031 Index Fund-Reg(G),46620,HDFC Mutual Fund,0.66,1.61,6.3,10.84,Nifty G-Sec July 2031 Index,,,,6.75,1,19,10,1,2,,,,HDFC Nifty G-Sec Jul 2031 Index Fund-Reg(G),Debt : Gilt,36,38,37,37,36,23,21,21,4.96,0.72,0.97,4.9,8.57,7.75,5.38,7.35,,,,,,,,
Motilal Oswal Nifty 500 Momentum 50 Index Fund-Reg(G),48961,Motilal Oswal Mutual Fund,-1.65,10.41,0.26,,Nifty500 Momentum 50 - TRI,,,,-7.77,167,184,55,158,,,,,Motilal Oswal Nifty 500 Momentum 50 Index Fund-Reg(G),Equity : Index Funds,175,201,193,175,129,68,32,18,2.77,1.26,8.58,6.78,-1.07,18.99,19.99,11.7,,,,,,,,
UTI India Consumer Fund-Reg(G),3581,UTI Mutual Fund,0.97,3.64,2.38,-2.59,Nifty India Consumption - TRI,14.98,17.43,10.62,-0.69,12,22,17,15,14,12,12,9,UTI India Consumer Fund-Reg(G),Equity : Thematic - Consumption,20,22,22,20,17,13,13,9,0.03,2.67,5.04,3.6,0.01,17.88,20.88,13.54,,,,,,,,
Motilal Oswal Nifty Midcap 100 ETF,13595,Motilal Oswal Mutual Fund,1.8,12.46,8.53,3.97,Nifty Midcap 100 - TRI,28.15,31.61,16.07,3.61,108,77,25,48,32,7,5,2,Motilal Oswal Nifty Midcap 100 ETF,Equity : ETFs,170,195,184,170,155,103,64,29,3.89,1.23,8.34,7.09,1.04,19.42,21.52,12.29,,,,,,,,
UTI Equity Savings Fund-Reg(G),35818,UTI Mutual Fund,0.37,1.94,4.51,4.93,Crisil Equity Savings Index,11.77,12.18,,4.13,22,56,53,34,25,40,35,,UTI Equity Savings Fund-Reg(G),Hybrid : Equity Oriented,55,56,56,55,55,54,51,31,7.94,5.64,9.07,9.75,8.7,14.73,15.16,9.88,,,,,,,,
Kotak Nifty Alpha 50 ETF,45687,Kotak Mahindra Mutual Fund,0.37,11.48,0.09,-10.01,Nifty Alpha 50 - TRI,23.31,,,-7.02,158,158,46,151,146,21,,,Kotak Nifty Alpha 50 ETF,Equity : ETFs,170,195,184,170,155,103,64,29,3.89,1.23,8.34,7.09,1.04,19.42,21.52,12.29,,,,,,,,
Kotak Credit Risk Fund(G),8472,Kotak Mahindra Mutual Fund,0.82,2.77,5.18,8.0,CRISIL Credit Risk Debt Index,7.15,5.79,6.84,5.78,6,3,3,6,13,13,13,9,Kotak Credit Risk Fund(G),Debt : Credit Risk,15,15,15,15,15,15,15,13,7.32,0.66,2.88,7.0,11.08,8.53,9.04,6.55,,,,,,,,
SBI Comma Fund-Reg(G),2750,SBI Mutual Fund,4.72,10.36,10.39,1.97,NIFTY COMMODITIES - TRI,20.14,23.4,15.23,7.58,6,7,29,8,23,20,13,3,SBI Comma Fund-Reg(G),Equity : Thematic,89,101,98,89,70,38,21,9,1.17,2.11,8.57,4.92,-0.47,21.6,24.24,13.58,,,,,,,,
Nippon India US Equity Opp Fund(G),19246,Nippon India Mutual Fund,2.17,14.54,0.73,13.1,S&P 500 - TRI,17.49,12.9,,3.73,7,7,7,8,5,4,3,,Nippon India US Equity Opp Fund(G),Equity : International,8,8,8,8,8,8,6,4,8.87,3.81,20.71,7.92,15.13,17.53,11.16,8.8,,,,,,,,
Quant PSU Fund-Reg(G),48341,Quant Mutual Fund,0.66,4.97,1.73,-17.26,NIFTY PSE - TRI,,,,1.78,46,92,90,69,70,,,,Quant PSU Fund-Reg(G),Equity : Thematic,89,101,98,89,70,38,21,9,1.17,2.11,8.57,4.92,-0.47,21.6,24.24,13.58,,,,,,,,
DSP Nifty Bank ETF,46468,DSP Mutual Fund,1.13,4.14,16.43,7.57,NIFTY BANK - TRI,,,,11.11,20,107,165,18,22,,,,DSP Nifty Bank ETF,Equity : ETFs,170,195,184,170,155,103,64,29,3.89,1.23,8.34,7.09,1.04,19.42,21.52,12.29,,,,,,,,
Kotak Nifty Next 50 Index Fund-Reg(G),44443,Kotak Mahindra Mutual Fund,2.17,6.17,4.79,-6.6,NIFTY NEXT 50 - TRI,19.94,,,0.24,130,63,112,133,103,16,,,Kotak Nifty Next 50 Index Fund-Reg(G),Equity : Index Funds,175,201,193,175,129,68,32,18,2.77,1.26,8.58,6.78,-1.07,18.99,19.99,11.7,,,,,,,,
DSP FMP 267-1246D-Reg(G),47071,DSP Mutual Fund,0.45,1.84,4.13,7.96,CRISIL Medium Duration Debt Index,,,,4.47,46,30,43,42,43,,,,DSP FMP 267-1246D-Reg(G),Debt : FTP/FMP,91,92,92,91,91,49,18,4,4.33,0.44,1.82,4.17,8.01,7.39,5.56,6.15,,,,,,,,
SBI FMP-66-1361D-Reg(G),46633,SBI Mutual Fund,0.44,1.78,3.95,7.76,CRISIL Medium Duration Debt Index,,,,4.39,60,42,63,67,63,,,,SBI FMP-66-1361D-Reg(G),Debt : FTP/FMP,91,92,92,91,91,49,18,4,4.33,0.44,1.82,4.17,8.01,7.39,5.56,6.15,,,,,,,,
Aditya Birla SL Equity Savings Fund-Reg(G),30757,Aditya Birla Sun Life Mutual Fund,0.96,3.04,5.2,7.15,NIFTY 50 Equity Savings Index - TRI,9.79,10.17,7.63,5.15,11,36,45,27,9,48,44,26,Aditya Birla SL Equity Savings Fund-Reg(G),Hybrid : Equity Oriented,55,56,56,55,55,54,51,31,7.94,5.64,9.07,9.75,8.7,14.73,15.16,9.88,,,,,,,,
Edelweiss Technology Fund-Reg(G),43844,Edelweiss Mutual Fund,0.77,17.6,-1.53,1.94,BSE TECk Index - TRI,,,,-4.52,5,1,2,4,3,,,,Edelweiss Technology Fund-Reg(G),Equity : Sectoral - Technology,12,12,12,12,9,5,5,4,-6.58,-1.02,13.09,-2.93,-0.2,18.09,24.02,17.08,,,,,,,,
360 ONE Dynamic Bond Fund-Reg(G),17578,360 ONE Mutual Fund,0.58,2.37,5.83,10.56,CRISIL Dynamic Bond Index,8.4,7.04,7.24,6.27,1,9,1,1,1,2,2,8,360 ONE Dynamic Bond Fund-Reg(G),Debt : Dynamic Bond,22,22,22,22,22,22,21,19,4.92,0.6,1.04,4.9,8.51,7.58,5.76,7.12,0.51,1.57,5.28,9.53,,,,10.18
HSBC Financial Services Fund-Reg(G),49575,HSBC Mutual Fund,2.3,7.72,,,BSE Financial Services - TRI,,,,,,5,4,,,,,,HSBC Financial Services Fund-Reg(G),Equity : Sectoral - Financial Services,21,22,22,21,21,14,11,10,11.1,1.61,6.01,15.59,9.73,20.92,22.04,12.4,,,,,,,,
Mirae Asset Nifty Smallcap 250 Momentum Quality 100 ETF,48496,Mirae Asset Mutual Fund,2.68,14.49,3.28,-8.63,Nifty Smallcap250 Momentum Quality 100 - TRI,,,,-3.41,144,35,13,135,144,,,,Mirae Asset Nifty Smallcap 250 Momentum Quality 100 ETF,Equity : ETFs,170,195,184,170,155,103,64,29,3.89,1.23,8.34,7.09,1.04,19.42,21.52,12.29,,,,,,,,
Kotak Quant Fund-Reg(G),48083,Kotak Mahindra Mutual Fund,2.66,3.87,5.43,-6.33,NIFTY 200 - TRI,,,,0.41,57,32,96,48,58,,,,Kotak Quant Fund-Reg(G),Equity : Thematic,89,101,98,89,70,38,21,9,1.17,2.11,8.57,4.92,-0.47,21.6,24.24,13.58,,,,,,,,
Edelweiss Equity Savings Fund-Reg(G),30730,Edelweiss Mutual Fund,1.52,3.53,5.06,7.95,NIFTY 50 Equity Savings Index,11.94,11.0,8.83,4.34,16,17,41,29,5,39,39,20,Edelweiss Equity Savings Fund-Reg(G),Hybrid : Equity Oriented,55,56,56,55,55,54,51,31,7.94,5.64,9.07,9.75,8.7,14.73,15.16,9.88,,,,,,,,
Union Aggressive Hybrid Fund-Reg(G),44512,Union Mutual Fund,1.63,6.65,7.35,4.02,CRISIL Hybrid 35+65 - Aggressive Index,15.22,,,3.66,30,11,10,10,34,22,,,Union Aggressive Hybrid Fund-Reg(G),Hybrid : Equity Oriented,55,56,56,55,55,54,51,31,7.94,5.64,9.07,9.75,8.7,14.73,15.16,9.88,,,,,,,,
Unifi Dynamic Asset Allocation Fund-Reg(G),49692,Unifi Mutual Fund,0.58,1.72,,,CRISIL Hybrid 50+50 - Moderate Index,,,,,,32,33,,,,,,Unifi Dynamic Asset Allocation Fund-Reg(G),Hybrid : Dynamic Asset Allocation,33,34,34,33,32,22,19,11,3.21,1.21,4.48,5.12,3.17,13.66,13.0,9.48,,,,,,,,
Franklin India Equity Savings Fund(G),39645,Franklin Templeton Mutual Fund,0.43,1.97,3.63,5.67,NIFTY 50 Equity Savings Index,9.14,10.35,,3.17,37,54,52,53,18,51,43,,Franklin India Equity Savings Fund(G),Hybrid : Equity Oriented,55,56,56,55,55,54,51,31,7.94,5.64,9.07,9.75,8.7,14.73,15.16,9.88,,,,,,,,
Motilal Oswal Nifty Bank Index Fund-Reg(G),43789,Motilal Oswal Mutual Fund,1.07,3.94,15.97,6.79,NIFTY BANK - TRI,16.59,20.15,,10.63,14,114,180,11,8,37,12,,Motilal Oswal Nifty Bank Index Fund-Reg(G),Equity : Index Funds,175,201,193,175,129,68,32,18,2.77,1.26,8.58,6.78,-1.07,18.99,19.99,11.7,,,,,,,,
Sundaram Overnight Fund-Reg(G),42000,Sundaram Mutual Fund,0.42,1.36,2.91,6.24,Nifty 1D Rate Index,6.34,5.07,,3.26,16,24,13,9,17,21,23,,Sundaram Overnight Fund-Reg(G),Debt : Overnight,34,34,34,34,34,28,27,3,3.24,0.42,1.35,2.89,6.22,6.35,5.1,5.53,0.43,1.4,2.97,6.34,6.48,5.24,,6.01
ICICI Pru BSE Liquid Rate ETF(G),49518,ICICI Prudential Mutual Fund,0.41,1.34,,,BSE Liquid Rate Index,,,,,,9,21,,,,,,ICICI Pru BSE Liquid Rate ETF(G),Debt : ETFs,31,33,33,31,28,14,7,2,4.6,0.36,1.59,4.3,8.36,7.84,5.26,6.08,,,,,,,,
HSBC Medium Duration Fund-Reg(G),31014,HSBC Mutual Fund,0.49,1.93,5.4,9.36,NIFTY Medium Duration Debt Index,7.89,6.64,7.07,5.67,5,12,14,5,7,5,6,7,HSBC Medium Duration Fund-Reg(G),Debt : Medium Duration,28,28,28,28,28,17,12,12,4.98,0.56,1.93,4.75,8.69,7.48,6.83,6.83,,,,,,,,
HDFC Nifty G-Sec Sep 2032 Index Fund-Reg(G),46872,HDFC Mutual Fund,0.41,1.51,6.26,10.89,Nifty G-Sec Sep 2032 Index,,,,6.59,2,33,13,2,1,,,,HDFC Nifty G-Sec Sep 2032 Index Fund-Reg(G),Debt : Gilt,36,38,37,37,36,23,21,21,4.96,0.72,0.97,4.9,8.57,7.75,5.38,7.35,,,,,,,,
Aditya Birla SL ESG Integration Strategy Fund-Reg(G),44736,Aditya Birla Sun Life Mutual Fund,0.68,6.85,4.22,2.95,NIFTY100 ESG - TRI,16.21,,,0.28,58,91,68,58,18,30,,,Aditya Birla SL ESG Integration Strategy Fund-Reg(G),Equity : Thematic,89,101,98,89,70,38,21,9,1.17,2.11,8.57,4.92,-0.47,21.6,24.24,13.58,,,,,,,,
HSBC Credit Risk Fund-Reg(G),8016,HSBC Mutual Fund,0.5,13.01,17.39,21.41,NIFTY Credit Risk Bond Index,11.2,8.73,7.36,17.67,2,11,1,2,2,2,7,7,HSBC Credit Risk Fund-Reg(G),Debt : Credit Risk,15,15,15,15,15,15,15,13,7.32,0.66,2.88,7.0,11.08,8.53,9.04,6.55,,,,,,,,
HSBC Equity Savings Fund-Reg(G),15304,HSBC Mutual Fund,1.19,4.12,-0.21,3.28,NIFTY 50 Equity Savings Index,13.02,13.7,8.52,-3.47,55,27,35,55,45,30,29,23,HSBC Equity Savings Fund-Reg(G),Hybrid : Equity Oriented,55,56,56,55,55,54,51,31,7.94,5.64,9.07,9.75,8.7,14.73,15.16,9.88,,,,,,,,
UTI Nifty200 Quality 30 Index Fund-Reg(G),49144,UTI Mutual Fund,0.52,7.8,2.96,,NIFTY200 Quality 30 - TRI,,,,0.32,123,153,85,149,,,,,UTI Nifty200 Quality 30 Index Fund-Reg(G),Equity : Index Funds,175,201,193,175,129,68,32,18,2.77,1.26,8.58,6.78,-1.07,18.99,19.99,11.7,,,,,,,,
HSBC Low Duration Fund-Reg(G),13350,HSBC Mutual Fund,0.56,3.15,5.58,9.24,NIFTY Low Duration Debt Index,7.61,6.02,6.87,5.88,1,17,1,1,1,2,3,4,HSBC Low Duration Fund-Reg(G),Debt : Low Duration,20,23,23,20,20,20,20,19,4.63,0.58,1.99,4.33,7.97,7.12,5.77,6.51,,,,,,,,
Quant BFSI Fund-Reg(G),47989,Quant Mutual Fund,6.71,17.69,18.02,2.96,Nifty Financial Services - TRI,,,,15.76,1,1,1,1,21,,,,Quant BFSI Fund-Reg(G),Equity : Sectoral - Financial Services,21,22,22,21,21,14,11,10,11.1,1.61,6.01,15.59,9.73,20.92,22.04,12.4,,,,,,,,
UTI Gilt Fund-Reg(G),3560,UTI Mutual Fund,0.85,0.74,5.15,8.65,CRISIL Dynamic Gilt Index,7.94,5.34,7.68,4.99,16,14,19,10,15,8,12,8,UTI Gilt Fund-Reg(G),Debt : Gilt,36,38,37,37,36,23,21,21,4.96,0.72,0.97,4.9,8.57,7.75,5.38,7.35,,,,,,,,
Aditya Birla SL CRISIL IBX Gilt Apr 2029 Index Fund-Reg(G),46950,Aditya Birla Sun Life Mutual Fund,0.48,2.05,5.81,9.96,CRISIL IBX Gilt Index - April 2029,,,,6.12,5,29,2,6,6,,,,Aditya Birla SL CRISIL IBX Gilt Apr 2029 Index Fund-Reg(G),Debt : Gilt,36,38,37,37,36,23,21,21,4.96,0.72,0.97,4.9,8.57,7.75,5.38,7.35,,,,,,,,
Mahindra Manulife Low Duration Fund-Reg(G),36894,Mahindra Manulife Mutual Fund,0.57,1.84,4.09,7.64,CRISIL Low Duration Debt Index,6.85,5.4,,4.37,19,12,21,19,18,18,20,,Mahindra Manulife Low Duration Fund-Reg(G),Debt : Low Duration,20,23,23,20,20,20,20,19,4.63,0.58,1.99,4.33,7.97,7.12,5.77,6.51,0.55,1.92,4.24,8.19,,,,8.43
ICICI Pru Nifty Bank Index Fund-Reg(G),45994,ICICI Prudential Mutual Fund,1.09,3.98,16.06,6.83,NIFTY BANK - TRI,16.52,,,10.72,10,108,179,8,6,38,,,ICICI Pru Nifty Bank Index Fund-Reg(G),Equity : Index Funds,175,201,193,175,129,68,32,18,2.77,1.26,8.58,6.78,-1.07,18.99,19.99,11.7,,,,,,,,
Aditya Birla SL Gold Fund(G),16220,Aditya Birla Sun Life Mutual Fund,-0.91,2.48,22.59,29.99,Gold-India,23.01,13.44,12.65,27.54,8,6,17,5,1,4,6,6,Aditya Birla SL Gold Fund(G),Gold : MFs,17,18,18,17,16,10,10,10,27.75,-0.55,5.51,22.44,27.71,22.92,13.46,12.65,,,,,,,,
Navi Nifty Bank Index Fund-Reg(G),45873,Navi Mutual Fund,1.07,3.93,15.98,6.76,NIFTY BANK - TRI,16.48,,,10.65,12,111,182,10,10,39,,,Navi Nifty Bank Index Fund-Reg(G),Equity : Index Funds,175,201,193,175,129,68,32,18,2.77,1.26,8.58,6.78,-1.07,18.99,19.99,11.7,,,,,,,,
Baroda BNP Paribas Health and Wellness Fund-Reg(G),49985,Baroda BNP Paribas Mutual Fund,,,,,BSE Health Care - TRI,,,,,,,,,,,,,Baroda BNP Paribas Health and Wellness Fund-Reg(G),Equity : Sectoral - Pharma,18,18,18,18,16,10,9,3,-1.2,4.63,7.85,4.04,14.42,24.56,21.46,12.18,,,,,,,,
Mahindra Manulife Multi Asset Allocation Fund-Reg(G),48449,Mahindra Manulife Mutual Fund,1.65,6.54,8.98,7.32,NIFTY 500 - TRI,,,,8.88,9,10,9,12,10,,,,Mahindra Manulife Multi Asset Allocation Fund-Reg(G),Hybrid : Multi Asset Allocation,28,31,29,28,25,10,8,7,6.64,1.23,5.61,7.89,5.53,17.22,19.22,12.41,,,,,,,,
Mirae Asset S&P 500 Top 50 ETF FoF-Reg(G),45836,Mirae Asset Mutual Fund,8.41,25.74,2.6,33.21,S&P 500 Top 50 TRI,29.32,,,1.04,56,3,14,51,5,4,,,Mirae Asset S&P 500 Top 50 ETF FoF-Reg(G),FoFs : Overseas,57,57,57,57,57,51,27,23,12.31,3.83,18.25,9.74,17.36,17.69,10.6,8.38,,,,,,,,
Kotak Technology Fund-Reg(G),48587,Kotak Mahindra Mutual Fund,-1.68,10.13,-4.63,-0.4,BSE TECk Index - TRI,,,,-8.01,9,10,12,10,5,,,,Kotak Technology Fund-Reg(G),Equity : Sectoral - Technology,12,12,12,12,9,5,5,4,-6.58,-1.02,13.09,-2.93,-0.2,18.09,24.02,17.08,,,,,,,,
PGIM India Large Cap Fund(G),758,PGIM India Mutual Fund,0.68,4.68,7.06,0.71,NIFTY 100 - TRI,14.79,16.33,9.96,4.07,15,35,29,16,18,30,29,26,PGIM India Large Cap Fund(G),Equity : Large Cap,38,39,39,38,37,34,31,28,3.44,1.2,5.76,6.5,0.22,17.57,19.3,11.84,,,,,,,,
LIC MF Multi Asset Allocation Fund-Reg(G),49465,LIC Mutual Fund,1.85,5.73,,,NIFTY 500 - TRI,,,,,,6,15,,,,,,LIC MF Multi Asset Allocation Fund-Reg(G),Hybrid : Multi Asset Allocation,28,31,29,28,25,10,8,7,6.64,1.23,5.61,7.89,5.53,17.22,19.22,12.41,,,,,,,,
Mirae Asset Nifty SDL Jun 2027 Index Fund-Reg(G),46134,Mirae Asset Mutual Fund,0.37,2.15,4.92,8.94,Nifty SDL Jun 2027 Index,7.88,,,5.27,37,48,21,36,27,8,,,Mirae Asset Nifty SDL Jun 2027 Index Fund-Reg(G),Debt : Medium to Long Duration,59,60,60,59,52,26,11,11,5.43,0.47,1.94,5.12,9.04,7.69,5.48,6.54,,,,,,,,
LIC MF Dividend Yield Fund-Reg(G),41332,LIC Mutual Fund,1.09,8.65,7.21,1.75,NIFTY 500 - TRI,24.95,23.89,,2.75,3,10,3,3,2,2,4,,LIC MF Dividend Yield Fund-Reg(G),Equity : Thematic - Dividend Yield,10,10,10,10,9,8,6,5,2.37,1.41,6.86,5.22,-1.67,22.26,24.59,14.04,,,,,,,,
ICICI Pru Nifty FMCG ETF,45651,ICICI Prudential Mutual Fund,3.99,0.61,2.71,-6.08,NIFTY FMCG - TRI,12.5,,,0.89,121,23,184,140,129,100,,,ICICI Pru Nifty FMCG ETF,Equity : ETFs,170,195,184,170,155,103,64,29,3.89,1.23,8.34,7.09,1.04,19.42,21.52,12.29,,,,,,,,
ICICI Pru CRISIL-IBX Financial Services 3-6 Months Debt Index Fund-Reg(G),49708,ICICI Prudential Mutual Fund,0.58,1.75,,,CRISIL-IBX Financial Services 3 to 6 Months Debt Index,,,,,,9,15,,,,,,ICICI Pru CRISIL-IBX Financial Services 3-6 Months Debt Index Fund-Reg(G),Debt : Ultra Short Duration,26,30,29,26,24,24,22,13,4.1,0.55,1.75,3.81,7.28,6.76,5.5,6.17,,,,,,,,
Bank of India Mfg & Infra Fund-Reg(G),8484,Bank of India Mutual Fund,3.88,14.98,7.31,0.83,BSE India Infrastructure Index - TRI,29.27,31.6,16.27,5.31,2,2,2,7,2,10,10,5,Bank of India Mfg & Infra Fund-Reg(G),Equity : Sectoral - Infrastructure,20,21,20,20,19,19,19,18,1.53,2.73,10.17,5.93,-4.11,28.6,31.63,14.92,,,,,,,,
LIC MF Small Cap Fund(G),36914,LIC Mutual Fund,5.01,10.21,-2.98,-1.8,Nifty Smallcap 250 - TRI,23.54,31.96,,-7.81,29,5,30,29,25,14,16,,LIC MF Small Cap Fund(G),Equity : Small Cap,29,30,30,29,28,23,21,13,-0.08,4.05,13.69,5.69,3.33,25.1,33.16,17.18,,,,,,,,
Nippon India Nifty Next 50 Junior BeES FoF-Reg(G),40664,Nippon India Mutual Fund,2.25,6.64,4.99,-6.4,NIFTY NEXT 50,20.3,21.17,,0.49,54,13,29,47,54,11,5,,Nippon India Nifty Next 50 Junior BeES FoF-Reg(G),FoFs : Domestic,61,76,66,62,58,47,28,23,7.79,1.03,6.92,8.6,7.34,15.95,15.45,10.25,2.15,6.18,4.88,-6.68,20.0,20.91,,-0.06
HDFC MNC Fund-Reg(G),47648,HDFC Mutual Fund,3.57,8.95,2.64,-9.69,NIFTY MNC - TRI,,,,-1.71,6,2,4,5,5,,,,HDFC MNC Fund-Reg(G),Equity : Thematic - MNC,6,6,6,6,5,4,4,3,0.71,3.06,10.54,4.2,-3.53,13.91,16.78,9.58,,,,,,,,
Baroda BNP Paribas Business Cycle Fund-Reg(G),45686,Baroda BNP Paribas Mutual Fund,1.25,6.75,2.71,-3.15,BSE 500 - TRI,19.67,,,-1.78,63,76,69,64,50,24,,,Baroda BNP Paribas Business Cycle Fund-Reg(G),Equity : Thematic,89,101,98,89,70,38,21,9,1.17,2.11,8.57,4.92,-0.47,21.6,24.24,13.58,,,,,,,,
Bajaj Finserv Consumption Fund-Reg(G),49345,Bajaj Finserv Mutual Fund,2.01,4.67,1.27,,Nifty India Consumption - TRI,,,,-3.28,18,17,10,17,,,,,Bajaj Finserv Consumption Fund-Reg(G),Equity : Thematic - Consumption,20,22,22,20,17,13,13,9,0.03,2.67,5.04,3.6,0.01,17.88,20.88,13.54,,,,,,,,
SBI FMP-67-1467D-Reg(G),46703,SBI Mutual Fund,0.44,1.93,4.27,8.14,CRISIL Medium to Long Term Debt Index,,,,4.67,34,46,33,34,34,,,,SBI FMP-67-1467D-Reg(G),Debt : FTP/FMP,91,92,92,91,91,49,18,4,4.33,0.44,1.82,4.17,8.01,7.39,5.56,6.15,,,,,,,,
Union Business Cycle Fund-Reg(G),48599,Union Mutual Fund,0.82,6.04,4.64,-3.91,NIFTY 500 - TRI,,,,-1.34,62,86,79,55,53,,,,Union Business Cycle Fund-Reg(G),Equity : Thematic,89,101,98,89,70,38,21,9,1.17,2.11,8.57,4.92,-0.47,21.6,24.24,13.58,,,,,,,,
ICICI Pru Nifty 200 Momentum 30 ETF,46682,ICICI Prudential Mutual Fund,-1.77,9.75,0.25,-14.19,Nifty200 Momentum 30 - TRI,,,,-6.37,155,178,62,149,155,,,,ICICI Pru Nifty 200 Momentum 30 ETF,Equity : ETFs,170,195,184,170,155,103,64,29,3.89,1.23,8.34,7.09,1.04,19.42,21.52,12.29,,,,,,,,
Motilal Oswal Nifty India Defence ETF,49103,Motilal Oswal Mutual Fund,-7.85,23.49,27.8,,Nifty India Defence - TRI,,,,25.93,1,194,5,1,,,,,Motilal Oswal Nifty India Defence ETF,Equity : ETFs,170,195,184,170,155,103,64,29,3.89,1.23,8.34,7.09,1.04,19.42,21.52,12.29,,,,,,,,
Canara Rob Ultra Short Term Fund-Reg(G),5902,Canara Robeco Mutual Fund,0.52,1.7,3.74,7.1,CRISIL Ultra Short Term Debt Index,6.5,4.99,5.73,4.03,18,27,21,18,17,19,20,11,Canara Rob Ultra Short Term Fund-Reg(G),Debt : Ultra Short Duration,26,30,29,26,24,24,22,13,4.1,0.55,1.75,3.81,7.28,6.76,5.5,6.17,0.54,1.81,4.0,7.89,,,,7.99
ICICI Pru Nifty 200 Momentum 30 Index Fund-Reg(G),46683,ICICI Prudential Mutual Fund,-1.84,9.53,-0.2,-14.75,Nifty200 Momentum 30 - TRI,,,,-6.82,162,190,70,163,129,,,,ICICI Pru Nifty 200 Momentum 30 Index Fund-Reg(G),Equity : Index Funds,175,201,193,175,129,68,32,18,2.77,1.26,8.58,6.78,-1.07,18.99,19.99,11.7,,,,,,,,
DSP Nifty 50 Equal Weight ETF,45715,DSP Mutual Fund,1.28,5.92,8.83,0.8,NIFTY50 Equal Weight,20.11,,,7.7,41,91,104,41,88,35,,,DSP Nifty 50 Equal Weight ETF,Equity : ETFs,170,195,184,170,155,103,64,29,3.89,1.23,8.34,7.09,1.04,19.42,21.52,12.29,1.14,5.56,8.28,-0.01,19.22,23.17,,12.42
Invesco India Gilt Fund(G),4378,Invesco Mutual Fund,0.9,0.39,4.78,7.79,Nifty All Duration G-Sec Index,7.72,4.91,6.79,4.5,23,13,26,21,25,13,17,19,Invesco India Gilt Fund(G),Debt : Gilt,36,38,37,37,36,23,21,21,4.96,0.72,0.97,4.9,8.57,7.75,5.38,7.35,,,,,,,,
Nippon India Income Plus Arbitrage Active FoF-Reg(G),49936,Nippon India Mutual Fund,0.65,,,,CRISIL Short Term Bond Index,,,,,,51,,,,,,,Nippon India Income Plus Arbitrage Active FoF-Reg(G),FoFs : Domestic,61,76,66,62,58,47,28,23,7.79,1.03,6.92,8.6,7.34,15.95,15.45,10.25,,,,,,,,
UTI BSE Low Volatility Index Fund-Reg(G),46409,UTI Mutual Fund,1.92,5.02,6.46,-2.72,BSE Low Volatility Index - TRI,17.13,,,4.96,62,72,158,114,87,34,,,UTI BSE Low Volatility Index Fund-Reg(G),Equity : Index Funds,175,201,193,175,129,68,32,18,2.77,1.26,8.58,6.78,-1.07,18.99,19.99,11.7,,,,,,,,
Union Short Duration Fund-Reg(G),49467,Union Mutual Fund,0.52,2.13,,,CRISIL Short Duration Debt Index,,,,,,18,9,,,,,,Union Short Duration Fund-Reg(G),Debt : Short Duration,30,34,34,30,26,23,21,18,11.43,0.71,2.15,4.98,8.8,7.38,6.05,6.81,,,,,,,,
Motilal Oswal Ultra Short Term Fund-Reg(G),22532,Motilal Oswal Mutual Fund,0.41,1.41,2.95,5.88,CRISIL Ultra Short Term Debt Index,5.72,4.5,3.73,3.22,26,30,29,26,24,24,22,13,Motilal Oswal Ultra Short Term Fund-Reg(G),Debt : Ultra Short Duration,26,30,29,26,24,24,22,13,4.1,0.55,1.75,3.81,7.28,6.76,5.5,6.17,0.54,1.81,4.0,7.89,,,,7.99
Kotak Nifty SDL Plus AAA PSU Bond Jul 2028 60:40 Index Fund-Reg(G),46730,Kotak Mahindra Mutual Fund,0.52,2.3,5.56,9.64,Nifty SDL Plus AAA PSU Bond Jul 2028 60:40 Index,,,,5.9,11,20,9,11,12,,,,Kotak Nifty SDL Plus AAA PSU Bond Jul 2028 60:40 Index Fund-Reg(G),Debt : Medium to Long Duration,59,60,60,59,52,26,11,11,5.43,0.47,1.94,5.12,9.04,7.69,5.48,6.54,,,,,,,,
Bank of India Business Cycle Fund-Reg(G),48964,Bank of India Mutual Fund,3.42,7.09,1.08,,NIFTY 500 - TRI,,,,-4.58,78,16,64,74,,,,,Bank of India Business Cycle Fund-Reg(G),Equity : Thematic,89,101,98,89,70,38,21,9,1.17,2.11,8.57,4.92,-0.47,21.6,24.24,13.58,,,,,,,,
Axis Greater China Equity FoF-Reg(G),44318,Axis Mutual Fund,6.66,20.6,18.41,23.94,MSCI Golden Dragon Index (Total Return Net),3.89,,,16.94,12,9,25,7,10,49,,,Axis Greater China Equity FoF-Reg(G),FoFs : Overseas,57,57,57,57,57,51,27,23,12.31,3.83,18.25,9.74,17.36,17.69,10.6,8.38,,,,,,,,
TRUSTMF Liquid Fund-Reg(G),45451,Trust Mutual Fund,0.47,1.54,3.37,6.96,CRISIL Liquid Debt Index,6.86,,,3.74,29,31,23,29,29,27,,,TRUSTMF Liquid Fund-Reg(G),Debt : Liquid,38,39,38,38,37,35,34,29,3.76,0.48,1.53,3.38,6.99,6.88,5.47,6.12,,,,,,,,
Mahindra Manulife Equity Savings Fund-Reg(G),36671,Mahindra Manulife Mutual Fund,1.1,3.59,4.15,3.64,NIFTY 50 Equity Savings Index - TRI,10.65,11.95,,3.58,32,29,40,43,42,46,36,,Mahindra Manulife Equity Savings Fund-Reg(G),Hybrid : Equity Oriented,55,56,56,55,55,54,51,31,7.94,5.64,9.07,9.75,8.7,14.73,15.16,9.88,,,,,,,,
DSP Floater Fund-Reg(G),45396,DSP Mutual Fund,0.46,1.59,4.86,9.35,CRISIL Short Duration Debt Index,8.24,,,5.2,7,12,11,7,2,2,,,DSP Floater Fund-Reg(G),Debt : Floater,12,12,12,12,12,12,7,5,5.22,0.57,1.94,4.92,8.95,7.83,6.26,7.13,,,,,,,,
Bandhan Transportation and Logistics Fund-Reg(G),46986,Bandhan Mutual Fund,4.23,14.33,7.98,-4.95,Nifty Transportation & Logistics - TRI,,,,5.87,4,3,3,4,4,,,,Bandhan Transportation and Logistics Fund-Reg(G),Equity : Sectoral - Auto,10,10,10,10,8,1,1,1,5.39,3.9,13.25,6.94,-4.17,21.76,26.94,11.63,,,,,,,,
ITI Large Cap Fund-Reg(G),44400,ITI Mutual Fund,1.24,5.9,5.21,-3.65,NIFTY 100 - TRI,17.2,,,2.42,28,15,17,30,32,20,,,ITI Large Cap Fund-Reg(G),Equity : Large Cap,38,39,39,38,37,34,31,28,3.44,1.2,5.76,6.5,0.22,17.57,19.3,11.84,,,,,,,,
Tata Housing Opportunities Fund-Reg(G),46764,Tata Mutual Fund,3.42,12.44,8.56,-2.7,Nifty Housing - TRI,,,,1.14,51,17,12,13,49,,,,Tata Housing Opportunities Fund-Reg(G),Equity : Thematic,89,101,98,89,70,38,21,9,1.17,2.11,8.57,4.92,-0.47,21.6,24.24,13.58,,,,,,,,
WOC Arbitrage Fund-Reg(G),48900,WhiteOak Capital Mutual Fund,0.47,1.46,3.4,,Nifty 50 Arbitrage - TRI,,,,3.86,2,11,6,4,,,,,WOC Arbitrage Fund-Reg(G),Hybrid : Arbitrage,30,31,31,30,26,24,23,14,3.58,0.45,1.37,3.2,6.67,6.74,5.4,5.72,,,,,,,,
ICICI Pru Nifty IT Index Fund-Reg(G),46707,ICICI Prudential Mutual Fund,-4.74,12.05,-11.07,-5.9,NIFTY IT - TRI,,,,-13.32,172,196,44,172,97,,,,ICICI Pru Nifty IT Index Fund-Reg(G),Equity : Index Funds,175,201,193,175,129,68,32,18,2.77,1.26,8.58,6.78,-1.07,18.99,19.99,11.7,,,,,,,,
UTI Nifty 500 Value 50 Index Fund-Reg(G),47577,UTI Mutual Fund,3.37,7.07,7.92,-6.0,NIFTY500 Value 50 - TRI,,,,6.3,27,32,97,60,99,,,,UTI Nifty 500 Value 50 Index Fund-Reg(G),Equity : Index Funds,175,201,193,175,129,68,32,18,2.77,1.26,8.58,6.78,-1.07,18.99,19.99,11.7,,,,,,,,
Axis Global Innovation FoF-Reg(G),45539,Axis Mutual Fund,5.03,23.36,6.94,15.29,MSCI ACWI Net TRI,20.01,,,9.34,34,20,18,33,29,21,,,Axis Global Innovation FoF-Reg(G),FoFs : Overseas,57,57,57,57,57,51,27,23,12.31,3.83,18.25,9.74,17.36,17.69,10.6,8.38,,,,,,,,
LIC MF Aggressive Hybrid Fund(G),2085,LIC Mutual Fund,0.5,8.05,7.01,3.98,CRISIL Hybrid 35+65 - Aggressive Index,15.33,14.23,8.7,3.91,25,53,6,11,36,21,28,22,LIC MF Aggressive Hybrid Fund(G),Hybrid : Equity Oriented,55,56,56,55,55,54,51,31,7.94,5.64,9.07,9.75,8.7,14.73,15.16,9.88,,,,,,,,
Franklin India Banking & PSU Debt Fund(G),28458,Franklin Templeton Mutual Fund,0.69,2.12,4.98,8.82,NIFTY Banking and PSU Debt Index,7.42,5.78,7.31,5.24,15,1,2,15,15,10,11,9,Franklin India Banking & PSU Debt Fund(G),Debt : Banking & PSU,26,26,26,26,26,21,16,16,5.17,0.47,1.89,4.89,8.73,7.42,5.86,7.22,,,,,,,,
WOC Quality Equity Fund-Reg(G),49192,WhiteOak Capital Mutual Fund,1.3,5.52,,,BSE Quality Index - TRI,,,,,,75,85,,,,,,WOC Quality Equity Fund-Reg(G),Equity : Thematic,89,101,98,89,70,38,21,9,1.17,2.11,8.57,4.92,-0.47,21.6,24.24,13.58,,,,,,,,
ICICI Pru Nifty Smallcap 250 Index Fund(G),45684,ICICI Prudential Mutual Fund,4.45,15.78,6.91,1.18,Nifty Smallcap 250 - TRI,27.36,,,0.53,119,10,17,104,53,5,,,ICICI Pru Nifty Smallcap 250 Index Fund(G),Equity : Index Funds,175,201,193,175,129,68,32,18,2.77,1.26,8.58,6.78,-1.07,18.99,19.99,11.7,,,,,,,,
JM Large Cap Fund-Reg(G),1858,JM Financial Mutual Fund,1.39,5.34,3.81,-7.3,BSE 100 - TRI,18.31,17.48,10.31,-0.11,35,12,23,34,37,11,26,24,JM Large Cap Fund-Reg(G),Equity : Large Cap,38,39,39,38,37,34,31,28,3.44,1.2,5.76,6.5,0.22,17.57,19.3,11.84,,,,,,,,
Mirae Asset Nifty 1D Rate Liquid ETF(IDCW),48119,Mirae Asset Mutual Fund,0.4,1.29,2.75,5.96,Nifty 1D Rate Index,,,,3.06,28,19,28,26,24,,,,Mirae Asset Nifty 1D Rate Liquid ETF(IDCW),Debt : ETFs,31,33,33,31,28,14,7,2,4.6,0.36,1.59,4.3,8.36,7.84,5.26,6.08,0.43,1.4,2.97,6.34,6.48,5.24,,6.01
Bandhan CRISIL IBX 90:10 SDL Plus Gilt - April 2032 Index Fund-Reg(G),46814,Bandhan Mutual Fund,0.31,1.52,5.58,10.51,CRISIL IBX 90:10 SDL Plus Gilt Index - April 2032,,,,6.02,7,21,4,8,6,,,,Bandhan CRISIL IBX 90:10 SDL Plus Gilt - April 2032 Index Fund-Reg(G),Debt : Long Duration,26,26,26,26,24,4,3,2,5.2,0.61,0.81,5.16,9.3,8.49,4.96,7.16,,,,,,,,
ITI Focused Fund-Reg(G),45722,ITI Mutual Fund,2.11,9.25,8.56,3.65,NIFTY 500 - TRI,,,,3.83,15,12,10,6,16,,,,ITI Focused Fund-Reg(G),Equity : Flexi Cap,48,49,48,48,48,35,27,21,1.56,1.72,7.48,5.87,0.93,19.41,21.42,13.2,,,,,,,,
Axis Nifty Smallcap 50 Index Fund-Reg(G),45856,Axis Mutual Fund,3.43,15.81,8.07,3.59,Nifty Smallcap 50 - TRI,29.93,,,1.85,111,26,13,51,15,2,,,Axis Nifty Smallcap 50 Index Fund-Reg(G),Equity : Index Funds,175,201,193,175,129,68,32,18,2.77,1.26,8.58,6.78,-1.07,18.99,19.99,11.7,,,,,,,,
HDFC BSE Sensex ETF,34084,HDFC Mutual Fund,0.7,4.8,7.57,1.74,BSE SENSEX - TRI,15.85,18.49,,5.5,66,143,143,83,69,84,53,,HDFC BSE Sensex ETF,Equity : ETFs,170,195,184,170,155,103,64,29,3.89,1.23,8.34,7.09,1.04,19.42,21.52,12.29,,,,,,,,
Quantum Liquid Fund-Reg(G),19756,Quantum Mutual Fund,0.44,1.46,3.18,6.67,CRISIL Liquid Debt Index,6.64,5.27,5.71,3.56,34,38,36,34,35,32,31,28,Quantum Liquid Fund-Reg(G),Debt : Liquid,38,39,38,38,37,35,34,29,3.76,0.48,1.53,3.38,6.99,6.88,5.47,6.12,,,,,,,,
