MF Code,schemecode,fund_house,returns_1month,returns_3month,returns_6month,returns_1year,index_name,returns_3year,returns_5year,returns_10year,ytd_returns,rank_ytd,rank_1month,rank_3month,rank_6month,rank_1year,rank_3year,rank_5year,rank_10year,s_name,classification,funds_num_ytd,funds_num_month1,funds_num_month3,funds_num_month6,funds_num_year1,funds_num_year3,funds_num_year5,funds_num_year10,ytd_avg,avg_month1,avg_month3,avg_month6,avg_year1,avg_year3,avg_year5,avg_year10,monthret_1,monthret_3,monthret_6,yrret_1,yrret_3,yrret_5,yrret_10,ytdret
SBI Nifty 50 ETF,33369,SBI Mutual Fund,1.3,7.43,6.65,9.88,NIFTY 50 - TRI,13.0,16.36,13.97,12.03,58,83,65,93,69,89,35,11,SBI Nifty 50 ETF,Equity : ETFs,170,214,205,191,168,122,72,33,9.0,0.95,7.36,7.03,7.92,16.94,18.01,13.8,,,,,,,,
Parag Parikh Flexi Cap Fund-Reg(G),21520,PPFAS Mutual Fund,-0.58,4.03,5.4,9.23,NIFTY 500 - TRI,20.95,20.76,17.4,7.71,12,40,40,20,6,5,7,2,Parag Parikh Flexi Cap Fund-Reg(G),Equity : Flexi Cap,48,51,50,48,48,39,29,21,4.09,0.1,4.98,5.21,4.11,16.03,18.06,14.12,,,,,,,,
SBI BSE Sensex ETF,20447,SBI Mutual Fund,1.58,7.56,6.03,8.62,BSE SENSEX - TRI,12.05,15.47,13.91,10.87,71,59,59,122,91,108,58,16,SBI BSE Sensex ETF,Equity : ETFs,170,214,205,191,168,122,72,33,9.0,0.95,7.36,7.03,7.92,16.94,18.01,13.8,,,,,,,,
HDFC Balanced Advantage Fund(G),1273,HDFC Mutual Fund,0.77,5.14,4.1,7.14,NIFTY 50 Hybrid Composite Debt 50:50 Index,17.77,21.62,15.05,7.25,14,11,7,22,12,1,1,1,HDFC Balanced Advantage Fund(G),Hybrid : Dynamic Asset Allocation,33,34,34,34,33,24,19,11,5.92,0.51,4.18,4.26,6.0,11.95,11.65,10.15,,,,,,,,
HDFC Flexi Cap Fund(G),1131,HDFC Mutual Fund,-0.11,5.38,6.85,11.46,NIFTY 500 - TRI,20.98,26.04,16.44,11.99,1,32,24,11,1,4,1,4,HDFC Flexi Cap Fund(G),Equity : Flexi Cap,48,51,50,48,48,39,29,21,4.09,0.1,4.98,5.21,4.11,16.03,18.06,14.12,,,,,,,,
HDFC Mid Cap Fund-Reg(G),1305,HDFC Mutual Fund,1.86,7.42,8.77,10.0,Nifty Midcap 150 - TRI,25.5,26.92,18.43,7.4,4,3,4,8,4,4,2,2,HDFC Mid Cap Fund-Reg(G),Equity : Mid Cap,30,32,32,31,30,28,24,20,2.98,0.26,4.82,6.46,4.54,21.34,22.91,16.24,,,,,,,,
SBI Equity Hybrid Fund-Reg(G),2747,SBI Mutual Fund,0.31,5.73,5.38,12.18,CRISIL Hybrid 35+65 - Aggressive Index,13.89,14.87,12.46,12.8,2,32,3,11,2,13,14,9,SBI Equity Hybrid Fund-Reg(G),Hybrid : Equity Oriented,53,56,56,54,53,52,49,33,5.87,0.34,3.53,4.08,6.08,12.09,12.93,10.38,,,,,,,,
ICICI Pru Large Cap Fund(G),4980,ICICI Prudential Mutual Fund,1.6,6.33,7.02,10.62,NIFTY 100 - TRI,17.82,19.98,14.96,11.89,2,4,11,4,3,4,3,2,ICICI Pru Large Cap Fund(G),Equity : Large Cap,38,39,39,39,38,35,32,28,7.27,0.57,5.63,5.36,6.37,14.46,16.38,13.01,,,,,,,,
Kotak Arbitrage Fund(G),1979,Kotak Mahindra Mutual Fund,0.52,1.35,2.86,6.52,Nifty 50 Arbitrage,7.27,5.97,5.92,5.89,7,13,20,12,5,1,1,1,Kotak Arbitrage Fund(G),Hybrid : Arbitrage,30,33,32,31,28,24,24,14,5.64,0.51,1.35,2.8,6.31,6.89,5.53,5.69,0.54,1.77,3.46,7.65,7.66,6.19,,7.51
ICICI Pru Multi-Asset Fund(G),1495,ICICI Prudential Mutual Fund,1.46,7.02,8.64,16.4,NIFTY 200 - TRI,19.28,23.6,16.05,17.17,8,22,22,20,7,4,2,2,ICICI Pru Multi-Asset Fund(G),Hybrid : Multi Asset Allocation,27,33,32,29,25,9,9,7,14.35,1.7,7.63,8.95,13.67,17.27,17.69,13.21,,,,,,,,
SBI Liquid Fund-Reg(G),2828,SBI Mutual Fund,0.49,1.43,2.9,6.51,Nifty Liquid Fund Index,6.9,5.67,6.08,5.92,21,22,25,24,22,24,25,19,SBI Liquid Fund-Reg(G),Debt : Liquid,38,42,41,38,38,35,34,29,5.89,0.48,1.42,2.89,6.49,6.89,5.66,6.05,,,,,,,,
Nippon India Small Cap Fund(G),12758,Nippon India Mutual Fund,-1.54,2.17,2.18,-3.69,Nifty Smallcap 250 - TRI,21.18,29.23,19.98,-3.54,19,12,18,19,20,5,2,1,Nippon India Small Cap Fund(G),Equity : Small Cap,29,31,31,30,29,23,21,13,-2.97,-1.8,2.52,3.17,-2.44,19.01,24.91,16.73,,,,,,,,
ICICI Pru Balanced Advantage Fund(G),1470,ICICI Prudential Mutual Fund,0.81,4.32,6.4,11.69,CRISIL Hybrid 50+50 - Moderate Index,13.48,13.52,11.37,12.06,1,9,13,2,1,5,2,3,ICICI Pru Balanced Advantage Fund(G),Hybrid : Dynamic Asset Allocation,33,34,34,34,33,24,19,11,5.92,0.51,4.18,4.26,6.0,11.95,11.65,10.15,,,,,,,,
UTI Nifty 50 ETF,33150,UTI Mutual Fund,1.09,7.12,6.76,10.9,NIFTY 50 - TRI,13.41,16.39,14.0,12.17,47,102,84,74,48,75,32,10,UTI Nifty 50 ETF,Equity : ETFs,170,214,205,191,168,122,72,33,9.0,0.95,7.36,7.03,7.92,16.94,18.01,13.8,,,,,,,,
HDFC Liquid Fund(G),1286,HDFC Mutual Fund,0.49,1.44,2.92,6.58,CRISIL Liquid Debt Index,6.94,5.68,6.07,5.98,17,5,16,20,18,16,22,20,HDFC Liquid Fund(G),Debt : Liquid,38,42,41,38,38,35,34,29,5.89,0.48,1.42,2.89,6.49,6.89,5.66,6.05,,,,,,,,
Kotak Midcap Fund-Reg(G),1977,Kotak Mahindra Mutual Fund,-1.44,2.2,6.22,4.46,Nifty Midcap 150 - TRI,21.19,23.8,17.91,2.23,19,32,29,15,15,15,10,5,Kotak Midcap Fund-Reg(G),Equity : Mid Cap,30,32,32,31,30,28,24,20,2.98,0.26,4.82,6.46,4.54,21.34,22.91,16.24,,,,,,,,
ICICI Pru Value Fund(G),1492,ICICI Prudential Mutual Fund,2.01,7.01,7.72,12.36,NIFTY 500 - TRI,21.13,25.14,15.74,13.62,1,1,8,2,1,5,2,8,ICICI Pru Value Fund(G),Equity : Value / Contra,22,23,23,23,22,21,17,15,4.58,0.55,6.18,5.28,3.9,18.91,21.32,14.93,,,,,,,,
Aditya Birla SL Liquid Fund(G),293,Aditya Birla Sun Life Mutual Fund,0.49,1.45,2.93,6.61,Nifty Liquid Fund Index,6.99,5.73,6.18,5.99,11,6,11,13,11,6,9,4,Aditya Birla SL Liquid Fund(G),Debt : Liquid,38,42,41,38,38,35,34,29,5.89,0.48,1.42,2.89,6.49,6.89,5.66,6.05,,,,,,,,
Kotak Flexicap Fund(G),7874,Kotak Mahindra Mutual Fund,0.33,6.08,5.18,9.27,NIFTY 500 - TRI,16.49,17.27,14.34,10.2,6,23,15,24,5,17,14,8,Kotak Flexicap Fund(G),Equity : Flexi Cap,48,51,50,48,48,39,29,21,4.09,0.1,4.98,5.21,4.11,16.03,18.06,14.12,,,,,,,,
SBI Large Cap Fund-Reg(G),2711,SBI Mutual Fund,0.93,5.88,5.27,7.47,BSE 100 - TRI,13.58,16.3,13.0,9.45,6,14,16,25,17,22,18,17,SBI Large Cap Fund-Reg(G),Equity : Large Cap,38,39,39,39,38,35,32,28,7.27,0.57,5.63,5.36,6.37,14.46,16.38,13.01,,,,,,,,
Nippon India ETF Nifty 50 BeES,2272,Nippon India Mutual Fund,1.07,7.11,6.74,10.89,NIFTY 50 - TRI,13.41,16.4,13.92,12.04,55,106,86,78,50,74,31,14,Nippon India ETF Nifty 50 BeES,Equity : ETFs,170,214,205,191,168,122,72,33,9.0,0.95,7.36,7.03,7.92,16.94,18.01,13.8,,,,,,,,
UTI BSE Sensex ETF,33151,UTI Mutual Fund,1.33,7.22,6.33,9.68,BSE SENSEX - TRI,12.41,15.48,13.94,10.97,65,73,72,100,75,96,57,13,UTI BSE Sensex ETF,Equity : ETFs,170,214,205,191,168,122,72,33,9.0,0.95,7.36,7.03,7.92,16.94,18.01,13.8,,,,,,,,
ICICI Pru Liquid Fund(G),1659,ICICI Prudential Mutual Fund,0.49,1.44,2.92,6.57,CRISIL Liquid Debt Index,6.96,5.69,6.14,5.97,20,14,21,21,20,14,16,11,ICICI Pru Liquid Fund(G),Debt : Liquid,38,42,41,38,38,35,34,29,5.89,0.48,1.42,2.89,6.49,6.89,5.66,6.05,,,,,,,,
Nippon India Multi Cap Fund(G),2466,Nippon India Mutual Fund,-0.6,2.44,3.26,4.4,Nifty500 Multicap 50:25:25 - TRI,21.47,27.23,15.19,4.87,20,32,41,38,20,3,1,4,Nippon India Multi Cap Fund(G),Equity : Multi Cap,42,45,45,44,41,29,21,14,4.04,0.0,4.76,5.42,4.2,16.99,18.85,14.4,,,,,,,,
SBI Contra Fund-Reg(G),2809,SBI Mutual Fund,0.77,6.39,5.1,4.02,BSE 500 - TRI,19.34,26.79,16.48,5.58,10,10,11,14,12,9,1,3,SBI Contra Fund-Reg(G),Equity : Value / Contra,22,23,23,23,22,21,17,15,4.58,0.55,6.18,5.28,3.9,18.91,21.32,14.93,,,,,,,,
Nippon India Large Cap Fund(G),2455,Nippon India Mutual Fund,0.44,4.89,6.18,8.94,BSE 100 - TRI,18.76,22.43,14.86,9.43,7,28,34,16,6,2,2,3,Nippon India Large Cap Fund(G),Equity : Large Cap,38,39,39,39,38,35,32,28,7.27,0.57,5.63,5.36,6.37,14.46,16.38,13.01,,,,,,,,
ICICI Pru Equity & Debt Fund(G),1482,ICICI Prudential Mutual Fund,0.67,5.03,6.92,12.82,CRISIL Hybrid 35+65 - Aggressive Index,18.96,23.95,16.16,13.8,1,15,10,4,1,1,1,1,ICICI Pru Equity & Debt Fund(G),Hybrid : Equity Oriented,53,56,56,54,53,52,49,33,5.87,0.34,3.53,4.08,6.08,12.09,12.93,10.38,,,,,,,,
Mirae Asset Large & Midcap Fund-Reg(G),9767,Mirae Asset Mutual Fund,0.64,7.56,8.82,8.32,NIFTY LargeMidcap 250 - TRI,16.88,18.87,17.53,9.03,4,11,1,3,6,15,18,1,Mirae Asset Large & Midcap Fund-Reg(G),Equity : Large & Mid Cap,31,33,33,31,31,26,26,19,4.9,0.29,5.29,5.8,5.38,18.04,20.1,14.95,,,,,,,,
Nippon India Growth Mid Cap Fund(G),2573,Nippon India Mutual Fund,0.2,4.92,5.88,5.88,Nifty Midcap 150 - TRI,24.79,26.43,18.22,4.6,9,18,16,16,9,6,3,4,Nippon India Growth Mid Cap Fund(G),Equity : Mid Cap,30,32,32,31,30,28,24,20,2.98,0.26,4.82,6.46,4.54,21.34,22.91,16.24,,,,,,,,
Mirae Asset Large Cap Fund-Reg(G),4457,Mirae Asset Mutual Fund,1.24,6.01,6.77,9.12,NIFTY 100 - TRI,12.85,15.39,13.88,10.37,3,8,14,7,5,27,22,6,Mirae Asset Large Cap Fund-Reg(G),Equity : Large Cap,38,39,39,39,38,35,32,28,7.27,0.57,5.63,5.36,6.37,14.46,16.38,13.01,,,,,,,,
SBI Focused Fund-Reg(G),2817,SBI Mutual Fund,2.19,9.92,10.63,15.46,BSE 500 - TRI,17.33,17.9,15.22,15.43,1,1,1,2,1,14,12,3,SBI Focused Fund-Reg(G),Equity : Multi Cap,42,45,45,44,41,29,21,14,4.04,0.0,4.76,5.42,4.2,16.99,18.85,14.4,,,,,,,,
SBI Arbitrage Opportunities Fund-Reg(G),2709,SBI Mutual Fund,0.51,1.39,2.94,6.58,Nifty 50 Arbitrage,7.21,5.95,5.74,6.0,2,20,5,4,3,2,3,7,SBI Arbitrage Opportunities Fund-Reg(G),Hybrid : Arbitrage,30,33,32,31,28,24,24,14,5.64,0.51,1.35,2.8,6.31,6.89,5.53,5.69,0.54,1.77,3.46,7.65,7.66,6.19,,7.51
HDFC Large Cap Fund(G),1331,HDFC Mutual Fund,1.27,5.95,5.6,6.94,NIFTY 100 - TRI,15.44,19.25,13.6,8.01,21,7,15,22,20,9,5,8,HDFC Large Cap Fund(G),Equity : Large Cap,38,39,39,39,38,35,32,28,7.27,0.57,5.63,5.36,6.37,14.46,16.38,13.01,,,,,,,,
SBI Balanced Advantage Fund-Reg(G),32097,SBI Mutual Fund,0.92,5.9,4.81,8.69,NIFTY 50 Hybrid Composite Debt 50:50 Index,13.89,,,9.17,4,5,4,9,3,3,,,SBI Balanced Advantage Fund-Reg(G),Hybrid : Dynamic Asset Allocation,33,34,34,34,33,24,19,11,5.92,0.51,4.18,4.26,6.0,11.95,11.65,10.15,,,,,,,,
HDFC Small Cap Fund-Reg(G),4455,HDFC Mutual Fund,-2.15,1.02,4.66,1.36,BSE 250 Small Cap - TRI,20.6,26.98,18.02,1.38,4,23,26,9,5,6,5,4,HDFC Small Cap Fund-Reg(G),Equity : Small Cap,29,31,31,30,29,23,21,13,-2.97,-1.8,2.52,3.17,-2.44,19.01,24.91,16.73,,,,,,,,
Tata Money Market Fund-Reg(G),3267,Tata Mutual Fund,0.52,1.51,3.2,7.55,CRISIL Money Market Index,7.54,6.18,5.97,6.89,7,11,9,6,6,6,4,13,Tata Money Market Fund-Reg(G),Debt : Money Market,22,23,23,23,22,21,17,13,6.72,0.51,1.48,3.13,7.34,7.27,5.94,6.52,,,,,,,,
SBI Savings Fund-Reg(G),2774,SBI Mutual Fund,0.51,1.46,3.02,7.19,CRISIL Money Market Index,7.1,5.71,6.39,6.61,17,18,18,21,17,18,13,9,SBI Savings Fund-Reg(G),Debt : Money Market,22,23,23,23,22,21,17,13,6.72,0.51,1.48,3.13,7.34,7.27,5.94,6.52,,,,,,,,
Motilal Oswal Midcap Fund-Reg(G),22533,Motilal Oswal Mutual Fund,-0.95,0.93,3.92,-3.15,Nifty Midcap 150 - TRI,25.88,29.79,17.81,-8.05,30,26,31,27,29,2,1,6,Motilal Oswal Midcap Fund-Reg(G),Equity : Mid Cap,30,32,32,31,30,28,24,20,2.98,0.26,4.82,6.46,4.54,21.34,22.91,16.24,,,,,,,,
SBI Small Cap Fund-Reg(G),7885,SBI Mutual Fund,-2.83,0.42,0.77,-4.87,BSE 250 Small Cap - TRI,13.52,20.43,17.93,-4.04,20,29,28,24,23,22,20,5,SBI Small Cap Fund-Reg(G),Equity : Small Cap,29,31,31,30,29,23,21,13,-2.97,-1.8,2.52,3.17,-2.44,19.01,24.91,16.73,,,,,,,,
HDFC Money Market Fund-Reg(G),1119,HDFC Mutual Fund,0.51,1.48,3.16,7.48,CRISIL Money Market Index,7.47,6.1,6.68,6.87,11,17,15,13,10,9,8,6,HDFC Money Market Fund-Reg(G),Debt : Money Market,22,23,23,23,22,21,17,13,6.72,0.51,1.48,3.13,7.34,7.27,5.94,6.52,,,,,,,,
HDFC Corp Bond Fund(G),8241,HDFC Mutual Fund,0.5,1.91,2.08,7.91,NIFTY Corporate Bond Index,7.81,6.12,7.61,7.18,17,19,10,19,17,5,4,2,HDFC Corp Bond Fund(G),Debt : Corporate Bond,21,21,21,21,21,20,18,12,7.47,0.56,1.87,2.41,8.17,7.58,5.85,7.09,,,,,,,,
SBI Large & Midcap Fund-Reg(G),2801,SBI Mutual Fund,1.71,6.72,8.4,8.42,NIFTY LargeMidcap 250 - TRI,16.79,21.42,15.31,10.06,2,3,6,5,5,16,9,8,SBI Large & Midcap Fund-Reg(G),Equity : Large & Mid Cap,31,33,33,31,31,26,26,19,4.9,0.29,5.29,5.8,5.38,18.04,20.1,14.95,,,,,,,,
Axis Liquid Fund-Reg(G),8029,Axis Mutual Fund,0.49,1.45,2.95,6.65,Nifty Liquid Fund Index,7.01,5.76,6.19,6.04,3,7,8,5,4,2,2,3,Axis Liquid Fund-Reg(G),Debt : Liquid,38,42,41,38,38,35,34,29,5.89,0.48,1.42,2.89,6.49,6.89,5.66,6.05,,,,,,,,
Axis ELSS Tax Saver Fund-Reg(G),8408,Axis Mutual Fund,-0.1,4.2,4.15,5.51,NIFTY 500 - TRI,13.7,12.26,12.58,5.77,21,31,41,40,21,45,50,24,Axis ELSS Tax Saver Fund-Reg(G),Equity : Tax Saving (ELSS),56,57,57,57,56,52,51,29,4.28,-0.01,4.87,4.88,4.07,16.65,19.66,14.01,,,,,,,,
Kotak Money Market Fund(G),1999,Kotak Mahindra Mutual Fund,0.52,1.51,3.19,7.51,CRISIL Money Market Index,7.51,6.13,6.68,6.9,6,7,7,10,8,7,6,7,Kotak Money Market Fund(G),Debt : Money Market,22,23,23,23,22,21,17,13,6.72,0.51,1.48,3.13,7.34,7.27,5.94,6.52,,,,,,,,
ICICI Pru Money Market Fund(G),1690,ICICI Prudential Mutual Fund,0.52,1.5,3.2,7.55,Nifty Money Market Index,7.54,6.12,6.71,6.93,5,10,12,8,5,5,7,5,ICICI Pru Money Market Fund(G),Debt : Money Market,22,23,23,23,22,21,17,13,6.72,0.51,1.48,3.13,7.34,7.27,5.94,6.52,,,,,,,,
ICICI Pru Nifty 50 ETF,20803,ICICI Prudential Mutual Fund,1.07,7.11,6.75,10.9,NIFTY 50 - TRI,13.43,16.42,13.95,12.05,53,107,85,77,47,73,29,12,ICICI Pru Nifty 50 ETF,Equity : ETFs,170,214,205,191,168,122,72,33,9.0,0.95,7.36,7.03,7.92,16.94,18.01,13.8,,,,,,,,
ICICI Pru Corp Bond Fund(G),7925,ICICI Prudential Mutual Fund,0.62,1.94,2.93,8.34,NIFTY Corporate Bond Index,7.92,6.44,7.51,7.67,6,3,7,2,8,3,2,3,ICICI Pru Corp Bond Fund(G),Debt : Corporate Bond,21,21,21,21,21,20,18,12,7.47,0.56,1.87,2.41,8.17,7.58,5.85,7.09,,,,,,,,
Kotak Liquid Fund-Reg(G),2060,Kotak Mahindra Mutual Fund,0.49,1.44,2.93,6.58,Nifty Liquid Fund Index,6.93,5.68,6.1,5.99,13,19,19,18,19,19,23,17,Kotak Liquid Fund-Reg(G),Debt : Liquid,38,42,41,38,38,35,34,29,5.89,0.48,1.42,2.89,6.49,6.89,5.66,6.05,,,,,,,,
Axis Large Cap Fund-Reg(G),8250,Axis Mutual Fund,0.63,5.05,5.02,6.41,BSE 100 - TRI,11.47,12.02,12.66,7.13,24,24,32,29,23,32,31,18,Axis Large Cap Fund-Reg(G),Equity : Large Cap,38,39,39,39,38,35,32,28,7.27,0.57,5.63,5.36,6.37,14.46,16.38,13.01,,,,,,,,
ICICI Pru India Opp Fund(G),42140,ICICI Prudential Mutual Fund,1.45,7.32,7.11,12.15,NIFTY 500 - TRI,22.57,29.54,,12.81,4,18,15,20,3,7,3,,ICICI Pru India Opp Fund(G),Equity : Thematic,88,110,107,99,80,39,23,9,3.21,-0.12,4.96,5.16,3.32,17.86,21.22,14.57,,,,,,,,
Nippon India ETF Gold BeES,1024,Nippon India Mutual Fund,7.01,24.17,30.93,63.36,Gold-India,31.72,19.6,16.12,66.82,20,26,25,26,24,17,11,10,Nippon India ETF Gold BeES,Gold : ETFs,31,38,37,35,31,17,11,11,77.55,10.0,30.15,44.9,71.32,33.37,20.02,16.23,,,,,,,,
ICICI Pru Equity-Arbitrage Fund(G),1467,ICICI Prudential Mutual Fund,0.5,1.36,2.88,6.53,Nifty 50 Arbitrage,7.1,5.78,5.79,5.91,6,22,13,9,4,7,6,5,ICICI Pru Equity-Arbitrage Fund(G),Hybrid : Arbitrage,30,33,32,31,28,24,24,14,5.64,0.51,1.35,2.8,6.31,6.89,5.53,5.69,0.54,1.77,3.46,7.65,7.66,6.19,,7.51
Axis Midcap Fund-Reg(G),13049,Axis Mutual Fund,-0.49,3.2,4.52,4.24,BSE 150 MidCap - TRI,18.86,19.22,16.44,2.68,17,24,26,24,16,23,22,8,Axis Midcap Fund-Reg(G),Equity : Mid Cap,30,32,32,31,30,28,24,20,2.98,0.26,4.82,6.46,4.54,21.34,22.91,16.24,,,,,,,,
SBI ELSS Tax Saver Fund-Reg(G),2815,SBI Mutual Fund,0.73,6.19,4.21,4.86,BSE 500 - TRI,22.6,23.42,15.07,5.89,20,15,15,39,27,2,9,7,SBI ELSS Tax Saver Fund-Reg(G),Equity : Tax Saving (ELSS),56,57,57,57,56,52,51,29,4.28,-0.01,4.87,4.88,4.07,16.65,19.66,14.01,,,,,,,,
Aditya Birla SL Large Cap Fund-Reg(G),447,Aditya Birla Sun Life Mutual Fund,0.63,5.87,5.89,8.73,NIFTY 100 - TRI,15.13,17.34,13.19,9.57,5,23,17,20,7,13,8,14,Aditya Birla SL Large Cap Fund-Reg(G),Equity : Large Cap,38,39,39,39,38,35,32,28,7.27,0.57,5.63,5.36,6.37,14.46,16.38,13.01,,,,,,,,
CPSE ETF,27621,Nippon India Mutual Fund,-2.44,4.47,-0.99,-0.06,Nifty CPSE - TRI,33.05,37.25,15.61,7.72,102,199,176,185,128,4,3,4,CPSE ETF,Equity : ETFs,170,214,205,191,168,122,72,33,9.0,0.95,7.36,7.03,7.92,16.94,18.01,13.8,,,,,,,,
Quant Small Cap Fund(G),876,Quant Mutual Fund,-1.79,3.48,2.75,-4.07,Nifty Smallcap 250 - TRI,21.86,31.52,19.3,-1.07,10,14,11,18,21,4,1,2,Quant Small Cap Fund(G),Equity : Small Cap,29,31,31,30,29,23,21,13,-2.97,-1.8,2.52,3.17,-2.44,19.01,24.91,16.73,,,,,,,,
Nippon India Liquid Fund(G),2637,Nippon India Mutual Fund,0.49,1.44,2.93,6.58,Nifty Liquid Fund Index,6.94,5.69,6.15,5.98,18,8,18,19,16,17,18,8,Nippon India Liquid Fund(G),Debt : Liquid,38,42,41,38,38,35,34,29,5.89,0.48,1.42,2.89,6.49,6.89,5.66,6.05,,,,,,,,
Aditya Birla SL Corp Bond Fund(G),453,Aditya Birla Sun Life Mutual Fund,0.59,2.0,2.13,7.96,NIFTY Corporate Bond Index,7.86,6.3,7.68,7.25,15,7,4,17,15,4,3,1,Aditya Birla SL Corp Bond Fund(G),Debt : Corporate Bond,21,21,21,21,21,20,18,12,7.47,0.56,1.87,2.41,8.17,7.58,5.85,7.09,,,,,,,,
Aditya Birla SL Money Manager Fund(G),394,Aditya Birla Sun Life Mutual Fund,0.53,1.52,3.24,7.54,CRISIL Money Market Index,7.57,6.19,6.84,6.87,10,4,4,2,7,2,3,1,Aditya Birla SL Money Manager Fund(G),Debt : Money Market,22,23,23,23,22,21,17,13,6.72,0.51,1.48,3.13,7.34,7.27,5.94,6.52,,,,,,,,
Kotak Large & Midcap Fund(G),2069,Kotak Mahindra Mutual Fund,0.43,6.38,6.62,6.1,NIFTY LargeMidcap 250 - TRI,18.83,20.02,15.88,6.09,14,15,11,11,13,11,13,6,Kotak Large & Midcap Fund(G),Equity : Large & Mid Cap,31,33,33,31,31,26,26,19,4.9,0.29,5.29,5.8,5.38,18.04,20.1,14.95,,,,,,,,
ICICI Pru Savings Fund(G),1500,ICICI Prudential Mutual Fund,0.64,1.72,3.38,7.86,NIFTY Low Duration Debt Index,7.77,6.33,7.24,7.28,2,1,1,1,2,1,2,1,ICICI Pru Savings Fund(G),Debt : Low Duration,20,26,25,23,20,20,20,19,6.83,0.53,1.55,3.09,7.44,7.2,5.82,6.43,,,,,,,,
UTI Liquid Fund-Reg(G),3590,UTI Mutual Fund,0.49,1.45,2.94,6.61,Nifty Liquid Fund Index,6.98,5.73,6.16,6.0,9,11,9,7,8,8,8,7,UTI Liquid Fund-Reg(G),Debt : Liquid,38,42,41,38,38,35,34,29,5.89,0.48,1.42,2.89,6.49,6.89,5.66,6.05,,,,,,,,
ICICI Pru Dynamic Asset Allocation Active FOF(G),1704,ICICI Prudential Mutual Fund,0.52,3.55,4.27,10.13,CRISIL Hybrid 50+50 - Moderate Index,14.0,14.24,12.58,10.08,24,54,50,43,22,29,15,7,ICICI Pru Dynamic Asset Allocation Active FOF(G),FoFs : Domestic,60,87,81,72,60,50,31,23,18.18,2.64,8.7,12.84,17.0,15.61,13.73,10.63,,,,,,,,
HDFC Large and Mid Cap Fund-Reg(G),2271,HDFC Mutual Fund,0.22,5.88,6.18,7.02,NIFTY LargeMidcap 250 - TRI,19.75,23.7,15.08,6.59,10,17,16,15,10,9,3,12,HDFC Large and Mid Cap Fund-Reg(G),Equity : Large & Mid Cap,31,33,33,31,31,26,26,19,4.9,0.29,5.29,5.8,5.38,18.04,20.1,14.95,,,,,,,,
Invesco India Arbitrage Fund-Reg(G),2167,Invesco Mutual Fund,0.53,1.41,2.94,6.52,Nifty 50 Arbitrage,7.2,5.95,5.8,5.84,8,4,3,5,7,3,2,3,Invesco India Arbitrage Fund-Reg(G),Hybrid : Arbitrage,30,33,32,31,28,24,24,14,5.64,0.51,1.35,2.8,6.31,6.89,5.53,5.69,0.54,1.77,3.46,7.65,7.66,6.19,,7.51
Mirae Asset ELSS Tax Saver Fund-Reg(G),33536,Mirae Asset Mutual Fund,0.22,6.9,8.09,8.78,NIFTY 500 - TRI,16.81,18.67,,9.48,8,26,10,4,8,24,27,,Mirae Asset ELSS Tax Saver Fund-Reg(G),Equity : Tax Saving (ELSS),56,57,57,57,56,52,51,29,4.28,-0.01,4.87,4.88,4.07,16.65,19.66,14.01,,,,,,,,
Axis Small Cap Fund-Reg(G),21651,Axis Mutual Fund,-2.11,2.68,2.07,0.16,Nifty Smallcap 250 - TRI,18.02,23.19,18.24,-0.63,8,21,14,20,9,14,17,3,Axis Small Cap Fund-Reg(G),Equity : Small Cap,29,31,31,30,29,23,21,13,-2.97,-1.8,2.52,3.17,-2.44,19.01,24.91,16.73,,,,,,,,
Canara Rob Large and Mid Cap Fund-Reg(G),523,Canara Robeco Mutual Fund,-0.76,1.75,2.81,3.11,NIFTY LargeMidcap 250 - TRI,15.76,17.81,15.25,1.87,25,30,32,27,24,21,21,9,Canara Rob Large and Mid Cap Fund-Reg(G),Equity : Large & Mid Cap,31,33,33,31,31,26,26,19,4.9,0.29,5.29,5.8,5.38,18.04,20.1,14.95,,,,,,,,
UTI Flexi Cap Fund-Reg(G),3461,UTI Mutual Fund,-1.03,1.45,3.44,3.19,NIFTY 500 - TRI,10.85,12.28,12.6,3.23,30,48,47,42,30,37,29,18,UTI Flexi Cap Fund-Reg(G),Equity : Flexi Cap,48,51,50,48,48,39,29,21,4.09,0.1,4.98,5.21,4.11,16.03,18.06,14.12,,,,,,,,
ICICI Pru Large & Mid Cap Fund(G),1608,ICICI Prudential Mutual Fund,0.55,6.5,6.53,12.57,NIFTY LargeMidcap 250 - TRI,20.99,24.89,16.36,14.19,1,13,10,13,1,5,2,4,ICICI Pru Large & Mid Cap Fund(G),Equity : Large & Mid Cap,31,33,33,31,31,26,26,19,4.9,0.29,5.29,5.8,5.38,18.04,20.1,14.95,,,,,,,,
UTI Nifty 50 Index Fund-Reg(G),3641,UTI Mutual Fund,1.07,7.05,6.62,10.62,NIFTY 50 - TRI,13.08,16.08,13.64,11.91,26,90,71,43,23,53,13,1,UTI Nifty 50 Index Fund-Reg(G),Equity : Index Funds,175,219,215,198,167,83,34,18,5.22,0.54,6.23,4.78,4.35,16.09,16.83,13.09,,,,,,,,
HDFC Low Duration Fund(G),1114,HDFC Mutual Fund,0.53,1.56,3.08,7.39,NIFTY Low Duration Debt Index,7.26,5.89,6.7,6.84,6,11,13,11,10,6,6,5,HDFC Low Duration Fund(G),Debt : Low Duration,20,26,25,23,20,20,20,19,6.83,0.53,1.55,3.09,7.44,7.2,5.82,6.43,,,,,,,,
SBI Overnight Fund-Reg(G),2787,SBI Mutual Fund,0.44,1.34,2.68,5.84,CRISIL Liquid Overnight Index,6.32,5.27,5.43,5.28,16,19,18,16,17,23,18,2,SBI Overnight Fund-Reg(G),Debt : Overnight,34,35,35,34,34,30,27,3,5.25,0.44,1.33,2.67,5.82,6.32,5.28,5.45,,,,,,,,
BHARAT Bond ETF - April 2030,44421,Edelweiss Mutual Fund,0.63,2.22,2.76,9.19,NIFTY BHARAT Bond Index - April 2030,8.4,6.71,,8.56,4,6,6,5,4,3,1,,BHARAT Bond ETF - April 2030,Debt : ETFs,30,33,32,32,30,13,8,2,6.58,0.51,1.65,2.37,7.34,7.52,5.44,5.9,,,,,,,,
HDFC Focused Fund-Reg(G),1129,HDFC Mutual Fund,-0.22,4.63,6.26,10.66,NIFTY 500 - TRI,20.8,26.54,14.49,11.59,3,28,26,17,2,4,2,8,HDFC Focused Fund-Reg(G),Equity : Multi Cap,42,45,45,44,41,29,21,14,4.04,0.0,4.76,5.42,4.2,16.99,18.85,14.4,,,,,,,,
ICICI Pru BSE Sensex ETF,2848,ICICI Prudential Mutual Fund,1.31,7.2,6.32,9.7,BSE SENSEX - TRI,12.45,15.51,13.89,10.9,67,77,73,101,73,93,54,20,ICICI Pru BSE Sensex ETF,Equity : ETFs,170,214,205,191,168,122,72,33,9.0,0.95,7.36,7.03,7.92,16.94,18.01,13.8,,,,,,,,
SBI Corp Bond Fund-Reg(G),40450,SBI Mutual Fund,0.63,2.04,2.43,8.23,NIFTY Corporate Bond Index,7.57,5.72,,7.62,9,2,2,10,11,12,12,,SBI Corp Bond Fund-Reg(G),Debt : Corporate Bond,21,21,21,21,21,20,18,12,7.47,0.56,1.87,2.41,8.17,7.58,5.85,7.09,,,,,,,,
HDFC Hybrid Equity Fund(G),1311,HDFC Mutual Fund,0.26,3.91,2.62,6.05,NIFTY 50 Hybrid Composite Debt 65:35 Index,11.77,15.43,10.74,6.12,26,34,22,45,30,24,10,14,HDFC Hybrid Equity Fund(G),Hybrid : Equity Oriented,53,56,56,54,53,52,49,33,5.87,0.34,3.53,4.08,6.08,12.09,12.93,10.38,,,,,,,,
Aditya Birla SL Flexi Cap Fund(G),445,Aditya Birla Sun Life Mutual Fund,0.67,7.19,7.35,10.27,NIFTY 500 - TRI,17.13,17.84,14.76,10.66,3,15,5,8,2,15,12,6,Aditya Birla SL Flexi Cap Fund(G),Equity : Flexi Cap,48,51,50,48,48,39,29,21,4.09,0.1,4.98,5.21,4.11,16.03,18.06,14.12,,,,,,,,
Aditya Birla SL Arbitrage Fund(G),7889,Aditya Birla Sun Life Mutual Fund,0.53,1.37,2.88,6.52,Nifty 50 Arbitrage - TRI,7.07,5.75,5.72,5.83,9,7,11,10,8,8,7,8,Aditya Birla SL Arbitrage Fund(G),Hybrid : Arbitrage,30,33,32,31,28,24,24,14,5.64,0.51,1.35,2.8,6.31,6.89,5.53,5.69,,,,,,,,
SBI Multicap Fund-Reg(G),46405,SBI Mutual Fund,-1.53,2.38,3.9,4.86,Nifty500 Multicap 50:25:25 - TRI,16.54,,,4.3,21,44,42,33,16,19,,,SBI Multicap Fund-Reg(G),Equity : Multi Cap,42,45,45,44,41,29,21,14,4.04,0.0,4.76,5.42,4.2,16.99,18.85,14.4,,,,,,,,
Nippon India Money Market Fund(G),2628,Nippon India Mutual Fund,0.53,1.51,3.22,7.57,Nifty Money Market Index,7.56,6.2,6.75,6.94,1,3,6,4,2,3,1,3,Nippon India Money Market Fund(G),Debt : Money Market,22,23,23,23,22,21,17,13,6.72,0.51,1.48,3.13,7.34,7.27,5.94,6.52,,,,,,,,
SBI Flexicap Fund-Reg(G),2799,SBI Mutual Fund,0.43,6.26,6.9,4.95,BSE 500 - TRI,13.03,15.79,13.14,5.55,20,20,13,10,19,33,21,17,SBI Flexicap Fund-Reg(G),Equity : Flexi Cap,48,51,50,48,48,39,29,21,4.09,0.1,4.98,5.21,4.11,16.03,18.06,14.12,,,,,,,,
SBI Midcap Fund-Reg(G),2789,SBI Mutual Fund,0.94,5.55,1.44,1.23,Nifty Midcap 150 - TRI,16.79,22.29,14.63,0.16,24,9,14,30,26,24,14,18,SBI Midcap Fund-Reg(G),Equity : Mid Cap,30,32,32,31,30,28,24,20,2.98,0.26,4.82,6.46,4.54,21.34,22.91,16.24,,,,,,,,
HDFC Arbitrage-WP(G),1103,HDFC Mutual Fund,0.52,1.39,2.89,6.45,Nifty 50 Arbitrage,7.12,5.75,5.62,5.82,10,15,7,8,10,5,8,12,HDFC Arbitrage-WP(G),Hybrid : Arbitrage,30,33,32,31,28,24,24,14,5.64,0.51,1.35,2.8,6.31,6.89,5.53,5.69,0.54,1.77,3.46,7.65,7.66,6.19,,7.51
ICICI Pru Short Term Fund(G),1682,ICICI Prudential Mutual Fund,0.68,1.88,3.02,8.3,Nifty Short Duration Debt Index,7.77,6.36,7.49,7.68,4,2,7,8,5,2,3,1,ICICI Pru Short Term Fund(G),Debt : Short Duration,28,33,33,32,27,23,20,18,7.25,0.54,1.72,2.71,7.91,7.33,5.92,6.67,,,,,,,,
Axis Money Market Fund-Reg(G),21218,Axis Mutual Fund,0.53,1.54,3.2,7.56,Nifty Money Market Index,7.54,6.15,,6.93,2,1,2,7,4,4,5,,Axis Money Market Fund-Reg(G),Debt : Money Market,22,23,23,23,22,21,17,13,6.72,0.51,1.48,3.13,7.34,7.27,5.94,6.52,,,,,,,,
Aditya Birla SL Savings Fund-Reg(G),468,Aditya Birla Sun Life Mutual Fund,0.57,1.64,3.36,7.65,NIFTY Ultra Short Duration Debt Index,7.51,6.16,7.06,6.91,1,1,1,1,1,1,2,1,Aditya Birla SL Savings Fund-Reg(G),Debt : Ultra Short Duration,26,31,30,30,25,24,23,13,6.24,0.5,1.46,3.03,6.82,6.84,5.62,6.08,,,,,,,,
Tata Liquid Fund-Reg(G),3212,Tata Mutual Fund,0.49,1.44,2.94,6.61,CRISIL Liquid Debt Index,6.95,5.69,6.14,5.99,12,15,14,9,9,15,17,10,Tata Liquid Fund-Reg(G),Debt : Liquid,38,42,41,38,38,35,34,29,5.89,0.48,1.42,2.89,6.49,6.89,5.66,6.05,,,,,,,,
Nippon India ETF BSE Sensex,30127,Nippon India Mutual Fund,1.31,7.2,6.32,9.68,BSE SENSEX - TRI,12.44,15.49,13.91,10.88,68,79,76,103,76,94,56,18,Nippon India ETF BSE Sensex,Equity : ETFs,170,214,205,191,168,122,72,33,9.0,0.95,7.36,7.03,7.92,16.94,18.01,13.8,,,,,,,,
HDFC Nifty 50 Index Fund(G)(Post Addendum),12633,HDFC Mutual Fund,1.04,7.01,6.56,10.5,NIFTY 50 - TRI,12.99,15.95,13.49,11.68,32,95,75,45,28,55,14,3,HDFC Nifty 50 Index Fund(G)(Post Addendum),Equity : Index Funds,175,219,215,198,167,83,34,18,5.22,0.54,6.23,4.78,4.35,16.09,16.83,13.09,,,,,,,,
Kotak Multicap Fund-Reg(G),45336,Kotak Mahindra Mutual Fund,-0.04,7.64,8.98,5.99,Nifty500 Multicap 50:25:25 - TRI,22.8,,,5.93,11,27,2,5,13,1,,,Kotak Multicap Fund-Reg(G),Equity : Multi Cap,42,45,45,44,41,29,21,14,4.04,0.0,4.76,5.42,4.2,16.99,18.85,14.4,,,,,,,,
UTI Money Market Fund-Reg(G),7914,UTI Mutual Fund,0.53,1.53,3.24,7.61,CRISIL Money Market Index,7.59,6.2,6.75,6.93,4,2,3,3,1,1,2,4,UTI Money Market Fund-Reg(G),Debt : Money Market,22,23,23,23,22,21,17,13,6.72,0.51,1.48,3.13,7.34,7.27,5.94,6.52,,,,,,,,
