Kotak Floating Rate Fund-Reg(G),42597,Kotak Mahindra Mutual Fund,0.34,1.43,4.66,8.57,NIFTY Ultra Short Duration Debt Index,7.66,6.48,,6.1,1,8,1,1,1,6,2,,Kotak Floating Rate Fund-Reg(G),Debt : Floater,12,12,12,12,12,12,7,5,5.66,0.34,1.12,4.28,7.93,7.58,6.28,7.08,,,,,,,,
Kotak Debt Hybrid Fund(G),2051,Kotak Mahindra Mutual Fund,0.77,0.06,4.93,2.69,CRISIL Hybrid 85+15 - Conservative Index,9.66,10.68,9.53,2.91,16,10,15,12,17,7,6,2,Kotak Debt Hybrid Fund(G),Hybrid : Debt Oriented (Conservative),18,18,18,18,18,18,17,17,4.32,0.76,0.65,5.57,4.64,8.67,9.28,7.8,,,,,,,,
Tata Multicap Fund-Reg(G),47480,Tata Mutual Fund,2.32,1.25,16.22,-6.79,Nifty500 Multicap 50:25:25 - TRI,,,,-0.85,33,36,30,25,38,,,,Tata Multicap Fund-Reg(G),Equity : Multi Cap,42,45,44,43,40,28,21,14,2.14,3.01,2.04,16.03,-1.53,16.5,21.27,14.62,,,,,,,,
Kotak Pioneer Fund-Reg(G),43927,Kotak Mahindra Mutual Fund,3.61,7.02,23.45,5.5,NIFTY 500 - TRI,21.32,23.58,,7.8,9,45,5,7,5,9,11,,Kotak Pioneer Fund-Reg(G),Equity : Thematic,88,105,100,96,75,38,20,9,1.43,3.27,2.11,15.95,-3.54,17.48,23.49,14.56,,,,,,,,
Edelweiss Aggressive Hybrid Fund-Reg(G),7922,Edelweiss Mutual Fund,2.08,1.7,11.82,1.72,CRISIL Hybrid 35+65 - Aggressive Index,16.67,19.82,13.04,4.09,25,27,27,18,24,5,3,3,Edelweiss Aggressive Hybrid Fund-Reg(G),Hybrid : Multi Asset Allocation,28,32,31,29,26,10,9,7,8.5,3.01,3.24,12.27,6.05,15.18,18.26,12.89,,,,,,,,
LIC MF Large & Midcap Fund-Reg(G),31950,LIC Mutual Fund,2.66,-0.53,13.21,-4.13,NIFTY LargeMidcap 250 - TRI,14.76,20.46,14.88,-0.75,26,21,27,26,24,20,20,11,LIC MF Large & Midcap Fund-Reg(G),Equity : Large & Mid Cap,31,33,31,31,30,26,26,19,2.21,2.82,1.47,16.33,-1.96,17.24,22.56,15.03,,,,,,,,
Mirae Asset Flexi Cap Fund-Reg(G),47596,Mirae Asset Mutual Fund,2.93,2.16,16.74,1.67,NIFTY 500 - TRI,,,,4.85,14,29,19,11,8,,,,Mirae Asset Flexi Cap Fund-Reg(G),Equity : Flexi Cap,48,50,49,48,48,39,27,21,1.89,2.96,1.77,15.22,-2.72,15.45,20.21,14.26,,,,,,,,
UTI Balanced Advantage Fund-Reg(G),48102,UTI Mutual Fund,2.18,1.35,9.02,4.27,NIFTY 50 Hybrid Composite Debt 50:50 Index,,,,5.94,3,6,10,22,5,,,,UTI Balanced Advantage Fund-Reg(G),Hybrid : Dynamic Asset Allocation,33,34,34,33,33,24,19,11,3.38,1.65,1.23,9.24,0.83,11.46,12.52,10.06,,,,,,,,
Aditya Birla SL Nifty 50 ETF,12811,Aditya Birla Sun Life Mutual Fund,2.63,1.44,12.69,0.12,NIFTY 50 - TRI,13.1,18.32,13.65,7.35,58,127,60,122,41,67,37,14,Aditya Birla SL Nifty 50 ETF,Equity : ETFs,170,203,194,180,162,114,68,32,4.39,3.14,1.21,15.06,-0.96,16.22,20.4,13.54,,,,,,,,
Parag Parikh Conservative Hybrid Fund-Reg(G),45338,PPFAS Mutual Fund,-0.03,0.25,4.81,6.24,CRISIL Hybrid 85+15 - Conservative Index,10.88,,,5.44,4,18,14,14,4,1,,,Parag Parikh Conservative Hybrid Fund-Reg(G),Hybrid : Debt Oriented (Conservative),18,18,18,18,18,18,17,17,4.32,0.76,0.65,5.57,4.64,8.67,9.28,7.8,,,,,,,,
SBI Retirement Benefit Fund-Aggressive Plan-Reg(G),30398,SBI Mutual Fund,2.2,-0.11,11.98,-4.99,BSE 500 - TRI,12.24,,,2.46,33,18,35,18,40,15,,,SBI Retirement Benefit Fund-Aggressive Plan-Reg(G),Hybrid : Solution Oriented,43,43,43,43,42,37,32,15,3.24,1.94,0.99,11.11,0.74,12.03,13.95,10.76,,,,,,,,
HDFC Gilt Fund(G),1269,HDFC Mutual Fund,0.44,-0.48,2.43,5.54,Nifty All Duration G-Sec Index,6.94,5.33,6.74,3.84,17,20,21,20,17,8,8,14,HDFC Gilt Fund(G),Debt : Gilt,36,38,38,37,36,24,21,21,4.06,0.4,-0.15,2.66,5.71,6.68,5.24,7.02,,,,,,,,
HSBC Ultra Short Duration Fund-Reg(G),44328,HSBC Mutual Fund,0.44,1.43,3.74,7.32,NIFTY Ultra Short Duration Debt Index,7.09,5.73,,5.08,7,12,14,6,6,5,7,,HSBC Ultra Short Duration Fund-Reg(G),Debt : Ultra Short Duration,26,30,30,27,25,24,22,13,4.9,0.43,1.42,3.59,7.05,6.77,5.54,6.13,,,,,,,,
Baroda BNP Paribas Multi Cap Fund-Reg(G),500,Baroda BNP Paribas Mutual Fund,3.75,2.54,14.92,-2.55,Nifty500 Multicap 50:25:25 - TRI,18.28,24.06,14.55,-2.85,39,7,18,31,25,9,6,8,Baroda BNP Paribas Multi Cap Fund-Reg(G),Equity : Multi Cap,42,45,44,43,40,28,21,14,2.14,3.01,2.04,16.03,-1.53,16.5,21.27,14.62,,,,,,,,
ICICI Pru Nifty Bank ETF,32451,ICICI Prudential Mutual Fund,-0.42,-1.69,14.88,6.57,NIFTY BANK - TRI,11.3,20.19,,8.53,29,197,159,85,17,97,25,,ICICI Pru Nifty Bank ETF,Equity : ETFs,170,203,194,180,162,114,68,32,4.39,3.14,1.21,15.06,-0.96,16.22,20.4,13.54,,,,,,,,
UTI MEPUS,3617,UTI Mutual Fund,3.17,1.44,12.7,-2.87,BSE 100 - TRI,12.3,17.68,12.26,5.6,10,15,27,43,34,46,46,25,UTI MEPUS,Equity : Tax Saving (ELSS),56,57,57,57,56,51,51,29,2.14,2.7,1.27,15.75,-2.59,16.06,22.21,14.09,,,,,,,,
ICICI Pru Commodities Fund-Reg(G),41999,ICICI Prudential Mutual Fund,2.91,4.39,14.31,2.64,NIFTY COMMODITIES - TRI,17.82,31.08,,11.86,2,62,22,55,10,17,1,,ICICI Pru Commodities Fund-Reg(G),Equity : Thematic,88,105,100,96,75,38,20,9,1.43,3.27,2.11,15.95,-3.54,17.48,23.49,14.56,,,,,,,,
Bandhan G-Sec-Invest-Reg(G),7483,Bandhan Mutual Fund,0.83,-0.34,1.45,3.33,CRISIL Dynamic Gilt Index,6.92,5.37,7.54,2.48,30,1,18,30,33,9,7,5,Bandhan G-Sec-Invest-Reg(G),Debt : Gilt,36,38,38,37,36,24,21,21,4.06,0.4,-0.15,2.66,5.71,6.68,5.24,7.02,,,,,,,,
Kotak Business Cycle Fund-Reg(G),46472,Kotak Mahindra Mutual Fund,3.75,4.96,21.41,2.68,NIFTY 500 - TRI,,,,5.67,19,42,17,13,9,,,,Kotak Business Cycle Fund-Reg(G),Equity : Thematic,88,105,100,96,75,38,20,9,1.43,3.27,2.11,15.95,-3.54,17.48,23.49,14.56,,,,,,,,
HDFC Business Cycle Fund-Reg(G),46445,HDFC Mutual Fund,2.94,3.87,16.37,-1.65,NIFTY 500 - TRI,,,,3.49,37,60,29,38,31,,,,HDFC Business Cycle Fund-Reg(G),Equity : Thematic,88,105,100,96,75,38,20,9,1.43,3.27,2.11,15.95,-3.54,17.48,23.49,14.56,,,,,,,,
Franklin Build India Fund(G),7864,Franklin Templeton Mutual Fund,1.54,1.25,16.79,-2.57,BSE India Infrastructure Index - TRI,26.19,32.87,17.72,2.41,4,12,6,11,3,3,6,2,Franklin Build India Fund(G),Equity : Sectoral - Infrastructure,20,21,21,20,19,19,19,18,-0.63,1.82,0.34,16.44,-6.6,21.96,29.79,16.01,,,,,,,,
Edelweiss Multi Cap Fund-Reg(G),48147,Edelweiss Mutual Fund,2.61,1.0,15.98,-3.71,Nifty500 Multicap 50:25:25 - TRI,,,,-1.0,34,32,34,26,32,,,,Edelweiss Multi Cap Fund-Reg(G),Equity : Multi Cap,42,45,44,43,40,28,21,14,2.14,3.01,2.04,16.03,-1.53,16.5,21.27,14.62,,,,,,,,
Nippon India ETF Nifty 8-13 yr G-Sec Long Term Gilt,35459,Nippon India Mutual Fund,0.6,0.23,4.23,8.26,Nifty 8-13 yr G-Sec,8.14,5.72,,6.03,9,5,27,9,8,1,3,,Nippon India ETF Nifty 8-13 yr G-Sec Long Term Gilt,Debt : ETFs,30,32,32,31,28,13,8,2,5.25,0.48,1.12,3.64,7.31,7.34,5.55,5.96,0.64,0.27,4.38,8.53,9.43,6.03,,9.03
Nippon India ETF Nifty PSU Bank BeES,3722,Nippon India Mutual Fund,0.39,0.39,22.92,6.46,NIFTY PSU BANK - TRI,30.71,37.78,8.84,8.14,51,184,127,16,27,5,2,30,Nippon India ETF Nifty PSU Bank BeES,Equity : ETFs,170,203,194,180,162,114,68,32,4.39,3.14,1.21,15.06,-0.96,16.22,20.4,13.54,,,,,,,,
Mirae Asset Arbitrage Fund-Reg(G),44983,Mirae Asset Mutual Fund,0.35,1.24,2.89,6.22,Nifty 50 Arbitrage,6.87,5.5,,4.3,23,27,26,27,21,15,14,,Mirae Asset Arbitrage Fund-Reg(G),Hybrid : Arbitrage,30,31,31,30,27,24,24,14,4.36,0.37,1.29,3.03,6.35,6.82,5.41,5.7,0.54,1.54,3.46,7.31,7.43,5.98,,7.5
UTI MNC Fund-Reg(G),3634,UTI Mutual Fund,6.15,5.56,18.0,-3.55,NIFTY MNC - TRI,12.45,14.92,10.47,3.67,2,3,3,3,1,2,2,2,UTI MNC Fund-Reg(G),Equity : Thematic - MNC,6,7,6,6,5,4,4,3,1.8,5.25,3.77,16.24,-5.45,11.19,15.45,10.1,,,,,,,,
ICICI Pru Bond Fund(G),6197,ICICI Prudential Mutual Fund,0.07,-0.05,3.38,7.1,CRISIL Medium to Long Term Debt Index,7.49,5.95,7.29,4.84,50,53,56,52,42,3,2,2,ICICI Pru Bond Fund(G),Debt : Medium to Long Duration,59,60,60,60,52,26,11,11,5.62,0.27,0.76,4.08,7.55,7.06,5.48,6.31,,,,,,,,
Tata Business Cycle Fund-Reg(G),45373,Tata Mutual Fund,1.89,0.56,12.73,-7.45,NIFTY 500 - TRI,17.99,,,-0.49,58,85,72,74,56,16,,,Tata Business Cycle Fund-Reg(G),Equity : Thematic,88,105,100,96,75,38,20,9,1.43,3.27,2.11,15.95,-3.54,17.48,23.49,14.56,,,,,,,,
Aditya Birla SL Medium Term Plan-Reg(G),7683,Aditya Birla Sun Life Mutual Fund,0.44,1.32,4.96,12.63,CRISIL Medium Duration Debt Index,9.23,12.16,8.59,8.61,1,10,4,2,1,1,1,1,Aditya Birla SL Medium Term Plan-Reg(G),Debt : Medium Duration,26,26,26,26,26,15,12,12,5.7,0.43,1.17,4.14,7.86,7.3,6.81,6.73,,,,,,,,
Tata Banking & Financial Services Fund-Reg(G),33726,Tata Mutual Fund,1.27,-1.67,15.61,6.91,Nifty Financial Services - TRI,16.45,20.31,,10.15,7,5,18,12,9,4,8,,Tata Banking & Financial Services Fund-Reg(G),Equity : Sectoral - Financial Services,21,23,22,22,21,14,11,10,9.05,0.87,-0.77,16.03,6.29,15.07,21.03,13.55,,,,,,,,
Sundaram Multi Cap Fund(G),2370,Sundaram Mutual Fund,2.78,2.96,16.81,-0.64,Nifty500 Multicap 50:25:25 - TRI,15.67,22.84,15.7,3.31,18,28,10,20,17,18,8,3,Sundaram Multi Cap Fund(G),Equity : Multi Cap,42,45,44,43,40,28,21,14,2.14,3.01,2.04,16.03,-1.53,16.5,21.27,14.62,,,,,,,,
Mirae Asset Healthcare Fund-Reg(G),39122,Mirae Asset Mutual Fund,2.54,3.74,13.45,-0.01,BSE Health Care - TRI,21.86,19.12,,-0.67,6,5,4,7,7,8,5,,Mirae Asset Healthcare Fund-Reg(G),Equity : Sectoral - Pharma,18,20,18,18,16,10,9,3,-1.48,2.01,2.75,12.8,-0.34,23.54,18.9,12.38,,,,,,,,
Invesco India ELSS Tax Saver Fund(G),2270,Invesco Mutual Fund,4.55,1.48,16.11,-2.87,BSE 500 - TRI,16.54,19.12,14.09,-0.68,48,3,25,21,35,23,39,13,Invesco India ELSS Tax Saver Fund(G),Equity : Tax Saving (ELSS),56,57,57,57,56,51,51,29,2.14,2.7,1.27,15.75,-2.59,16.06,22.21,14.09,,,,,,,,
Edelweiss Flexi Cap Fund-Reg(G),31778,Edelweiss Mutual Fund,3.34,2.43,15.29,-2.86,NIFTY 500 - TRI,17.17,21.81,14.92,1.29,27,15,15,24,29,13,8,5,Edelweiss Flexi Cap Fund-Reg(G),Equity : Flexi Cap,48,50,49,48,48,39,27,21,1.89,2.96,1.77,15.22,-2.72,15.45,20.21,14.26,,,,,,,,
Kotak Dynamic Bond Fund-Reg(G),5430,Kotak Mahindra Mutual Fund,0.55,-0.17,2.79,5.18,NIFTY Composite Debt Index,6.87,5.73,7.65,3.95,14,2,14,14,15,11,11,2,Kotak Dynamic Bond Fund-Reg(G),Debt : Dynamic Bond,22,22,22,22,22,22,21,19,4.25,0.29,-0.01,3.05,5.91,6.86,5.72,6.88,,,,,,,,
Nippon India Innovation Fund-Reg(G),48169,Nippon India Mutual Fund,4.27,5.99,23.6,-1.12,NIFTY 500 - TRI,,,,8.15,8,27,9,6,29,,,,Nippon India Innovation Fund-Reg(G),Equity : Thematic,88,105,100,96,75,38,20,9,1.43,3.27,2.11,15.95,-3.54,17.48,23.49,14.56,,,,,,,,
Nippon India Consumption Fund(G),2644,Nippon India Mutual Fund,4.97,6.14,17.78,-5.06,Nifty India Consumption - TRI,16.3,23.22,15.67,6.85,2,12,13,8,14,5,2,5,Nippon India Consumption Fund(G),Equity : Thematic - Consumption,20,22,22,22,18,13,13,9,3.21,5.0,5.74,17.0,-4.81,15.53,20.39,14.94,,,,,,,,
DSP Corp Bond Fund-Reg(G),37709,DSP Mutual Fund,0.41,1.32,4.52,8.15,CRISIL Corporate Bond Index,7.09,5.49,,5.86,11,2,1,12,11,17,17,,DSP Corp Bond Fund-Reg(G),Debt : Corporate Bond,21,21,21,21,21,20,18,12,5.83,0.33,0.95,4.54,8.12,7.34,6.02,7.11,,,,,,,,
Franklin India Balanced Advantage Fund-Reg(G),46625,Franklin Templeton Mutual Fund,1.15,0.58,8.05,2.89,NIFTY 50 Hybrid Composite Debt 50:50 Index,12.59,,,2.89,22,26,27,26,10,7,,,Franklin India Balanced Advantage Fund-Reg(G),Hybrid : Dynamic Asset Allocation,33,34,34,33,33,24,19,11,3.38,1.65,1.23,9.24,0.83,11.46,12.52,10.06,,,,,,,,
Canara Rob Focused Fund-Reg(G),45510,Canara Robeco Mutual Fund,2.38,3.11,16.67,1.66,BSE 500 - TRI,16.8,,,5.04,7,34,9,21,6,12,,,Canara Rob Focused Fund-Reg(G),Equity : Multi Cap,42,45,44,43,40,28,21,14,2.14,3.01,2.04,16.03,-1.53,16.5,21.27,14.62,,,,,,,,
Bandhan Dynamic Bond Fund-Reg(G),7455,Bandhan Mutual Fund,0.84,-0.36,1.28,2.94,NIFTY Composite Debt Index,6.46,4.96,6.93,2.21,22,1,15,22,22,17,18,8,Bandhan Dynamic Bond Fund-Reg(G),Debt : Dynamic Bond,22,22,22,22,22,22,21,19,4.25,0.29,-0.01,3.05,5.91,6.86,5.72,6.88,,,,,,,,
Kotak Nifty SDL Apr 2032 Top 12 Equal Weight Index Fund-Reg(G),46390,Kotak Mahindra Mutual Fund,-1.91,-1.15,3.27,6.79,Nifty SDL Apr 2032 Top 12 Equal Weight Index,7.58,,,4.44,11,26,18,10,10,1,,,Kotak Nifty SDL Apr 2032 Top 12 Equal Weight Index Fund-Reg(G),Debt : Long Duration,26,26,26,26,24,5,3,2,3.83,-0.1,-0.72,2.57,5.82,7.05,5.02,6.85,,,,,,,,
Motilal Oswal Large Cap Fund-Reg(G),48488,Motilal Oswal Mutual Fund,2.07,2.19,14.24,8.35,NIFTY 100 - TRI,,,,6.4,5,33,11,11,1,,,,Motilal Oswal Large Cap Fund-Reg(G),Equity : Large Cap,38,39,39,38,38,35,31,28,3.96,2.6,1.27,13.54,-2.51,14.0,18.44,12.92,,,,,,,,
JM Liquid Fund(G),1909,JM Financial Mutual Fund,0.46,1.39,3.22,6.77,CRISIL Liquid Debt Index,6.91,5.57,6.17,4.64,22,23,27,25,28,25,19,14,JM Liquid Fund(G),Debt : Liquid,38,41,39,38,37,35,34,29,4.61,0.46,1.4,3.22,6.77,6.9,5.55,6.09,,,,,,,,
Bandhan Multi Cap Fund-Reg(G),45867,Bandhan Mutual Fund,3.19,1.22,15.75,-3.46,Nifty500 Multicap 50:25:25 - TRI,16.78,,,3.19,19,18,31,27,30,13,,,Bandhan Multi Cap Fund-Reg(G),Equity : Multi Cap,42,45,44,43,40,28,21,14,2.14,3.01,2.04,16.03,-1.53,16.5,21.27,14.62,,,,,,,,
Sundaram Multi Asset Allocation Fund-Reg(G),48460,Sundaram Mutual Fund,3.31,3.24,13.13,8.54,NIFTY 500 - TRI,,,,12.15,5,12,14,13,7,,,,Sundaram Multi Asset Allocation Fund-Reg(G),Hybrid : Multi Asset Allocation,28,32,31,29,26,10,9,7,8.5,3.01,3.24,12.27,6.05,15.18,18.26,12.89,,,,,,,,
Quant Large Cap Fund-Reg(G),46678,Quant Mutual Fund,1.86,0.4,13.99,-8.04,NIFTY 100 - TRI,12.88,,,1.75,31,35,31,14,36,24,,,Quant Large Cap Fund-Reg(G),Equity : Large Cap,38,39,39,38,38,35,31,28,3.96,2.6,1.27,13.54,-2.51,14.0,18.44,12.92,,,,,,,,
Baroda BNP Paribas Large Cap Fund-Reg(G),23,Baroda BNP Paribas Mutual Fund,1.82,0.52,11.1,-4.86,NIFTY 100 - TRI,15.1,18.46,12.98,1.38,33,36,29,35,32,10,15,16,Baroda BNP Paribas Large Cap Fund-Reg(G),Equity : Large Cap,38,39,39,38,38,35,31,28,3.96,2.6,1.27,13.54,-2.51,14.0,18.44,12.92,,,,,,,,
HDFC NIFTY Bank ETF,33563,HDFC Mutual Fund,-0.42,-1.69,14.86,6.54,NIFTY BANK - TRI,11.26,20.11,,8.5,35,198,161,90,20,100,29,,HDFC NIFTY Bank ETF,Equity : ETFs,170,203,194,180,162,114,68,32,4.39,3.14,1.21,15.06,-0.96,16.22,20.4,13.54,,,,,,,,
ITI Small Cap Fund-Reg(G),44399,ITI Mutual Fund,2.0,0.23,20.01,-3.12,Nifty Smallcap 250 - TRI,24.8,24.82,,-2.46,14,28,21,12,13,2,19,,ITI Small Cap Fund-Reg(G),Equity : Small Cap,29,31,30,30,28,23,21,13,-2.48,3.04,1.33,19.4,-4.67,18.98,28.82,17.66,,,,,,,,
Tata Large Cap Fund-Reg(G),3281,Tata Mutual Fund,3.99,1.48,12.22,-2.19,NIFTY 100 - TRI,14.12,19.27,12.35,4.84,17,4,19,28,19,16,9,19,Tata Large Cap Fund-Reg(G),Equity : Large Cap,38,39,39,38,38,35,31,28,3.96,2.6,1.27,13.54,-2.51,14.0,18.44,12.92,,,,,,,,
Mahindra Manulife Large & Mid Cap Fund-Reg(G),43915,Mahindra Manulife Mutual Fund,2.82,0.22,16.4,-4.92,NIFTY LargeMidcap 250 - TRI,14.9,22.3,,0.9,22,15,23,14,26,19,13,,Mahindra Manulife Large & Mid Cap Fund-Reg(G),Equity : Large & Mid Cap,31,33,31,31,30,26,26,19,2.21,2.82,1.47,16.33,-1.96,17.24,22.56,15.03,,,,,,,,
Nippon India Index Fund-Nifty 50 Plan(G),12860,Nippon India Mutual Fund,2.59,1.34,12.43,-0.31,NIFTY 50 - TRI,12.48,17.38,12.57,7.02,33,145,54,144,22,56,24,16,Nippon India Index Fund-Nifty 50 Plan(G),Equity : Index Funds,175,212,201,189,140,78,32,18,2.07,2.9,0.13,15.23,-4.21,15.11,18.82,12.86,,,,,,,,
ICICI Pru Regular Gold Savings Fund(FOF)(G),14885,ICICI Prudential Mutual Fund,10.01,11.99,26.07,50.04,Gold-India,27.54,14.78,13.74,42.2,8,7,11,11,9,3,6,3,ICICI Pru Regular Gold Savings Fund(FOF)(G),Gold : MFs,17,18,18,18,16,10,10,10,42.81,10.44,13.56,25.84,50.09,27.49,14.83,13.58,,,,,,,,
Nippon India ETF Nifty IT,44506,Nippon India Mutual Fund,4.12,-5.83,0.42,-14.64,NIFTY IT - TRI,9.27,16.1,,-15.42,169,52,190,179,156,110,66,,Nippon India ETF Nifty IT,Equity : ETFs,170,203,194,180,162,114,68,32,4.39,3.14,1.21,15.06,-0.96,16.22,20.4,13.54,,,,,,,,
Motilal Oswal Nifty Microcap 250 Index Fund-Reg(G),41176,Motilal Oswal Mutual Fund,2.79,-0.71,17.81,-6.83,Nifty Microcap 250 - TRI,,,,-6.07,155,125,147,46,92,,,,Motilal Oswal Nifty Microcap 250 Index Fund-Reg(G),Equity : Index Funds,175,212,201,189,140,78,32,18,2.07,2.9,0.13,15.23,-4.21,15.11,18.82,12.86,,,,,,,,
UTI Focused Fund-Reg(G),45685,UTI Mutual Fund,3.86,1.7,13.64,-5.48,NIFTY 500 - TRI,13.72,,,5.38,11,11,28,34,40,28,,,UTI Focused Fund-Reg(G),Equity : Flexi Cap,48,50,49,48,48,39,27,21,1.89,2.96,1.77,15.22,-2.72,15.45,20.21,14.26,,,,,,,,
Aditya Birla SL Nifty Bank ETF,34434,Aditya Birla Sun Life Mutual Fund,-0.41,-1.68,14.87,6.52,NIFTY BANK - TRI,11.28,20.16,,8.5,33,193,156,88,23,98,26,,Aditya Birla SL Nifty Bank ETF,Equity : ETFs,170,203,194,180,162,114,68,32,4.39,3.14,1.21,15.06,-0.96,16.22,20.4,13.54,,,,,,,,
Nippon India ETF Nifty Midcap 150,40028,Nippon India Mutual Fund,3.09,0.47,19.92,-1.91,Nifty Midcap 150 - TRI,21.25,28.02,,2.34,120,96,123,37,91,20,6,,Nippon India ETF Nifty Midcap 150,Equity : ETFs,170,203,194,180,162,114,68,32,4.39,3.14,1.21,15.06,-0.96,16.22,20.4,13.54,,,,,,,,
SBI Long Duration Fund-Reg(G),46864,SBI Mutual Fund,0.55,-0.74,1.1,3.38,CRISIL Long Duration Debt Index,,,,2.22,20,5,11,20,19,,,,SBI Long Duration Fund-Reg(G),Debt : Long Duration,26,26,26,26,24,5,3,2,3.83,-0.1,-0.72,2.57,5.82,7.05,5.02,6.85,,,,,,,,
SBI CRISIL IBX Gilt Index - June 2036 Fund-Reg(G),46941,SBI Mutual Fund,0.56,0.27,3.92,7.55,CRISIL IBX Gilt Index - June 2036,,,,5.52,6,4,5,6,6,,,,SBI CRISIL IBX Gilt Index - June 2036 Fund-Reg(G),Debt : Long Duration,26,26,26,26,24,5,3,2,3.83,-0.1,-0.72,2.57,5.82,7.05,5.02,6.85,,,,,,,,
ICICI Pru Constant Maturity Gilt Fund(G),30426,ICICI Prudential Mutual Fund,0.64,0.19,4.4,8.2,CRISIL 10 Year Gilt Index,7.91,6.05,8.3,6.04,2,3,3,1,1,2,1,2,ICICI Pru Constant Maturity Gilt Fund(G),Debt : Gilt (10 Yr Constant Duration),6,6,6,6,6,5,4,4,5.75,0.66,0.17,4.05,7.79,7.73,5.68,7.95,,,,,,,,
Tata India Consumer Fund-Reg(G),33728,Tata Mutual Fund,3.7,6.26,17.52,-3.72,Nifty India Consumption - TRI,17.2,20.47,,-1.08,18,18,12,11,9,4,7,,Tata India Consumer Fund-Reg(G),Equity : Thematic - Consumption,20,22,22,22,18,13,13,9,3.21,5.0,5.74,17.0,-4.81,15.53,20.39,14.94,,,,,,,,
HDFC Innovation Fund-Reg(G),49691,HDFC Mutual Fund,4.69,,,,NIFTY 500 - TRI,,,,,,17,,,,,,,HDFC Innovation Fund-Reg(G),Equity : Thematic,88,105,100,96,75,38,20,9,1.43,3.27,2.11,15.95,-3.54,17.48,23.49,14.56,,,,,,,,
DSP Focused Fund-Reg(G),8463,DSP Mutual Fund,4.16,0.23,11.68,-1.94,NIFTY 500 - TRI,16.08,18.63,12.44,4.2,11,4,40,39,20,14,16,14,DSP Focused Fund-Reg(G),Equity : Multi Cap,42,45,44,43,40,28,21,14,2.14,3.01,2.04,16.03,-1.53,16.5,21.27,14.62,,,,,,,,
Parag Parikh Dynamic Asset Allocation Fund-Reg(G),48512,PPFAS Mutual Fund,0.09,0.74,4.58,5.12,CRISIL Hybrid 50+50 - Moderate Index,,,,4.61,10,34,25,32,2,,,,Parag Parikh Dynamic Asset Allocation Fund-Reg(G),Hybrid : Dynamic Asset Allocation,33,34,34,33,33,24,19,11,3.38,1.65,1.23,9.24,0.83,11.46,12.52,10.06,,,,,,,,
Motilal Oswal Nifty Midcap 150 Index Fund-Reg(G),43810,Motilal Oswal Mutual Fund,3.02,0.3,19.61,-2.51,Nifty Midcap 150 - TRI,20.36,26.81,,1.87,98,98,124,20,60,9,2,,Motilal Oswal Nifty Midcap 150 Index Fund-Reg(G),Equity : Index Funds,175,212,201,189,140,78,32,18,2.07,2.9,0.13,15.23,-4.21,15.11,18.82,12.86,,,,,,,,
HDFC Infrastructure Fund(G),4253,HDFC Mutual Fund,0.98,0.05,16.83,-4.01,BSE India Infrastructure Index - TRI,26.74,33.21,12.41,2.11,5,17,11,10,7,2,3,18,HDFC Infrastructure Fund(G),Equity : Sectoral - Infrastructure,20,21,21,20,19,19,19,18,-0.63,1.82,0.34,16.44,-6.6,21.96,29.79,16.01,,,,,,,,
SBI Nifty Next 50 ETF,30248,SBI Mutual Fund,3.09,1.47,15.67,-8.88,NIFTY NEXT 50 - TRI,15.83,20.8,14.41,1.0,129,95,55,58,130,52,18,7,SBI Nifty Next 50 ETF,Equity : ETFs,170,203,194,180,162,114,68,32,4.39,3.14,1.21,15.06,-0.96,16.22,20.4,13.54,,,,,,,,
Nippon India Nifty Smallcap 250 Index Fund-Reg(G),44504,Nippon India Mutual Fund,3.16,-0.69,19.94,-7.69,Nifty Smallcap 250 - TRI,20.02,,,-4.17,148,77,145,17,107,12,,,Nippon India Nifty Smallcap 250 Index Fund-Reg(G),Equity : Index Funds,175,212,201,189,140,78,32,18,2.07,2.9,0.13,15.23,-4.21,15.11,18.82,12.86,,,,,,,,
DSP Multicap Fund-Reg(G),48040,DSP Mutual Fund,3.64,2.36,18.6,-3.07,Nifty500 Multicap 50:25:25 - TRI,,,,1.56,25,8,21,10,27,,,,DSP Multicap Fund-Reg(G),Equity : Multi Cap,42,45,44,43,40,28,21,14,2.14,3.01,2.04,16.03,-1.53,16.5,21.27,14.62,,,,,,,,
Kotak Manufacture in India Fund-Reg(G),46107,Kotak Mahindra Mutual Fund,5.99,5.52,19.5,-0.31,Nifty India Manufacturing - TRI,18.82,,,4.89,24,7,13,20,21,14,,,Kotak Manufacture in India Fund-Reg(G),Equity : Thematic,88,105,100,96,75,38,20,9,1.43,3.27,2.11,15.95,-3.54,17.48,23.49,14.56,,,,,,,,
Motilal Oswal Nifty 500 Index Fund-Reg(G),43809,Motilal Oswal Mutual Fund,2.76,0.87,14.76,-2.81,NIFTY 500 - TRI,14.09,19.55,,3.98,75,127,89,97,70,43,10,,Motilal Oswal Nifty 500 Index Fund-Reg(G),Equity : Index Funds,175,212,201,189,140,78,32,18,2.07,2.9,0.13,15.23,-4.21,15.11,18.82,12.86,,,,,,,,
NJ Flexi Cap Fund-Reg(G),48135,NJ Mutual Fund,3.92,3.46,14.75,-13.18,NIFTY 500 - TRI,,,,0.15,37,9,6,28,47,,,,NJ Flexi Cap Fund-Reg(G),Equity : Flexi Cap,48,50,49,48,48,39,27,21,1.89,2.96,1.77,15.22,-2.72,15.45,20.21,14.26,,,,,,,,
Sundaram Money Market Fund-Reg(G),39625,Sundaram Mutual Fund,0.43,1.48,4.07,7.74,Nifty Money Market Index,7.27,5.8,,5.45,10,12,7,8,10,10,10,,Sundaram Money Market Fund-Reg(G),Debt : Money Market,22,23,23,23,22,21,17,13,5.33,0.43,1.45,3.97,7.58,7.2,5.84,6.56,,,,,,,,
ICICI Pru NASDAQ 100 Index Fund(G),45683,ICICI Prudential Mutual Fund,1.74,13.17,23.89,29.93,Nasdaq-100,27.4,,,17.67,4,7,2,2,2,2,,,ICICI Pru NASDAQ 100 Index Fund(G),Equity : International,8,8,8,8,8,8,6,5,18.27,3.96,12.4,20.48,23.59,19.49,12.21,11.14,1.06,9.94,22.94,24.04,23.64,16.77,,21.44
HSBC Arbitrage Fund-Reg(G),29550,HSBC Mutual Fund,0.39,1.3,3.05,6.32,Nifty 50 Arbitrage,6.84,5.48,5.73,4.38,17,6,15,17,17,17,16,7,HSBC Arbitrage Fund-Reg(G),Hybrid : Arbitrage,30,31,31,30,27,24,24,14,4.36,0.37,1.29,3.03,6.35,6.82,5.41,5.7,0.54,1.54,3.46,7.31,7.43,5.98,,7.5
Aditya Birla SL Quant Fund-Reg(G),48491,Aditya Birla Sun Life Mutual Fund,3.81,1.38,13.72,-7.83,NIFTY 200 - TRI,,,,0.0,57,40,59,64,58,,,,Aditya Birla SL Quant Fund-Reg(G),Equity : Thematic,88,105,100,96,75,38,20,9,1.43,3.27,2.11,15.95,-3.54,17.48,23.49,14.56,,,,,,,,
Union Flexi Cap Fund-Reg(G),14559,Union Mutual Fund,2.94,1.74,15.32,-0.91,BSE 500 - TRI,14.52,19.7,13.32,1.74,26,28,26,23,20,24,12,16,Union Flexi Cap Fund-Reg(G),Equity : Flexi Cap,48,50,49,48,48,39,27,21,1.89,2.96,1.77,15.22,-2.72,15.45,20.21,14.26,,,,,,,,
Franklin India Dividend Yield Fund(G),3367,Franklin Templeton Mutual Fund,1.51,-0.65,6.23,-8.0,NIFTY 500 - TRI,16.76,24.8,15.7,-0.77,9,10,9,10,9,6,2,2,Franklin India Dividend Yield Fund(G),Equity : Thematic - Dividend Yield,10,10,10,10,10,8,6,5,1.94,2.59,0.67,12.5,-5.16,18.42,23.28,14.87,,,,,,,,
Kotak Infra & Eco Reform Fund(G),4228,Kotak Mahindra Mutual Fund,2.58,0.64,20.96,-8.21,Nifty Infrastructure - TRI,20.27,30.51,16.04,-3.51,16,5,8,3,14,13,9,12,Kotak Infra & Eco Reform Fund(G),Equity : Sectoral - Infrastructure,20,21,21,20,19,19,19,18,-0.63,1.82,0.34,16.44,-6.6,21.96,29.79,16.01,,,,,,,,
Baroda BNP Paribas Money Market Fund-Reg(G),25167,Baroda BNP Paribas Mutual Fund,0.46,1.51,4.03,7.7,CRISIL Money Market Index,7.11,5.52,,5.42,11,1,1,11,11,16,16,,Baroda BNP Paribas Money Market Fund-Reg(G),Debt : Money Market,22,23,23,23,22,21,17,13,5.33,0.43,1.45,3.97,7.58,7.2,5.84,6.56,,,,,,,,
Edelweiss Nifty PSU Bond Plus SDL Apr 2027 50:50 Index Fund-Reg(G),45387,Edelweiss Mutual Fund,0.35,1.15,4.4,8.01,Nifty PSU Bond Plus SDL Apr 2027 50:50 Index,7.19,,,5.83,29,23,14,15,14,11,,,Edelweiss Nifty PSU Bond Plus SDL Apr 2027 50:50 Index Fund-Reg(G),Debt : Medium to Long Duration,59,60,60,60,52,26,11,11,5.62,0.27,0.76,4.08,7.55,7.06,5.48,6.31,,,,,,,,
DSP BSE Liquid Rate ETF,48724,DSP Mutual Fund,0.43,1.28,2.71,5.86,BSE Liquid Rate Index,,,,3.94,21,15,7,22,20,,,,DSP BSE Liquid Rate ETF,Debt : ETFs,30,32,32,31,28,13,8,2,5.25,0.48,1.12,3.64,7.31,7.34,5.55,5.96,,,,,,,,
ICICI Pru Housing Opp Fund-Reg(G),46546,ICICI Prudential Mutual Fund,0.17,1.0,14.29,-0.12,Nifty Housing - TRI,16.91,,,4.88,25,103,69,56,19,21,,,ICICI Pru Housing Opp Fund-Reg(G),Equity : Thematic,88,105,100,96,75,38,20,9,1.43,3.27,2.11,15.95,-3.54,17.48,23.49,14.56,,,,,,,,
HSBC Infrastructure Fund-Reg(G),594,HSBC Mutual Fund,1.84,-1.18,15.3,-9.25,Nifty Infrastructure - TRI,21.15,29.33,16.19,-3.56,17,9,19,15,15,11,12,8,HSBC Infrastructure Fund-Reg(G),Equity : Sectoral - Infrastructure,20,21,21,20,19,19,19,18,-0.63,1.82,0.34,16.44,-6.6,21.96,29.79,16.01,,,,,,,,
Axis Business Cycles Fund-Reg(G),47580,Axis Mutual Fund,1.85,1.6,15.66,-2.01,NIFTY 500 - TRI,,,,2.48,45,86,56,46,32,,,,Axis Business Cycles Fund-Reg(G),Equity : Thematic,88,105,100,96,75,38,20,9,1.43,3.27,2.11,15.95,-3.54,17.48,23.49,14.56,,,,,,,,
BHARAT Bond ETF FOF - April 2033 -Reg(G),47284,Edelweiss Mutual Fund,-0.18,0.13,4.9,8.47,NIFTY BHARAT Bond Index - April 2033,,,,5.76,32,79,64,52,18,,,,BHARAT Bond ETF FOF - April 2033 -Reg(G),FoFs : Domestic,60,80,74,61,59,47,29,23,10.54,3.51,4.02,13.87,8.94,14.44,14.59,10.5,,,,,,,,
Bandhan Balanced Advantage Fund-Reg(G),30671,Bandhan Mutual Fund,1.64,1.25,9.02,2.56,NIFTY 50 Hybrid Composite Debt 50:50 Index,9.95,10.63,8.84,2.55,27,17,13,21,11,18,15,8,Bandhan Balanced Advantage Fund-Reg(G),Hybrid : Dynamic Asset Allocation,33,34,34,33,33,24,19,11,3.38,1.65,1.23,9.24,0.83,11.46,12.52,10.06,,,,,,,,
ICICI Pru Bharat 22 FOF-(G),40232,ICICI Prudential Mutual Fund,0.76,-0.81,9.9,-6.3,BSE Bharat 22 Index,25.65,32.94,,1.34,53,55,70,43,53,4,1,,ICICI Pru Bharat 22 FOF-(G),FoFs : Domestic,60,80,74,61,59,47,29,23,10.54,3.51,4.02,13.87,8.94,14.44,14.59,10.5,0.58,-0.88,9.15,-8.63,22.51,29.05,,-1.56
WOC Multi Cap Fund-Reg(G),48199,WhiteOak Capital Mutual Fund,2.62,3.23,18.86,4.35,Nifty500 Multicap 50:25:25 - TRI,,,,3.84,12,30,8,5,4,,,,WOC Multi Cap Fund-Reg(G),Equity : Multi Cap,42,45,44,43,40,28,21,14,2.14,3.01,2.04,16.03,-1.53,16.5,21.27,14.62,,,,,,,,
Franklin India Aggressive Hybrid Fund(G),999,Franklin Templeton Mutual Fund,1.36,0.23,9.73,0.6,CRISIL Hybrid 35+65 - Aggressive Index,14.06,17.99,11.81,2.28,43,36,51,31,37,12,10,11,Franklin India Aggressive Hybrid Fund(G),Hybrid : Equity Oriented,53,55,54,54,53,52,49,33,3.83,1.68,1.45,9.83,1.87,11.84,14.33,10.42,,,,,,,,
