DSP Healthcare Fund-Reg(G),36002,DSP Mutual Fund,1.43,5.01,-7.37,16.03,BSE Health Care - TRI,23.34,24.27,,-9.41,18,3,18,16,7,4,3,,DSP Healthcare Fund-Reg(G),Equity : Sectoral - Pharma,18,18,18,16,16,10,9,3,-6.22,0.01,9.96,-2.0,17.43,23.0,22.31,12.23,,,,,,,,
LIC MF Large & Midcap Fund-Reg(G),31950,LIC Mutual Fund,5.0,16.18,-1.24,9.02,NIFTY LargeMidcap 250 - TRI,19.39,24.67,14.39,-1.1,24,4,6,23,16,18,19,10,LIC MF Large & Midcap Fund-Reg(G),Equity : Large & Mid Cap,31,31,31,31,29,26,25,19,-0.49,3.77,14.9,-0.37,8.36,21.23,26.33,14.28,,,,,,,,
Motilal Oswal Nifty India Defence Index Fund-Reg(G),48892,Motilal Oswal Mutual Fund,26.03,69.84,29.94,,Nifty India Defence - TRI,,,,35.23,1,1,1,1,,,,,Motilal Oswal Nifty India Defence Index Fund-Reg(G),Equity : Index Funds,175,194,187,167,123,68,32,18,0.59,3.51,15.23,-0.43,4.73,18.61,22.89,12.09,,,,,,,,
Kotak NASDAQ 100 FoF-Reg(G),45260,Kotak Mahindra Mutual Fund,11.85,1.46,3.9,16.43,Nasdaq-100 - TRI,22.97,,,0.22,45,5,25,32,13,5,,,Kotak NASDAQ 100 FoF-Reg(G),FoFs : Overseas,57,57,57,57,57,51,27,24,5.7,7.23,1.96,5.94,13.33,13.63,11.25,6.96,,,,,,,,
ICICI Pru Bond Fund(G),6197,ICICI Prudential Mutual Fund,1.17,4.53,6.24,10.85,CRISIL Medium to Long Term Debt Index,8.71,6.72,7.56,5.51,13,37,10,11,10,1,2,2,ICICI Pru Bond Fund(G),Debt : Medium to Long Duration,59,60,59,59,52,26,11,11,4.89,1.21,3.6,5.53,9.91,7.86,6.06,6.56,,,,,,,,
Tata Business Cycle Fund-Reg(G),45373,Tata Mutual Fund,1.92,11.94,-2.93,1.36,NIFTY 500 - TRI,22.72,,,-1.82,55,84,77,58,44,12,,,Tata Business Cycle Fund-Reg(G),Equity : Thematic,89,98,96,81,62,38,21,9,-1.26,3.87,14.67,-1.49,5.23,21.05,26.68,13.94,,,,,,,,
HSBC Money Market Fund-Reg(G),621,HSBC Mutual Fund,0.64,2.33,4.11,7.94,Nifty Money Market Index,6.99,5.39,6.73,3.51,12,11,12,13,12,13,15,8,HSBC Money Market Fund-Reg(G),Debt : Money Market,22,23,23,22,22,19,17,13,3.47,0.63,2.31,4.07,7.83,7.12,5.75,6.61,,,,,,,,
HDFC Business Cycle Fund-Reg(G),46445,HDFC Mutual Fund,3.04,10.34,-1.61,5.19,NIFTY 500 - TRI,,,,-1.75,52,63,88,47,32,,,,HDFC Business Cycle Fund-Reg(G),Equity : Thematic,89,98,96,81,62,38,21,9,-1.26,3.87,14.67,-1.49,5.23,21.05,26.68,13.94,,,,,,,,
Kotak Dynamic Bond Fund-Reg(G),5430,Kotak Mahindra Mutual Fund,1.06,4.83,5.84,10.77,NIFTY Composite Debt Index,8.14,6.59,8.01,5.35,13,13,12,16,8,10,7,2,Kotak Dynamic Bond Fund-Reg(G),Debt : Dynamic Bond,22,22,22,22,22,22,21,19,5.29,1.08,4.72,6.03,10.29,7.97,6.25,7.17,,,,,,,,
UTI Short Duration Fund-Reg(G),3656,UTI Mutual Fund,1.07,3.44,5.16,9.27,CRISIL Short Duration Debt Index,7.51,7.38,6.46,4.5,21,19,20,19,18,9,4,14,UTI Short Duration Fund-Reg(G),Debt : Short Duration,30,34,34,29,26,23,21,18,10.72,1.19,3.39,5.19,9.26,7.38,6.46,6.84,,,,,,,,
SBI Nifty Next 50 ETF,30248,SBI Mutual Fund,3.04,17.47,-4.37,-1.7,NIFTY NEXT 50 - TRI,21.37,23.96,13.93,-1.26,128,80,37,136,132,27,26,6,SBI Nifty Next 50 ETF,Equity : ETFs,170,185,177,168,150,103,63,28,2.01,3.27,13.64,0.77,7.19,18.97,24.38,12.41,,,,,,,,
SBI Retirement Benefit Fund-Aggressive Plan-Reg(G),30398,SBI Mutual Fund,4.28,12.87,-0.94,3.46,BSE 500 - TRI,17.26,,,1.59,27,5,15,38,42,11,,,SBI Retirement Benefit Fund-Aggressive Plan-Reg(G),Hybrid : Solution Oriented,43,43,43,42,42,37,32,15,1.65,2.68,10.49,1.67,8.8,14.62,16.21,10.44,,,,,,,,
Invesco India Flexi Cap Fund-Reg(G),45945,Invesco Mutual Fund,4.25,15.89,-1.84,13.01,BSE 500 - TRI,24.45,,,-3.49,40,10,9,31,6,5,,,Invesco India Flexi Cap Fund-Reg(G),Equity : Flexi Cap,48,48,48,48,48,35,26,21,-0.83,3.13,13.47,-1.04,6.98,19.03,23.58,13.48,,,,,,,,
Tata Banking & Financial Services Fund-Reg(G),33726,Tata Mutual Fund,0.35,15.05,7.7,18.36,Nifty Financial Services - TRI,21.71,23.36,,9.93,6,22,16,7,4,4,9,,Tata Banking & Financial Services Fund-Reg(G),Equity : Sectoral - Financial Services,21,22,22,21,20,14,11,10,8.23,1.78,15.61,6.62,14.94,20.31,25.21,12.75,,,,,,,,
HDFC NIFTY Bank ETF,33563,HDFC Mutual Fund,0.12,14.76,6.84,13.13,NIFTY BANK - TRI,16.46,,,9.32,16,169,65,21,25,59,,,HDFC NIFTY Bank ETF,Equity : ETFs,170,185,177,168,150,103,63,28,2.01,3.27,13.64,0.77,7.19,18.97,24.38,12.41,,,,,,,,
Franklin Build India Fund(G),7864,Franklin Templeton Mutual Fund,4.01,17.39,-1.97,2.51,BSE India Infrastructure Index - TRI,32.01,35.76,16.96,0.14,6,16,16,9,6,4,6,2,Franklin Build India Fund(G),Equity : Sectoral - Infrastructure,20,20,20,19,19,19,19,18,-1.15,5.9,19.8,-2.3,0.43,28.43,33.82,15.22,,,,,,,,
Invesco India ELSS Tax Saver Fund(G),2270,Invesco Mutual Fund,4.11,15.34,-2.51,10.31,BSE 500 - TRI,19.32,22.85,13.46,-3.04,47,16,18,40,10,28,43,13,Invesco India ELSS Tax Saver Fund(G),Equity : Tax Saving (ELSS),59,60,60,59,59,54,54,29,-0.58,3.41,13.41,-1.24,7.47,19.71,26.47,13.39,,,,,,,,
Canara Rob Mid Cap Fund-Reg(G),46001,Canara Robeco Mutual Fund,7.57,18.72,0.0,11.19,BSE 150 MidCap - TRI,,,,-0.06,3,2,4,7,7,,,,Canara Rob Mid Cap Fund-Reg(G),Equity : Mid Cap,30,31,30,30,30,25,24,20,-2.67,5.37,16.72,-1.51,8.11,24.58,30.49,15.77,,,,,,,,
HSBC Overnight Fund-Reg(G),42784,HSBC Mutual Fund,0.46,1.45,3.08,6.41,Nifty 1D Rate Index,6.3,5.02,,2.5,18,22,19,17,18,18,15,,HSBC Overnight Fund-Reg(G),Debt : Overnight,34,34,34,34,34,28,27,3,2.49,0.46,1.44,3.07,6.39,6.3,5.03,5.55,0.47,1.48,3.13,6.52,6.44,5.18,,6.2
Mirae Asset Money Market Fund-Reg(G),45753,Mirae Asset Mutual Fund,0.64,2.33,4.12,7.98,Nifty Money Market Index,6.94,,,3.52,11,13,11,12,10,15,,,Mirae Asset Money Market Fund-Reg(G),Debt : Money Market,22,23,23,22,22,19,17,13,3.47,0.63,2.31,4.07,7.83,7.12,5.75,6.61,,,,,,,,
Baroda BNP Paribas Multi Cap Fund-Reg(G),500,Baroda BNP Paribas Mutual Fund,2.69,13.01,-4.55,6.63,Nifty500 Multicap 50:25:25 - TRI,21.53,27.54,13.45,-6.09,42,37,30,40,25,10,6,10,Baroda BNP Paribas Multi Cap Fund-Reg(G),Equity : Multi Cap,42,43,43,41,37,28,20,14,-1.0,3.77,13.98,-1.05,8.15,20.3,25.08,13.89,,,,,,,,
DSP Equity Savings Fund-Reg(G),34871,DSP Mutual Fund,0.52,4.45,3.52,10.82,NIFTY 50 Equity Savings Index - TRI,10.83,13.03,,3.48,16,56,49,15,12,43,37,,DSP Equity Savings Fund-Reg(G),Hybrid : Equity Oriented,55,56,55,55,55,54,51,29,6.48,6.43,13.13,6.55,12.57,14.45,16.7,10.19,,,,,,,,
UTI MNC Fund-Reg(G),3634,UTI Mutual Fund,5.04,12.26,-3.71,1.37,NIFTY MNC - TRI,14.69,16.34,9.81,-2.76,4,3,3,4,4,2,3,2,UTI MNC Fund-Reg(G),Equity : Thematic - MNC,6,6,6,6,5,4,4,3,-2.95,5.13,11.87,-3.56,0.68,14.32,18.13,9.65,,,,,,,,
Aditya Birla SL Nifty Bank ETF,34434,Aditya Birla Sun Life Mutual Fund,0.12,14.76,6.83,13.13,NIFTY BANK - TRI,16.49,24.17,,9.06,24,167,66,23,26,56,18,,Aditya Birla SL Nifty Bank ETF,Equity : ETFs,170,185,177,168,150,103,63,28,2.01,3.27,13.64,0.77,7.19,18.97,24.38,12.41,,,,,,,,
Mirae Asset Healthcare Fund-Reg(G),39122,Mirae Asset Mutual Fund,-1.04,9.24,-1.68,15.99,BSE Health Care - TRI,20.71,22.22,,-6.94,12,13,13,8,8,9,6,,Mirae Asset Healthcare Fund-Reg(G),Equity : Sectoral - Pharma,18,18,18,16,16,10,9,3,-6.22,0.01,9.96,-2.0,17.43,23.0,22.31,12.23,,,,,,,,
JM Liquid Fund(G),1909,JM Financial Mutual Fund,0.52,1.73,3.5,7.13,CRISIL Liquid Debt Index,6.82,5.42,6.24,2.89,28,24,28,28,28,25,20,12,JM Liquid Fund(G),Debt : Liquid,38,38,38,38,37,35,34,29,2.88,0.52,1.73,3.5,7.13,6.81,5.39,6.15,,,,,,,,
Nippon India ETF Nifty PSU Bank BeES,3722,Nippon India Mutual Fund,2.12,20.86,-0.35,-7.37,NIFTY PSU BANK - TRI,40.12,43.77,7.02,4.11,73,102,11,114,144,3,1,26,Nippon India ETF Nifty PSU Bank BeES,Equity : ETFs,170,185,177,168,150,103,63,28,2.01,3.27,13.64,0.77,7.19,18.97,24.38,12.41,,,,,,,,
HSBC Ultra Short Duration Fund-Reg(G),44328,HSBC Mutual Fund,0.62,2.12,3.89,7.63,NIFTY Ultra Short Duration Debt Index,7.0,5.64,,3.28,4,4,3,4,4,4,8,,HSBC Ultra Short Duration Fund-Reg(G),Debt : Ultra Short Duration,26,29,26,25,24,24,22,13,3.13,0.58,2.02,3.71,7.3,6.66,5.46,6.19,,,,,,,,
Sundaram Multi Cap Fund(G),2370,Sundaram Mutual Fund,3.79,14.72,0.13,6.92,Nifty500 Multicap 50:25:25 - TRI,19.9,26.49,14.63,-0.41,17,19,19,12,24,16,7,4,Sundaram Multi Cap Fund(G),Equity : Multi Cap,42,43,43,41,37,28,20,14,-1.0,3.77,13.98,-1.05,8.15,20.3,25.08,13.89,,,,,,,,
Mirae Asset Flexi Cap Fund-Reg(G),47596,Mirae Asset Mutual Fund,3.26,13.41,0.67,7.89,NIFTY 500 - TRI,,,,0.82,18,22,27,13,24,,,,Mirae Asset Flexi Cap Fund-Reg(G),Equity : Flexi Cap,48,48,48,48,48,35,26,21,-0.83,3.13,13.47,-1.04,6.98,19.03,23.58,13.48,,,,,,,,
Nippon India ETF Nifty 8-13 yr G-Sec Long Term Gilt,35459,Nippon India Mutual Fund,1.56,5.04,7.3,12.31,Nifty 8-13 yr G-Sec,9.5,5.92,,6.3,4,8,5,3,1,2,2,,Nippon India ETF Nifty 8-13 yr G-Sec Long Term Gilt,Debt : ETFs,31,33,31,31,26,14,7,2,4.11,0.91,2.84,4.87,9.09,7.96,5.44,6.1,1.14,5.02,6.99,12.53,9.7,6.24,,16.01
Edelweiss Multi Cap Fund-Reg(G),48147,Edelweiss Mutual Fund,3.39,14.97,-3.46,10.07,Nifty500 Multicap 50:25:25 - TRI,,,,-3.42,34,27,16,35,11,,,,Edelweiss Multi Cap Fund-Reg(G),Equity : Multi Cap,42,43,43,41,37,28,20,14,-1.0,3.77,13.98,-1.05,8.15,20.3,25.08,13.89,,,,,,,,
Kotak Pioneer Fund-Reg(G),43927,Kotak Mahindra Mutual Fund,5.69,14.13,0.76,10.36,NIFTY 500 - TRI,22.45,28.04,,-0.89,46,15,47,23,10,13,10,,Kotak Pioneer Fund-Reg(G),Equity : Thematic,89,98,96,81,62,38,21,9,-1.26,3.87,14.67,-1.49,5.23,21.05,26.68,13.94,,,,,,,,
ICICI Pru Commodities Fund-Reg(G),41999,ICICI Prudential Mutual Fund,3.83,14.03,3.43,-0.1,NIFTY COMMODITIES - TRI,20.09,37.27,,6.37,5,45,51,6,49,20,1,,ICICI Pru Commodities Fund-Reg(G),Equity : Thematic,89,98,96,81,62,38,21,9,-1.26,3.87,14.67,-1.49,5.23,21.05,26.68,13.94,,,,,,,,
Edelweiss Aggressive Hybrid Fund-Reg(G),7922,Edelweiss Mutual Fund,2.14,10.83,3.48,11.11,CRISIL Hybrid 35+65 - Aggressive Index,19.24,22.39,12.34,1.71,24,13,7,17,10,4,3,3,Edelweiss Aggressive Hybrid Fund-Reg(G),Hybrid : Multi Asset Allocation,28,29,29,26,24,10,8,7,4.25,2.16,9.52,3.64,8.81,16.44,21.01,12.29,,,,,,,,
DSP Corp Bond Fund-Reg(G),37709,DSP Mutual Fund,1.01,3.13,4.89,9.0,CRISIL Corporate Bond Index,7.34,5.71,,4.24,20,20,21,20,20,18,17,,DSP Corp Bond Fund-Reg(G),Debt : Corporate Bond,21,21,21,21,21,20,18,12,4.98,1.19,3.95,5.65,9.93,7.68,6.44,7.24,,,,,,,,
Kotak Business Cycle Fund-Reg(G),46472,Kotak Mahindra Mutual Fund,4.54,15.77,0.48,12.34,NIFTY 500 - TRI,,,,-0.25,39,33,29,26,8,,,,Kotak Business Cycle Fund-Reg(G),Equity : Thematic,89,98,96,81,62,38,21,9,-1.26,3.87,14.67,-1.49,5.23,21.05,26.68,13.94,,,,,,,,
Franklin India Balanced Advantage Fund-Reg(G),46625,Franklin Templeton Mutual Fund,1.79,7.82,2.73,8.64,NIFTY 50 Hybrid Composite Debt 50:50 Index,,,,1.78,22,14,24,14,15,,,,Franklin India Balanced Advantage Fund-Reg(G),Hybrid : Dynamic Asset Allocation,33,34,33,33,32,22,19,11,1.74,1.81,8.61,1.68,6.87,13.37,14.66,9.7,,,,,,,,
Sundaram Multi Asset Allocation Fund-Reg(G),48460,Sundaram Mutual Fund,1.35,10.27,7.38,11.38,NIFTY 500 - TRI,,,,7.84,3,25,12,2,7,,,,Sundaram Multi Asset Allocation Fund-Reg(G),Hybrid : Multi Asset Allocation,28,29,29,26,24,10,8,7,4.25,2.16,9.52,3.64,8.81,16.44,21.01,12.29,,,,,,,,
Mirae Asset NYSE FANG+ ETF,45379,Mirae Asset Mutual Fund,12.71,4.82,13.35,32.86,NYSE FANG+ TRI,41.91,,,4.63,62,3,162,6,2,1,,,Mirae Asset NYSE FANG+ ETF,Equity : ETFs,170,185,177,168,150,103,63,28,2.01,3.27,13.64,0.77,7.19,18.97,24.38,12.41,,,,,,,,
UTI Focused Fund-Reg(G),45685,UTI Mutual Fund,2.84,12.26,0.55,6.58,NIFTY 500 - TRI,18.06,,,3.06,7,27,36,16,31,19,,,UTI Focused Fund-Reg(G),Equity : Flexi Cap,48,48,48,48,48,35,26,21,-0.83,3.13,13.47,-1.04,6.98,19.03,23.58,13.48,,,,,,,,
Parag Parikh Conservative Hybrid Fund-Reg(G),45338,PPFAS Mutual Fund,1.33,4.83,5.15,10.9,CRISIL Hybrid 85+15 - Conservative Index,12.26,,,5.21,1,9,16,1,2,1,,,Parag Parikh Conservative Hybrid Fund-Reg(G),Hybrid : Debt Oriented (Conservative),18,18,18,18,18,18,17,17,3.88,1.41,5.75,4.19,9.33,10.03,10.53,7.83,,,,,,,,
SBI CRISIL IBX Gilt Index - June 2036 Fund-Reg(G),46941,SBI Mutual Fund,1.65,5.9,7.71,12.69,CRISIL IBX Gilt Index - June 2036,,,,6.85,2,6,3,2,4,,,,SBI CRISIL IBX Gilt Index - June 2036 Fund-Reg(G),Debt : Long Duration,26,26,26,24,24,4,3,2,5.93,1.13,5.29,6.78,11.54,8.81,5.6,7.17,,,,,,,,
Baroda BNP Paribas Large Cap Fund-Reg(G),23,Baroda BNP Paribas Mutual Fund,2.49,12.55,-0.28,5.24,NIFTY 100 - TRI,18.6,21.65,12.53,0.86,29,15,19,30,26,8,15,13,Baroda BNP Paribas Large Cap Fund-Reg(G),Equity : Large Cap,38,39,38,38,37,34,31,28,1.91,2.29,12.83,0.78,6.77,17.35,21.78,12.19,,,,,,,,
Edelweiss Flexi Cap Fund-Reg(G),31778,Edelweiss Mutual Fund,1.9,12.6,-2.77,7.25,NIFTY 500 - TRI,20.79,25.37,14.27,-2.47,37,42,32,37,29,14,8,6,Edelweiss Flexi Cap Fund-Reg(G),Equity : Flexi Cap,48,48,48,48,48,35,26,21,-0.83,3.13,13.47,-1.04,6.98,19.03,23.58,13.48,,,,,,,,
Tata Large Cap Fund-Reg(G),3281,Tata Mutual Fund,1.81,11.79,1.32,4.97,NIFTY 100 - TRI,17.12,22.89,11.84,3.03,14,26,28,18,27,19,7,19,Tata Large Cap Fund-Reg(G),Equity : Large Cap,38,39,38,38,37,34,31,28,1.91,2.29,12.83,0.78,6.77,17.35,21.78,12.19,,,,,,,,
ICICI Pru Constant Maturity Gilt Fund(G),30426,ICICI Prudential Mutual Fund,1.58,5.46,7.53,12.41,Crisil 10 Yr Gilt Index,9.29,6.35,8.52,6.57,2,2,2,1,2,2,1,2,ICICI Pru Constant Maturity Gilt Fund(G),Debt : Gilt (10 Yr Constant Duration),6,6,6,6,6,4,4,4,6.33,1.53,5.17,7.24,11.98,9.16,5.92,8.2,,,,,,,,
DSP BSE Liquid Rate ETF,48724,DSP Mutual Fund,0.45,1.39,2.97,6.18,BSE Liquid Rate Index,,,,2.39,22,22,21,25,20,,,,DSP BSE Liquid Rate ETF,Debt : ETFs,31,33,31,31,26,14,7,2,4.11,0.91,2.84,4.87,9.09,7.96,5.44,6.1,,,,,,,,
LIC MF Nifty 8-13 yr G-Sec ETF,31581,LIC Mutual Fund,1.56,5.03,7.28,12.25,Nifty 8-13 yr G-Sec,9.43,5.9,7.41,6.28,5,10,6,4,2,3,3,1,LIC MF Nifty 8-13 yr G-Sec ETF,Debt : ETFs,31,33,31,31,26,14,7,2,4.11,0.91,2.84,4.87,9.09,7.96,5.44,6.1,1.14,5.02,6.99,12.53,9.7,6.24,,16.01
Quant Large Cap Fund-Reg(G),46678,Quant Mutual Fund,3.26,12.71,-1.97,-2.83,NIFTY 100 - TRI,,,,-0.38,34,4,14,32,36,,,,Quant Large Cap Fund-Reg(G),Equity : Large Cap,38,39,38,38,37,34,31,28,1.91,2.29,12.83,0.78,6.77,17.35,21.78,12.19,,,,,,,,
Canara Rob Focused Equity Fund-Reg(G),45510,Canara Robeco Mutual Fund,3.58,13.8,1.1,13.07,BSE 500 - TRI,20.37,,,0.93,10,24,26,9,6,13,,,Canara Rob Focused Equity Fund-Reg(G),Equity : Multi Cap,42,43,43,41,37,28,20,14,-1.0,3.77,13.98,-1.05,8.15,20.3,25.08,13.89,,,,,,,,
Mahindra Manulife Large & Mid Cap Fund-Reg(G),43915,Mahindra Manulife Mutual Fund,3.52,15.08,-0.15,1.48,NIFTY LargeMidcap 250 - TRI,18.61,25.95,,-0.7,19,17,12,16,28,21,11,,Mahindra Manulife Large & Mid Cap Fund-Reg(G),Equity : Large & Mid Cap,31,31,31,31,29,26,25,19,-0.49,3.77,14.9,-0.37,8.36,21.23,26.33,14.28,,,,,,,,
Bandhan Multi Cap Fund-Reg(G),45867,Bandhan Mutual Fund,3.67,14.34,0.47,8.14,Nifty500 Multicap 50:25:25 - TRI,21.36,,,0.88,11,21,22,10,18,12,,,Bandhan Multi Cap Fund-Reg(G),Equity : Multi Cap,42,43,43,41,37,28,20,14,-1.0,3.77,13.98,-1.05,8.15,20.3,25.08,13.89,,,,,,,,
DSP Focused Fund-Reg(G),8463,DSP Mutual Fund,3.72,14.4,2.87,12.22,NIFTY 500 - TRI,21.42,22.68,12.06,4.23,2,20,21,3,9,11,13,11,DSP Focused Fund-Reg(G),Equity : Multi Cap,42,43,43,41,37,28,20,14,-1.0,3.77,13.98,-1.05,8.15,20.3,25.08,13.89,,,,,,,,
Aditya Birla SL Quant Fund-Reg(G),48491,Aditya Birla Sun Life Mutual Fund,0.11,11.59,-2.87,,NIFTY 200 - TRI,,,,-3.99,63,94,80,56,,,,,Aditya Birla SL Quant Fund-Reg(G),Equity : Thematic,89,98,96,81,62,38,21,9,-1.26,3.87,14.67,-1.49,5.23,21.05,26.68,13.94,,,,,,,,
Nippon India Index Fund-Nifty 50 Plan(G),12860,Nippon India Mutual Fund,1.83,11.89,3.65,8.74,NIFTY 50 - TRI,15.34,21.42,11.74,5.22,29,137,140,29,29,56,24,15,Nippon India Index Fund-Nifty 50 Plan(G),Equity : Index Funds,175,194,187,167,123,68,32,18,0.59,3.51,15.23,-0.43,4.73,18.61,22.89,12.09,,,,,,,,
Edelweiss US Technology Equity FOF-Reg(G),44630,Edelweiss Mutual Fund,12.43,0.91,1.89,18.82,Russell 1000 Equal Weighted Technology Index,24.9,18.11,,1.26,42,4,32,44,9,3,3,,Edelweiss US Technology Equity FOF-Reg(G),FoFs : Overseas,57,57,57,57,57,51,27,24,5.7,7.23,1.96,5.94,13.33,13.63,11.25,6.96,,,,,,,,
ICICI Pru Housing Opp Fund-Reg(G),46546,ICICI Prudential Mutual Fund,3.05,14.64,1.87,6.96,Nifty Housing - TRI,20.31,,,3.29,18,62,38,15,23,19,,,ICICI Pru Housing Opp Fund-Reg(G),Equity : Thematic,89,98,96,81,62,38,21,9,-1.26,3.87,14.67,-1.49,5.23,21.05,26.68,13.94,,,,,,,,
Nippon India Innovation Fund-Reg(G),48169,Nippon India Mutual Fund,4.19,14.87,-1.43,4.83,NIFTY 500 - TRI,,,,0.64,33,39,37,43,37,,,,Nippon India Innovation Fund-Reg(G),Equity : Thematic,89,98,96,81,62,38,21,9,-1.26,3.87,14.67,-1.49,5.23,21.05,26.68,13.94,,,,,,,,
HDFC Infrastructure Fund(G),4253,HDFC Mutual Fund,5.7,19.52,1.03,4.97,BSE India Infrastructure Index - TRI,34.3,38.03,11.39,2.1,3,13,9,3,3,1,3,18,HDFC Infrastructure Fund(G),Equity : Sectoral - Infrastructure,20,20,20,19,19,19,19,18,-1.15,5.9,19.8,-2.3,0.43,28.43,33.82,15.22,,,,,,,,
Nippon India Consumption Fund(G),2644,Nippon India Mutual Fund,0.19,12.0,-0.73,5.46,Nifty India Consumption - TRI,21.12,26.37,14.88,0.74,3,20,7,3,12,2,2,4,Nippon India Consumption Fund(G),Equity : Thematic - Consumption,20,22,22,18,17,13,13,9,-2.53,1.58,11.57,-2.95,7.07,18.85,22.75,13.91,,,,,,,,
HSBC Arbitrage Fund-Reg(G),29550,HSBC Mutual Fund,0.47,1.64,3.38,6.96,Nifty 50 Arbitrage,6.53,5.3,5.76,2.7,19,10,17,19,20,17,13,7,HSBC Arbitrage Fund-Reg(G),Hybrid : Arbitrage,30,31,30,28,26,24,22,14,2.71,0.45,1.64,3.41,7.04,6.53,5.2,5.73,0.48,1.91,3.99,7.61,7.07,5.54,,8.07
BHARAT Bond ETF FOF - April 2033 -Reg(G),47284,Edelweiss Mutual Fund,1.51,5.47,7.1,11.62,NIFTY BHARAT Bond Index - April 2033,,,,6.09,15,41,41,11,11,,,,BHARAT Bond ETF FOF - April 2033 -Reg(G),FoFs : Domestic,61,67,62,61,56,47,28,23,4.73,2.69,9.86,4.34,8.96,15.08,16.99,10.28,,,,,,,,
Templeton India Equity Income Fund(G),3367,Franklin Templeton Mutual Fund,1.68,8.11,-1.74,4.42,NIFTY 500 - TRI,19.2,29.74,14.82,-0.26,8,8,10,6,5,7,2,2,Templeton India Equity Income Fund(G),Equity : Thematic - Dividend Yield,10,10,10,10,9,8,6,5,0.44,2.77,12.48,-1.28,5.33,21.88,27.43,14.16,,,,,,,,
Aditya Birla SL Medium Term Plan-Reg(G),7683,Aditya Birla Sun Life Mutual Fund,1.29,3.76,7.9,14.83,CRISIL Medium Duration Debt Index,14.84,13.55,8.72,7.13,1,3,7,1,1,1,1,1,Aditya Birla SL Medium Term Plan-Reg(G),Debt : Medium Duration,29,29,29,29,29,18,12,12,4.18,0.99,3.02,4.91,9.1,7.67,7.2,6.84,,,,,,,,
Edelweiss Nifty PSU Bond Plus SDL Apr 2027 50:50 Index Fund-Reg(G),45387,Edelweiss Mutual Fund,1.1,3.15,4.96,9.15,Nifty PSU Bond Plus SDL Apr 2027 50:50 Index,7.64,,,4.35,47,41,42,48,42,19,,,Edelweiss Nifty PSU Bond Plus SDL Apr 2027 50:50 Index Fund-Reg(G),Debt : Medium to Long Duration,59,60,59,59,52,26,11,11,4.89,1.21,3.6,5.53,9.91,7.86,6.06,6.56,,,,,,,,
Axis Business Cycles Fund-Reg(G),47580,Axis Mutual Fund,4.13,16.29,-0.25,6.89,NIFTY 500 - TRI,,,,0.37,35,42,24,34,24,,,,Axis Business Cycles Fund-Reg(G),Equity : Thematic,89,98,96,81,62,38,21,9,-1.26,3.87,14.67,-1.49,5.23,21.05,26.68,13.94,,,,,,,,
Tata India Consumer Fund-Reg(G),33728,Tata Mutual Fund,0.61,10.1,-5.71,10.39,Nifty India Consumption - TRI,21.28,22.91,,-7.62,20,18,19,17,4,1,6,,Tata India Consumer Fund-Reg(G),Equity : Thematic - Consumption,20,22,22,18,17,13,13,9,-2.53,1.58,11.57,-2.95,7.07,18.85,22.75,13.91,,,,,,,,
ICICI Pru BSE Liquid Rate ETF(IDCW),35122,ICICI Prudential Mutual Fund,0.45,1.38,2.97,6.22,BSE Liquid Rate Index,6.15,4.8,,2.39,23,23,22,24,18,12,5,,ICICI Pru BSE Liquid Rate ETF(IDCW),Debt : ETFs,31,33,31,31,26,14,7,2,4.11,0.91,2.84,4.87,9.09,7.96,5.44,6.1,,,,,,,,
Aditya Birla SL Income Fund(G),405,Aditya Birla Sun Life Mutual Fund,1.03,4.6,5.92,10.25,CRISIL Medium to Long Term Debt Index,7.93,6.5,7.26,5.15,22,45,8,17,18,12,4,3,Aditya Birla SL Income Fund(G),Debt : Medium to Long Duration,59,60,59,59,52,26,11,11,4.89,1.21,3.6,5.53,9.91,7.86,6.06,6.56,,,,,,,,
Kotak Manufacture in India Fund-Reg(G),46107,Kotak Mahindra Mutual Fund,5.21,18.86,0.81,2.96,Nifty India Manufacturing - TRI,21.6,,,-0.35,42,21,11,22,42,16,,,Kotak Manufacture in India Fund-Reg(G),Equity : Thematic,89,98,96,81,62,38,21,9,-1.26,3.87,14.67,-1.49,5.23,21.05,26.68,13.94,,,,,,,,
ITI Small Cap Fund-Reg(G),44399,ITI Mutual Fund,4.94,19.54,-4.28,8.2,Nifty Smallcap 250 - TRI,30.08,31.55,,-4.9,9,27,5,11,13,2,19,,ITI Small Cap Fund-Reg(G),Equity : Small Cap,29,30,30,29,27,23,21,13,-5.65,6.19,17.6,-5.29,8.26,24.03,35.64,16.99,,,,,,,,
UTI-Nifty Next 50 ETF,37338,UTI Mutual Fund,3.05,17.49,-4.31,-1.62,NIFTY NEXT 50,21.43,24.09,,-1.1,124,75,35,132,130,25,23,,UTI-Nifty Next 50 ETF,Equity : ETFs,170,185,177,168,150,103,63,28,2.01,3.27,13.64,0.77,7.19,18.97,24.38,12.41,3.39,17.58,-5.14,-1.43,20.76,22.75,,-4.17
ICICI Pru Bharat 22 FOF-(G),40232,ICICI Prudential Mutual Fund,2.37,15.65,-3.02,-0.55,BSE Bharat 22 Index,31.9,35.52,,1.83,48,26,7,54,53,1,1,,ICICI Pru Bharat 22 FOF-(G),FoFs : Domestic,61,67,62,61,56,47,28,23,4.73,2.69,9.86,4.34,8.96,15.08,16.99,10.28,2.5,15.45,-4.35,-2.9,28.47,30.74,,-0.13
Nippon India ETF Nifty IT,44506,Nippon India Mutual Fund,5.62,0.52,-12.26,12.56,NIFTY IT - TRI,11.24,,,-12.31,166,35,171,165,37,98,,,Nippon India ETF Nifty IT,Equity : ETFs,170,185,177,168,150,103,63,28,2.01,3.27,13.64,0.77,7.19,18.97,24.38,12.41,,,,,,,,
Bandhan Balanced Advantage Fund-Reg(G),30671,Bandhan Mutual Fund,1.11,8.03,1.07,8.03,NIFTY 50 Hybrid Composite Debt 50:50 Index,12.24,12.97,8.45,0.67,26,31,22,25,18,16,12,8,Bandhan Balanced Advantage Fund-Reg(G),Hybrid : Dynamic Asset Allocation,33,34,33,33,32,22,19,11,1.74,1.81,8.61,1.68,6.87,13.37,14.66,9.7,,,,,,,,
HSBC Infrastructure Fund-Reg(G),594,HSBC Mutual Fund,6.67,21.34,-4.73,-1.42,Nifty Infrastructure - TRI,28.93,32.5,15.75,-2.75,15,4,6,16,15,9,13,9,HSBC Infrastructure Fund-Reg(G),Equity : Sectoral - Infrastructure,20,20,20,19,19,19,19,18,-1.15,5.9,19.8,-2.3,0.43,28.43,33.82,15.22,,,,,,,,
SBI Credit Risk Fund-Reg(G),2770,SBI Mutual Fund,0.81,3.08,4.89,8.87,NIFTY Credit Risk Bond Index,8.03,7.36,7.48,4.16,12,14,12,11,12,6,10,6,SBI Credit Risk Fund-Reg(G),Debt : Credit Risk,15,15,15,15,15,15,15,13,6.41,0.99,4.65,6.98,11.38,8.51,9.23,6.57,,,,,,,,
Axis CRISIL IBX SDL May 2027 Index Fund-Reg(G),45999,Axis Mutual Fund,1.2,3.1,5.1,9.54,CRISIL IBX SDL Index - May 2027,7.98,,,4.54,39,35,44,41,36,11,,,Axis CRISIL IBX SDL May 2027 Index Fund-Reg(G),Debt : Medium to Long Duration,59,60,59,59,52,26,11,11,4.89,1.21,3.6,5.53,9.91,7.86,6.06,6.56,,,,,,,,
Union Flexi Cap Fund-Reg(G),14559,Union Mutual Fund,3.35,14.6,0.4,6.45,BSE 500 - TRI,17.82,23.94,12.12,-0.83,26,18,14,17,32,22,10,17,Union Flexi Cap Fund-Reg(G),Equity : Flexi Cap,48,48,48,48,48,35,26,21,-0.83,3.13,13.47,-1.04,6.98,19.03,23.58,13.48,,,,,,,,
Sundaram Ultra Short Duration Fund(G),4186,Sundaram Mutual Fund,0.51,1.85,3.37,6.62,NIFTY Ultra Short Duration Debt Index,6.02,4.71,5.25,2.84,25,28,25,24,23,23,21,12,Sundaram Ultra Short Duration Fund(G),Debt : Ultra Short Duration,26,29,26,25,24,24,22,13,3.13,0.58,2.02,3.71,7.3,6.66,5.46,6.19,,,,,,,,
Motilal Oswal Nifty 500 Index Fund-Reg(G),43809,Motilal Oswal Mutual Fund,3.07,14.5,1.11,6.45,NIFTY 500 - TRI,17.83,23.85,,2.18,76,90,100,71,68,32,5,,Motilal Oswal Nifty 500 Index Fund-Reg(G),Equity : Index Funds,175,194,187,167,123,68,32,18,0.59,3.51,15.23,-0.43,4.73,18.61,22.89,12.09,,,,,,,,
Templeton India Value Fund(G),3379,Franklin Templeton Mutual Fund,1.58,11.47,-0.6,3.43,NIFTY 500 - TRI,22.28,31.7,14.49,1.41,6,23,17,10,17,11,3,9,Templeton India Value Fund(G),Equity : Value / Contra,22,23,22,22,22,21,17,14,-0.39,3.35,13.17,-1.22,6.19,22.63,28.17,14.73,,,,,,,,
Kotak Infra & Eco Reform Fund(G),4228,Kotak Mahindra Mutual Fund,9.47,24.03,-3.14,-0.79,Nifty Infrastructure - TRI,27.56,34.34,15.55,-4.0,17,2,3,12,13,12,9,10,Kotak Infra & Eco Reform Fund(G),Equity : Sectoral - Infrastructure,20,20,20,19,19,19,19,18,-1.15,5.9,19.8,-2.3,0.43,28.43,33.82,15.22,,,,,,,,
SBI CRISIL IBX Gilt Index - Apr 2029 Fund-Reg(G),46971,SBI Mutual Fund,1.47,4.18,6.39,10.93,CRISIL IBX Gilt Index - April 2029,,,,5.63,10,10,16,6,7,,,,SBI CRISIL IBX Gilt Index - Apr 2029 Fund-Reg(G),Debt : Medium to Long Duration,59,60,59,59,52,26,11,11,4.89,1.21,3.6,5.53,9.91,7.86,6.06,6.56,,,,,,,,
DSP Nifty SDL Plus G-Sec Jun 2028 30:70 Index Fund-Reg(G),45863,DSP Mutual Fund,1.3,3.48,5.59,10.05,Nifty SDL Plus G-Sec Jun 2028 70:30 Index,8.23,,,4.99,28,22,31,29,25,5,,,DSP Nifty SDL Plus G-Sec Jun 2028 30:70 Index Fund-Reg(G),Debt : Medium to Long Duration,59,60,59,59,52,26,11,11,4.89,1.21,3.6,5.53,9.91,7.86,6.06,6.56,,,,,,,,
Kotak MNC Fund-Reg(G),49046,Kotak Mahindra Mutual Fund,5.31,13.13,-3.71,,NIFTY MNC - TRI,,,,-2.67,3,2,2,5,,,,,Kotak MNC Fund-Reg(G),Equity : Thematic - MNC,6,6,6,6,5,4,4,3,-2.95,5.13,11.87,-3.56,0.68,14.32,18.13,9.65,,,,,,,,
Motilal Oswal Large Cap Fund-Reg(G),48488,Motilal Oswal Mutual Fund,1.88,11.45,5.81,23.25,NIFTY 100 - TRI,,,,3.17,11,24,30,1,1,,,,Motilal Oswal Large Cap Fund-Reg(G),Equity : Large Cap,38,39,38,38,37,34,31,28,1.91,2.29,12.83,0.78,6.77,17.35,21.78,12.19,,,,,,,,
NJ Flexi Cap Fund-Reg(G),48135,NJ Mutual Fund,2.96,11.11,-4.76,-2.37,NIFTY 500 - TRI,,,,-3.85,41,26,42,43,45,,,,NJ Flexi Cap Fund-Reg(G),Equity : Flexi Cap,48,48,48,48,48,35,26,21,-0.83,3.13,13.47,-1.04,6.98,19.03,23.58,13.48,,,,,,,,
UTI Infrastructure Fund-Reg(G),3582,UTI Mutual Fund,3.08,15.56,1.25,0.05,Nifty Infrastructure - TRI,25.09,28.12,12.28,2.31,2,20,19,2,11,16,17,17,UTI Infrastructure Fund-Reg(G),Equity : Sectoral - Infrastructure,20,20,20,19,19,19,19,18,-1.15,5.9,19.8,-2.3,0.43,28.43,33.82,15.22,,,,,,,,
Franklin India Equity Hybrid Fund(G),999,Franklin Templeton Mutual Fund,2.25,9.97,2.12,9.18,CRISIL Hybrid 35+65 - Aggressive Index,17.41,20.65,11.55,1.42,41,20,27,29,24,11,11,10,Franklin India Equity Hybrid Fund(G),Hybrid : Equity Oriented,55,56,55,55,55,54,51,29,6.48,6.43,13.13,6.55,12.57,14.45,16.7,10.19,,,,,,,,
Kotak Bond Fund-Reg(G),1968,Kotak Mahindra Mutual Fund,1.24,4.54,5.77,9.96,CRISIL Medium to Long Term Debt Index,7.85,5.9,6.9,5.15,23,28,9,23,26,17,5,5,Kotak Bond Fund-Reg(G),Debt : Medium to Long Duration,59,60,59,59,52,26,11,11,4.89,1.21,3.6,5.53,9.91,7.86,6.06,6.56,,,,,,,,
Motilal Oswal Nifty Midcap 150 Index Fund-Reg(G),43810,Motilal Oswal Mutual Fund,5.38,18.4,0.74,7.73,Nifty Midcap 150 - TRI,26.2,32.63,,-0.05,96,37,32,78,49,6,2,,Motilal Oswal Nifty Midcap 150 Index Fund-Reg(G),Equity : Index Funds,175,194,187,167,123,68,32,18,0.59,3.51,15.23,-0.43,4.73,18.61,22.89,12.09,,,,,,,,
