DSP NIFTY 1D Rate Liquid ETF,38904,DSP Mutual Fund,0.53,1.56,3.12,6.33,Nifty 1D Rate Index,5.71,4.51,,0.61,28,25,24,21,21,13,6,,DSP NIFTY 1D Rate Liquid ETF,Debt : ETFs,31,31,30,28,24,14,7,2,0.99,0.95,2.13,3.76,8.1,6.55,5.47,5.92,0.59,1.66,3.3,6.73,6.18,5.01,,6.52
UTI Gilt Fund-Reg(G),3560,UTI Mutual Fund,1.0,1.69,3.5,8.14,CRISIL Dynamic Gilt Index,6.76,6.12,7.16,1.05,8,7,18,18,10,7,10,8,UTI Gilt Fund-Reg(G),Debt : Gilt,36,36,36,36,35,23,21,21,0.95,0.86,1.63,3.54,8.0,6.51,6.18,6.91,,,,,,,,
DSP NIFTY 50 Index Fund-Reg(G),41642,DSP Mutual Fund,-1.19,-2.05,-1.25,9.66,NIFTY 50 - TRI,11.4,15.07,,-0.08,19,10,26,31,58,33,16,,DSP NIFTY 50 Index Fund-Reg(G),Equity : Index Funds,175,175,161,132,108,56,30,18,-4.24,-5.01,-4.81,-3.99,9.79,13.41,15.97,10.86,,,,,,,,
HSBC Equity Savings Fund-Reg(G),15304,HSBC Mutual Fund,-7.23,-1.85,0.98,13.23,NIFTY 50 Equity Savings Index,11.37,11.88,8.37,-6.9,53,53,36,25,10,17,26,21,HSBC Equity Savings Fund-Reg(G),Hybrid : Equity Oriented,55,55,55,55,55,54,51,29,-1.66,-2.21,-1.28,0.42,10.31,10.23,12.12,9.63,,,,,,,,
SBI Magnum Comma Fund-Reg(G),2750,SBI Mutual Fund,-4.92,-7.12,-5.61,2.71,NIFTY COMMODITIES - TRI,8.05,19.77,13.97,-4.08,37,32,58,39,50,35,12,3,SBI Magnum Comma Fund-Reg(G),Equity : Thematic,89,89,80,71,56,36,20,9,-5.1,-5.97,-5.34,-4.72,11.49,15.97,20.38,12.86,,,,,,,,
Union Aggressive Hybrid Fund-Reg(G),44512,Union Mutual Fund,-3.8,-2.13,-0.59,9.2,CRISIL Hybrid 35+65 - Aggressive Index,10.5,,,-3.26,46,45,38,43,36,25,,,Union Aggressive Hybrid Fund-Reg(G),Hybrid : Equity Oriented,55,55,55,55,55,54,51,29,-1.66,-2.21,-1.28,0.42,10.31,10.23,12.12,9.63,,,,,,,,
JM Small Cap Fund-Reg(G),48452,JM Financial Mutual Fund,-9.62,-8.68,-1.23,,Nifty Smallcap 250 - TRI,,,,-8.51,17,16,23,11,,,,,JM Small Cap Fund-Reg(G),Equity : Small Cap,29,29,29,28,27,23,19,13,-8.07,-9.09,-7.32,-2.37,12.26,18.09,26.94,16.48,,,,,,,,
Aditya Birla SL Equity Savings Fund-Reg(G),30757,Aditya Birla Sun Life Mutual Fund,-0.05,1.1,2.53,8.17,NIFTY 50 Equity Savings Index - TRI,6.25,7.91,7.36,0.48,6,8,6,12,41,51,45,25,Aditya Birla SL Equity Savings Fund-Reg(G),Hybrid : Equity Oriented,55,55,55,55,55,54,51,29,-1.66,-2.21,-1.28,0.42,10.31,10.23,12.12,9.63,,,,,,,,
Mahindra Manulife Low Duration Fund-Reg(G),36894,Mahindra Manulife Mutual Fund,0.57,1.61,3.39,7.14,CRISIL Low Duration Debt Index,5.98,5.38,,0.67,20,20,18,19,17,19,19,,Mahindra Manulife Low Duration Fund-Reg(G),Debt : Low Duration,20,20,20,20,20,20,20,18,0.73,0.63,1.68,3.52,7.38,6.24,5.98,6.48,0.65,1.85,3.8,,,,,7.64
Canara Rob Overnight Fund-Reg(G),43350,Canara Robeco Mutual Fund,0.55,1.62,3.24,6.58,CRISIL Liquid Overnight Index,6.06,4.92,,0.65,21,22,21,23,23,10,5,,Canara Rob Overnight Fund-Reg(G),Debt : Overnight,35,35,35,35,35,28,27,3,0.63,0.54,1.61,3.23,6.57,6.03,4.87,5.61,0.56,1.66,3.3,,,,,6.53
360 ONE Quant Fund-Reg(G),46015,360 ONE Mutual Fund,-5.7,-4.33,-6.9,11.67,BSE 200 - TRI,21.16,,,-4.0,36,48,35,47,28,8,,,360 ONE Quant Fund-Reg(G),Equity : Thematic,89,89,80,71,56,36,20,9,-5.1,-5.97,-5.34,-4.72,11.49,15.97,20.38,12.86,-1.58,-5.11,-2.94,9.57,13.58,17.39,,-25.19
Baroda BNP Paribas Overnight Fund-Reg(G),43376,Baroda BNP Paribas Mutual Fund,0.55,1.63,3.26,6.63,CRISIL Liquid Overnight Index,6.06,4.91,,0.66,5,7,12,10,13,6,7,,Baroda BNP Paribas Overnight Fund-Reg(G),Debt : Overnight,35,35,35,35,35,28,27,3,0.63,0.54,1.61,3.23,6.57,6.03,4.87,5.61,0.56,1.66,3.3,,,,,6.53
ICICI Pru Nifty Midcap 150 Index Fund-Reg(G),46108,ICICI Prudential Mutual Fund,-6.71,-4.35,-3.93,11.27,Nifty Midcap 150 - TRI,19.64,,,-6.44,120,120,96,70,28,4,,,ICICI Pru Nifty Midcap 150 Index Fund-Reg(G),Equity : Index Funds,175,175,161,132,108,56,30,18,-4.24,-5.01,-4.81,-3.99,9.79,13.41,15.97,10.86,,,,,,,,
HDFC MNC Fund-Reg(G),47648,HDFC Mutual Fund,-7.28,-8.34,-10.99,3.29,NIFTY MNC - TRI,,,,-6.18,5,5,5,5,5,,,,HDFC MNC Fund-Reg(G),Equity : Thematic - MNC,6,6,6,5,5,4,4,3,-4.9,-6.1,-5.98,-6.95,7.63,10.34,14.09,9.72,,,,,,,,
PGIM India Large and Mid Cap Fund(G),48543,PGIM India Mutual Fund,-4.61,-0.94,1.05,,NIFTY LargeMidcap 250 - TRI,,,,-4.09,9,7,1,3,,,,,PGIM India Large and Mid Cap Fund(G),Equity : Large & Mid Cap,31,31,31,29,27,26,25,18,-5.39,-6.01,-4.07,-2.09,14.36,15.64,19.14,13.46,,,,,,,,
Quant BFSI Fund-Reg(G),47989,Quant Mutual Fund,-5.01,-4.37,-9.16,-3.39,Nifty Financial Services - TRI,,,,-2.94,16,19,13,21,18,,,,Quant BFSI Fund-Reg(G),Equity : Sectoral - Financial Services,21,21,21,21,18,14,11,8,-1.8,-2.8,-3.98,1.37,9.93,12.8,12.16,10.94,,,,,,,,
DSP Floater Fund-Reg(G),45396,DSP Mutual Fund,0.79,1.82,4.01,8.9,CRISIL Short Duration Debt Index,6.95,,,0.87,4,4,3,1,1,3,,,DSP Floater Fund-Reg(G),Debt : Floater,12,12,12,12,12,12,7,5,0.8,0.71,1.7,3.73,8.19,6.7,6.39,7.04,,,,,,,,
Samco Dynamic Asset Allocation Fund-Reg(G),48331,Samco Mutual Fund,-5.54,-3.07,-4.06,2.87,NIFTY 50 Hybrid Composite Debt 50:50 Index,,,,-5.13,31,32,30,29,28,,,,Samco Dynamic Asset Allocation Fund-Reg(G),Hybrid : Dynamic Asset Allocation,33,33,33,33,30,22,19,11,-1.9,-2.41,-1.65,-0.51,8.86,10.83,11.46,9.11,,,,,,,,
Kotak Technology Fund-Reg(G),48587,Kotak Mahindra Mutual Fund,-3.76,1.88,6.99,,BSE TECk Index - TRI,,,,-2.86,5,5,7,6,,,,,Kotak Technology Fund-Reg(G),Equity : Sectoral - Technology,12,12,12,9,7,5,5,4,-4.36,-5.35,1.98,6.6,17.25,12.5,26.05,16.98,-1.55,0.77,7.44,14.37,9.33,21.19,,-10.65
Motilal Oswal Nifty Bank Index Fund-Reg(G),43789,Motilal Oswal Mutual Fund,-1.35,-3.77,0.28,9.75,NIFTY BANK - TRI,8.9,9.63,,-1.03,56,39,71,11,52,55,30,,Motilal Oswal Nifty Bank Index Fund-Reg(G),Equity : Index Funds,175,175,161,132,108,56,30,18,-4.24,-5.01,-4.81,-3.99,9.79,13.41,15.97,10.86,,,,,,,,
HDFC Nifty G-Sec Sep 2032 Index Fund-Reg(G),46872,HDFC Mutual Fund,1.13,2.23,4.23,9.15,Nifty G-Sec Sep 2032 Index,,,,1.18,2,3,3,5,3,,,,HDFC Nifty G-Sec Sep 2032 Index Fund-Reg(G),Debt : Gilt,36,36,36,36,35,23,21,21,0.95,0.86,1.63,3.54,8.0,6.51,6.18,6.91,,,,,,,,
Samco Flexi Cap Fund-Reg(G),46217,Samco Mutual Fund,-16.18,-12.43,-12.5,-12.5,NIFTY 500 - TRI,1.18,,,-16.15,48,48,48,47,47,34,,,Samco Flexi Cap Fund-Reg(G),Equity : Flexi Cap,48,48,48,48,47,34,26,20,-4.64,-5.48,-4.2,-2.15,12.96,13.66,17.23,12.69,,,,,,,,
Baroda BNP Paribas Business Cycle Fund-Reg(G),45686,Baroda BNP Paribas Mutual Fund,-6.42,-5.16,-4.44,9.51,BSE 500 - TRI,14.69,,,-6.05,60,60,41,35,36,18,,,Baroda BNP Paribas Business Cycle Fund-Reg(G),Equity : Thematic,89,89,80,71,56,36,20,9,-5.1,-5.97,-5.34,-4.72,11.49,15.97,20.38,12.86,-2.37,-5.86,-3.43,8.91,13.88,18.0,,-35.26
Invesco India Aggressive Hybrid Fund-Reg(G),39893,Invesco Mutual Fund,-4.4,-1.35,3.85,19.23,CRISIL Hybrid 35+65 - Aggressive Index,14.61,14.12,,-4.22,50,47,27,2,1,5,15,,Invesco India Aggressive Hybrid Fund-Reg(G),Hybrid : Equity Oriented,55,55,55,55,55,54,51,29,-1.66,-2.21,-1.28,0.42,10.31,10.23,12.12,9.63,,,,,,,,
Franklin India Banking & PSU Debt Fund(G),28458,Franklin Templeton Mutual Fund,0.66,1.75,3.63,7.64,NIFTY Banking and PSU Debt Index,6.19,5.97,7.1,0.77,25,24,14,19,17,11,11,9,Franklin India Banking & PSU Debt Fund(G),Debt : Banking & PSU,26,26,26,26,26,21,16,15,0.87,0.76,1.75,3.69,7.71,6.23,6.21,7.09,,,,,,,,
Kotak Nifty SDL Plus AAA PSU Bond Jul 2028 60:40 Index Fund-Reg(G),46730,Kotak Mahindra Mutual Fund,0.9,1.85,3.76,8.11,Nifty SDL Plus AAA PSU Bond Jul 2028 60:40 Index,,,,0.97,24,26,28,11,26,,,,Kotak Nifty SDL Plus AAA PSU Bond Jul 2028 60:40 Index Fund-Reg(G),Debt : Medium to Long Duration,59,59,56,52,52,16,11,11,0.95,0.89,1.85,3.68,8.03,6.31,6.03,6.12,,,,,,,,
Nippon India Nifty 500 Momentum 50 Index Fund-Reg(G),49162,Nippon India Mutual Fund,-11.4,-13.39,,,Nifty500 Momentum 50 - TRI,,,,-11.26,169,170,160,,,,,,Nippon India Nifty 500 Momentum 50 Index Fund-Reg(G),Equity : Index Funds,175,175,161,132,108,56,30,18,-4.24,-5.01,-4.81,-3.99,9.79,13.41,15.97,10.86,,,,,,,,
Mahindra Manulife Large Cap Fund-Reg(G),38073,Mahindra Manulife Mutual Fund,-1.83,-2.45,-3.93,10.99,NIFTY 100 - TRI,11.28,15.1,,-0.66,4,2,9,28,23,22,18,,Mahindra Manulife Large Cap Fund-Reg(G),Equity : Large Cap,38,38,38,37,36,34,31,28,-2.54,-3.56,-3.46,-2.73,10.97,12.57,15.55,11.28,,,,,,,,
PGIM India Large Cap Fund(G),758,PGIM India Mutual Fund,-2.07,-0.51,-1.11,9.97,NIFTY 100 - TRI,9.84,12.52,9.52,-1.37,11,8,3,9,25,31,27,26,PGIM India Large Cap Fund(G),Equity : Large Cap,38,38,38,37,36,34,31,28,-2.54,-3.56,-3.46,-2.73,10.97,12.57,15.55,11.28,,,,,,,,
Union Business Cycle Fund-Reg(G),48599,Union Mutual Fund,-6.12,-4.77,-5.11,,NIFTY 500 - TRI,,,,-6.24,64,57,37,38,,,,,Union Business Cycle Fund-Reg(G),Equity : Thematic,89,89,80,71,56,36,20,9,-5.1,-5.97,-5.34,-4.72,11.49,15.97,20.38,12.86,,,,,,,,
HSBC Credit Risk Fund-Reg(G),8016,HSBC Mutual Fund,0.72,1.76,3.43,7.25,NIFTY Credit Risk Bond Index,5.92,5.43,6.1,0.81,12,11,7,11,13,12,11,8,HSBC Credit Risk Fund-Reg(G),Debt : Credit Risk,15,15,15,15,15,15,15,11,0.89,0.74,1.7,3.81,7.93,8.93,6.56,6.51,,,,,,,,
Bank of India Business Cycle Fund-Reg(G),48964,Bank of India Mutual Fund,-10.24,-10.78,,,NIFTY 500 - TRI,,,,-9.78,80,79,77,,,,,,Bank of India Business Cycle Fund-Reg(G),Equity : Thematic,89,89,80,71,56,36,20,9,-5.1,-5.97,-5.34,-4.72,11.49,15.97,20.38,12.86,,,,,,,,
Axis Nifty 50 Index Fund-Reg(G),45701,Axis Mutual Fund,-1.2,-2.07,-1.22,9.68,NIFTY 50 - TRI,11.34,,,-0.09,25,11,28,27,57,35,,,Axis Nifty 50 Index Fund-Reg(G),Equity : Index Funds,175,175,161,132,108,56,30,18,-4.24,-5.01,-4.81,-3.99,9.79,13.41,15.97,10.86,,,,,,,,
ICICI Pru Nifty IT Index Fund-Reg(G),46707,ICICI Prudential Mutual Fund,-1.45,6.41,12.23,16.79,NIFTY IT - TRI,,,,-0.28,48,52,3,3,3,,,,ICICI Pru Nifty IT Index Fund-Reg(G),Equity : Index Funds,175,175,161,132,108,56,30,18,-4.24,-5.01,-4.81,-3.99,9.79,13.41,15.97,10.86,,,,,,,,
Motilal Oswal Nifty 50 Index Fund-Reg(G),44366,Motilal Oswal Mutual Fund,-1.21,-2.1,-1.34,9.53,NIFTY 50 - TRI,11.24,15.11,,-0.1,32,22,35,37,65,38,15,,Motilal Oswal Nifty 50 Index Fund-Reg(G),Equity : Index Funds,175,175,161,132,108,56,30,18,-4.24,-5.01,-4.81,-3.99,9.79,13.41,15.97,10.86,,,,,,,,
Mahindra Manulife Equity Savings Fund-Reg(G),36671,Mahindra Manulife Mutual Fund,-0.77,-0.48,0.51,6.53,NIFTY 50 Equity Savings Index - TRI,7.96,10.67,,-0.39,18,15,23,31,49,44,33,,Mahindra Manulife Equity Savings Fund-Reg(G),Hybrid : Equity Oriented,55,55,55,55,55,54,51,29,-1.66,-2.21,-1.28,0.42,10.31,10.23,12.12,9.63,,,,,,,,
Sundaram Money Market Fund-Reg(G),39625,Sundaram Mutual Fund,0.63,1.75,3.6,7.49,Nifty Money Market Index,6.52,5.56,,0.75,9,9,10,12,11,10,11,,Sundaram Money Market Fund-Reg(G),Debt : Money Market,22,22,22,22,22,19,16,13,0.72,0.62,1.72,3.54,7.4,6.47,5.72,6.59,,,,,,,,
SBI FMP-67-1467D-Reg(G),46703,SBI Mutual Fund,0.71,1.77,3.63,7.9,CRISIL Medium to Long Term Debt Index,,,,0.9,28,39,30,34,36,,,,SBI FMP-67-1467D-Reg(G),Debt : FTP/FMP,92,92,91,91,91,42,17,12,0.84,0.72,1.75,3.58,7.75,6.33,5.61,6.0,,,,,,,,
Tata Housing Opportunities Fund-Reg(G),46764,Tata Mutual Fund,-7.72,-8.28,-7.63,6.3,Nifty Housing - TRI,,,,-7.03,71,69,66,54,42,,,,Tata Housing Opportunities Fund-Reg(G),Equity : Thematic,89,89,80,71,56,36,20,9,-5.1,-5.97,-5.34,-4.72,11.49,15.97,20.38,12.86,,,,,,,,
Edelweiss Equity Savings Fund-Reg(G),30730,Edelweiss Mutual Fund,-0.76,1.32,3.64,11.15,NIFTY 50 Equity Savings Index,9.54,10.46,8.53,-0.25,17,14,3,3,27,33,35,19,Edelweiss Equity Savings Fund-Reg(G),Hybrid : Equity Oriented,55,55,55,55,55,54,51,29,-1.66,-2.21,-1.28,0.42,10.31,10.23,12.12,9.63,,,,,,,,
Kotak Global Innovation FoF-Reg(G),45334,Kotak Mahindra Mutual Fund,2.78,5.72,21.35,20.79,MSCI AC World Index,9.84,,,4.58,27,46,30,21,33,23,,,Kotak Global Innovation FoF-Reg(G),FoFs : Overseas,58,58,58,58,57,48,27,24,4.76,4.64,6.57,18.39,23.28,9.57,9.02,7.33,,,,,,,,
Nippon India Silver ETF FOF-Reg(G),46198,Nippon India Mutual Fund,8.28,1.26,17.44,33.53,Silver,13.97,,,9.6,4,6,21,3,4,13,,,Nippon India Silver ETF FOF-Reg(G),FoFs : Domestic,61,62,61,59,55,46,27,23,-0.13,-0.76,-0.9,2.66,14.18,12.14,12.79,9.72,,,,,,,,
Motilal Oswal Nifty Midcap 100 ETF,13595,Motilal Oswal Mutual Fund,-6.44,-3.38,-2.82,12.51,Nifty Midcap 100 - TRI,21.83,25.08,15.31,-6.43,146,138,89,90,46,9,3,2,Motilal Oswal Nifty Midcap 100 ETF,Equity : ETFs,171,171,169,157,145,97,63,25,-2.48,-3.34,-3.07,-1.08,12.77,14.56,16.96,11.23,,,,,,,,
Bandhan CRISIL IBX 90:10 SDL Plus Gilt - April 2032 Index Fund-Reg(G),46814,Bandhan Mutual Fund,0.89,1.78,4.47,9.6,CRISIL IBX 90:10 SDL Plus Gilt Index - April 2032,,,,1.12,6,12,13,3,4,,,,Bandhan CRISIL IBX 90:10 SDL Plus Gilt - April 2032 Index Fund-Reg(G),Debt : Long Duration,26,26,24,24,21,3,3,2,1.0,0.88,1.66,3.91,8.92,6.95,5.89,6.73,,,,,,,,
Mahindra Manulife Multi Asset Allocation Fund-Reg(G),48449,Mahindra Manulife Mutual Fund,0.45,-0.16,2.66,,NIFTY 500 - TRI,,,,1.1,7,9,10,11,,,,,Mahindra Manulife Multi Asset Allocation Fund-Reg(G),Hybrid : Multi Asset Allocation,28,28,26,25,20,10,7,7,-0.37,-1.04,-1.13,1.57,12.51,13.32,17.17,11.66,,,,,,,,
UTI BSE Low Volatility Index Fund-Reg(G),46409,UTI Mutual Fund,-1.47,-2.44,-5.47,5.35,BSE Low Volatility Index - TRI,,,,-0.17,42,55,46,92,98,,,,UTI BSE Low Volatility Index Fund-Reg(G),Equity : Index Funds,175,175,161,132,108,56,30,18,-4.24,-5.01,-4.81,-3.99,9.79,13.41,15.97,10.86,-0.61,-3.55,-5.14,,,,,-4.5
Baroda BNP Paribas Money Market Fund-Reg(G),25167,Baroda BNP Paribas Mutual Fund,0.62,1.73,3.57,7.38,CRISIL Money Market Index,6.24,5.08,,0.74,13,14,14,14,15,16,16,,Baroda BNP Paribas Money Market Fund-Reg(G),Debt : Money Market,22,22,22,22,22,19,16,13,0.72,0.62,1.72,3.54,7.4,6.47,5.72,6.59,,,,,,,,
HSBC Low Duration Fund-Reg(G),13350,HSBC Mutual Fund,0.61,1.64,3.48,7.45,NIFTY Low Duration Debt Index,6.31,5.71,6.68,0.71,14,15,14,13,5,5,13,10,HSBC Low Duration Fund-Reg(G),Debt : Low Duration,20,20,20,20,20,20,20,18,0.73,0.63,1.68,3.52,7.38,6.24,5.98,6.48,,,,,,,,
Canara Rob Ultra Short Term Fund-Reg(G),5902,Canara Robeco Mutual Fund,0.56,1.56,3.28,6.76,CRISIL Ultra Short Term Debt Index,5.81,4.85,5.79,0.67,22,23,22,20,20,21,20,11,Canara Rob Ultra Short Term Fund-Reg(G),Debt : Ultra Short Duration,26,26,25,24,24,24,22,13,0.69,0.59,1.65,3.41,7.1,6.12,5.37,6.21,0.62,1.83,3.76,,,,,7.38
Bank of India Mfg & Infra Fund-Reg(G),8484,Bank of India Mutual Fund,-5.74,-6.0,-5.79,14.15,BSE India Infrastructure Index - TRI,21.06,27.01,15.18,-4.26,2,4,1,2,4,12,3,3,Bank of India Mfg & Infra Fund-Reg(G),Equity : Sectoral - Infrastructure,20,20,19,19,19,19,19,18,-7.86,-8.42,-8.97,-9.86,10.47,21.91,24.02,13.89,-5.6,-13.65,-18.32,,,,,-79.9
Bandhan Transportation and Logistics Fund-Reg(G),46986,Bandhan Mutual Fund,-4.67,-5.49,-8.62,9.98,Nifty Transportation & Logistics - TRI,,,,-2.2,9,9,7,7,6,,,,Bandhan Transportation and Logistics Fund-Reg(G),Equity : Sectoral - Auto,10,10,8,8,6,1,1,1,-0.47,-3.4,-3.33,-6.62,15.21,22.08,21.44,10.98,,,,,,,,
UTI Dynamic Bond Fund-Reg(G),11896,UTI Mutual Fund,0.83,1.68,3.65,7.86,CRISIL Dynamic Bond Index,8.78,8.72,6.65,0.85,17,10,8,7,13,1,1,11,UTI Dynamic Bond Fund-Reg(G),Debt : Dynamic Bond,22,22,22,22,22,22,21,18,0.93,0.82,1.54,3.51,7.83,6.54,6.21,6.72,0.82,1.87,3.99,,,,,9.48
Axis Long Duration Fund-Reg(G),46626,Axis Mutual Fund,0.7,1.03,3.18,8.53,NIFTY Long Duration Debt Index,,,,0.82,24,22,21,22,17,,,,Axis Long Duration Fund-Reg(G),Debt : Long Duration,26,26,24,24,21,3,3,2,1.0,0.88,1.66,3.91,8.92,6.95,5.89,6.73,,,,,,,,
Quantum Liquid Fund-Reg(G),19756,Quantum Mutual Fund,0.56,1.68,3.39,6.99,CRISIL Liquid Debt Index,6.23,5.03,5.79,0.68,36,36,34,34,32,32,31,28,Quantum Liquid Fund-Reg(G),Debt : Liquid,38,38,37,37,37,35,34,29,0.71,0.58,1.73,3.51,7.24,6.43,5.27,6.2,,,,,,,,
Navi Nifty Bank Index Fund-Reg(G),45873,Navi Mutual Fund,-1.34,-3.79,0.27,9.8,NIFTY BANK - TRI,8.78,,,-1.02,54,37,72,12,50,56,,,Navi Nifty Bank Index Fund-Reg(G),Equity : Index Funds,175,175,161,132,108,56,30,18,-4.24,-5.01,-4.81,-3.99,9.79,13.41,15.97,10.86,,,,,,,,
ICICI Pru Nifty FMCG ETF,45651,ICICI Prudential Mutual Fund,-2.46,-3.42,-8.13,4.85,NIFTY FMCG - TRI,16.32,,,-1.67,91,90,92,125,133,29,,,ICICI Pru Nifty FMCG ETF,Equity : ETFs,171,171,169,157,145,97,63,25,-2.48,-3.34,-3.07,-1.08,12.77,14.56,16.96,11.23,,,,,,,,
Bajaj Finserv Consumption Fund-Reg(G),49345,Bajaj Finserv Mutual Fund,-6.09,,,,Nifty India Consumption - TRI,,,,-5.72,17,16,,,,,,,Bajaj Finserv Consumption Fund-Reg(G),Equity : Thematic - Consumption,20,20,18,17,17,13,13,9,-3.85,-4.74,-3.3,-2.4,16.51,16.57,17.58,13.48,,,,,,,,
Union Short Duration Fund-Reg(G),49467,Union Mutual Fund,,,,,CRISIL Short Duration Debt Index,,,,,,,,,,,,,Union Short Duration Fund-Reg(G),Debt : Short Duration,30,30,29,26,25,23,21,19,0.84,0.75,1.74,3.6,7.41,6.38,6.12,6.64,,,,,,,,
ICICI Pru Nifty 10 yr Benchmark G-Sec ETF,47331,ICICI Prudential Mutual Fund,1.38,2.6,4.38,9.35,Nifty 10 yr Benchmark G-Sec,,,,1.36,1,1,1,1,1,,,,ICICI Pru Nifty 10 yr Benchmark G-Sec ETF,Debt : Gilt (10 Yr Constant Duration),6,6,6,6,6,4,4,4,1.18,1.22,2.32,4.17,9.05,7.01,6.28,7.81,1.34,2.64,4.55,9.59,7.41,5.55,,14.99
Motilal Oswal Ultra Short Term Fund-Reg(G),22532,Motilal Oswal Mutual Fund,0.53,1.4,2.86,5.99,CRISIL Ultra Short Term Debt Index,5.26,4.44,3.77,0.59,26,25,25,24,24,24,22,13,Motilal Oswal Ultra Short Term Fund-Reg(G),Debt : Ultra Short Duration,26,26,25,24,24,24,22,13,0.69,0.59,1.65,3.41,7.1,6.12,5.37,6.21,0.62,1.83,3.76,,,,,7.38
Axis Global Innovation FoF-Reg(G),45539,Axis Mutual Fund,4.44,8.43,23.03,23.58,MSCI ACWI Net TRI,12.96,,,3.36,36,28,20,19,25,19,,,Axis Global Innovation FoF-Reg(G),FoFs : Overseas,58,58,58,58,57,48,27,24,4.76,4.64,6.57,18.39,23.28,9.57,9.02,7.33,,,,,,,,
Mirae Asset Nifty 1D Rate Liquid ETF(IDCW),48119,Mirae Asset Mutual Fund,0.51,1.55,3.12,6.37,Nifty 1D Rate Index,,,,0.62,27,29,27,22,20,,,,Mirae Asset Nifty 1D Rate Liquid ETF(IDCW),Debt : ETFs,31,31,30,28,24,14,7,2,0.99,0.95,2.13,3.76,8.1,6.55,5.47,5.92,0.59,1.66,3.3,6.73,6.18,5.01,,6.52
ITI Focused Equity Fund-Reg(G),45722,ITI Mutual Fund,-5.46,-4.52,-1.74,12.12,NIFTY 500 - TRI,,,,-5.39,32,28,30,25,31,,,,ITI Focused Equity Fund-Reg(G),Equity : Flexi Cap,48,48,48,48,47,34,26,20,-4.64,-5.48,-4.2,-2.15,12.96,13.66,17.23,12.69,,,,,,,,
ICICI Pru Nifty Bank Index Fund-Reg(G),45994,ICICI Prudential Mutual Fund,-1.35,-3.8,0.24,10.05,NIFTY BANK - TRI,,,,-1.04,57,40,75,14,42,,,,ICICI Pru Nifty Bank Index Fund-Reg(G),Equity : Index Funds,175,175,161,132,108,56,30,18,-4.24,-5.01,-4.81,-3.99,9.79,13.41,15.97,10.86,,,,,,,,
LIC MF Aggressive Hybrid Fund(G),2085,LIC Mutual Fund,-4.49,-4.1,-1.5,11.19,CRISIL Hybrid 35+65 - Aggressive Index,9.68,10.36,7.52,-3.72,47,48,51,47,25,32,36,24,LIC MF Aggressive Hybrid Fund(G),Hybrid : Equity Oriented,55,55,55,55,55,54,51,29,-1.66,-2.21,-1.28,0.42,10.31,10.23,12.12,9.63,,,,,,,,
Invesco India ESG Integration Strategy Fund-Reg(G),45348,Invesco Mutual Fund,-4.67,-2.64,1.23,15.36,NIFTY100 ESG - TRI,9.77,,,-3.46,26,31,18,13,15,30,,,Invesco India ESG Integration Strategy Fund-Reg(G),Equity : Thematic,89,89,80,71,56,36,20,9,-5.1,-5.97,-5.34,-4.72,11.49,15.97,20.38,12.86,,,,,,,,
ICICI Pru Nifty IT ETF,44401,ICICI Prudential Mutual Fund,-1.39,6.61,12.71,17.71,NIFTY IT - TRI,8.92,,,-0.2,63,72,10,11,27,87,,,ICICI Pru Nifty IT ETF,Equity : ETFs,171,171,169,157,145,97,63,25,-2.48,-3.34,-3.07,-1.08,12.77,14.56,16.96,11.23,,,,,,,,
Franklin India Pension Plan(G),3396,Franklin Templeton Mutual Fund,-1.63,0.01,1.33,10.2,CRISIL Short Term Debt Hybrid 60+40 Index,9.31,9.08,7.86,-1.28,18,15,7,18,23,24,24,12,Franklin India Pension Plan(G),Hybrid : Solution Oriented,43,43,42,42,40,37,32,13,-2.21,-2.88,-1.95,0.03,11.42,11.0,12.26,10.07,,,,,,,,
ICICI Pru Nifty 200 Momentum 30 Index Fund-Reg(G),46683,ICICI Prudential Mutual Fund,-8.98,-12.58,-12.86,3.14,Nifty200 Momentum 30 - TRI,,,,-9.03,146,147,156,128,106,,,,ICICI Pru Nifty 200 Momentum 30 Index Fund-Reg(G),Equity : Index Funds,175,175,161,132,108,56,30,18,-4.24,-5.01,-4.81,-3.99,9.79,13.41,15.97,10.86,,,,,,,,
DSP Nifty Bank ETF,46468,DSP Mutual Fund,-1.28,-3.62,0.63,10.6,NIFTY BANK - TRI,,,,-0.95,76,55,104,33,72,,,,DSP Nifty Bank ETF,Equity : ETFs,171,171,169,157,145,97,63,25,-2.48,-3.34,-3.07,-1.08,12.77,14.56,16.96,11.23,,,,,,,,
Nippon India Nifty Next 50 Junior BeES FoF-Reg(G),40664,Nippon India Mutual Fund,-7.48,-8.19,-10.93,15.24,NIFTY NEXT 50,15.34,17.68,,-6.56,56,58,57,57,15,8,4,,Nippon India Nifty Next 50 Junior BeES FoF-Reg(G),FoFs : Domestic,61,62,61,59,55,46,27,23,-0.13,-0.76,-0.9,2.66,14.18,12.14,12.79,9.72,-5.16,-11.0,-9.6,12.52,14.75,17.07,,-69.99
LIC MF Small Cap Fund(G),36914,LIC Mutual Fund,-11.58,-6.33,-1.82,20.42,Nifty Smallcap 250 - TRI,19.04,26.05,,-10.32,25,28,9,13,3,10,10,,LIC MF Small Cap Fund(G),Equity : Small Cap,29,29,29,28,27,23,19,13,-8.07,-9.09,-7.32,-2.37,12.26,18.09,26.94,16.48,,,,,,,,
UTI Nifty 500 Value 50 Index Fund-Reg(G),47577,UTI Mutual Fund,-4.74,-9.02,-10.42,3.78,NIFTY500 Value 50 - TRI,,,,-3.26,80,92,136,121,104,,,,UTI Nifty 500 Value 50 Index Fund-Reg(G),Equity : Index Funds,175,175,161,132,108,56,30,18,-4.24,-5.01,-4.81,-3.99,9.79,13.41,15.97,10.86,,,,,,,,
Bandhan Bond Fund - Income Plan-Reg(G),1090,Bandhan Mutual Fund,0.5,1.06,2.79,6.72,NIFTY Medium to Long Duration Debt Index,5.27,5.23,6.35,0.73,26,26,20,24,21,3,3,2,Bandhan Bond Fund - Income Plan-Reg(G),Debt : Long Duration,26,26,24,24,21,3,3,2,1.0,0.88,1.66,3.91,8.92,6.95,5.89,6.73,,,,,,,,
SBI Silver ETF,48967,SBI Mutual Fund,8.6,1.58,18.73,,Silver,,,,9.91,29,27,25,28,,,,,SBI Silver ETF,Gold : ETFs,31,31,31,29,27,14,11,11,10.47,8.95,5.25,20.35,34.43,18.63,15.09,10.27,,,,,,,,
LIC MF Dividend Yield Fund-Reg(G),41332,LIC Mutual Fund,-7.0,-5.97,-4.7,15.66,NIFTY 500 - TRI,18.3,20.72,,-5.41,10,10,7,5,2,3,4,,LIC MF Dividend Yield Fund-Reg(G),Equity : Thematic - Dividend Yield,10,10,10,9,9,8,6,5,-3.16,-4.14,-5.0,-4.7,10.35,17.6,21.68,13.32,,,,,,,,
Franklin India Overnight Fund(G),43438,Franklin Templeton Mutual Fund,0.55,1.64,3.25,6.6,Nifty 1D Rate Index,6.03,4.84,,0.66,8,4,5,13,17,16,23,,Franklin India Overnight Fund(G),Debt : Overnight,35,35,35,35,35,28,27,3,0.63,0.54,1.61,3.23,6.57,6.03,4.87,5.61,0.59,1.66,3.3,6.73,6.18,5.01,,6.52
JM Large Cap Fund-Reg(G),1858,JM Financial Mutual Fund,-4.02,-6.08,-7.34,6.07,BSE 100 - TRI,14.25,16.76,9.93,-3.82,31,25,34,34,32,8,6,24,JM Large Cap Fund-Reg(G),Equity : Large Cap,38,38,38,37,36,34,31,28,-2.54,-3.56,-3.46,-2.73,10.97,12.57,15.55,11.28,-0.86,-4.22,-1.84,10.11,13.07,16.59,,-16.4
TRUSTMF Small Cap Fund-Reg(G),48991,Trust Mutual Fund,-10.59,-2.68,,,Nifty Smallcap 250 - TRI,,,,-9.29,21,23,2,,,,,,TRUSTMF Small Cap Fund-Reg(G),Equity : Small Cap,29,29,29,28,27,23,19,13,-8.07,-9.09,-7.32,-2.37,12.26,18.09,26.94,16.48,,,,,,,,
LIC MF ULIS,2154,LIC Mutual Fund,-1.7,-0.13,0.14,12.12,CRISIL Hybrid 35+65 - Aggressive Index,8.94,11.5,8.95,-1.03,13,16,9,24,14,26,16,9,LIC MF ULIS,Hybrid : Solution Oriented,43,43,42,42,40,37,32,13,-2.21,-2.88,-1.95,0.03,11.42,11.0,12.26,10.07,,,,,,,,
Motilal Oswal Nifty 500 Momentum 50 Index Fund-Reg(G),48961,Motilal Oswal Mutual Fund,-11.44,-13.31,,,Nifty500 Momentum 50 - TRI,,,,-11.29,171,172,159,,,,,,Motilal Oswal Nifty 500 Momentum 50 Index Fund-Reg(G),Equity : Index Funds,175,175,161,132,108,56,30,18,-4.24,-5.01,-4.81,-3.99,9.79,13.41,15.97,10.86,,,,,,,,
Aditya Birla SL Silver ETF,46194,Aditya Birla Sun Life Mutual Fund,8.66,1.38,18.91,34.82,Silver,15.43,,,9.98,20,19,28,21,7,13,,,Aditya Birla SL Silver ETF,Gold : ETFs,31,31,31,29,27,14,11,11,10.47,8.95,5.25,20.35,34.43,18.63,15.09,10.27,,,,,,,,
Invesco India Short Duration Fund(G),2262,Invesco Mutual Fund,0.83,1.85,3.65,8.0,Nifty Short Duration Debt Index,5.8,5.67,6.39,0.93,7,2,9,15,3,19,17,12,Invesco India Short Duration Fund(G),Debt : Short Duration,30,30,29,26,25,23,21,19,0.84,0.75,1.74,3.6,7.41,6.38,6.12,6.64,,,,,,,,
Mirae Asset Nifty Next 50 ETF,44314,Mirae Asset Mutual Fund,-7.45,-8.1,-9.52,15.7,NIFTY NEXT 50 - TRI,15.71,17.95,,-6.51,151,154,143,140,41,36,23,,Mirae Asset Nifty Next 50 ETF,Equity : ETFs,171,171,169,157,145,97,63,25,-2.48,-3.34,-3.07,-1.08,12.77,14.56,16.96,11.23,,,,,,,,
ICICI Pru Nifty Smallcap 250 Index Fund(G),45684,ICICI Prudential Mutual Fund,-10.45,-9.13,-5.33,5.5,Nifty Smallcap 250 - TRI,16.58,,,-9.38,160,166,143,91,94,6,,,ICICI Pru Nifty Smallcap 250 Index Fund(G),Equity : Index Funds,175,175,161,132,108,56,30,18,-4.24,-5.01,-4.81,-3.99,9.79,13.41,15.97,10.86,,,,,,,,
SBI FMP-42-1857D-Reg(G),45447,SBI Mutual Fund,0.68,1.71,3.56,7.76,CRISIL Medium to Long Term Debt Index,6.14,,,0.87,50,50,61,53,44,26,,,SBI FMP-42-1857D-Reg(G),Debt : FTP/FMP,92,92,91,91,91,42,17,12,0.84,0.72,1.75,3.58,7.75,6.33,5.61,6.0,,,,,,,,
HDFC Nifty LargeMidcap 250 Index Fund-Reg(G),48969,HDFC Mutual Fund,-4.56,-3.7,,,NIFTY LargeMidcap 250 - TRI,,,,-3.89,92,88,67,,,,,,HDFC Nifty LargeMidcap 250 Index Fund-Reg(G),Equity : Index Funds,175,175,161,132,108,56,30,18,-4.24,-5.01,-4.81,-3.99,9.79,13.41,15.97,10.86,,,,,,,,
Axis Nifty Smallcap 50 Index Fund-Reg(G),45856,Axis Mutual Fund,-8.46,-7.9,-2.1,8.47,Nifty Smallcap 50 - TRI,,,,-7.89,138,142,118,49,81,,,,Axis Nifty Smallcap 50 Index Fund-Reg(G),Equity : Index Funds,175,175,161,132,108,56,30,18,-4.24,-5.01,-4.81,-3.99,9.79,13.41,15.97,10.86,,,,,,,,
Axis CRISIL IBX 70:30 CPSE Plus SDL April 2025 Index Fund-Reg(G),45992,Axis Mutual Fund,0.63,1.71,3.52,7.43,CRISIL IBX 70:30 CPSE Plus SDL - April 2025,5.74,,,0.73,25,26,20,22,22,12,,,Axis CRISIL IBX 70:30 CPSE Plus SDL April 2025 Index Fund-Reg(G),Debt : Medium Duration,29,29,29,29,29,16,12,11,0.88,0.79,1.8,3.71,7.8,6.55,6.04,6.65,,,,,,,,
HDFC BSE Sensex ETF,34084,HDFC Mutual Fund,-1.17,-1.45,-0.28,10.35,BSE SENSEX - TRI,11.43,15.0,,-0.06,47,32,32,44,83,67,50,,HDFC BSE Sensex ETF,Equity : ETFs,171,171,169,157,145,97,63,25,-2.48,-3.34,-3.07,-1.08,12.77,14.56,16.96,11.23,0.17,-2.81,-0.29,9.47,11.38,14.95,,-5.28
Mirae Asset Gold ETF,47117,Mirae Asset Mutual Fund,9.16,7.71,21.02,34.03,Gold-India,,,,10.66,14,13,8,11,20,,,,Mirae Asset Gold ETF,Gold : ETFs,31,31,31,29,27,14,11,11,10.47,8.95,5.25,20.35,34.43,18.63,15.09,10.27,,,,,,,,
