HDFC Nifty G-Sec Sep 2032 Index Fund-Reg(G),46872,HDFC Mutual Fund,1.04,1.61,4.87,9.4,Nifty G-Sec Sep 2032 Index,,,,9.14,8,6,6,3,9,,,,HDFC Nifty G-Sec Sep 2032 Index Fund-Reg(G),Debt : Gilt,35,36,36,36,35,23,21,21,8.48,0.89,1.4,4.24,8.85,5.91,6.5,7.12,,,,,,,,
DSP Gold ETF,47938,DSP Mutual Fund,2.48,4.6,7.08,22.44,Gold-India,,,,19.13,12,12,8,12,12,,,,DSP Gold ETF,Gold : ETFs,25,31,29,28,25,11,11,11,18.87,1.56,3.36,5.0,21.48,15.11,14.03,9.91,,,,,,,,
Baroda BNP Paribas Business Cycle Fund-Reg(G),45686,Baroda BNP Paribas Mutual Fund,5.18,-3.19,3.61,24.47,BSE 500 - TRI,18.81,,,21.86,30,33,29,29,29,16,,,Baroda BNP Paribas Business Cycle Fund-Reg(G),Equity : Thematic,56,80,76,64,54,36,18,9,23.24,5.19,-3.36,2.84,25.08,19.14,23.06,14.72,3.22,-4.77,2.44,19.32,16.79,19.39,,18.03
PGIM India Large and Mid Cap Fund(G),48543,PGIM India Mutual Fund,6.81,-1.13,6.62,,NIFTY LargeMidcap 250 - TRI,,,,,,8,10,9,,,,,PGIM India Large and Mid Cap Fund(G),Equity : Large & Mid Cap,27,31,30,29,26,26,24,18,25.81,6.08,-1.98,5.44,27.68,19.37,21.61,15.36,,,,,,,,
Mahindra Manulife Large Cap Fund-Reg(G),38073,Mahindra Manulife Mutual Fund,3.51,-5.23,2.12,17.8,NIFTY 100 - TRI,13.47,15.71,,14.81,27,27,31,27,22,24,21,,Mahindra Manulife Large Cap Fund-Reg(G),Equity : Large Cap,36,38,38,37,36,34,31,28,17.34,3.93,-4.1,3.37,19.86,15.23,16.7,12.96,,,,,,,,
Mahindra Manulife Low Duration Fund-Reg(G),36894,Mahindra Manulife Mutual Fund,0.52,1.77,3.52,7.2,CRISIL Low Duration Debt Index,5.79,5.39,,6.94,17,12,14,17,17,18,20,,Mahindra Manulife Low Duration Fund-Reg(G),Debt : Low Duration,20,20,20,20,20,20,20,18,7.16,0.51,1.8,3.62,7.4,6.04,5.99,6.5,0.6,1.89,3.88,,,,,7.79
PGIM India Large Cap Fund(G),758,PGIM India Mutual Fund,4.84,-5.15,2.97,13.24,NIFTY 100 - TRI,11.53,13.12,10.95,10.76,36,9,30,22,36,31,30,27,PGIM India Large Cap Fund(G),Equity : Large Cap,36,38,38,37,36,34,31,28,17.34,3.93,-4.1,3.37,19.86,15.23,16.7,12.96,,,,,,,,
Kotak Nifty SDL Plus AAA PSU Bond Jul 2028 60:40 Index Fund-Reg(G),46730,Kotak Mahindra Mutual Fund,0.68,1.83,4.42,8.4,Nifty SDL Plus AAA PSU Bond Jul 2028 60:40 Index,,,,8.12,14,28,6,15,21,,,,Kotak Nifty SDL Plus AAA PSU Bond Jul 2028 60:40 Index Fund-Reg(G),Debt : Medium to Long Duration,52,57,53,52,52,15,11,11,7.95,0.7,1.68,4.22,8.26,5.62,6.18,6.25,,,,,,,,
Kotak Technology Fund-Reg(G),48587,Kotak Mahindra Mutual Fund,8.64,3.58,26.26,,BSE TECk Index - TRI,,,,,,9,7,4,,,,,Kotak Technology Fund-Reg(G),Equity : Sectoral - Technology,7,12,9,9,7,5,5,4,31.58,9.81,4.6,22.54,31.59,13.15,29.14,18.79,6.61,2.95,21.79,28.81,10.07,22.98,,28.62
Motilal Oswal Nifty 50 Index Fund-Reg(G),44366,Motilal Oswal Mutual Fund,3.13,-4.64,2.93,13.6,NIFTY 50 - TRI,13.15,,,10.84,87,128,85,63,85,38,,,Motilal Oswal Nifty 50 Index Fund-Reg(G),Equity : Index Funds,105,161,140,125,103,51,28,18,20.36,5.49,-3.55,2.97,22.6,16.34,16.95,12.34,,,,,,,,
ICICI Pru Nifty Midcap 150 Index Fund-Reg(G),46108,ICICI Prudential Mutual Fund,7.66,-2.28,3.62,27.16,Nifty Midcap 150 - TRI,,,,25.62,41,40,44,43,39,,,,ICICI Pru Nifty Midcap 150 Index Fund-Reg(G),Equity : Index Funds,105,161,140,125,103,51,28,18,20.36,5.49,-3.55,2.97,22.6,16.34,16.95,12.34,,,,,,,,
Sundaram Money Market Fund-Reg(G),39625,Sundaram Mutual Fund,0.54,1.81,3.61,7.5,Nifty Money Market Index,6.32,5.51,,7.25,11,10,11,13,11,10,11,,Sundaram Money Market Fund-Reg(G),Debt : Money Market,22,22,22,22,22,19,16,13,7.17,0.54,1.78,3.57,7.42,6.3,5.67,6.6,,,,,,,,
HSBC Equity Savings Fund-Reg(G),15304,HSBC Mutual Fund,6.47,5.15,8.81,24.7,NIFTY 50 Equity Savings Index,14.46,13.95,9.49,24.72,5,3,1,3,5,13,21,20,HSBC Equity Savings Fund-Reg(G),Hybrid : Equity Oriented,55,55,55,55,55,54,51,29,14.77,3.01,-0.76,4.42,15.97,11.85,13.02,10.64,,,,,,,,
Bandhan CRISIL IBX 90:10 SDL Plus Gilt - April 2032 Index Fund-Reg(G),46814,Bandhan Mutual Fund,0.86,1.97,5.17,10.23,CRISIL IBX 90:10 SDL Plus Gilt Index - April 2032,,,,9.89,13,21,5,6,13,,,,Bandhan CRISIL IBX 90:10 SDL Plus Gilt - April 2032 Index Fund-Reg(G),Debt : Long Duration,21,24,24,24,20,3,3,2,9.94,1.0,1.6,4.79,10.26,5.7,6.45,6.86,,,,,,,,
HSBC Credit Risk Fund-Reg(G),8016,HSBC Mutual Fund,0.65,1.63,3.7,7.21,NIFTY Credit Risk Bond Index,5.52,5.52,6.15,6.94,14,8,11,12,14,12,11,7,HSBC Credit Risk Fund-Reg(G),Debt : Credit Risk,15,15,15,15,15,15,15,10,7.84,0.65,1.82,4.05,8.11,8.79,6.48,6.43,,,,,,,,
Franklin India Banking & PSU Debt Fund(G),28458,Franklin Templeton Mutual Fund,0.62,1.82,3.99,7.74,NIFTY Banking and PSU Debt Index,5.85,6.18,7.13,7.49,15,11,6,14,16,10,10,9,Franklin India Banking & PSU Debt Fund(G),Debt : Banking & PSU,26,26,26,26,26,21,16,15,7.56,0.6,1.78,3.98,7.84,5.81,6.33,7.12,,,,,,,,
Mahindra Manulife Equity Savings Fund-Reg(G),36671,Mahindra Manulife Mutual Fund,1.54,-0.69,2.97,9.93,NIFTY 50 Equity Savings Index - TRI,8.82,11.02,,8.79,48,42,32,47,46,43,35,,Mahindra Manulife Equity Savings Fund-Reg(G),Hybrid : Equity Oriented,55,55,55,55,55,54,51,29,14.77,3.01,-0.76,4.42,15.97,11.85,13.02,10.64,,,,,,,,
Tata Housing Opportunities Fund-Reg(G),46764,Tata Mutual Fund,6.21,-5.51,-1.27,16.71,Nifty Housing - TRI,,,,14.61,50,23,56,49,49,,,,Tata Housing Opportunities Fund-Reg(G),Equity : Thematic,56,80,76,64,54,36,18,9,23.24,5.19,-3.36,2.84,25.08,19.14,23.06,14.72,,,,,,,,
Axis Nifty 50 Index Fund-Reg(G),45701,Axis Mutual Fund,3.12,-4.57,3.04,13.76,NIFTY 50 - TRI,13.23,,,11.0,79,134,74,51,79,34,,,Axis Nifty 50 Index Fund-Reg(G),Equity : Index Funds,105,161,140,125,103,51,28,18,20.36,5.49,-3.55,2.97,22.6,16.34,16.95,12.34,,,,,,,,
Invesco India Aggressive Hybrid Fund-Reg(G),39893,Invesco Mutual Fund,6.22,1.74,9.01,29.65,CRISIL Hybrid 35+65 - Aggressive Index,17.21,15.88,,27.77,3,4,4,2,2,5,15,,Invesco India Aggressive Hybrid Fund-Reg(G),Hybrid : Equity Oriented,55,55,55,55,55,54,51,29,14.77,3.01,-0.76,4.42,15.97,11.85,13.02,10.64,,,,,,,,
Union Business Cycle Fund-Reg(G),48599,Union Mutual Fund,5.83,-3.38,1.69,,NIFTY 500 - TRI,,,,,,29,33,37,,,,,Union Business Cycle Fund-Reg(G),Equity : Thematic,56,80,76,64,54,36,18,9,23.24,5.19,-3.36,2.84,25.08,19.14,23.06,14.72,,,,,,,,
SBI FMP-67-1467D-Reg(G),46703,SBI Mutual Fund,0.56,1.71,4.01,7.96,CRISIL Medium to Long Term Debt Index,,,,7.67,38,56,44,35,37,,,,SBI FMP-67-1467D-Reg(G),Debt : FTP/FMP,91,91,91,91,91,40,17,12,7.59,0.6,1.71,3.94,7.85,5.82,5.63,6.04,,,,,,,,
Edelweiss Equity Savings Fund-Reg(G),30730,Edelweiss Mutual Fund,1.85,0.07,4.52,13.18,NIFTY 50 Equity Savings Index,9.72,10.67,8.93,12.59,34,38,18,27,35,39,36,22,Edelweiss Equity Savings Fund-Reg(G),Hybrid : Equity Oriented,55,55,55,55,55,54,51,29,14.77,3.01,-0.76,4.42,15.97,11.85,13.02,10.64,,,,,,,,
ICICI Pru Nifty 10 yr Benchmark G-Sec ETF,47331,ICICI Prudential Mutual Fund,1.04,1.54,4.65,9.19,Nifty 10 yr Benchmark G-Sec,,,,8.88,3,2,3,4,3,,,,ICICI Pru Nifty 10 yr Benchmark G-Sec ETF,Debt : Gilt (10 Yr Constant Duration),6,6,6,6,6,4,4,4,8.9,1.01,1.51,4.64,9.19,5.67,6.63,7.89,0.85,1.13,4.4,9.2,5.74,5.75,,9.51
UTI Dynamic Bond Fund-Reg(G),11896,UTI Mutual Fund,0.88,1.59,4.32,8.68,CRISIL Dynamic Bond Index,8.25,8.41,6.84,8.64,8,11,6,8,13,1,1,9,UTI Dynamic Bond Fund-Reg(G),Debt : Dynamic Bond,22,22,22,22,22,22,21,18,8.36,0.85,1.42,4.2,8.73,6.01,6.42,6.87,0.9,1.85,4.6,,,,,8.67
Nippon India Nifty 500 Momentum 50 Index Fund-Reg(G),49162,Nippon India Mutual Fund,8.18,,,,Nifty500 Momentum 50 - TRI,,,,,,33,,,,,,,Nippon India Nifty 500 Momentum 50 Index Fund-Reg(G),Equity : Index Funds,105,161,140,125,103,51,28,18,20.36,5.49,-3.55,2.97,22.6,16.34,16.95,12.34,,,,,,,,
ICICI Pru Nifty IT Index Fund-Reg(G),46707,ICICI Prudential Mutual Fund,9.86,8.49,31.05,28.75,NIFTY IT - TRI,,,,27.79,25,13,3,4,31,,,,ICICI Pru Nifty IT Index Fund-Reg(G),Equity : Index Funds,105,161,140,125,103,51,28,18,20.36,5.49,-3.55,2.97,22.6,16.34,16.95,12.34,,,,,,,,
Mahindra Manulife Multi Asset Allocation Fund-Reg(G),48449,Mahindra Manulife Mutual Fund,1.91,-0.97,3.42,,NIFTY 500 - TRI,,,,,,20,12,14,,,,,Mahindra Manulife Multi Asset Allocation Fund-Reg(G),Hybrid : Multi Asset Allocation,17,26,26,25,17,10,7,7,16.35,2.98,-1.09,3.77,17.72,14.83,17.81,12.45,,,,,,,,
Motilal Oswal Nifty Midcap 100 ETF,13595,Motilal Oswal Mutual Fund,8.68,-1.65,6.15,29.21,Nifty Midcap 100 - TRI,25.82,28.88,17.39,27.47,36,19,45,34,37,6,3,2,Motilal Oswal Nifty Midcap 100 ETF,Equity : ETFs,141,169,163,154,141,89,61,25,19.33,4.65,-2.61,4.77,21.76,16.68,17.59,12.52,,,,,,,,
Bandhan Transportation and Logistics Fund-Reg(G),46986,Bandhan Mutual Fund,2.26,-9.16,-7.03,24.36,Nifty Transportation & Logistics - TRI,,,,21.74,5,4,3,4,5,,,,Bandhan Transportation and Logistics Fund-Reg(G),Equity : Sectoral - Auto,6,8,8,8,6,1,1,1,25.05,1.92,-9.39,-6.8,28.07,25.4,22.37,12.16,,,,,,,,
UTI BSE Low Volatility Index Fund-Reg(G),46409,UTI Mutual Fund,3.24,-8.0,-1.48,15.83,BSE Low Volatility Index - TRI,,,,11.94,70,118,128,95,66,,,,UTI BSE Low Volatility Index Fund-Reg(G),Equity : Index Funds,105,161,140,125,103,51,28,18,20.36,5.49,-3.55,2.97,22.6,16.34,16.95,12.34,2.62,-8.7,-0.6,,,,,-1.95
Bank of India Mfg & Infra Fund-Reg(G),8484,Bank of India Mutual Fund,6.71,-3.15,2.06,33.26,BSE India Infrastructure Index - TRI,26.2,31.09,17.43,29.95,10,6,7,2,9,14,4,6,Bank of India Mfg & Infra Fund-Reg(G),Equity : Sectoral - Infrastructure,19,19,19,19,19,19,19,18,30.13,6.06,-3.55,-1.2,33.08,28.2,27.82,16.49,1.89,-8.65,-3.67,,,,,-4.62
Edelweiss Overnight Fund-Reg(G),42955,Edelweiss Mutual Fund,0.53,1.58,3.2,6.6,CRISIL Liquid Overnight Index,5.88,4.86,,6.37,25,23,25,24,25,22,8,,Edelweiss Overnight Fund-Reg(G),Debt : Overnight,35,35,35,35,35,27,25,3,6.34,0.53,1.57,3.19,6.6,5.89,4.81,5.65,0.54,1.62,3.27,,,,,6.61
LIC MF Aggressive Hybrid Fund(G),2085,LIC Mutual Fund,4.33,-1.56,4.23,20.05,CRISIL Hybrid 35+65 - Aggressive Index,12.53,12.09,8.79,18.91,11,12,38,31,14,25,29,23,LIC MF Aggressive Hybrid Fund(G),Hybrid : Equity Oriented,55,55,55,55,55,54,51,29,14.77,3.01,-0.76,4.42,15.97,11.85,13.02,10.64,,,,,,,,
Navi Nifty Bank Index Fund-Reg(G),45873,Navi Mutual Fund,3.46,-1.34,3.25,8.87,NIFTY BANK - TRI,,,,6.77,104,106,20,46,102,,,,Navi Nifty Bank Index Fund-Reg(G),Equity : Index Funds,105,161,140,125,103,51,28,18,20.36,5.49,-3.55,2.97,22.6,16.34,16.95,12.34,,,,,,,,
Invesco India ESG Integration Strategy Fund-Reg(G),45348,Invesco Mutual Fund,6.47,-1.02,9.31,26.13,NIFTY100 ESG - TRI,12.45,,,23.55,26,20,18,11,19,31,,,Invesco India ESG Integration Strategy Fund-Reg(G),Equity : Thematic,56,80,76,64,54,36,18,9,23.24,5.19,-3.36,2.84,25.08,19.14,23.06,14.72,,,,,,,,
Franklin India Pension Plan(G),3396,Franklin Templeton Mutual Fund,2.42,0.31,4.86,13.96,CRISIL Short Term Debt Hybrid 60+40 Index,10.29,9.81,8.68,12.74,28,29,10,19,28,25,22,12,Franklin India Pension Plan(G),Hybrid : Solution Oriented,40,42,42,42,39,37,29,13,16.5,3.99,-1.05,5.06,18.07,12.7,13.59,11.24,,,,,,,,
Axis CRISIL IBX 70:30 CPSE Plus SDL April 2025 Index Fund-Reg(G),45992,Axis Mutual Fund,0.53,1.76,3.57,7.41,CRISIL IBX 70:30 CPSE Plus SDL - April 2025,,,,7.2,23,27,11,28,25,,,,Axis CRISIL IBX 70:30 CPSE Plus SDL April 2025 Index Fund-Reg(G),Debt : Medium Duration,30,30,30,30,30,15,13,10,7.57,0.64,1.76,4.01,7.89,6.11,6.1,6.7,,,,,,,,
Nippon India Nifty Next 50 Junior BeES FoF-Reg(G),40664,Nippon India Mutual Fund,5.66,-4.99,-1.19,36.35,NIFTY NEXT 50,20.07,20.58,,32.51,2,6,56,56,1,3,4,,Nippon India Nifty Next 50 Junior BeES FoF-Reg(G),FoFs : Domestic,53,61,60,57,53,41,25,23,15.75,2.77,-0.84,3.91,16.97,12.94,14.04,10.42,4.21,-5.1,-1.27,34.81,19.47,20.09,,33.33
ICICI Pru Nifty Bank Index Fund-Reg(G),45994,ICICI Prudential Mutual Fund,3.45,-1.38,3.23,9.09,NIFTY BANK - TRI,,,,7.0,103,107,22,47,101,,,,ICICI Pru Nifty Bank Index Fund-Reg(G),Equity : Index Funds,105,161,140,125,103,51,28,18,20.36,5.49,-3.55,2.97,22.6,16.34,16.95,12.34,,,,,,,,
UTI Nifty 500 Value 50 Index Fund-Reg(G),47577,UTI Mutual Fund,2.86,-4.83,-4.51,26.92,NIFTY500 Value 50 - TRI,,,,24.71,46,142,91,117,42,,,,UTI Nifty 500 Value 50 Index Fund-Reg(G),Equity : Index Funds,105,161,140,125,103,51,28,18,20.36,5.49,-3.55,2.97,22.6,16.34,16.95,12.34,,,,,,,,
Axis Long Duration Fund-Reg(G),46626,Axis Mutual Fund,1.06,1.2,4.39,11.16,NIFTY Long Duration Debt Index,,,,10.87,4,9,18,21,4,,,,Axis Long Duration Fund-Reg(G),Debt : Long Duration,21,24,24,24,20,3,3,2,9.94,1.0,1.6,4.79,10.26,5.7,6.45,6.86,,,,,,,,
ITI Focused Equity Fund-Reg(G),45722,ITI Mutual Fund,6.41,-0.88,5.52,28.46,NIFTY 500 - TRI,,,,26.95,12,16,11,21,12,,,,ITI Focused Equity Fund-Reg(G),Equity : Flexi Cap,46,48,48,48,46,33,26,19,22.65,5.59,-2.55,5.16,24.67,17.29,19.25,14.36,,,,,,,,
Axis Global Innovation FoF-Reg(G),45539,Axis Mutual Fund,6.46,7.72,8.14,28.21,MSCI ACWI Net TRI,8.55,,,25.55,19,12,20,24,15,16,,,Axis Global Innovation FoF-Reg(G),FoFs : Overseas,57,58,58,58,57,47,27,24,18.86,2.84,5.95,8.0,20.53,6.03,8.48,7.27,,,,,,,,
ICICI Pru Nifty 200 Momentum 30 Index Fund-Reg(G),46683,ICICI Prudential Mutual Fund,4.71,-5.5,-5.3,25.41,Nifty200 Momentum 30 - TRI,,,,24.7,47,80,116,122,47,,,,ICICI Pru Nifty 200 Momentum 30 Index Fund-Reg(G),Equity : Index Funds,105,161,140,125,103,51,28,18,20.36,5.49,-3.55,2.97,22.6,16.34,16.95,12.34,,,,,,,,
DSP Nifty Bank ETF,46468,DSP Mutual Fund,3.51,-1.2,3.63,9.68,NIFTY BANK - TRI,,,,7.54,131,100,40,64,131,,,,DSP Nifty Bank ETF,Equity : ETFs,141,169,163,154,141,89,61,25,19.33,4.65,-2.61,4.77,21.76,16.68,17.59,12.52,,,,,,,,
ICICI Pru Nifty IT ETF,44401,ICICI Prudential Mutual Fund,9.93,8.72,31.67,29.79,NIFTY IT - TRI,9.36,,,28.78,27,8,10,3,26,82,,,ICICI Pru Nifty IT ETF,Equity : ETFs,141,169,163,154,141,89,61,25,19.33,4.65,-2.61,4.77,21.76,16.68,17.59,12.52,,,,,,,,
Quantum Liquid Fund-Reg(G),19756,Quantum Mutual Fund,0.54,1.66,3.37,7.03,CRISIL Liquid Debt Index,6.07,4.98,5.81,6.77,32,35,34,34,32,32,31,28,Quantum Liquid Fund-Reg(G),Debt : Liquid,37,38,37,37,37,35,34,29,6.99,0.55,1.72,3.48,7.27,6.26,5.21,6.22,,,,,,,,
SBI Silver ETF,48967,SBI Mutual Fund,-0.09,1.65,,,Silver,,,,,,25,27,,,,,,SBI Silver ETF,Gold : ETFs,25,31,29,28,25,11,11,11,18.87,1.56,3.36,5.0,21.48,15.11,14.03,9.91,,,,,,,,
LIC MF ULIS,2154,LIC Mutual Fund,4.28,-2.18,3.92,14.32,CRISIL Hybrid 35+65 - Aggressive Index,10.74,12.43,9.94,13.02,26,19,34,23,27,23,18,8,LIC MF ULIS,Hybrid : Solution Oriented,40,42,42,42,39,37,29,13,16.5,3.99,-1.05,5.06,18.07,12.7,13.59,11.24,,,,,,,,
Nippon India Silver ETF FOF-Reg(G),46198,Nippon India Mutual Fund,-0.28,1.94,0.24,18.88,Silver,,,,16.62,24,57,9,50,22,,,,Nippon India Silver ETF FOF-Reg(G),FoFs : Domestic,53,61,60,57,53,41,25,23,15.75,2.77,-0.84,3.91,16.97,12.94,14.04,10.42,,,,,,,,
JM Large Cap Fund-Reg(G),1858,JM Financial Mutual Fund,3.65,-4.4,0.29,20.28,BSE 100 - TRI,17.63,18.24,12.02,17.89,16,25,27,34,16,6,5,22,JM Large Cap Fund-Reg(G),Equity : Large Cap,36,38,38,37,36,34,31,28,17.34,3.93,-4.1,3.37,19.86,15.23,16.7,12.96,2.43,-5.09,2.61,16.6,15.29,17.18,,15.48
Invesco India Short Duration Fund(G),2262,Invesco Mutual Fund,0.65,1.68,3.86,7.93,Nifty Short Duration Debt Index,5.46,5.74,6.45,7.69,6,9,17,19,8,19,16,12,Invesco India Short Duration Fund(G),Debt : Short Duration,25,29,26,26,25,23,21,19,7.18,0.6,1.74,3.86,7.44,6.05,6.14,6.68,,,,,,,,
Aditya Birla SL Silver ETF,46194,Aditya Birla Sun Life Mutual Fund,-0.09,1.94,1.6,19.97,Silver,,,,18.11,18,22,18,20,17,,,,Aditya Birla SL Silver ETF,Gold : ETFs,25,31,29,28,25,11,11,11,18.87,1.56,3.36,5.0,21.48,15.11,14.03,9.91,,,,,,,,
Bandhan Bond Fund - Income Plan-Reg(G),1090,Bandhan Mutual Fund,0.77,1.12,3.68,8.06,NIFTY Medium to Long Duration Debt Index,4.75,5.73,6.54,7.77,21,24,20,24,20,3,3,2,Bandhan Bond Fund - Income Plan-Reg(G),Debt : Long Duration,21,24,24,24,20,3,3,2,9.94,1.0,1.6,4.79,10.26,5.7,6.45,6.86,,,,,,,,
HSBC Low Duration Fund-Reg(G),13350,HSBC Mutual Fund,0.51,1.81,3.61,7.52,NIFTY Low Duration Debt Index,6.13,5.75,6.72,7.24,5,13,8,10,5,4,11,9,HSBC Low Duration Fund-Reg(G),Debt : Low Duration,20,20,20,20,20,20,20,18,7.16,0.51,1.8,3.62,7.4,6.04,5.99,6.5,,,,,,,,
Bajaj Finserv Consumption Fund-Reg(G),49345,Bajaj Finserv Mutual Fund,,,,,Nifty India Consumption - TRI,,,,,,,,,,,,,Bajaj Finserv Consumption Fund-Reg(G),Equity : Thematic - Consumption,16,18,18,17,16,13,13,8,21.52,4.16,-6.41,4.92,25.31,19.22,19.74,14.69,,,,,,,,
Bandhan CRISIL IBX Gilt April 2026 Index Fund-Reg(G),46815,Bandhan Mutual Fund,0.53,1.58,3.63,7.19,CRISIL IBX Gilt Index - April 2026,,,,6.95,35,36,13,36,35,,,,Bandhan CRISIL IBX Gilt April 2026 Index Fund-Reg(G),Debt : Gilt,35,36,36,36,35,23,21,21,8.48,0.89,1.4,4.24,8.85,5.91,6.5,7.12,,,,,,,,
HDFC Nifty LargeMidcap 250 Index Fund-Reg(G),48969,HDFC Mutual Fund,5.54,,,,NIFTY LargeMidcap 250 - TRI,,,,,,67,,,,,,,HDFC Nifty LargeMidcap 250 Index Fund-Reg(G),Equity : Index Funds,105,161,140,125,103,51,28,18,20.36,5.49,-3.55,2.97,22.6,16.34,16.95,12.34,,,,,,,,
HDFC BSE Sensex ETF,34084,HDFC Mutual Fund,3.67,-3.18,4.25,13.7,BSE SENSEX - TRI,13.4,15.32,,10.89,117,76,72,44,117,69,48,,HDFC BSE Sensex ETF,Equity : ETFs,141,169,163,154,141,89,61,25,19.33,4.65,-2.61,4.77,21.76,16.68,17.59,12.52,2.11,-4.6,3.0,12.25,13.0,15.08,,11.32
Motilal Oswal Nifty 500 Momentum 50 Index Fund-Reg(G),48961,Motilal Oswal Mutual Fund,8.18,,,,Nifty500 Momentum 50 - TRI,,,,,,35,,,,,,,Motilal Oswal Nifty 500 Momentum 50 Index Fund-Reg(G),Equity : Index Funds,105,161,140,125,103,51,28,18,20.36,5.49,-3.55,2.97,22.6,16.34,16.95,12.34,,,,,,,,
Baroda BNP Paribas Money Market Fund-Reg(G),25167,Baroda BNP Paribas Mutual Fund,0.53,1.8,3.59,7.33,CRISIL Money Market Index,6.08,5.01,,7.09,16,16,14,14,16,16,16,,Baroda BNP Paribas Money Market Fund-Reg(G),Debt : Money Market,22,22,22,22,22,19,16,13,7.17,0.54,1.78,3.57,7.42,6.3,5.67,6.6,,,,,,,,
LIC MF Dividend Yield Fund-Reg(G),41332,LIC Mutual Fund,5.81,-3.84,5.42,35.74,NIFTY 500 - TRI,22.05,23.49,,34.13,1,1,2,2,1,3,4,,LIC MF Dividend Yield Fund-Reg(G),Equity : Thematic - Dividend Yield,9,10,10,9,9,8,6,5,21.9,3.78,-4.62,2.84,24.09,20.58,23.5,14.55,,,,,,,,
SBI FMP-42-1857D-Reg(G),45447,SBI Mutual Fund,0.56,1.7,3.89,7.8,CRISIL Medium to Long Term Debt Index,5.51,,,7.53,46,52,45,53,45,35,,,SBI FMP-42-1857D-Reg(G),Debt : FTP/FMP,91,91,91,91,91,40,17,12,7.59,0.6,1.71,3.94,7.85,5.82,5.63,6.04,,,,,,,,
Axis Nifty Smallcap 50 Index Fund-Reg(G),45856,Axis Mutual Fund,9.06,-1.54,7.8,30.8,Nifty Smallcap 50 - TRI,,,,27.75,26,21,28,13,19,,,,Axis Nifty Smallcap 50 Index Fund-Reg(G),Equity : Index Funds,105,161,140,125,103,51,28,18,20.36,5.49,-3.55,2.97,22.6,16.34,16.95,12.34,,,,,,,,
Mirae Asset Gold ETF,47117,Mirae Asset Mutual Fund,2.49,4.64,7.17,22.65,Gold-India,,,,19.32,6,8,1,5,4,,,,Mirae Asset Gold ETF,Gold : ETFs,25,31,29,28,25,11,11,11,18.87,1.56,3.36,5.0,21.48,15.11,14.03,9.91,,,,,,,,
HDFC FMP-Sr 46-1861D-Mar 2022-Reg(G),46453,HDFC Mutual Fund,0.65,1.8,4.21,8.36,NIFTY Medium to Long Duration Debt Index,,,,7.98,19,12,16,17,16,,,,HDFC FMP-Sr 46-1861D-Mar 2022-Reg(G),Debt : FTP/FMP,91,91,91,91,91,40,17,12,7.59,0.6,1.71,3.94,7.85,5.82,5.63,6.04,,,,,,,,
PGIM India Liquid Fund(G),818,PGIM India Mutual Fund,0.56,1.75,3.52,7.34,CRISIL Liquid Debt Index,6.32,5.28,6.34,7.06,20,2,2,12,20,14,14,6,PGIM India Liquid Fund(G),Debt : Liquid,37,38,37,37,37,35,34,29,6.99,0.55,1.72,3.48,7.27,6.26,5.21,6.22,,,,,,,,
Mirae Asset Nifty Next 50 ETF,44314,Mirae Asset Mutual Fund,5.62,-4.88,-1.21,36.87,NIFTY NEXT 50 - TRI,20.51,,,33.02,15,42,117,126,12,21,,,Mirae Asset Nifty Next 50 ETF,Equity : ETFs,141,169,163,154,141,89,61,25,19.33,4.65,-2.61,4.77,21.76,16.68,17.59,12.52,,,,,,,,
Quant Commodities Fund-Reg(G),48343,Quant Mutual Fund,3.42,-5.6,7.26,,NIFTY COMMODITIES - TRI,,,,37.48,5,63,57,15,,,,,Quant Commodities Fund-Reg(G),Equity : Thematic,56,80,76,64,54,36,18,9,23.24,5.19,-3.36,2.84,25.08,19.14,23.06,14.72,,,,,,,,
Nippon India Nifty AAA PSU Bond Plus SDL - Sep 2026 Maturity 50:50 Index Fund-Reg(G),47034,Nippon India Mutual Fund,0.52,1.78,3.87,7.75,Nifty AAA PSU Bond Plus SDL Sep 2026 50:50 Index,,,,7.49,14,21,9,19,15,,,,Nippon India Nifty AAA PSU Bond Plus SDL - Sep 2026 Maturity 50:50 Index Fund-Reg(G),Debt : Banking & PSU,26,26,26,26,26,21,16,15,7.56,0.6,1.78,3.98,7.84,5.81,6.33,7.12,,,,,,,,
Mirae Asset Nifty 1D Rate Liquid ETF(IDCW),48119,Mirae Asset Mutual Fund,0.51,1.54,3.08,6.36,Nifty 1D Rate Index,,,,6.12,15,26,21,24,17,,,,Mirae Asset Nifty 1D Rate Liquid ETF(IDCW),Debt : ETFs,22,32,30,27,22,15,6,1,7.38,0.72,1.54,4.0,7.79,5.75,5.16,4.87,0.54,1.62,3.27,6.75,6.04,4.96,,6.71
Quant Teck Fund-Reg(G),48195,Quant Mutual Fund,7.06,-0.38,7.96,28.79,NIFTY IT - TRI,,,,26.21,6,12,9,9,6,,,,Quant Teck Fund-Reg(G),Equity : Sectoral - Technology,7,12,9,9,7,5,5,4,31.58,9.81,4.6,22.54,31.59,13.15,29.14,18.79,,,,,,,,
Kotak FMP-292-1735D(G),45679,Kotak Mahindra Mutual Fund,0.56,1.7,3.93,7.82,CRISIL Composite Bond Index,5.51,,,7.55,44,48,47,45,43,33,,,Kotak FMP-292-1735D(G),Debt : FTP/FMP,91,91,91,91,91,40,17,12,7.59,0.6,1.71,3.94,7.85,5.82,5.63,6.04,,,,,,,,
Kotak FMP-292-1735D(IDCW),45790,Kotak Mahindra Mutual Fund,0.56,1.7,3.93,7.82,NIFTY Medium to Long Duration Debt Index,5.51,,,7.55,43,49,46,44,44,34,,,Kotak FMP-292-1735D(IDCW),Debt : FTP/FMP,91,91,91,91,91,40,17,12,7.59,0.6,1.71,3.94,7.85,5.82,5.63,6.04,,,,,,,,
Sundaram Low Duration Fund(G),2343,Sundaram Mutual Fund,0.53,1.71,3.7,7.29,NIFTY Low Duration Debt Index,5.92,5.43,4.47,7.05,16,8,19,4,16,15,19,18,Sundaram Low Duration Fund(G),Debt : Low Duration,20,20,20,20,20,20,20,18,7.16,0.51,1.8,3.62,7.4,6.04,5.99,6.5,,,,,,,,
ICICI Pru FMP-85-10Y-I(G),43023,ICICI Prudential Mutual Fund,0.97,1.9,4.87,9.34,CRISIL Composite Bond Index,6.3,7.28,,9.2,2,5,6,6,3,4,1,,ICICI Pru FMP-85-10Y-I(G),Debt : FTP/FMP,91,91,91,91,91,40,17,12,7.59,0.6,1.71,3.94,7.85,5.82,5.63,6.04,,,,,,,,
Quant Healthcare Fund-Reg(G),48035,Quant Mutual Fund,-0.12,-9.64,5.41,32.67,Nifty India Consumption - TRI,,,,29.31,14,16,16,16,14,,,,Quant Healthcare Fund-Reg(G),Equity : Sectoral - Pharma,14,16,16,16,14,10,9,3,37.83,4.23,-0.13,18.11,41.01,21.66,27.59,13.83,,,,,,,,
Motilal Oswal Ultra Short Term Fund-Reg(G),22532,Motilal Oswal Mutual Fund,0.44,1.4,2.91,6.02,CRISIL Ultra Short Term Debt Index,5.09,4.41,3.79,5.84,24,25,25,24,24,24,21,13,Motilal Oswal Ultra Short Term Fund-Reg(G),Debt : Ultra Short Duration,24,25,25,24,24,24,21,13,6.88,0.51,1.72,3.42,7.11,5.95,5.33,6.24,0.58,1.86,3.78,,,,,7.68
Kotak Nifty Alpha 50 ETF,45687,Kotak Mahindra Mutual Fund,10.84,-3.29,3.28,36.69,Nifty Alpha 50 - TRI,,,,36.81,8,5,77,72,16,,,,Kotak Nifty Alpha 50 ETF,Equity : ETFs,141,169,163,154,141,89,61,25,19.33,4.65,-2.61,4.77,21.76,16.68,17.59,12.52,,,,,,,,
Union Largecap Fund-Reg(G),33066,Union Mutual Fund,4.68,-2.85,1.29,16.39,BSE 100 - TRI,12.64,15.56,,14.05,31,10,11,30,31,28,23,,Union Largecap Fund-Reg(G),Equity : Large Cap,36,38,38,37,36,34,31,28,17.34,3.93,-4.1,3.37,19.86,15.23,16.7,12.96,2.43,-5.09,2.61,16.6,15.29,17.18,,15.48
ICICI Pru Nifty Smallcap 250 Index Fund(G),45684,ICICI Prudential Mutual Fund,8.47,-2.15,6.19,29.69,Nifty Smallcap 250 - TRI,23.18,,,27.79,24,31,38,22,26,5,,,ICICI Pru Nifty Smallcap 250 Index Fund(G),Equity : Index Funds,105,161,140,125,103,51,28,18,20.36,5.49,-3.55,2.97,22.6,16.34,16.95,12.34,,,,,,,,
ICICI Pru Nifty FMCG ETF,45651,ICICI Prudential Mutual Fund,0.27,-12.39,-0.9,6.25,NIFTY FMCG - TRI,17.49,,,0.17,141,168,162,123,136,34,,,ICICI Pru Nifty FMCG ETF,Equity : ETFs,141,169,163,154,141,89,61,25,19.33,4.65,-2.61,4.77,21.76,16.68,17.59,12.52,,,,,,,,
Bandhan CRISIL IBX Gilt April 2032 Index Fund-Reg(G),47601,Bandhan Mutual Fund,0.99,1.61,4.83,9.31,CRISIL IBX Gilt Index - April 2032,,,,8.91,19,13,16,13,18,,,,Bandhan CRISIL IBX Gilt April 2032 Index Fund-Reg(G),Debt : Long Duration,21,24,24,24,20,3,3,2,9.94,1.0,1.6,4.79,10.26,5.7,6.45,6.86,,,,,,,,
Aditya Birla SL Gold Fund(G),16220,Aditya Birla Sun Life Mutual Fund,1.8,4.19,6.07,21.85,Gold-India,14.47,13.3,9.59,18.11,11,12,5,12,11,9,10,6,Aditya Birla SL Gold Fund(G),Gold : MFs,16,17,16,16,16,10,10,10,18.19,1.7,3.75,5.1,21.48,14.77,13.58,9.53,,,,,,,,
Invesco India - Invesco EQQQ NASDAQ-100 ETF FoF-Reg(G),45943,Invesco Mutual Fund,7.22,14.2,12.6,34.35,Nasdaq-100 - TRI,,,,33.91,8,9,11,8,10,,,,Invesco India - Invesco EQQQ NASDAQ-100 ETF FoF-Reg(G),FoFs : Overseas,57,58,58,58,57,47,27,24,18.86,2.84,5.95,8.0,20.53,6.03,8.48,7.27,,,,,,,,
ICICI Pru Nifty Midcap 150 ETF,44494,ICICI Prudential Mutual Fund,7.75,-2.03,4.14,28.41,Nifty Midcap 150 - TRI,24.58,,,26.8,39,28,52,52,39,7,,,ICICI Pru Nifty Midcap 150 ETF,Equity : ETFs,141,169,163,154,141,89,61,25,19.33,4.65,-2.61,4.77,21.76,16.68,17.59,12.52,,,,,,,,
Mirae Asset Nifty Smallcap 250 Momentum Quality 100 ETF,48496,Mirae Asset Mutual Fund,9.56,-2.45,2.43,,Nifty Smallcap250 Momentum Quality 100 - TRI,,,,,,17,58,104,,,,,Mirae Asset Nifty Smallcap 250 Momentum Quality 100 ETF,Equity : ETFs,141,169,163,154,141,89,61,25,19.33,4.65,-2.61,4.77,21.76,16.68,17.59,12.52,,,,,,,,
Mahindra Manulife Consumption Fund-Reg(G),38749,Mahindra Manulife Mutual Fund,4.99,-6.68,3.07,26.19,Nifty India Consumption - TRI,20.21,18.32,,23.05,8,6,11,12,8,6,11,,Mahindra Manulife Consumption Fund-Reg(G),Equity : Thematic - Consumption,16,18,18,17,16,13,13,8,21.52,4.16,-6.41,4.92,25.31,19.22,19.74,14.69,,,,,,,,
Union Focused Fund-Reg(G),22068,Union Mutual Fund,5.9,0.5,5.51,19.18,BSE 500 - TRI,13.46,18.2,,17.74,32,19,8,18,33,24,14,,Union Focused Fund-Reg(G),Equity : Multi Cap,36,41,40,38,36,27,20,14,23.98,5.77,-1.79,6.71,25.93,18.39,20.33,14.84,3.22,-4.77,2.44,19.32,16.79,19.39,,18.03
Kotak Healthcare Fund-Reg(G),47949,Kotak Mahindra Mutual Fund,5.5,0.98,19.58,39.14,Nifty Healthcare Index - TRI,,,,37.28,9,2,8,8,10,,,,Kotak Healthcare Fund-Reg(G),Equity : Sectoral - Pharma,14,16,16,16,14,10,9,3,37.83,4.23,-0.13,18.11,41.01,21.66,27.59,13.83,,,,,,,,
HDFC Silver ETF,46223,HDFC Mutual Fund,0.41,0.95,3.51,21.65,Silver,,,,19.29,7,20,29,18,16,,,,HDFC Silver ETF,Gold : ETFs,25,31,29,28,25,11,11,11,18.87,1.56,3.36,5.0,21.48,15.11,14.03,9.91,,,,,,,,
HDFC Nifty500 Multicap 50:25:25 Index Fund-Reg(G),48970,HDFC Mutual Fund,5.7,-3.52,,,Nifty500 Multicap 50:25:25 - TRI,,,,,,52,61,,,,,,HDFC Nifty500 Multicap 50:25:25 Index Fund-Reg(G),Equity : Index Funds,105,161,140,125,103,51,28,18,20.36,5.49,-3.55,2.97,22.6,16.34,16.95,12.34,,,,,,,,
