Aditya Birla SL Nifty Next 50 ETF,38262,Aditya Birla Sun Life Mutual Fund,5.0,4.09,-6.48,5.86,NIFTY NEXT 50 - TRI,16.07,23.77,,-2.92,111,60,88,117,113,41,20,,Aditya Birla SL Nifty Next 50 ETF,Equity : ETFs,170,182,170,167,148,103,63,28,-1.32,4.21,2.34,-2.65,9.31,15.77,23.97,11.98,,,,,,,,
Edelweiss Nifty Alpha Low Volatility 30 Index Fund-Reg(G),48808,Edelweiss Mutual Fund,5.06,-0.16,-8.91,,NIFTY Alpha Low-Volatility 30 - TRI,,,,-3.59,111,57,130,122,,,,,Edelweiss Nifty Alpha Low Volatility 30 Index Fund-Reg(G),Equity : Index Funds,175,190,176,151,115,68,32,18,-2.57,4.67,2.21,-3.96,6.58,14.83,22.71,11.63,,,,,,,,
Kotak FMP-310-1131D(G),47871,Kotak Mahindra Mutual Fund,1.09,2.27,3.87,8.04,NIFTY Medium Duration Debt Index,,,,2.72,55,44,47,50,62,,,,Kotak FMP-310-1131D(G),Debt : FTP/FMP,92,93,92,91,91,49,17,8,2.77,1.11,2.32,3.96,8.33,6.9,5.66,6.0,,,,,,,,
LIC MF Focused Fund-Reg(G),32627,LIC Mutual Fund,6.37,2.92,-3.13,9.84,NIFTY 500 - TRI,11.86,20.06,,0.56,16,1,30,29,17,31,25,,LIC MF Focused Fund-Reg(G),Equity : Large Cap,38,38,38,38,37,34,31,28,-0.54,4.17,3.42,-2.39,8.22,14.54,21.57,11.86,,,,,,,,
DSP World Mining FoF-Reg(G),8359,DSP Mutual Fund,-1.82,3.17,-6.86,0.56,MSCI ACWI Metals & Mining 30% Buffer 10/40 (1994) Net TRI,-1.73,14.42,9.01,7.24,8,14,10,47,53,48,8,6,DSP World Mining FoF-Reg(G),FoFs : Overseas,57,57,57,57,57,51,27,24,-4.25,-4.25,-6.34,-2.49,10.02,9.01,11.06,6.14,,,,,,,,
Axis NIFTY IT Index Fund-Reg(G),47983,Axis Mutual Fund,-3.65,-18.54,-15.81,6.06,NIFTY IT - TRI,,,,-18.4,175,190,176,144,68,,,,Axis NIFTY IT Index Fund-Reg(G),Equity : Index Funds,175,190,176,151,115,68,32,18,-2.57,4.67,2.21,-3.96,6.58,14.83,22.71,11.63,,,,,,,,
Axis BSE Sensex ETF,47768,Axis Mutual Fund,4.17,4.81,0.32,9.83,BSE SENSEX - TRI,,,,2.26,59,125,70,33,76,,,,Axis BSE Sensex ETF,Equity : ETFs,170,182,170,167,148,103,63,28,-1.32,4.21,2.34,-2.65,9.31,15.77,23.97,11.98,,,,,,,,
Shriram Overnight Fund-Reg(G),46777,Shriram Mutual Fund,0.49,1.48,3.08,6.39,CRISIL Liquid Overnight Index,,,,1.89,31,31,30,31,31,,,,Shriram Overnight Fund-Reg(G),Debt : Overnight,34,34,34,34,34,28,27,3,1.94,0.51,1.51,3.15,6.48,6.24,4.97,5.57,0.51,1.53,3.21,6.6,,,,6.3
Canara Rob Dynamic Bond Fund-Reg(G),7792,Canara Robeco Mutual Fund,3.08,4.52,5.51,10.66,CRISIL Dynamic Bond Index,7.05,5.28,6.47,5.04,5,3,4,10,17,19,19,15,Canara Rob Dynamic Bond Fund-Reg(G),Debt : Dynamic Bond,22,22,22,22,22,22,21,18,4.53,2.61,4.04,5.38,10.9,7.66,6.29,7.03,2.29,3.83,5.55,11.01,,,,14.14
DSP FMP 268-1281D-Reg(G),47124,DSP Mutual Fund,0.97,2.13,3.77,8.17,CRISIL Medium Duration Debt Index,,,,2.69,63,68,69,66,48,,,,DSP FMP 268-1281D-Reg(G),Debt : FTP/FMP,92,93,92,91,91,49,17,8,2.77,1.11,2.32,3.96,8.33,6.9,5.66,6.0,,,,,,,,
ICICI Pru Quant Fund(G),42805,ICICI Prudential Mutual Fund,3.55,3.17,-0.05,14.72,BSE 200 - TRI,16.2,,,2.08,9,56,19,7,4,19,,,ICICI Pru Quant Fund(G),Equity : Thematic,89,98,90,79,60,38,21,9,-4.61,3.78,0.45,-5.44,6.93,17.04,26.27,13.41,,,,,,,,
HSBC Nifty Next 50 Index Fund-Reg(G),33548,HSBC Mutual Fund,4.76,3.73,-7.17,4.52,NIFTY NEXT 50 - TRI,14.92,22.67,,-3.29,107,76,80,111,90,33,9,,HSBC Nifty Next 50 Index Fund-Reg(G),Equity : Index Funds,175,190,176,151,115,68,32,18,-2.57,4.67,2.21,-3.96,6.58,14.83,22.71,11.63,,,,,,,,
Quant Gilt Fund-Reg(G),47345,Quant Mutual Fund,2.05,3.35,4.81,9.28,CRISIL Dynamic Gilt Index,,,,3.81,28,28,29,28,30,,,,Quant Gilt Fund-Reg(G),Debt : Gilt,36,37,37,36,35,23,21,21,4.65,2.59,4.12,5.54,11.23,7.86,6.06,7.32,,,,,,,,
SBI FMP-78-1170D-Reg(G),47638,SBI Mutual Fund,0.99,2.23,3.87,8.07,CRISIL Medium Duration Debt Index,,,,2.72,56,64,58,51,57,,,,SBI FMP-78-1170D-Reg(G),Debt : FTP/FMP,92,93,92,91,91,49,17,8,2.77,1.11,2.32,3.96,8.33,6.9,5.66,6.0,,,,,,,,
SBI Magnum Childrens Benefit Fund-Savings Plan,2748,SBI Mutual Fund,2.58,2.74,2.33,14.01,NIFTY 50 Hybrid Composite Debt 15:85 Index,12.35,14.79,11.48,1.01,12,34,21,5,2,18,21,6,SBI Magnum Childrens Benefit Fund-Savings Plan,Hybrid : Solution Oriented,43,43,43,42,41,37,32,15,-0.73,3.36,2.24,-0.74,9.55,12.38,15.93,10.16,,,,,,,,
ICICI Pru Nifty Infrastructure ETF,45998,ICICI Prudential Mutual Fund,4.23,5.28,-1.24,3.71,Nifty Infrastructure - TRI,,,,3.13,30,95,45,71,128,,,,ICICI Pru Nifty Infrastructure ETF,Equity : ETFs,170,182,170,167,148,103,63,28,-1.32,4.21,2.34,-2.65,9.31,15.77,23.97,11.98,,,,,,,,
Aditya Birla SL Debt Plus Arbitrage FOF-Reg(G),2277,Aditya Birla Sun Life Mutual Fund,1.64,3.21,4.47,9.34,CRISIL Composite Bond Index,7.02,6.45,6.83,3.79,23,51,38,14,41,44,27,22,Aditya Birla SL Debt Plus Arbitrage FOF-Reg(G),FoFs : Domestic,61,64,62,61,56,47,28,23,2.55,3.16,3.62,0.43,11.38,12.86,16.38,10.07,,,,,,,,
Baroda BNP Paribas NIFTY SDL Dec 2026 Index Fund-Reg(G),47387,Baroda BNP Paribas Mutual Fund,1.34,2.5,4.03,8.7,NIFTY SDL December 2026 Index,,,,3.08,53,54,53,50,45,,,,Baroda BNP Paribas NIFTY SDL Dec 2026 Index Fund-Reg(G),Debt : Medium to Long Duration,59,60,59,55,52,26,11,11,3.68,1.82,3.14,4.78,9.75,7.25,6.14,6.43,,,,,,,,
SBI FMP-50-1843D-Reg(G),45842,SBI Mutual Fund,1.19,2.44,4.05,8.61,CRISIL Medium to Long Term Debt Index,6.92,,,2.97,28,30,26,29,30,24,,,SBI FMP-50-1843D-Reg(G),Debt : FTP/FMP,92,93,92,91,91,49,17,8,2.77,1.11,2.32,3.96,8.33,6.9,5.66,6.0,,,,,,,,
Nippon India Nifty G-Sec Oct 2028 Maturity Index Fund-Reg(G),47629,Nippon India Mutual Fund,1.8,3.22,5.12,10.03,Nifty G-Sec Oct 2028 Index,,,,3.86,21,27,23,18,20,,,,Nippon India Nifty G-Sec Oct 2028 Maturity Index Fund-Reg(G),Debt : Medium to Long Duration,59,60,59,55,52,26,11,11,3.68,1.82,3.14,4.78,9.75,7.25,6.14,6.43,,,,,,,,
Quantum Equity FoF-Reg(G),19904,Quantum Mutual Fund,4.13,3.96,-1.66,11.97,BSE 200 - TRI,15.49,22.44,12.41,-0.23,46,21,25,41,19,9,7,4,Quantum Equity FoF-Reg(G),FoFs : Domestic,61,64,62,61,56,47,28,23,2.55,3.16,3.62,0.43,11.38,12.86,16.38,10.07,,,,,,,,
Groww Largecap Fund-Reg(G),15997,Groww Mutual Fund,4.32,4.0,-3.18,4.61,NIFTY 100 - TRI,13.35,18.79,10.89,-1.48,28,15,17,30,29,25,27,22,Groww Largecap Fund-Reg(G),Equity : Large Cap,38,38,38,38,37,34,31,28,-0.54,4.17,3.42,-2.39,8.22,14.54,21.57,11.86,,,,,,,,
SBI Nifty 200 Quality 30 ETF,41015,SBI Mutual Fund,4.88,-1.48,-8.67,8.65,NIFTY200 Quality 30 - TRI,12.82,19.27,,-4.05,119,70,133,141,89,88,60,,SBI Nifty 200 Quality 30 ETF,Equity : ETFs,170,182,170,167,148,103,63,28,-1.32,4.21,2.34,-2.65,9.31,15.77,23.97,11.98,,,,,,,,
Edelweiss Nifty Next 50 Index Fund-Reg(G),47171,Edelweiss Mutual Fund,4.86,3.8,-6.99,4.75,NIFTY NEXT 50 - TRI,,,,-3.24,106,71,79,107,85,,,,Edelweiss Nifty Next 50 Index Fund-Reg(G),Equity : Index Funds,175,190,176,151,115,68,32,18,-2.57,4.67,2.21,-3.96,6.58,14.83,22.71,11.63,,,,,,,,
Canara Rob Income Fund-Reg(G),542,Canara Robeco Mutual Fund,2.07,3.39,4.62,9.68,CRISIL Medium to Long Term Debt Index,6.47,5.22,6.44,3.88,20,18,20,32,29,25,10,6,Canara Rob Income Fund-Reg(G),Debt : Medium to Long Duration,59,60,59,55,52,26,11,11,3.68,1.82,3.14,4.78,9.75,7.25,6.14,6.43,,,,,,,,
Canara Rob Corp Bond Fund-Reg(G),23504,Canara Robeco Mutual Fund,1.75,2.98,4.4,8.66,CRISIL Corporate Bond Index,6.38,5.76,6.6,3.33,20,19,20,19,21,20,18,10,Canara Rob Corp Bond Fund-Reg(G),Debt : Corporate Bond,21,21,21,21,21,20,18,12,3.73,1.99,3.31,4.94,9.59,7.04,6.48,7.15,,,,,,,,
Groww Nifty EV & New Age Automotive ETF FOF-Reg(G),48990,Groww Mutual Fund,0.63,-4.35,-15.03,,Nifty EV and New Age Automotive - TRI,,,,-8.11,57,58,60,61,,,,,Groww Nifty EV & New Age Automotive ETF FOF-Reg(G),FoFs : Domestic,61,64,62,61,56,47,28,23,2.55,3.16,3.62,0.43,11.38,12.86,16.38,10.07,,,,,,,,
Shriram Liquid Fund-Reg(G),48954,Shriram Mutual Fund,0.58,1.66,,,Nifty Liquid Fund Index,,,,2.1,36,36,36,,,,,,Shriram Liquid Fund-Reg(G),Debt : Liquid,38,38,38,37,37,35,34,29,2.27,0.7,1.81,3.57,7.18,6.71,5.35,6.17,,,,,,,,
SBI FMP-43-1616D-Reg(G),45525,SBI Mutual Fund,0.72,1.82,3.39,7.49,CRISIL Medium Duration Debt Index,6.42,,,2.29,73,74,73,74,73,35,,,SBI FMP-43-1616D-Reg(G),Debt : FTP/FMP,92,93,92,91,91,49,17,8,2.77,1.11,2.32,3.96,8.33,6.9,5.66,6.0,,,,,,,,
Bandhan Nifty200 Momentum 30 Index Fund-Reg(G),46608,Bandhan Mutual Fund,3.86,-3.16,-16.33,-6.63,Nifty200 Momentum 30 - TRI,,,,-10.79,155,160,161,148,114,,,,Bandhan Nifty200 Momentum 30 Index Fund-Reg(G),Equity : Index Funds,175,190,176,151,115,68,32,18,-2.57,4.67,2.21,-3.96,6.58,14.83,22.71,11.63,,,,,,,,
Mirae Asset Dynamic Bond Fund-Reg(G),36556,Mirae Asset Mutual Fund,1.4,2.47,3.94,8.09,CRISIL Dynamic Bond Index,5.97,4.56,,2.95,21,21,21,21,21,22,21,,Mirae Asset Dynamic Bond Fund-Reg(G),Debt : Dynamic Bond,22,22,22,22,22,22,21,18,4.53,2.61,4.04,5.38,10.9,7.66,6.29,7.03,2.29,3.83,5.55,11.01,,,,14.14
ICICI Pru BSE 500 ETF FOF-Reg(G),45726,ICICI Prudential Mutual Fund,3.97,2.83,-3.28,6.97,BSE 500 - TRI,13.76,,,-1.19,49,26,42,52,50,16,,,ICICI Pru BSE 500 ETF FOF-Reg(G),FoFs : Domestic,61,64,62,61,56,47,28,23,2.55,3.16,3.62,0.43,11.38,12.86,16.38,10.07,,,,,,,,
Motilal Oswal Nifty 500 ETF,48267,Motilal Oswal Mutual Fund,4.52,3.37,-2.39,8.49,NIFTY 500 - TRI,,,,-0.71,94,77,94,89,93,,,,Motilal Oswal Nifty 500 ETF,Equity : ETFs,170,182,170,167,148,103,63,28,-1.32,4.21,2.34,-2.65,9.31,15.77,23.97,11.98,,,,,,,,
Mirae Asset Nifty 100 ESG Sector Leaders ETF,45134,Mirae Asset Mutual Fund,4.2,6.0,-0.3,10.3,Nifty100 ESG Sector Leaders - TRI,12.36,,,2.85,33,96,36,62,46,90,,,Mirae Asset Nifty 100 ESG Sector Leaders ETF,Equity : ETFs,170,182,170,167,148,103,63,28,-1.32,4.21,2.34,-2.65,9.31,15.77,23.97,11.98,,,,,,,,
PGIM India Gilt Fund(G),7012,PGIM India Mutual Fund,2.92,4.51,5.57,11.64,CRISIL Dynamic Gilt Index,7.59,5.82,7.1,4.88,24,18,21,25,19,17,13,13,PGIM India Gilt Fund(G),Debt : Gilt,36,37,37,36,35,23,21,21,4.65,2.59,4.12,5.54,11.23,7.86,6.06,7.32,,,,,,,,
Navi Aggressive Hybrid Fund-Reg(G),39479,Navi Mutual Fund,2.13,1.03,-1.96,9.0,CRISIL Hybrid 35+65 - Aggressive Index,11.68,16.68,,-1.23,43,43,49,42,29,26,25,,Navi Aggressive Hybrid Fund-Reg(G),Hybrid : Equity Oriented,55,56,55,55,55,54,51,29,4.63,7.33,6.98,4.7,13.32,12.48,16.48,9.96,,,,,,,,
Motilal Oswal Nifty 200 Momentum 30 ETF,46325,Motilal Oswal Mutual Fund,3.94,-2.95,-16.02,-5.53,Nifty200 Momentum 30 - TRI,14.37,,,-10.55,149,136,142,164,138,59,,,Motilal Oswal Nifty 200 Momentum 30 ETF,Equity : ETFs,170,182,170,167,148,103,63,28,-1.32,4.21,2.34,-2.65,9.31,15.77,23.97,11.98,,,,,,,,
JM Short Duration Fund-Reg(G),46751,JM Financial Mutual Fund,1.73,3.0,4.57,8.77,CRISIL Short Duration Debt Index,,,,3.5,17,21,20,23,22,,,,JM Short Duration Fund-Reg(G),Debt : Short Duration,30,34,30,28,26,23,21,19,3.52,1.81,3.07,4.78,9.01,6.85,6.32,6.77,,,,,,,,
Edelweiss Emerging Markets Opp Eq. Offshore Fund-Reg(G),20281,Edelweiss Mutual Fund,-4.36,-1.12,-2.45,6.29,MSCI Emerging Market Index,3.54,4.53,3.4,-2.05,21,30,20,22,39,40,24,20,Edelweiss Emerging Markets Opp Eq. Offshore Fund-Reg(G),FoFs : Overseas,57,57,57,57,57,51,27,24,-4.25,-4.25,-6.34,-2.49,10.02,9.01,11.06,6.14,,,,,,,,
UTI Long Duration Fund-Reg(G),47733,UTI Mutual Fund,3.1,4.54,5.3,11.62,NIFTY Long Duration Debt Index,,,,5.07,15,8,16,23,22,,,,UTI Long Duration Fund-Reg(G),Debt : Long Duration,26,26,26,24,24,4,3,2,5.06,2.9,4.53,5.95,12.39,8.19,5.77,7.06,,,,,,,,
Bandhan Conservative Hybrid Fund-Reg(G),8465,Bandhan Mutual Fund,2.71,3.69,3.23,9.79,NIFTY AAA Short Duration Bond Index,7.28,7.73,6.67,3.56,4,5,5,10,11,15,16,15,Bandhan Conservative Hybrid Fund-Reg(G),Hybrid : Debt Oriented (Conservative),18,18,18,18,18,18,17,17,2.57,2.43,3.21,3.13,9.77,9.0,10.35,7.67,,,,,,,,
Aditya Birla SL CRISIL IBX Gilt June 2027 Index Fund-Reg(G),48450,Aditya Birla Sun Life Mutual Fund,1.39,2.72,4.45,,CRISIL IBX Gilt Index - June 2027,,,,3.3,33,35,34,32,,,,,Aditya Birla SL CRISIL IBX Gilt June 2027 Index Fund-Reg(G),Debt : Gilt,36,37,37,36,35,23,21,21,4.65,2.59,4.12,5.54,11.23,7.86,6.06,7.32,,,,,,,,
DSP Income Plus Arbitrage FoF-Reg(G),14756,DSP Mutual Fund,1.6,-0.31,4.21,12.68,CRISIL Dynamic Bond Index,9.17,9.76,7.11,3.0,11,3,17,8,13,27,16,10,DSP Income Plus Arbitrage FoF-Reg(G),FoFs : Overseas,57,57,57,57,57,51,27,24,-4.25,-4.25,-6.34,-2.49,10.02,9.01,11.06,6.14,2.29,3.83,5.55,11.01,,,,14.14
Tata Nifty500 Multicap India Manufacturing 50:30:20 Index Fund-Reg(G),48782,Tata Mutual Fund,1.43,0.44,-5.66,,Nifty500 Multicap India Manufacturing 50:30:20 - TRI,,,,-3.53,109,180,123,94,,,,,Tata Nifty500 Multicap India Manufacturing 50:30:20 Index Fund-Reg(G),Equity : Index Funds,175,190,176,151,115,68,32,18,-2.57,4.67,2.21,-3.96,6.58,14.83,22.71,11.63,,,,,,,,
Taurus Mid Cap Fund-Reg(G),3306,Taurus Mutual Fund,4.81,0.3,-5.97,0.1,Nifty Midcap 150 - TRI,15.14,24.24,14.2,-3.92,3,7,12,15,29,24,23,17,Taurus Mid Cap Fund-Reg(G),Equity : Mid Cap,30,31,30,30,30,25,24,20,-7.0,3.99,-0.34,-5.9,10.63,19.4,29.69,15.31,,,,,,,,
Bank of India Short Term Income Fund-Reg(G),7456,Bank of India Mutual Fund,1.54,2.79,6.26,10.43,CRISIL Short Duration Debt Index,9.38,8.21,5.79,3.21,26,27,25,2,1,1,1,19,Bank of India Short Term Income Fund-Reg(G),Debt : Short Duration,30,34,30,28,26,23,21,19,3.52,1.81,3.07,4.78,9.01,6.85,6.32,6.77,,,,,,,,
ICICI Pru Nifty Auto ETF,46229,ICICI Prudential Mutual Fund,3.08,-0.43,-8.32,2.95,NIFTY AUTO - TRI,27.41,,,-2.06,99,145,123,136,130,6,,,ICICI Pru Nifty Auto ETF,Equity : ETFs,170,182,170,167,148,103,63,28,-1.32,4.21,2.34,-2.65,9.31,15.77,23.97,11.98,,,,,,,,
Nippon India FHF-XLV-4-1111D(G),47822,Nippon India Mutual Fund,1.11,2.31,3.93,8.16,CRISIL Medium Duration Debt Index,,,,2.76,47,39,42,43,49,,,,Nippon India FHF-XLV-4-1111D(G),Debt : FTP/FMP,92,93,92,91,91,49,17,8,2.77,1.11,2.32,3.96,8.33,6.9,5.66,6.0,,,,,,,,
Kotak FMP-304-3119D(G),47401,Kotak Mahindra Mutual Fund,2.64,4.66,6.36,12.75,NIFTY Long Duration Debt Index,,,,5.19,1,1,1,1,1,,,,Kotak FMP-304-3119D(G),Debt : FTP/FMP,92,93,92,91,91,49,17,8,2.77,1.11,2.32,3.96,8.33,6.9,5.66,6.0,,,,,,,,
Bajaj Finserv Banking and PSU Fund-Reg(G),48214,Bajaj Finserv Mutual Fund,2.12,3.41,4.92,9.64,NIFTY Banking and PSU Debt Index,,,,3.78,6,8,5,10,4,,,,Bajaj Finserv Banking and PSU Fund-Reg(G),Debt : Banking & PSU,26,26,26,26,26,21,16,15,3.5,1.85,3.08,4.7,9.12,6.99,6.36,7.2,,,,,,,,
Axis CRISIL-IBX AAA Bond Financial Services - Sep 2027 Index Fund-Reg(G),49254,Axis Mutual Fund,1.71,3.01,,,CRISIL IBX AAA Financial Services Index - Sep 2027,,,,3.49,33,32,32,,,,,,Axis CRISIL-IBX AAA Bond Financial Services - Sep 2027 Index Fund-Reg(G),Debt : Medium to Long Duration,59,60,59,55,52,26,11,11,3.68,1.82,3.14,4.78,9.75,7.25,6.14,6.43,,,,,,,,
Bandhan CRISIL IBX 90:10 SDL Plus Gilt - Nov 2026 Index Fund-Reg(G),46213,Bandhan Mutual Fund,1.25,2.42,4.02,8.56,CRISIL IBX 90:10 SDL Plus Gilt Index - November 2026,,,,2.99,55,56,55,51,48,,,,Bandhan CRISIL IBX 90:10 SDL Plus Gilt - Nov 2026 Index Fund-Reg(G),Debt : Medium to Long Duration,59,60,59,55,52,26,11,11,3.68,1.82,3.14,4.78,9.75,7.25,6.14,6.43,,,,,,,,
ICICI Pru Nifty Financial Services Ex-Bank ETF,47166,ICICI Prudential Mutual Fund,7.65,13.24,8.63,20.52,Nifty Financial Services Ex-Bank - TRI,,,,12.24,1,30,20,11,9,,,,ICICI Pru Nifty Financial Services Ex-Bank ETF,Equity : ETFs,170,182,170,167,148,103,63,28,-1.32,4.21,2.34,-2.65,9.31,15.77,23.97,11.98,,,,,,,,
Kotak Nifty Smallcap 50 Index Fund-Reg(G),46631,Kotak Mahindra Mutual Fund,5.23,-1.63,-6.67,5.36,Nifty Smallcap 50 - TRI,,,,-8.28,138,44,140,96,72,,,,Kotak Nifty Smallcap 50 Index Fund-Reg(G),Equity : Index Funds,175,190,176,151,115,68,32,18,-2.57,4.67,2.21,-3.96,6.58,14.83,22.71,11.63,,,,,,,,
Kotak Nifty 50 Value 20 ETF,31116,Kotak Mahindra Mutual Fund,1.33,-3.25,-7.67,6.05,Nifty50 Value 20 - TRI,14.65,24.7,,-5.4,132,155,147,129,109,56,15,,Kotak Nifty 50 Value 20 ETF,Equity : ETFs,170,182,170,167,148,103,63,28,-1.32,4.21,2.34,-2.65,9.31,15.77,23.97,11.98,,,,,,,,
ICICI Pru Debt Mgmt Fund(FOF)(G),1707,ICICI Prudential Mutual Fund,1.93,3.44,5.2,9.82,CRISIL Composite Bond Index,7.86,7.02,7.77,3.87,21,48,34,7,35,41,24,18,ICICI Pru Debt Mgmt Fund(FOF)(G),FoFs : Domestic,61,64,62,61,56,47,28,23,2.55,3.16,3.62,0.43,11.38,12.86,16.38,10.07,,,,,,,,
Sundaram Global Brand Fund(G),3005,Sundaram Mutual Fund,-4.76,-9.52,0.26,2.75,MSCI AC World Index,10.22,12.66,6.91,-6.94,28,32,32,15,46,23,9,11,Sundaram Global Brand Fund(G),FoFs : Overseas,57,57,57,57,57,51,27,24,-4.25,-4.25,-6.34,-2.49,10.02,9.01,11.06,6.14,,,,,,,,
LIC MF Short Duration Fund-Reg(G),34304,LIC Mutual Fund,1.8,3.06,4.58,8.88,CRISIL Short Duration Debt Index,6.25,5.33,,3.49,18,14,17,22,21,21,20,,LIC MF Short Duration Fund-Reg(G),Debt : Short Duration,30,34,30,28,26,23,21,19,3.52,1.81,3.07,4.78,9.01,6.85,6.32,6.77,,,,,,,,
ICICI Pru Nifty 100 ETF,22404,ICICI Prudential Mutual Fund,4.29,4.72,-1.38,8.55,NIFTY 100 - TRI,13.1,22.0,12.16,1.58,73,92,79,75,90,84,45,17,ICICI Pru Nifty 100 ETF,Equity : ETFs,170,182,170,167,148,103,63,28,-1.32,4.21,2.34,-2.65,9.31,15.77,23.97,11.98,,,,,,,,
ICICI Pru Global Stable Equity Fund(FOF)(G),16718,ICICI Prudential Mutual Fund,-1.77,1.41,1.68,10.1,MSCI World,7.38,11.61,8.23,1.96,12,13,12,13,24,33,13,8,ICICI Pru Global Stable Equity Fund(FOF)(G),FoFs : Overseas,57,57,57,57,57,51,27,24,-4.25,-4.25,-6.34,-2.49,10.02,9.01,11.06,6.14,,,,,,,,
Bank of India Credit Risk Fund-Reg(G),30390,Bank of India Mutual Fund,1.17,2.06,3.24,5.52,CRISIL Credit Risk Debt Index,5.48,10.46,1.8,2.39,15,15,15,15,15,15,2,13,Bank of India Credit Risk Fund-Reg(G),Debt : Credit Risk,15,15,15,15,15,15,15,13,4.62,1.56,4.15,5.76,10.39,7.71,7.62,6.45,,,,,,,,
Aditya Birla SL Retirement Fund-40-Reg(G),42770,Aditya Birla Sun Life Mutual Fund,4.06,2.99,0.78,11.75,CRISIL Hybrid 35+65 - Aggressive Index,12.84,14.78,,-1.35,27,10,15,15,7,16,22,,Aditya Birla SL Retirement Fund-40-Reg(G),Hybrid : Solution Oriented,43,43,43,42,41,37,32,15,-0.73,3.36,2.24,-0.74,9.55,12.38,15.93,10.16,,,,,,,,
Edelweiss Nifty Smallcap 250 Index Fund-Reg(G),47167,Edelweiss Mutual Fund,4.28,-2.87,-9.19,2.15,Nifty Smallcap 250 - TRI,,,,-10.65,151,112,155,130,100,,,,Edelweiss Nifty Smallcap 250 Index Fund-Reg(G),Equity : Index Funds,175,190,176,151,115,68,32,18,-2.57,4.67,2.21,-3.96,6.58,14.83,22.71,11.63,,,,,,,,
Nippon India CRISIL-IBX AAA Financial Services - Jan 2028 Index Fund-Reg(G),49221,Nippon India Mutual Fund,1.79,3.01,,,CRISIL-IBX AAA Financial Services Index - Jan 2028,,,,3.47,34,28,31,,,,,,Nippon India CRISIL-IBX AAA Financial Services - Jan 2028 Index Fund-Reg(G),Debt : Medium to Long Duration,59,60,59,55,52,26,11,11,3.68,1.82,3.14,4.78,9.75,7.25,6.14,6.43,,,,,,,,
Tata Floating Rate Fund-Reg(G),45375,Tata Mutual Fund,1.95,3.11,4.86,9.14,CRISIL Short Duration Debt Index,7.23,,,3.59,5,4,5,5,7,9,,,Tata Floating Rate Fund-Reg(G),Debt : Floater,12,12,12,12,12,12,7,5,3.52,1.77,3.03,4.72,9.33,7.4,6.59,7.12,,,,,,,,
Edelweiss Europe Dynamic Equity Off-shore Fund-Reg(G),24618,Edelweiss Mutual Fund,2.37,13.76,12.06,18.39,MSCI Europe Index (Total Return Net),15.17,17.39,7.72,17.1,3,2,3,3,4,9,4,9,Edelweiss Europe Dynamic Equity Off-shore Fund-Reg(G),FoFs : Overseas,57,57,57,57,57,51,27,24,-4.25,-4.25,-6.34,-2.49,10.02,9.01,11.06,6.14,,,,,,,,
Quantum Small Cap Fund-Reg(G),48248,Quantum Mutual Fund,3.95,0.26,-4.22,6.93,BSE 250 Small Cap - TRI,,,,-4.86,1,13,1,1,11,,,,Quantum Small Cap Fund-Reg(G),Equity : Small Cap,29,30,29,28,27,23,21,13,-9.98,3.77,-2.64,-8.47,6.59,18.06,34.02,16.3,,,,,,,,
Motilal Oswal Nifty Capital Market Index Fund-Reg(G),49214,Motilal Oswal Mutual Fund,16.1,4.1,,,Nifty Capital Markets Index - TRI,,,,-4.37,115,2,63,,,,,,Motilal Oswal Nifty Capital Market Index Fund-Reg(G),Equity : Index Funds,175,190,176,151,115,68,32,18,-2.57,4.67,2.21,-3.96,6.58,14.83,22.71,11.63,,,,,,,,
Samco ELSS Tax Saver Fund-Reg(G),46606,Samco Mutual Fund,4.53,-4.96,-13.36,-6.18,NIFTY 500 - TRI,,,,-14.96,59,22,58,58,59,,,,Samco ELSS Tax Saver Fund-Reg(G),Equity : Tax Saving (ELSS),59,60,59,59,59,54,54,29,-3.61,4.16,1.17,-4.7,8.25,16.08,25.81,13.05,,,,,,,,
HDFC NIFTY Realty Index Fund-Reg(G),48654,HDFC Mutual Fund,3.87,2.48,-10.43,-6.9,NIFTY REALTY - TRI,,,,-16.16,170,158,100,133,115,,,,HDFC NIFTY Realty Index Fund-Reg(G),Equity : Index Funds,175,190,176,151,115,68,32,18,-2.57,4.67,2.21,-3.96,6.58,14.83,22.71,11.63,,,,,,,,
ICICI Pru Retirement Fund-Pure Debt Plan(G),25670,ICICI Prudential Mutual Fund,1.79,3.15,4.58,8.76,NIFTY Composite Debt Index,6.49,5.89,,3.54,1,41,14,1,23,36,30,,ICICI Pru Retirement Fund-Pure Debt Plan(G),Hybrid : Solution Oriented,43,43,43,42,41,37,32,15,-0.73,3.36,2.24,-0.74,9.55,12.38,15.93,10.16,,,,,,,,
Kotak Nifty SDL Jul 2026 Index Fund-Reg(G),46729,Kotak Mahindra Mutual Fund,1.09,2.24,3.81,8.24,Nifty SDL Jul 2026 Index,,,,2.78,58,59,58,54,51,,,,Kotak Nifty SDL Jul 2026 Index Fund-Reg(G),Debt : Medium to Long Duration,59,60,59,55,52,26,11,11,3.68,1.82,3.14,4.78,9.75,7.25,6.14,6.43,,,,,,,,
Tata Nifty India Digital ETF FoF-Reg(G),46355,Tata Mutual Fund,2.85,-7.51,-8.11,9.87,Nifty India Digital  - TRI,11.32,,,-12.51,60,36,62,56,34,34,,,Tata Nifty India Digital ETF FoF-Reg(G),FoFs : Domestic,61,64,62,61,56,47,28,23,2.55,3.16,3.62,0.43,11.38,12.86,16.38,10.07,,,,,,,,
Motilal Oswal BSE Low Volatility Index Fund-Reg(G),46438,Motilal Oswal Mutual Fund,4.41,1.6,-3.6,3.49,BSE Low Volatility Index - TRI,15.93,,,1.04,68,93,106,80,95,14,,,Motilal Oswal BSE Low Volatility Index Fund-Reg(G),Equity : Index Funds,175,190,176,151,115,68,32,18,-2.57,4.67,2.21,-3.96,6.58,14.83,22.71,11.63,,,,,,,,
ICICI Pru Nifty50 Equal Weight Index Fund-Reg(G),46902,ICICI Prudential Mutual Fund,4.42,4.72,-2.08,8.28,NIFTY50 Equal Weight - TRI,,,,3.72,16,90,43,55,51,,,,ICICI Pru Nifty50 Equal Weight Index Fund-Reg(G),Equity : Index Funds,175,190,176,151,115,68,32,18,-2.57,4.67,2.21,-3.96,6.58,14.83,22.71,11.63,,,,,,,,
PGIM India Healthcare Fund-Reg(G),48975,PGIM India Mutual Fund,2.12,-1.03,,,BSE Health Care - TRI,,,,-4.35,3,4,5,,,,,,PGIM India Healthcare Fund-Reg(G),Equity : Sectoral - Pharma,18,18,18,16,16,10,9,3,-5.92,1.4,-1.85,-1.47,21.02,20.0,22.73,12.21,,,,,,,,
Mahindra Manulife Arbitrage Fund-Reg(G),45042,Mahindra Manulife Mutual Fund,0.58,1.38,2.8,5.73,Nifty 50 Arbitrage,5.32,,,1.81,29,29,29,27,26,24,,,Mahindra Manulife Arbitrage Fund-Reg(G),Hybrid : Arbitrage,30,30,30,27,26,24,22,14,2.23,0.76,1.79,3.49,7.02,6.46,5.23,5.78,0.82,2.22,4.43,7.52,7.02,5.43,,8.53
LIC MF Gold ETF FoF(G),17242,LIC Mutual Fund,9.49,20.38,21.94,32.48,Gold-India,21.35,13.85,12.03,25.63,2,1,1,1,9,1,1,10,LIC MF Gold ETF FoF(G),Gold : MFs,17,18,17,16,16,10,10,10,22.92,7.02,16.69,16.44,29.99,20.7,13.35,12.35,,,,,,,,
PGIM India Dynamic Bond Fund(G),15247,PGIM India Mutual Fund,2.83,4.43,5.56,11.4,CRISIL Dynamic Bond Index,7.41,5.84,7.18,4.71,11,11,7,9,7,16,15,7,PGIM India Dynamic Bond Fund(G),Debt : Dynamic Bond,22,22,22,22,22,22,21,18,4.53,2.61,4.04,5.38,10.9,7.66,6.29,7.03,2.29,3.83,5.55,11.01,,,,14.14
Kotak NIFTY 100 Low Volatility 30 Index Fund-Reg(G),45716,Kotak Mahindra Mutual Fund,4.09,1.54,-2.83,,Nifty100 Low Volatility 30 - TRI,,,,1.27,63,143,108,69,,,,,Kotak NIFTY 100 Low Volatility 30 Index Fund-Reg(G),Equity : Index Funds,175,190,176,151,115,68,32,18,-2.57,4.67,2.21,-3.96,6.58,14.83,22.71,11.63,,,,,,,,
SBI Nifty Bank Index Fund-Reg(G),49104,SBI Mutual Fund,9.36,,,,NIFTY BANK - TRI,,,,,,6,,,,,,,SBI Nifty Bank Index Fund-Reg(G),Equity : Index Funds,175,190,176,151,115,68,32,18,-2.57,4.67,2.21,-3.96,6.58,14.83,22.71,11.63,,,,,,,,
Edelweiss ASEAN Equity Off-Shore Fund-Reg(G),13404,Edelweiss Mutual Fund,-0.24,-4.14,-5.23,12.67,MSCI AC ASEAN 10/40 Index,4.31,9.84,4.54,-4.84,25,6,26,32,14,39,15,17,Edelweiss ASEAN Equity Off-Shore Fund-Reg(G),FoFs : Overseas,57,57,57,57,57,51,27,24,-4.25,-4.25,-6.34,-2.49,10.02,9.01,11.06,6.14,,,,,,,,
Invesco India Banking and PSU Fund(G),17249,Invesco Mutual Fund,2.16,3.34,4.91,9.67,NIFTY Banking and PSU Debt Index,6.76,5.81,6.52,3.76,8,7,7,11,3,16,15,15,Invesco India Banking and PSU Fund(G),Debt : Banking & PSU,26,26,26,26,26,21,16,15,3.5,1.85,3.08,4.7,9.12,6.99,6.36,7.2,,,,,,,,
Mirae Asset Nifty India Manufacturing ETF FoF-Reg(G),46053,Mirae Asset Mutual Fund,1.7,1.18,-6.89,6.53,Nifty India Manufacturing - TRI,17.96,,,-2.21,52,50,55,54,51,7,,,Mirae Asset Nifty India Manufacturing ETF FoF-Reg(G),FoFs : Domestic,61,64,62,61,56,47,28,23,2.55,3.16,3.62,0.43,11.38,12.86,16.38,10.07,,,,,,,,
ICICI Pru Nifty50 Value 20 Index Fund-Reg(G),48523,ICICI Prudential Mutual Fund,1.28,-3.4,-7.97,5.31,Nifty50 Value 20 - TRI,,,,-5.59,128,182,165,118,73,,,,ICICI Pru Nifty50 Value 20 Index Fund-Reg(G),Equity : Index Funds,175,190,176,151,115,68,32,18,-2.57,4.67,2.21,-3.96,6.58,14.83,22.71,11.63,,,,,,,,
Motilal Oswal Nifty 5 Year Benchmark G-Sec ETF,45196,Motilal Oswal Mutual Fund,2.19,3.83,5.76,11.03,Nifty 5 yr Benchmark G-Sec Index TRI,7.63,,,4.52,9,13,10,9,9,8,,,Motilal Oswal Nifty 5 Year Benchmark G-Sec ETF,Debt : ETFs,31,32,31,30,25,14,7,2,3.22,1.36,2.69,4.52,9.22,7.37,5.41,6.03,,,,,,,,
Nippon India Strategic Debt Fund(G),21911,Nippon India Mutual Fund,1.91,3.27,5.09,9.9,CRISIL Medium Duration Debt Index,6.93,7.76,3.4,3.83,8,7,8,6,5,9,2,12,Nippon India Strategic Debt Fund(G),Debt : Medium Duration,29,29,29,29,29,18,12,12,3.24,1.45,2.79,4.44,8.99,7.13,6.96,6.77,,,,,,,,
Sundaram Nifty 100 Equal Weight Fund(G),2384,Sundaram Mutual Fund,4.66,3.99,-3.34,6.01,Nifty100 Equal Weight - TRI,14.97,24.61,11.12,0.71,70,83,67,76,69,32,4,16,Sundaram Nifty 100 Equal Weight Fund(G),Equity : Index Funds,175,190,176,151,115,68,32,18,-2.57,4.67,2.21,-3.96,6.58,14.83,22.71,11.63,,,,,,,,
ICICI Pru Strategic Metal and Energy Equity FoF-Reg(G),46205,ICICI Prudential Mutual Fund,-2.56,5.95,3.49,9.74,NYSE Arca Gold Miners Index,9.66,,,18.76,2,16,6,10,29,25,,,ICICI Pru Strategic Metal and Energy Equity FoF-Reg(G),FoFs : Overseas,57,57,57,57,57,51,27,24,-4.25,-4.25,-6.34,-2.49,10.02,9.01,11.06,6.14,,,,,,,,
PGIM India Arbitrage Fund-Reg(G),28514,PGIM India Mutual Fund,0.9,1.91,3.52,7.1,Nifty 50 Arbitrage,6.26,5.12,5.59,2.37,6,1,3,14,12,20,17,13,PGIM India Arbitrage Fund-Reg(G),Hybrid : Arbitrage,30,30,30,27,26,24,22,14,2.23,0.76,1.79,3.49,7.02,6.46,5.23,5.78,0.82,2.22,4.43,7.52,7.02,5.43,,8.53
