Tata Nifty MidSmall Healthcare Index Fund-Reg(G),48764,Tata Mutual Fund,0.47,11.08,-0.42,19.28,Nifty MidSmall Healthcare - TRI,,,,-6.61,150,177,166,99,2,,,,Tata Nifty MidSmall Healthcare Index Fund-Reg(G),Equity : Index Funds,175,194,187,167,123,68,32,18,0.59,3.51,15.23,-0.43,4.73,18.61,22.89,12.09,,,,,,,,
Canara Rob Dynamic Bond Fund-Reg(G),7792,Canara Robeco Mutual Fund,0.91,5.44,6.18,9.67,CRISIL Dynamic Bond Index,7.37,5.07,6.56,5.36,12,18,3,12,18,18,19,17,Canara Rob Dynamic Bond Fund-Reg(G),Debt : Dynamic Bond,22,22,22,22,22,22,21,19,5.29,1.08,4.72,6.03,10.29,7.97,6.25,7.17,1.14,4.68,6.05,10.95,,,,13.7
Bank of India Balanced Advantage Fund-Reg(G),21917,Bank of India Mutual Fund,1.89,9.4,1.41,1.62,NIFTY 50 Hybrid Composite Debt 50:50 Index,11.98,12.62,7.18,2.93,14,11,10,24,29,17,14,11,Bank of India Balanced Advantage Fund-Reg(G),Hybrid : Dynamic Asset Allocation,33,34,33,33,32,22,19,11,1.74,1.81,8.61,1.68,6.87,13.37,14.66,9.7,,,,,,,,
Shriram Flexi Cap Fund-Reg(G),38781,Shriram Mutual Fund,0.38,10.3,-8.39,-9.13,NIFTY 500 - TRI,13.23,17.43,,-10.69,47,48,45,47,47,33,26,,Shriram Flexi Cap Fund-Reg(G),Equity : Flexi Cap,48,48,48,48,48,35,26,21,-0.83,3.13,13.47,-1.04,6.98,19.03,23.58,13.48,,,,,,,,
Union Gilt Fund-Reg(G),46221,Union Mutual Fund,0.97,5.48,6.36,10.55,CRISIL Dynamic Gilt Index,,,,5.47,19,21,13,15,15,,,,Union Gilt Fund-Reg(G),Debt : Gilt,36,37,37,36,35,23,21,21,5.38,1.07,4.78,6.16,10.48,8.21,5.87,7.42,,,,,,,,
ICICI Pru FMP-88-1226D-F(G),47232,ICICI Prudential Mutual Fund,0.74,2.37,4.25,8.2,CRISIL Medium Duration Debt Index,,,,3.66,41,55,41,39,52,,,,ICICI Pru FMP-88-1226D-F(G),Debt : FTP/FMP,92,93,93,91,91,49,18,4,3.63,0.84,2.46,4.34,8.42,7.45,5.64,6.19,,,,,,,,
Bandhan US Treasury Bond 0-1 year FoF-Reg(G),47724,Bandhan Mutual Fund,0.87,-1.07,3.45,7.71,ICE 0-1 Year US Treasury Securities Index,,,,1.84,37,55,43,37,47,,,,Bandhan US Treasury Bond 0-1 year FoF-Reg(G),FoFs : Overseas,57,57,57,57,57,51,27,24,5.7,7.23,1.96,5.94,13.33,13.63,11.25,6.96,,,,,,,,
LIC MF Focused Fund-Reg(G),32627,LIC Mutual Fund,6.15,17.07,1.25,11.64,NIFTY 500 - TRI,15.28,20.44,,4.71,4,2,2,20,4,26,22,,LIC MF Focused Fund-Reg(G),Equity : Large Cap,38,39,38,38,37,34,31,28,1.96,2.29,12.83,0.78,6.77,17.46,21.6,12.19,,,,,,,,
SBI FMP-46-1850D-Reg(G),45620,SBI Mutual Fund,0.87,2.45,4.31,8.41,CRISIL Medium to Long Term Debt Index,7.54,,,3.75,35,29,39,36,37,27,,,SBI FMP-46-1850D-Reg(G),Debt : FTP/FMP,92,93,93,91,91,49,18,4,3.63,0.84,2.46,4.34,8.42,7.45,5.64,6.19,,,,,,,,
TRUSTMF Banking & PSU Fund-Reg(G),45242,Trust Mutual Fund,1.12,3.44,5.08,9.06,CRISIL Banking and PSU Debt Index,7.12,,,4.52,19,14,18,20,20,20,,,TRUSTMF Banking & PSU Fund-Reg(G),Debt : Banking & PSU,26,26,26,26,26,21,16,16,4.64,1.11,3.62,5.28,9.36,7.49,6.27,7.28,1.17,3.67,5.18,9.19,,,,11.21
Aditya Birla SL Nifty Next 50 ETF,38262,Aditya Birla Sun Life Mutual Fund,3.04,17.48,-4.26,-1.61,NIFTY NEXT 50 - TRI,21.43,24.03,,-1.27,129,77,36,130,128,24,25,,Aditya Birla SL Nifty Next 50 ETF,Equity : ETFs,170,185,177,168,150,103,63,28,2.01,3.27,13.64,0.77,7.19,18.97,24.38,12.41,,,,,,,,
ICICI Pru Quant Fund(G),42805,ICICI Prudential Mutual Fund,1.87,11.19,2.33,9.77,BSE 200 - TRI,19.01,,,3.94,17,86,83,13,12,23,,,ICICI Pru Quant Fund(G),Equity : Thematic,89,98,96,81,62,38,21,9,-1.21,3.87,14.67,-1.49,5.23,21.14,26.44,13.94,,,,,,,,
ICICI Pru Nifty Infrastructure ETF,45998,ICICI Prudential Mutual Fund,2.35,16.84,4.2,2.47,Nifty Infrastructure - TRI,,,,6.34,31,93,45,29,115,,,,ICICI Pru Nifty Infrastructure ETF,Equity : ETFs,170,185,177,168,150,103,63,28,2.01,3.27,13.64,0.77,7.19,18.97,24.38,12.41,,,,,,,,
Motilal Oswal Quant Fund-Reg(G),48806,Motilal Oswal Mutual Fund,7.32,17.99,-7.24,,NIFTY 200 - TRI,,,,-5.94,75,6,14,74,,,,,Motilal Oswal Quant Fund-Reg(G),Equity : Thematic,89,98,96,81,62,38,21,9,-1.21,3.87,14.67,-1.49,5.23,21.14,26.44,13.94,,,,,,,,
Axis BSE Sensex ETF,47768,Axis Mutual Fund,1.5,11.25,3.17,9.22,BSE SENSEX - TRI,,,,4.77,59,143,136,55,65,,,,Axis BSE Sensex ETF,Equity : ETFs,170,185,177,168,150,103,63,28,2.01,3.27,13.64,0.77,7.19,18.97,24.38,12.41,,,,,,,,
Kotak FMP-310-1131D(G),47871,Kotak Mahindra Mutual Fund,0.74,2.31,4.15,8.09,NIFTY Medium Duration Debt Index,,,,3.56,57,59,56,56,63,,,,Kotak FMP-310-1131D(G),Debt : FTP/FMP,92,93,93,91,91,49,18,4,3.63,0.84,2.46,4.34,8.42,7.45,5.64,6.19,,,,,,,,
ICICI Pru Nifty Financial Services Ex-Bank ETF,47166,ICICI Prudential Mutual Fund,5.1,19.72,15.24,24.39,Nifty Financial Services Ex-Bank - TRI,,,,15.89,5,43,17,5,4,,,,ICICI Pru Nifty Financial Services Ex-Bank ETF,Equity : ETFs,170,185,177,168,150,103,63,28,2.01,3.27,13.64,0.77,7.19,18.97,24.38,12.41,,,,,,,,
HSBC Nifty Next 50 Index Fund-Reg(G),33548,HSBC Mutual Fund,2.99,17.07,-4.97,-2.75,NIFTY NEXT 50 - TRI,20.25,22.35,,-1.57,121,100,61,130,111,25,10,,HSBC Nifty Next 50 Index Fund-Reg(G),Equity : Index Funds,175,194,187,167,123,68,32,18,0.65,3.51,15.23,-0.43,4.73,18.73,22.65,12.09,,,,,,,,
Motilal Oswal BSE Enhanced Value ETF,46740,Motilal Oswal Mutual Fund,2.84,17.56,2.98,-0.35,BSE Enhanced Value Index - TRI,,,,6.72,29,86,32,69,123,,,,Motilal Oswal BSE Enhanced Value ETF,Equity : ETFs,170,185,177,168,150,103,63,28,2.01,3.27,13.64,0.77,7.19,18.97,24.38,12.41,,,,,,,,
Bandhan Nifty200 Momentum 30 Index Fund-Reg(G),46608,Bandhan Mutual Fund,3.8,13.3,-11.0,-13.31,Nifty200 Momentum 30 - TRI,,,,-7.17,158,73,114,157,123,,,,Bandhan Nifty200 Momentum 30 Index Fund-Reg(G),Equity : Index Funds,175,194,187,167,123,68,32,18,0.65,3.51,15.23,-0.43,4.73,18.73,22.65,12.09,,,,,,,,
Edelweiss Nifty Next 50 Index Fund-Reg(G),47171,Edelweiss Mutual Fund,2.88,17.07,-4.87,-2.65,NIFTY NEXT 50 - TRI,,,,-1.61,122,107,62,127,107,,,,Edelweiss Nifty Next 50 Index Fund-Reg(G),Equity : Index Funds,175,194,187,167,123,68,32,18,0.65,3.51,15.23,-0.43,4.73,18.73,22.65,12.09,,,,,,,,
Groww Nifty EV & New Age Automotive ETF FOF-Reg(G),48990,Groww Mutual Fund,6.99,13.08,-4.67,,Nifty EV and New Age Automotive - TRI,,,,-1.9,56,4,12,56,,,,,Groww Nifty EV & New Age Automotive ETF FOF-Reg(G),FoFs : Domestic,61,67,62,61,56,47,28,23,4.73,2.69,9.86,4.34,8.96,15.08,16.99,10.28,,,,,,,,
DSP FMP 268-1281D-Reg(G),47124,DSP Mutual Fund,0.79,2.24,4.11,8.23,CRISIL Medium Duration Debt Index,,,,3.58,54,40,66,62,48,,,,DSP FMP 268-1281D-Reg(G),Debt : FTP/FMP,92,93,93,91,91,49,18,4,3.63,0.84,2.46,4.34,8.42,7.45,5.64,6.19,,,,,,,,
Bank of India Short Term Income Fund-Reg(G),7456,Bank of India Mutual Fund,0.97,3.09,4.77,10.54,CRISIL Short Duration Debt Index,9.83,10.25,5.82,4.14,25,24,26,25,1,1,1,18,Bank of India Short Term Income Fund-Reg(G),Debt : Short Duration,30,34,34,29,26,23,21,18,10.72,1.19,3.39,5.19,9.26,7.38,6.46,6.84,,,,,,,,
SBI FMP-78-1170D-Reg(G),47638,SBI Mutual Fund,0.75,2.29,4.12,8.13,CRISIL Medium Duration Debt Index,,,,3.55,58,54,61,60,56,,,,SBI FMP-78-1170D-Reg(G),Debt : FTP/FMP,92,93,93,91,91,49,18,4,3.63,0.84,2.46,4.34,8.42,7.45,5.64,6.19,,,,,,,,
LIC MF Gold ETF FoF(G),17242,LIC Mutual Fund,0.46,11.92,24.22,30.28,Gold-India,21.59,12.27,11.36,23.95,4,18,12,12,10,6,10,10,LIC MF Gold ETF FoF(G),Gold : MFs,17,18,18,17,16,10,10,10,21.42,1.11,10.82,21.89,24.95,21.54,13.76,11.88,,,,,,,,
Motilal Oswal Nifty 500 ETF,48267,Motilal Oswal Mutual Fund,3.14,14.65,1.42,7.26,NIFTY 500 - TRI,,,,2.42,90,68,71,81,93,,,,Motilal Oswal Nifty 500 ETF,Equity : ETFs,170,185,177,168,150,103,63,28,2.01,3.27,13.64,0.77,7.19,18.97,24.38,12.41,,,,,,,,
SBI Nifty 200 Quality 30 ETF,41015,SBI Mutual Fund,4.27,13.81,-2.16,5.07,NIFTY200 Quality 30 - TRI,16.51,19.93,,-0.23,118,53,81,122,107,54,61,,SBI Nifty 200 Quality 30 ETF,Equity : ETFs,170,185,177,168,150,103,63,28,2.01,3.27,13.64,0.77,7.19,18.97,24.38,12.41,,,,,,,,
Axis NIFTY IT Index Fund-Reg(G),47983,Axis Mutual Fund,5.55,0.26,-12.7,11.48,NIFTY IT - TRI,,,,-12.68,175,34,187,167,13,,,,Axis NIFTY IT Index Fund-Reg(G),Equity : Index Funds,175,194,187,167,123,68,32,18,0.65,3.51,15.23,-0.43,4.73,18.73,22.65,12.09,,,,,,,,
SBI Magnum Childrens Benefit Fund-Savings Plan,2748,SBI Mutual Fund,1.33,5.63,2.19,13.49,NIFTY 50 Hybrid Composite Debt 15:85 Index,13.43,15.09,11.7,1.8,26,39,40,19,3,21,21,6,SBI Magnum Childrens Benefit Fund-Savings Plan,Hybrid : Solution Oriented,43,43,43,42,42,37,32,15,1.65,2.68,10.49,1.67,8.8,14.62,16.21,10.44,,,,,,,,
Bank of India Money Market Fund-Reg(G),49468,Bank of India Mutual Fund,0.62,2.28,,,CRISIL Money Market Index,,,,,,20,18,,,,,,Bank of India Money Market Fund-Reg(G),Debt : Money Market,22,23,23,22,22,19,17,13,3.47,0.63,2.31,4.07,7.83,7.13,5.76,6.61,,,,,,,,
Quantum Equity FoF-Reg(G),19904,Quantum Mutual Fund,2.66,13.65,1.54,9.15,BSE 200 - TRI,18.95,22.75,12.74,1.79,49,22,11,46,31,10,7,4,Quantum Equity FoF-Reg(G),FoFs : Domestic,61,67,62,61,56,47,28,23,4.73,2.69,9.86,4.34,8.96,15.08,16.99,10.28,,,,,,,,
Motilal Oswal Nifty 200 Momentum 30 ETF,46325,Motilal Oswal Mutual Fund,3.87,13.53,-10.69,-12.35,Nifty200 Momentum 30 - TRI,20.81,,,-6.85,151,62,85,155,147,30,,,Motilal Oswal Nifty 200 Momentum 30 ETF,Equity : ETFs,170,185,177,168,150,103,63,28,2.01,3.27,13.64,0.77,7.19,18.97,24.38,12.41,,,,,,,,
Groww Largecap Fund-Reg(G),15997,Groww Mutual Fund,3.12,13.85,-0.12,2.52,NIFTY 100 - TRI,15.94,19.38,11.35,1.94,23,7,7,28,30,24,26,22,Groww Largecap Fund-Reg(G),Equity : Large Cap,38,39,38,38,37,34,31,28,1.96,2.29,12.83,0.78,6.77,17.46,21.6,12.19,,,,,,,,
DSP World Mining FoF-Reg(G),8359,DSP Mutual Fund,2.52,6.41,1.84,-4.0,MSCI ACWI Metals & Mining 30% Buffer 10/40 (1994) Net TRI,0.0,13.33,8.98,10.77,9,52,9,45,56,50,9,7,DSP World Mining FoF-Reg(G),FoFs : Overseas,57,57,57,57,57,51,27,24,5.7,7.23,1.96,5.94,13.33,13.63,11.25,6.96,,,,,,,,
Mirae Asset Nifty IT ETF,48250,Mirae Asset Mutual Fund,5.63,0.54,-12.22,12.7,NIFTY IT - TRI,,,,-12.28,163,27,164,159,30,,,,Mirae Asset Nifty IT ETF,Equity : ETFs,170,185,177,168,150,103,63,28,2.01,3.27,13.64,0.77,7.19,18.97,24.38,12.41,,,,,,,,
Tata Floating Rate Fund-Reg(G),45375,Tata Mutual Fund,1.06,3.8,5.36,9.42,CRISIL Short Duration Debt Index,7.51,,,4.58,6,4,2,4,7,10,,,Tata Floating Rate Fund-Reg(G),Debt : Floater,12,12,12,12,12,12,7,5,4.47,0.99,3.38,5.1,9.45,7.77,6.55,7.16,,,,,,,,
SBI FMP-50-1843D-Reg(G),45842,SBI Mutual Fund,0.91,2.63,4.56,8.73,CRISIL Medium to Long Term Debt Index,7.68,,,3.97,26,26,27,27,29,23,,,SBI FMP-50-1843D-Reg(G),Debt : FTP/FMP,92,93,93,91,91,49,18,4,3.63,0.84,2.46,4.34,8.42,7.45,5.64,6.19,,,,,,,,
ICICI Pru Nifty Auto ETF,46229,ICICI Prudential Mutual Fund,4.89,14.37,1.3,-0.94,NIFTY AUTO - TRI,28.38,,,3.18,83,47,76,83,125,7,,,ICICI Pru Nifty Auto ETF,Equity : ETFs,170,185,177,168,150,103,63,28,2.01,3.27,13.64,0.77,7.19,18.97,24.38,12.41,,,,,,,,
ICICI Pru BSE 500 ETF FOF-Reg(G),45726,ICICI Prudential Mutual Fund,2.89,13.68,-0.4,5.59,BSE 500 - TRI,17.18,,,1.85,47,19,10,51,45,16,,,ICICI Pru BSE 500 ETF FOF-Reg(G),FoFs : Domestic,61,67,62,61,56,47,28,23,4.73,2.69,9.86,4.34,8.96,15.08,16.99,10.28,,,,,,,,
Baroda BNP Paribas NIFTY SDL Dec 2026 Index Fund-Reg(G),47387,Baroda BNP Paribas Mutual Fund,1.06,2.82,4.79,8.91,NIFTY SDL December 2026 Index,,,,4.21,51,42,53,52,45,,,,Baroda BNP Paribas NIFTY SDL Dec 2026 Index Fund-Reg(G),Debt : Medium to Long Duration,59,60,59,59,52,26,11,11,4.9,1.21,3.6,5.53,9.91,7.85,6.06,6.56,,,,,,,,
JM Short Duration Fund-Reg(G),46751,JM Financial Mutual Fund,1.13,3.52,5.22,9.09,CRISIL Short Duration Debt Index,,,,4.62,17,15,14,17,20,,,,JM Short Duration Fund-Reg(G),Debt : Short Duration,30,34,34,29,26,23,21,18,10.72,1.19,3.39,5.19,9.26,7.37,6.47,6.84,,,,,,,,
Canara Rob Income Fund-Reg(G),542,Canara Robeco Mutual Fund,0.78,3.97,5.1,8.87,CRISIL Medium to Long Term Debt Index,6.9,4.99,6.54,4.44,43,59,20,42,47,25,10,7,Canara Rob Income Fund-Reg(G),Debt : Medium to Long Duration,59,60,59,59,52,26,11,11,4.9,1.21,3.6,5.53,9.91,7.85,6.06,6.56,,,,,,,,
ICICI Pru Nifty50 Equal Weight Index Fund-Reg(G),46902,ICICI Prudential Mutual Fund,2.23,12.52,4.44,6.74,NIFTY50 Equal Weight - TRI,,,,6.07,16,118,124,16,62,,,,ICICI Pru Nifty50 Equal Weight Index Fund-Reg(G),Equity : Index Funds,175,194,187,167,123,68,32,18,0.65,3.51,15.23,-0.43,4.73,18.73,22.65,12.09,,,,,,,,
Taurus Mid Cap Fund-Reg(G),3306,Taurus Mutual Fund,5.94,19.92,-1.46,-0.64,Nifty Midcap 150 - TRI,22.11,25.14,14.59,0.85,2,12,1,16,29,18,23,18,Taurus Mid Cap Fund-Reg(G),Equity : Mid Cap,30,31,30,30,30,25,24,20,-2.62,5.37,16.72,-1.51,8.11,24.72,30.3,15.77,,,,,,,,
Mirae Asset Nifty 100 ESG Sector Leaders ETF,45134,Mirae Asset Mutual Fund,2.0,13.16,3.94,9.36,Nifty100 ESG Sector Leaders - TRI,15.17,,,5.47,36,111,93,31,43,90,,,Mirae Asset Nifty 100 ESG Sector Leaders ETF,Equity : ETFs,170,185,177,168,150,103,63,28,2.01,3.27,13.64,0.77,7.19,18.97,24.38,12.41,,,,,,,,
Mirae Asset Dynamic Bond Fund-Reg(G),36556,Mirae Asset Mutual Fund,1.06,2.97,4.61,8.38,CRISIL Dynamic Bond Index,6.8,4.58,,4.08,21,14,21,21,21,20,21,,Mirae Asset Dynamic Bond Fund-Reg(G),Debt : Dynamic Bond,22,22,22,22,22,22,21,19,5.28,1.08,4.72,6.03,10.29,7.95,6.25,7.17,1.14,4.68,6.05,10.95,,,,13.7
Edelweiss Nifty Smallcap 250 Index Fund-Reg(G),47167,Edelweiss Mutual Fund,7.02,20.27,-5.38,5.24,Nifty Smallcap 250 - TRI,,,,-5.83,144,12,15,140,76,,,,Edelweiss Nifty Smallcap 250 Index Fund-Reg(G),Equity : Index Funds,175,194,187,167,123,68,32,18,0.65,3.51,15.23,-0.43,4.73,18.73,22.65,12.09,,,,,,,,
SBI FMP-43-1616D-Reg(G),45525,SBI Mutual Fund,0.54,1.7,3.47,7.39,CRISIL Medium Duration Debt Index,7.13,,,2.9,73,74,75,74,72,32,,,SBI FMP-43-1616D-Reg(G),Debt : FTP/FMP,92,93,93,91,91,49,18,4,3.63,0.84,2.46,4.34,8.42,7.45,5.64,6.19,,,,,,,,
Kotak Nifty Smallcap 50 Index Fund-Reg(G),46631,Kotak Mahindra Mutual Fund,5.35,19.6,-4.71,8.2,Nifty Smallcap 50 - TRI,,,,-4.48,131,45,20,121,41,,,,Kotak Nifty Smallcap 50 Index Fund-Reg(G),Equity : Index Funds,175,194,187,167,123,68,32,18,0.65,3.51,15.23,-0.43,4.73,18.73,22.65,12.09,,,,,,,,
ICICI Pru Nifty 100 ETF,22404,ICICI Prudential Mutual Fund,2.03,12.85,2.25,6.8,NIFTY 100 - TRI,15.99,22.03,12.59,4.01,77,108,98,75,96,73,45,18,ICICI Pru Nifty 100 ETF,Equity : ETFs,170,185,177,168,150,103,63,28,2.01,3.27,13.64,0.77,7.19,18.97,24.38,12.41,,,,,,,,
Tata Nifty500 Multicap India Manufacturing 50:30:20 Index Fund-Reg(G),48782,Tata Mutual Fund,3.52,14.61,0.37,3.75,Nifty500 Multicap India Manufacturing 50:30:20 - TRI,,,,0.6,91,80,88,91,82,,,,Tata Nifty500 Multicap India Manufacturing 50:30:20 Index Fund-Reg(G),Equity : Index Funds,175,194,187,167,123,68,32,18,0.65,3.51,15.23,-0.43,4.73,18.73,22.65,12.09,,,,,,,,
Canara Rob Corp Bond Fund-Reg(G),23504,Canara Robeco Mutual Fund,0.88,3.47,4.87,8.8,CRISIL Corporate Bond Index,6.85,5.65,6.66,4.21,21,21,20,21,21,20,18,10,Canara Rob Corp Bond Fund-Reg(G),Debt : Corporate Bond,21,21,21,21,21,20,18,12,4.98,1.19,3.95,5.65,9.93,7.67,6.44,7.24,,,,,,,,
Kotak NIFTY Midcap 150 Momentum 50 Index Fund-Reg(G),49180,Kotak Mahindra Mutual Fund,4.18,18.61,-5.57,,Nifty Midcap150 Momentum 50 - TRI,,,,-5.56,136,58,31,142,,,,,Kotak NIFTY Midcap 150 Momentum 50 Index Fund-Reg(G),Equity : Index Funds,175,194,187,167,123,68,32,18,0.65,3.51,15.23,-0.43,4.73,18.73,22.65,12.09,,,,,,,,
PGIM India Gilt Fund(G),7012,PGIM India Mutual Fund,1.16,5.09,6.24,10.52,CRISIL Dynamic Gilt Index,7.88,5.77,7.14,5.47,16,11,25,21,16,18,12,13,PGIM India Gilt Fund(G),Debt : Gilt,36,37,37,36,35,23,21,21,5.37,1.07,4.78,6.16,10.48,8.17,5.86,7.42,,,,,,,,
Aditya Birla SL CRISIL IBX Gilt June 2027 Index Fund-Reg(G),48450,Aditya Birla Sun Life Mutual Fund,1.11,2.97,4.98,,CRISIL IBX Gilt Index - June 2027,,,,4.45,34,16,35,34,,,,,Aditya Birla SL CRISIL IBX Gilt June 2027 Index Fund-Reg(G),Debt : Gilt,36,37,37,36,35,23,21,21,5.37,1.07,4.78,6.16,10.48,8.17,5.86,7.42,,,,,,,,
Kotak FMP-304-3119D(G),47401,Kotak Mahindra Mutual Fund,1.81,5.65,7.73,12.95,NIFTY Long Duration Debt Index,,,,6.81,1,1,1,1,1,,,,Kotak FMP-304-3119D(G),Debt : FTP/FMP,92,93,93,91,91,49,18,4,3.63,0.84,2.46,4.34,8.42,7.44,5.63,6.19,,,,,,,,
Bandhan Conservative Hybrid Fund-Reg(G),8465,Bandhan Mutual Fund,1.21,5.96,4.66,9.23,NIFTY AAA Short Duration Bond Index,8.32,7.81,6.83,4.65,3,13,7,5,11,17,16,15,Bandhan Conservative Hybrid Fund-Reg(G),Hybrid : Debt Oriented (Conservative),18,18,18,18,18,18,17,17,3.88,1.41,5.75,4.19,9.33,10.03,10.53,7.83,,,,,,,,
Kotak Nifty 50 Value 20 ETF,31116,Kotak Mahindra Mutual Fund,1.6,7.6,-5.01,4.38,Nifty50 Value 20 - TRI,17.64,24.4,,-3.29,134,132,156,141,108,45,15,,Kotak Nifty 50 Value 20 ETF,Equity : ETFs,170,185,177,168,150,103,63,28,2.01,3.27,13.64,0.77,7.19,18.97,24.38,12.41,,,,,,,,
HDFC NIFTY Realty Index Fund-Reg(G),48654,HDFC Mutual Fund,8.34,18.21,-8.2,-7.02,NIFTY REALTY - TRI,,,,-9.45,167,8,40,147,116,,,,HDFC NIFTY Realty Index Fund-Reg(G),Equity : Index Funds,175,194,187,167,123,68,32,18,0.65,3.51,15.23,-0.43,4.73,18.73,22.65,12.09,,,,,,,,
Edelweiss Emerging Markets Opp Eq. Offshore Fund-Reg(G),20281,Edelweiss Mutual Fund,7.26,5.24,10.46,7.82,MSCI Emerging Market Index,6.08,5.47,4.47,8.07,14,27,11,11,45,42,24,19,Edelweiss Emerging Markets Opp Eq. Offshore Fund-Reg(G),FoFs : Overseas,57,57,57,57,57,51,27,24,5.7,7.23,1.96,5.94,13.33,13.63,11.25,6.96,,,,,,,,
Quantum Small Cap Fund-Reg(G),48248,Quantum Mutual Fund,8.13,17.02,-0.41,12.29,BSE 250 Small Cap - TRI,,,,1.15,1,2,20,1,6,,,,Quantum Small Cap Fund-Reg(G),Equity : Small Cap,29,30,30,29,27,23,21,13,-5.56,6.19,17.6,-5.29,8.26,24.15,35.39,16.99,,,,,,,,
Nippon India FHF-XLV-4-1111D(G),47822,Nippon India Mutual Fund,0.75,2.34,4.21,8.21,CRISIL Medium Duration Debt Index,,,,3.62,51,52,49,47,51,,,,Nippon India FHF-XLV-4-1111D(G),Debt : FTP/FMP,92,93,93,91,91,49,18,4,3.63,0.84,2.46,4.34,8.42,7.44,5.63,6.19,,,,,,,,
Navi Aggressive Hybrid Fund-Reg(G),39479,Navi Mutual Fund,3.04,9.36,0.16,7.97,CRISIL Hybrid 35+65 - Aggressive Index,14.07,16.59,,0.54,46,10,30,46,37,27,25,,Navi Aggressive Hybrid Fund-Reg(G),Hybrid : Equity Oriented,55,56,55,55,55,54,51,29,6.5,6.43,13.13,6.55,12.57,14.51,16.6,10.19,,,,,,,,
Bajaj Finserv Banking and PSU Fund-Reg(G),48214,Bajaj Finserv Mutual Fund,1.4,4.22,5.81,10.0,NIFTY Banking and PSU Debt Index,,,,5.19,3,1,4,3,4,,,,Bajaj Finserv Banking and PSU Fund-Reg(G),Debt : Banking & PSU,26,26,26,26,26,21,16,16,4.64,1.11,3.62,5.28,9.36,7.49,6.28,7.28,,,,,,,,
PGIM India Dynamic Bond Fund(G),15247,PGIM India Mutual Fund,1.1,4.78,6.05,10.36,CRISIL Dynamic Bond Index,7.62,5.72,7.22,5.31,14,11,13,13,13,16,14,8,PGIM India Dynamic Bond Fund(G),Debt : Dynamic Bond,22,22,22,22,22,22,21,19,5.28,1.08,4.72,6.03,10.29,7.95,6.25,7.17,1.14,4.68,6.05,10.95,,,,13.7
ICICI Pru Debt Mgmt Fund(FOF)(G),1707,ICICI Prudential Mutual Fund,0.99,3.67,5.48,9.66,CRISIL Composite Bond Index,8.18,6.96,7.85,4.76,25,55,55,23,28,41,25,18,ICICI Pru Debt Mgmt Fund(FOF)(G),FoFs : Domestic,61,67,62,61,56,47,28,23,4.73,2.69,9.86,4.34,8.96,15.08,16.99,10.28,,,,,,,,
TRUSTMF Overnight Fund-Reg(G),45719,Trust Mutual Fund,0.46,1.43,3.06,6.43,CRISIL Liquid Overnight Index,6.33,,,2.48,26,17,26,26,13,9,,,TRUSTMF Overnight Fund-Reg(G),Debt : Overnight,34,34,34,34,34,28,27,3,2.49,0.46,1.44,3.07,6.39,6.31,5.03,5.55,0.47,1.48,3.12,6.52,,,,6.2
Bandhan CRISIL IBX 90:10 SDL Plus Gilt - Nov 2026 Index Fund-Reg(G),46213,Bandhan Mutual Fund,0.98,2.7,4.65,8.73,CRISIL IBX 90:10 SDL Plus Gilt Index - November 2026,,,,4.06,54,47,55,55,48,,,,Bandhan CRISIL IBX 90:10 SDL Plus Gilt - Nov 2026 Index Fund-Reg(G),Debt : Medium to Long Duration,59,60,59,59,52,26,11,11,4.9,1.21,3.6,5.53,9.91,7.85,6.06,6.56,,,,,,,,
Aditya Birla SL Retirement Fund-40-Reg(G),42770,Aditya Birla Sun Life Mutual Fund,2.28,11.19,2.95,10.78,CRISIL Hybrid 35+65 - Aggressive Index,15.02,14.97,,0.57,33,26,21,15,8,19,22,,Aditya Birla SL Retirement Fund-40-Reg(G),Hybrid : Solution Oriented,43,43,43,42,42,37,32,15,1.65,2.68,10.49,1.67,8.8,14.62,16.21,10.44,,,,,,,,
SBI Nifty Bank Index Fund-Reg(G),49104,SBI Mutual Fund,0.08,14.6,,,NIFTY BANK - TRI,,,,,,179,89,,,,,,SBI Nifty Bank Index Fund-Reg(G),Equity : Index Funds,175,194,187,167,123,68,32,18,0.65,3.51,15.23,-0.43,4.73,18.73,22.65,12.09,,,,,,,,
Tata Nifty India Digital ETF FoF-Reg(G),46355,Tata Mutual Fund,3.61,7.49,-8.79,11.53,Nifty India Digital  - TRI,17.43,,,-9.64,61,10,37,60,14,14,,,Tata Nifty India Digital ETF FoF-Reg(G),FoFs : Domestic,61,67,62,61,56,47,28,23,4.73,2.69,9.86,4.34,8.96,15.08,16.99,10.28,,,,,,,,
Nippon India CRISIL-IBX AAA Financial Services - Jan 2028 Index Fund-Reg(G),49221,Nippon India Mutual Fund,0.96,3.25,5.2,,CRISIL-IBX AAA Financial Services Index - Jan 2028,,,,4.45,42,49,37,39,,,,,Nippon India CRISIL-IBX AAA Financial Services - Jan 2028 Index Fund-Reg(G),Debt : Medium to Long Duration,59,60,59,59,52,26,11,11,4.9,1.21,3.6,5.53,9.91,7.85,6.06,6.56,,,,,,,,
Samco ELSS Tax Saver Fund-Reg(G),46606,Samco Mutual Fund,8.52,21.56,-8.24,-5.02,NIFTY 500 - TRI,,,,-8.58,57,2,3,58,57,,,,Samco ELSS Tax Saver Fund-Reg(G),Equity : Tax Saving (ELSS),59,60,60,59,59,54,54,29,-0.52,3.41,13.41,-1.24,7.47,19.83,26.28,13.39,,,,,,,,
Bank of India Credit Risk Fund-Reg(G),30390,Bank of India Mutual Fund,0.52,2.1,3.29,5.88,CRISIL Credit Risk Debt Index,5.79,26.9,1.79,2.98,15,15,15,15,15,15,1,13,Bank of India Credit Risk Fund-Reg(G),Debt : Credit Risk,15,15,15,15,15,15,15,13,6.41,0.99,4.65,6.98,11.38,8.51,9.24,6.57,,,,,,,,
Motilal Oswal BSE Low Volatility Index Fund-Reg(G),46438,Motilal Oswal Mutual Fund,1.76,10.12,2.71,2.79,BSE Low Volatility Index - TRI,17.37,,,2.94,67,150,175,55,86,34,,,Motilal Oswal BSE Low Volatility Index Fund-Reg(G),Equity : Index Funds,175,194,187,167,123,68,32,18,0.65,3.51,15.23,-0.43,4.73,18.73,22.65,12.09,,,,,,,,
Sundaram Global Brand Theme - Equity Active FoF(G),3005,Sundaram Mutual Fund,6.27,-2.43,5.25,10.55,MSCI AC World Index,14.04,12.81,8.04,2.54,32,38,49,21,33,24,10,10,Sundaram Global Brand Theme - Equity Active FoF(G),FoFs : Overseas,57,57,57,57,57,51,27,24,5.7,7.23,1.96,5.94,13.33,13.63,11.25,6.96,,,,,,,,
Axis CRISIL-IBX AAA Bond Financial Services - Sep 2027 Index Fund-Reg(G),49254,Axis Mutual Fund,0.98,3.33,5.24,,CRISIL IBX AAA Financial Services Index - Sep 2027,,,,4.51,40,48,34,36,,,,,Axis CRISIL-IBX AAA Bond Financial Services - Sep 2027 Index Fund-Reg(G),Debt : Medium to Long Duration,59,60,59,59,52,26,11,11,4.9,1.21,3.6,5.53,9.91,7.85,6.06,6.56,,,,,,,,
Mirae Asset Nifty India Manufacturing ETF FoF-Reg(G),46053,Mirae Asset Mutual Fund,4.83,16.66,1.35,1.64,Nifty India Manufacturing - TRI,23.1,,,2.79,41,8,5,48,52,2,,,Mirae Asset Nifty India Manufacturing ETF FoF-Reg(G),FoFs : Domestic,61,67,62,61,56,47,28,23,4.73,2.69,9.86,4.34,8.96,15.08,16.99,10.28,,,,,,,,
PGIM India Healthcare Fund-Reg(G),48975,PGIM India Mutual Fund,-0.42,9.39,,,BSE Health Care - TRI,,,,-5.44,8,9,10,,,,,,PGIM India Healthcare Fund-Reg(G),Equity : Sectoral - Pharma,18,18,18,16,16,10,9,3,-6.16,0.01,9.96,-2.0,17.43,23.14,22.03,12.23,,,,,,,,
ICICI Pru Retirement Fund-Pure Debt Plan(G),25670,ICICI Prudential Mutual Fund,0.89,3.35,4.85,8.69,NIFTY Composite Debt Index,6.88,5.77,,4.27,4,42,42,2,21,36,30,,ICICI Pru Retirement Fund-Pure Debt Plan(G),Hybrid : Solution Oriented,43,43,43,42,42,37,32,15,1.71,2.68,10.49,1.67,8.8,14.69,16.12,10.44,,,,,,,,
Groww Nifty India Defence ETF,49018,Groww Mutual Fund,26.07,69.73,30.08,,Nifty India Defence - TRI,,,,35.3,2,2,2,2,,,,,Groww Nifty India Defence ETF,Equity : ETFs,170,185,177,168,150,103,63,28,2.07,3.27,13.64,0.77,7.19,19.11,24.14,12.41,,,,,,,,
TRUSTMF Short Duration Fund-Reg(G),45652,Trust Mutual Fund,1.23,3.64,5.41,9.38,CRISIL Short Duration Debt Index,7.22,,,4.77,9,3,8,10,15,15,,,TRUSTMF Short Duration Fund-Reg(G),Debt : Short Duration,30,34,34,29,26,23,21,18,10.72,1.19,3.39,5.19,9.26,7.37,6.47,6.84,,,,,,,,
PGIM India Arbitrage Fund-Reg(G),28514,PGIM India Mutual Fund,0.57,1.88,3.59,7.13,Nifty 50 Arbitrage,6.34,5.06,5.53,2.91,3,1,1,3,12,19,17,13,PGIM India Arbitrage Fund-Reg(G),Hybrid : Arbitrage,30,31,30,28,26,24,22,14,2.7,0.45,1.64,3.41,7.04,6.52,5.14,5.73,0.48,1.91,3.99,7.61,7.07,5.54,,8.07
Mahindra Manulife Arbitrage Fund-Reg(G),45042,Mahindra Manulife Mutual Fund,0.33,1.32,2.75,5.76,Nifty 50 Arbitrage,5.33,,,2.17,29,30,29,28,26,24,,,Mahindra Manulife Arbitrage Fund-Reg(G),Hybrid : Arbitrage,30,31,30,28,26,24,22,14,2.7,0.45,1.64,3.41,7.04,6.52,5.14,5.73,0.48,1.91,3.99,7.61,7.07,5.54,,8.07
ICICI Pru Nifty50 Value 20 Index Fund-Reg(G),48523,ICICI Prudential Mutual Fund,1.55,7.45,-5.3,3.65,Nifty50 Value 20 - TRI,,,,-3.54,129,154,180,136,83,,,,ICICI Pru Nifty50 Value 20 Index Fund-Reg(G),Equity : Index Funds,175,194,187,167,123,68,32,18,0.65,3.51,15.23,-0.43,4.73,18.73,22.65,12.09,,,,,,,,
Motilal Oswal Nifty 5 Year Benchmark G-Sec ETF,45196,Motilal Oswal Mutual Fund,1.64,4.51,6.75,11.37,Nifty 5 yr Benchmark G-Sec Index TRI,8.45,,,6.0,9,4,13,10,11,8,,,Motilal Oswal Nifty 5 Year Benchmark G-Sec ETF,Debt : ETFs,31,33,31,31,26,14,7,2,4.11,0.91,2.84,4.87,9.09,7.96,5.44,6.1,,,,,,,,
Kotak NIFTY 100 Low Volatility 30 Index Fund-Reg(G),45716,Kotak Mahindra Mutual Fund,1.14,9.9,2.67,,Nifty100 Low Volatility 30 - TRI,,,,2.82,72,169,177,56,,,,,Kotak NIFTY 100 Low Volatility 30 Index Fund-Reg(G),Equity : Index Funds,175,194,187,167,123,68,32,18,0.65,3.51,15.23,-0.43,4.73,18.73,22.65,12.09,,,,,,,,
Invesco India Banking and PSU Fund(G),17249,Invesco Mutual Fund,1.28,4.15,5.73,9.92,NIFTY Banking and PSU Debt Index,7.6,5.75,6.62,5.03,7,5,7,7,6,8,15,16,Invesco India Banking and PSU Fund(G),Debt : Banking & PSU,26,26,26,26,26,21,16,16,4.64,1.11,3.62,5.28,9.36,7.49,6.28,7.28,,,,,,,,
Sundaram Nifty 100 Equal Weight Fund(G),2384,Sundaram Mutual Fund,2.82,14.77,0.98,2.48,Nifty100 Equal Weight - TRI,19.12,23.85,11.61,2.91,68,110,85,75,89,28,4,16,Sundaram Nifty 100 Equal Weight Fund(G),Equity : Index Funds,175,194,187,167,123,68,32,18,0.65,3.51,15.23,-0.43,4.73,18.73,22.65,12.09,,,,,,,,
Kotak Nifty SDL Jul 2026 Index Fund-Reg(G),46729,Kotak Mahindra Mutual Fund,0.87,2.45,4.3,8.36,Nifty SDL Jul 2026 Index,,,,3.76,58,53,58,58,51,,,,Kotak Nifty SDL Jul 2026 Index Fund-Reg(G),Debt : Medium to Long Duration,59,60,59,59,52,26,11,11,4.9,1.21,3.6,5.53,9.91,7.85,6.06,6.56,,,,,,,,
