Tata Retirement Sav Fund - Cons Plan(G),15378,Tata Mutual Fund,-1.61,-0.57,0.79,8.19,CRISIL Short Term Debt Hybrid 75+25 Index,7.15,7.64,7.61,-1.21,14,14,15,20,33,32,28,13,Tata Retirement Sav Fund - Cons Plan(G),Hybrid : Solution Oriented,43,43,42,42,40,37,32,13,-2.21,-2.88,-1.95,0.03,11.42,11.0,12.26,10.07,,,,,,,,
Edelweiss Government Securities Fund-Reg(G),21922,Edelweiss Mutual Fund,0.85,1.44,3.29,8.01,CRISIL Dynamic Gilt Index,6.65,7.2,7.38,1.04,9,19,24,24,15,9,1,7,Edelweiss Government Securities Fund-Reg(G),Debt : Gilt,36,36,36,36,35,23,21,21,0.95,0.86,1.63,3.54,8.0,6.51,6.18,6.91,,,,,,,,
DSP Nifty Smallcap250 Quality 50 Index Fund-Reg(G),48377,DSP Mutual Fund,-11.54,-12.02,-6.84,6.71,Nifty Smallcap250 Quality 50 - TRI,,,,-10.88,166,173,151,101,88,,,,DSP Nifty Smallcap250 Quality 50 Index Fund-Reg(G),Equity : Index Funds,175,175,161,132,108,56,30,18,-4.24,-5.01,-4.81,-3.99,9.79,13.41,15.97,10.86,,,,,,,,
Franklin India Arbitrage Fund-Reg(G),49339,Franklin Templeton Mutual Fund,0.55,,,,Nifty 50 Arbitrage - TRI,,,,0.71,24,26,,,,,,,Franklin India Arbitrage Fund-Reg(G),Hybrid : Arbitrage,30,30,27,26,26,24,22,14,0.74,0.59,1.66,3.35,7.07,6.19,5.15,5.8,,,,,,,,
UTI Gold ETF FoF-Reg(G),47003,UTI Mutual Fund,9.5,7.88,20.65,34.82,Gold-India,,,,11.49,2,9,10,12,2,,,,UTI Gold ETF FoF-Reg(G),Gold : MFs,17,17,16,16,16,10,10,10,10.8,9.34,6.65,20.26,34.09,19.45,14.78,9.95,,,,,,,,
Motilal Oswal Gold and Silver ETFs FoF-Reg(G),17788,Motilal Oswal Mutual Fund,9.28,5.88,20.21,33.57,Gold-India,,,,10.73,11,13,13,13,12,,,,Motilal Oswal Gold and Silver ETFs FoF-Reg(G),Gold : MFs,17,17,16,16,16,10,10,10,10.8,9.34,6.65,20.26,34.09,19.45,14.78,9.95,,,,,,,,
Nippon India FHF-XLIII-5-2315D(G),46433,Nippon India Mutual Fund,0.97,1.99,3.82,8.48,CRISIL Medium to Long Term Debt Index,,,,0.95,10,7,8,13,11,,,,Nippon India FHF-XLIII-5-2315D(G),Debt : FTP/FMP,92,92,91,91,91,42,17,12,0.84,0.72,1.75,3.58,7.75,6.33,5.61,6.0,,,,,,,,
Aditya Birla SL Silver ETF FOF-Reg(G),46225,Aditya Birla Sun Life Mutual Fund,8.55,1.56,17.02,33.39,Silver,14.26,,,8.17,8,3,16,5,5,12,,,Aditya Birla SL Silver ETF FOF-Reg(G),FoFs : Domestic,61,62,61,59,55,46,27,23,-0.13,-0.76,-0.9,2.66,14.18,12.14,12.79,9.72,,,,,,,,
Bank of India Ultra Short Duration Fund-Reg(G),5842,Bank of India Mutual Fund,0.57,1.59,3.27,6.69,CRISIL Ultra Short Term Debt Index,5.86,5.08,6.59,0.68,17,22,21,21,21,18,16,6,Bank of India Ultra Short Duration Fund-Reg(G),Debt : Ultra Short Duration,26,26,25,24,24,24,22,13,0.69,0.59,1.65,3.41,7.1,6.12,5.37,6.21,0.62,1.83,3.76,,,,,7.38
Tata Nifty India Digital ETF,45944,Tata Mutual Fund,-5.75,3.07,5.89,23.66,Nifty India Digital  - TRI,,,,-4.87,130,134,16,19,8,,,,Tata Nifty India Digital ETF,Equity : ETFs,171,171,169,157,145,97,63,25,-2.48,-3.34,-3.07,-1.08,12.77,14.56,16.96,11.23,,,,,,,,
Invesco India Medium Duration Fund-Reg(G),45607,Invesco Mutual Fund,0.85,1.8,3.62,7.77,NIFTY Medium Duration Debt Index,5.7,,,0.92,10,10,13,16,15,13,,,Invesco India Medium Duration Fund-Reg(G),Debt : Medium Duration,29,29,29,29,29,16,12,11,0.88,0.79,1.8,3.71,7.8,6.55,6.04,6.65,,,,,,,,
Nippon India ETF Nifty Infrastructure BeES,12859,Nippon India Mutual Fund,-3.26,-4.56,-8.37,4.86,Nifty Infrastructure - TRI,17.92,20.42,9.73,-2.55,100,97,125,128,132,26,16,22,Nippon India ETF Nifty Infrastructure BeES,Equity : ETFs,171,171,169,157,145,97,63,25,-2.48,-3.34,-3.07,-1.08,12.77,14.56,16.96,11.23,,,,,,,,
Baroda BNP Paribas Credit Risk Fund-Reg(G),25569,Baroda BNP Paribas Mutual Fund,0.77,1.79,4.12,8.19,CRISIL Credit Risk Debt Index,6.91,8.13,7.8,0.99,2,6,6,4,4,8,3,1,Baroda BNP Paribas Credit Risk Fund-Reg(G),Debt : Credit Risk,15,15,15,15,15,15,15,11,0.89,0.74,1.7,3.81,7.93,8.93,6.56,6.51,,,,,,,,
Aditya Birla SL Nifty Next 50 Index Fund-Reg(G),46360,Aditya Birla Sun Life Mutual Fund,-7.55,-8.53,-10.18,14.26,NIFTY NEXT 50 - TRI,,,,-6.63,136,137,134,119,19,,,,Aditya Birla SL Nifty Next 50 Index Fund-Reg(G),Equity : Index Funds,175,175,161,132,108,56,30,18,-4.24,-5.01,-4.81,-3.99,9.79,13.41,15.97,10.86,,,,,,,,
UTI Nifty Private Bank Index Fund-Reg(G),49146,UTI Mutual Fund,-0.86,-2.89,,,Nifty Private Bank - TRI,,,,0.39,3,2,51,,,,,,UTI Nifty Private Bank Index Fund-Reg(G),Equity : Index Funds,175,175,161,132,108,56,30,18,-4.24,-5.01,-4.81,-3.99,9.79,13.41,15.97,10.86,,,,,,,,
UTI Gilt Fund with 10 year Constant Duration-Reg(G),40967,UTI Mutual Fund,1.16,2.21,4.08,8.8,Crisil 10 Yr Gilt Index,,,,1.12,4,4,4,6,6,,,,UTI Gilt Fund with 10 year Constant Duration-Reg(G),Debt : Gilt (10 Yr Constant Duration),6,6,6,6,6,4,4,4,1.18,1.22,2.32,4.17,9.05,7.01,6.28,7.81,,,,,,,,
Mirae Asset Nifty EV and New Age Automotive ETF,48935,Mirae Asset Mutual Fund,-4.39,-6.82,-8.25,,Nifty EV and New Age Automotive - TRI,,,,-2.41,98,113,134,127,,,,,Mirae Asset Nifty EV and New Age Automotive ETF,Equity : ETFs,171,171,169,157,145,97,63,25,-2.48,-3.34,-3.07,-1.08,12.77,14.56,16.96,11.23,,,,,,,,
HDFC NIFTY G-Sec Apr 2029 Index Fund-Reg(G),47712,HDFC Mutual Fund,1.02,2.2,3.9,8.44,NIFTY G- Sec Apr 2029 Index,,,,1.08,3,7,2,7,5,,,,HDFC NIFTY G-Sec Apr 2029 Index Fund-Reg(G),Debt : Medium to Long Duration,59,59,56,52,52,16,11,11,0.95,0.89,1.85,3.68,8.03,6.31,6.03,6.12,,,,,,,,
UTI Silver ETF,46881,UTI Mutual Fund,9.4,0.71,20.7,35.29,Silver,,,,11.3,3,4,31,17,3,,,,UTI Silver ETF,Gold : ETFs,31,31,31,29,27,14,11,11,10.47,8.95,5.25,20.35,34.43,18.63,15.09,10.27,,,,,,,,
DSP Regular Savings Fund-Reg(G),719,DSP Mutual Fund,-0.28,0.38,2.68,10.49,CRISIL Hybrid 85+15 - Conservative Index,8.24,8.36,6.81,0.15,8,9,11,8,4,9,10,12,DSP Regular Savings Fund-Reg(G),Hybrid : Debt Oriented (Conservative),19,19,19,19,19,19,18,17,-0.01,-0.33,0.42,2.42,8.91,8.21,8.53,7.43,,,,,,,,
Aditya Birla SL CRISIL IBX 60:40 SDL + AAA PSU - Apr 2025 Index Fund-Reg(G),46226,Aditya Birla Sun Life Mutual Fund,0.6,1.64,3.39,7.26,CRISIL IBX 60:40 SDL + AAA PSU Index - April 2025,,,,0.68,29,29,25,25,26,,,,Aditya Birla SL CRISIL IBX 60:40 SDL + AAA PSU - Apr 2025 Index Fund-Reg(G),Debt : Medium Duration,29,29,29,29,29,16,12,11,0.88,0.79,1.8,3.71,7.8,6.55,6.04,6.65,,,,,,,,
Mirae Asset Nifty IT ETF,48250,Mirae Asset Mutual Fund,-1.38,6.64,12.77,17.84,NIFTY IT - TRI,,,,-0.19,57,67,7,7,24,,,,Mirae Asset Nifty IT ETF,Equity : ETFs,171,171,169,157,145,97,63,25,-2.48,-3.34,-3.07,-1.08,12.77,14.56,16.96,11.23,,,,,,,,
SBI FMP-76-1221D-Reg(G),47541,SBI Mutual Fund,0.63,1.74,3.53,7.59,CRISIL Medium Duration Debt Index,,,,0.85,60,72,48,57,58,,,,SBI FMP-76-1221D-Reg(G),Debt : FTP/FMP,92,92,91,91,91,42,17,12,0.84,0.72,1.75,3.58,7.75,6.33,5.61,6.0,,,,,,,,
HDFC FMP-Sr 46-1158D-July 2022-Reg(G),46672,HDFC Mutual Fund,0.61,1.58,3.32,7.31,CRISIL Medium Duration Debt Index,,,,0.71,79,77,84,82,77,,,,HDFC FMP-Sr 46-1158D-July 2022-Reg(G),Debt : FTP/FMP,92,92,91,91,91,42,17,12,0.84,0.72,1.75,3.58,7.75,6.33,5.61,6.0,,,,,,,,
SBI Nifty Private Bank ETF,36351,SBI Mutual Fund,-0.76,-2.66,-0.66,6.59,Nifty Private Bank - TRI,8.71,,,0.5,13,11,73,54,127,94,,,SBI Nifty Private Bank ETF,Equity : ETFs,171,171,169,157,145,97,63,25,-2.48,-3.34,-3.07,-1.08,12.77,14.56,16.96,11.23,,,,,,,,
Tata Floating Rate Fund-Reg(G),45375,Tata Mutual Fund,0.74,1.73,3.89,7.8,CRISIL Short Duration Debt Index,6.55,,,0.75,10,5,5,5,11,9,,,Tata Floating Rate Fund-Reg(G),Debt : Floater,12,12,12,12,12,12,7,5,0.8,0.71,1.7,3.73,8.19,6.7,6.39,7.04,,,,,,,,
Aditya Birla SL CRISIL IBX SDL Jun 2032 Index Fund-Reg(G),47592,Aditya Birla Sun Life Mutual Fund,0.87,1.75,4.3,9.25,CRISIL IBX SDL Index - June 2032,,,,1.07,9,14,14,8,8,,,,Aditya Birla SL CRISIL IBX SDL Jun 2032 Index Fund-Reg(G),Debt : Long Duration,26,26,24,24,21,3,3,2,1.0,0.88,1.66,3.91,8.92,6.95,5.89,6.73,,,,,,,,
HDFC Retirement Savings Fund-Hybrid-Debt Plan-Reg(G),24807,HDFC Mutual Fund,-0.53,-0.42,1.42,7.66,NIFTY 50 Hybrid Composite Debt 15:85 Index,8.38,8.33,,-0.32,7,7,13,16,38,28,27,,HDFC Retirement Savings Fund-Hybrid-Debt Plan-Reg(G),Hybrid : Solution Oriented,43,43,42,42,40,37,32,13,-2.21,-2.88,-1.95,0.03,11.42,11.0,12.26,10.07,,,,,,,,
WOC Balanced Hybrid Fund-Reg(G),48213,WhiteOak Capital Mutual Fund,-2.76,-1.2,1.88,12.34,CRISIL Hybrid 50+50 - Moderate Index,,,,-2.21,22,25,16,6,3,,,,WOC Balanced Hybrid Fund-Reg(G),Hybrid : Dynamic Asset Allocation,33,33,33,33,30,22,19,11,-1.9,-2.41,-1.65,-0.51,8.86,10.83,11.46,9.11,,,,,,,,
Edelweiss MSCI India Domestic & World Healthcare 45 Index Fund-Reg(G),45117,Edelweiss Mutual Fund,-1.55,-0.77,4.57,17.37,MSCI India Domestic & World Healthcare 45 Index,16.72,,,-2.4,66,57,9,7,1,5,,,Edelweiss MSCI India Domestic & World Healthcare 45 Index Fund-Reg(G),Equity : Index Funds,175,175,161,132,108,56,30,18,-4.24,-5.01,-4.81,-3.99,9.79,13.41,15.97,10.86,,,,,,,,
Mirae Asset Nifty 1D Rate Liquid ETF(G),49344,Mirae Asset Mutual Fund,0.53,,,,Nifty 1D Rate Index,,,,0.64,22,22,,,,,,,Mirae Asset Nifty 1D Rate Liquid ETF(G),Debt : ETFs,31,31,30,28,24,14,7,2,0.99,0.95,2.13,3.76,8.1,6.55,5.47,5.92,0.59,1.66,3.3,6.73,6.18,5.01,,6.52
HSBC Dynamic Bond Fund-Reg(G),925,HSBC Mutual Fund,0.96,1.7,3.62,8.28,CRISIL Dynamic Bond Index,6.39,5.8,6.75,1.07,4,4,6,9,4,14,13,8,HSBC Dynamic Bond Fund-Reg(G),Debt : Dynamic Bond,22,22,22,22,22,22,21,18,0.93,0.82,1.54,3.51,7.83,6.54,6.21,6.72,0.82,1.87,3.99,,,,,9.48
Edelweiss Nifty500 Multicap Momentum Quality 50 Index Fund-Reg(G),49278,Edelweiss Mutual Fund,-10.67,-10.75,,,Nifty500 Multicap Momentum Quality 50 - TRI,,,,-10.95,167,169,149,,,,,,Edelweiss Nifty500 Multicap Momentum Quality 50 Index Fund-Reg(G),Equity : Index Funds,175,175,161,132,108,56,30,18,-4.24,-5.01,-4.81,-3.99,9.79,13.41,15.97,10.86,,,,,,,,
ICICI Pru Nifty Oil & Gas ETF,33836,ICICI Prudential Mutual Fund,-3.6,-5.32,-15.62,,NIFTY OIL & GAS - TRI,,,,-1.27,82,103,129,155,,,,,ICICI Pru Nifty Oil & Gas ETF,Equity : ETFs,171,171,169,157,145,97,63,25,-2.48,-3.34,-3.07,-1.08,12.77,14.56,16.96,11.23,,,,,,,,
Union Retirement Fund-Reg(G),45735,Union Mutual Fund,-4.81,-3.75,-1.55,10.32,BSE 500 - TRI,,,,-4.02,35,33,34,33,22,,,,Union Retirement Fund-Reg(G),Hybrid : Solution Oriented,43,43,42,42,40,37,32,13,-2.21,-2.88,-1.95,0.03,11.42,11.0,12.26,10.07,-2.37,-5.86,-3.43,8.91,13.88,18.0,,-35.26
Edelweiss CRISIL IBX 50:50 Gilt Plus SDL Sep 2028 Index Fund-Reg(G),47075,Edelweiss Mutual Fund,1.0,1.96,3.73,8.15,CRISIL IBX 50:50 Gilt Plus SDL Index - Sep 2028,,,,0.97,23,9,15,18,19,,,,Edelweiss CRISIL IBX 50:50 Gilt Plus SDL Sep 2028 Index Fund-Reg(G),Debt : Medium to Long Duration,59,59,56,52,52,16,11,11,0.95,0.89,1.85,3.68,8.03,6.31,6.03,6.12,,,,,,,,
SBI FMP-74-1243D-Reg(G),47381,SBI Mutual Fund,0.69,1.72,3.62,7.96,CRISIL Medium Duration Debt Index,,,,0.89,30,41,56,35,30,,,,SBI FMP-74-1243D-Reg(G),Debt : FTP/FMP,92,92,91,91,91,42,17,12,0.84,0.72,1.75,3.58,7.75,6.33,5.61,6.0,,,,,,,,
Aditya Birla SL Long Duration Fund-Reg(G),46711,Aditya Birla Sun Life Mutual Fund,0.69,1.21,3.72,8.57,NIFTY Long Duration Debt Index,,,,0.79,25,23,16,16,16,,,,Aditya Birla SL Long Duration Fund-Reg(G),Debt : Long Duration,26,26,24,24,21,3,3,2,1.0,0.88,1.66,3.91,8.92,6.95,5.89,6.73,,,,,,,,
Edelweiss CRISIL IBX 50:50 Gilt Plus SDL Short Duration Index Fund-Reg(G),47430,Edelweiss Mutual Fund,0.9,1.87,3.64,7.82,CRISIL IBX 50:50 Gilt Plus SDL Short Duration Index,,,,0.95,1,1,6,17,10,,,,Edelweiss CRISIL IBX 50:50 Gilt Plus SDL Short Duration Index Fund-Reg(G),Debt : Short Duration,30,30,29,26,25,23,21,19,0.84,0.75,1.74,3.6,7.41,6.38,6.12,6.64,,,,,,,,
Shriram Multi Asset Allocation Fund-Reg(G),48029,Shriram Mutual Fund,-4.32,-3.32,-4.74,1.45,NIFTY 50 - TRI,,,,-4.16,26,26,23,24,19,,,,Shriram Multi Asset Allocation Fund-Reg(G),Hybrid : Multi Asset Allocation,28,28,26,25,20,10,7,7,-0.37,-1.04,-1.13,1.57,12.51,13.32,17.17,11.66,,,,,,,,
Kotak Nifty 100 Low Volatility 30 ETF,45688,Kotak Mahindra Mutual Fund,-1.18,-1.57,-2.27,10.37,Nifty100 Low Volatility 30 - TRI,,,,0.31,20,42,40,83,81,,,,Kotak Nifty 100 Low Volatility 30 ETF,Equity : ETFs,171,171,169,157,145,97,63,25,-2.48,-3.34,-3.07,-1.08,12.77,14.56,16.96,11.23,,,,,,,,
Nippon India Retirement Fund-Income Generation(G),17166,Nippon India Mutual Fund,-0.3,-0.09,1.75,8.32,CRISIL Hybrid 85+15 - Conservative Index,8.26,7.38,,-0.3,6,4,8,12,31,29,29,,Nippon India Retirement Fund-Income Generation(G),Hybrid : Solution Oriented,43,43,42,42,40,37,32,13,-2.21,-2.88,-1.95,0.03,11.42,11.0,12.26,10.07,,,,,,,,
HDFC FMP-Sr 47-2638D-Feb 2023-Reg(G),47642,HDFC Mutual Fund,1.02,2.08,3.87,8.92,NIFTY Long Duration Debt Index,,,,0.89,34,6,2,11,3,,,,HDFC FMP-Sr 47-2638D-Feb 2023-Reg(G),Debt : FTP/FMP,92,92,91,91,91,42,17,12,0.84,0.72,1.75,3.58,7.75,6.33,5.61,6.0,,,,,,,,
Motilal Oswal Quant Fund-Reg(G),48806,Motilal Oswal Mutual Fund,-7.74,-9.1,-5.83,,NIFTY 200 - TRI,,,,-6.17,62,70,72,41,,,,,Motilal Oswal Quant Fund-Reg(G),Equity : Thematic,89,89,80,71,56,36,20,9,-5.1,-5.97,-5.34,-4.72,11.49,15.97,20.38,12.86,,,,,,,,
ICICI Pru India Equity (FOF)(G),44626,ICICI Prudential Mutual Fund,-2.72,-2.61,-0.98,14.98,BSE 500 - TRI,18.91,,,-1.9,43,43,47,45,16,2,,,ICICI Pru India Equity (FOF)(G),FoFs : Domestic,61,62,61,59,55,46,27,23,-0.13,-0.76,-0.9,2.66,14.18,12.14,12.79,9.72,-2.37,-5.86,-3.43,8.91,13.88,18.0,,-35.26
Bandhan Nifty 100 Index Fund-Reg(G),46119,Bandhan Mutual Fund,-2.39,-3.14,-3.0,10.19,NIFTY 100 - TRI,,,,-1.31,60,59,57,54,36,,,,Bandhan Nifty 100 Index Fund-Reg(G),Equity : Index Funds,175,175,161,132,108,56,30,18,-4.24,-5.01,-4.81,-3.99,9.79,13.41,15.97,10.86,,,,,,,,
WOC Arbitrage Fund-Reg(G),48900,WhiteOak Capital Mutual Fund,0.72,1.74,,,Nifty 50 Arbitrage - TRI,,,,0.87,1,1,3,,,,,,WOC Arbitrage Fund-Reg(G),Hybrid : Arbitrage,30,30,27,26,26,24,22,14,0.74,0.59,1.66,3.35,7.07,6.19,5.15,5.8,,,,,,,,
Nippon India Nifty IT Index Fund-Reg(G),48568,Nippon India Mutual Fund,-1.43,6.38,12.27,,NIFTY IT - TRI,,,,-0.25,46,50,5,1,,,,,Nippon India Nifty IT Index Fund-Reg(G),Equity : Index Funds,175,175,161,132,108,56,30,18,-4.24,-5.01,-4.81,-3.99,9.79,13.41,15.97,10.86,,,,,,,,
Franklin India G-Sec Fund(G),3373,Franklin Templeton Mutual Fund,0.8,1.78,3.57,7.55,Nifty All Duration G-Sec Index,5.5,5.01,5.65,0.85,29,28,15,15,24,23,21,21,Franklin India G-Sec Fund(G),Debt : Gilt,36,36,36,36,35,23,21,21,0.95,0.86,1.63,3.54,8.0,6.51,6.18,6.91,,,,,,,,
Bandhan CRISIL IBX 90:10 SDL Plus Gilt - Sep 2027 Index Fund-Reg(G),46212,Bandhan Mutual Fund,0.91,1.78,3.65,8.05,CRISIL IBX 90:10 SDL Plus Gilt Index - September 2027,,,,1.03,10,12,16,11,13,,,,Bandhan CRISIL IBX 90:10 SDL Plus Gilt - Sep 2027 Index Fund-Reg(G),Debt : Gilt,36,36,36,36,35,23,21,21,0.95,0.86,1.63,3.54,8.0,6.51,6.18,6.91,,,,,,,,
HSBC Conservative Hybrid Fund(G),1458,HSBC Mutual Fund,-3.03,-0.32,1.77,11.52,NIFTY 50 Hybrid Composite Debt 15:85 Index,8.24,8.45,7.15,-2.82,19,19,17,16,1,10,9,10,HSBC Conservative Hybrid Fund(G),Hybrid : Debt Oriented (Conservative),19,19,19,19,19,19,18,17,-0.01,-0.33,0.42,2.42,8.91,8.21,8.53,7.43,,,,,,,,
Axis Silver ETF,46369,Axis Mutual Fund,8.66,1.61,18.89,34.74,Silver,,,,9.98,21,20,21,22,9,,,,Axis Silver ETF,Gold : ETFs,31,31,31,29,27,14,11,11,10.47,8.95,5.25,20.35,34.43,18.63,15.09,10.27,,,,,,,,
LIC MF Value Fund-Reg(G),39956,LIC Mutual Fund,-10.0,-4.02,-1.2,15.0,NIFTY 500 - TRI,14.57,17.63,,-7.7,22,22,6,7,6,20,16,,LIC MF Value Fund-Reg(G),Equity : Value / Contra,22,22,22,22,22,21,17,14,-3.98,-4.88,-5.0,-3.67,11.36,17.79,20.99,13.83,,,,,,,,
ICICI Pru Nifty Healthcare ETF,45383,ICICI Prudential Mutual Fund,-4.96,-1.58,4.04,22.94,Nifty Healthcare Index - TRI,19.09,,,-5.07,131,122,41,22,9,19,,,ICICI Pru Nifty Healthcare ETF,Equity : ETFs,171,171,169,157,145,97,63,25,-2.48,-3.34,-3.07,-1.08,12.77,14.56,16.96,11.23,,,,,,,,
Helios Financial Services Fund-Reg(G),48897,Helios Mutual Fund,-5.6,-5.07,4.04,,Nifty Financial Services - TRI,,,,-4.92,20,20,19,3,,,,,Helios Financial Services Fund-Reg(G),Equity : Sectoral - Financial Services,21,21,21,21,18,14,11,8,-1.8,-2.8,-3.98,1.37,9.93,12.8,12.16,10.94,,,,,,,,
Edelweiss US Value Equity Offshore Fund-Reg(G),21920,Edelweiss Mutual Fund,5.76,5.9,15.38,22.11,Russell 1000 Index,11.54,12.99,10.99,6.19,14,17,28,33,28,20,8,3,Edelweiss US Value Equity Offshore Fund-Reg(G),FoFs : Overseas,58,58,58,58,57,48,27,24,4.76,4.64,6.57,18.39,23.28,9.57,9.02,7.33,,,,,,,,
Helios Overnight Fund-Reg(G),48295,Helios Mutual Fund,0.54,1.63,3.23,6.57,CRISIL Liquid Overnight Index,,,,0.65,28,30,14,26,27,,,,Helios Overnight Fund-Reg(G),Debt : Overnight,35,35,35,35,35,28,27,3,0.63,0.54,1.61,3.23,6.57,6.03,4.87,5.61,0.56,1.66,3.3,,,,,6.53
Shriram Flexi Cap Fund-Reg(G),38781,Shriram Mutual Fund,-10.33,-8.35,-10.29,-1.96,NIFTY 500 - TRI,9.88,12.71,,-10.42,46,46,46,45,46,30,26,,Shriram Flexi Cap Fund-Reg(G),Equity : Flexi Cap,48,48,48,48,47,34,26,20,-4.64,-5.48,-4.2,-2.15,12.96,13.66,17.23,12.69,,,,,,,,
Edelweiss Nifty 100 Quality 30 Index Fund-Reg(G),45961,Edelweiss Mutual Fund,-1.82,-3.01,-4.72,10.75,NIFTY100 Quality 30 - TRI,13.22,,,-0.6,51,58,54,81,32,28,,,Edelweiss Nifty 100 Quality 30 Index Fund-Reg(G),Equity : Index Funds,175,175,161,132,108,56,30,18,-4.24,-5.01,-4.81,-3.99,9.79,13.41,15.97,10.86,,,,,,,,
Invesco India Credit Risk Fund(G),21522,Invesco Mutual Fund,0.78,1.74,3.44,7.25,NIFTY Credit Risk Bond Index,7.28,6.31,5.7,0.83,11,5,8,10,11,4,9,10,Invesco India Credit Risk Fund(G),Debt : Credit Risk,15,15,15,15,15,15,15,11,0.89,0.74,1.7,3.81,7.93,8.93,6.56,6.51,,,,,,,,
Bandhan US Treasury Bond 0-1 year FoF-Reg(G),47724,Bandhan Mutual Fund,2.02,4.74,6.33,10.17,ICE 0-1 Year US Treasury Securities Index,,,,2.41,43,48,33,47,49,,,,Bandhan US Treasury Bond 0-1 year FoF-Reg(G),FoFs : Overseas,58,58,58,58,57,48,27,24,4.76,4.64,6.57,18.39,23.28,9.57,9.02,7.33,,,,,,,,
Axis CRISIL-IBX AAA Bond Financial Services - Sep 2027 Index Fund-Reg(G),49254,Axis Mutual Fund,0.81,,,,CRISIL IBX AAA Financial Services Index - Sep 2027,,,,0.91,47,44,,,,,,,Axis CRISIL-IBX AAA Bond Financial Services - Sep 2027 Index Fund-Reg(G),Debt : Medium to Long Duration,59,59,56,52,52,16,11,11,0.95,0.89,1.85,3.68,8.03,6.31,6.03,6.12,,,,,,,,
Axis NIFTY IT Index Fund-Reg(G),47983,Axis Mutual Fund,-1.46,6.36,12.22,16.75,NIFTY IT - TRI,,,,-0.29,50,53,6,4,4,,,,Axis NIFTY IT Index Fund-Reg(G),Equity : Index Funds,175,175,161,132,108,56,30,18,-4.24,-5.01,-4.81,-3.99,9.79,13.41,15.97,10.86,,,,,,,,
SBI FMP-47-1434D-Reg(G),45660,SBI Mutual Fund,0.58,1.63,3.38,7.46,CRISIL Medium Duration Debt Index,5.9,,,0.71,77,82,75,76,68,38,,,SBI FMP-47-1434D-Reg(G),Debt : FTP/FMP,92,92,91,91,91,42,17,12,0.84,0.72,1.75,3.58,7.75,6.33,5.61,6.0,,,,,,,,
Quantum Gold Saving Fund-Reg(G),19961,Quantum Mutual Fund,9.92,8.18,21.76,34.8,Gold-India,19.59,14.95,10.16,11.47,3,2,4,1,3,4,2,2,Quantum Gold Saving Fund-Reg(G),Gold : MFs,17,17,16,16,16,10,10,10,10.8,9.34,6.65,20.26,34.09,19.45,14.78,9.95,,,,,,,,
Canara Rob Gilt Fund-Reg(G),538,Canara Robeco Mutual Fund,0.84,1.28,3.25,7.52,CRISIL Dynamic Gilt Index,6.19,5.81,6.81,0.94,15,21,29,28,28,18,14,12,Canara Rob Gilt Fund-Reg(G),Debt : Gilt,36,36,36,36,35,23,21,21,0.95,0.86,1.63,3.54,8.0,6.51,6.18,6.91,,,,,,,,
Nippon India CRISIL-IBX AAA Financial Services - Jan 2028 Index Fund-Reg(G),49221,Nippon India Mutual Fund,0.79,1.92,,,CRISIL-IBX AAA Financial Services Index - Jan 2028,,,,0.87,53,49,17,,,,,,Nippon India CRISIL-IBX AAA Financial Services - Jan 2028 Index Fund-Reg(G),Debt : Medium to Long Duration,59,59,56,52,52,16,11,11,0.95,0.89,1.85,3.68,8.03,6.31,6.03,6.12,,,,,,,,
Bank of India Overnight Fund-Reg(G),44437,Bank of India Mutual Fund,0.56,1.67,3.33,6.77,CRISIL Liquid Overnight Index,6.19,5.03,,0.67,1,1,1,1,2,1,1,,Bank of India Overnight Fund-Reg(G),Debt : Overnight,35,35,35,35,35,28,27,3,0.63,0.54,1.61,3.23,6.57,6.03,4.87,5.61,0.56,1.66,3.3,,,,,6.53
Union Equity Savings Fund-Reg(G),40627,Union Mutual Fund,-0.98,-0.25,0.93,6.49,Crisil Equity Savings Index,7.08,8.03,,-0.8,25,18,21,27,50,48,44,,Union Equity Savings Fund-Reg(G),Hybrid : Equity Oriented,55,55,55,55,55,54,51,29,-1.66,-2.21,-1.28,0.42,10.31,10.23,12.12,9.63,,,,,,,,
Axis All Seasons Debt FOFs-Reg(G),43840,Axis Mutual Fund,0.92,1.64,3.59,8.43,NIFTY Composite Debt Index,6.73,6.69,,0.73,23,15,15,25,47,41,23,,Axis All Seasons Debt FOFs-Reg(G),FoFs : Domestic,61,62,61,59,55,46,27,23,-0.13,-0.76,-0.9,2.66,14.18,12.14,12.79,9.72,,,,,,,,
Bandhan Nifty200 Momentum 30 Index Fund-Reg(G),46608,Bandhan Mutual Fund,-9.01,-12.51,-12.78,2.8,Nifty200 Momentum 30 - TRI,,,,-9.06,152,151,154,127,107,,,,Bandhan Nifty200 Momentum 30 Index Fund-Reg(G),Equity : Index Funds,175,175,161,132,108,56,30,18,-4.24,-5.01,-4.81,-3.99,9.79,13.41,15.97,10.86,,,,,,,,
Zerodha Gold ETF,48500,Zerodha Mutual Fund,9.16,7.53,21.01,,Gold-India,,,,10.65,15,14,16,12,,,,,Zerodha Gold ETF,Gold : ETFs,31,31,31,29,27,14,11,11,10.47,8.95,5.25,20.35,34.43,18.63,15.09,10.27,,,,,,,,
SBI FMP-52-1848D-Reg(G),45915,SBI Mutual Fund,0.77,1.82,3.73,8.06,CRISIL Medium to Long Term Debt Index,6.39,,,0.93,18,23,18,22,26,14,,,SBI FMP-52-1848D-Reg(G),Debt : FTP/FMP,92,92,91,91,91,42,17,12,0.84,0.72,1.75,3.58,7.75,6.33,5.61,6.0,,,,,,,,
ICICI Pru Nifty Auto Index Fund-Reg(G),45995,ICICI Prudential Mutual Fund,-2.12,-1.57,-5.12,19.52,NIFTY AUTO - TRI,,,,1.93,3,2,2,2,1,,,,ICICI Pru Nifty Auto Index Fund-Reg(G),Equity : Sectoral - Auto,10,10,8,8,6,1,1,1,-0.47,-3.4,-3.33,-6.62,15.21,22.08,21.44,10.98,,,,,,,,
LIC MF Focused Fund-Reg(G),32627,LIC Mutual Fund,-1.96,-2.02,-3.44,14.25,NIFTY 500 - TRI,10.43,14.91,,0.75,1,3,7,26,6,28,21,,LIC MF Focused Fund-Reg(G),Equity : Large Cap,38,38,38,37,36,34,31,28,-2.54,-3.56,-3.46,-2.73,10.97,12.57,15.55,11.28,,,,,,,,
Quantum Dynamic Bond Fund-Reg(G),37428,Quantum Mutual Fund,0.82,1.53,3.35,8.16,CRISIL Dynamic Bond Index,7.4,6.54,,0.95,9,12,14,16,10,3,7,,Quantum Dynamic Bond Fund-Reg(G),Debt : Dynamic Bond,22,22,22,22,22,22,21,18,0.93,0.82,1.54,3.51,7.83,6.54,6.21,6.72,0.82,1.87,3.99,,,,,9.48
Nippon India ETF Nifty India Consumption,17478,Nippon India Mutual Fund,-2.82,-0.79,-1.69,19.37,Nifty India Consumption - TRI,18.11,17.86,13.67,-1.7,94,93,24,80,19,24,24,3,Nippon India ETF Nifty India Consumption,Equity : ETFs,171,171,169,157,145,97,63,25,-2.48,-3.34,-3.07,-1.08,12.77,14.56,16.96,11.23,,,,,,,,
Bank of India Balanced Advantage Fund-Reg(G),21917,Bank of India Mutual Fund,-2.2,-3.72,-4.06,3.15,NIFTY 50 Hybrid Composite Debt 50:50 Index,12.64,10.24,6.71,-1.54,13,15,31,30,27,3,13,11,Bank of India Balanced Advantage Fund-Reg(G),Hybrid : Dynamic Asset Allocation,33,33,33,33,30,22,19,11,-1.9,-2.41,-1.65,-0.51,8.86,10.83,11.46,9.11,,,,,,,,
Tata Nifty MidSmall Healthcare Index Fund-Reg(G),48764,Tata Mutual Fund,-6.41,-2.5,9.6,,Nifty MidSmall Healthcare - TRI,,,,-5.33,104,110,48,5,,,,,Tata Nifty MidSmall Healthcare Index Fund-Reg(G),Equity : Index Funds,175,175,161,132,108,56,30,18,-4.24,-5.01,-4.81,-3.99,9.79,13.41,15.97,10.86,,,,,,,,
Tata Silver ETF,48436,Tata Mutual Fund,7.33,1.21,19.92,33.78,Silver,,,,9.91,28,31,30,19,25,,,,Tata Silver ETF,Gold : ETFs,31,31,31,29,27,14,11,11,10.47,8.95,5.25,20.35,34.43,18.63,15.09,10.27,,,,,,,,
Edelweiss CRISIL IBX AAA Financial Services Bond - Jan 2028 Index Fund-Reg(G),49393,Edelweiss Mutual Fund,0.8,,,,CRISIL-IBX AAA Financial Services Index - Jan 2028,,,,0.84,55,46,,,,,,,Edelweiss CRISIL IBX AAA Financial Services Bond - Jan 2028 Index Fund-Reg(G),Debt : Medium to Long Duration,59,59,56,52,52,16,11,11,0.95,0.89,1.85,3.68,8.03,6.31,6.03,6.12,,,,,,,,
Nippon India Nifty Bank Index Fund-Reg(G),48148,Nippon India Mutual Fund,-1.36,-3.8,0.25,,NIFTY BANK - TRI,,,,-1.05,58,41,73,13,,,,,Nippon India Nifty Bank Index Fund-Reg(G),Equity : Index Funds,175,175,161,132,108,56,30,18,-4.24,-5.01,-4.81,-3.99,9.79,13.41,15.97,10.86,,,,,,,,
ICICI Pru FMP-88-1226D-F(G),47232,ICICI Prudential Mutual Fund,0.67,1.74,3.52,7.66,CRISIL Medium Duration Debt Index,,,,0.87,49,52,46,59,54,,,,ICICI Pru FMP-88-1226D-F(G),Debt : FTP/FMP,92,92,91,91,91,42,17,12,0.84,0.72,1.75,3.58,7.75,6.33,5.61,6.0,,,,,,,,
SBI Nifty 200 Quality 30 ETF,41015,SBI Mutual Fund,-3.42,-3.87,-5.18,10.84,NIFTY200 Quality 30 - TRI,13.1,16.53,,-2.67,103,100,113,120,60,44,28,,SBI Nifty 200 Quality 30 ETF,Equity : ETFs,171,171,169,157,145,97,63,25,-2.48,-3.34,-3.07,-1.08,12.77,14.56,16.96,11.23,,,,,,,,
HSBC Nifty Next 50 Index Fund-Reg(G),33548,HSBC Mutual Fund,-7.51,-8.38,-9.99,14.52,NIFTY NEXT 50 - TRI,14.74,,,-6.58,128,129,129,116,18,22,,,HSBC Nifty Next 50 Index Fund-Reg(G),Equity : Index Funds,175,175,161,132,108,56,30,18,-4.24,-5.01,-4.81,-3.99,9.79,13.41,15.97,10.86,,,,,,,,
Tata Gold ETF FoF-Reg(G),48437,Tata Mutual Fund,9.48,7.68,20.58,32.79,Gold-India,,,,11.07,1,1,1,1,6,,,,Tata Gold ETF FoF-Reg(G),FoFs : Domestic,61,62,61,59,55,46,27,23,-0.13,-0.76,-0.9,2.66,14.18,12.14,12.79,9.72,,,,,,,,
Canara Rob Corp Bond Fund-Reg(G),23504,Canara Robeco Mutual Fund,0.63,1.51,3.49,7.39,CRISIL Corporate Bond Index,5.66,5.67,6.48,0.71,19,20,21,21,21,20,18,9,Canara Rob Corp Bond Fund-Reg(G),Debt : Corporate Bond,21,21,21,21,21,20,18,12,0.89,0.79,1.82,3.84,7.98,6.26,6.3,6.98,,,,,,,,
SBI FMP-46-1850D-Reg(G),45620,SBI Mutual Fund,0.72,1.72,3.61,7.85,CRISIL Medium to Long Term Debt Index,6.19,,,0.9,27,36,55,38,39,24,,,SBI FMP-46-1850D-Reg(G),Debt : FTP/FMP,92,92,91,91,91,42,17,12,0.84,0.72,1.75,3.58,7.75,6.33,5.61,6.0,,,,,,,,
Tata BSE Select Business Groups Index Fund-Reg(G),49326,Tata Mutual Fund,-2.71,,,,BSE Select Business Groups Index - TRI,,,,-0.74,52,64,,,,,,,Tata BSE Select Business Groups Index Fund-Reg(G),Equity : Index Funds,175,175,161,132,108,56,30,18,-4.24,-5.01,-4.81,-3.99,9.79,13.41,15.97,10.86,,,,,,,,
ICICI Pru Nifty 200 Quality 30 ETF,48118,ICICI Prudential Mutual Fund,-3.41,-3.81,-5.07,11.1,NIFTY200 Quality 30 - TRI,,,,-2.65,102,99,110,117,55,,,,ICICI Pru Nifty 200 Quality 30 ETF,Equity : ETFs,171,171,169,157,145,97,63,25,-2.48,-3.34,-3.07,-1.08,12.77,14.56,16.96,11.23,,,,,,,,
Taurus Mid Cap Fund-Reg(G),3306,Taurus Mutual Fund,-6.28,-6.51,-9.04,0.67,Nifty Midcap 150 - TRI,15.43,19.44,13.98,-5.37,3,3,25,29,30,20,22,17,Taurus Mid Cap Fund-Reg(G),Equity : Mid Cap,30,30,30,30,30,25,23,20,-7.66,-8.0,-5.16,-3.03,15.87,18.79,22.89,15.24,,,,,,,,
