Tata Business Cycle Fund-Reg(G),45373,Tata Mutual Fund,4.64,2.51,-5.69,4.99,NIFTY 500 - TRI,19.35,,,-3.26,38,29,26,44,40,13,,,Tata Business Cycle Fund-Reg(G),Equity : Thematic,89,98,90,79,60,38,21,9,-4.61,3.78,0.45,-5.44,6.93,17.04,26.27,13.41,,,,,,,,
UTI Low Duration Fund-Reg(G),3601,UTI Mutual Fund,1.25,2.43,4.16,8.16,NIFTY Low Duration Debt Index,6.99,7.18,6.27,2.87,2,3,2,3,2,2,2,16,UTI Low Duration Fund-Reg(G),Debt : Low Duration,20,23,20,20,20,20,20,19,2.76,1.2,2.33,4.0,7.8,6.67,6.11,6.53,,,,,,,,
DSP BSE Liquid Rate ETF,48724,DSP Mutual Fund,0.49,1.46,3.06,6.26,BSE Liquid Rate Index,,,,1.87,23,22,23,23,20,,,,DSP BSE Liquid Rate ETF,Debt : ETFs,31,32,31,30,25,14,7,2,3.22,1.36,2.69,4.52,9.22,7.37,5.41,6.03,,,,,,,,
SBI Retirement Benefit Fund-Aggressive Plan-Reg(G),30398,SBI Mutual Fund,2.58,0.47,-5.6,5.18,BSE 500 - TRI,14.48,,,-2.21,32,33,40,41,40,10,,,SBI Retirement Benefit Fund-Aggressive Plan-Reg(G),Hybrid : Solution Oriented,43,43,43,42,41,37,32,15,-0.73,3.36,2.24,-0.74,9.55,12.38,15.93,10.16,,,,,,,,
DSP Corp Bond Fund-Reg(G),37709,DSP Mutual Fund,1.51,2.69,4.35,8.7,CRISIL Corporate Bond Index,6.57,5.84,,3.16,21,21,21,21,20,19,17,,DSP Corp Bond Fund-Reg(G),Debt : Corporate Bond,21,21,21,21,21,20,18,12,3.73,1.99,3.31,4.94,9.59,7.04,6.48,7.15,,,,,,,,
Mirae Asset Healthcare Fund-Reg(G),39122,Mirae Asset Mutual Fund,1.0,-1.27,-2.03,21.73,BSE Health Care - TRI,18.27,23.07,,-5.61,8,13,7,12,6,9,4,,Mirae Asset Healthcare Fund-Reg(G),Equity : Sectoral - Pharma,18,18,18,16,16,10,9,3,-5.92,1.4,-1.85,-1.47,21.02,20.0,22.73,12.21,,,,,,,,
Franklin Build India Fund(G),7864,Franklin Templeton Mutual Fund,4.47,2.6,-4.06,6.24,BSE India Infrastructure Index - TRI,27.79,35.03,16.35,-3.21,5,6,6,3,4,3,5,2,Franklin Build India Fund(G),Equity : Sectoral - Infrastructure,20,20,20,19,19,19,19,18,-6.07,3.79,0.23,-7.45,3.23,22.88,32.44,14.33,,,,,,,,
UTI MNC Fund-Reg(G),3634,UTI Mutual Fund,2.42,-3.91,-9.96,2.65,NIFTY MNC - TRI,11.78,15.69,9.41,-7.01,3,5,6,3,4,2,3,2,UTI MNC Fund-Reg(G),Equity : Thematic - MNC,6,6,6,5,5,4,4,3,-7.19,2.76,-3.06,-8.88,2.54,11.07,17.42,9.06,,,,,,,,
Invesco India ELSS Tax Saver Fund(G),2270,Invesco Mutual Fund,5.16,0.11,-4.09,11.04,BSE 500 - TRI,15.33,22.37,13.15,-6.0,43,13,40,32,15,30,43,12,Invesco India ELSS Tax Saver Fund(G),Equity : Tax Saving (ELSS),59,60,59,59,59,54,54,29,-3.61,4.16,1.17,-4.7,8.25,16.08,25.81,13.05,,,,,,,,
Baroda BNP Paribas Multi Cap Fund-Reg(G),500,Baroda BNP Paribas Mutual Fund,3.66,-1.03,-5.05,9.39,Nifty500 Multicap 50:25:25 - TRI,17.1,27.14,13.4,-8.26,40,30,37,29,17,12,6,9,Baroda BNP Paribas Multi Cap Fund-Reg(G),Equity : Multi Cap,42,43,42,40,37,28,20,14,-4.24,3.93,1.4,-3.94,9.47,16.46,24.57,13.59,,,,,,,,
Sundaram Multi Cap Fund(G),2370,Sundaram Mutual Fund,3.69,1.0,-4.41,9.7,Nifty500 Multicap 50:25:25 - TRI,15.01,25.76,14.23,-4.11,18,29,23,23,16,19,8,4,Sundaram Multi Cap Fund(G),Equity : Multi Cap,42,43,42,40,37,28,20,14,-4.24,3.93,1.4,-3.94,9.47,16.46,24.57,13.59,,,,,,,,
ICICI Pru Commodities Fund-Reg(G),41999,ICICI Prudential Mutual Fund,0.7,2.6,-0.81,0.0,NIFTY COMMODITIES - TRI,14.11,38.64,,2.59,6,94,24,9,52,24,1,,ICICI Pru Commodities Fund-Reg(G),Equity : Thematic,89,98,90,79,60,38,21,9,-4.61,3.78,0.45,-5.44,6.93,17.04,26.27,13.41,,,,,,,,
Canara Rob Mid Cap Fund-Reg(G),46001,Canara Robeco Mutual Fund,3.74,0.65,-6.1,10.13,BSE 150 MidCap - TRI,,,,-6.45,14,19,10,18,16,,,,Canara Rob Mid Cap Fund-Reg(G),Equity : Mid Cap,30,31,30,30,30,25,24,20,-7.0,3.99,-0.34,-5.9,10.63,19.4,29.69,15.31,,,,,,,,
HDFC NIFTY Bank ETF,33563,HDFC Mutual Fund,9.42,13.91,7.98,16.23,NIFTY BANK - TRI,16.08,,,8.48,18,10,15,17,17,40,,,HDFC NIFTY Bank ETF,Equity : ETFs,170,182,170,167,148,103,63,28,-1.32,4.21,2.34,-2.65,9.31,15.77,23.97,11.98,,,,,,,,
ICICI Pru Thematic Advantage Fund(FOF)(G),1706,ICICI Prudential Mutual Fund,5.0,4.65,1.62,19.17,NIFTY 200 - TRI,19.15,29.4,15.51,1.41,38,6,19,28,3,3,3,1,ICICI Pru Thematic Advantage Fund(FOF)(G),FoFs : Domestic,61,64,62,61,56,47,28,23,2.55,3.16,3.62,0.43,11.38,12.86,16.38,10.07,,,,,,,,
Invesco India Flexi Cap Fund-Reg(G),45945,Invesco Mutual Fund,5.24,2.55,-3.44,15.39,BSE 500 - TRI,20.42,,,-6.93,41,6,24,24,3,5,,,Invesco India Flexi Cap Fund-Reg(G),Equity : Flexi Cap,48,48,48,48,47,35,26,21,-3.57,4.17,1.94,-4.02,8.9,15.42,23.38,13.13,,,,,,,,
UTI Short Duration Fund-Reg(G),3656,UTI Mutual Fund,1.76,3.01,4.64,8.95,CRISIL Short Duration Debt Index,7.08,7.45,6.39,3.43,22,17,19,18,18,6,2,15,UTI Short Duration Fund-Reg(G),Debt : Short Duration,30,34,30,28,26,23,21,19,3.52,1.81,3.07,4.78,9.01,6.85,6.32,6.77,,,,,,,,
Kotak Pioneer Fund-Reg(G),43927,Kotak Mahindra Mutual Fund,3.59,-1.61,-4.88,11.33,NIFTY 500 - TRI,17.52,27.83,,-6.62,62,55,68,36,14,18,10,,Kotak Pioneer Fund-Reg(G),Equity : Thematic,89,98,90,79,60,38,21,9,-4.61,3.78,0.45,-5.44,6.93,17.04,26.27,13.41,,,,,,,,
Tata Banking & Financial Services Fund-Reg(G),33726,Tata Mutual Fund,9.43,14.39,7.78,20.27,Nifty Financial Services - TRI,20.5,22.72,,9.92,2,2,3,3,4,3,8,,Tata Banking & Financial Services Fund-Reg(G),Equity : Sectoral - Financial Services,21,22,21,21,20,14,11,10,6.67,7.78,12.22,5.83,16.3,18.59,23.93,12.64,,,,,,,,
Franklin India Money Market Fund(G),3361,Franklin Templeton Mutual Fund,1.19,2.41,4.22,8.02,Nifty Money Market Index,7.02,5.89,6.84,2.89,1,1,1,1,2,9,9,2,Franklin India Money Market Fund(G),Debt : Money Market,22,23,22,22,22,19,17,13,2.74,1.12,2.29,4.03,7.71,6.89,5.79,6.61,,,,,,,,
Mirae Asset Flexi Cap Fund-Reg(G),47596,Mirae Asset Mutual Fund,3.44,1.98,-1.95,9.78,NIFTY 500 - TRI,,,,-2.67,21,40,29,12,25,,,,Mirae Asset Flexi Cap Fund-Reg(G),Equity : Flexi Cap,48,48,48,48,47,35,26,21,-3.57,4.17,1.94,-4.02,8.9,15.42,23.38,13.13,,,,,,,,
ICICI Pru Constant Maturity Gilt Fund(G),30426,ICICI Prudential Mutual Fund,2.91,4.74,6.69,12.58,Crisil 10 Yr Gilt Index,8.55,6.55,8.37,5.3,2,2,2,1,2,2,1,2,ICICI Pru Constant Maturity Gilt Fund(G),Debt : Gilt (10 Yr Constant Duration),6,6,6,6,6,4,4,4,5.16,2.75,4.52,6.4,12.28,8.5,6.08,8.09,,,,,,,,
HSBC Money Market Fund-Reg(G),621,HSBC Mutual Fund,1.13,2.32,4.08,7.79,Nifty Money Market Index,6.72,5.43,6.73,2.77,13,13,12,13,12,13,14,8,HSBC Money Market Fund-Reg(G),Debt : Money Market,22,23,22,22,22,19,17,13,2.74,1.12,2.29,4.03,7.71,6.89,5.79,6.61,,,,,,,,
Edelweiss Multi Cap Fund-Reg(G),48147,Edelweiss Mutual Fund,4.42,0.5,-6.29,11.8,Nifty500 Multicap 50:25:25 - TRI,,,,-5.92,27,16,26,34,11,,,,Edelweiss Multi Cap Fund-Reg(G),Equity : Multi Cap,42,43,42,40,37,28,20,14,-4.24,3.93,1.4,-3.94,9.47,16.46,24.57,13.59,,,,,,,,
Nippon India ETF Nifty PSU Bank BeES,3722,Nippon India Mutual Fund,9.16,7.2,5.15,-6.1,NIFTY PSU BANK - TRI,34.78,38.81,6.48,2.06,68,26,30,29,145,2,2,26,Nippon India ETF Nifty PSU Bank BeES,Equity : ETFs,170,182,170,167,148,103,63,28,-1.32,4.21,2.34,-2.65,9.31,15.77,23.97,11.98,,,,,,,,
DSP Equity Savings Fund-Reg(G),34871,DSP Mutual Fund,2.02,3.41,3.02,11.96,NIFTY 50 Equity Savings Index - TRI,10.35,13.04,,3.06,7,46,14,8,12,37,37,,DSP Equity Savings Fund-Reg(G),Hybrid : Equity Oriented,55,56,55,55,55,54,51,29,4.63,7.33,6.98,4.7,13.32,12.48,16.48,9.96,,,,,,,,
SBI CRISIL IBX Gilt Index - June 2036 Fund-Reg(G),46941,SBI Mutual Fund,3.16,4.91,6.72,13.14,CRISIL IBX Gilt Index - June 2036,,,,5.34,6,5,3,2,4,,,,SBI CRISIL IBX Gilt Index - June 2036 Fund-Reg(G),Debt : Long Duration,26,26,26,24,24,4,3,2,5.06,2.9,4.53,5.95,12.39,8.19,5.77,7.06,,,,,,,,
Motilal Oswal Nifty India Defence Index Fund-Reg(G),48892,Motilal Oswal Mutual Fund,9.49,10.37,9.58,,Nifty India Defence - TRI,,,,5.27,12,4,12,4,,,,,Motilal Oswal Nifty India Defence Index Fund-Reg(G),Equity : Index Funds,175,190,176,151,115,68,32,18,-2.57,4.67,2.21,-3.96,6.58,14.83,22.71,11.63,,,,,,,,
Franklin India Balanced Advantage Fund-Reg(G),46625,Franklin Templeton Mutual Fund,2.67,2.78,1.56,9.82,NIFTY 50 Hybrid Composite Debt 50:50 Index,,,,0.21,21,25,20,11,11,,,,Franklin India Balanced Advantage Fund-Reg(G),Hybrid : Dynamic Asset Allocation,33,34,33,33,32,22,19,11,0.08,2.83,2.52,-0.34,7.64,11.63,14.43,9.5,,,,,,,,
ICICI Pru Housing Opp Fund-Reg(G),46546,ICICI Prudential Mutual Fund,4.64,4.97,-1.5,8.65,Nifty Housing - TRI,18.19,,,0.55,14,27,9,13,23,16,,,ICICI Pru Housing Opp Fund-Reg(G),Equity : Thematic,89,98,90,79,60,38,21,9,-4.61,3.78,0.45,-5.44,6.93,17.04,26.27,13.41,,,,,,,,
UTI Focused Fund-Reg(G),45685,UTI Mutual Fund,4.94,2.91,-4.38,8.47,NIFTY 500 - TRI,15.61,,,0.43,7,10,21,29,29,16,,,UTI Focused Fund-Reg(G),Equity : Flexi Cap,48,48,48,48,47,35,26,21,-3.57,4.17,1.94,-4.02,8.9,15.42,23.38,13.13,,,,,,,,
Parag Parikh Liquid Fund-Reg(G),38735,PPFAS Mutual Fund,0.65,1.72,3.41,6.9,CRISIL Liquid Debt Index,6.39,5.08,,2.15,33,32,33,33,33,34,32,,Parag Parikh Liquid Fund-Reg(G),Debt : Liquid,38,38,38,37,37,35,34,29,2.27,0.7,1.81,3.57,7.18,6.71,5.35,6.17,,,,,,,,
Kotak Business Cycle Fund-Reg(G),46472,Kotak Mahindra Mutual Fund,5.62,1.37,-2.63,14.08,NIFTY 500 - TRI,,,,-4.44,48,11,38,21,9,,,,Kotak Business Cycle Fund-Reg(G),Equity : Thematic,89,98,90,79,60,38,21,9,-4.61,3.78,0.45,-5.44,6.93,17.04,26.27,13.41,,,,,,,,
Edelweiss Aggressive Hybrid Fund-Reg(G),7922,Edelweiss Mutual Fund,3.58,3.26,-0.1,12.46,CRISIL Hybrid 35+65 - Aggressive Index,16.8,22.03,12.23,-0.26,24,19,20,19,9,4,3,3,Edelweiss Aggressive Hybrid Fund-Reg(G),Hybrid : Multi Asset Allocation,28,29,28,26,24,10,8,7,2.5,3.63,4.18,0.78,9.92,14.0,20.7,12.08,,,,,,,,
Sundaram Multi Asset Allocation Fund-Reg(G),48460,Sundaram Mutual Fund,5.23,8.08,4.95,13.45,NIFTY 500 - TRI,,,,7.38,2,2,2,2,5,,,,Sundaram Multi Asset Allocation Fund-Reg(G),Hybrid : Multi Asset Allocation,28,29,28,26,24,10,8,7,2.5,3.63,4.18,0.78,9.92,14.0,20.7,12.08,,,,,,,,
LIC MF Nifty 8-13 yr G-Sec ETF,31581,LIC Mutual Fund,2.63,4.45,6.5,12.46,Nifty 8-13 yr G-Sec,8.83,5.94,7.26,5.12,5,4,3,2,2,2,3,1,LIC MF Nifty 8-13 yr G-Sec ETF,Debt : ETFs,31,32,31,30,25,14,7,2,3.22,1.36,2.69,4.52,9.22,7.37,5.41,6.03,2.47,4.22,6.48,12.56,9.0,6.41,,16.26
Canara Rob Focused Equity Fund-Reg(G),45510,Canara Robeco Mutual Fund,2.56,3.46,-2.08,12.54,BSE 500 - TRI,16.91,,,-2.65,11,39,9,8,9,14,,,Canara Rob Focused Equity Fund-Reg(G),Equity : Multi Cap,42,43,42,40,37,28,20,14,-4.24,3.93,1.4,-3.94,9.47,16.46,24.57,13.59,,,,,,,,
Tata Large Cap Fund-Reg(G),3281,Tata Mutual Fund,3.88,3.39,-1.34,8.23,NIFTY 100 - TRI,14.39,22.62,11.54,0.99,13,28,25,16,22,17,8,19,Tata Large Cap Fund-Reg(G),Equity : Large Cap,38,38,38,38,37,34,31,28,-0.54,4.17,3.42,-2.39,8.22,14.54,21.57,11.86,,,,,,,,
Parag Parikh Conservative Hybrid Fund-Reg(G),45338,PPFAS Mutual Fund,2.16,3.39,4.03,11.22,CRISIL Hybrid 85+15 - Conservative Index,11.58,,,3.77,2,12,9,2,3,1,,,Parag Parikh Conservative Hybrid Fund-Reg(G),Hybrid : Debt Oriented (Conservative),18,18,18,18,18,18,17,17,2.57,2.43,3.21,3.13,9.77,9.0,10.35,7.67,,,,,,,,
DSP Focus Fund-Reg(G),8463,DSP Mutual Fund,3.44,5.22,-1.44,18.04,NIFTY 500 - TRI,18.08,22.7,11.92,1.02,3,34,3,5,3,8,12,11,DSP Focus Fund-Reg(G),Equity : Multi Cap,42,43,42,40,37,28,20,14,-4.24,3.93,1.4,-3.94,9.47,16.46,24.57,13.59,,,,,,,,
Quant Large Cap Fund-Reg(G),46678,Quant Mutual Fund,3.91,-0.68,-6.41,-3.36,NIFTY 100 - TRI,,,,-3.26,35,27,37,34,35,,,,Quant Large Cap Fund-Reg(G),Equity : Large Cap,38,38,38,38,37,34,31,28,-0.54,4.17,3.42,-2.39,8.22,14.54,21.57,11.86,,,,,,,,
Baroda BNP Paribas Large Cap Fund-Reg(G),23,Baroda BNP Paribas Mutual Fund,3.64,2.05,-4.22,6.61,NIFTY 100 - TRI,15.97,21.37,12.06,-1.98,31,31,33,32,28,7,19,14,Baroda BNP Paribas Large Cap Fund-Reg(G),Equity : Large Cap,38,38,38,38,37,34,31,28,-0.54,4.17,3.42,-2.39,8.22,14.54,21.57,11.86,,,,,,,,
Edelweiss Flexi Cap Fund-Reg(G),31778,Edelweiss Mutual Fund,4.1,2.0,-4.86,11.84,NIFTY 500 - TRI,17.71,24.95,13.94,-4.02,32,29,28,34,13,11,7,5,Edelweiss Flexi Cap Fund-Reg(G),Equity : Flexi Cap,48,48,48,48,47,35,26,21,-3.57,4.17,1.94,-4.02,8.9,15.42,23.38,13.13,,,,,,,,
Mahindra Manulife Large & Mid Cap Fund-Reg(G),43915,Mahindra Manulife Mutual Fund,5.72,1.81,-5.21,2.09,NIFTY LargeMidcap 250 - TRI,14.3,25.83,,-3.45,16,2,17,27,28,22,11,,Mahindra Manulife Large & Mid Cap Fund-Reg(G),Equity : Large & Mid Cap,31,31,31,30,29,26,25,19,-3.68,4.18,1.97,-3.46,10.58,17.29,25.85,13.92,,,,,,,,
Aditya Birla SL Nifty Bank ETF,34434,Aditya Birla Sun Life Mutual Fund,9.42,13.9,7.96,16.22,NIFTY BANK - TRI,16.11,22.73,,8.47,20,11,17,22,18,36,26,,Aditya Birla SL Nifty Bank ETF,Equity : ETFs,170,182,170,167,148,103,63,28,-1.32,4.21,2.34,-2.65,9.31,15.77,23.97,11.98,,,,,,,,
Mirae Asset NYSE FANG+ ETF,45379,Mirae Asset Mutual Fund,-5.29,-17.92,0.14,22.85,NYSE FANG+ TRI,32.31,,,-15.7,159,177,160,44,5,4,,,Mirae Asset NYSE FANG+ ETF,Equity : ETFs,170,182,170,167,148,103,63,28,-1.32,4.21,2.34,-2.65,9.31,15.77,23.97,11.98,,,,,,,,
Bandhan Multi Cap Fund-Reg(G),45867,Bandhan Mutual Fund,4.52,2.98,-3.87,8.03,Nifty500 Multicap 50:25:25 - TRI,17.43,,,-1.98,9,13,11,17,27,11,,,Bandhan Multi Cap Fund-Reg(G),Equity : Multi Cap,42,43,42,40,37,28,20,14,-4.24,3.93,1.4,-3.94,9.47,16.46,24.57,13.59,,,,,,,,
Nippon India ETF Nifty 8-13 yr G-Sec Long Term Gilt,35459,Nippon India Mutual Fund,2.64,4.46,6.52,12.52,Nifty 8-13 yr G-Sec,8.9,5.95,,5.13,2,3,1,1,1,1,2,,Nippon India ETF Nifty 8-13 yr G-Sec Long Term Gilt,Debt : ETFs,31,32,31,30,25,14,7,2,3.22,1.36,2.69,4.52,9.22,7.37,5.41,6.03,2.47,4.22,6.48,12.56,9.0,6.41,,16.26
Aditya Birla SL Quant Fund-Reg(G),48491,Aditya Birla Sun Life Mutual Fund,4.76,2.9,-6.38,,NIFTY 200 - TRI,,,,-2.94,36,21,22,48,,,,,Aditya Birla SL Quant Fund-Reg(G),Equity : Thematic,89,98,90,79,60,38,21,9,-4.61,3.78,0.45,-5.44,6.93,17.04,26.27,13.41,,,,,,,,
Edelweiss US Technology Equity FOF-Reg(G),44630,Edelweiss Mutual Fund,-6.17,-19.47,-4.5,8.62,Russell 1000 Equal Weighted Technology Index,15.05,17.54,,-17.8,55,42,55,27,34,10,3,,Edelweiss US Technology Equity FOF-Reg(G),FoFs : Overseas,57,57,57,57,57,51,27,24,-4.25,-4.25,-6.34,-2.49,10.02,9.01,11.06,6.14,,,,,,,,
BHARAT Bond ETF FOF - April 2033 -Reg(G),47284,Edelweiss Mutual Fund,2.73,3.59,5.08,11.04,NIFTY BHARAT Bond Index - April 2033,,,,4.12,16,39,30,8,29,,,,BHARAT Bond ETF FOF - April 2033 -Reg(G),FoFs : Domestic,61,64,62,61,56,47,28,23,2.55,3.16,3.62,0.43,11.38,12.86,16.38,10.07,,,,,,,,
HDFC Infrastructure Fund(G),4253,HDFC Mutual Fund,5.04,2.98,-4.21,4.32,BSE India Infrastructure Index - TRI,28.47,35.15,10.27,-2.93,4,2,2,4,9,1,4,18,HDFC Infrastructure Fund(G),Equity : Sectoral - Infrastructure,20,20,20,19,19,19,19,18,-6.07,3.79,0.23,-7.45,3.23,22.88,32.44,14.33,,,,,,,,
Tata Treasury Advantage Fund-Reg(G),3205,Tata Mutual Fund,1.21,2.33,4.02,7.85,CRISIL Low Duration Debt Index,6.67,5.99,6.28,2.79,7,10,11,7,5,10,7,15,Tata Treasury Advantage Fund-Reg(G),Debt : Low Duration,20,23,20,20,20,20,20,19,2.76,1.2,2.33,4.0,7.8,6.67,6.11,6.53,1.06,2.32,4.16,8.21,,,,8.95
UTI-Nifty Next 50 ETF,37338,UTI Mutual Fund,5.01,4.11,-6.52,5.79,NIFTY NEXT 50,16.06,23.84,,-2.9,107,58,85,119,115,42,19,,UTI-Nifty Next 50 ETF,Equity : ETFs,170,182,170,167,148,103,63,28,-1.32,4.21,2.34,-2.65,9.31,15.77,23.97,11.98,,,,,,,,
Nippon India Innovation Fund-Reg(G),48169,Nippon India Mutual Fund,6.33,1.91,-5.07,8.22,NIFTY 500 - TRI,,,,-2.2,30,7,31,39,26,,,,Nippon India Innovation Fund-Reg(G),Equity : Thematic,89,98,90,79,60,38,21,9,-4.61,3.78,0.45,-5.44,6.93,17.04,26.27,13.41,,,,,,,,
Edelweiss Nifty PSU Bond Plus SDL Apr 2027 50:50 Index Fund-Reg(G),45387,Edelweiss Mutual Fund,1.47,2.65,4.27,8.88,Nifty PSU Bond Plus SDL Apr 2027 50:50 Index,6.81,,,3.16,50,46,45,42,43,21,,,Edelweiss Nifty PSU Bond Plus SDL Apr 2027 50:50 Index Fund-Reg(G),Debt : Medium to Long Duration,59,60,59,55,52,26,11,11,3.68,1.82,3.14,4.78,9.75,7.25,6.14,6.43,,,,,,,,
Nippon India Index Fund-Nifty 50 Plan(G),12860,Nippon India Mutual Fund,4.13,4.86,-0.3,9.47,NIFTY 50 - TRI,12.86,21.41,11.23,2.63,30,129,30,33,25,56,24,15,Nippon India Index Fund-Nifty 50 Plan(G),Equity : Index Funds,175,190,176,151,115,68,32,18,-2.57,4.67,2.21,-3.96,6.58,14.83,22.71,11.63,,,,,,,,
Axis Business Cycles Fund-Reg(G),47580,Axis Mutual Fund,3.99,1.76,-2.98,7.42,NIFTY 500 - TRI,,,,-3.53,42,48,34,24,30,,,,Axis Business Cycles Fund-Reg(G),Equity : Thematic,89,98,90,79,60,38,21,9,-4.61,3.78,0.45,-5.44,6.93,17.04,26.27,13.41,,,,,,,,
Templeton India Equity Income Fund(G),3367,Franklin Templeton Mutual Fund,2.85,0.46,-4.9,7.99,NIFTY 500 - TRI,17.3,30.19,14.56,-2.2,5,8,8,6,4,6,2,2,Templeton India Equity Income Fund(G),Equity : Thematic - Dividend Yield,10,10,10,10,9,8,6,5,-2.21,3.6,1.42,-4.84,8.14,18.12,27.34,13.81,,,,,,,,
Kotak Manufacture in India Fund-Reg(G),46107,Kotak Mahindra Mutual Fund,2.0,-0.54,-5.01,6.93,Nifty India Manufacturing - TRI,18.22,,,-5.47,54,86,59,38,33,15,,,Kotak Manufacture in India Fund-Reg(G),Equity : Thematic,89,98,90,79,60,38,21,9,-4.61,3.78,0.45,-5.44,6.93,17.04,26.27,13.41,,,,,,,,
HSBC Ultra Short Duration Fund-Reg(G),44328,HSBC Mutual Fund,1.0,2.13,3.86,7.56,NIFTY Ultra Short Duration Debt Index,6.78,5.66,,2.57,6,5,6,4,4,4,8,,HSBC Ultra Short Duration Fund-Reg(G),Debt : Ultra Short Duration,26,29,26,25,24,24,22,13,2.47,0.95,2.05,3.7,7.24,6.46,5.47,6.2,,,,,,,,
SBI Credit Risk Fund-Reg(G),2770,SBI Mutual Fund,1.56,2.86,4.8,9.24,NIFTY Credit Risk Bond Index,7.63,7.25,7.47,3.33,9,7,9,7,8,4,9,6,SBI Credit Risk Fund-Reg(G),Debt : Credit Risk,15,15,15,15,15,15,15,13,4.62,1.56,4.15,5.76,10.39,7.71,7.62,6.45,,,,,,,,
HSBC Arbitrage Fund-Reg(G),29550,HSBC Mutual Fund,0.74,1.79,3.46,6.93,Nifty 50 Arbitrage,6.43,5.35,5.82,2.21,21,21,19,19,21,17,12,7,HSBC Arbitrage Fund-Reg(G),Hybrid : Arbitrage,30,30,30,27,26,24,22,14,2.23,0.76,1.79,3.49,7.02,6.46,5.23,5.78,0.82,2.22,4.43,7.54,7.04,5.43,,8.73
Aditya Birla SL Income Fund(G),405,Aditya Birla Sun Life Mutual Fund,2.44,3.84,5.26,10.86,CRISIL Medium to Long Term Debt Index,7.23,6.69,7.11,4.3,11,9,11,14,7,11,3,3,Aditya Birla SL Income Fund(G),Debt : Medium to Long Duration,59,60,59,55,52,26,11,11,3.68,1.82,3.14,4.78,9.75,7.25,6.14,6.43,,,,,,,,
HSBC Infrastructure Fund-Reg(G),594,HSBC Mutual Fund,3.43,-0.41,-8.89,5.33,Nifty Infrastructure - TRI,22.57,31.38,14.92,-8.24,15,14,12,14,6,10,13,8,HSBC Infrastructure Fund-Reg(G),Equity : Sectoral - Infrastructure,20,20,20,19,19,19,19,18,-6.07,3.79,0.23,-7.45,3.23,22.88,32.44,14.33,,,,,,,,
Axis CRISIL IBX SDL May 2027 Index Fund-Reg(G),45999,Axis Mutual Fund,1.41,2.64,4.27,9.28,CRISIL IBX SDL Index - May 2027,7.13,,,3.26,44,48,47,43,33,15,,,Axis CRISIL IBX SDL May 2027 Index Fund-Reg(G),Debt : Medium to Long Duration,59,60,59,55,52,26,11,11,3.68,1.82,3.14,4.78,9.75,7.25,6.14,6.43,,,,,,,,
ITI Small Cap Fund-Reg(G),44399,ITI Mutual Fund,4.35,0.19,-4.23,9.57,Nifty Smallcap 250 - TRI,24.15,29.63,,-8.43,9,8,2,2,6,2,19,,ITI Small Cap Fund-Reg(G),Equity : Small Cap,29,30,29,28,27,23,21,13,-9.98,3.77,-2.64,-8.47,6.59,18.06,34.02,16.3,,,,,,,,
Bandhan Balanced Advantage Fund-Reg(G),30671,Bandhan Mutual Fund,2.96,2.7,1.13,9.59,NIFTY 50 Hybrid Composite Debt 50:50 Index,10.24,12.93,8.26,-0.29,23,17,21,12,14,17,12,8,Bandhan Balanced Advantage Fund-Reg(G),Hybrid : Dynamic Asset Allocation,33,34,33,33,32,22,19,11,0.08,2.83,2.52,-0.34,7.64,11.63,14.43,9.5,,,,,,,,
Tata India Consumer Fund-Reg(G),33728,Tata Mutual Fund,6.02,1.68,-5.06,13.34,Nifty India Consumption - TRI,17.99,22.86,,-7.33,18,11,14,10,4,5,6,,Tata India Consumer Fund-Reg(G),Equity : Thematic - Consumption,20,22,20,18,17,13,13,9,-3.28,5.9,2.07,-5.13,9.91,16.91,22.83,13.66,,,,,,,,
ICICI Pru Bharat 22 FOF-(G),40232,ICICI Prudential Mutual Fund,4.21,3.6,-4.03,3.81,BSE Bharat 22 Index,27.91,34.16,,-0.15,45,19,28,53,54,1,1,,ICICI Pru Bharat 22 FOF-(G),FoFs : Domestic,61,64,62,61,56,47,28,23,2.55,3.16,3.62,0.43,11.38,12.86,16.38,10.07,1.83,3.73,-5.39,0.59,24.58,30.94,,-4.86
Aditya Birla SL Medium Term Plan-Reg(G),7683,Aditya Birla Sun Life Mutual Fund,1.9,5.32,7.09,14.51,CRISIL Medium Duration Debt Index,14.27,12.39,8.65,5.85,1,8,1,1,1,1,1,1,Aditya Birla SL Medium Term Plan-Reg(G),Debt : Medium Duration,29,29,29,29,29,18,12,12,3.24,1.45,2.79,4.44,8.99,7.13,6.96,6.77,,,,,,,,
Mirae Asset Money Market Fund-Reg(G),45753,Mirae Asset Mutual Fund,1.13,2.32,4.09,7.85,Nifty Money Market Index,6.79,,,2.78,12,11,13,11,11,11,,,Mirae Asset Money Market Fund-Reg(G),Debt : Money Market,22,23,22,22,22,19,17,13,2.74,1.12,2.29,4.03,7.71,6.89,5.79,6.61,,,,,,,,
Nippon India Consumption Fund(G),2644,Nippon India Mutual Fund,8.68,5.02,-1.87,12.09,Nifty India Consumption - TRI,20.18,28.06,14.49,1.56,1,1,1,1,7,1,1,5,Nippon India Consumption Fund(G),Equity : Thematic - Consumption,20,22,20,18,17,13,13,9,-3.28,5.9,2.07,-5.13,9.91,16.91,22.83,13.66,,,,,,,,
DSP Nifty SDL Plus G-Sec Jun 2028 30:70 Index Fund-Reg(G),45863,DSP Mutual Fund,1.67,2.99,4.73,9.74,Nifty SDL Plus G-Sec Jun 2028 70:30 Index,7.46,,,3.63,27,34,33,27,27,7,,,DSP Nifty SDL Plus G-Sec Jun 2028 30:70 Index Fund-Reg(G),Debt : Medium to Long Duration,59,60,59,55,52,26,11,11,3.68,1.82,3.14,4.78,9.75,7.25,6.14,6.43,,,,,,,,
Union Flexi Cap Fund-Reg(G),14559,Union Mutual Fund,4.05,3.41,-2.24,6.71,BSE 500 - TRI,14.43,23.52,11.47,-3.78,28,30,15,17,36,20,11,18,Union Flexi Cap Fund-Reg(G),Equity : Flexi Cap,48,48,48,48,47,35,26,21,-3.57,4.17,1.94,-4.02,8.9,15.42,23.38,13.13,,,,,,,,
SBI CRISIL IBX Gilt Index - Apr 2029 Fund-Reg(G),46971,SBI Mutual Fund,1.93,3.52,5.41,10.62,CRISIL IBX Gilt Index - April 2029,,,,4.09,16,22,19,11,13,,,,SBI CRISIL IBX Gilt Index - Apr 2029 Fund-Reg(G),Debt : Medium to Long Duration,59,60,59,55,52,26,11,11,3.68,1.82,3.14,4.78,9.75,7.25,6.14,6.43,,,,,,,,
Kotak Infra & Eco Reform Fund(G),4228,Kotak Mahindra Mutual Fund,4.43,-3.86,-10.9,0.96,Nifty Infrastructure - TRI,22.37,32.39,14.65,-11.43,19,7,19,18,15,11,9,11,Kotak Infra & Eco Reform Fund(G),Equity : Sectoral - Infrastructure,20,20,20,19,19,19,19,18,-6.07,3.79,0.23,-7.45,3.23,22.88,32.44,14.33,,,,,,,,
ICICI Pru BSE Liquid Rate ETF(IDCW),35122,ICICI Prudential Mutual Fund,0.48,1.46,3.06,6.31,BSE Liquid Rate Index,6.1,4.74,,1.87,24,24,24,22,18,12,5,,ICICI Pru BSE Liquid Rate ETF(IDCW),Debt : ETFs,31,32,31,30,25,14,7,2,3.22,1.36,2.69,4.52,9.22,7.37,5.41,6.03,,,,,,,,
Motilal Oswal Nifty 500 Index Fund-Reg(G),43809,Motilal Oswal Mutual Fund,4.5,3.24,-2.69,7.56,NIFTY 500 - TRI,14.2,23.58,,-0.87,75,87,88,65,58,37,5,,Motilal Oswal Nifty 500 Index Fund-Reg(G),Equity : Index Funds,175,190,176,151,115,68,32,18,-2.57,4.67,2.21,-3.96,6.58,14.83,22.71,11.63,,,,,,,,
UTI Infrastructure Fund-Reg(G),3582,UTI Mutual Fund,4.15,3.73,-4.0,5.18,Nifty Infrastructure - TRI,20.95,27.55,12.07,-0.63,1,9,1,2,8,14,17,17,UTI Infrastructure Fund-Reg(G),Equity : Sectoral - Infrastructure,20,20,20,19,19,19,19,18,-6.07,3.79,0.23,-7.45,3.23,22.88,32.44,14.33,,,,,,,,
Kotak MNC Fund-Reg(G),49046,Kotak Mahindra Mutual Fund,3.93,-3.34,,,NIFTY MNC - TRI,,,,-7.49,4,1,5,,,,,,Kotak MNC Fund-Reg(G),Equity : Thematic - MNC,6,6,6,5,5,4,4,3,-7.19,2.76,-3.06,-8.88,2.54,11.07,17.42,9.06,,,,,,,,
HSBC Overnight Fund-Reg(G),42784,HSBC Mutual Fund,0.51,1.52,3.16,6.5,Nifty 1D Rate Index,6.24,4.97,,1.95,19,14,19,18,17,19,15,,HSBC Overnight Fund-Reg(G),Debt : Overnight,34,34,34,34,34,28,27,3,1.94,0.51,1.51,3.15,6.48,6.24,4.97,5.57,0.55,1.53,3.21,6.61,6.38,5.12,,6.3
Templeton India Value Fund(G),3379,Franklin Templeton Mutual Fund,4.55,2.73,-4.48,6.68,NIFTY 500 - TRI,18.89,31.68,14.23,-0.15,3,6,5,13,15,11,3,9,Templeton India Value Fund(G),Equity : Value / Contra,22,23,22,22,22,21,17,14,-3.41,3.68,1.06,-4.72,7.87,18.79,27.86,14.3,,,,,,,,
Nippon India Gilt Securities Fund(G),6291,Nippon India Mutual Fund,2.89,4.47,5.69,11.68,Nifty All Duration G-Sec Index,7.83,5.8,7.85,4.97,23,19,23,21,17,15,15,6,Nippon India Gilt Securities Fund(G),Debt : Gilt,36,37,37,36,35,23,21,21,4.65,2.59,4.12,5.54,11.23,7.86,6.06,7.32,,,,,,,,
Franklin India Equity Hybrid Fund(G),999,Franklin Templeton Mutual Fund,3.42,3.06,0.21,10.59,CRISIL Hybrid 35+65 - Aggressive Index,15.15,20.54,11.36,-0.53,39,23,19,31,18,11,11,10,Franklin India Equity Hybrid Fund(G),Hybrid : Equity Oriented,55,56,55,55,55,54,51,29,4.63,7.33,6.98,4.7,13.32,12.48,16.48,9.96,,,,,,,,
Nippon India ETF Nifty IT,44506,Nippon India Mutual Fund,-3.53,-18.32,-15.38,7.09,NIFTY IT - TRI,4.82,,,-18.12,166,170,166,159,103,101,,,Nippon India ETF Nifty IT,Equity : ETFs,170,182,170,167,148,103,63,28,-1.32,4.21,2.34,-2.65,9.31,15.77,23.97,11.98,,,,,,,,
Tata Infrastructure Fund-Reg(G),3254,Tata Mutual Fund,3.52,-0.86,-13.04,-6.09,BSE India Infrastructure Index - TRI,20.27,31.11,13.96,-8.87,17,13,13,19,18,15,15,12,Tata Infrastructure Fund-Reg(G),Equity : Sectoral - Infrastructure,20,20,20,19,19,19,19,18,-6.07,3.79,0.23,-7.45,3.23,22.88,32.44,14.33,,,,,,,,
Kotak Bond Fund-Reg(G),1968,Kotak Mahindra Mutual Fund,2.28,3.61,5.0,10.37,CRISIL Medium to Long Term Debt Index,7.34,6.03,6.74,4.18,14,15,14,20,17,10,5,5,Kotak Bond Fund-Reg(G),Debt : Medium to Long Duration,59,60,59,55,52,26,11,11,3.68,1.82,3.14,4.78,9.75,7.25,6.14,6.43,,,,,,,,
NJ Flexi Cap Fund-Reg(G),48135,NJ Mutual Fund,3.69,-3.22,-10.65,0.23,NIFTY 500 - TRI,,,,-5.89,37,36,46,46,44,,,,NJ Flexi Cap Fund-Reg(G),Equity : Flexi Cap,48,48,48,48,47,35,26,21,-3.57,4.17,1.94,-4.02,8.9,15.42,23.38,13.13,,,,,,,,
Tata Retirement Sav Fund - Mod Plan(G),15379,Tata Mutual Fund,4.89,0.67,-2.45,10.98,CRISIL Hybrid 25+75 - Aggressive Index,14.04,17.84,11.64,-4.08,40,3,39,31,10,11,11,4,Tata Retirement Sav Fund - Mod Plan(G),Hybrid : Solution Oriented,43,43,43,42,41,37,32,15,-0.73,3.36,2.24,-0.74,9.55,12.38,15.93,10.16,,,,,,,,
Franklin India Liquid Fund-Super Inst(G),3406,Franklin Templeton Mutual Fund,0.77,1.89,3.68,7.36,Nifty Liquid Fund Index,6.81,5.43,6.35,2.35,2,1,2,1,1,7,9,2,Franklin India Liquid Fund-Super Inst(G),Debt : Liquid,38,38,38,37,37,35,34,29,2.27,0.7,1.81,3.57,7.18,6.71,5.35,6.17,,,,,,,,
Quant Absolute Fund(G),865,Quant Mutual Fund,4.97,3.33,-3.49,-1.15,NIFTY 50 Hybrid Composite Debt 65:35 Index,12.05,27.58,14.75,1.68,15,3,16,50,55,23,2,2,Quant Absolute Fund(G),Hybrid : Equity Oriented,55,56,55,55,55,54,51,29,4.63,7.33,6.98,4.7,13.32,12.48,16.48,9.96,,,,,,,,
