DSP World Mining Overseas Equity Omni FoF-Reg(G),8359,DSP Mutual Fund,9.4,38.91,65.73,89.13,MSCI ACWI Metals & Mining 30% Buffer 10/40 (1994) Net TRI,19.46,19.59,21.21,18.95,1,2,2,2,2,24,2,1,DSP World Mining Overseas Equity Omni FoF-Reg(G),FoFs : Overseas,56,56,56,56,56,53,30,23,2.99,0.23,4.59,15.05,25.51,19.42,10.34,12.21,,,,,,,,
Shriram Liquid Fund-Reg(G),48954,Shriram Mutual Fund,0.47,1.41,2.81,5.97,Nifty Liquid Fund Index,,,,0.56,31,33,34,34,34,,,,Shriram Liquid Fund-Reg(G),Debt : Liquid,44,44,42,40,38,36,34,29,0.56,0.48,1.43,2.86,6.26,6.83,5.77,6.01,,,,,,,,
Axis Income Plus Arbitrage Passive FOF-Reg(G),50378,Axis Mutual Fund,0.41,,,,Nifty Short Duration Debt Index,,,,0.46,33,34,,,,,,,Axis Income Plus Arbitrage Passive FOF-Reg(G),FoFs : Domestic,92,92,87,79,61,51,32,23,1.54,0.18,9.05,17.8,25.95,16.98,12.12,10.94,,,,,,,,
Motilal Oswal Nifty 5 Year Benchmark G-Sec ETF,45196,Motilal Oswal Mutual Fund,0.81,0.99,1.8,7.29,Nifty 5 yr Benchmark G-Sec Index TRI,7.65,6.01,,0.45,19,2,22,22,6,9,3,,Motilal Oswal Nifty 5 Year Benchmark G-Sec ETF,Debt : ETFs,33,33,33,32,30,14,9,2,0.38,0.4,1.07,2.15,6.23,7.36,5.68,5.83,,,,,,,,
Aditya Birla SL Long Duration Fund-Reg(G),46711,Aditya Birla Sun Life Mutual Fund,0.16,0.07,-0.31,3.83,NIFTY Long Duration Debt Index,7.0,,,0.01,17,20,24,18,17,8,,,Aditya Birla SL Long Duration Fund-Reg(G),Debt : Long Duration,26,26,26,26,26,13,3,2,0.02,0.36,0.48,0.32,4.53,7.18,4.96,6.84,,,,,,,,
Bandhan CRISIL IBX 90:10 SDL Plus Gilt - Sep 2027 Index Fund-Reg(G),46212,Bandhan Mutual Fund,0.5,1.31,2.58,7.43,CRISIL IBX 90:10 SDL Plus Gilt Index - September 2027,7.56,,,0.5,10,7,9,8,3,7,,,Bandhan CRISIL IBX 90:10 SDL Plus Gilt - Sep 2027 Index Fund-Reg(G),Debt : Gilt,39,39,39,38,37,35,21,21,-0.09,0.31,0.64,0.67,4.6,6.73,5.09,6.97,,,,,,,,
Axis Floater Fund-Reg(G),45632,Axis Mutual Fund,0.45,1.14,2.11,7.13,NIFTY Long Duration Debt Index,7.82,,,0.09,12,6,9,12,8,5,,,Axis Floater Fund-Reg(G),Debt : Floater,12,12,12,12,12,12,8,5,0.41,0.45,1.19,2.49,7.32,7.65,6.29,7.02,,,,,,,,
Axis Nifty Bank Index Fund-Reg(G),48680,Axis Mutual Fund,-0.07,3.57,8.14,19.02,NIFTY BANK - TRI,,,,0.78,15,18,16,19,18,,,,Axis Nifty Bank Index Fund-Reg(G),Equity : Index Funds,227,228,219,210,179,86,34,18,-1.71,-2.69,-1.24,2.6,6.66,17.61,13.34,13.56,,,,,,,,
HSBC Dynamic Bond Fund-Reg(G),925,HSBC Mutual Fund,0.24,0.38,0.6,4.74,CRISIL Dynamic Bond Index,6.7,5.18,6.74,-0.25,17,17,14,13,13,12,14,11,HSBC Dynamic Bond Fund-Reg(G),Debt : Dynamic Bond,22,22,22,22,22,22,21,19,-0.01,0.29,0.54,0.93,4.98,6.71,5.68,6.82,,,,,,,,
Edelweiss Government Securities Fund-Reg(G),21922,Edelweiss Mutual Fund,0.12,0.06,-0.4,2.74,CRISIL Dynamic Gilt Index,6.15,5.44,7.39,-0.18,21,29,37,28,29,24,6,8,Edelweiss Government Securities Fund-Reg(G),Debt : Gilt,39,39,39,38,37,35,21,21,-0.09,0.31,0.64,0.67,4.6,6.73,5.09,6.97,,,,,,,,
Bank of India Balanced Advantage Fund-Reg(G),21917,Bank of India Mutual Fund,-1.55,0.74,4.4,8.71,NIFTY 50 Hybrid Composite Debt 50:50 Index,11.05,10.29,7.64,-0.88,19,17,6,3,5,17,8,11,Bank of India Balanced Advantage Fund-Reg(G),Hybrid : Dynamic Asset Allocation,36,34,34,34,33,24,20,11,-1.05,-1.53,-0.6,2.1,6.11,12.01,9.86,10.54,,,,,,,,
Aditya Birla SL CRISIL-IBX AAA NBFC-HFC Index-Dec 2025 Fund-Reg(G),49202,Aditya Birla Sun Life Mutual Fund,0.45,1.42,2.99,7.19,CRISIL-IBX AAA NBFC-HFC Index - Dec 2025,,,,0.0,32,3,2,2,9,,,,Aditya Birla SL CRISIL-IBX AAA NBFC-HFC Index-Dec 2025 Fund-Reg(G),Debt : Short Duration,33,33,33,33,29,23,20,18,0.26,0.36,0.98,2.27,6.98,7.11,6.07,6.61,,,,,,,,
Tata Nifty G-Sec Dec 2029 Index Fund-Reg(G),47405,Tata Mutual Fund,0.61,1.37,2.53,7.87,Nifty G-Sec Dec 2029 Index,7.94,,,0.7,1,4,12,31,6,2,,,Tata Nifty G-Sec Dec 2029 Index Fund-Reg(G),Debt : Medium to Long Duration,60,60,60,60,59,42,11,11,0.36,0.38,1.13,2.16,6.96,7.28,5.45,6.31,,,,,,,,
Nippon India Retirement Fund-Income Generation(G),17166,Nippon India Mutual Fund,-0.26,0.07,-0.29,3.41,CRISIL Hybrid 85+15 - Conservative Index,7.99,6.12,7.24,-0.14,6,6,12,36,37,36,30,17,Nippon India Retirement Fund-Income Generation(G),Hybrid : Solution Oriented,43,43,43,43,43,38,33,17,-1.19,-1.69,-1.08,1.4,5.78,13.02,10.9,10.77,,,,,,,,
Motilal Oswal Quant Fund-Reg(G),48806,Motilal Oswal Mutual Fund,-1.69,-0.97,0.58,1.21,NIFTY 200 - TRI,,,,-1.06,41,25,46,68,71,,,,Motilal Oswal Quant Fund-Reg(G),Equity : Thematic,113,112,110,105,91,41,28,9,-1.73,-2.76,-1.73,1.98,6.04,18.73,17.11,15.41,,,,,,,,
Mirae Asset Nifty IT ETF,48250,Mirae Asset Mutual Fund,-3.84,2.95,4.44,-13.8,NIFTY IT - TRI,,,,-4.13,204,196,40,82,168,,,,Mirae Asset Nifty IT ETF,Equity : ETFs,232,233,215,204,173,124,73,38,-1.19,-2.21,-0.08,5.13,9.63,17.32,14.32,14.76,,,,,,,,
Motilal Oswal Nifty Smallcap 250 ETF,48657,Motilal Oswal Mutual Fund,-5.46,-8.04,-6.04,-0.85,Nifty Smallcap 250 - TRI,,,,-4.89,218,221,206,198,154,,,,Motilal Oswal Nifty Smallcap 250 ETF,Equity : ETFs,232,233,215,204,173,124,73,38,-1.19,-2.21,-0.08,5.13,9.63,17.32,14.32,14.76,,,,,,,,
SBI FMP-52-1848D-Reg(G),45915,SBI Mutual Fund,0.45,1.41,2.8,7.12,CRISIL Medium to Long Term Debt Index,7.43,,,0.53,31,30,28,14,28,21,,,SBI FMP-52-1848D-Reg(G),Debt : FTP/FMP,76,76,76,76,76,58,10,3,0.48,0.43,1.36,2.66,6.95,7.32,6.4,6.11,,,,,,,,
Union Equity Savings Fund-Reg(G),40627,Union Mutual Fund,-0.35,0.29,2.02,5.42,Crisil Equity Savings Index,8.21,6.6,,-0.12,18,11,21,29,37,50,50,,Union Equity Savings Fund-Reg(G),Hybrid : Equity Oriented,63,56,56,55,53,52,50,33,-0.79,-1.24,-0.35,1.98,6.37,12.34,10.81,10.69,,,,,,,,
HSBC Nifty Next 50 Index Fund-Reg(G),33548,HSBC Mutual Fund,-2.09,-1.83,3.16,7.64,NIFTY NEXT 50 - TRI,21.1,15.04,,-0.47,46,58,150,101,87,23,10,,HSBC Nifty Next 50 Index Fund-Reg(G),Equity : Index Funds,227,228,219,210,179,86,34,18,-1.71,-2.69,-1.24,2.6,6.66,17.61,13.34,13.56,,,,,,,,
Kotak NIFTY 100 Low Volatility 30 Index Fund-Reg(G),45716,Kotak Mahindra Mutual Fund,-3.17,-0.09,2.99,6.83,Nifty100 Low Volatility 30 - TRI,,,,-2.35,170,169,77,114,107,,,,Kotak NIFTY 100 Low Volatility 30 Index Fund-Reg(G),Equity : Index Funds,227,228,219,210,179,86,34,18,-1.71,-2.69,-1.24,2.6,6.66,17.61,13.34,13.56,,,,,,,,
Samco Special Opportunities Fund-Reg(G),48744,Samco Mutual Fund,-3.93,-6.2,-4.81,-1.77,NIFTY 500 - TRI,,,,-2.92,87,85,102,102,81,,,,Samco Special Opportunities Fund-Reg(G),Equity : Thematic,113,112,110,105,91,41,28,9,-1.73,-2.76,-1.73,1.98,6.04,18.77,17.12,15.41,,,,,,,,
SBI Nifty Bank Index Fund-Reg(G),49104,SBI Mutual Fund,-0.04,3.67,8.34,,NIFTY BANK - TRI,,,,0.73,16,11,11,12,,,,,SBI Nifty Bank Index Fund-Reg(G),Equity : Index Funds,227,228,219,210,179,86,34,18,-1.71,-2.69,-1.24,2.6,6.66,17.61,13.34,13.56,,,,,,,,
Shriram Multi Asset Allocation Fund-Reg(G),48029,Shriram Mutual Fund,0.01,4.94,11.42,13.3,NIFTY 50 - TRI,,,,0.72,28,27,18,15,22,,,,Shriram Multi Asset Allocation Fund-Reg(G),Hybrid : Multi Asset Allocation,35,35,33,31,27,11,9,7,1.84,0.79,4.93,10.61,17.78,18.51,16.3,13.72,,,,,,,,
Axis NIFTY IT Index Fund-Reg(G),47983,Axis Mutual Fund,-3.9,2.74,3.97,-14.64,NIFTY IT - TRI,,,,-5.61,218,188,23,71,179,,,,Axis NIFTY IT Index Fund-Reg(G),Equity : Index Funds,227,228,219,210,179,86,34,18,-1.71,-2.69,-1.24,2.6,6.66,17.61,13.34,13.56,,,,,,,,
Edelweiss CRISIL IBX 50:50 Gilt Plus SDL Sep 2028 Index Fund-Reg(G),47075,Edelweiss Mutual Fund,0.33,1.32,2.42,7.64,CRISIL IBX 50:50 Gilt Plus SDL Index - Sep 2028,7.75,,,0.39,38,42,27,36,15,7,,,Edelweiss CRISIL IBX 50:50 Gilt Plus SDL Sep 2028 Index Fund-Reg(G),Debt : Medium to Long Duration,60,60,60,60,59,42,11,11,0.36,0.38,1.13,2.16,6.96,7.28,5.45,6.31,,,,,,,,
ICICI Pru FMP-88-1226D-F(G),47232,ICICI Prudential Mutual Fund,0.4,1.36,2.64,6.65,CRISIL Medium Duration Debt Index,7.02,,,0.49,51,63,55,55,58,45,,,ICICI Pru FMP-88-1226D-F(G),Debt : FTP/FMP,76,76,76,76,76,58,10,3,0.48,0.43,1.36,2.66,6.95,7.32,6.4,6.11,,,,,,,,
Axis BSE Sensex ETF,47768,Axis Mutual Fund,-2.45,-0.1,3.56,7.67,BSE SENSEX - TRI,,,,-1.88,156,126,111,123,105,,,,Axis BSE Sensex ETF,Equity : ETFs,232,233,215,204,173,124,73,38,-1.19,-2.21,-0.08,5.13,9.63,17.32,14.32,14.76,,,,,,,,
Kotak Nifty Midcap 50 ETF,45730,Kotak Mahindra Mutual Fund,-2.25,0.29,6.36,13.15,Nifty Midcap 50 - TRI,26.09,,,-1.32,103,113,83,53,51,11,,,Kotak Nifty Midcap 50 ETF,Equity : ETFs,232,233,215,204,173,124,73,38,-1.19,-2.21,-0.08,5.13,9.63,17.32,14.32,14.76,,,,,,,,
HSBC Conservative Hybrid Fund(G),1458,HSBC Mutual Fund,-0.07,-1.32,-1.17,4.79,NIFTY 50 Hybrid Composite Debt 15:85 Index,9.56,7.34,7.75,-0.01,5,6,18,18,13,7,11,8,HSBC Conservative Hybrid Fund(G),Hybrid : Debt Oriented (Conservative),18,18,18,18,18,18,17,17,-0.19,-0.25,0.33,1.67,5.88,8.88,7.89,7.88,,,,,,,,
Canara Rob Gilt Fund-Reg(G),538,Canara Robeco Mutual Fund,0.25,0.12,-0.32,2.82,CRISIL Dynamic Gilt Index,5.91,4.74,6.93,-0.61,31,23,32,25,27,28,16,12,Canara Rob Gilt Fund-Reg(G),Debt : Gilt,39,39,39,38,37,35,21,21,-0.09,0.31,0.64,0.67,4.6,6.73,5.09,6.97,,,,,,,,
SBI FMP-46-1850D-Reg(G),45620,SBI Mutual Fund,0.45,1.38,2.7,6.83,CRISIL Medium to Long Term Debt Index,7.18,,,0.52,36,32,48,47,39,33,,,SBI FMP-46-1850D-Reg(G),Debt : FTP/FMP,76,76,76,76,76,58,10,3,0.48,0.43,1.36,2.66,6.95,7.32,6.4,6.11,,,,,,,,
Shriram Flexi Cap Fund-Reg(G),38781,Shriram Mutual Fund,-3.12,-1.72,0.93,1.5,NIFTY 500 - TRI,10.91,9.62,,-2.22,40,40,27,34,40,38,28,,Shriram Flexi Cap Fund-Reg(G),Equity : Flexi Cap,52,52,51,50,48,39,29,21,-1.8,-2.61,-1.86,1.4,5.76,16.58,14.29,14.73,,,,,,,,
Tata Floating Rate Fund-Reg(G),45375,Tata Mutual Fund,0.45,1.28,2.63,7.24,CRISIL Short Duration Debt Index,7.41,,,0.47,3,5,5,5,7,10,,,Tata Floating Rate Fund-Reg(G),Debt : Floater,12,12,12,12,12,12,8,5,0.41,0.45,1.19,2.49,7.32,7.65,6.29,7.02,,,,,,,,
Mahindra Manulife Overnight Fund-Reg(G),42560,Mahindra Manulife Mutual Fund,0.43,1.3,2.66,5.58,CRISIL Liquid Overnight Index,6.27,5.37,,0.52,9,15,17,17,18,20,13,,Mahindra Manulife Overnight Fund-Reg(G),Debt : Overnight,35,35,35,35,34,31,27,3,0.51,0.43,1.29,2.65,5.55,6.27,5.36,5.42,,,,,,,,
Bandhan US Treasury Bond 0-1 year specific Debt Passive FOF-Reg(G),47724,Bandhan Mutual Fund,0.46,2.96,4.99,7.75,ICE 0-1 Year US Treasury Securities Index,,,,0.83,33,27,32,47,50,,,,Bandhan US Treasury Bond 0-1 year specific Debt Passive FOF-Reg(G),FoFs : Overseas,56,56,56,56,56,53,30,23,2.99,0.23,4.59,15.05,25.51,19.42,10.34,12.21,,,,,,,,
Nippon India Medium Duration Fund(G),21911,Nippon India Mutual Fund,0.53,1.13,2.36,9.25,CRISIL Medium Duration Debt Index,8.3,8.93,3.42,0.49,14,3,18,19,2,2,2,12,Nippon India Medium Duration Fund(G),Debt : Medium Duration,25,25,25,25,25,19,12,12,0.46,0.43,1.24,2.54,7.27,7.37,6.78,6.71,,,,,,,,
Edelweiss ASEAN Equity Off-Shore Fund-Reg(G),13404,Edelweiss Mutual Fund,1.73,6.82,10.9,19.68,MSCI AC ASEAN 10/40 Index,9.15,8.49,8.49,3.15,25,23,19,30,27,48,18,21,Edelweiss ASEAN Equity Off-Shore Fund-Reg(G),FoFs : Overseas,56,56,56,56,56,53,30,23,2.99,0.23,4.59,15.05,25.51,19.42,10.34,12.21,,,,,,,,
Samco Small Cap Fund-Reg(G),50097,Samco Mutual Fund,-3.55,,,,Nifty Smallcap 250 - TRI,,,,-3.19,21,16,,,,,,,Samco Small Cap Fund-Reg(G),Equity : Small Cap,33,33,31,31,30,24,22,13,-2.94,-3.77,-6.01,-3.42,1.25,18.64,20.53,17.1,,,,,,,,
Kotak FMP-310-1131D(G),47871,Kotak Mahindra Mutual Fund,0.4,1.36,2.63,6.54,NIFTY Medium Duration Debt Index,,,,0.49,53,64,57,57,64,,,,Kotak FMP-310-1131D(G),Debt : FTP/FMP,76,76,76,76,76,58,10,3,0.48,0.43,1.36,2.66,6.95,7.32,6.4,6.11,,,,,,,,
Tata Nifty India Digital ETF FoF-Reg(G),46355,Tata Mutual Fund,-6.24,-3.8,1.78,-3.23,Nifty India Digital - TRI,17.76,,,-6.03,91,91,82,62,60,16,,,Tata Nifty India Digital ETF FoF-Reg(G),FoFs : Domestic,92,92,87,79,61,51,32,23,1.54,0.18,9.05,17.8,25.95,16.98,12.12,10.94,,,,,,,,
Bandhan Nifty200 Momentum 30 Index Fund-Reg(G),46608,Bandhan Mutual Fund,-3.09,-2.72,1.31,0.72,Nifty200 Momentum 30 - TRI,18.08,,,-0.99,73,161,171,156,137,45,,,Bandhan Nifty200 Momentum 30 Index Fund-Reg(G),Equity : Index Funds,227,228,219,210,179,86,34,18,-1.69,-2.69,-1.24,2.6,6.66,17.67,13.36,13.56,,,,,,,,
Quantum Diversified Equity All Cap Active FOF-Reg(G),19904,Quantum Mutual Fund,-2.48,-0.72,2.67,8.05,BSE 500 - TRI,16.72,13.79,13.87,-1.25,77,75,66,42,33,18,11,4,Quantum Diversified Equity All Cap Active FOF-Reg(G),FoFs : Domestic,92,92,87,79,61,51,32,23,1.54,0.18,9.05,17.8,25.95,16.98,12.12,10.94,,,,,,,,
ICICI Pru Nifty Healthcare ETF,45383,ICICI Prudential Mutual Fund,-2.96,-3.55,-1.63,1.07,Nifty Healthcare Index - TRI,23.15,,,-3.31,192,164,186,186,145,25,,,ICICI Pru Nifty Healthcare ETF,Equity : ETFs,232,233,215,204,173,124,73,38,-1.19,-2.21,-0.08,5.13,9.63,17.32,14.32,14.76,,,,,,,,
Samco Large & Mid Cap Fund-Reg(G),49779,Samco Mutual Fund,-4.49,-3.77,-6.98,,NIFTY LargeMidcap 250 - TRI,,,,-2.82,27,31,26,33,,,,,Samco Large & Mid Cap Fund-Reg(G),Equity : Large & Mid Cap,33,33,33,33,31,26,26,20,-1.87,-2.7,-2.02,1.59,7.39,18.7,16.42,15.37,,,,,,,,
Invesco India - Invesco Pan European Equity FoF-Reg(G),24619,Invesco Mutual Fund,5.0,17.4,22.84,42.2,MSCI Europe Index (Total Return Net),16.68,15.48,10.46,6.83,14,9,5,11,12,33,8,16,Invesco India - Invesco Pan European Equity FoF-Reg(G),FoFs : Overseas,56,56,56,56,56,53,30,23,2.99,0.23,4.59,15.05,25.51,19.42,10.34,12.21,,,,,,,,
Sundaram Nifty 100 Equal Weight Fund(G),2384,Sundaram Mutual Fund,-1.75,-0.23,4.65,10.07,Nifty100 Equal Weight - TRI,19.42,15.13,13.26,-0.34,39,43,86,45,37,31,9,16,Sundaram Nifty 100 Equal Weight Fund(G),Equity : Index Funds,227,228,219,210,179,86,34,18,-1.69,-2.69,-1.24,2.6,6.66,17.67,13.36,13.56,,,,,,,,
UTI Gilt Fund with 10 year Constant Duration-Reg(G),40967,UTI Mutual Fund,0.46,0.71,0.92,5.74,CRISIL 10 Year Gilt Index,7.38,,,0.28,2,4,4,4,4,5,,,UTI Gilt Fund with 10 year Constant Duration-Reg(G),Debt : Gilt (10 Yr Constant Duration),6,6,6,6,6,6,4,4,0.06,0.47,0.69,0.91,5.97,7.62,5.61,7.72,,,,,,,,
Groww Largecap Fund-Reg(G),15997,Groww Mutual Fund,-1.86,-0.36,3.32,10.07,NIFTY 100 - TRI,14.47,11.49,12.38,-0.99,8,8,16,17,5,26,25,22,Groww Largecap Fund-Reg(G),Equity : Large Cap,39,39,39,39,38,36,33,28,-1.65,-2.46,-0.85,2.78,7.34,15.38,12.65,13.51,,,,,,,,
SBI Childrens Fund-Savings Plan-Reg(G),2748,SBI Mutual Fund,0.03,0.13,0.98,4.61,NIFTY 50 Hybrid Composite Debt 15:85 Index,12.21,11.25,11.51,0.03,4,4,10,26,26,20,11,7,SBI Childrens Fund-Savings Plan-Reg(G),Hybrid : Solution Oriented,43,43,43,43,43,38,33,17,-1.19,-1.69,-1.08,1.4,5.78,13.02,10.9,10.77,,,,,,,,
SBI FMP-78-1170D-Reg(G),47638,SBI Mutual Fund,0.45,1.39,2.74,6.76,CRISIL Medium Duration Debt Index,,,,0.52,34,35,37,30,43,,,,SBI FMP-78-1170D-Reg(G),Debt : FTP/FMP,76,76,76,76,76,58,10,3,0.48,0.43,1.36,2.66,6.95,7.32,6.4,6.11,,,,,,,,
DSP FMP 268-1281D-Reg(G),47124,DSP Mutual Fund,0.47,1.41,2.74,6.65,CRISIL Medium Duration Debt Index,7.2,,,0.54,22,14,24,31,59,31,,,DSP FMP 268-1281D-Reg(G),Debt : FTP/FMP,76,76,76,76,76,58,10,3,0.48,0.43,1.36,2.66,6.95,7.32,6.4,6.11,,,,,,,,
TRUSTMF Banking & PSU Fund-Reg(G),45242,Trust Mutual Fund,0.41,0.96,2.17,6.79,CRISIL Banking and PSU Debt Index,7.02,5.64,,0.26,14,8,10,10,15,20,15,,TRUSTMF Banking & PSU Fund-Reg(G),Debt : Banking & PSU,26,26,26,26,26,25,19,16,0.25,0.37,0.92,2.17,6.85,7.14,5.94,7.02,,,,,,,,
Samco Large Cap Fund-Reg(G),49506,Samco Mutual Fund,-4.71,-5.21,-6.95,,NIFTY 100 - TRI,,,,-3.08,37,38,38,39,,,,,Samco Large Cap Fund-Reg(G),Equity : Large Cap,39,39,39,39,38,36,33,28,-1.65,-2.46,-0.85,2.78,7.34,15.38,12.65,13.51,,,,,,,,
Unifi Liquid Fund-Reg(G),49844,Unifi Mutual Fund,0.49,1.42,2.91,,Nifty Liquid Fund Index,,,,0.59,5,5,33,11,,,,,Unifi Liquid Fund-Reg(G),Debt : Liquid,44,44,42,40,38,36,34,29,0.56,0.48,1.43,2.86,6.26,6.83,5.77,6.01,,,,,,,,
Motilal Oswal BSE Enhanced Value ETF,46740,Motilal Oswal Mutual Fund,2.86,7.18,21.69,29.92,BSE Enhanced Value Index - TRI,35.7,,,4.45,15,6,5,11,11,3,,,Motilal Oswal BSE Enhanced Value ETF,Equity : ETFs,232,233,215,204,173,124,73,38,-1.19,-2.21,-0.08,5.13,9.63,17.32,14.32,14.76,,,,,,,,
Taurus Mid Cap Fund-Reg(G),3306,Taurus Mutual Fund,-3.56,-5.56,-2.66,3.49,Nifty Midcap 150 - TRI,15.67,15.37,15.49,-2.75,25,27,29,27,25,28,23,17,Taurus Mid Cap Fund-Reg(G),Equity : Mid Cap,32,32,32,31,30,30,24,20,-1.84,-2.78,-2.65,1.02,7.6,21.56,19.34,16.8,,,,,,,,
Motilal Oswal Nifty 200 Momentum 30 ETF,46325,Motilal Oswal Mutual Fund,-3.0,-2.68,1.57,1.35,Nifty200 Momentum 30 - TRI,19.14,,,-0.88,83,167,181,168,143,40,,,Motilal Oswal Nifty 200 Momentum 30 ETF,Equity : ETFs,232,233,215,204,173,124,73,38,-1.19,-2.21,-0.08,5.13,9.63,17.32,14.32,14.76,,,,,,,,
ICICI Pru Strategic Metal and Energy Equity FoF-Reg(G),46205,ICICI Prudential Mutual Fund,7.11,27.88,40.85,58.62,NYSE Arca Gold Miners Index,24.91,,,14.93,3,3,3,3,3,12,,,ICICI Pru Strategic Metal and Energy Equity FoF-Reg(G),FoFs : Overseas,56,56,56,56,56,53,30,23,2.99,0.23,4.59,15.05,25.51,19.42,10.34,12.21,,,,,,,,
SBI FMP-50-1843D-Reg(G),45842,SBI Mutual Fund,0.42,1.38,2.75,7.08,CRISIL Medium to Long Term Debt Index,7.33,,,0.5,47,45,51,27,30,25,,,SBI FMP-50-1843D-Reg(G),Debt : FTP/FMP,76,76,76,76,76,58,10,3,0.48,0.43,1.36,2.66,6.95,7.32,6.4,6.11,,,,,,,,
Tata Nifty500 Multicap India Manufacturing 50:30:20 Index Fund-Reg(G),48782,Tata Mutual Fund,-3.56,-1.71,4.09,9.08,Nifty500 Multicap India Manufacturing 50:30:20 - TRI,,,,-2.26,168,178,141,64,50,,,,Tata Nifty500 Multicap India Manufacturing 50:30:20 Index Fund-Reg(G),Equity : Index Funds,227,228,219,210,179,86,34,18,-1.69,-2.69,-1.24,2.6,6.66,17.67,13.36,13.56,,,,,,,,
Motilal Oswal NASDAQ Q 50 ETF,46181,Motilal Oswal Mutual Fund,-0.86,3.87,12.17,15.26,NASDAQ Q-50-TRI,15.53,,,3.53,19,47,22,17,42,58,,,Motilal Oswal NASDAQ Q 50 ETF,Equity : ETFs,232,233,215,204,173,124,73,38,-1.19,-2.21,-0.08,5.13,9.63,17.32,14.32,14.76,,,,,,,,
Edelweiss Nifty Alpha Low Volatility 30 Index Fund-Reg(G),48808,Edelweiss Mutual Fund,-2.42,-0.77,1.57,1.29,NIFTY Alpha Low-Volatility 30 - TRI,,,,-1.23,81,102,110,150,133,,,,Edelweiss Nifty Alpha Low Volatility 30 Index Fund-Reg(G),Equity : Index Funds,227,228,219,210,179,86,34,18,-1.69,-2.69,-1.24,2.6,6.66,17.67,13.36,13.56,,,,,,,,
Nippon India Nifty G-Sec Oct 2028 Maturity Index Fund-Reg(G),47629,Nippon India Mutual Fund,0.58,1.5,2.89,8.09,Nifty G-Sec Oct 2028 Index,,,,0.59,5,5,1,1,2,,,,Nippon India Nifty G-Sec Oct 2028 Maturity Index Fund-Reg(G),Debt : Medium to Long Duration,60,60,60,60,59,42,11,11,0.36,0.38,1.13,2.16,6.96,7.28,5.45,6.31,,,,,,,,
Nippon India Nifty 1D Rate Liquid ETF(G),50023,Nippon India Mutual Fund,0.39,1.19,2.44,,Nifty 1D Rate Index,,,,0.47,44,44,42,40,,,,,Nippon India Nifty 1D Rate Liquid ETF(G),Debt : Liquid,44,44,42,40,38,36,34,29,0.57,0.48,1.43,2.86,6.26,6.82,5.77,6.01,0.43,1.33,2.7,5.67,6.39,5.5,,5.1
Baroda BNP Paribas Multi Asset Active FoF-Reg(G),49872,Baroda BNP Paribas Mutual Fund,2.17,5.61,11.0,,NIFTY Composite Debt Index,,,,2.68,21,17,17,16,,,,,Baroda BNP Paribas Multi Asset Active FoF-Reg(G),FoFs : Domestic,92,92,87,79,61,51,32,23,1.54,0.18,9.05,17.8,25.95,16.98,12.12,10.94,,,,,,,,
Motilal Oswal Asset Allocation Passive FoF-Aggressive-Reg(G),45344,Motilal Oswal Mutual Fund,0.53,3.68,9.82,16.47,NIFTY 500 - TRI,18.26,,,1.48,28,27,24,18,17,14,,,Motilal Oswal Asset Allocation Passive FoF-Aggressive-Reg(G),FoFs : Domestic,92,92,87,79,61,51,32,23,1.54,0.18,9.05,17.8,25.95,16.98,12.12,10.94,,,,,,,,
Baroda BNP Paribas Gold ETF FoF-Reg(G),50181,Baroda BNP Paribas Mutual Fund,11.03,25.54,,,Gold-India,,,,12.91,4,2,13,,,,,,Baroda BNP Paribas Gold ETF FoF-Reg(G),FoFs : Domestic,92,92,87,79,61,51,32,23,1.54,0.18,9.05,17.8,25.95,16.98,12.12,10.94,,,,,,,,
Groww Nifty India Railways PSU ETF,49496,Groww Mutual Fund,-5.92,-4.06,-5.95,-9.25,Nifty India Railways PSU Index - TRI,,,,-5.51,220,225,192,197,162,,,,Groww Nifty India Railways PSU ETF,Equity : ETFs,232,233,215,204,173,124,73,38,-1.19,-2.21,-0.08,5.13,9.63,17.32,14.32,14.76,,,,,,,,
Abakkus Liquid Fund-Reg(G),50550,Abakkus Mutual Fund,0.43,,,,CRISIL Liquid Debt Index,,,,0.51,41,41,,,,,,,Abakkus Liquid Fund-Reg(G),Debt : Liquid,44,44,42,40,38,36,34,29,0.57,0.48,1.43,2.86,6.26,6.82,5.77,6.01,,,,,,,,
TRUSTMF Money Market Fund-Reg(G),46735,Trust Mutual Fund,0.41,1.34,2.7,6.7,CRISIL Money Market Index,7.03,,,0.47,13,15,16,19,21,17,,,TRUSTMF Money Market Fund-Reg(G),Debt : Money Market,24,24,23,23,23,21,17,13,0.47,0.42,1.38,2.78,6.99,7.17,6.03,6.48,,,,,,,,
Edelweiss Overnight Fund-Reg(G),42955,Edelweiss Mutual Fund,0.43,1.3,2.66,5.57,CRISIL Liquid Overnight Index,6.26,5.35,,0.52,16,14,19,22,22,19,21,,Edelweiss Overnight Fund-Reg(G),Debt : Overnight,35,35,35,35,34,31,27,3,0.51,0.43,1.29,2.65,5.55,6.26,5.36,5.42,,,,,,,,
UTI NIFTY50 Equal Weight Index Fund-Reg(G),47962,UTI Mutual Fund,-1.4,1.54,7.14,12.39,NIFTY50 Equal Weight - TRI,,,,-0.32,33,30,31,22,27,,,,UTI NIFTY50 Equal Weight Index Fund-Reg(G),Equity : Index Funds,227,228,219,210,179,86,34,18,-1.69,-2.69,-1.24,2.6,6.66,17.67,13.36,13.56,,,,,,,,
Axis Nifty500 Momentum 50 Index Fund-Reg(G),49216,Axis Mutual Fund,-3.58,-4.53,-1.26,,Nifty500 Momentum 50 - TRI,,,,-1.78,135,180,188,173,,,,,Axis Nifty500 Momentum 50 Index Fund-Reg(G),Equity : Index Funds,227,228,219,210,179,86,34,18,-1.69,-2.69,-1.24,2.6,6.66,17.67,13.36,13.56,,,,,,,,
Union Gold ETF FoF-Reg(G),49466,Union Mutual Fund,10.97,24.98,47.65,,Gold-India,,,,11.95,14,11,19,17,,,,,Union Gold ETF FoF-Reg(G),Gold : MFs,22,22,20,18,17,14,10,10,12.2,10.06,34.32,61.97,90.13,38.24,24.62,17.09,,,,,,,,
Kotak Long Duration Fund-Reg(G),48538,Kotak Mahindra Mutual Fund,0.16,-0.19,-1.56,1.65,NIFTY Long Duration Debt Index,,,,-1.11,24,19,25,26,25,,,,Kotak Long Duration Fund-Reg(G),Debt : Long Duration,26,26,26,26,26,13,3,2,-0.28,0.36,0.48,0.32,4.53,7.03,4.83,6.84,,,,,,,,
Nippon India FMP-XLV-4-1111D(G),47822,Nippon India Mutual Fund,0.41,1.39,2.68,6.66,CRISIL Medium Duration Debt Index,,,,0.49,58,55,43,50,54,,,,Nippon India FMP-XLV-4-1111D(G),Debt : FTP/FMP,76,76,76,76,76,58,10,3,0.48,0.43,1.36,2.66,6.95,7.32,6.4,6.11,,,,,,,,
Bandhan Long Duration Fund-Reg(G),48582,Bandhan Mutual Fund,0.18,0.56,-0.32,2.65,NIFTY Long Duration Debt Index,,,,-0.71,20,18,11,19,21,,,,Bandhan Long Duration Fund-Reg(G),Debt : Long Duration,26,26,26,26,26,13,3,2,-0.28,0.36,0.48,0.32,4.53,7.03,4.83,6.84,,,,,,,,
Groww Nifty Smallcap 250 Index Fund-Reg(G),48617,Groww Mutual Fund,-5.55,-8.12,-6.4,-1.56,Nifty Smallcap 250 - TRI,,,,-5.0,210,217,204,193,155,,,,Groww Nifty Smallcap 250 Index Fund-Reg(G),Equity : Index Funds,227,228,219,210,179,86,34,18,-1.69,-2.69,-1.24,2.6,6.66,17.67,13.36,13.56,,,,,,,,
Kotak FMP-304-3119D(G),47401,Kotak Mahindra Mutual Fund,0.09,0.17,1.08,6.68,NIFTY Long Duration Debt Index,8.42,,,-0.45,76,76,76,76,53,1,,,Kotak FMP-304-3119D(G),Debt : FTP/FMP,76,76,76,76,76,58,10,3,0.48,0.43,1.36,2.66,6.95,7.32,6.4,6.11,,,,,,,,
Navi Aggressive Hybrid Fund-Reg(G),39479,Navi Mutual Fund,-3.45,-1.73,0.88,3.38,CRISIL Hybrid 35+65 - Aggressive Index,12.41,10.88,,-2.35,60,56,50,43,48,23,24,,Navi Aggressive Hybrid Fund-Reg(G),Hybrid : Equity Oriented,63,56,56,55,53,52,50,33,-0.79,-1.24,-0.35,1.98,6.37,12.34,10.81,10.69,,,,,,,,
Samco ELSS Tax Saver Fund-Reg(G),46606,Samco Mutual Fund,-3.97,-4.71,-7.36,-1.67,NIFTY 500 - TRI,7.05,,,-3.22,52,52,50,57,56,54,,,Samco ELSS Tax Saver Fund-Reg(G),Equity : Tax Saving (ELSS),57,57,57,57,57,54,51,31,-2.08,-2.99,-2.21,0.86,5.62,16.97,15.83,14.52,,,,,,,,
Canara Rob Income Fund-Reg(G),542,Canara Robeco Mutual Fund,0.3,0.26,0.39,3.75,CRISIL Medium to Long Term Debt Index,5.54,4.38,6.29,-0.1,52,45,58,60,59,42,10,7,Canara Rob Income Fund-Reg(G),Debt : Medium to Long Duration,60,60,60,60,59,42,11,11,0.3,0.38,1.13,2.16,6.96,7.27,5.38,6.31,,,,,,,,
Nippon India ETF BSE Sensex Next 50,43930,Nippon India Mutual Fund,-2.05,-1.11,4.47,9.96,BSE Sensex Next 50 - TRI,23.55,18.12,,-1.11,89,85,154,78,63,22,12,,Nippon India ETF BSE Sensex Next 50,Equity : ETFs,232,233,215,204,173,124,73,38,-1.19,-2.21,-0.08,5.13,9.63,17.32,14.32,14.76,,,,,,,,
Aditya Birla SL Retirement Fund-40-Reg(G),42770,Aditya Birla Sun Life Mutual Fund,-1.46,-1.63,2.65,7.74,CRISIL Hybrid 35+65 - Aggressive Index,13.91,9.31,,-0.53,13,18,27,11,10,15,19,,Aditya Birla SL Retirement Fund-40-Reg(G),Hybrid : Solution Oriented,43,43,43,43,43,38,33,17,-1.19,-1.69,-1.08,1.4,5.78,13.02,10.9,10.77,,,,,,,,
Baroda BNP Paribas NIFTY SDL Dec 2026 Index Fund-Reg(G),47387,Baroda BNP Paribas Mutual Fund,0.33,1.26,2.52,7.02,NIFTY SDL December 2026 Index,7.31,,,0.41,29,43,33,32,44,27,,,Baroda BNP Paribas NIFTY SDL Dec 2026 Index Fund-Reg(G),Debt : Medium to Long Duration,60,60,60,60,59,42,11,11,0.3,0.38,1.13,2.16,6.96,7.27,5.38,6.31,,,,,,,,
Mirae Asset Dynamic Bond Fund-Reg(G),36556,Mirae Asset Mutual Fund,0.31,1.12,2.26,6.65,CRISIL Dynamic Bond Index,6.6,4.94,,0.37,2,13,2,3,3,14,17,,Mirae Asset Dynamic Bond Fund-Reg(G),Debt : Dynamic Bond,22,22,22,22,22,22,21,19,-0.12,0.29,0.54,0.93,4.98,6.63,5.62,6.82,,,,,,,,
Motilal Oswal BSE Low Volatility Index Fund-Reg(G),46438,Motilal Oswal Mutual Fund,-3.02,-0.37,2.27,4.87,BSE Low Volatility Index - TRI,14.68,,,-1.82,143,149,100,140,115,52,,,Motilal Oswal BSE Low Volatility Index Fund-Reg(G),Equity : Index Funds,227,228,219,210,179,86,34,18,-1.69,-2.69,-1.24,2.6,6.66,17.67,13.36,13.56,,,,,,,,
Capitalmind Liquid Fund-Reg(G),50478,Capitalmind Mutual Fund,0.47,,,,Nifty Liquid Fund Index,,,,0.57,31,27,,,,,,,Capitalmind Liquid Fund-Reg(G),Debt : Liquid,44,44,42,40,38,36,34,29,0.57,0.48,1.43,2.86,6.26,6.82,5.77,6.01,,,,,,,,
ICICI Pru Nifty200 Value 30 Index Fund-Reg(G),49113,ICICI Prudential Mutual Fund,3.08,9.07,21.85,30.33,Nifty200 Value 30 - TRI,,,,5.55,1,1,1,2,3,,,,ICICI Pru Nifty200 Value 30 Index Fund-Reg(G),Equity : Index Funds,227,228,219,210,179,86,34,18,-1.69,-2.69,-1.24,2.6,6.66,17.67,13.36,13.56,,,,,,,,
Mirae Asset Nifty India Manufacturing ETF FoF-Reg(G),46053,Mirae Asset Mutual Fund,-1.71,0.97,8.03,14.33,Nifty India Manufacturing - TRI,22.67,,,-0.1,55,68,48,23,20,6,,,Mirae Asset Nifty India Manufacturing ETF FoF-Reg(G),FoFs : Domestic,92,92,87,79,61,51,32,23,1.54,0.18,9.05,17.8,25.95,16.98,12.12,10.94,,,,,,,,
