LIC MF Multi Asset Allocation Fund-Reg(G),49465,LIC Mutual Fund,1.36,8.81,9.77,,NIFTY 500 - TRI,,,,,,24,10,15,,,,,LIC MF Multi Asset Allocation Fund-Reg(G),Hybrid : Multi Asset Allocation,27,33,32,29,25,9,9,7,14.35,1.7,7.63,8.95,13.67,17.27,17.69,13.21,,,,,,,,
Mahindra Manulife Manufacturing Fund-Reg(G),48881,Mahindra Manulife Mutual Fund,-0.32,4.45,4.01,3.45,BSE India Manufacturing Index - TRI,,,,5.8,35,61,67,67,47,,,,Mahindra Manulife Manufacturing Fund-Reg(G),Equity : Thematic,88,110,107,99,80,39,23,9,3.21,-0.12,4.96,5.16,3.32,17.86,21.22,14.57,,,,,,,,
Union Low Duration Fund-Reg(G),49982,Union Mutual Fund,0.49,1.45,,,NIFTY Low Duration Debt Index,,,,,,22,24,,,,,,Union Low Duration Fund-Reg(G),Debt : Low Duration,20,26,25,23,20,20,20,19,6.83,0.53,1.55,3.09,7.44,7.2,5.82,6.43,,,,,,,,
SBI Floating Rate Debt Fund-Reg(G),45111,SBI Mutual Fund,0.52,1.23,2.5,7.08,Nifty Short Duration Debt Index,7.65,6.23,,6.63,12,8,12,10,12,9,4,,SBI Floating Rate Debt Fund-Reg(G),Debt : Floater,12,12,12,12,12,12,8,5,7.29,0.6,1.81,2.73,7.89,7.75,6.19,7.06,,,,,,,,
Axis Nifty 50 Index Fund-Reg(G),45701,Axis Mutual Fund,1.26,7.31,6.42,9.42,NIFTY 50 - TRI,12.54,,,11.59,37,71,54,57,46,68,,,Axis Nifty 50 Index Fund-Reg(G),Equity : Index Funds,175,219,215,198,167,83,34,18,5.22,0.54,6.23,4.78,4.35,16.09,16.83,13.09,,,,,,,,
Samco Active Momentum Fund-Reg(G),47753,Samco Mutual Fund,-3.67,-3.46,-4.1,-10.69,NIFTY 500 - TRI,,,,-14.98,86,110,107,98,80,,,,Samco Active Momentum Fund-Reg(G),Equity : Thematic,88,110,107,99,80,39,23,9,3.21,-0.12,4.96,5.16,3.32,17.86,21.22,14.57,,,,,,,,
Quant Manufacturing Fund-Reg(G),48120,Quant Mutual Fund,-2.76,4.73,-0.68,-8.02,Nifty India Manufacturing - TRI,,,,-5.99,81,105,60,97,77,,,,Quant Manufacturing Fund-Reg(G),Equity : Thematic,88,110,107,99,80,39,23,9,3.21,-0.12,4.96,5.16,3.32,17.86,21.22,14.57,,,,,,,,
DSP Nifty Top 10 Equal Weight ETF,49012,DSP Mutual Fund,1.49,8.12,3.93,7.8,Nifty Top 10 Equal Weight - TRI,,,,8.91,95,68,52,151,104,,,,DSP Nifty Top 10 Equal Weight ETF,Equity : ETFs,170,214,205,191,168,122,72,33,9.0,0.95,7.36,7.03,7.92,16.94,18.01,13.8,,,,,,,,
PGIM India ELSS Tax Saver Fund-Reg(G),26780,PGIM India Mutual Fund,0.17,3.7,4.31,5.32,NIFTY 500 - TRI,12.19,17.58,,3.76,34,27,45,36,23,50,37,,PGIM India ELSS Tax Saver Fund-Reg(G),Equity : Tax Saving (ELSS),56,57,57,57,56,52,51,29,4.28,-0.01,4.87,4.88,4.07,16.65,19.66,14.01,,,,,,,,
HSBC Medium Duration Fund-Reg(G),31014,HSBC Mutual Fund,0.5,1.8,2.27,8.34,NIFTY Medium Duration Debt Index,7.72,6.16,6.84,7.51,7,15,8,21,7,6,6,7,HSBC Medium Duration Fund-Reg(G),Debt : Medium Duration,26,26,26,26,26,19,12,12,7.16,0.54,1.75,2.68,7.85,7.46,6.62,6.7,,,,,,,,
Tata Nifty SDL Plus AAA PSU Bond Dec 2027 60:40 Index Fund-Reg(G),46351,Tata Mutual Fund,0.52,1.66,2.63,8.25,Nifty SDL Plus AAA PSU Bond Dec 2027 60: 40 Index - TRI,7.62,,,7.67,19,24,40,26,22,15,,,Tata Nifty SDL Plus AAA PSU Bond Dec 2027 60:40 Index Fund-Reg(G),Debt : Medium to Long Duration,59,60,60,60,59,36,11,11,7.12,0.47,1.78,2.14,7.78,7.42,5.24,6.26,,,,,,,,
Mirae Asset S&P 500 Top 50 ETF FoF-Reg(G),45836,Mirae Asset Mutual Fund,1.54,9.21,29.54,34.75,S&P 500 Top 50 TRI,37.77,,,19.81,36,12,21,6,15,4,,,Mirae Asset S&P 500 Top 50 ETF FoF-Reg(G),FoFs : Overseas,56,56,56,56,56,53,27,23,27.59,0.05,7.93,20.79,27.7,22.16,11.19,10.41,,,,,,,,
Axis Retirement Fund-Aggressive Plan-Reg(G),43841,Axis Mutual Fund,-0.16,4.89,2.06,3.97,CRISIL Hybrid 25+75 - Aggressive Index,13.72,11.48,,4.67,29,35,14,31,31,15,20,,Axis Retirement Fund-Aggressive Plan-Reg(G),Hybrid : Solution Oriented,43,43,43,43,42,38,33,15,5.31,0.32,4.01,3.84,5.32,12.71,13.12,10.61,,,,,,,,
LIC MF BSE Sensex ETF,33579,LIC Mutual Fund,1.31,7.16,6.25,9.6,BSE SENSEX - TRI,12.34,15.41,,10.8,75,81,81,109,81,99,60,,LIC MF BSE Sensex ETF,Equity : ETFs,170,214,205,191,168,122,72,33,9.0,0.95,7.36,7.03,7.92,16.94,18.01,13.8,,,,,,,,
Franklin India NSE Nifty 50 Index Fund(G),942,Franklin Templeton Mutual Fund,1.01,6.95,6.43,10.25,NIFTY 50,12.7,15.57,12.87,11.44,43,105,86,55,37,65,23,14,Franklin India NSE Nifty 50 Index Fund(G),Equity : Index Funds,175,219,215,198,167,83,34,18,5.22,0.54,6.23,4.78,4.35,16.09,16.83,13.09,1.76,6.3,5.76,8.47,11.63,14.82,14.61,11.2
HDFC Dynamic Debt Fund(G),1274,HDFC Mutual Fund,-0.25,1.53,-0.92,4.87,NIFTY Composite Debt Index,6.6,5.82,6.14,4.1,15,19,13,16,16,17,6,17,HDFC Dynamic Debt Fund(G),Debt : Dynamic Bond,22,22,22,22,22,22,21,19,5.32,0.16,1.62,0.11,6.06,6.95,5.48,6.83,,,,,,,,
Baroda BNP Paribas Business Conglomerates Fund-Reg(G),50243,Baroda BNP Paribas Mutual Fund,0.9,,,,Nifty Conglomerate 50 - TRI,,,,,,31,,,,,,,Baroda BNP Paribas Business Conglomerates Fund-Reg(G),Equity : Thematic,88,110,107,99,80,39,23,9,3.21,-0.12,4.96,5.16,3.32,17.86,21.22,14.57,,,,,,,,
Motilal Oswal Nifty 500 Momentum 50 Index Fund-Reg(G),48961,Motilal Oswal Mutual Fund,1.75,8.35,5.01,-7.98,Nifty500 Momentum 50 - TRI,,,,-5.25,150,28,33,113,155,,,,Motilal Oswal Nifty 500 Momentum 50 Index Fund-Reg(G),Equity : Index Funds,175,219,215,198,167,83,34,18,5.22,0.54,6.23,4.78,4.35,16.09,16.83,13.09,,,,,,,,
Sundaram Corp Bond Fund(G),2955,Sundaram Mutual Fund,0.51,1.86,2.45,8.16,NIFTY Corporate Bond Index,7.44,5.8,7.27,7.42,12,17,12,8,12,15,9,5,Sundaram Corp Bond Fund(G),Debt : Corporate Bond,21,21,21,21,21,20,18,12,7.47,0.56,1.87,2.41,8.17,7.58,5.85,7.09,,,,,,,,
LIC MF Nifty 100 ETF,33578,LIC Mutual Fund,0.85,6.69,6.14,8.64,NIFTY 100 - TRI,13.5,16.3,,10.09,88,133,114,118,90,72,42,,LIC MF Nifty 100 ETF,Equity : ETFs,170,214,205,191,168,122,72,33,9.0,0.95,7.36,7.03,7.92,16.94,18.01,13.8,,,,,,,,
LIC MF Balanced Advantage Fund-Reg(G),45941,LIC Mutual Fund,-0.41,2.79,0.18,4.26,NIFTY 50,9.37,,,3.71,45,52,37,54,46,44,,,LIC MF Balanced Advantage Fund-Reg(G),Hybrid : Equity Oriented,53,56,56,54,53,52,49,33,5.87,0.34,3.53,4.08,6.08,12.09,12.93,10.38,1.76,6.3,5.76,8.47,11.63,14.82,14.61,11.2
Aditya Birla SL Nifty India Defence Index Fund-Reg(G),49044,Aditya Birla Sun Life Mutual Fund,-0.97,8.0,-8.61,18.29,Nifty India Defence - TRI,,,,22.41,4,188,38,197,6,,,,Aditya Birla SL Nifty India Defence Index Fund-Reg(G),Equity : Index Funds,175,219,215,198,167,83,34,18,5.22,0.54,6.23,4.78,4.35,16.09,16.83,13.09,,,,,,,,
Mahindra Manulife Multi Asset Allocation Fund-Reg(G),48449,Mahindra Manulife Mutual Fund,1.72,10.05,12.29,18.53,NIFTY 500 - TRI,,,,19.31,3,15,5,3,2,,,,Mahindra Manulife Multi Asset Allocation Fund-Reg(G),Hybrid : Multi Asset Allocation,27,33,32,29,25,9,9,7,14.35,1.7,7.63,8.95,13.67,17.27,17.69,13.21,,,,,,,,
HSBC Financial Services Fund-Reg(G),49575,HSBC Mutual Fund,1.09,9.81,7.73,,BSE Financial Services - TRI,,,,,,19,14,10,,,,,HSBC Financial Services Fund-Reg(G),Equity : Sectoral - Financial Services,21,23,23,22,21,14,11,10,16.64,1.61,9.82,7.89,15.04,16.29,17.14,14.0,,,,,,,,
JM Small Cap Fund-Reg(G),48452,JM Financial Mutual Fund,-1.82,4.89,2.98,-2.92,Nifty Smallcap 250 - TRI,,,,-4.39,22,16,4,17,18,,,,JM Small Cap Fund-Reg(G),Equity : Small Cap,29,31,31,30,29,23,21,13,-2.97,-1.8,2.52,3.17,-2.44,19.01,24.91,16.73,,,,,,,,
HSBC Equity Savings Fund-Reg(G),15304,HSBC Mutual Fund,-0.1,2.44,6.82,4.7,NIFTY 50 Equity Savings Index,13.64,12.45,9.08,1.47,49,44,45,5,41,16,23,25,HSBC Equity Savings Fund-Reg(G),Hybrid : Equity Oriented,53,56,56,54,53,52,49,33,5.87,0.34,3.53,4.08,6.08,12.09,12.93,10.38,,,,,,,,
Invesco India Manufacturing Fund-Reg(G),47579,Invesco Mutual Fund,-1.17,-0.1,1.3,-0.88,Nifty India Manufacturing - TRI,,,,-4.71,77,85,106,87,64,,,,Invesco India Manufacturing Fund-Reg(G),Equity : Thematic,88,110,107,99,80,39,23,9,3.21,-0.12,4.96,5.16,3.32,17.86,21.22,14.57,,,,,,,,
Baroda BNP Paribas Energy Opportunities Fund-Reg(G),49558,Baroda BNP Paribas Mutual Fund,0.27,4.41,1.39,,NIFTY ENERGY - TRI,,,,,,2,5,5,,,,,Baroda BNP Paribas Energy Opportunities Fund-Reg(G),Equity : Sectoral - Energy / Power,5,7,7,7,5,3,3,2,6.5,-1.22,4.97,2.48,4.33,20.25,23.87,17.58,,,,,,,,
UTI Equity Savings Fund-Reg(G),35818,UTI Mutual Fund,1.0,4.12,3.95,7.92,Crisil Equity Savings Index,10.6,11.19,,7.62,11,5,18,29,9,37,32,,UTI Equity Savings Fund-Reg(G),Hybrid : Equity Oriented,53,56,56,54,53,52,49,33,5.87,0.34,3.53,4.08,6.08,12.09,12.93,10.38,,,,,,,,
LIC MF Nifty Midcap 100 ETF,48473,LIC Mutual Fund,2.22,8.95,7.1,8.8,NIFTY 50 - TRI,,,,7.11,106,42,43,70,88,,,,LIC MF Nifty Midcap 100 ETF,Equity : ETFs,170,214,205,191,168,122,72,33,9.0,0.95,7.36,7.03,7.92,16.94,18.01,13.8,,,,,,,,
HDFC Nifty G-Sec Jun 2027 Index Fund-Reg(G),46618,HDFC Mutual Fund,0.57,1.69,2.84,8.08,Nifty G-Sec Jun 2027 Index,,,,7.42,6,5,14,1,6,,,,HDFC Nifty G-Sec Jun 2027 Index Fund-Reg(G),Debt : Gilt,36,39,39,38,36,30,21,21,4.82,-0.05,1.46,-0.56,5.61,6.82,4.85,6.89,,,,,,,,
Tata Nifty 50 ETF,41017,Tata Mutual Fund,1.06,7.1,6.73,10.84,NIFTY 50 - TRI,13.34,16.35,,12.1,51,116,89,84,59,82,38,,Tata Nifty 50 ETF,Equity : ETFs,170,214,205,191,168,122,72,33,9.0,0.95,7.36,7.03,7.92,16.94,18.01,13.8,,,,,,,,
Kotak Nifty Alpha 50 ETF,45687,Kotak Mahindra Mutual Fund,1.84,5.28,2.91,-7.32,Nifty Alpha 50 - TRI,18.94,,,-7.36,158,46,148,163,154,33,,,Kotak Nifty Alpha 50 ETF,Equity : ETFs,170,214,205,191,168,122,72,33,9.0,0.95,7.36,7.03,7.92,16.94,18.01,13.8,,,,,,,,
Mahindra Manulife Large Cap Fund-Reg(G),38073,Mahindra Manulife Mutual Fund,1.12,5.26,4.55,7.2,NIFTY 100 - TRI,13.5,16.39,,9.0,13,9,30,30,18,23,16,,Mahindra Manulife Large Cap Fund-Reg(G),Equity : Large Cap,38,39,39,39,38,35,32,28,7.27,0.57,5.63,5.36,6.37,14.46,16.38,13.01,,,,,,,,
WOC Arbitrage Fund-Reg(G),48900,WhiteOak Capital Mutual Fund,0.51,1.39,2.92,6.69,Nifty 50 Arbitrage - TRI,,,,6.03,1,19,6,7,1,,,,WOC Arbitrage Fund-Reg(G),Hybrid : Arbitrage,30,33,32,31,28,24,24,14,5.64,0.51,1.35,2.8,6.31,6.89,5.53,5.69,,,,,,,,
UTI India Consumer Fund-Reg(G),3581,UTI Mutual Fund,-0.88,2.41,7.24,3.54,Nifty India Consumption - TRI,14.62,15.89,11.96,4.55,6,4,7,6,6,11,12,8,UTI India Consumer Fund-Reg(G),Equity : Thematic - Consumption,20,24,22,22,18,13,13,9,1.96,-1.38,1.53,5.2,1.74,15.46,18.14,14.07,,,,,,,,
Nippon India Income Plus Arbitrage Active FoF-Reg(G),49936,Nippon India Mutual Fund,0.56,1.73,,,CRISIL Short Term Bond Index,,,,,,47,64,,,,,,Nippon India Income Plus Arbitrage Active FoF-Reg(G),FoFs : Domestic,60,87,81,72,60,50,31,23,18.18,2.64,8.7,12.84,17.0,15.61,13.73,10.63,,,,,,,,
DSP Nifty Bank ETF,46468,DSP Mutual Fund,2.63,10.97,8.42,15.84,NIFTY BANK - TRI,,,,18.25,24,32,24,42,24,,,,DSP Nifty Bank ETF,Equity : ETFs,170,214,205,191,168,122,72,33,9.0,0.95,7.36,7.03,7.92,16.94,18.01,13.8,,,,,,,,
ICICI Pru BSE Liquid Rate ETF(G),49518,ICICI Prudential Mutual Fund,0.43,1.31,2.6,,BSE Liquid Rate Index,,,,,,14,18,7,,,,,ICICI Pru BSE Liquid Rate ETF(G),Debt : ETFs,30,33,32,32,30,13,8,2,6.58,0.51,1.65,2.37,7.34,7.52,5.44,5.9,,,,,,,,
Nippon India US Equity Opp Fund(G),19246,Nippon India Mutual Fund,-1.04,3.22,10.88,9.81,S&P 500 - TRI,20.47,12.37,14.09,10.15,8,7,7,7,8,4,3,2,Nippon India US Equity Opp Fund(G),Equity : International,8,8,8,8,8,8,6,5,23.3,0.49,7.6,21.83,25.07,21.89,10.76,10.91,,,,,,,,
Kotak Credit Risk Fund(G),8472,Kotak Mahindra Mutual Fund,0.51,2.55,3.94,9.09,CRISIL Credit Risk Debt Index,7.6,5.82,6.79,8.83,6,12,3,3,7,11,13,9,Kotak Credit Risk Fund(G),Debt : Credit Risk,15,15,15,15,15,15,15,13,9.69,0.57,2.0,3.13,10.3,8.6,8.79,6.44,,,,,,,,
360 ONE Liquid Fund-Reg(G),15687,360 ONE Mutual Fund,0.48,1.42,2.84,6.41,CRISIL Liquid Debt Index,6.81,5.55,5.77,5.8,31,33,31,32,31,29,29,26,360 ONE Liquid Fund-Reg(G),Debt : Liquid,38,42,41,38,38,35,34,29,5.89,0.48,1.42,2.89,6.49,6.89,5.66,6.05,,,,,,,,
Edelweiss Technology Fund-Reg(G),43844,Edelweiss Mutual Fund,-0.12,6.28,10.81,2.46,BSE TECk Index - TRI,,,,0.93,3,11,2,1,4,,,,Edelweiss Technology Fund-Reg(G),Equity : Sectoral - Technology,12,12,12,12,12,5,5,4,-4.1,0.73,4.58,5.1,-2.23,15.57,18.62,17.21,,,,,,,,
TRUSTMF Liquid Fund-Reg(G),45451,Trust Mutual Fund,0.48,1.42,2.88,6.46,CRISIL Liquid Debt Index,6.85,,,5.87,30,28,29,28,29,27,,,TRUSTMF Liquid Fund-Reg(G),Debt : Liquid,38,42,41,38,38,35,34,29,5.89,0.48,1.42,2.89,6.49,6.89,5.66,6.05,,,,,,,,
Axis Silver ETF,46369,Axis Mutual Fund,11.74,38.44,66.34,80.63,Silver,35.59,,,100.33,4,14,15,2,11,6,,,Axis Silver ETF,Gold : ETFs,31,38,37,35,31,17,11,11,77.55,10.0,30.15,44.9,71.32,33.37,20.02,16.23,,,,,,,,
Mirae Asset Nifty Smallcap 250 Momentum Quality 100 ETF,48496,Mirae Asset Mutual Fund,-2.84,1.37,-1.76,-11.84,Nifty Smallcap250 Momentum Quality 100 - TRI,,,,-10.61,159,202,196,187,167,,,,Mirae Asset Nifty Smallcap 250 Momentum Quality 100 ETF,Equity : ETFs,170,214,205,191,168,122,72,33,9.0,0.95,7.36,7.03,7.92,16.94,18.01,13.8,,,,,,,,
Motilal Oswal Nifty Midcap 100 ETF,13595,Motilal Oswal Mutual Fund,2.23,9.01,7.17,8.92,Nifty Midcap 100 - TRI,24.87,25.99,16.86,7.22,105,41,42,67,86,12,5,2,Motilal Oswal Nifty Midcap 100 ETF,Equity : ETFs,170,214,205,191,168,122,72,33,9.0,0.95,7.36,7.03,7.92,16.94,18.01,13.8,,,,,,,,
Baroda BNP Paribas Focused Fund-Reg(G),32452,Baroda BNP Paribas Mutual Fund,2.12,7.31,4.65,2.65,NIFTY 500 - TRI,14.15,15.39,,3.55,27,1,4,29,35,30,25,,Baroda BNP Paribas Focused Fund-Reg(G),Equity : Flexi Cap,48,51,50,48,48,39,29,21,4.09,0.1,4.98,5.21,4.11,16.03,18.06,14.12,,,,,,,,
Invesco India - Invesco Global Consumer Trends FoF-Reg(G),45201,Invesco Mutual Fund,-12.63,0.53,20.25,28.87,MSCI World Consumer Discretionary Index - Net Dividend,25.3,,,26.66,20,56,54,30,24,16,,,Invesco India - Invesco Global Consumer Trends FoF-Reg(G),FoFs : Overseas,56,56,56,56,56,53,27,23,27.59,0.05,7.93,20.79,27.7,22.16,11.19,10.41,,,,,,,,
DSP FMP 267-1246D-Reg(G),47071,DSP Mutual Fund,0.47,1.4,2.77,7.12,CRISIL Medium Duration Debt Index,7.28,,,6.49,52,49,58,45,43,32,,,DSP FMP 267-1246D-Reg(G),Debt : FTP/FMP,79,79,79,79,79,49,10,4,6.73,0.49,1.57,2.74,7.36,7.48,6.19,6.09,,,,,,,,
HDFC NIFTY200 Momentum 30 Index Fund-Reg(G),48466,HDFC Mutual Fund,1.44,7.81,5.87,-5.84,Nifty200 Momentum 30 - TRI,,,,-2.46,141,55,45,90,149,,,,HDFC NIFTY200 Momentum 30 Index Fund-Reg(G),Equity : Index Funds,175,219,215,198,167,83,34,18,5.22,0.54,6.23,4.78,4.35,16.09,16.83,13.09,,,,,,,,
SBI FMP-66-1361D-Reg(G),46633,SBI Mutual Fund,0.47,1.42,2.8,6.92,CRISIL Medium Duration Debt Index,7.24,,,6.45,58,40,48,39,63,34,,,SBI FMP-66-1361D-Reg(G),Debt : FTP/FMP,79,79,79,79,79,49,10,4,6.73,0.49,1.57,2.74,7.36,7.48,6.19,6.09,,,,,,,,
LIC MF Dividend Yield Fund-Reg(G),41332,LIC Mutual Fund,-0.47,5.53,3.29,3.04,NIFTY 500 - TRI,20.7,20.03,,3.62,7,8,6,9,5,2,5,,LIC MF Dividend Yield Fund-Reg(G),Equity : Thematic - Dividend Yield,10,10,10,10,10,8,6,5,4.89,0.34,5.74,4.68,3.34,18.7,21.3,14.72,,,,,,,,
Mirae Asset Short Duration Fund-Reg(G),38870,Mirae Asset Mutual Fund,0.53,1.73,2.43,7.98,CRISIL Short Duration Debt Index,7.2,5.5,,7.25,14,18,17,25,12,16,14,,Mirae Asset Short Duration Fund-Reg(G),Debt : Short Duration,28,33,33,32,27,23,20,18,7.25,0.54,1.72,2.71,7.91,7.33,5.92,6.67,,,,,,,,
Bank of India Mid Cap Fund-Reg(G),50004,Bank of India Mutual Fund,-0.99,1.52,,,Nifty Midcap 150 - TRI,,,,,,27,30,,,,,,Bank of India Mid Cap Fund-Reg(G),Equity : Mid Cap,30,32,32,31,30,28,24,20,2.98,0.26,4.82,6.46,4.54,21.34,22.91,16.24,,,,,,,,
HSBC Income Plus Arbitrage Active FOF-Reg(G),28311,HSBC Mutual Fund,0.43,1.59,2.3,5.7,Nifty Short Duration Debt Index,7.27,5.79,6.38,5.13,52,65,74,64,49,49,30,23,HSBC Income Plus Arbitrage Active FOF-Reg(G),FoFs : Domestic,60,87,81,72,60,50,31,23,18.18,2.64,8.7,12.84,17.0,15.61,13.73,10.63,,,,,,,,
Kotak MSCI India ETF,48891,Kotak Mahindra Mutual Fund,1.11,6.8,6.16,,MSCI India,,,,,,97,108,116,,,,,Kotak MSCI India ETF,Equity : ETFs,170,214,205,191,168,122,72,33,9.0,0.95,7.36,7.03,7.92,16.94,18.01,13.8,,,,,,,,
Franklin India Equity Savings Fund(G),39645,Franklin Templeton Mutual Fund,0.35,2.17,3.25,6.05,NIFTY 50 Equity Savings Index,7.88,8.86,,5.72,34,31,48,39,29,50,43,,Franklin India Equity Savings Fund(G),Hybrid : Equity Oriented,53,56,56,54,53,52,49,33,5.87,0.34,3.53,4.08,6.08,12.09,12.93,10.38,,,,,,,,
HDFC Nifty G-Sec Jul 2031 Index Fund-Reg(G),46620,HDFC Mutual Fund,0.27,2.01,1.0,8.62,Nifty G-Sec July 2031 Index,8.32,,,7.78,2,16,8,10,2,2,,,HDFC Nifty G-Sec Jul 2031 Index Fund-Reg(G),Debt : Gilt,36,39,39,38,36,30,21,21,4.82,-0.05,1.46,-0.56,5.61,6.82,4.85,6.89,,,,,,,,
Quant BFSI Fund-Reg(G),47989,Quant Mutual Fund,1.47,11.19,16.24,22.52,Nifty Financial Services - TRI,,,,21.62,1,11,4,1,1,,,,Quant BFSI Fund-Reg(G),Equity : Sectoral - Financial Services,21,23,23,22,21,14,11,10,16.64,1.61,9.82,7.89,15.04,16.29,17.14,14.0,,,,,,,,
SBI BSE PSU Bank ETF,49725,SBI Mutual Fund,5.78,26.44,21.9,,BSE PSU Bank - TRI,,,,,,1,1,11,,,,,SBI BSE PSU Bank ETF,Equity : ETFs,170,214,205,191,168,122,72,33,9.0,0.95,7.36,7.03,7.92,16.94,18.01,13.8,,,,,,,,
Motilal Oswal Gold ETF,50010,Motilal Oswal Mutual Fund,6.92,23.96,,,Gold-India,,,,,,33,29,,,,,,Motilal Oswal Gold ETF,Gold : ETFs,31,38,37,35,31,17,11,11,77.55,10.0,30.15,44.9,71.32,33.37,20.02,16.23,,,,,,,,
Edelweiss Gold ETF,17716,Edelweiss Mutual Fund,6.97,23.99,30.77,62.9,Gold-India,,,,66.27,23,28,28,28,27,,,,Edelweiss Gold ETF,Gold : ETFs,31,38,37,35,31,17,11,11,77.55,10.0,30.15,44.9,71.32,33.37,20.02,16.23,,,,,,,,
Union Aggressive Hybrid Fund-Reg(G),44512,Union Mutual Fund,0.0,4.1,4.45,6.68,CRISIL Hybrid 35+65 - Aggressive Index,12.73,,,6.18,25,42,19,21,21,20,,,Union Aggressive Hybrid Fund-Reg(G),Hybrid : Equity Oriented,53,56,56,54,53,52,49,33,5.87,0.34,3.53,4.08,6.08,12.09,12.93,10.38,,,,,,,,
Bajaj Finserv Consumption Fund-Reg(G),49345,Bajaj Finserv Mutual Fund,-2.9,0.47,2.56,,Nifty India Consumption - TRI,,,,-3.79,18,23,17,19,,,,,Bajaj Finserv Consumption Fund-Reg(G),Equity : Thematic - Consumption,20,24,22,22,18,13,13,9,1.96,-1.38,1.53,5.2,1.74,15.46,18.14,14.07,,,,,,,,
ICICI Pru Nifty FMCG ETF,45651,ICICI Prudential Mutual Fund,-0.72,0.14,0.39,-1.96,NIFTY FMCG - TRI,9.53,,,-0.59,143,188,203,183,145,114,,,ICICI Pru Nifty FMCG ETF,Equity : ETFs,170,214,205,191,168,122,72,33,9.0,0.95,7.36,7.03,7.92,16.94,18.01,13.8,,,,,,,,
Bank of India Mfg & Infra Fund-Reg(G),8484,Bank of India Mutual Fund,0.07,6.45,7.89,4.29,BSE India Infrastructure Index - TRI,24.22,26.28,17.25,6.67,1,2,1,2,4,7,12,4,Bank of India Mfg & Infra Fund-Reg(G),Equity : Sectoral - Infrastructure,20,21,21,21,19,19,19,18,0.16,-1.29,3.78,2.38,-0.48,22.04,26.89,15.69,,,,,,,,
Bandhan Transportation and Logistics Fund-Reg(G),46986,Bandhan Mutual Fund,2.12,7.54,17.96,16.02,Nifty Transportation & Logistics - TRI,24.82,,,19.75,5,4,5,5,6,3,,,Bandhan Transportation and Logistics Fund-Reg(G),Equity : Sectoral - Auto,10,10,10,10,8,4,1,1,19.76,1.26,7.96,17.57,17.0,26.33,24.09,12.81,,,,,,,,
UTI Nifty200 Quality 30 Index Fund-Reg(G),49144,UTI Mutual Fund,1.22,4.96,3.91,1.31,NIFTY200 Quality 30 - TRI,,,,3.37,107,77,151,132,107,,,,UTI Nifty200 Quality 30 Index Fund-Reg(G),Equity : Index Funds,175,219,215,198,167,83,34,18,5.22,0.54,6.23,4.78,4.35,16.09,16.83,13.09,,,,,,,,
ICICI Pru Nifty Bank Index Fund-Reg(G),45994,ICICI Prudential Mutual Fund,2.58,10.79,8.07,15.08,NIFTY BANK - TRI,11.49,,,17.4,10,16,12,18,8,79,,,ICICI Pru Nifty Bank Index Fund-Reg(G),Equity : Index Funds,175,219,215,198,167,83,34,18,5.22,0.54,6.23,4.78,4.35,16.09,16.83,13.09,,,,,,,,
HDFC Nifty G-Sec Sep 2032 Index Fund-Reg(G),46872,HDFC Mutual Fund,0.39,1.97,0.73,8.47,Nifty G-Sec Sep 2032 Index,,,,7.65,3,15,10,12,3,,,,HDFC Nifty G-Sec Sep 2032 Index Fund-Reg(G),Debt : Gilt,36,39,39,38,36,30,21,21,4.82,-0.05,1.46,-0.56,5.61,6.82,4.85,6.89,,,,,,,,
Kotak CRISIL-IBX Financial Services 9 to 12 Months Debt Index Fund-Reg(G),50232,Kotak Mahindra Mutual Fund,0.53,,,,CRISIL-IBX Financial Services 9-12 Months Debt Index,,,,,,12,,,,,,,Kotak CRISIL-IBX Financial Services 9 to 12 Months Debt Index Fund-Reg(G),Debt : Low Duration,20,26,25,23,20,20,20,19,6.83,0.53,1.55,3.09,7.44,7.2,5.82,6.43,,,,,,,,
LIC MF Small Cap Fund(G),36914,LIC Mutual Fund,-2.72,0.91,-0.05,-10.92,Nifty Smallcap 250 - TRI,16.1,24.13,,-13.08,29,28,27,27,28,18,13,,LIC MF Small Cap Fund(G),Equity : Small Cap,29,31,31,30,29,23,21,13,-2.97,-1.8,2.52,3.17,-2.44,19.01,24.91,16.73,,,,,,,,
Motilal Oswal Nifty Bank Index Fund-Reg(G),43789,Motilal Oswal Mutual Fund,2.56,10.74,7.97,14.93,NIFTY BANK - TRI,11.4,14.63,,17.23,13,20,16,21,11,80,32,,Motilal Oswal Nifty Bank Index Fund-Reg(G),Equity : Index Funds,175,219,215,198,167,83,34,18,5.22,0.54,6.23,4.78,4.35,16.09,16.83,13.09,,,,,,,,
WOC Quality Equity Fund-Reg(G),49192,WhiteOak Capital Mutual Fund,1.11,3.45,4.16,,BSE Quality Index - TRI,,,,,,25,81,66,,,,,WOC Quality Equity Fund-Reg(G),Equity : Thematic,88,110,107,99,80,39,23,9,3.21,-0.12,4.96,5.16,3.32,17.86,21.22,14.57,,,,,,,,
Bajaj Finserv Nifty 1D Rate Liquid ETF(G),48746,Bajaj Finserv Mutual Fund,0.41,1.25,2.54,5.57,Nifty 1D Rate Index,,,,5.02,25,23,29,15,24,,,,Bajaj Finserv Nifty 1D Rate Liquid ETF(G),Debt : ETFs,30,33,32,32,30,13,8,2,6.58,0.51,1.65,2.37,7.34,7.52,5.44,5.9,0.45,1.36,2.73,5.95,6.46,5.42,,5.84
Navi Nifty Bank Index Fund-Reg(G),45873,Navi Mutual Fund,2.56,10.76,7.97,14.93,NIFTY BANK - TRI,11.36,,,17.25,12,18,15,22,12,81,,,Navi Nifty Bank Index Fund-Reg(G),Equity : Index Funds,175,219,215,198,167,83,34,18,5.22,0.54,6.23,4.78,4.35,16.09,16.83,13.09,,,,,,,,
Axis Global Innovation FoF-Reg(G),45539,Axis Mutual Fund,-3.12,4.69,16.97,20.62,MSCI ACWI Net TRI,22.3,,,18.46,41,49,39,35,36,22,,,Axis Global Innovation FoF-Reg(G),FoFs : Overseas,56,56,56,56,56,53,27,23,27.59,0.05,7.93,20.79,27.7,22.16,11.19,10.41,,,,,,,,
Aditya Birla SL Silver ETF FOF-Reg(G),46225,Aditya Birla Sun Life Mutual Fund,19.01,38.35,64.55,82.04,Silver,35.6,,,85.14,4,1,4,3,2,2,,,Aditya Birla SL Silver ETF FOF-Reg(G),FoFs : Domestic,60,87,81,72,60,50,31,23,18.18,2.64,8.7,12.84,17.0,15.61,13.73,10.63,,,,,,,,
360 ONE Dynamic Bond Fund-Reg(G),17578,360 ONE Mutual Fund,0.7,2.7,2.49,9.08,CRISIL Dynamic Bond Index,8.38,6.82,7.06,8.36,1,1,2,3,1,1,2,6,360 ONE Dynamic Bond Fund-Reg(G),Debt : Dynamic Bond,22,22,22,22,22,22,21,19,5.32,0.16,1.62,0.11,6.06,6.95,5.48,6.83,,,,,,,,
Nippon India Nifty Next 50 Junior BeES FoF-Reg(G),40664,Nippon India Mutual Fund,-0.15,4.81,3.79,-1.09,NIFTY NEXT 50,17.47,18.17,,2.19,54,80,40,46,56,14,6,,Nippon India Nifty Next 50 Junior BeES FoF-Reg(G),FoFs : Domestic,60,87,81,72,60,50,31,23,18.18,2.64,8.7,12.84,17.0,15.61,13.73,10.63,-0.87,3.83,3.68,-2.13,16.41,17.62,,1.56
Baroda BNP Paribas Health and Wellness Fund-Reg(G),49985,Baroda BNP Paribas Mutual Fund,-0.62,-0.33,,,BSE Health Care - TRI,,,,,,18,20,,,,,,Baroda BNP Paribas Health and Wellness Fund-Reg(G),Equity : Sectoral - Pharma,18,20,20,18,16,10,9,3,-1.68,0.6,2.52,5.57,3.36,22.11,16.87,12.4,,,,,,,,
Aditya Birla SL ESG Integration Strategy Fund-Reg(G),44736,Aditya Birla Sun Life Mutual Fund,0.71,6.55,6.25,4.69,NIFTY100 ESG - TRI,14.49,,,4.51,42,38,25,36,36,27,,,Aditya Birla SL ESG Integration Strategy Fund-Reg(G),Equity : Thematic,88,110,107,99,80,39,23,9,3.21,-0.12,4.96,5.16,3.32,17.86,21.22,14.57,,,,,,,,
Franklin India Overnight Fund(G),43438,Franklin Templeton Mutual Fund,0.45,1.35,2.71,5.9,Nifty 1D Rate Index,6.34,5.28,,5.33,4,4,4,4,4,12,13,,Franklin India Overnight Fund(G),Debt : Overnight,34,35,35,34,34,30,27,3,5.25,0.44,1.33,2.67,5.82,6.32,5.28,5.45,0.45,1.36,2.73,5.95,6.46,5.42,,5.84
ICICI Pru Nifty 200 Momentum 30 ETF,46682,ICICI Prudential Mutual Fund,1.51,8.0,6.24,-5.34,Nifty200 Momentum 30 - TRI,17.18,,,-1.89,148,63,54,110,153,50,,,ICICI Pru Nifty 200 Momentum 30 ETF,Equity : ETFs,170,214,205,191,168,122,72,33,9.0,0.95,7.36,7.03,7.92,16.94,18.01,13.8,,,,,,,,
Mahindra Manulife Low Duration Fund-Reg(G),36894,Mahindra Manulife Mutual Fund,0.48,1.48,2.98,7.12,CRISIL Low Duration Debt Index,6.96,5.47,,6.52,17,25,20,19,17,17,20,,Mahindra Manulife Low Duration Fund-Reg(G),Debt : Low Duration,20,26,25,23,20,20,20,19,6.83,0.53,1.55,3.09,7.44,7.2,5.82,6.43,,,,,,,,
Kotak Technology Fund-Reg(G),48587,Kotak Mahindra Mutual Fund,1.4,4.16,4.23,-5.54,BSE TECk Index - TRI,,,,-6.22,10,5,10,9,10,,,,Kotak Technology Fund-Reg(G),Equity : Sectoral - Technology,12,12,12,12,12,5,5,4,-4.1,0.73,4.58,5.1,-2.23,15.57,18.62,17.21,,,,,,,,
Bajaj Finserv Overnight Fund-Reg(G),48051,Bajaj Finserv Mutual Fund,0.48,1.38,2.74,5.93,CRISIL Liquid Overnight Index,,,,5.34,3,1,1,2,3,,,,Bajaj Finserv Overnight Fund-Reg(G),Debt : Overnight,34,35,35,34,34,30,27,3,5.25,0.44,1.33,2.67,5.82,6.32,5.28,5.45,,,,,,,,
PGIM India Large Cap Fund(G),758,PGIM India Mutual Fund,0.7,5.13,5.99,8.39,NIFTY 100 - TRI,11.52,13.28,11.15,8.52,17,21,31,19,8,31,30,26,PGIM India Large Cap Fund(G),Equity : Large Cap,38,39,39,39,38,35,32,28,7.27,0.57,5.63,5.36,6.37,14.46,16.38,13.01,,,,,,,,
UTI Gold ETF FoF-Reg(G),47003,UTI Mutual Fund,7.68,23.73,30.56,62.92,Gold-India,31.97,,,62.88,14,17,8,8,5,6,,,UTI Gold ETF FoF-Reg(G),Gold : MFs,17,20,18,18,17,14,10,10,70.73,9.27,25.93,36.35,65.53,32.37,19.19,15.95,,,,,,,,
Tata Gold ETF FoF-Reg(G),48437,Tata Mutual Fund,7.57,22.92,29.23,60.64,Gold-India,,,,60.54,8,13,11,11,8,,,,Tata Gold ETF FoF-Reg(G),FoFs : Domestic,60,87,81,72,60,50,31,23,18.18,2.64,8.7,12.84,17.0,15.61,13.73,10.63,,,,,,,,
Aditya Birla SL CRISIL IBX Gilt Apr 2029 Index Fund-Reg(G),46950,Aditya Birla Sun Life Mutual Fund,0.63,2.29,2.43,9.0,CRISIL IBX Gilt Index - April 2029,8.36,,,8.22,1,2,3,9,1,1,,,Aditya Birla SL CRISIL IBX Gilt Apr 2029 Index Fund-Reg(G),Debt : Gilt,36,39,39,38,36,30,21,21,4.82,-0.05,1.46,-0.56,5.61,6.82,4.85,6.89,,,,,,,,
SBI FMP-67-1467D-Reg(G),46703,SBI Mutual Fund,0.49,1.51,2.84,7.29,CRISIL Medium to Long Term Debt Index,7.39,,,6.77,35,29,35,27,35,26,,,SBI FMP-67-1467D-Reg(G),Debt : FTP/FMP,79,79,79,79,79,49,10,4,6.73,0.49,1.57,2.74,7.36,7.48,6.19,6.09,,,,,,,,
HDFC MNC Fund-Reg(G),47648,HDFC Mutual Fund,-1.06,1.7,5.03,-1.91,NIFTY MNC - TRI,,,,-0.64,5,6,6,4,5,,,,HDFC MNC Fund-Reg(G),Equity : Thematic - MNC,6,7,7,6,6,4,4,3,1.79,-0.03,3.12,5.02,1.26,12.02,13.83,9.91,,,,,,,,
Quant PSU Fund-Reg(G),48341,Quant Mutual Fund,1.14,8.12,-0.53,-3.45,NIFTY PSE - TRI,,,,1.55,58,23,9,95,71,,,,Quant PSU Fund-Reg(G),Equity : Thematic,88,110,107,99,80,39,23,9,3.21,-0.12,4.96,5.16,3.32,17.86,21.22,14.57,,,,,,,,
