Tata Nifty MidSmall Healthcare Index Fund-Reg(G),48764,Tata Mutual Fund,7.41,10.57,9.54,19.76,Nifty MidSmall Healthcare - TRI,,,,1.53,113,1,50,21,1,,,,Tata Nifty MidSmall Healthcare Index Fund-Reg(G),Equity : Index Funds,175,201,193,175,129,68,32,18,2.77,1.26,8.58,6.78,-1.07,18.99,19.99,11.7,,,,,,,,
ICICI Pru Nifty Auto ETF,46229,ICICI Prudential Mutual Fund,2.72,12.19,5.2,-6.01,NIFTY AUTO - TRI,25.06,,,4.99,86,33,42,120,125,13,,,ICICI Pru Nifty Auto ETF,Equity : ETFs,170,195,184,170,155,103,64,29,3.89,1.23,8.34,7.09,1.04,19.42,21.52,12.29,,,,,,,,
Bandhan Long Duration Fund-Reg(G),48582,Bandhan Mutual Fund,1.52,0.26,4.6,7.57,NIFTY Long Duration Debt Index,,,,4.17,20,1,19,20,20,,,,Bandhan Long Duration Fund-Reg(G),Debt : Long Duration,26,26,26,26,24,4,3,2,5.2,0.61,0.81,5.16,9.3,8.49,4.96,7.16,,,,,,,,
Bajaj Finserv Banking and PSU Fund-Reg(G),48214,Bajaj Finserv Mutual Fund,0.4,1.94,5.25,9.22,NIFTY Banking and PSU Debt Index,,,,5.52,3,23,8,4,2,,,,Bajaj Finserv Banking and PSU Fund-Reg(G),Debt : Banking & PSU,26,26,26,26,26,21,16,16,5.17,0.47,1.89,4.89,8.73,7.42,5.86,7.22,,,,,,,,
Kotak Nifty Smallcap 50 Index Fund-Reg(G),46631,Kotak Mahindra Mutual Fund,3.43,15.76,8.55,4.13,Nifty Smallcap 50 - TRI,,,,2.25,107,27,19,25,13,,,,Kotak Nifty Smallcap 50 Index Fund-Reg(G),Equity : Index Funds,175,201,193,175,129,68,32,18,2.77,1.26,8.58,6.78,-1.07,18.99,19.99,11.7,,,,,,,,
UTI Long Duration Fund-Reg(G),47733,UTI Mutual Fund,1.24,-0.48,3.66,6.34,NIFTY Long Duration Debt Index,,,,3.28,26,5,26,26,24,,,,UTI Long Duration Fund-Reg(G),Debt : Long Duration,26,26,26,26,24,4,3,2,5.2,0.61,0.81,5.16,9.3,8.49,4.96,7.16,,,,,,,,
Edelweiss Nifty Next 50 Index Fund-Reg(G),47171,Edelweiss Mutual Fund,2.29,6.11,4.69,-6.95,NIFTY NEXT 50 - TRI,,,,0.13,135,50,117,139,113,,,,Edelweiss Nifty Next 50 Index Fund-Reg(G),Equity : Index Funds,175,201,193,175,129,68,32,18,2.77,1.26,8.58,6.78,-1.07,18.99,19.99,11.7,,,,,,,,
SBI FMP-47-1434D-Reg(G),45660,SBI Mutual Fund,0.47,1.57,3.23,6.91,CRISIL Medium Duration Debt Index,7.13,,,3.12,80,20,72,75,78,32,,,SBI FMP-47-1434D-Reg(G),Debt : FTP/FMP,91,92,92,91,91,49,18,4,4.33,0.44,1.82,4.17,8.01,7.39,5.56,6.15,,,,,,,,
Bank of India Overnight Fund-Reg(G),44437,Bank of India Mutual Fund,0.44,1.4,2.99,6.41,CRISIL Liquid Overnight Index,6.5,5.24,,3.36,1,1,1,1,1,1,1,,Bank of India Overnight Fund-Reg(G),Debt : Overnight,34,34,34,34,34,28,27,3,3.24,0.42,1.35,2.89,6.22,6.35,5.1,5.53,0.43,1.38,2.95,6.34,,,,6.01
Groww Nifty EV & New Age Automotive ETF FOF-Reg(G),48990,Groww Mutual Fund,1.99,12.1,0.72,,Nifty EV and New Age Automotive - TRI,,,,-1.21,56,14,10,61,,,,,Groww Nifty EV & New Age Automotive ETF FOF-Reg(G),FoFs : Domestic,61,76,66,62,58,47,28,23,7.79,1.03,6.92,8.6,7.34,15.95,15.45,10.25,,,,,,,,
Nippon India Nifty G-Sec Oct 2028 Maturity Index Fund-Reg(G),47629,Nippon India Mutual Fund,0.48,2.08,5.49,9.53,Nifty G-Sec Oct 2028 Index,,,,5.91,10,26,33,15,16,,,,Nippon India Nifty G-Sec Oct 2028 Maturity Index Fund-Reg(G),Debt : Medium to Long Duration,59,60,60,59,52,26,11,11,5.43,0.47,1.94,5.12,9.04,7.69,5.48,6.54,,,,,,,,
Bank of India Balanced Advantage Fund-Reg(G),21917,Bank of India Mutual Fund,0.79,4.39,5.85,-1.46,NIFTY 50 Hybrid Composite Debt 50:50 Index,12.32,11.6,7.08,3.93,17,26,17,14,28,17,11,11,Bank of India Balanced Advantage Fund-Reg(G),Hybrid : Dynamic Asset Allocation,33,34,34,33,32,22,19,11,3.21,1.21,4.48,5.12,3.17,13.66,13.0,9.48,,,,,,,,
Edelweiss CRISIL IBX 50:50 Gilt Plus SDL Short Duration Index Fund-Reg(G),47430,Edelweiss Mutual Fund,0.4,1.97,5.0,8.89,CRISIL IBX 50:50 Gilt Plus SDL Short Duration Index,,,,5.36,12,34,24,17,14,,,,Edelweiss CRISIL IBX 50:50 Gilt Plus SDL Short Duration Index Fund-Reg(G),Debt : Short Duration,30,34,34,30,26,23,21,18,11.43,0.71,2.15,4.98,8.8,7.38,6.05,6.81,,,,,,,,
Quantum Small Cap Fund-Reg(G),48248,Quantum Mutual Fund,2.96,13.81,11.15,7.8,BSE 250 Small Cap - TRI,,,,5.93,1,27,14,1,4,,,,Quantum Small Cap Fund-Reg(G),Equity : Small Cap,29,30,30,29,28,23,21,13,-0.08,4.05,13.69,5.69,3.33,25.1,33.16,17.18,,,,,,,,
Axis Silver FoF-Reg(G),46368,Axis Mutual Fund,2.54,17.35,23.13,21.19,Silver,,,,29.29,3,3,3,3,15,,,,Axis Silver FoF-Reg(G),Gold : MFs,17,18,18,17,16,10,10,10,27.75,-0.55,5.51,22.44,27.71,22.92,13.46,12.65,,,,,,,,
Union Gilt Fund-Reg(G),46221,Union Mutual Fund,0.92,0.21,4.42,7.7,CRISIL Dynamic Gilt Index,,,,4.25,27,12,30,28,26,,,,Union Gilt Fund-Reg(G),Debt : Gilt,36,38,37,37,36,23,21,21,4.96,0.72,0.97,4.9,8.57,7.75,5.38,7.35,,,,,,,,
Shriram Flexi Cap Fund-Reg(G),38781,Shriram Mutual Fund,2.34,4.25,-0.24,-12.82,NIFTY 500 - TRI,13.78,15.31,,-7.99,47,8,48,46,47,33,27,,Shriram Flexi Cap Fund-Reg(G),Equity : Flexi Cap,48,49,48,48,48,35,27,21,1.56,1.72,7.48,5.87,0.93,19.41,21.42,13.2,,,,,,,,
Aditya Birla SL Nifty Next 50 ETF,38262,Aditya Birla Sun Life Mutual Fund,2.24,6.33,5.19,-6.04,NIFTY NEXT 50 - TRI,20.66,21.58,,0.64,129,58,101,121,126,30,17,,Aditya Birla SL Nifty Next 50 ETF,Equity : ETFs,170,195,184,170,155,103,64,29,3.89,1.23,8.34,7.09,1.04,19.42,21.52,12.29,,,,,,,,
Mirae Asset Nifty IT ETF,48250,Mirae Asset Mutual Fund,-4.68,12.28,-10.87,-5.24,NIFTY IT - TRI,,,,-13.09,162,185,33,162,115,,,,Mirae Asset Nifty IT ETF,Equity : ETFs,170,195,184,170,155,103,64,29,3.89,1.23,8.34,7.09,1.04,19.42,21.52,12.29,,,,,,,,
ICICI Pru Nifty Healthcare ETF,45383,ICICI Prudential Mutual Fund,4.59,7.19,4.7,11.68,Nifty Healthcare Index - TRI,23.51,,,-1.57,137,8,82,126,10,18,,,ICICI Pru Nifty Healthcare ETF,Equity : ETFs,170,195,184,170,155,103,64,29,3.89,1.23,8.34,7.09,1.04,19.42,21.52,12.29,,,,,,,,
Motilal Oswal Nifty 500 ETF,48267,Motilal Oswal Mutual Fund,1.72,7.75,7.88,1.1,NIFTY 500 - TRI,,,,4.58,91,86,77,74,87,,,,Motilal Oswal Nifty 500 ETF,Equity : ETFs,170,195,184,170,155,103,64,29,3.89,1.23,8.34,7.09,1.04,19.42,21.52,12.29,,,,,,,,
SBI FMP-52-1848D-Reg(G),45915,SBI Mutual Fund,0.43,1.99,4.38,8.31,CRISIL Medium to Long Term Debt Index,7.71,,,4.8,29,54,21,30,28,21,,,SBI FMP-52-1848D-Reg(G),Debt : FTP/FMP,91,92,92,91,91,49,18,4,4.33,0.44,1.82,4.17,8.01,7.39,5.56,6.15,,,,,,,,
Union Equity Savings Fund-Reg(G),40627,Union Mutual Fund,0.9,2.62,4.08,3.63,Crisil Equity Savings Index,9.12,8.65,,2.94,40,38,48,45,43,52,50,,Union Equity Savings Fund-Reg(G),Hybrid : Equity Oriented,55,56,56,55,55,54,51,31,7.94,5.64,9.07,9.75,8.7,14.73,15.16,9.88,,,,,,,,
ICICI Pru Quant Fund(G),42805,ICICI Prudential Mutual Fund,2.04,6.96,7.81,4.63,BSE 200 - TRI,19.78,,,6.67,13,46,66,24,14,23,,,ICICI Pru Quant Fund(G),Equity : Thematic,89,101,98,89,70,38,21,9,1.17,2.11,8.57,4.92,-0.47,21.6,24.24,13.58,,,,,,,,
Kotak Silver ETF FoF-Reg(G),46628,Kotak Mahindra Mutual Fund,2.63,17.75,23.2,21.23,Silver,,,,29.45,2,1,2,2,14,,,,Kotak Silver ETF FoF-Reg(G),Gold : MFs,17,18,18,17,16,10,10,10,27.75,-0.55,5.51,22.44,27.71,22.92,13.46,12.65,,,,,,,,
Shriram Overnight Fund-Reg(G),46777,Shriram Mutual Fund,0.42,1.34,2.84,6.12,CRISIL Liquid Overnight Index,,,,3.19,31,19,28,30,31,,,,Shriram Overnight Fund-Reg(G),Debt : Overnight,34,34,34,34,34,28,27,3,3.24,0.42,1.35,2.89,6.22,6.35,5.1,5.53,0.43,1.38,2.95,6.34,,,,6.01
HSBC Nifty Next 50 Index Fund-Reg(G),33548,HSBC Mutual Fund,2.22,6.2,4.69,-7.02,NIFTY NEXT 50 - TRI,19.53,20.51,,0.15,134,52,109,138,114,25,9,,HSBC Nifty Next 50 Index Fund-Reg(G),Equity : Index Funds,175,201,193,175,129,68,32,18,2.77,1.26,8.58,6.78,-1.07,18.99,19.99,11.7,,,,,,,,
Bandhan Nifty200 Momentum 30 Index Fund-Reg(G),46608,Bandhan Mutual Fund,-1.92,9.39,-0.3,-14.74,Nifty200 Momentum 30 - TRI,,,,-6.91,164,192,75,165,128,,,,Bandhan Nifty200 Momentum 30 Index Fund-Reg(G),Equity : Index Funds,175,201,193,175,129,68,32,18,2.77,1.26,8.58,6.78,-1.07,18.99,19.99,11.7,,,,,,,,
Axis NIFTY IT Index Fund-Reg(G),47983,Axis Mutual Fund,-4.75,12.0,-11.33,-6.18,NIFTY IT - TRI,,,,-13.58,175,197,47,175,101,,,,Axis NIFTY IT Index Fund-Reg(G),Equity : Index Funds,175,201,193,175,129,68,32,18,2.77,1.26,8.58,6.78,-1.07,18.99,19.99,11.7,,,,,,,,
Union Gold ETF,49576,Union Mutual Fund,-1.15,3.12,,,Gold-India,,,,,,24,28,,,,,,Union Gold ETF,Gold : ETFs,31,35,35,31,29,14,11,11,28.63,0.52,9.06,23.15,26.9,23.9,13.86,13.12,,,,,,,,
Tata Silver ETF FoF-Reg(G),48441,Tata Mutual Fund,2.61,17.67,23.46,21.44,Silver,,,,29.64,4,8,7,5,4,,,,Tata Silver ETF FoF-Reg(G),FoFs : Domestic,61,76,66,62,58,47,28,23,7.79,1.03,6.92,8.6,7.34,15.95,15.45,10.25,,,,,,,,
Aditya Birla SL CRISIL IBX 60:40 SDL + AAA PSU - Apr 2025 Index Fund-Reg(G),46226,Aditya Birla Sun Life Mutual Fund,0.53,1.56,3.23,6.95,CRISIL IBX 60:40 SDL + AAA PSU Index - April 2025,6.08,,,2.11,28,8,25,27,27,16,,,Aditya Birla SL CRISIL IBX 60:40 SDL + AAA PSU - Apr 2025 Index Fund-Reg(G),Debt : Medium Duration,28,28,28,28,28,17,12,12,4.98,0.56,1.93,4.75,8.69,7.48,6.83,6.83,,,,,,,,
Axis BSE Sensex ETF,47768,Axis Mutual Fund,0.7,4.81,7.57,1.74,BSE SENSEX - TRI,,,,5.5,67,140,141,84,68,,,,Axis BSE Sensex ETF,Equity : ETFs,170,195,184,170,155,103,64,29,3.89,1.23,8.34,7.09,1.04,19.42,21.52,12.29,,,,,,,,
Quant Gilt Fund-Reg(G),47345,Quant Mutual Fund,0.43,0.69,3.99,7.58,CRISIL Dynamic Gilt Index,,,,4.14,32,32,20,36,29,,,,Quant Gilt Fund-Reg(G),Debt : Gilt,36,38,37,37,36,23,21,21,4.96,0.72,0.97,4.9,8.57,7.75,5.38,7.35,,,,,,,,
ICICI Pru FMP-88-1226D-F(G),47232,ICICI Prudential Mutual Fund,0.44,1.8,4.15,7.9,CRISIL Medium Duration Debt Index,,,,4.48,44,41,59,40,50,,,,ICICI Pru FMP-88-1226D-F(G),Debt : FTP/FMP,91,92,92,91,91,49,18,4,4.33,0.44,1.82,4.17,8.01,7.39,5.56,6.15,,,,,,,,
SBI FMP-46-1850D-Reg(G),45620,SBI Mutual Fund,0.43,1.93,4.21,8.05,CRISIL Medium to Long Term Debt Index,7.48,,,4.62,37,55,32,37,38,27,,,SBI FMP-46-1850D-Reg(G),Debt : FTP/FMP,91,92,92,91,91,49,18,4,4.33,0.44,1.82,4.17,8.01,7.39,5.56,6.15,,,,,,,,
Taurus Mid Cap Fund-Reg(G),3306,Taurus Mutual Fund,3.77,13.07,9.91,-1.35,Nifty Midcap 150 - TRI,22.16,23.82,14.49,5.02,3,4,13,4,28,18,23,16,Taurus Mid Cap Fund-Reg(G),Equity : Mid Cap,30,31,31,30,30,25,24,20,1.22,2.53,12.29,6.95,2.82,24.54,28.28,15.64,,,,,,,,
Motilal Oswal Nifty 200 Momentum 30 ETF,46325,Motilal Oswal Mutual Fund,-1.9,9.55,0.08,-14.11,Nifty200 Momentum 30 - TRI,21.77,,,-6.53,157,183,65,152,154,26,,,Motilal Oswal Nifty 200 Momentum 30 ETF,Equity : ETFs,170,195,184,170,155,103,64,29,3.89,1.23,8.34,7.09,1.04,19.42,21.52,12.29,,,,,,,,
Quantum Equity FoF-Reg(G),19904,Quantum Mutual Fund,1.76,6.81,7.89,2.89,BSE 200 - TRI,19.21,20.43,12.47,4.2,43,20,25,25,43,13,7,4,Quantum Equity FoF-Reg(G),FoFs : Domestic,61,76,66,62,58,47,28,23,7.79,1.03,6.92,8.6,7.34,15.95,15.45,10.25,,,,,,,,
Tata Floating Rate Fund-Reg(G),45375,Tata Mutual Fund,0.51,1.96,4.93,8.83,CRISIL Short Duration Debt Index,7.51,,,5.1,8,10,6,6,8,10,,,Tata Floating Rate Fund-Reg(G),Debt : Floater,12,12,12,12,12,12,7,5,5.22,0.57,1.94,4.92,8.95,7.83,6.26,7.13,,,,,,,,
Kotak FMP-310-1131D(G),47871,Kotak Mahindra Mutual Fund,0.44,1.8,4.05,7.79,NIFTY Medium Duration Debt Index,,,,4.38,62,44,61,57,61,,,,Kotak FMP-310-1131D(G),Debt : FTP/FMP,91,92,92,91,91,49,18,4,4.33,0.44,1.82,4.17,8.01,7.39,5.56,6.15,,,,,,,,
ICICI Pru Nifty50 Equal Weight Index Fund-Reg(G),46902,ICICI Prudential Mutual Fund,1.21,5.69,8.53,0.08,NIFTY50 Equal Weight - TRI,,,,7.36,18,105,128,26,74,,,,ICICI Pru Nifty50 Equal Weight Index Fund-Reg(G),Equity : Index Funds,175,201,193,175,129,68,32,18,2.77,1.26,8.58,6.78,-1.07,18.99,19.99,11.7,,,,,,,,
Bandhan US Treasury Bond 0-1 year FoF-Reg(G),47724,Bandhan Mutual Fund,0.23,1.69,1.51,7.56,ICE 0-1 Year US Treasury Securities Index,,,,3.07,54,52,54,54,51,,,,Bandhan US Treasury Bond 0-1 year FoF-Reg(G),FoFs : Overseas,57,57,57,57,57,51,27,23,12.31,3.83,18.25,9.74,17.36,17.69,10.6,8.38,,,,,,,,
Groww Largecap Fund-Reg(G),15997,Groww Mutual Fund,1.28,6.83,8.57,-2.6,NIFTY 100 - TRI,16.4,17.15,10.86,3.69,21,14,9,3,30,24,27,22,Groww Largecap Fund-Reg(G),Equity : Large Cap,38,39,39,38,37,34,31,28,3.44,1.2,5.76,6.5,0.22,17.57,19.3,11.84,,,,,,,,
HDFC NIFTY Realty Index Fund-Reg(G),48654,HDFC Mutual Fund,-0.94,18.07,6.09,-11.45,NIFTY REALTY - TRI,,,,-5.36,155,176,5,120,122,,,,HDFC NIFTY Realty Index Fund-Reg(G),Equity : Index Funds,175,201,193,175,129,68,32,18,2.77,1.26,8.58,6.78,-1.07,18.99,19.99,11.7,,,,,,,,
DSP World Mining FoF-Reg(G),8359,DSP Mutual Fund,1.96,10.36,12.02,6.61,MSCI ACWI Metals & Mining 30% Buffer 10/40 (1994) Net TRI,11.64,12.08,11.33,18.41,9,44,48,18,54,37,10,4,DSP World Mining FoF-Reg(G),FoFs : Overseas,57,57,57,57,57,51,27,23,12.31,3.83,18.25,9.74,17.36,17.69,10.6,8.38,,,,,,,,
TRUSTMF Short Duration Fund-Reg(G),45652,Trust Mutual Fund,0.46,2.04,5.12,8.85,CRISIL Short Duration Debt Index,7.18,,,5.42,9,30,18,9,16,16,,,TRUSTMF Short Duration Fund-Reg(G),Debt : Short Duration,30,34,34,30,26,23,21,18,11.43,0.71,2.15,4.98,8.8,7.38,6.05,6.81,,,,,,,,
Mirae Asset CRISIL-IBX Financial Services 9-12 Months Debt Index Fund-Reg(G),49980,Mirae Asset Mutual Fund,,,,,CRISIL-IBX Financial Services 9-12 Months Debt Index,,,,,,,,,,,,,Mirae Asset CRISIL-IBX Financial Services 9-12 Months Debt Index Fund-Reg(G),Debt : Low Duration,20,23,23,20,20,20,20,19,4.63,0.58,1.99,4.33,7.97,7.12,5.77,6.51,,,,,,,,
Samco ELSS Tax Saver Fund-Reg(G),46606,Samco Mutual Fund,1.63,15.28,1.85,-7.54,NIFTY 500 - TRI,,,,-5.77,56,35,9,55,56,,,,Samco ELSS Tax Saver Fund-Reg(G),Equity : Tax Saving (ELSS),58,59,59,58,58,53,53,29,2.21,2.0,8.18,5.97,1.65,20.26,24.17,13.11,,,,,,,,
Edelweiss Emerging Markets Opp Eq. Offshore Fund-Reg(G),20281,Edelweiss Mutual Fund,3.77,18.87,15.43,12.0,MSCI Emerging Market Index,10.09,4.5,6.12,16.37,15,33,28,12,40,43,24,19,Edelweiss Emerging Markets Opp Eq. Offshore Fund-Reg(G),FoFs : Overseas,57,57,57,57,57,51,27,23,12.31,3.83,18.25,9.74,17.36,17.69,10.6,8.38,,,,,,,,
SBI Magnum Childrens Benefit Fund-Savings Plan,2748,SBI Mutual Fund,1.49,2.65,4.62,9.21,NIFTY 50 Hybrid Composite Debt 15:85 Index,13.64,14.0,11.68,3.01,32,18,37,33,1,22,19,6,SBI Magnum Childrens Benefit Fund-Savings Plan,Hybrid : Solution Oriented,43,43,43,43,42,37,32,15,3.53,1.45,6.02,5.95,4.17,14.88,14.71,10.33,,,,,,,,
DSP FMP 268-1281D-Reg(G),47124,DSP Mutual Fund,0.42,1.82,3.98,7.81,CRISIL Medium Duration Debt Index,,,,4.41,57,62,55,65,57,,,,DSP FMP 268-1281D-Reg(G),Debt : FTP/FMP,91,92,92,91,91,49,18,4,4.33,0.44,1.82,4.17,8.01,7.39,5.56,6.15,,,,,,,,
SBI FMP-78-1170D-Reg(G),47638,SBI Mutual Fund,0.48,1.83,4.07,7.83,CRISIL Medium Duration Debt Index,,,,4.46,51,17,47,54,53,,,,SBI FMP-78-1170D-Reg(G),Debt : FTP/FMP,91,92,92,91,91,49,18,4,4.33,0.44,1.82,4.17,8.01,7.39,5.56,6.15,,,,,,,,
TRUSTMF Money Market Fund-Reg(G),46735,Trust Mutual Fund,0.56,1.83,4.01,7.74,CRISIL Money Market Index,,,,4.32,19,19,21,19,17,,,,TRUSTMF Money Market Fund-Reg(G),Debt : Money Market,22,23,23,22,22,19,17,13,4.52,0.58,1.91,4.21,7.85,7.25,5.79,6.6,,,,,,,,
Baroda BNP Paribas Multi Asset Active FoF-Reg(G),49872,Baroda BNP Paribas Mutual Fund,0.17,,,,NIFTY Composite Debt Index,,,,,,69,,,,,,,Baroda BNP Paribas Multi Asset Active FoF-Reg(G),FoFs : Domestic,61,76,66,62,58,47,28,23,7.79,1.03,6.92,8.6,7.34,15.95,15.45,10.25,,,,,,,,
Tata Nifty India Digital ETF FoF-Reg(G),46355,Tata Mutual Fund,-0.92,10.27,-2.89,0.91,Nifty India Digital  - TRI,19.37,,,-7.87,61,73,14,62,48,12,,,Tata Nifty India Digital ETF FoF-Reg(G),FoFs : Domestic,61,76,66,62,58,47,28,23,7.79,1.03,6.92,8.6,7.34,15.95,15.45,10.25,,,,,,,,
Canara Rob Income Fund-Reg(G),542,Canara Robeco Mutual Fund,0.4,0.65,3.9,6.96,CRISIL Medium to Long Term Debt Index,6.54,4.43,6.49,3.96,59,41,60,59,52,26,10,6,Canara Rob Income Fund-Reg(G),Debt : Medium to Long Duration,59,60,60,59,52,26,11,11,5.43,0.47,1.94,5.12,9.04,7.69,5.48,6.54,,,,,,,,
Helios Mid Cap Fund-Reg(G),49111,Helios Mutual Fund,4.49,14.46,,,Nifty Midcap 150 - TRI,,,,,,2,6,,,,,,Helios Mid Cap Fund-Reg(G),Equity : Mid Cap,30,31,31,30,30,25,24,20,1.22,2.53,12.29,6.95,2.82,24.54,28.28,15.64,,,,,,,,
Motilal Oswal BSE Enhanced Value ETF,46740,Motilal Oswal Mutual Fund,3.97,8.62,11.76,-3.55,BSE Enhanced Value Index - TRI,,,,9.93,31,24,69,33,108,,,,Motilal Oswal BSE Enhanced Value ETF,Equity : ETFs,170,195,184,170,155,103,64,29,3.89,1.23,8.34,7.09,1.04,19.42,21.52,12.29,,,,,,,,
Navi Aggressive Hybrid Fund-Reg(G),39479,Navi Mutual Fund,3.54,7.73,5.78,4.98,CRISIL Hybrid 35+65 - Aggressive Index,15.59,15.64,,4.93,14,3,7,23,24,20,24,,Navi Aggressive Hybrid Fund-Reg(G),Hybrid : Equity Oriented,55,56,56,55,55,54,51,31,7.94,5.64,9.07,9.75,8.7,14.73,15.16,9.88,,,,,,,,
Canara Rob Dynamic Bond Fund-Reg(G),7792,Canara Robeco Mutual Fund,0.63,0.1,4.31,6.86,CRISIL Dynamic Bond Index,6.69,4.51,6.42,4.08,20,7,21,19,21,20,21,18,Canara Rob Dynamic Bond Fund-Reg(G),Debt : Dynamic Bond,22,22,22,22,22,22,21,19,4.92,0.6,1.04,4.9,8.51,7.58,5.76,7.12,0.51,1.57,5.28,9.53,,,,10.18
PGIM India Arbitrage Fund-Reg(G),28514,PGIM India Mutual Fund,0.41,1.28,3.26,6.66,Nifty 50 Arbitrage,6.51,5.29,5.51,3.63,15,26,26,15,15,20,18,13,PGIM India Arbitrage Fund-Reg(G),Hybrid : Arbitrage,30,31,31,30,26,24,23,14,3.58,0.45,1.37,3.2,6.67,6.74,5.4,5.72,0.37,1.49,3.72,7.28,7.34,5.84,,7.62
Mirae Asset Nifty 100 ESG Sector Leaders ETF,45134,Mirae Asset Mutual Fund,1.36,5.47,8.62,2.28,Nifty100 ESG Sector Leaders - TRI,15.76,,,6.61,45,88,114,44,42,89,,,Mirae Asset Nifty 100 ESG Sector Leaders ETF,Equity : ETFs,170,195,184,170,155,103,64,29,3.89,1.23,8.34,7.09,1.04,19.42,21.52,12.29,,,,,,,,
SBI FMP-50-1843D-Reg(G),45842,SBI Mutual Fund,0.4,1.97,4.4,8.29,CRISIL Medium to Long Term Debt Index,7.64,,,4.8,28,76,27,29,30,23,,,SBI FMP-50-1843D-Reg(G),Debt : FTP/FMP,91,92,92,91,91,49,18,4,4.33,0.44,1.82,4.17,8.01,7.39,5.56,6.15,,,,,,,,
JM Overnight Fund-Reg(G),44156,JM Financial Mutual Fund,0.42,1.33,2.85,6.17,CRISIL Liquid Overnight Index,6.32,5.09,,3.21,27,28,29,27,30,24,15,,JM Overnight Fund-Reg(G),Debt : Overnight,34,34,34,34,34,28,27,3,3.24,0.42,1.35,2.89,6.22,6.35,5.1,5.53,0.43,1.38,2.95,6.34,,,,6.01
Sundaram Global Brand Theme - Equity Active FoF(G),3005,Sundaram Mutual Fund,3.53,16.31,5.34,11.99,MSCI AC World Index,18.0,12.79,9.65,8.1,40,35,37,41,41,26,9,8,Sundaram Global Brand Theme - Equity Active FoF(G),FoFs : Overseas,57,57,57,57,57,51,27,23,12.31,3.83,18.25,9.74,17.36,17.69,10.6,8.38,,,,,,,,
Tata Nifty500 Multicap India Manufacturing 50:30:20 Index Fund-Reg(G),48782,Tata Mutual Fund,3.39,11.05,6.57,-0.32,Nifty500 Multicap India Manufacturing 50:30:20 - TRI,,,,3.58,90,29,49,111,82,,,,Tata Nifty500 Multicap India Manufacturing 50:30:20 Index Fund-Reg(G),Equity : Index Funds,175,201,193,175,129,68,32,18,2.77,1.26,8.58,6.78,-1.07,18.99,19.99,11.7,,,,,,,,
ICICI Pru Nifty 100 ETF,22404,ICICI Prudential Mutual Fund,1.1,5.36,7.57,0.04,NIFTY 100 - TRI,16.34,19.05,12.2,5.12,84,117,118,82,96,76,49,18,ICICI Pru Nifty 100 ETF,Equity : ETFs,170,195,184,170,155,103,64,29,3.89,1.23,8.34,7.09,1.04,19.42,21.52,12.29,,,,,,,,
SBI Nifty Bank Index Fund-Reg(G),49104,SBI Mutual Fund,1.09,3.99,,,NIFTY BANK - TRI,,,,,,107,178,,,,,,SBI Nifty Bank Index Fund-Reg(G),Equity : Index Funds,175,201,193,175,129,68,32,18,2.77,1.26,8.58,6.78,-1.07,18.99,19.99,11.7,,,,,,,,
Kotak Nifty 50 Value 20 ETF,31116,Kotak Mahindra Mutual Fund,-0.62,3.95,-1.86,-6.7,Nifty50 Value 20 - TRI,17.22,21.11,,-3.81,145,172,171,155,136,57,26,,Kotak Nifty 50 Value 20 ETF,Equity : ETFs,170,195,184,170,155,103,64,29,3.89,1.23,8.34,7.09,1.04,19.42,21.52,12.29,,,,,,,,
LIC MF Arbitrage Fund-Reg(G),39948,LIC Mutual Fund,0.39,1.32,3.16,6.57,Nifty 50 Arbitrage,6.54,5.15,,3.56,22,28,25,23,22,19,19,,LIC MF Arbitrage Fund-Reg(G),Hybrid : Arbitrage,30,31,31,30,26,24,23,14,3.58,0.45,1.37,3.2,6.67,6.74,5.4,5.72,0.37,1.49,3.72,7.28,7.34,5.84,,7.62
Mirae Asset Dynamic Bond Fund-Reg(G),36556,Mirae Asset Mutual Fund,0.39,1.99,4.54,8.01,CRISIL Dynamic Bond Index,6.71,4.53,,4.83,11,18,2,16,16,19,20,,Mirae Asset Dynamic Bond Fund-Reg(G),Debt : Dynamic Bond,22,22,22,22,22,22,21,19,4.92,0.6,1.04,4.9,8.51,7.58,5.76,7.12,0.51,1.57,5.28,9.53,,,,10.18
Groww Multicap Fund-Reg(G),49400,Groww Mutual Fund,3.37,13.76,10.54,,Nifty500 Multicap 50:25:25 - TRI,,,,4.06,11,4,1,1,,,,,Groww Multicap Fund-Reg(G),Equity : Multi Cap,42,44,43,42,38,28,20,14,2.05,2.23,8.86,6.52,2.95,20.66,22.63,13.74,,,,,,,,
SBI FMP-43-1616D-Reg(G),45525,SBI Mutual Fund,0.44,1.51,3.35,7.03,CRISIL Medium Duration Debt Index,7.11,,,3.72,73,40,80,73,76,33,,,SBI FMP-43-1616D-Reg(G),Debt : FTP/FMP,91,92,92,91,91,49,18,4,4.33,0.44,1.82,4.17,8.01,7.39,5.56,6.15,,,,,,,,
Mirae Asset Silver ETF,46195,Mirae Asset Mutual Fund,3.05,18.15,23.68,22.19,Silver,,,,30.02,5,5,7,4,21,,,,Mirae Asset Silver ETF,Gold : ETFs,31,35,35,31,29,14,11,11,28.63,0.52,9.06,23.15,26.9,23.9,13.86,13.12,,,,,,,,
JM Short Duration Fund-Reg(G),46751,JM Financial Mutual Fund,0.5,1.9,4.94,8.54,CRISIL Short Duration Debt Index,,,,5.22,20,20,26,21,22,,,,JM Short Duration Fund-Reg(G),Debt : Short Duration,30,34,34,30,26,23,21,18,11.43,0.71,2.15,4.98,8.8,7.38,6.05,6.81,,,,,,,,
Quantum Dynamic Bond Fund-Reg(G),37428,Quantum Mutual Fund,0.59,1.18,5.54,8.96,CRISIL Dynamic Bond Index,8.39,6.42,7.82,5.36,7,8,11,5,8,3,5,3,Quantum Dynamic Bond Fund-Reg(G),Debt : Dynamic Bond,22,22,22,22,22,22,21,19,4.92,0.6,1.04,4.9,8.51,7.58,5.76,7.12,0.51,1.57,5.28,9.53,,,,10.18
Groww Nifty Smallcap 250 Index Fund-Reg(G),48617,Groww Mutual Fund,4.45,15.78,6.94,1.24,Nifty Smallcap 250 - TRI,,,,0.56,118,11,18,103,49,,,,Groww Nifty Smallcap 250 Index Fund-Reg(G),Equity : Index Funds,175,201,193,175,129,68,32,18,2.77,1.26,8.58,6.78,-1.07,18.99,19.99,11.7,,,,,,,,
Baroda BNP Paribas Gold ETF,48145,Baroda BNP Paribas Mutual Fund,-1.16,3.14,23.11,30.82,Gold-India,,,,27.76,26,26,25,21,8,,,,Baroda BNP Paribas Gold ETF,Gold : ETFs,31,35,35,31,29,14,11,11,28.63,0.52,9.06,23.15,26.9,23.9,13.86,13.12,,,,,,,,
Motilal Oswal Nifty Smallcap 250 ETF,48657,Motilal Oswal Mutual Fund,4.51,16.0,7.3,1.79,Nifty Smallcap 250 - TRI,,,,0.93,120,13,12,96,64,,,,Motilal Oswal Nifty Smallcap 250 ETF,Equity : ETFs,170,195,184,170,155,103,64,29,3.89,1.23,8.34,7.09,1.04,19.42,21.52,12.29,,,,,,,,
Aditya Birla SL Retirement Fund-40-Reg(G),42770,Aditya Birla Sun Life Mutual Fund,1.18,6.11,6.61,6.7,CRISIL Hybrid 35+65 - Aggressive Index,15.15,13.51,,2.78,34,23,21,11,8,19,22,,Aditya Birla SL Retirement Fund-40-Reg(G),Hybrid : Solution Oriented,43,43,43,43,42,37,32,15,3.53,1.45,6.02,5.95,4.17,14.88,14.71,10.33,,,,,,,,
Shriram Liquid Fund-Reg(G),48954,Shriram Mutual Fund,0.46,1.47,3.15,,Nifty Liquid Fund Index,,,,3.54,36,36,35,36,,,,,Shriram Liquid Fund-Reg(G),Debt : Liquid,38,39,38,38,37,35,34,29,3.76,0.48,1.53,3.38,6.99,6.88,5.47,6.12,,,,,,,,
Kotak FMP-304-3119D(G),47401,Kotak Mahindra Mutual Fund,0.49,1.52,6.37,11.51,NIFTY Long Duration Debt Index,,,,6.75,1,14,78,1,1,,,,Kotak FMP-304-3119D(G),Debt : FTP/FMP,91,92,92,91,91,49,18,4,4.33,0.44,1.82,4.17,8.01,7.39,5.56,6.15,,,,,,,,
Unifi Flexi Cap Fund-Reg(G),49807,Unifi Mutual Fund,2.0,,,,NIFTY 500 - TRI,,,,,,15,,,,,,,Unifi Flexi Cap Fund-Reg(G),Equity : Flexi Cap,48,49,48,48,48,35,27,21,1.56,1.72,7.48,5.87,0.93,19.41,21.42,13.2,,,,,,,,
Motilal Oswal BSE Low Volatility Index Fund-Reg(G),46438,Motilal Oswal Mutual Fund,1.89,4.97,6.27,-2.9,BSE Low Volatility Index - TRI,16.69,,,4.76,68,75,159,116,89,36,,,Motilal Oswal BSE Low Volatility Index Fund-Reg(G),Equity : Index Funds,175,201,193,175,129,68,32,18,2.77,1.26,8.58,6.78,-1.07,18.99,19.99,11.7,,,,,,,,
Nippon India FMP-XLV-4-1111D(G),47822,Nippon India Mutual Fund,0.45,1.82,4.11,7.91,CRISIL Medium Duration Debt Index,,,,4.44,55,32,50,50,49,,,,Nippon India FMP-XLV-4-1111D(G),Debt : FTP/FMP,91,92,92,91,91,49,18,4,4.33,0.44,1.82,4.17,8.01,7.39,5.56,6.15,,,,,,,,
Canara Rob Corp Bond Fund-Reg(G),23504,Canara Robeco Mutual Fund,0.47,1.5,4.37,7.92,CRISIL Corporate Bond Index,6.73,5.2,6.6,4.5,21,18,21,21,21,20,18,10,Canara Rob Corp Bond Fund-Reg(G),Debt : Corporate Bond,21,21,21,21,21,20,18,12,5.52,0.52,2.05,5.28,9.29,7.62,5.97,7.21,,,,,,,,
Bandhan Conservative Hybrid Fund-Reg(G),8465,Bandhan Mutual Fund,0.56,1.77,4.4,5.29,NIFTY AAA Short Duration Bond Index,8.02,6.83,6.64,4.41,10,12,16,14,15,17,16,15,Bandhan Conservative Hybrid Fund-Reg(G),Hybrid : Debt Oriented (Conservative),18,18,18,18,18,18,17,17,4.39,0.7,2.51,4.96,6.71,9.88,9.59,7.73,,,,,,,,
PGIM India Dynamic Bond Fund(G),15247,PGIM India Mutual Fund,0.5,0.58,4.81,8.36,CRISIL Dynamic Bond Index,7.24,5.3,7.13,4.73,12,15,17,11,11,17,13,11,PGIM India Dynamic Bond Fund(G),Debt : Dynamic Bond,22,22,22,22,22,22,21,19,4.92,0.6,1.04,4.9,8.51,7.58,5.76,7.12,0.51,1.57,5.28,9.53,,,,10.18
ICICI Pru Debt Mgmt Fund(FOF)(G),1707,ICICI Prudential Mutual Fund,0.72,1.88,5.22,9.23,CRISIL Composite Bond Index,8.26,6.56,7.49,5.5,31,47,59,45,19,41,24,18,ICICI Pru Debt Mgmt Fund(FOF)(G),FoFs : Domestic,61,76,66,62,58,47,28,23,7.79,1.03,6.92,8.6,7.34,15.95,15.45,10.25,,,,,,,,
PGIM India Gilt Fund(G),7012,PGIM India Mutual Fund,0.63,0.52,4.79,8.19,CRISIL Dynamic Gilt Index,7.42,5.32,7.01,4.68,20,22,22,19,21,18,13,14,PGIM India Gilt Fund(G),Debt : Gilt,36,38,37,37,36,23,21,21,4.96,0.72,0.97,4.9,8.57,7.75,5.38,7.35,,,,,,,,
Edelweiss Europe Dynamic Equity Off-shore Fund-Reg(G),24618,Edelweiss Mutual Fund,1.64,13.01,27.94,24.11,MSCI Europe Index (Total Return Net),22.9,15.44,8.61,31.55,2,46,41,2,9,14,5,12,Edelweiss Europe Dynamic Equity Off-shore Fund-Reg(G),FoFs : Overseas,57,57,57,57,57,51,27,23,12.31,3.83,18.25,9.74,17.36,17.69,10.6,8.38,,,,,,,,
Nippon India CRISIL-IBX AAA Financial Services - Dec 2026 Index Fund-Reg(G),49222,Nippon India Mutual Fund,0.7,2.24,4.82,,CRISIL-IBX AAA Financial Services Index - Dec 2026,,,,5.07,23,3,4,23,,,,,Nippon India CRISIL-IBX AAA Financial Services - Dec 2026 Index Fund-Reg(G),Debt : Short Duration,30,34,34,30,26,23,21,18,11.43,0.71,2.15,4.98,8.8,7.38,6.05,6.81,,,,,,,,
Mirae Asset Nifty India Manufacturing ETF FoF-Reg(G),46053,Mirae Asset Mutual Fund,1.9,10.45,6.59,-2.86,Nifty India Manufacturing - TRI,22.93,,,4.28,42,15,13,33,53,6,,,Mirae Asset Nifty India Manufacturing ETF FoF-Reg(G),FoFs : Domestic,61,76,66,62,58,47,28,23,7.79,1.03,6.92,8.6,7.34,15.95,15.45,10.25,,,,,,,,
