MF Code,schemecode,fund_house,returns_1month,returns_3month,returns_6month,returns_1year,index_name,returns_3year,returns_5year,returns_10year,ytd_returns,rank_ytd,rank_1month,rank_3month,rank_6month,rank_1year,rank_3year,rank_5year,rank_10year,s_name,classification,funds_num_ytd,funds_num_month1,funds_num_month3,funds_num_month6,funds_num_year1,funds_num_year3,funds_num_year5,funds_num_year10,ytd_avg,avg_month1,avg_month3,avg_month6,avg_year1,avg_year3,avg_year5,avg_year10,monthret_1,monthret_3,monthret_6,yrret_1,yrret_3,yrret_5,yrret_10,ytdret
SBI Nifty 50 ETF,33369,SBI Mutual Fund,-2.25,0.28,4.4,9.44,NIFTY 50 - TRI,14.05,12.69,14.39,-1.8,148,106,86,94,74,81,38,17,SBI Nifty 50 ETF,Equity : ETFs,232,233,215,204,173,124,73,38,-1.19,-2.21,-0.08,5.13,9.63,17.32,14.32,14.76,,,,,,,,
Parag Parikh Flexi Cap Fund-Reg(G),21520,PPFAS Mutual Fund,-1.9,-0.45,1.91,5.97,NIFTY 500 - TRI,19.49,17.73,18.19,-1.2,10,7,10,23,26,7,5,2,Parag Parikh Flexi Cap Fund-Reg(G),Equity : Flexi Cap,52,52,51,50,48,39,29,21,-1.8,-2.61,-1.86,1.4,5.76,16.58,14.29,14.73,,,,,,,,
SBI BSE Sensex ETF,20447,SBI Mutual Fund,-2.46,-0.11,3.55,7.66,BSE SENSEX - TRI,12.32,11.7,14.27,-2.21,169,132,115,127,108,106,51,29,SBI BSE Sensex ETF,Equity : ETFs,232,233,215,204,173,124,73,38,-1.19,-2.21,-0.08,5.13,9.63,17.32,14.32,14.76,,,,,,,,
HDFC Balanced Advantage Fund(G),1273,HDFC Mutual Fund,-1.33,0.04,3.26,8.34,NIFTY 50 Hybrid Composite Debt 50:50 Index,17.88,17.31,16.15,-0.8,17,14,10,10,7,1,1,1,HDFC Balanced Advantage Fund(G),Hybrid : Dynamic Asset Allocation,36,34,34,34,33,24,20,11,-1.05,-1.53,-0.6,2.1,6.11,12.01,9.86,10.54,,,,,,,,
HDFC Flexi Cap Fund(G),1131,HDFC Mutual Fund,-1.36,0.16,5.25,12.62,NIFTY 500 - TRI,21.86,20.64,18.08,-0.32,3,4,5,3,3,3,2,3,HDFC Flexi Cap Fund(G),Equity : Flexi Cap,52,52,51,50,48,39,29,21,-1.8,-2.61,-1.86,1.4,5.76,16.58,14.29,14.73,,,,,,,,
HDFC Mid Cap Fund-Reg(G),1305,HDFC Mutual Fund,-0.96,0.32,5.95,12.96,Nifty Midcap 150 - TRI,26.09,23.8,19.06,-0.13,4,2,3,2,3,3,2,3,HDFC Mid Cap Fund-Reg(G),Equity : Mid Cap,32,32,32,31,30,30,24,20,-1.8,-2.78,-2.65,1.02,7.6,21.75,19.35,16.8,,,,,,,,
SBI Equity Hybrid Fund-Reg(G),2747,SBI Mutual Fund,-2.15,-1.14,2.18,9.95,CRISIL Hybrid 35+65 - Aggressive Index,14.62,12.04,12.65,-1.38,48,48,41,26,4,13,13,10,SBI Equity Hybrid Fund-Reg(G),Hybrid : Equity Oriented,63,56,56,55,53,52,50,33,-0.79,-1.24,-0.35,1.98,6.37,12.34,10.81,10.69,,,,,,,,
ICICI Pru Large Cap Fund(G),4980,ICICI Prudential Mutual Fund,-2.22,0.73,4.4,10.38,NIFTY 100 - TRI,18.06,15.97,15.51,-1.41,19,17,6,8,4,3,3,3,ICICI Pru Large Cap Fund(G),Equity : Large Cap,39,39,39,39,38,36,33,28,-1.66,-2.46,-0.85,2.78,7.34,15.25,12.64,13.51,,,,,,,,
ICICI Pru Multi-Asset Fund(G),1495,ICICI Prudential Mutual Fund,-0.2,3.38,9.41,15.26,NIFTY 200 - TRI,19.59,20.43,17.0,0.71,29,29,26,18,19,5,2,2,ICICI Pru Multi-Asset Fund(G),Hybrid : Multi Asset Allocation,35,35,33,31,27,11,9,7,1.84,0.79,4.93,10.61,17.78,18.51,16.3,13.72,,,,,,,,
Kotak Arbitrage Fund(G),1979,Kotak Mahindra Mutual Fund,0.51,1.54,2.86,6.28,Nifty 50 Arbitrage,7.17,6.08,5.94,0.73,3,6,12,11,11,1,2,1,Kotak Arbitrage Fund(G),Hybrid : Arbitrage,34,34,33,31,30,24,24,14,0.66,0.48,1.51,2.79,6.04,6.81,5.66,5.72,0.72,2.03,3.79,7.5,7.73,6.38,,9.4
ICICI Pru Balanced Advantage Fund(G),1470,ICICI Prudential Mutual Fund,-0.92,1.49,5.12,11.24,CRISIL Hybrid 50+50 - Moderate Index,13.59,11.95,11.88,-0.27,4,7,2,2,1,5,2,2,ICICI Pru Balanced Advantage Fund(G),Hybrid : Dynamic Asset Allocation,36,34,34,34,33,24,20,11,-1.05,-1.53,-0.6,2.1,6.11,12.01,9.86,10.54,,,,,,,,
UTI Nifty 50 ETF,33150,UTI Mutual Fund,-2.25,0.3,4.42,9.47,NIFTY 50 - TRI,14.06,12.7,14.41,-1.8,147,105,81,84,67,75,33,16,UTI Nifty 50 ETF,Equity : ETFs,232,233,215,204,173,124,73,38,-1.19,-2.21,-0.08,5.13,9.63,17.32,14.32,14.76,,,,,,,,
Nippon India Small Cap Fund(G),12758,Nippon India Mutual Fund,-3.43,-5.68,-3.8,1.7,Nifty Smallcap 250 - TRI,21.09,24.61,20.79,-2.68,16,11,14,19,17,5,2,1,Nippon India Small Cap Fund(G),Equity : Small Cap,33,33,31,31,30,24,22,13,-2.82,-3.77,-6.01,-3.42,1.25,18.8,20.61,17.1,,,,,,,,
ICICI Pru Value Fund(G),1492,ICICI Prudential Mutual Fund,-2.02,1.27,5.63,11.35,NIFTY 500 - TRI,20.52,20.77,16.6,-1.53,12,7,3,4,3,6,2,7,ICICI Pru Value Fund(G),Equity : Value / Contra,23,23,23,23,22,21,18,15,-1.35,-2.31,-0.29,3.73,7.13,19.4,17.29,15.63,,,,,,,,
Kotak Midcap Fund-Reg(G),1977,Kotak Mahindra Mutual Fund,-2.02,-2.43,-0.38,9.26,Nifty Midcap 150 - TRI,21.76,20.2,18.65,-1.04,9,10,15,23,15,15,9,5,Kotak Midcap Fund-Reg(G),Equity : Mid Cap,32,32,32,31,30,30,24,20,-1.8,-2.78,-2.65,1.02,7.6,21.75,19.35,16.8,,,,,,,,
HDFC Liquid Fund(G),1286,HDFC Mutual Fund,0.49,1.47,2.91,6.37,CRISIL Liquid Debt Index,6.9,5.8,6.04,0.57,19,14,6,14,14,16,18,20,HDFC Liquid Fund(G),Debt : Liquid,44,44,42,40,38,36,34,29,0.56,0.48,1.43,2.86,6.26,6.83,5.77,6.01,,,,,,,,
SBI Liquid Fund-Reg(G),2828,SBI Mutual Fund,0.49,1.45,2.88,6.3,Nifty Liquid Fund Index,6.85,5.78,6.05,0.56,29,20,20,24,21,25,23,19,SBI Liquid Fund-Reg(G),Debt : Liquid,44,44,42,40,38,36,34,29,0.56,0.48,1.43,2.86,6.26,6.83,5.77,6.01,,,,,,,,
Nippon India ETF Nifty 50 BeES,2272,Nippon India Mutual Fund,-2.25,0.28,4.4,9.45,NIFTY 50 - TRI,14.06,12.71,14.35,-1.8,144,97,85,91,71,74,32,20,Nippon India ETF Nifty 50 BeES,Equity : ETFs,232,233,215,204,173,124,73,38,-1.19,-2.21,-0.08,5.13,9.63,17.32,14.32,14.76,,,,,,,,
Kotak Flexicap Fund(G),7874,Kotak Mahindra Mutual Fund,-0.4,1.57,4.55,13.42,NIFTY 500 - TRI,17.48,14.3,15.2,0.75,1,2,2,7,1,17,12,8,Kotak Flexicap Fund(G),Equity : Flexi Cap,52,52,51,50,48,39,29,21,-1.8,-2.61,-1.86,1.4,5.76,16.58,14.29,14.73,,,,,,,,
SBI Large Cap Fund-Reg(G),2711,SBI Mutual Fund,-2.06,0.79,3.83,9.05,BSE 100 - TRI,14.43,12.66,13.33,-1.19,12,14,5,11,10,25,17,17,SBI Large Cap Fund-Reg(G),Equity : Large Cap,39,39,39,39,38,36,33,28,-1.66,-2.46,-0.85,2.78,7.34,15.25,12.64,13.51,,,,,,,,
Aditya Birla SL Liquid Fund(G),293,Aditya Birla Sun Life Mutual Fund,0.49,1.47,2.92,6.38,Nifty Liquid Fund Index,6.94,5.85,6.15,0.57,21,15,11,9,11,6,6,4,Aditya Birla SL Liquid Fund(G),Debt : Liquid,44,44,42,40,38,36,34,29,0.56,0.48,1.43,2.86,6.26,6.83,5.77,6.01,,,,,,,,
UTI BSE Sensex ETF,33151,UTI Mutual Fund,-2.46,-0.09,3.57,7.68,BSE SENSEX - TRI,12.33,11.69,14.29,-2.21,170,133,110,120,104,105,52,28,UTI BSE Sensex ETF,Equity : ETFs,232,233,215,204,173,124,73,38,-1.19,-2.21,-0.08,5.13,9.63,17.32,14.32,14.76,,,,,,,,
ICICI Pru Liquid Fund(G),1659,ICICI Prudential Mutual Fund,0.49,1.46,2.9,6.35,CRISIL Liquid Debt Index,6.92,5.81,6.11,0.59,7,10,14,16,19,14,15,11,ICICI Pru Liquid Fund(G),Debt : Liquid,44,44,42,40,38,36,34,29,0.56,0.48,1.43,2.86,6.26,6.83,5.77,6.01,,,,,,,,
Nippon India Large Cap Fund(G),2455,Nippon India Mutual Fund,-1.91,-0.72,3.21,9.59,BSE 100 - TRI,18.9,17.7,15.62,-1.58,22,10,21,19,6,2,2,2,Nippon India Large Cap Fund(G),Equity : Large Cap,39,39,39,39,38,36,33,28,-1.66,-2.46,-0.85,2.78,7.34,15.25,12.64,13.51,,,,,,,,
Nippon India Multi Cap Fund(G),2466,Nippon India Mutual Fund,-2.58,-3.31,-1.04,7.56,Nifty500 Multicap 50:25:25 - TRI,21.66,22.52,16.08,-2.05,27,24,34,37,13,4,1,3,Nippon India Multi Cap Fund(G),Equity : Multi Cap,45,45,45,45,42,31,21,14,-1.86,-2.7,-2.41,1.07,5.97,17.73,14.96,15.03,,,,,,,,
SBI Contra Fund-Reg(G),2809,SBI Mutual Fund,-2.22,0.02,3.99,6.66,BSE 500 - TRI,20.17,21.36,17.22,-1.71,15,10,9,13,14,8,1,1,SBI Contra Fund-Reg(G),Equity : Value / Contra,23,23,23,23,22,21,18,15,-1.35,-2.31,-0.29,3.73,7.13,19.4,17.29,15.63,,,,,,,,
ICICI Pru Equity & Debt Fund(G),1482,ICICI Prudential Mutual Fund,-1.1,0.81,5.28,11.98,CRISIL Hybrid 35+65 - Aggressive Index,19.19,19.81,16.7,-0.38,25,27,11,1,1,1,1,1,ICICI Pru Equity & Debt Fund(G),Hybrid : Equity Oriented,63,56,56,55,53,52,50,33,-0.79,-1.24,-0.35,1.98,6.37,12.34,10.81,10.69,,,,,,,,
Mirae Asset Large & Midcap Fund-Reg(G),9767,Mirae Asset Mutual Fund,-2.65,-1.16,4.69,11.46,NIFTY LargeMidcap 250 - TRI,17.7,14.91,18.11,-2.22,23,19,10,7,4,16,20,1,Mirae Asset Large & Midcap Fund-Reg(G),Equity : Large & Mid Cap,33,33,33,33,31,26,26,20,-1.84,-2.7,-2.02,1.59,7.39,18.72,16.43,15.37,,,,,,,,
SBI Focused Fund-Reg(G),2817,SBI Mutual Fund,-2.47,1.54,8.04,12.78,BSE 500 - TRI,18.86,15.04,15.75,-1.16,10,16,2,2,2,13,10,6,SBI Focused Fund-Reg(G),Equity : Multi Cap,45,45,45,45,42,31,21,14,-1.86,-2.7,-2.41,1.07,5.97,17.73,14.96,15.03,,,,,,,,
Nippon India Growth Mid Cap Fund(G),2573,Nippon India Mutual Fund,-0.82,-0.2,4.15,11.62,Nifty Midcap 150 - TRI,26.09,23.0,19.34,0.74,1,1,4,6,6,4,3,1,Nippon India Growth Mid Cap Fund(G),Equity : Mid Cap,32,32,32,31,30,30,24,20,-1.8,-2.78,-2.65,1.02,7.6,21.75,19.35,16.8,,,,,,,,
Mirae Asset Large Cap Fund-Reg(G),4457,Mirae Asset Mutual Fund,-2.68,-0.47,3.22,8.74,NIFTY 100 - TRI,13.31,11.69,14.45,-2.3,33,28,17,18,13,28,22,6,Mirae Asset Large Cap Fund-Reg(G),Equity : Large Cap,39,39,39,39,38,36,33,28,-1.66,-2.46,-0.85,2.78,7.34,15.25,12.64,13.51,,,,,,,,
SBI Arbitrage Opportunities Fund-Reg(G),2709,SBI Mutual Fund,0.49,1.54,2.86,6.38,Nifty 50 Arbitrage,7.1,6.09,5.77,0.63,25,12,11,10,4,2,1,7,SBI Arbitrage Opportunities Fund-Reg(G),Hybrid : Arbitrage,34,34,33,31,30,24,24,14,0.66,0.48,1.51,2.79,6.04,6.81,5.66,5.72,0.72,2.03,3.79,7.5,7.73,6.38,,9.4
HDFC Large Cap Fund(G),1331,HDFC Mutual Fund,-1.85,0.71,3.78,7.43,NIFTY 100 - TRI,15.74,14.66,14.89,-1.07,9,7,7,13,20,15,5,5,HDFC Large Cap Fund(G),Equity : Large Cap,39,39,39,39,38,36,33,28,-1.66,-2.46,-0.85,2.78,7.34,15.25,12.64,13.51,,,,,,,,
SBI Balanced Advantage Fund-Reg(G),32097,SBI Mutual Fund,-0.9,1.19,5.34,9.86,NIFTY 50 Hybrid Composite Debt 50:50 Index,14.06,,,-0.62,10,6,3,1,3,3,,,SBI Balanced Advantage Fund-Reg(G),Hybrid : Dynamic Asset Allocation,36,34,34,34,33,24,20,11,-1.05,-1.53,-0.6,2.1,6.11,12.01,9.86,10.54,,,,,,,,
Nippon India ETF Gold BeES,1024,Nippon India Mutual Fund,11.35,25.66,50.43,76.7,Gold-India,36.27,24.98,17.16,13.93,16,10,25,24,22,11,11,10,Nippon India ETF Gold BeES,Gold : ETFs,40,40,39,36,31,18,11,11,12.24,8.95,42.76,77.39,107.44,41.8,25.15,17.25,,,,,,,,
Axis Liquid Fund-Reg(G),8029,Axis Mutual Fund,0.49,1.48,2.93,6.42,Nifty Liquid Fund Index,6.97,5.88,6.16,0.59,3,4,5,5,3,2,2,3,Axis Liquid Fund-Reg(G),Debt : Liquid,44,44,42,40,38,36,34,29,0.56,0.48,1.43,2.86,6.26,6.83,5.77,6.01,,,,,,,,
HDFC Small Cap Fund-Reg(G),4455,HDFC Mutual Fund,-3.05,-5.96,-3.62,5.09,BSE 250 Small Cap - TRI,19.59,21.91,18.47,-1.97,8,3,16,18,6,8,6,2,HDFC Small Cap Fund-Reg(G),Equity : Small Cap,33,33,31,31,30,24,22,13,-2.82,-3.77,-6.01,-3.42,1.25,18.8,20.61,17.1,,,,,,,,
SBI Large & Midcap Fund-Reg(G),2801,SBI Mutual Fund,-0.68,2.15,6.01,13.07,NIFTY LargeMidcap 250 - TRI,18.78,17.82,16.05,0.7,1,1,1,1,2,13,6,9,SBI Large & Midcap Fund-Reg(G),Equity : Large & Mid Cap,33,33,33,33,31,26,26,20,-1.84,-2.7,-2.02,1.59,7.39,18.72,16.43,15.37,,,,,,,,
ICICI Pru Nifty 50 ETF,20803,ICICI Prudential Mutual Fund,-2.25,0.29,4.41,9.47,NIFTY 50 - TRI,14.08,12.72,14.38,-1.59,123,94,84,89,68,71,30,18,ICICI Pru Nifty 50 ETF,Equity : ETFs,232,233,215,204,173,124,73,38,-1.19,-2.21,-0.08,5.13,9.63,17.32,14.32,14.76,,,,,,,,
SBI Savings Fund-Reg(G),2774,SBI Mutual Fund,0.41,1.35,2.71,6.87,CRISIL Money Market Index,7.02,5.8,6.37,0.47,12,16,15,17,16,19,13,9,SBI Savings Fund-Reg(G),Debt : Money Market,24,24,23,23,23,21,17,13,0.47,0.42,1.38,2.78,6.99,7.18,6.04,6.48,,,,,,,,
Motilal Oswal Midcap Fund-Reg(G),22533,Motilal Oswal Mutual Fund,-5.68,-9.19,-8.62,-4.19,Nifty Midcap 150 - TRI,22.92,24.69,17.02,-5.38,31,31,32,31,29,12,1,8,Motilal Oswal Midcap Fund-Reg(G),Equity : Mid Cap,32,32,32,31,30,30,24,20,-1.8,-2.78,-2.65,1.02,7.6,21.75,19.35,16.8,,,,,,,,
SBI Small Cap Fund-Reg(G),7885,SBI Mutual Fund,-4.53,-7.56,-5.15,-2.05,BSE 250 Small Cap - TRI,13.22,16.43,17.87,-4.25,31,28,28,24,23,24,22,6,SBI Small Cap Fund-Reg(G),Equity : Small Cap,33,33,31,31,30,24,22,13,-2.82,-3.77,-6.01,-3.42,1.25,18.8,20.61,17.1,,,,,,,,
SBI Overnight Fund-Reg(G),2787,SBI Mutual Fund,0.43,1.3,2.66,5.58,CRISIL Liquid Overnight Index,6.26,5.35,5.39,0.5,27,21,23,20,19,24,18,2,SBI Overnight Fund-Reg(G),Debt : Overnight,35,35,35,35,34,31,27,3,0.51,0.43,1.29,2.65,5.55,6.27,5.36,5.42,,,,,,,,
ICICI Pru Money Market Fund(G),1690,ICICI Prudential Mutual Fund,0.46,1.46,2.89,7.25,Nifty Money Market Index,7.46,6.23,6.67,0.51,5,2,2,2,2,2,6,5,ICICI Pru Money Market Fund(G),Debt : Money Market,24,24,23,23,23,21,17,13,0.47,0.42,1.38,2.78,6.99,7.18,6.04,6.48,,,,,,,,
Kotak Liquid Fund-Reg(G),2060,Kotak Mahindra Mutual Fund,0.47,1.44,2.89,6.35,Nifty Liquid Fund Index,6.89,5.79,6.06,0.57,22,30,26,23,18,20,22,18,Kotak Liquid Fund-Reg(G),Debt : Liquid,44,44,42,40,38,36,34,29,0.56,0.48,1.43,2.86,6.26,6.83,5.77,6.01,,,,,,,,
ICICI Pru India Opp Fund(G),42140,ICICI Prudential Mutual Fund,-1.26,1.68,7.18,12.13,NIFTY 500 - TRI,23.49,24.68,,-0.64,32,15,15,14,14,7,5,,ICICI Pru India Opp Fund(G),Equity : Thematic,113,112,110,105,91,41,28,9,-1.66,-2.76,-1.73,1.98,6.04,18.73,17.11,15.41,,,,,,,,
Axis ELSS Tax Saver Fund-Reg(G),8408,Axis Mutual Fund,-2.01,-2.33,0.48,4.95,NIFTY 500 - TRI,15.6,9.57,12.57,-1.04,8,10,30,35,31,37,50,28,Axis ELSS Tax Saver Fund-Reg(G),Equity : Tax Saving (ELSS),57,57,57,57,57,54,51,31,-2.07,-2.99,-2.21,0.86,5.62,16.94,15.85,14.52,,,,,,,,
HDFC Money Market Fund-Reg(G),1119,HDFC Mutual Fund,0.45,1.42,2.84,7.15,CRISIL Money Market Index,7.38,6.2,6.64,0.52,2,5,6,7,8,9,8,6,HDFC Money Market Fund-Reg(G),Debt : Money Market,24,24,23,23,23,21,17,13,0.47,0.42,1.38,2.78,6.99,7.18,6.04,6.48,,,,,,,,
Tata Money Market Fund-Reg(G),3267,Tata Mutual Fund,0.44,1.4,2.83,7.16,CRISIL Money Market Index,7.43,6.27,5.92,0.49,7,7,8,8,6,6,4,13,Tata Money Market Fund-Reg(G),Debt : Money Market,24,24,23,23,23,21,17,13,0.47,0.42,1.38,2.78,6.99,7.18,6.04,6.48,,,,,,,,
Axis Large Cap Fund-Reg(G),8250,Axis Mutual Fund,-2.18,-1.12,2.07,5.42,BSE 100 - TRI,12.62,8.99,13.06,-1.37,18,16,25,27,27,31,32,19,Axis Large Cap Fund-Reg(G),Equity : Large Cap,39,39,39,39,38,36,33,28,-1.66,-2.46,-0.85,2.78,7.34,15.25,12.64,13.51,,,,,,,,
HDFC Corp Bond Fund(G),8241,HDFC Mutual Fund,0.31,0.66,1.76,6.63,NIFTY Corporate Bond Index,7.55,6.24,7.52,0.19,10,15,16,18,18,6,5,2,HDFC Corp Bond Fund(G),Debt : Corporate Bond,21,21,21,21,21,21,18,13,0.2,0.32,0.78,1.97,7.0,7.31,6.01,7.06,,,,,,,,
ICICI Pru Corp Bond Fund(G),7925,ICICI Prudential Mutual Fund,0.39,1.12,2.52,7.52,NIFTY Corporate Bond Index,7.77,6.54,7.45,0.16,12,2,3,1,3,1,2,3,ICICI Pru Corp Bond Fund(G),Debt : Corporate Bond,21,21,21,21,21,21,18,13,0.2,0.32,0.78,1.97,7.0,7.31,6.01,7.06,,,,,,,,
Kotak Money Market Fund(G),1999,Kotak Mahindra Mutual Fund,0.44,1.42,2.85,7.16,CRISIL Money Market Index,7.41,6.23,6.63,0.48,10,6,7,6,7,8,7,7,Kotak Money Market Fund(G),Debt : Money Market,24,24,23,23,23,21,17,13,0.47,0.42,1.38,2.78,6.99,7.18,6.04,6.48,,,,,,,,
SBI ELSS Tax Saver Fund-Reg(G),2815,SBI Mutual Fund,-1.93,0.07,3.77,7.44,BSE 500 - TRI,23.77,19.44,15.99,-1.63,18,7,5,12,19,1,10,8,SBI ELSS Tax Saver Fund-Reg(G),Equity : Tax Saving (ELSS),57,57,57,57,57,54,51,31,-2.07,-2.99,-2.21,0.86,5.62,16.94,15.85,14.52,,,,,,,,
ICICI Pru Equity-Arbitrage Fund(G),1467,ICICI Prudential Mutual Fund,0.5,1.56,2.85,6.33,Nifty 50 Arbitrage,7.02,5.92,5.81,0.68,12,9,10,12,6,5,6,6,ICICI Pru Equity-Arbitrage Fund(G),Hybrid : Arbitrage,34,34,33,31,30,24,24,14,0.66,0.48,1.51,2.79,6.04,6.81,5.66,5.72,0.72,2.03,3.79,7.5,7.73,6.38,,9.4
Axis Midcap Fund-Reg(G),13049,Axis Mutual Fund,-1.59,-2.6,-0.53,7.61,BSE 150 MidCap - TRI,19.69,16.48,17.06,-0.87,7,5,17,24,19,24,19,7,Axis Midcap Fund-Reg(G),Equity : Mid Cap,32,32,32,31,30,30,24,20,-1.8,-2.78,-2.65,1.02,7.6,21.75,19.35,16.8,,,,,,,,
ICICI Pru Savings Fund(G),1500,ICICI Prudential Mutual Fund,0.42,1.41,2.95,7.48,NIFTY Low Duration Debt Index,7.73,6.37,7.2,0.44,4,2,1,1,2,1,2,1,ICICI Pru Savings Fund(G),Debt : Low Duration,26,26,26,25,20,20,20,19,0.39,0.37,1.21,2.61,6.93,7.07,5.91,6.39,,,,,,,,
Aditya Birla SL Large Cap Fund-Reg(G),447,Aditya Birla Sun Life Mutual Fund,-2.94,-0.9,2.74,8.65,NIFTY 100 - TRI,15.54,13.45,13.56,-2.24,31,30,23,21,14,16,10,16,Aditya Birla SL Large Cap Fund-Reg(G),Equity : Large Cap,39,39,39,39,38,36,33,28,-1.66,-2.46,-0.85,2.78,7.34,15.25,12.64,13.51,,,,,,,,
Kotak Large & Midcap Fund(G),2069,Kotak Mahindra Mutual Fund,-0.73,1.08,5.22,12.5,NIFTY LargeMidcap 250 - TRI,19.98,17.57,16.76,0.47,2,2,3,4,3,10,7,2,Kotak Large & Midcap Fund(G),Equity : Large & Mid Cap,33,33,33,33,31,26,26,20,-1.84,-2.7,-2.02,1.59,7.39,18.72,16.43,15.37,,,,,,,,
Quant Small Cap Fund(G),876,Quant Mutual Fund,-5.35,-7.4,-4.87,-1.73,Nifty Smallcap 250 - TRI,19.47,26.45,18.44,-5.42,33,33,27,22,21,9,1,3,Quant Small Cap Fund(G),Equity : Small Cap,33,33,31,31,30,24,22,13,-2.82,-3.77,-6.01,-3.42,1.25,18.8,20.61,17.1,,,,,,,,
ICICI Pru Dynamic Asset Allocation Active FOF(G),1704,ICICI Prudential Mutual Fund,-1.07,0.32,3.14,8.9,CRISIL Hybrid 50+50 - Moderate Index,13.44,12.35,12.84,-0.52,63,57,53,37,31,33,15,8,ICICI Pru Dynamic Asset Allocation Active FOF(G),FoFs : Domestic,92,92,87,79,61,51,32,23,1.54,0.18,9.05,17.8,25.95,16.98,12.12,10.94,,,,,,,,
HDFC Large and Mid Cap Fund-Reg(G),2271,HDFC Mutual Fund,-2.72,-2.1,2.49,8.15,NIFTY LargeMidcap 250 - TRI,20.27,19.11,16.08,-1.67,17,21,22,16,14,9,5,8,HDFC Large and Mid Cap Fund-Reg(G),Equity : Large & Mid Cap,33,33,33,33,31,26,26,20,-1.84,-2.7,-2.02,1.59,7.39,18.72,16.43,15.37,,,,,,,,
Nippon India Silver ETF,46199,Nippon India Mutual Fund,5.34,70.52,120.35,156.39,Silver,51.17,,,9.32,28,28,7,7,9,2,,,Nippon India Silver ETF,Gold : ETFs,40,40,39,36,31,18,11,11,12.24,8.95,42.76,77.39,107.44,41.8,25.15,17.25,,,,,,,,
Aditya Birla SL Money Manager Fund(G),394,Aditya Birla Sun Life Mutual Fund,0.37,1.33,2.78,7.07,CRISIL Money Market Index,7.43,6.28,6.79,0.42,23,23,17,14,11,5,3,1,Aditya Birla SL Money Manager Fund(G),Debt : Money Market,24,24,23,23,23,21,17,13,0.47,0.42,1.38,2.78,6.99,7.18,6.04,6.48,,,,,,,,
CPSE ETF,27621,Nippon India Mutual Fund,4.79,7.08,10.33,18.01,Nifty CPSE - TRI,38.27,35.88,17.5,8.7,1,1,8,19,32,2,1,2,CPSE ETF,Equity : ETFs,232,233,215,204,173,124,73,38,-1.19,-2.21,-0.08,5.13,9.63,17.32,14.32,14.76,,,,,,,,
Aditya Birla SL Corp Bond Fund(G),453,Aditya Birla Sun Life Mutual Fund,0.33,0.75,1.79,6.63,NIFTY Corporate Bond Index,7.55,6.41,7.56,0.17,11,9,12,16,17,7,3,1,Aditya Birla SL Corp Bond Fund(G),Debt : Corporate Bond,21,21,21,21,21,21,18,13,0.2,0.32,0.78,1.97,7.0,7.31,6.01,7.06,,,,,,,,
ICICI Pru Large & Mid Cap Fund(G),1608,ICICI Prudential Mutual Fund,-2.42,-0.39,5.97,10.06,NIFTY LargeMidcap 250 - TRI,21.21,20.97,16.71,-1.47,13,14,7,2,6,5,1,4,ICICI Pru Large & Mid Cap Fund(G),Equity : Large & Mid Cap,33,33,33,33,31,26,26,20,-1.84,-2.7,-2.02,1.59,7.39,18.72,16.43,15.37,,,,,,,,
Invesco India Arbitrage Fund-Reg(G),2167,Invesco Mutual Fund,0.48,1.56,2.9,6.29,Nifty 50 Arbitrage,7.07,6.08,5.82,0.61,29,16,9,7,9,4,3,3,Invesco India Arbitrage Fund-Reg(G),Hybrid : Arbitrage,34,34,33,31,30,24,24,14,0.66,0.48,1.51,2.79,6.04,6.81,5.66,5.72,0.72,2.03,3.79,7.5,7.73,6.38,,9.4
Mirae Asset ELSS Tax Saver Fund-Reg(G),33536,Mirae Asset Mutual Fund,-2.46,-1.29,3.82,10.53,NIFTY 500 - TRI,17.5,14.8,18.11,-2.16,36,20,22,11,5,22,28,2,Mirae Asset ELSS Tax Saver Fund-Reg(G),Equity : Tax Saving (ELSS),57,57,57,57,57,54,51,31,-2.07,-2.99,-2.21,0.86,5.62,16.94,15.85,14.52,,,,,,,,
ICICI Pru BSE Sensex ETF,2848,ICICI Prudential Mutual Fund,-2.45,-0.11,3.56,7.69,BSE SENSEX - TRI,12.37,11.73,14.23,-1.88,157,127,114,122,103,101,48,32,ICICI Pru BSE Sensex ETF,Equity : ETFs,232,233,215,204,173,124,73,38,-1.19,-2.21,-0.08,5.13,9.63,17.32,14.32,14.76,,,,,,,,
Axis Small Cap Fund-Reg(G),21651,Axis Mutual Fund,-3.96,-6.09,-3.34,1.76,Nifty Smallcap 250 - TRI,17.18,19.65,18.25,-3.11,20,20,17,16,16,15,15,4,Axis Small Cap Fund-Reg(G),Equity : Small Cap,33,33,31,31,30,24,22,13,-2.82,-3.77,-6.01,-3.42,1.25,18.8,20.61,17.1,,,,,,,,
HDFC Focused Fund-Reg(G),1129,HDFC Mutual Fund,-1.63,-0.09,4.67,11.92,NIFTY 500 - TRI,21.63,21.79,16.05,-0.38,5,6,5,5,3,5,2,5,HDFC Focused Fund-Reg(G),Equity : Multi Cap,45,45,45,45,42,31,21,14,-1.86,-2.7,-2.41,1.07,5.97,17.73,14.96,15.03,,,,,,,,
UTI Nifty 50 Index Fund-Reg(G),3641,UTI Mutual Fund,-2.27,0.23,4.27,9.18,NIFTY 50 - TRI,13.72,12.39,14.07,-1.83,134,75,48,48,45,58,14,2,UTI Nifty 50 Index Fund-Reg(G),Equity : Index Funds,227,228,219,210,179,86,34,18,-1.71,-2.69,-1.24,2.6,6.66,17.61,13.34,13.56,,,,,,,,
Nippon India Liquid Fund(G),2637,Nippon India Mutual Fund,0.48,1.46,2.9,6.36,Nifty Liquid Fund Index,6.9,5.8,6.12,0.56,32,21,17,20,17,17,17,9,Nippon India Liquid Fund(G),Debt : Liquid,44,44,42,40,38,36,34,29,0.56,0.48,1.43,2.86,6.26,6.83,5.77,6.01,,,,,,,,
Canara Rob Large and Mid Cap Fund-Reg(G),523,Canara Robeco Mutual Fund,-2.85,-4.5,-2.82,2.41,NIFTY LargeMidcap 250 - TRI,16.13,14.21,16.01,-2.03,21,22,28,29,28,23,22,10,Canara Rob Large and Mid Cap Fund-Reg(G),Equity : Large & Mid Cap,33,33,33,33,31,26,26,20,-1.84,-2.7,-2.02,1.59,7.39,18.72,16.43,15.37,,,,,,,,
Aditya Birla SL Arbitrage Fund(G),7889,Aditya Birla Sun Life Mutual Fund,0.48,1.54,2.84,6.32,Nifty 50 Arbitrage - TRI,6.98,5.86,5.76,0.61,28,19,13,17,7,8,8,8,Aditya Birla SL Arbitrage Fund(G),Hybrid : Arbitrage,34,34,33,31,30,24,24,14,0.66,0.48,1.51,2.79,6.04,6.81,5.66,5.72,,,,,,,,
Aditya Birla SL Flexi Cap Fund-Reg(G),445,Aditya Birla Sun Life Mutual Fund,-2.05,0.08,5.64,12.62,NIFTY 500 - TRI,18.36,14.78,15.32,-1.53,14,9,6,2,2,13,11,7,Aditya Birla SL Flexi Cap Fund-Reg(G),Equity : Flexi Cap,52,52,51,50,48,39,29,21,-1.8,-2.61,-1.86,1.4,5.76,16.58,14.29,14.73,,,,,,,,
BHARAT Bond ETF - April 2030,44421,Edelweiss Mutual Fund,0.33,0.65,2.12,7.62,NIFTY BHARAT Bond Index - April 2030,8.08,7.01,,0.25,25,29,27,18,4,3,1,,BHARAT Bond ETF - April 2030,Debt : ETFs,33,33,33,32,30,14,9,2,0.38,0.4,1.07,2.15,6.23,7.36,5.68,5.83,,,,,,,,
UTI Liquid Fund-Reg(G),3590,UTI Mutual Fund,0.49,1.47,2.93,6.4,Nifty Liquid Fund Index,6.94,5.85,6.13,0.57,20,12,7,7,6,8,7,7,UTI Liquid Fund-Reg(G),Debt : Liquid,44,44,42,40,38,36,34,29,0.56,0.48,1.43,2.86,6.26,6.83,5.77,6.01,,,,,,,,
HDFC Low Duration Fund(G),1114,HDFC Mutual Fund,0.39,1.22,2.63,6.97,NIFTY Low Duration Debt Index,7.16,5.94,6.68,0.45,3,6,11,10,5,5,6,5,HDFC Low Duration Fund(G),Debt : Low Duration,26,26,26,25,20,20,20,19,0.39,0.37,1.21,2.61,6.93,7.07,5.91,6.39,,,,,,,,
HDFC Hybrid Equity Fund(G),1311,HDFC Mutual Fund,-2.0,-1.37,0.42,5.78,NIFTY 50 Hybrid Composite Debt 65:35 Index,11.53,11.86,12.48,-1.82,54,46,45,47,33,28,15,11,HDFC Hybrid Equity Fund(G),Hybrid : Equity Oriented,63,56,56,55,53,52,50,33,-0.79,-1.24,-0.35,1.98,6.37,12.34,10.81,10.69,,,,,,,,
HDFC Arbitrage-WP(G),1103,HDFC Mutual Fund,0.49,1.58,2.9,6.24,Nifty 50 Arbitrage,7.02,5.88,5.65,0.63,24,14,4,6,12,6,7,12,HDFC Arbitrage-WP(G),Hybrid : Arbitrage,34,34,33,31,30,24,24,14,0.66,0.48,1.51,2.79,6.04,6.81,5.66,5.72,0.72,2.03,3.79,7.5,7.73,6.38,,9.4
SBI Multicap Fund-Reg(G),46405,SBI Mutual Fund,-2.65,-3.79,-2.41,3.32,Nifty500 Multicap 50:25:25 - TRI,17.0,,,-1.76,20,26,38,39,33,20,,,SBI Multicap Fund-Reg(G),Equity : Multi Cap,45,45,45,45,42,31,21,14,-1.86,-2.7,-2.41,1.07,5.97,17.73,14.96,15.03,,,,,,,,
SBI Flexicap Fund-Reg(G),2799,SBI Mutual Fund,-3.13,-0.9,3.32,4.68,BSE 500 - TRI,13.46,11.86,13.49,-1.86,24,41,15,12,33,35,23,17,SBI Flexicap Fund-Reg(G),Equity : Flexi Cap,52,52,51,50,48,39,29,21,-1.8,-2.61,-1.86,1.4,5.76,16.58,14.29,14.73,,,,,,,,
Nippon India ETF BSE Sensex,30127,Nippon India Mutual Fund,-2.46,-0.11,3.55,7.67,BSE SENSEX - TRI,12.36,11.71,14.26,-2.2,166,129,117,126,106,102,49,30,Nippon India ETF BSE Sensex,Equity : ETFs,232,233,215,204,173,124,73,38,-1.19,-2.21,-0.08,5.13,9.63,17.32,14.32,14.76,,,,,,,,
UTI Flexi Cap Fund-Reg(G),3461,UTI Mutual Fund,-3.55,-5.05,-3.33,-0.66,NIFTY 500 - TRI,11.15,8.04,12.74,-2.97,50,50,48,46,45,37,29,18,UTI Flexi Cap Fund-Reg(G),Equity : Flexi Cap,52,52,51,50,48,39,29,21,-1.8,-2.61,-1.86,1.4,5.76,16.58,14.29,14.73,,,,,,,,
SBI Midcap Fund-Reg(G),2789,SBI Mutual Fund,-2.53,-0.22,2.2,2.7,Nifty Midcap 150 - TRI,17.74,18.43,14.98,-1.24,11,13,5,13,26,26,17,19,SBI Midcap Fund-Reg(G),Equity : Mid Cap,32,32,32,31,30,30,24,20,-1.8,-2.78,-2.65,1.02,7.6,21.75,19.35,16.8,,,,,,,,
Kotak Multicap Fund-Reg(G),45336,Kotak Mahindra Mutual Fund,-4.05,-2.11,5.07,7.9,Nifty500 Multicap 50:25:25 - TRI,23.06,,,-3.02,42,42,20,4,11,1,,,Kotak Multicap Fund-Reg(G),Equity : Multi Cap,45,45,45,45,42,31,21,14,-1.86,-2.7,-2.41,1.07,5.97,17.73,14.96,15.03,,,,,,,,
Aditya Birla SL Savings Fund-Reg(G),468,Aditya Birla Sun Life Mutual Fund,0.42,1.37,2.91,7.14,NIFTY Ultra Short Duration Debt Index,7.4,6.27,7.03,0.47,6,7,5,3,1,1,2,1,Aditya Birla SL Savings Fund-Reg(G),Debt : Ultra Short Duration,31,31,31,30,26,24,23,13,0.43,0.38,1.29,2.69,6.46,6.74,5.71,6.04,,,,,,,,
HDFC Nifty 50 Index Fund(G)(Post Addendum),12633,HDFC Mutual Fund,-2.28,0.2,4.23,9.08,NIFTY 50 - TRI,13.64,12.27,13.91,-1.83,135,76,54,51,51,60,15,3,HDFC Nifty 50 Index Fund(G)(Post Addendum),Equity : Index Funds,227,228,219,210,179,86,34,18,-1.71,-2.69,-1.24,2.6,6.66,17.61,13.34,13.56,,,,,,,,
ICICI Pru Short Term Fund(G),1682,ICICI Prudential Mutual Fund,0.38,1.2,2.55,7.56,Nifty Short Duration Debt Index,7.65,6.47,7.44,0.21,23,9,7,9,2,1,3,1,ICICI Pru Short Term Fund(G),Debt : Short Duration,33,33,33,33,29,23,20,18,0.26,0.36,0.98,2.27,6.98,7.11,6.07,6.61,,,,,,,,
Axis Money Market Fund-Reg(G),21218,Axis Mutual Fund,0.45,1.44,2.88,7.23,Nifty Money Market Index,7.45,6.25,,0.5,6,4,4,4,4,3,5,,Axis Money Market Fund-Reg(G),Debt : Money Market,24,24,23,23,23,21,17,13,0.47,0.42,1.38,2.78,6.99,7.18,6.04,6.48,,,,,,,,
SBI Corp Bond Fund-Reg(G),40450,SBI Mutual Fund,0.3,0.76,1.93,7.11,NIFTY Corporate Bond Index,7.28,5.91,,0.27,7,16,11,9,10,12,12,,SBI Corp Bond Fund-Reg(G),Debt : Corporate Bond,21,21,21,21,21,21,18,13,0.2,0.32,0.78,1.97,7.0,7.31,6.01,7.06,,,,,,,,
Nippon India Money Market Fund(G),2628,Nippon India Mutual Fund,0.42,1.39,2.83,7.2,Nifty Money Market Index,7.44,6.29,6.71,0.48,11,11,9,9,5,4,2,3,Nippon India Money Market Fund(G),Debt : Money Market,24,24,23,23,23,21,17,13,0.47,0.42,1.38,2.78,6.99,7.18,6.04,6.48,,,,,,,,
