Mahindra Manulife Large Cap Fund-Reg(G),38073,Mahindra Manulife Mutual Fund,1.31,12.05,2.53,7.39,NIFTY 100 - TRI,15.92,21.52,,4.61,5,32,25,9,19,23,17,,Mahindra Manulife Large Cap Fund-Reg(G),Equity : Large Cap,38,39,38,38,37,34,31,28,1.91,2.29,12.83,0.78,6.77,17.35,21.78,12.19,,,,,,,,
PGIM India Large and Mid Cap Fund(G),48543,PGIM India Mutual Fund,3.14,14.21,2.62,11.99,NIFTY LargeMidcap 250 - TRI,,,,1.5,4,23,19,2,5,,,,PGIM India Large and Mid Cap Fund(G),Equity : Large & Mid Cap,31,31,31,31,29,26,25,19,-0.49,3.77,14.9,-0.37,8.36,21.23,26.33,14.28,,,,,,,,
HSBC Medium Duration Fund-Reg(G),31014,HSBC Mutual Fund,1.17,4.01,5.93,10.04,NIFTY Medium Duration Debt Index,7.96,7.23,7.16,5.18,3,8,3,3,5,6,5,6,HSBC Medium Duration Fund-Reg(G),Debt : Medium Duration,29,29,29,29,29,18,12,12,4.18,0.99,3.02,4.91,9.1,7.67,7.2,6.84,,,,,,,,
HSBC Equity Savings Fund-Reg(G),15304,HSBC Mutual Fund,2.43,6.46,-1.98,7.47,NIFTY 50 Equity Savings Index,12.76,15.25,8.52,-4.77,55,18,39,53,40,30,30,21,HSBC Equity Savings Fund-Reg(G),Hybrid : Equity Oriented,55,56,55,55,55,54,51,29,6.48,6.43,13.13,6.55,12.57,14.45,16.7,10.19,,,,,,,,
Nippon India US Equity Opp Fund(G),19246,Nippon India Mutual Fund,6.37,-4.55,-0.97,9.96,S&P 500 - TRI,14.23,12.88,,-0.6,6,5,7,7,5,3,2,,Nippon India US Equity Opp Fund(G),Equity : International,8,8,8,8,8,8,6,4,2.4,8.49,0.3,2.67,11.2,12.94,11.19,8.0,,,,,,,,
SBI Magnum Comma Fund-Reg(G),2750,SBI Mutual Fund,4.33,17.26,1.72,3.96,NIFTY COMMODITIES - TRI,16.7,26.16,15.23,3.82,17,37,18,16,38,25,12,3,SBI Magnum Comma Fund-Reg(G),Equity : Thematic,89,98,96,81,62,38,21,9,-1.26,3.87,14.67,-1.49,5.23,21.05,26.68,13.94,,,,,,,,
Mirae Asset Nifty Next 50 ETF,44314,Mirae Asset Mutual Fund,3.05,17.49,-4.34,-1.63,NIFTY NEXT 50 - TRI,21.28,23.72,,-1.1,123,73,34,134,131,29,28,,Mirae Asset Nifty Next 50 ETF,Equity : ETFs,170,185,177,168,150,103,63,28,2.01,3.27,13.64,0.77,7.19,18.97,24.38,12.41,,,,,,,,
Union Aggressive Hybrid Fund-Reg(G),44512,Union Mutual Fund,2.84,12.63,2.13,8.17,CRISIL Hybrid 35+65 - Aggressive Index,14.98,,,1.66,37,13,8,28,33,21,,,Union Aggressive Hybrid Fund-Reg(G),Hybrid : Equity Oriented,55,56,55,55,55,54,51,29,6.48,6.43,13.13,6.55,12.57,14.45,16.7,10.19,,,,,,,,
Motilal Oswal Nifty Bank Index Fund-Reg(G),43789,Motilal Oswal Mutual Fund,0.06,14.54,6.45,12.29,NIFTY BANK - TRI,15.59,23.04,,8.96,11,184,95,12,8,43,9,,Motilal Oswal Nifty Bank Index Fund-Reg(G),Equity : Index Funds,175,194,187,167,123,68,32,18,0.59,3.51,15.23,-0.43,4.73,18.61,22.89,12.09,,,,,,,,
JM Small Cap Fund-Reg(G),48452,JM Financial Mutual Fund,5.75,17.84,-5.73,,Nifty Smallcap 250 - TRI,,,,-6.43,20,17,14,17,,,,,JM Small Cap Fund-Reg(G),Equity : Small Cap,29,30,30,29,27,23,21,13,-5.65,6.19,17.6,-5.29,8.26,24.03,35.64,16.99,,,,,,,,
Aditya Birla SL Equity Savings Fund-Reg(G),30757,Aditya Birla Sun Life Mutual Fund,1.26,4.37,4.22,8.11,NIFTY 50 Equity Savings Index - TRI,9.59,11.05,7.64,3.72,10,41,50,8,35,48,44,25,Aditya Birla SL Equity Savings Fund-Reg(G),Hybrid : Equity Oriented,55,56,55,55,55,54,51,29,6.48,6.43,13.13,6.55,12.57,14.45,16.7,10.19,,,,,,,,
Navi Nifty Bank Index Fund-Reg(G),45873,Navi Mutual Fund,0.06,14.57,6.45,12.3,NIFTY BANK - TRI,15.5,,,8.99,9,183,90,11,7,48,,,Navi Nifty Bank Index Fund-Reg(G),Equity : Index Funds,175,194,187,167,123,68,32,18,0.59,3.51,15.23,-0.43,4.73,18.61,22.89,12.09,,,,,,,,
Nippon India Silver ETF FOF-Reg(G),46198,Nippon India Mutual Fund,1.79,4.74,11.06,3.41,Silver,14.37,,,12.73,7,33,48,4,50,29,,,Nippon India Silver ETF FOF-Reg(G),FoFs : Domestic,61,67,62,61,56,47,28,23,4.73,2.69,9.86,4.34,8.96,15.08,16.99,10.28,,,,,,,,
Aditya Birla SL ESG Integration Strategy Fund-Reg(G),44736,Aditya Birla Sun Life Mutual Fund,2.83,11.93,-1.47,12.07,NIFTY100 ESG - TRI,16.21,,,-1.63,51,69,78,44,9,28,,,Aditya Birla SL ESG Integration Strategy Fund-Reg(G),Equity : Thematic,89,98,96,81,62,38,21,9,-1.26,3.87,14.67,-1.49,5.23,21.05,26.68,13.94,,,,,,,,
Edelweiss Technology Fund-Reg(G),43844,Edelweiss Mutual Fund,7.28,5.35,-7.54,10.55,BSE TECk Index - TRI,,,,-8.87,7,4,8,7,6,,,,Edelweiss Technology Fund-Reg(G),Equity : Sectoral - Technology,12,12,12,12,9,5,5,4,-8.52,6.74,7.76,-6.97,12.99,16.22,27.78,16.7,,,,,,,,
HDFC Silver ETF,46223,HDFC Mutual Fund,1.67,4.47,11.83,3.42,Silver,,,,13.3,25,9,28,20,27,,,,HDFC Silver ETF,Gold : ETFs,31,35,32,31,28,14,11,11,20.04,1.24,9.4,19.62,20.79,20.55,14.17,12.27,,,,,,,,
Bajaj Finserv Multi Cap Fund-Reg(G),49459,Bajaj Finserv Mutual Fund,3.17,10.54,,,Nifty500 Multicap 50:25:25 - TRI,,,,,,31,40,,,,,,Bajaj Finserv Multi Cap Fund-Reg(G),Equity : Multi Cap,42,43,43,41,37,28,20,14,-1.0,3.77,13.98,-1.05,8.15,20.3,25.08,13.89,,,,,,,,
Unifi Dynamic Asset Allocation Fund-Reg(G),49692,Unifi Mutual Fund,0.67,,,,CRISIL Hybrid 50+50 - Moderate Index,,,,,,34,,,,,,,Unifi Dynamic Asset Allocation Fund-Reg(G),Hybrid : Dynamic Asset Allocation,33,34,33,33,32,22,19,11,1.74,1.81,8.61,1.68,6.87,13.37,14.66,9.7,,,,,,,,
Aditya Birla SL Gold Fund(G),16220,Aditya Birla Sun Life Mutual Fund,0.71,11.99,24.24,29.95,Gold-India,21.41,13.7,11.87,24.26,3,16,11,11,11,8,8,7,Aditya Birla SL Gold Fund(G),Gold : MFs,17,18,18,17,16,10,10,10,21.42,1.11,10.82,21.89,24.95,21.54,13.76,11.88,,,,,,,,
Aditya Birla SL Silver ETF,46194,Aditya Birla Sun Life Mutual Fund,1.68,4.52,11.17,4.66,Silver,15.54,,,13.29,26,2,21,22,19,12,,,Aditya Birla SL Silver ETF,Gold : ETFs,31,35,32,31,28,14,11,11,20.04,1.24,9.4,19.62,20.79,20.55,14.17,12.27,,,,,,,,
ICICI Pru Nifty 200 Momentum 30 ETF,46682,ICICI Prudential Mutual Fund,3.92,13.58,-10.91,-12.52,Nifty200 Momentum 30 - TRI,,,,-6.81,150,61,83,157,150,,,,ICICI Pru Nifty 200 Momentum 30 ETF,Equity : ETFs,170,185,177,168,150,103,63,28,2.01,3.27,13.64,0.77,7.19,18.97,24.38,12.41,,,,,,,,
Edelweiss Equity Savings Fund-Reg(G),30730,Edelweiss Mutual Fund,1.08,5.06,4.29,9.69,NIFTY 50 Equity Savings Index,11.34,11.75,8.82,2.52,27,44,45,7,17,41,40,20,Edelweiss Equity Savings Fund-Reg(G),Hybrid : Equity Oriented,55,56,55,55,55,54,51,29,6.48,6.43,13.13,6.55,12.57,14.45,16.7,10.19,,,,,,,,
Tata Gold ETF,48435,Tata Mutual Fund,1.58,13.0,24.91,31.56,Gold-India,,,,24.37,7,14,3,9,4,,,,Tata Gold ETF,Gold : ETFs,31,35,32,31,28,14,11,11,20.04,1.24,9.4,19.62,20.79,20.55,14.17,12.27,,,,,,,,
Kotak Nifty Alpha 50 ETF,45687,Kotak Mahindra Mutual Fund,5.7,19.49,-9.94,-4.75,Nifty Alpha 50 - TRI,19.57,,,-9.27,160,25,18,152,139,39,,,Kotak Nifty Alpha 50 ETF,Equity : ETFs,170,185,177,168,150,103,63,28,2.01,3.27,13.64,0.77,7.19,18.97,24.38,12.41,,,,,,,,
Motilal Oswal Nifty 500 Momentum 50 Index Fund-Reg(G),48961,Motilal Oswal Mutual Fund,4.13,15.46,-12.37,,Nifty500 Momentum 50 - TRI,,,,-8.66,165,63,79,161,,,,,Motilal Oswal Nifty 500 Momentum 50 Index Fund-Reg(G),Equity : Index Funds,175,194,187,167,123,68,32,18,0.59,3.51,15.23,-0.43,4.73,18.61,22.89,12.09,,,,,,,,
Kotak Nifty Next 50 Index Fund-Reg(G),44443,Kotak Mahindra Mutual Fund,2.99,17.2,-4.57,-2.21,NIFTY NEXT 50 - TRI,20.71,,,-1.44,114,96,56,118,97,14,,,Kotak Nifty Next 50 Index Fund-Reg(G),Equity : Index Funds,175,194,187,167,123,68,32,18,0.59,3.51,15.23,-0.43,4.73,18.61,22.89,12.09,,,,,,,,
ICICI Pru Nifty Bank Index Fund-Reg(G),45994,ICICI Prudential Mutual Fund,0.07,14.57,6.49,12.35,NIFTY BANK - TRI,15.51,,,9.02,8,181,92,10,6,47,,,ICICI Pru Nifty Bank Index Fund-Reg(G),Equity : Index Funds,175,194,187,167,123,68,32,18,0.59,3.51,15.23,-0.43,4.73,18.61,22.89,12.09,,,,,,,,
PGIM India Large Cap Fund(G),758,PGIM India Mutual Fund,1.09,12.38,2.26,6.65,NIFTY 100 - TRI,14.48,18.79,10.33,2.75,18,34,21,12,21,31,29,26,PGIM India Large Cap Fund(G),Equity : Large Cap,38,39,38,38,37,34,31,28,1.91,2.29,12.83,0.78,6.77,17.35,21.78,12.19,,,,,,,,
SBI FMP-67-1467D-Reg(G),46703,SBI Mutual Fund,0.87,2.5,4.39,8.52,CRISIL Medium to Long Term Debt Index,,,,3.8,32,31,32,32,34,,,,SBI FMP-67-1467D-Reg(G),Debt : FTP/FMP,92,93,93,91,91,49,18,4,3.63,0.84,2.46,4.34,8.42,7.45,5.64,6.19,,,,,,,,
Sundaram Overnight Fund-Reg(G),42000,Sundaram Mutual Fund,0.46,1.46,3.1,6.41,Nifty 1D Rate Index,6.3,5.0,,2.51,8,24,8,12,17,21,23,,Sundaram Overnight Fund-Reg(G),Debt : Overnight,34,34,34,34,34,28,27,3,2.49,0.46,1.44,3.07,6.39,6.3,5.03,5.55,0.47,1.48,3.13,6.52,6.44,5.18,,6.2
Mahindra Manulife Low Duration Fund-Reg(G),36894,Mahindra Manulife Mutual Fund,0.68,2.35,4.02,7.71,CRISIL Low Duration Debt Index,6.75,5.49,,3.43,20,19,20,18,17,18,20,,Mahindra Manulife Low Duration Fund-Reg(G),Debt : Low Duration,20,23,20,20,20,20,20,19,3.64,0.72,2.51,4.23,8.03,7.0,6.17,6.54,0.72,2.36,4.25,8.32,,,,8.88
Motilal Oswal Nifty Midcap 100 ETF,13595,Motilal Oswal Mutual Fund,5.02,19.3,1.64,9.85,Nifty Midcap 100 - TRI,27.96,34.64,16.21,0.6,106,44,20,79,41,9,5,2,Motilal Oswal Nifty Midcap 100 ETF,Equity : ETFs,170,185,177,168,150,103,63,28,2.01,3.27,13.64,0.77,7.19,18.97,24.38,12.41,,,,,,,,
Mirae Asset S&P 500 Top 50 ETF FoF-Reg(G),45836,Mirae Asset Mutual Fund,4.57,-4.22,4.02,23.73,S&P 500 Top 50 TRI,26.25,,,-6.83,56,43,54,31,5,2,,,Mirae Asset S&P 500 Top 50 ETF FoF-Reg(G),FoFs : Overseas,57,57,57,57,57,51,27,24,5.7,7.23,1.96,5.94,13.33,13.63,11.25,6.96,,,,,,,,
UTI Nifty200 Quality 30 Index Fund-Reg(G),49144,UTI Mutual Fund,4.23,13.62,-2.5,,NIFTY200 Quality 30 - TRI,,,,-0.27,103,56,107,110,,,,,UTI Nifty200 Quality 30 Index Fund-Reg(G),Equity : Index Funds,175,194,187,167,123,68,32,18,0.59,3.51,15.23,-0.43,4.73,18.61,22.89,12.09,,,,,,,,
Mahindra Manulife Multi Asset Allocation Fund-Reg(G),48449,Mahindra Manulife Mutual Fund,2.2,9.8,5.56,10.18,NIFTY 500 - TRI,,,,5.94,9,11,14,8,13,,,,Mahindra Manulife Multi Asset Allocation Fund-Reg(G),Hybrid : Multi Asset Allocation,28,29,29,26,24,10,8,7,4.25,2.16,9.52,3.64,8.81,16.44,21.01,12.29,,,,,,,,
Quant BFSI Fund-Reg(G),47989,Quant Mutual Fund,4.37,17.31,5.4,-0.77,Nifty Financial Services - TRI,,,,5.5,19,1,2,15,20,,,,Quant BFSI Fund-Reg(G),Equity : Sectoral - Financial Services,21,22,22,21,20,14,11,10,8.23,1.78,15.61,6.62,14.94,20.31,25.21,12.75,,,,,,,,
DSP NIFTY 1D Rate Liquid ETF,38904,DSP Mutual Fund,0.45,1.39,2.97,6.16,Nifty 1D Rate Index,6.01,4.67,,2.39,21,21,20,23,21,13,6,,DSP NIFTY 1D Rate Liquid ETF,Debt : ETFs,31,33,31,31,26,14,7,2,4.11,0.91,2.84,4.87,9.09,7.96,5.44,6.1,0.47,1.48,3.13,6.52,6.44,5.18,,6.2
HSBC Financial Services Fund-Reg(G),49575,HSBC Mutual Fund,2.21,12.34,,,BSE Financial Services - TRI,,,,,,6,22,,,,,,HSBC Financial Services Fund-Reg(G),Equity : Sectoral - Financial Services,21,22,22,21,20,14,11,10,8.23,1.78,15.61,6.62,14.94,20.31,25.21,12.75,,,,,,,,
DSP Floater Fund-Reg(G),45396,DSP Mutual Fund,0.98,3.57,5.28,10.23,CRISIL Short Duration Debt Index,8.21,,,4.71,5,6,5,5,2,2,,,DSP Floater Fund-Reg(G),Debt : Floater,12,12,12,12,12,12,7,5,4.47,0.99,3.38,5.1,9.45,7.77,6.55,7.16,,,,,,,,
Mirae Asset Nifty Smallcap 250 Momentum Quality 100 ETF,48496,Mirae Asset Mutual Fund,6.39,17.74,-10.26,-3.14,Nifty Smallcap250 Momentum Quality 100 - TRI,,,,-8.39,156,19,30,153,137,,,,Mirae Asset Nifty Smallcap 250 Momentum Quality 100 ETF,Equity : ETFs,170,185,177,168,150,103,63,28,2.01,3.27,13.64,0.77,7.19,18.97,24.38,12.41,,,,,,,,
ICICI Pru CRISIL-IBX Financial Services 3-6 Months Debt Index Fund-Reg(G),49708,ICICI Prudential Mutual Fund,0.59,,,,CRISIL-IBX Financial Services 3 to 6 Months Debt Index,,,,,,16,,,,,,,ICICI Pru CRISIL-IBX Financial Services 3-6 Months Debt Index Fund-Reg(G),Debt : Ultra Short Duration,26,29,26,25,24,24,22,13,3.13,0.58,2.02,3.71,7.3,6.66,5.46,6.19,,,,,,,,
Kotak Nifty SDL Plus AAA PSU Bond Jul 2028 60:40 Index Fund-Reg(G),46730,Kotak Mahindra Mutual Fund,1.34,3.71,5.7,10.13,Nifty SDL Plus AAA PSU Bond Jul 2028 60:40 Index,,,,5.14,24,16,23,24,21,,,,Kotak Nifty SDL Plus AAA PSU Bond Jul 2028 60:40 Index Fund-Reg(G),Debt : Medium to Long Duration,59,60,59,59,52,26,11,11,4.89,1.21,3.6,5.53,9.91,7.86,6.06,6.56,,,,,,,,
HDFC MNC Fund-Reg(G),47648,HDFC Mutual Fund,3.53,11.27,-6.6,-6.21,NIFTY MNC - TRI,,,,-5.1,6,6,4,6,5,,,,HDFC MNC Fund-Reg(G),Equity : Thematic - MNC,6,6,6,6,5,4,4,3,-2.95,5.13,11.87,-3.56,0.68,14.32,18.13,9.65,,,,,,,,
ICICI Pru Nifty 10 yr Benchmark G-Sec ETF,47331,ICICI Prudential Mutual Fund,1.7,5.05,7.42,12.09,Nifty 10 yr Benchmark G-Sec,,,,6.46,3,1,4,3,3,,,,ICICI Pru Nifty 10 yr Benchmark G-Sec ETF,Debt : Gilt (10 Yr Constant Duration),6,6,6,6,6,4,4,4,6.33,1.53,5.17,7.24,11.98,9.16,5.92,8.2,1.4,5.16,7.25,13.44,9.54,5.56,,16.7
Baroda BNP Paribas Business Cycle Fund-Reg(G),45686,Baroda BNP Paribas Mutual Fund,3.09,13.7,-3.27,3.96,BSE 500 - TRI,19.42,,,-3.0,60,60,57,61,39,21,,,Baroda BNP Paribas Business Cycle Fund-Reg(G),Equity : Thematic,89,98,96,81,62,38,21,9,-1.26,3.87,14.67,-1.49,5.23,21.05,26.68,13.94,,,,,,,,
Mirae Asset Nifty 1D Rate Liquid ETF(IDCW),48119,Mirae Asset Mutual Fund,0.45,1.38,2.93,6.15,Nifty 1D Rate Index,,,,2.36,25,24,23,28,22,,,,Mirae Asset Nifty 1D Rate Liquid ETF(IDCW),Debt : ETFs,31,33,31,31,26,14,7,2,4.11,0.91,2.84,4.87,9.09,7.96,5.44,6.1,0.47,1.48,3.13,6.52,6.44,5.18,,6.2
Union Business Cycle Fund-Reg(G),48599,Union Mutual Fund,2.93,13.22,-1.72,0.46,NIFTY 500 - TRI,,,,-2.68,59,66,64,48,48,,,,Union Business Cycle Fund-Reg(G),Equity : Thematic,89,98,96,81,62,38,21,9,-1.26,3.87,14.67,-1.49,5.23,21.05,26.68,13.94,,,,,,,,
Mahindra Manulife Equity Savings Fund-Reg(G),36671,Mahindra Manulife Mutual Fund,1.51,5.68,2.31,6.27,NIFTY 50 Equity Savings Index - TRI,10.26,13.48,,2.43,28,36,43,26,46,47,35,,Mahindra Manulife Equity Savings Fund-Reg(G),Hybrid : Equity Oriented,55,56,55,55,55,54,51,29,6.48,6.43,13.13,6.55,12.57,14.45,16.7,10.19,,,,,,,,
UTI BSE Low Volatility Index Fund-Reg(G),46409,UTI Mutual Fund,1.76,10.27,2.88,3.04,BSE Low Volatility Index - TRI,17.5,,,3.1,63,149,174,50,85,33,,,UTI BSE Low Volatility Index Fund-Reg(G),Equity : Index Funds,175,194,187,167,123,68,32,18,0.59,3.51,15.23,-0.43,4.73,18.61,22.89,12.09,,,,,,,,
Kotak Technology Fund-Reg(G),48587,Kotak Mahindra Mutual Fund,4.4,3.57,-9.37,14.04,BSE TECk Index - TRI,,,,-10.17,10,12,11,10,4,,,,Kotak Technology Fund-Reg(G),Equity : Sectoral - Technology,12,12,12,12,9,5,5,4,-8.52,6.74,7.76,-6.97,12.99,16.22,27.78,16.7,,,,,,,,
Edelweiss Low Duration Fund-Reg(G),49709,Edelweiss Mutual Fund,0.61,,,,CRISIL Low Duration Debt Index,,,,,,23,,,,,,,Edelweiss Low Duration Fund-Reg(G),Debt : Low Duration,20,23,20,20,20,20,20,19,3.64,0.72,2.51,4.23,8.03,7.0,6.17,6.54,0.72,2.36,4.25,8.32,,,,8.88
ICICI Pru Nifty FMCG ETF,45651,ICICI Prudential Mutual Fund,-0.98,10.51,-2.34,3.06,NIFTY FMCG - TRI,15.0,,,-0.88,120,181,143,123,114,92,,,ICICI Pru Nifty FMCG ETF,Equity : ETFs,170,185,177,168,150,103,63,28,2.01,3.27,13.64,0.77,7.19,18.97,24.38,12.41,,,,,,,,
Nippon India Nifty Next 50 Junior BeES FoF-Reg(G),40664,Nippon India Mutual Fund,3.09,16.85,-4.7,-2.22,NIFTY NEXT 50,20.92,23.46,,-1.5,55,16,4,57,54,6,5,,Nippon India Nifty Next 50 Junior BeES FoF-Reg(G),FoFs : Domestic,61,67,62,61,56,47,28,23,4.73,2.69,9.86,4.34,8.96,15.08,16.99,10.28,3.39,17.58,-5.14,-1.43,20.76,22.75,,-4.17
Bajaj Finserv Consumption Fund-Reg(G),49345,Bajaj Finserv Mutual Fund,1.14,10.59,,,Nifty India Consumption - TRI,,,,-5.95,17,16,15,,,,,,Bajaj Finserv Consumption Fund-Reg(G),Equity : Thematic - Consumption,20,22,22,18,17,13,13,9,-2.53,1.58,11.57,-2.95,7.07,18.85,22.75,13.91,,,,,,,,
Motilal Oswal Ultra Short Term Fund-Reg(G),22532,Motilal Oswal Mutual Fund,0.49,1.53,2.95,5.99,CRISIL Ultra Short Term Debt Index,5.65,4.43,3.75,2.47,26,29,26,25,24,24,22,13,Motilal Oswal Ultra Short Term Fund-Reg(G),Debt : Ultra Short Duration,26,29,26,25,24,24,22,13,3.13,0.58,2.02,3.71,7.3,6.66,5.46,6.19,0.64,2.13,4.01,7.99,,,,8.27
Franklin India Banking & PSU Debt Fund(G),28458,Franklin Templeton Mutual Fund,1.06,3.58,5.27,9.38,NIFTY Banking and PSU Debt Index,7.47,6.14,7.31,4.62,16,19,16,16,15,11,11,10,Franklin India Banking & PSU Debt Fund(G),Debt : Banking & PSU,26,26,26,26,26,21,16,16,4.64,1.11,3.62,5.28,9.36,7.49,6.27,7.28,,,,,,,,
LIC MF Multi Asset Allocation Fund-Reg(G),49465,LIC Mutual Fund,2.04,12.21,,,NIFTY 500 - TRI,,,,,,16,3,,,,,,LIC MF Multi Asset Allocation Fund-Reg(G),Hybrid : Multi Asset Allocation,28,29,29,26,24,10,8,7,4.25,2.16,9.52,3.64,8.81,16.44,21.01,12.29,,,,,,,,
Bandhan CRISIL IBX 90:10 SDL Plus Gilt - April 2032 Index Fund-Reg(G),46814,Bandhan Mutual Fund,1.19,4.66,6.68,11.68,CRISIL IBX 90:10 SDL Plus Gilt Index - April 2032,,,,6.26,8,11,24,16,13,,,,Bandhan CRISIL IBX 90:10 SDL Plus Gilt - April 2032 Index Fund-Reg(G),Debt : Long Duration,26,26,26,24,24,4,3,2,5.93,1.13,5.29,6.78,11.54,8.81,5.6,7.17,,,,,,,,
Bank of India Business Cycle Fund-Reg(G),48964,Bank of India Mutual Fund,3.2,16.05,-10.23,,NIFTY 500 - TRI,,,,-7.54,78,57,25,79,,,,,Bank of India Business Cycle Fund-Reg(G),Equity : Thematic,89,98,96,81,62,38,21,9,-1.26,3.87,14.67,-1.49,5.23,21.05,26.68,13.94,,,,,,,,
Canara Rob Ultra Short Term Fund-Reg(G),5902,Canara Robeco Mutual Fund,0.55,1.99,3.63,7.07,CRISIL Ultra Short Term Debt Index,6.38,4.96,5.75,3.08,18,24,17,18,18,19,20,11,Canara Rob Ultra Short Term Fund-Reg(G),Debt : Ultra Short Duration,26,29,26,25,24,24,22,13,3.13,0.58,2.02,3.71,7.3,6.66,5.46,6.19,0.64,2.13,4.01,7.99,,,,8.27
Quantum Liquid Fund-Reg(G),19756,Quantum Mutual Fund,0.5,1.62,3.32,6.83,CRISIL Liquid Debt Index,6.58,5.18,5.74,2.72,34,36,34,34,34,32,31,28,Quantum Liquid Fund-Reg(G),Debt : Liquid,38,38,38,38,37,35,34,29,2.88,0.52,1.73,3.5,7.13,6.81,5.39,6.15,,,,,,,,
Bank of India Mfg & Infra Fund-Reg(G),8484,Bank of India Mutual Fund,5.89,18.93,-3.34,4.01,BSE India Infrastructure Index - TRI,28.19,33.14,16.28,-0.38,7,11,11,13,4,10,12,5,Bank of India Mfg & Infra Fund-Reg(G),Equity : Sectoral - Infrastructure,20,20,20,19,19,19,19,18,-1.15,5.9,19.8,-2.3,0.43,28.43,33.82,15.22,,,,,,,,
ICICI Pru Nifty 200 Momentum 30 Index Fund-Reg(G),46683,ICICI Prudential Mutual Fund,3.87,13.25,-11.07,-12.96,Nifty200 Momentum 30 - TRI,,,,-7.15,157,71,115,159,121,,,,ICICI Pru Nifty 200 Momentum 30 Index Fund-Reg(G),Equity : Index Funds,175,194,187,167,123,68,32,18,0.59,3.51,15.23,-0.43,4.73,18.61,22.89,12.09,,,,,,,,
DSP Nifty 50 Equal Weight ETF,45715,DSP Mutual Fund,2.3,12.6,4.74,7.51,NIFTY50 Equal Weight,19.81,,,5.88,33,94,101,27,92,34,,,DSP Nifty 50 Equal Weight ETF,Equity : ETFs,170,185,177,168,150,103,63,28,2.01,3.27,13.64,0.77,7.19,18.97,24.38,12.41,2.76,12.95,4.01,7.64,19.0,25.29,,13.8
Tata Housing Opportunities Fund-Reg(G),46764,Tata Mutual Fund,4.89,14.92,-5.0,-1.11,Nifty Housing - TRI,,,,-4.42,65,26,34,65,51,,,,Tata Housing Opportunities Fund-Reg(G),Equity : Thematic,89,98,96,81,62,38,21,9,-1.26,3.87,14.67,-1.49,5.23,21.05,26.68,13.94,,,,,,,,
Baroda BNP Paribas Overnight Fund-Reg(G),43376,Baroda BNP Paribas Mutual Fund,0.47,1.46,3.1,6.44,CRISIL Liquid Overnight Index,6.34,5.06,,2.52,7,5,9,8,9,5,6,,Baroda BNP Paribas Overnight Fund-Reg(G),Debt : Overnight,34,34,34,34,34,28,27,3,2.49,0.46,1.44,3.07,6.39,6.3,5.03,5.55,0.47,1.46,3.13,6.52,,,,6.2
ITI Large Cap Fund-Reg(G),44400,ITI Mutual Fund,2.83,13.55,-0.19,1.47,NIFTY 100 - TRI,16.59,,,0.86,30,8,10,29,31,22,,,ITI Large Cap Fund-Reg(G),Equity : Large Cap,38,39,38,38,37,34,31,28,1.91,2.29,12.83,0.78,6.77,17.35,21.78,12.19,,,,,,,,
LIC MF Small Cap Fund(G),36914,LIC Mutual Fund,5.04,16.1,-10.88,5.91,Nifty Smallcap 250 - TRI,22.84,33.71,,-12.67,29,23,25,29,17,13,16,,LIC MF Small Cap Fund(G),Equity : Small Cap,29,30,30,29,27,23,21,13,-5.65,6.19,17.6,-5.29,8.26,24.03,35.64,16.99,,,,,,,,
UTI Nifty 500 Value 50 Index Fund-Reg(G),47577,UTI Mutual Fund,1.94,15.59,-1.93,-2.74,NIFTY500 Value 50 - TRI,,,,3.5,59,126,71,106,110,,,,UTI Nifty 500 Value 50 Index Fund-Reg(G),Equity : Index Funds,175,194,187,167,123,68,32,18,0.59,3.51,15.23,-0.43,4.73,18.61,22.89,12.09,,,,,,,,
Franklin India Pension Plan(G),3396,Franklin Templeton Mutual Fund,1.71,6.87,3.03,8.77,CRISIL Short Term Debt Hybrid 60+40 Index,12.1,11.29,8.32,2.37,20,33,34,12,20,25,24,12,Franklin India Pension Plan(G),Hybrid : Solution Oriented,43,43,43,42,42,37,32,15,1.65,2.68,10.49,1.67,8.8,14.62,16.21,10.44,,,,,,,,
SBI Nifty Private Bank ETF,36351,SBI Mutual Fund,-0.28,13.49,8.9,13.14,Nifty Private Bank - TRI,15.34,,,10.92,10,176,86,10,24,81,,,SBI Nifty Private Bank ETF,Equity : ETFs,170,185,177,168,150,103,63,28,2.01,3.27,13.64,0.77,7.19,18.97,24.38,12.41,,,,,,,,
Bandhan Transportation and Logistics Fund-Reg(G),46986,Bandhan Mutual Fund,7.02,15.19,-0.92,-1.49,Nifty Transportation & Logistics - TRI,,,,1.21,7,3,1,7,5,,,,Bandhan Transportation and Logistics Fund-Reg(G),Equity : Sectoral - Auto,10,10,10,8,7,1,1,1,1.52,5.97,14.28,-0.38,-0.16,23.77,29.54,11.39,,,,,,,,
HDFC BSE Sensex ETF,34084,HDFC Mutual Fund,1.5,11.26,3.16,9.24,BSE SENSEX - TRI,15.29,21.7,,4.78,56,141,130,57,59,85,51,,HDFC BSE Sensex ETF,Equity : ETFs,170,185,177,168,150,103,63,28,2.01,3.27,13.64,0.77,7.19,18.97,24.38,12.41,,,,,,,,
HSBC Low Duration Fund-Reg(G),13350,HSBC Mutual Fund,0.72,3.79,5.48,9.34,NIFTY Low Duration Debt Index,7.52,6.58,6.89,4.9,1,15,1,1,1,2,4,4,HSBC Low Duration Fund-Reg(G),Debt : Low Duration,20,23,20,20,20,20,20,19,3.64,0.72,2.51,4.23,8.03,7.0,6.17,6.54,,,,,,,,
LIC MF Dividend Yield Fund-Reg(G),41332,LIC Mutual Fund,5.17,17.26,-0.24,9.72,NIFTY 500 - TRI,25.14,26.23,,1.13,3,1,1,3,2,2,4,,LIC MF Dividend Yield Fund-Reg(G),Equity : Thematic - Dividend Yield,10,10,10,10,9,8,6,5,0.44,2.77,12.48,-1.28,5.33,21.88,27.43,14.16,,,,,,,,
JM Large Cap Fund-Reg(G),1858,JM Financial Mutual Fund,2.14,11.24,-4.25,-2.3,BSE 100 - TRI,17.96,19.18,10.47,-2.0,35,18,32,36,35,12,27,24,JM Large Cap Fund-Reg(G),Equity : Large Cap,38,39,38,38,37,34,31,28,1.91,2.29,12.83,0.78,6.77,17.35,21.78,12.19,,,,,,,,
LIC MF Aggressive Hybrid Fund(G),2085,LIC Mutual Fund,4.22,14.04,1.32,8.82,CRISIL Hybrid 35+65 - Aggressive Index,14.93,15.97,8.46,2.53,26,5,6,43,28,23,28,22,LIC MF Aggressive Hybrid Fund(G),Hybrid : Equity Oriented,55,56,55,55,55,54,51,29,6.48,6.43,13.13,6.55,12.57,14.45,16.7,10.19,,,,,,,,
ICICI Pru Nifty IT Index Fund-Reg(G),46707,ICICI Prudential Mutual Fund,5.57,0.49,-12.44,11.85,NIFTY IT - TRI,,,,-12.44,172,32,183,163,10,,,,ICICI Pru Nifty IT Index Fund-Reg(G),Equity : Index Funds,175,194,187,167,123,68,32,18,0.59,3.51,15.23,-0.43,4.73,18.61,22.89,12.09,,,,,,,,
Bandhan Bond Fund - Income Plan-Reg(G),1090,Bandhan Mutual Fund,0.59,3.75,4.61,8.33,NIFTY Medium to Long Duration Debt Index,6.9,4.77,6.71,3.97,26,26,26,24,24,4,3,2,Bandhan Bond Fund - Income Plan-Reg(G),Debt : Long Duration,26,26,26,24,24,4,3,2,5.93,1.13,5.29,6.78,11.54,8.81,5.6,7.17,,,,,,,,
ITI Focused Equity Fund-Reg(G),45722,ITI Mutual Fund,2.45,15.91,-1.11,6.63,NIFTY 500 - TRI,,,,-0.59,24,33,8,27,30,,,,ITI Focused Equity Fund-Reg(G),Equity : Flexi Cap,48,48,48,48,48,35,26,21,-0.83,3.13,13.47,-1.04,6.98,19.03,23.58,13.48,,,,,,,,
Nippon India Multi Asset Active FoF-Reg(G),44074,Nippon India Mutual Fund,3.11,12.12,6.74,13.85,CRISIL Short Term Bond Index,21.2,,,6.51,13,15,20,14,5,5,,,Nippon India Multi Asset Active FoF-Reg(G),FoFs : Domestic,61,67,62,61,56,47,28,23,4.73,2.69,9.86,4.34,8.96,15.08,16.99,10.28,,,,,,,,
Mahindra Manulife Consumption Fund-Reg(G),38749,Mahindra Manulife Mutual Fund,1.38,11.78,-3.8,4.05,Nifty India Consumption - TRI,18.34,21.2,,-3.17,11,10,9,14,14,10,11,,Mahindra Manulife Consumption Fund-Reg(G),Equity : Thematic - Consumption,20,22,22,18,17,13,13,9,-2.53,1.58,11.57,-2.95,7.07,18.85,22.75,13.91,,,,,,,,
Samco Dynamic Asset Allocation Fund-Reg(G),48331,Samco Mutual Fund,1.88,2.29,-4.02,-1.53,NIFTY 50 Hybrid Composite Debt 50:50 Index,,,,-5.77,32,12,33,32,30,,,,Samco Dynamic Asset Allocation Fund-Reg(G),Hybrid : Dynamic Asset Allocation,33,34,33,33,32,22,19,11,1.74,1.81,8.61,1.68,6.87,13.37,14.66,9.7,,,,,,,,
SBI FMP-42-1857D-Reg(G),45447,SBI Mutual Fund,0.73,2.19,4.03,8.09,CRISIL Medium to Long Term Debt Index,7.39,,,3.49,67,65,70,69,59,30,,,SBI FMP-42-1857D-Reg(G),Debt : FTP/FMP,92,93,93,91,91,49,18,4,3.63,0.84,2.46,4.34,8.42,7.45,5.64,6.19,,,,,,,,
LIC MF ULIS,2154,LIC Mutual Fund,3.53,12.26,3.68,10.62,CRISIL Hybrid 35+65 - Aggressive Index,13.42,18.59,9.69,4.5,2,8,17,9,10,22,11,10,LIC MF ULIS,Hybrid : Solution Oriented,43,43,43,42,42,37,32,15,1.65,2.68,10.49,1.67,8.8,14.62,16.21,10.44,,,,,,,,
Kotak Global Innovation FoF-Reg(G),45334,Kotak Mahindra Mutual Fund,7.21,-1.32,-3.51,8.03,MSCI AC World Index,14.04,,,-1.18,52,28,45,55,43,25,,,Kotak Global Innovation FoF-Reg(G),FoFs : Overseas,57,57,57,57,57,51,27,24,5.7,7.23,1.96,5.94,13.33,13.63,11.25,6.96,,,,,,,,
Franklin India Overnight Fund(G),43438,Franklin Templeton Mutual Fund,0.47,1.46,3.11,6.43,Nifty 1D Rate Index,6.3,5.02,,2.5,14,4,6,7,14,14,16,,Franklin India Overnight Fund(G),Debt : Overnight,34,34,34,34,34,28,27,3,2.49,0.46,1.44,3.07,6.39,6.3,5.03,5.55,0.47,1.48,3.13,6.52,6.44,5.18,,6.2
Axis Greater China Equity FoF-Reg(G),44318,Axis Mutual Fund,6.82,-1.29,8.47,8.78,MSCI Golden Dragon Index (Total Return Net),3.13,,,5.51,21,33,44,13,41,46,,,Axis Greater China Equity FoF-Reg(G),FoFs : Overseas,57,57,57,57,57,51,27,24,5.7,7.23,1.96,5.94,13.33,13.63,11.25,6.96,,,,,,,,
HDFC FMP-Sr 46-1861D-Mar 2022-Reg(G),46453,HDFC Mutual Fund,1.17,3.04,5.02,9.44,NIFTY Medium to Long Duration Debt Index,8.02,,,4.42,15,14,15,15,15,11,,,HDFC FMP-Sr 46-1861D-Mar 2022-Reg(G),Debt : FTP/FMP,92,93,93,91,91,49,18,4,3.63,0.84,2.46,4.34,8.42,7.45,5.64,6.19,,,,,,,,
Axis Global Innovation FoF-Reg(G),45539,Axis Mutual Fund,9.79,2.24,4.03,11.22,MSCI ACWI Net TRI,16.43,,,1.42,41,13,23,30,28,20,,,Axis Global Innovation FoF-Reg(G),FoFs : Overseas,57,57,57,57,57,51,27,24,5.7,7.23,1.96,5.94,13.33,13.63,11.25,6.96,,,,,,,,
Invesco India ESG Integration Strategy Fund-Reg(G),45348,Invesco Mutual Fund,3.49,12.68,-2.88,9.23,NIFTY100 ESG - TRI,15.52,,,-1.79,54,50,71,57,15,34,,,Invesco India ESG Integration Strategy Fund-Reg(G),Equity : Thematic,89,98,96,81,62,38,21,9,-1.26,3.87,14.67,-1.49,5.23,21.05,26.68,13.94,,,,,,,,
Sundaram Banking & PSU Fund(G),2960,Sundaram Mutual Fund,1.11,3.81,5.5,9.8,NIFTY Banking and PSU Debt Index,7.58,5.8,6.81,4.81,13,16,13,13,10,9,14,15,Sundaram Banking & PSU Fund(G),Debt : Banking & PSU,26,26,26,26,26,21,16,16,4.64,1.11,3.62,5.28,9.36,7.49,6.27,7.28,,,,,,,,
