Edelweiss CRISIL PSU Plus SDL 50:50 Oct 2025 Index Fund-Reg(G),46448,Edelweiss Mutual Fund,0.45,1.37,3.33,6.84,CRISIL IBX 50:50 PSU + SDL Index - October 2025,6.75,,,4.69,24,8,2,24,24,12,,,Edelweiss CRISIL PSU Plus SDL 50:50 Oct 2025 Index Fund-Reg(G),Debt : Medium Duration,26,26,26,26,26,15,12,12,5.7,0.43,1.17,4.14,7.86,7.3,6.81,6.73,,,,,,,,
Union Low Duration Fund-Reg(G),49982,Union Mutual Fund,0.34,,,,NIFTY Low Duration Debt Index,,,,,,25,,,,,,,Union Low Duration Fund-Reg(G),Debt : Low Duration,20,25,23,21,20,20,20,19,5.36,0.4,1.39,4.06,7.6,7.06,5.81,6.47,,,,,,,,
Axis Retirement Fund-Aggressive Plan-Reg(G),43841,Axis Mutual Fund,2.38,-0.16,10.25,-1.39,CRISIL Hybrid 25+75 - Aggressive Index,11.81,13.53,,2.95,29,13,36,26,32,18,16,,Axis Retirement Fund-Aggressive Plan-Reg(G),Hybrid : Solution Oriented,43,43,43,43,42,37,32,15,3.24,1.94,0.99,11.11,0.74,12.03,13.95,10.76,,,,,,,,
Bajaj Finserv Overnight Fund-Reg(G),48051,Bajaj Finserv Mutual Fund,0.45,1.33,2.83,6.12,CRISIL Liquid Overnight Index,,,,4.14,3,4,5,4,3,,,,Bajaj Finserv Overnight Fund-Reg(G),Debt : Overnight,34,35,34,34,34,29,27,3,4.07,0.44,1.32,2.79,6.05,6.36,5.17,5.49,0.46,1.35,2.86,6.18,,,,5.91
HDFC Nifty G-Sec Jun 2027 Index Fund-Reg(G),46618,HDFC Mutual Fund,0.5,1.29,4.23,7.93,Nifty G-Sec Jun 2027 Index,,,,5.93,6,10,1,5,7,,,,HDFC Nifty G-Sec Jun 2027 Index Fund-Reg(G),Debt : Gilt,36,38,38,37,36,24,21,21,4.06,0.4,-0.15,2.66,5.71,6.68,5.24,7.02,,,,,,,,
Nippon India Income Plus Arbitrage Active FoF-Reg(G),49936,Nippon India Mutual Fund,0.31,,,,CRISIL Short Term Bond Index,,,,,,75,,,,,,,Nippon India Income Plus Arbitrage Active FoF-Reg(G),FoFs : Domestic,60,80,74,61,59,47,29,23,10.54,3.51,4.02,13.87,8.94,14.44,14.59,10.5,,,,,,,,
Baroda BNP Paribas Overnight Fund-Reg(G),43376,Baroda BNP Paribas Mutual Fund,0.45,1.32,2.81,6.09,CRISIL Liquid Overnight Index,6.39,5.2,,4.11,7,11,17,11,15,9,6,,Baroda BNP Paribas Overnight Fund-Reg(G),Debt : Overnight,34,35,34,34,34,29,27,3,4.07,0.44,1.32,2.79,6.05,6.36,5.17,5.49,0.46,1.35,2.86,6.18,,,,5.91
PGIM India Large and Mid Cap Fund(G),48543,PGIM India Mutual Fund,2.69,2.35,17.29,2.1,NIFTY LargeMidcap 250 - TRI,,,,5.25,6,19,12,10,3,,,,PGIM India Large and Mid Cap Fund(G),Equity : Large & Mid Cap,31,33,31,31,30,26,26,19,2.21,2.82,1.47,16.33,-1.96,17.24,22.56,15.03,,,,,,,,
Motilal Oswal Nifty 50 Index Fund-Reg(G),44366,Motilal Oswal Mutual Fund,2.58,1.31,12.39,-0.42,NIFTY 50 - TRI,12.48,17.59,,6.95,37,151,61,148,29,55,20,,Motilal Oswal Nifty 50 Index Fund-Reg(G),Equity : Index Funds,175,212,201,189,140,78,32,18,2.07,2.9,0.13,15.23,-4.21,15.11,18.82,12.86,,,,,,,,
Franklin India NSE Nifty 50 Index Fund(G),942,Franklin Templeton Mutual Fund,2.57,1.29,12.32,-0.36,NIFTY 50,12.38,17.44,12.61,6.91,41,152,65,153,26,60,23,15,Franklin India NSE Nifty 50 Index Fund(G),Equity : Index Funds,175,212,201,189,140,78,32,18,2.07,2.9,0.13,15.23,-4.21,15.11,18.82,12.86,2.56,0.91,11.76,-1.08,11.86,16.96,14.23,8.3
Axis Nifty 50 Index Fund-Reg(G),45701,Axis Mutual Fund,2.58,1.33,12.42,-0.26,NIFTY 50 - TRI,12.6,,,7.02,32,146,56,146,20,51,,,Axis Nifty 50 Index Fund-Reg(G),Equity : Index Funds,175,212,201,189,140,78,32,18,2.07,2.9,0.13,15.23,-4.21,15.11,18.82,12.86,,,,,,,,
LIC MF Nifty 100 ETF,33578,LIC Mutual Fund,2.68,1.41,13.09,-1.78,NIFTY 100 - TRI,12.85,18.25,,6.0,79,117,78,111,84,82,46,,LIC MF Nifty 100 ETF,Equity : ETFs,170,203,194,180,162,114,68,32,4.39,3.14,1.21,15.06,-0.96,16.22,20.4,13.54,,,,,,,,
Aditya Birla SL Gold Fund(G),16220,Aditya Birla Sun Life Mutual Fund,9.87,12.1,26.51,50.36,Gold-India,27.42,14.92,13.6,42.09,10,13,7,6,5,8,3,7,Aditya Birla SL Gold Fund(G),Gold : MFs,17,18,18,18,16,10,10,10,42.81,10.44,13.56,25.84,50.09,27.49,14.83,13.58,,,,,,,,
ICICI Pru BSE Liquid Rate ETF(G),49518,ICICI Prudential Mutual Fund,0.43,1.29,2.76,,BSE Liquid Rate Index,,,,,,12,6,19,,,,,ICICI Pru BSE Liquid Rate ETF(G),Debt : ETFs,30,32,32,31,28,13,8,2,5.25,0.48,1.12,3.64,7.31,7.34,5.55,5.96,,,,,,,,
Mirae Asset S&P 500 Top 50 ETF FoF-Reg(G),45836,Mirae Asset Mutual Fund,3.91,20.67,44.42,53.86,S&P 500 Top 50 TRI,34.3,,,13.46,45,31,7,4,6,3,,,Mirae Asset S&P 500 Top 50 ETF FoF-Reg(G),FoFs : Overseas,57,57,57,57,57,53,27,23,21.88,4.79,12.69,20.82,28.62,19.43,11.99,9.93,,,,,,,,
Baroda BNP Paribas Energy Opportunities Fund-Reg(G),49558,Baroda BNP Paribas Mutual Fund,1.08,-0.23,11.76,,NIFTY ENERGY - TRI,,,,,,4,5,6,,,,,Baroda BNP Paribas Energy Opportunities Fund-Reg(G),Equity : Sectoral - Energy / Power,5,7,7,6,5,3,3,2,4.46,1.68,0.56,13.8,-3.89,20.79,26.22,17.9,,,,,,,,
UTI India Consumer Fund-Reg(G),3581,UTI Mutual Fund,5.95,6.43,18.26,-4.41,Nifty India Consumption - TRI,13.11,17.51,12.33,4.4,7,6,11,6,12,12,12,9,UTI India Consumer Fund-Reg(G),Equity : Thematic - Consumption,20,22,22,22,18,13,13,9,3.21,5.0,5.74,17.0,-4.81,15.53,20.39,14.94,,,,,,,,
JM Small Cap Fund-Reg(G),48452,JM Financial Mutual Fund,4.58,0.09,17.04,-7.29,Nifty Smallcap 250 - TRI,,,,-5.16,25,2,25,25,21,,,,JM Small Cap Fund-Reg(G),Equity : Small Cap,29,31,30,30,28,23,21,13,-2.48,3.04,1.33,19.4,-4.67,18.98,28.82,17.66,,,,,,,,
UTI Equity Savings Fund-Reg(G),35818,UTI Mutual Fund,1.05,0.69,5.4,3.49,Crisil Equity Savings Index,10.3,11.73,,4.43,22,44,46,48,19,35,33,,UTI Equity Savings Fund-Reg(G),Hybrid : Equity Oriented,53,55,54,54,53,52,49,33,3.83,1.68,1.45,9.83,1.87,11.84,14.33,10.42,,,,,,,,
Nippon India US Equity Opp Fund(G),19246,Nippon India Mutual Fund,2.41,5.04,9.4,15.61,S&P 500 - TRI,16.81,13.65,14.35,8.07,7,6,8,8,7,5,3,2,Nippon India US Equity Opp Fund(G),Equity : International,8,8,8,8,8,8,6,5,18.27,3.96,12.4,20.48,23.59,19.49,12.21,11.14,,,,,,,,
DSP Nifty Top 10 Equal Weight ETF,49012,DSP Mutual Fund,1.16,-2.91,6.98,-2.97,Nifty Top 10 Equal Weight - TRI,,,,2.45,116,170,170,168,106,,,,DSP Nifty Top 10 Equal Weight ETF,Equity : ETFs,170,203,194,180,162,114,68,32,4.39,3.14,1.21,15.06,-0.96,16.22,20.4,13.54,,,,,,,,
Edelweiss Overnight Fund-Reg(G),42955,Edelweiss Mutual Fund,0.44,1.31,2.79,6.04,CRISIL Liquid Overnight Index,6.35,5.17,,4.08,23,27,28,25,26,22,12,,Edelweiss Overnight Fund-Reg(G),Debt : Overnight,34,35,34,34,34,29,27,3,4.07,0.44,1.32,2.79,6.05,6.36,5.17,5.49,0.46,1.35,2.86,6.18,,,,5.91
Kotak Nifty Next 50 Index Fund-Reg(G),44443,Kotak Mahindra Mutual Fund,3.04,1.26,15.28,-9.37,NIFTY NEXT 50 - TRI,15.16,,,0.45,122,88,72,72,108,29,,,Kotak Nifty Next 50 Index Fund-Reg(G),Equity : Index Funds,175,212,201,189,140,78,32,18,2.07,2.9,0.13,15.23,-4.21,15.11,18.82,12.86,,,,,,,,
Motilal Oswal Nifty 500 Momentum 50 Index Fund-Reg(G),48961,Motilal Oswal Mutual Fund,2.29,-3.26,15.63,,Nifty500 Momentum 50 - TRI,,,,-9.57,165,164,182,60,,,,,Motilal Oswal Nifty 500 Momentum 50 Index Fund-Reg(G),Equity : Index Funds,175,212,201,189,140,78,32,18,2.07,2.9,0.13,15.23,-4.21,15.11,18.82,12.86,,,,,,,,
Mahindra Manulife Large Cap Fund-Reg(G),38073,Mahindra Manulife Mutual Fund,2.51,0.6,12.16,-2.7,NIFTY 100 - TRI,12.96,18.44,,5.75,8,19,28,30,22,23,16,,Mahindra Manulife Large Cap Fund-Reg(G),Equity : Large Cap,38,39,39,38,38,35,31,28,3.96,2.6,1.27,13.54,-2.51,14.0,18.44,12.92,,,,,,,,
Tata Nifty 50 ETF,41017,Tata Mutual Fund,2.62,1.43,12.66,0.07,NIFTY 50 - TRI,13.06,18.26,,7.31,70,131,71,134,55,76,44,,Tata Nifty 50 ETF,Equity : ETFs,170,203,194,180,162,114,68,32,4.39,3.14,1.21,15.06,-0.96,16.22,20.4,13.54,,,,,,,,
SBI Comma Fund-Reg(G),2750,SBI Mutual Fund,2.6,2.93,15.94,-0.57,NIFTY COMMODITIES - TRI,14.56,20.57,16.84,7.33,13,68,37,43,26,24,13,3,SBI Comma Fund-Reg(G),Equity : Thematic,88,105,100,96,75,38,20,9,1.43,3.27,2.11,15.95,-3.54,17.48,23.49,14.56,,,,,,,,
DSP FMP 267-1246D-Reg(G),47071,DSP Mutual Fund,0.42,1.25,3.78,7.34,CRISIL Medium Duration Debt Index,,,,5.23,48,44,42,40,44,,,,DSP FMP 267-1246D-Reg(G),Debt : FTP/FMP,81,82,82,81,81,44,10,4,5.31,0.4,1.2,3.85,7.48,7.27,6.17,6.14,,,,,,,,
SBI FMP-66-1361D-Reg(G),46633,SBI Mutual Fund,0.42,1.24,3.54,7.17,CRISIL Medium Duration Debt Index,7.07,,,5.17,59,38,45,71,64,31,,,SBI FMP-66-1361D-Reg(G),Debt : FTP/FMP,81,82,82,81,81,44,10,4,5.31,0.4,1.2,3.85,7.48,7.27,6.17,6.14,,,,,,,,
LIC MF Nifty Midcap 100 ETF,48473,LIC Mutual Fund,3.44,-0.14,20.39,-2.09,Nifty Midcap 100 - TRI,,,,2.15,122,73,135,31,95,,,,LIC MF Nifty Midcap 100 ETF,Equity : ETFs,170,203,194,180,162,114,68,32,4.39,3.14,1.21,15.06,-0.96,16.22,20.4,13.54,,,,,,,,
Kotak Nifty Alpha 50 ETF,45687,Kotak Mahindra Mutual Fund,2.97,-1.53,18.5,-14.38,Nifty Alpha 50 - TRI,16.73,,,-9.02,158,104,152,42,146,35,,,Kotak Nifty Alpha 50 ETF,Equity : ETFs,170,203,194,180,162,114,68,32,4.39,3.14,1.21,15.06,-0.96,16.22,20.4,13.54,,,,,,,,
HDFC NIFTY200 Momentum 30 Index Fund-Reg(G),48466,HDFC Mutual Fund,3.26,-1.31,14.72,-15.99,Nifty200 Momentum 30 - TRI,,,,-6.45,157,66,152,99,137,,,,HDFC NIFTY200 Momentum 30 Index Fund-Reg(G),Equity : Index Funds,175,212,201,189,140,78,32,18,2.07,2.9,0.13,15.23,-4.21,15.11,18.82,12.86,,,,,,,,
Kotak Credit Risk Fund(G),8472,Kotak Mahindra Mutual Fund,0.79,1.81,5.22,6.99,CRISIL Credit Risk Debt Index,7.04,5.73,6.79,6.73,5,1,3,3,12,12,13,9,Kotak Credit Risk Fund(G),Debt : Credit Risk,15,15,15,15,15,15,15,13,7.92,0.54,1.34,5.27,10.14,8.33,8.93,6.48,,,,,,,,
HSBC Financial Services Fund-Reg(G),49575,HSBC Mutual Fund,1.17,-1.27,13.12,,BSE Financial Services - TRI,,,,,,7,17,21,,,,,HSBC Financial Services Fund-Reg(G),Equity : Sectoral - Financial Services,21,23,22,22,21,14,11,10,9.05,0.87,-0.77,16.03,6.29,15.07,21.03,13.55,,,,,,,,
HDFC Nifty G-Sec Jul 2031 Index Fund-Reg(G),46620,HDFC Mutual Fund,0.22,0.31,4.44,8.34,Nifty G-Sec July 2031 Index,,,,6.3,2,34,12,2,2,,,,HDFC Nifty G-Sec Jul 2031 Index Fund-Reg(G),Debt : Gilt,36,38,38,37,36,24,21,21,4.06,0.4,-0.15,2.66,5.71,6.68,5.24,7.02,,,,,,,,
Mirae Asset Nifty Smallcap 250 Momentum Quality 100 ETF,48496,Mirae Asset Mutual Fund,3.4,-2.83,16.31,-14.18,Nifty Smallcap250 Momentum Quality 100 - TRI,,,,-8.31,157,75,169,48,145,,,,Mirae Asset Nifty Smallcap 250 Momentum Quality 100 ETF,Equity : ETFs,170,203,194,180,162,114,68,32,4.39,3.14,1.21,15.06,-0.96,16.22,20.4,13.54,,,,,,,,
LIC MF Multi Asset Allocation Fund-Reg(G),49465,LIC Mutual Fund,3.95,3.5,14.89,,NIFTY 500 - TRI,,,,,,7,12,5,,,,,LIC MF Multi Asset Allocation Fund-Reg(G),Hybrid : Multi Asset Allocation,28,32,31,29,26,10,9,7,8.5,3.01,3.24,12.27,6.05,15.18,18.26,12.89,,,,,,,,
Canara Rob Ultra Short Term Fund-Reg(G),5902,Canara Robeco Mutual Fund,0.4,1.33,3.52,6.87,CRISIL Ultra Short Term Debt Index,6.51,5.07,5.69,4.78,19,26,25,18,18,19,20,11,Canara Rob Ultra Short Term Fund-Reg(G),Debt : Ultra Short Duration,26,30,30,27,25,24,22,13,4.9,0.43,1.42,3.59,7.05,6.77,5.54,6.13,0.45,1.45,3.75,7.56,,,,7.44
HSBC Equity Savings Fund-Reg(G),15304,HSBC Mutual Fund,3.41,5.88,12.7,5.38,NIFTY 50 Equity Savings Index,13.52,13.86,9.12,0.86,49,2,1,11,6,14,26,25,HSBC Equity Savings Fund-Reg(G),Hybrid : Equity Oriented,53,55,54,54,53,52,49,33,3.83,1.68,1.45,9.83,1.87,11.84,14.33,10.42,,,,,,,,
Baroda BNP Paribas Focused Fund-Reg(G),32452,Baroda BNP Paribas Mutual Fund,0.35,-1.38,13.73,-7.54,NIFTY 500 - TRI,12.16,17.0,,-1.72,43,49,47,33,42,33,24,,Baroda BNP Paribas Focused Fund-Reg(G),Equity : Flexi Cap,48,50,49,48,48,39,27,21,1.89,2.96,1.77,15.22,-2.72,15.45,20.21,14.26,,,,,,,,
Edelweiss Technology Fund-Reg(G),43844,Edelweiss Mutual Fund,2.64,3.51,16.05,-1.58,BSE TECk Index - TRI,,,,-2.79,4,11,2,4,2,,,,Edelweiss Technology Fund-Reg(G),Equity : Sectoral - Technology,12,12,12,12,9,5,5,4,-6.36,3.74,-0.11,13.11,-8.01,15.72,21.56,16.77,,,,,,,,
Franklin India Equity Savings Fund(G),39645,Franklin Templeton Mutual Fund,0.77,1.38,4.87,4.68,NIFTY 50 Equity Savings Index,7.83,10.02,,4.03,27,51,24,52,11,50,39,,Franklin India Equity Savings Fund(G),Hybrid : Equity Oriented,53,55,54,54,53,52,49,33,3.83,1.68,1.45,9.83,1.87,11.84,14.33,10.42,,,,,,,,
Invesco India Business Cycle Fund-Reg(G),49315,Invesco Mutual Fund,2.09,6.63,30.36,,NIFTY 500 - TRI,,,,,,81,8,2,,,,,Invesco India Business Cycle Fund-Reg(G),Equity : Thematic,88,105,100,96,75,38,20,9,1.43,3.27,2.11,15.95,-3.54,17.48,23.49,14.56,,,,,,,,
Motilal Oswal Nifty Midcap 100 ETF,13595,Motilal Oswal Mutual Fund,3.45,-0.13,20.43,-1.9,Nifty Midcap 100 - TRI,22.11,28.77,16.88,2.2,121,71,133,28,90,16,5,2,Motilal Oswal Nifty Midcap 100 ETF,Equity : ETFs,170,203,194,180,162,114,68,32,4.39,3.14,1.21,15.06,-0.96,16.22,20.4,13.54,,,,,,,,
HDFC Silver ETF FoF-Reg(G),46465,HDFC Mutual Fund,13.28,21.15,30.0,51.52,Silver,,,,47.2,1,1,2,1,1,,,,HDFC Silver ETF FoF-Reg(G),Gold : MFs,17,18,18,18,16,10,10,10,42.81,10.44,13.56,25.84,50.09,27.49,14.83,13.58,,,,,,,,
Motilal Oswal Nifty India Defence ETF,49103,Motilal Oswal Mutual Fund,5.6,-7.04,44.01,17.85,Nifty India Defence - TRI,,,,24.22,4,18,191,1,7,,,,Motilal Oswal Nifty India Defence ETF,Equity : ETFs,170,203,194,180,162,114,68,32,4.39,3.14,1.21,15.06,-0.96,16.22,20.4,13.54,,,,,,,,
Aditya Birla SL Nifty India Defence Index Fund-Reg(G),49044,Aditya Birla Sun Life Mutual Fund,5.53,-7.25,43.14,16.36,Nifty India Defence - TRI,,,,23.24,2,8,197,4,2,,,,Aditya Birla SL Nifty India Defence Index Fund-Reg(G),Equity : Index Funds,175,212,201,189,140,78,32,18,2.07,2.9,0.13,15.23,-4.21,15.11,18.82,12.86,,,,,,,,
HDFC Nifty G-Sec Sep 2032 Index Fund-Reg(G),46872,HDFC Mutual Fund,0.3,0.36,4.36,8.3,Nifty G-Sec Sep 2032 Index,,,,6.14,3,28,10,3,3,,,,HDFC Nifty G-Sec Sep 2032 Index Fund-Reg(G),Debt : Gilt,36,38,38,37,36,24,21,21,4.06,0.4,-0.15,2.66,5.71,6.68,5.24,7.02,,,,,,,,
UTI Nifty200 Quality 30 Index Fund-Reg(G),49144,UTI Mutual Fund,5.11,2.35,15.01,,NIFTY200 Quality 30 - TRI,,,,2.19,92,13,32,89,,,,,UTI Nifty200 Quality 30 Index Fund-Reg(G),Equity : Index Funds,175,212,201,189,140,78,32,18,2.07,2.9,0.13,15.23,-4.21,15.11,18.82,12.86,,,,,,,,
360 ONE Dynamic Bond Fund-Reg(G),17578,360 ONE Mutual Fund,0.31,0.63,4.63,8.3,CRISIL Dynamic Bond Index,7.82,6.97,7.02,6.18,1,13,3,1,1,1,2,7,360 ONE Dynamic Bond Fund-Reg(G),Debt : Dynamic Bond,22,22,22,22,22,22,21,19,4.25,0.29,-0.01,3.05,5.91,6.86,5.72,6.88,0.43,0.44,3.95,7.47,,,,7.6
Union Aggressive Hybrid Fund-Reg(G),44512,Union Mutual Fund,1.97,1.51,13.17,0.89,CRISIL Hybrid 35+65 - Aggressive Index,12.26,,,3.72,31,18,20,6,34,20,,,Union Aggressive Hybrid Fund-Reg(G),Hybrid : Equity Oriented,53,55,54,54,53,52,49,33,3.83,1.68,1.45,9.83,1.87,11.84,14.33,10.42,,,,,,,,
Mahindra Manulife Multi Asset Allocation Fund-Reg(G),48449,Mahindra Manulife Mutual Fund,3.63,4.0,13.69,9.23,NIFTY 500 - TRI,,,,11.38,8,8,9,7,5,,,,Mahindra Manulife Multi Asset Allocation Fund-Reg(G),Hybrid : Multi Asset Allocation,28,32,31,29,26,10,9,7,8.5,3.01,3.24,12.27,6.05,15.18,18.26,12.89,,,,,,,,
LIC MF Dividend Yield Fund-Reg(G),41332,LIC Mutual Fund,3.91,0.12,16.41,-3.6,NIFTY 500 - TRI,20.09,22.05,,2.27,5,1,8,2,2,2,4,,LIC MF Dividend Yield Fund-Reg(G),Equity : Thematic - Dividend Yield,10,10,10,10,10,8,6,5,1.94,2.59,0.67,12.5,-5.16,18.42,23.28,14.87,,,,,,,,
ICICI Pru Nifty FMCG ETF,45651,ICICI Prudential Mutual Fund,2.77,3.01,9.94,-12.08,NIFTY FMCG - TRI,10.45,,,1.13,126,113,41,159,143,104,,,ICICI Pru Nifty FMCG ETF,Equity : ETFs,170,203,194,180,162,114,68,32,4.39,3.14,1.21,15.06,-0.96,16.22,20.4,13.54,,,,,,,,
DSP Nifty Bank ETF,46468,DSP Mutual Fund,-0.42,-1.69,14.87,6.53,NIFTY BANK - TRI,,,,8.51,32,199,158,87,22,,,,DSP Nifty Bank ETF,Equity : ETFs,170,203,194,180,162,114,68,32,4.39,3.14,1.21,15.06,-0.96,16.22,20.4,13.54,,,,,,,,
Baroda BNP Paribas Health and Wellness Fund-Reg(G),49985,Baroda BNP Paribas Mutual Fund,0.86,,,,BSE Health Care - TRI,,,,,,18,,,,,,,Baroda BNP Paribas Health and Wellness Fund-Reg(G),Equity : Sectoral - Pharma,18,20,18,18,16,10,9,3,-1.48,2.01,2.75,12.8,-0.34,23.54,18.9,12.38,,,,,,,,
Mahindra Manulife Low Duration Fund-Reg(G),36894,Mahindra Manulife Mutual Fund,0.42,1.43,3.88,7.34,CRISIL Low Duration Debt Index,6.85,5.45,,5.16,16,7,7,18,16,16,20,,Mahindra Manulife Low Duration Fund-Reg(G),Debt : Low Duration,20,25,23,21,20,20,20,19,5.36,0.4,1.39,4.06,7.6,7.06,5.81,6.47,0.46,1.46,3.98,7.83,,,,7.79
Edelweiss Low Duration Fund-Reg(G),49709,Edelweiss Mutual Fund,0.35,1.27,,,CRISIL Low Duration Debt Index,,,,,,24,23,,,,,,Edelweiss Low Duration Fund-Reg(G),Debt : Low Duration,20,25,23,21,20,20,20,19,5.36,0.4,1.39,4.06,7.6,7.06,5.81,6.47,0.46,1.46,3.98,7.83,,,,7.79
Bank of India Mid Cap Fund-Reg(G),50004,Bank of India Mutual Fund,,,,,Nifty Midcap 150 - TRI,,,,,,,,,,,,,Bank of India Mid Cap Fund-Reg(G),Equity : Mid Cap,30,31,31,30,30,27,24,20,0.89,3.1,2.17,19.27,-2.01,19.72,26.01,16.41,,,,,,,,
Quant BFSI Fund-Reg(G),47989,Quant Mutual Fund,0.87,2.95,25.81,0.96,Nifty Financial Services - TRI,,,,13.13,1,13,1,1,20,,,,Quant BFSI Fund-Reg(G),Equity : Sectoral - Financial Services,21,23,22,22,21,14,11,10,9.05,0.87,-0.77,16.03,6.29,15.07,21.03,13.55,,,,,,,,
Bajaj Finserv Consumption Fund-Reg(G),49345,Bajaj Finserv Mutual Fund,6.4,4.71,16.61,,Nifty India Consumption - TRI,,,,-0.57,17,2,18,17,,,,,Bajaj Finserv Consumption Fund-Reg(G),Equity : Thematic - Consumption,20,22,22,22,18,13,13,9,3.21,5.0,5.74,17.0,-4.81,15.53,20.39,14.94,,,,,,,,
Navi Nifty Bank Index Fund-Reg(G),45873,Navi Mutual Fund,-0.49,-1.91,14.41,5.75,NIFTY BANK - TRI,10.33,,,7.9,20,209,169,117,7,77,,,Navi Nifty Bank Index Fund-Reg(G),Equity : Index Funds,175,212,201,189,140,78,32,18,2.07,2.9,0.13,15.23,-4.21,15.11,18.82,12.86,,,,,,,,
Axis Gilt Fund-Reg(G),15652,Axis Mutual Fund,0.49,-0.33,2.68,5.66,CRISIL Dynamic Gilt Index,7.13,5.78,7.27,3.89,16,12,17,16,16,7,5,9,Axis Gilt Fund-Reg(G),Debt : Gilt,36,38,38,37,36,24,21,21,4.06,0.4,-0.15,2.66,5.71,6.68,5.24,7.02,,,,,,,,
HSBC Income Plus Arbitrage Active FOF-Reg(G),28311,HSBC Mutual Fund,0.37,1.05,3.68,4.93,Nifty Short Duration Debt Index,7.08,6.24,6.43,3.76,47,66,49,61,30,47,27,23,HSBC Income Plus Arbitrage Active FOF-Reg(G),FoFs : Domestic,60,80,74,61,59,47,29,23,10.54,3.51,4.02,13.87,8.94,14.44,14.59,10.5,,,,,,,,
Bandhan Transportation and Logistics Fund-Reg(G),46986,Bandhan Mutual Fund,10.25,14.0,30.85,2.68,Nifty Transportation & Logistics - TRI,,,,16.22,6,7,5,2,6,,,,Bandhan Transportation and Logistics Fund-Reg(G),Equity : Sectoral - Auto,10,10,10,10,8,1,1,1,16.31,10.47,14.04,29.68,3.17,22.55,26.82,13.31,,,,,,,,
Motilal Oswal Nifty Bank Index Fund-Reg(G),43789,Motilal Oswal Mutual Fund,-0.48,-1.88,14.41,5.74,NIFTY BANK - TRI,10.42,19.04,,7.9,21,207,166,118,8,75,12,,Motilal Oswal Nifty Bank Index Fund-Reg(G),Equity : Index Funds,175,212,201,189,140,78,32,18,2.07,2.9,0.13,15.23,-4.21,15.11,18.82,12.86,,,,,,,,
Aditya Birla SL ESG Integration Strategy Fund-Reg(G),44736,Aditya Birla Sun Life Mutual Fund,3.43,0.23,13.31,-3.84,NIFTY100 ESG - TRI,12.35,,,0.28,54,47,76,69,42,34,,,Aditya Birla SL ESG Integration Strategy Fund-Reg(G),Equity : Thematic,88,105,100,96,75,38,20,9,1.43,3.27,2.11,15.95,-3.54,17.48,23.49,14.56,,,,,,,,
LIC MF Small Cap Fund(G),36914,LIC Mutual Fund,6.31,2.21,17.34,-8.6,Nifty Smallcap 250 - TRI,15.93,28.48,,-9.16,29,1,8,22,25,19,12,,LIC MF Small Cap Fund(G),Equity : Small Cap,29,31,30,30,28,23,21,13,-2.48,3.04,1.33,19.4,-4.67,18.98,28.82,17.66,,,,,,,,
Kotak Quant Fund-Reg(G),48083,Kotak Mahindra Mutual Fund,4.27,2.91,13.42,-6.06,NIFTY 200 - TRI,,,,1.66,46,26,38,68,52,,,,Kotak Quant Fund-Reg(G),Equity : Thematic,88,105,100,96,75,38,20,9,1.43,3.27,2.11,15.95,-3.54,17.48,23.49,14.56,,,,,,,,
Motilal Oswal Ultra Short Term Fund-Reg(G),22532,Motilal Oswal Mutual Fund,0.39,1.17,2.82,5.68,CRISIL Ultra Short Term Debt Index,5.74,4.54,3.71,3.93,26,27,30,27,25,24,22,13,Motilal Oswal Ultra Short Term Fund-Reg(G),Debt : Ultra Short Duration,26,30,30,27,25,24,22,13,4.9,0.43,1.42,3.59,7.05,6.77,5.54,6.13,0.45,1.45,3.75,7.56,,,,7.44
Aditya Birla SL CRISIL IBX Gilt Apr 2029 Index Fund-Reg(G),46950,Aditya Birla Sun Life Mutual Fund,0.59,0.95,4.67,8.42,CRISIL IBX Gilt Index - April 2029,,,,6.39,1,4,8,1,1,,,,Aditya Birla SL CRISIL IBX Gilt Apr 2029 Index Fund-Reg(G),Debt : Gilt,36,38,38,37,36,24,21,21,4.06,0.4,-0.15,2.66,5.71,6.68,5.24,7.02,,,,,,,,
SBI FMP-67-1467D-Reg(G),46703,SBI Mutual Fund,0.45,1.27,3.9,7.5,CRISIL Medium to Long Term Debt Index,7.2,,,5.45,35,15,34,34,35,25,,,SBI FMP-67-1467D-Reg(G),Debt : FTP/FMP,81,82,82,81,81,44,10,4,5.31,0.4,1.2,3.85,7.48,7.27,6.17,6.14,,,,,,,,
ICICI Pru Nifty Bank Index Fund-Reg(G),45994,ICICI Prudential Mutual Fund,-0.48,-1.84,14.48,5.81,NIFTY BANK - TRI,10.42,,,8.01,16,206,163,111,5,76,,,ICICI Pru Nifty Bank Index Fund-Reg(G),Equity : Index Funds,175,212,201,189,140,78,32,18,2.07,2.9,0.13,15.23,-4.21,15.11,18.82,12.86,,,,,,,,
Bank of India Mfg & Infra Fund-Reg(G),8484,Bank of India Mutual Fund,4.47,1.77,19.91,-3.42,BSE India Infrastructure Index - TRI,22.59,28.12,17.32,3.37,2,1,3,4,5,9,14,5,Bank of India Mfg & Infra Fund-Reg(G),Equity : Sectoral - Infrastructure,20,21,21,20,19,19,19,18,-0.63,1.82,0.34,16.44,-6.6,21.96,29.79,16.01,,,,,,,,
PGIM India Large Cap Fund(G),758,PGIM India Mutual Fund,3.11,2.21,14.21,-1.88,NIFTY 100 - TRI,11.84,15.4,11.02,5.81,7,10,10,12,16,28,29,25,PGIM India Large Cap Fund(G),Equity : Large Cap,38,39,39,38,38,35,31,28,3.96,2.6,1.27,13.54,-2.51,14.0,18.44,12.92,,,,,,,,
DSP Nifty 50 Equal Weight ETF,45715,DSP Mutual Fund,4.27,3.54,15.57,-0.83,NIFTY50 Equal Weight,16.81,,,10.44,15,39,33,63,75,34,,,DSP Nifty 50 Equal Weight ETF,Equity : ETFs,170,203,194,180,162,114,68,32,4.39,3.14,1.21,15.06,-0.96,16.22,20.4,13.54,4.21,3.11,14.91,-1.66,15.99,22.1,,13.18
WOC Quality Equity Fund-Reg(G),49192,WhiteOak Capital Mutual Fund,2.53,1.44,11.01,,BSE Quality Index - TRI,,,,,,70,58,85,,,,,WOC Quality Equity Fund-Reg(G),Equity : Thematic,88,105,100,96,75,38,20,9,1.43,3.27,2.11,15.95,-3.54,17.48,23.49,14.56,,,,,,,,
HDFC MNC Fund-Reg(G),47648,HDFC Mutual Fund,5.04,5.79,17.88,-7.69,NIFTY MNC - TRI,,,,1.14,5,4,2,4,5,,,,HDFC MNC Fund-Reg(G),Equity : Thematic - MNC,6,7,6,6,5,4,4,3,1.8,5.25,3.77,16.24,-5.45,11.19,15.45,10.1,,,,,,,,
Nippon India Nifty Next 50 Junior BeES FoF-Reg(G),40664,Nippon India Mutual Fund,2.97,1.13,15.19,-9.15,NIFTY NEXT 50,15.38,20.39,,0.51,54,31,44,18,55,18,5,,Nippon India Nifty Next 50 Junior BeES FoF-Reg(G),FoFs : Domestic,60,80,74,61,59,47,29,23,10.54,3.51,4.02,13.87,8.94,14.44,14.59,10.5,2.97,0.97,15.04,-9.61,15.16,20.08,,-0.11
Kotak Technology Fund-Reg(G),48587,Kotak Mahindra Mutual Fund,4.12,-1.17,7.65,-10.59,BSE TECk Index - TRI,,,,-8.59,10,4,9,10,6,,,,Kotak Technology Fund-Reg(G),Equity : Sectoral - Technology,12,12,12,12,9,5,5,4,-6.36,3.74,-0.11,13.11,-8.01,15.72,21.56,16.77,,,,,,,,
Quant PSU Fund-Reg(G),48341,Quant Mutual Fund,-1.12,-5.64,7.94,-18.09,NIFTY PSE - TRI,,,,-3.35,74,104,100,94,74,,,,Quant PSU Fund-Reg(G),Equity : Thematic,88,105,100,96,75,38,20,9,1.43,3.27,2.11,15.95,-3.54,17.48,23.49,14.56,,,,,,,,
WOC Arbitrage Fund-Reg(G),48900,WhiteOak Capital Mutual Fund,0.39,1.36,3.21,6.54,Nifty 50 Arbitrage - TRI,,,,4.7,1,11,5,7,9,,,,WOC Arbitrage Fund-Reg(G),Hybrid : Arbitrage,30,31,31,30,27,24,24,14,4.36,0.37,1.29,3.03,6.35,6.82,5.41,5.7,,,,,,,,
UTI Gilt Fund-Reg(G),3560,UTI Mutual Fund,0.27,-0.56,2.2,5.01,CRISIL Dynamic Gilt Index,6.84,5.28,7.34,3.55,20,32,25,21,21,11,9,8,UTI Gilt Fund-Reg(G),Debt : Gilt,36,38,38,37,36,24,21,21,4.06,0.4,-0.15,2.66,5.71,6.68,5.24,7.02,,,,,,,,
HSBC Credit Risk Fund-Reg(G),8016,HSBC Mutual Fund,0.46,1.18,16.83,20.58,NIFTY Credit Risk Bond Index,11.02,8.61,7.3,18.29,2,12,10,1,2,2,7,7,HSBC Credit Risk Fund-Reg(G),Debt : Credit Risk,15,15,15,15,15,15,15,13,7.92,0.54,1.34,5.27,10.14,8.33,8.93,6.48,,,,,,,,
SBI Silver ETF FOF-Reg(G),48895,SBI Mutual Fund,13.05,20.39,29.76,51.25,Silver,,,,47.17,1,3,8,4,2,,,,SBI Silver ETF FOF-Reg(G),FoFs : Domestic,60,80,74,61,59,47,29,23,10.54,3.51,4.02,13.87,8.94,14.44,14.59,10.5,,,,,,,,
WOC Liquid Fund-Reg(G),42211,WhiteOak Capital Mutual Fund,0.45,1.41,3.23,6.78,CRISIL Liquid Debt Index,6.85,5.39,,4.62,28,35,20,23,23,28,30,,WOC Liquid Fund-Reg(G),Debt : Liquid,38,41,39,38,37,35,34,29,4.61,0.46,1.4,3.22,6.77,6.9,5.55,6.09,,,,,,,,
ICICI Pru CRISIL-IBX Financial Services 3-6 Months Debt Index Fund-Reg(G),49708,ICICI Prudential Mutual Fund,0.49,1.55,,,CRISIL-IBX Financial Services 3 to 6 Months Debt Index,,,,,,1,4,,,,,,ICICI Pru CRISIL-IBX Financial Services 3-6 Months Debt Index Fund-Reg(G),Debt : Ultra Short Duration,26,30,30,27,25,24,22,13,4.9,0.43,1.42,3.59,7.05,6.77,5.54,6.13,,,,,,,,
Sundaram Low Duration Fund(G),2343,Sundaram Mutual Fund,0.41,1.35,3.81,7.2,NIFTY Low Duration Debt Index,6.83,5.54,4.4,5.1,19,14,15,21,20,18,18,19,Sundaram Low Duration Fund(G),Debt : Low Duration,20,25,23,21,20,20,20,19,5.36,0.4,1.39,4.06,7.6,7.06,5.81,6.47,,,,,,,,
Baroda BNP Paribas Business Cycle Fund-Reg(G),45686,Baroda BNP Paribas Mutual Fund,2.33,0.54,12.81,-6.67,BSE 500 - TRI,15.56,,,-2.28,69,74,73,73,53,22,,,Baroda BNP Paribas Business Cycle Fund-Reg(G),Equity : Thematic,88,105,100,96,75,38,20,9,1.43,3.27,2.11,15.95,-3.54,17.48,23.49,14.56,,,,,,,,
Axis Global Innovation FoF-Reg(G),45539,Axis Mutual Fund,4.16,11.4,21.31,23.53,MSCI ACWI Net TRI,20.71,,,16.14,36,29,34,25,33,23,,,Axis Global Innovation FoF-Reg(G),FoFs : Overseas,57,57,57,57,57,53,27,23,21.88,4.79,12.69,20.82,28.62,19.43,11.99,9.93,,,,,,,,
UTI BSE Low Volatility Index Fund-Reg(G),46409,UTI Mutual Fund,3.77,2.14,12.58,-5.24,BSE Low Volatility Index - TRI,15.2,,,5.59,62,44,36,135,84,28,,,UTI BSE Low Volatility Index Fund-Reg(G),Equity : Index Funds,175,212,201,189,140,78,32,18,2.07,2.9,0.13,15.23,-4.21,15.11,18.82,12.86,,,,,,,,
Mirae Asset Nifty SDL Jun 2027 Index Fund-Reg(G),46134,Mirae Asset Mutual Fund,0.31,0.93,4.14,7.9,Nifty SDL Jun 2027 Index,7.37,,,5.79,34,34,31,35,28,6,,,Mirae Asset Nifty SDL Jun 2027 Index Fund-Reg(G),Debt : Medium to Long Duration,59,60,60,60,52,26,11,11,5.62,0.27,0.76,4.08,7.55,7.06,5.48,6.31,,,,,,,,
Franklin India Overnight Fund(G),43438,Franklin Templeton Mutual Fund,0.45,1.33,2.84,6.12,Nifty 1D Rate Index,6.37,5.17,,4.11,10,3,3,3,4,14,15,,Franklin India Overnight Fund(G),Debt : Overnight,34,35,34,34,34,29,27,3,4.07,0.44,1.32,2.79,6.05,6.36,5.17,5.49,0.46,1.35,2.85,6.18,6.5,5.32,,5.91
