Bank of India Mfg & Infra Fund-Reg(G),8484,Bank of India Mutual Fund,-2.3,-0.08,5.9,11.64,BSE India Infrastructure Index - TRI,25.2,23.49,18.42,-0.45,15,17,2,1,3,6,7,4,Bank of India Mfg & Infra Fund-Reg(G),Equity : Sectoral - Infrastructure,22,22,21,21,20,19,19,18,-0.29,-1.81,-2.83,0.33,6.79,22.91,21.98,16.7,,,,,,,,
WOC Quality Equity Fund-Reg(G),49192,WhiteOak Capital Mutual Fund,-4.58,-3.18,-1.0,-0.06,BSE Quality Index - TRI,,,,-3.54,102,102,72,80,76,,,,WOC Quality Equity Fund-Reg(G),Equity : Thematic,113,112,110,105,91,41,28,9,-1.66,-2.76,-1.73,1.98,6.04,18.73,17.11,15.41,,,,,,,,
Helios Large & Mid Cap Fund-Reg(G),49245,Helios Mutual Fund,-2.33,-1.71,3.42,14.15,NIFTY LargeMidcap 250 - TRI,,,,-1.54,14,11,17,10,1,,,,Helios Large & Mid Cap Fund-Reg(G),Equity : Large & Mid Cap,33,33,33,33,31,26,26,20,-1.84,-2.7,-2.02,1.59,7.39,18.72,16.43,15.37,,,,,,,,
Franklin India Arbitrage Fund-Reg(G),49339,Franklin Templeton Mutual Fund,0.55,1.63,2.95,6.39,Nifty 50 Arbitrage - TRI,,,,0.65,19,1,3,3,3,,,,Franklin India Arbitrage Fund-Reg(G),Hybrid : Arbitrage,34,34,33,31,30,24,24,14,0.66,0.48,1.51,2.79,6.04,6.81,5.66,5.72,,,,,,,,
HDFC NIFTY200 Momentum 30 Index Fund-Reg(G),48466,HDFC Mutual Fund,-3.07,-2.62,1.46,1.11,Nifty200 Momentum 30 - TRI,,,,-1.3,78,157,168,154,135,,,,HDFC NIFTY200 Momentum 30 Index Fund-Reg(G),Equity : Index Funds,227,228,219,210,179,86,34,18,-1.71,-2.69,-1.24,2.6,6.66,17.61,13.34,13.56,,,,,,,,
Motilal Oswal Nifty Bank Index Fund-Reg(G),43789,Motilal Oswal Mutual Fund,-0.06,3.58,8.17,19.05,NIFTY BANK - TRI,12.9,10.68,,0.79,13,15,15,16,16,75,33,,Motilal Oswal Nifty Bank Index Fund-Reg(G),Equity : Index Funds,227,228,219,210,179,86,34,18,-1.71,-2.69,-1.24,2.6,6.66,17.61,13.34,13.56,,,,,,,,
HDFC Nifty G-Sec Jul 2031 Index Fund-Reg(G),46620,HDFC Mutual Fund,0.73,0.95,1.72,7.28,Nifty G-Sec July 2031 Index,8.17,,,0.48,12,2,14,10,6,2,,,HDFC Nifty G-Sec Jul 2031 Index Fund-Reg(G),Debt : Gilt,39,39,39,38,37,35,21,21,-0.09,0.31,0.64,0.67,4.6,6.73,5.09,6.97,,,,,,,,
Kotak Technology Fund-Reg(G),48587,Kotak Mahindra Mutual Fund,-4.46,-1.5,0.75,-7.55,BSE TECk Index - TRI,,,,-4.0,3,2,3,6,9,,,,Kotak Technology Fund-Reg(G),Equity : Sectoral - Technology,12,12,12,12,12,5,5,5,-5.98,-5.95,-4.3,-1.33,-6.31,13.32,13.7,16.7,,,,,,,,
Mahindra Manulife Value Fund-Reg(G),49460,Mahindra Manulife Mutual Fund,-1.04,2.98,8.66,,NIFTY 500 - TRI,,,,0.2,3,3,1,2,,,,,Mahindra Manulife Value Fund-Reg(G),Equity : Value / Contra,23,23,23,23,22,21,18,15,-1.35,-2.31,-0.29,3.73,7.13,19.4,17.29,15.63,,,,,,,,
Bajaj Finserv Consumption Fund-Reg(G),49345,Bajaj Finserv Mutual Fund,-6.62,-10.08,-6.91,-7.54,Nifty India Consumption - TRI,,,,-5.26,21,25,23,20,18,,,,Bajaj Finserv Consumption Fund-Reg(G),Equity : Thematic - Consumption,26,26,24,22,20,13,13,10,-4.64,-5.01,-6.51,-3.3,-1.2,14.47,13.75,14.31,,,,,,,,
LIC MF Dividend Yield Fund-Reg(G),41332,LIC Mutual Fund,-1.99,-3.73,0.83,5.88,NIFTY 500 - TRI,20.87,16.81,,-1.67,9,8,10,10,8,2,6,,LIC MF Dividend Yield Fund-Reg(G),Equity : Thematic - Dividend Yield,10,10,10,10,10,8,7,5,-0.52,-1.39,0.3,4.34,7.32,19.12,18.37,15.91,,,,,,,,
Axis Global Innovation FoF-Reg(G),45539,Axis Mutual Fund,-6.05,-5.35,1.94,9.5,MSCI ACWI Net TRI,17.31,,,-2.49,50,52,48,52,46,31,,,Axis Global Innovation FoF-Reg(G),FoFs : Overseas,56,56,56,56,56,53,30,23,2.99,0.23,4.59,15.05,25.51,19.42,10.34,12.21,,,,,,,,
Nippon India Nifty Next 50 Junior BeES FoF-Reg(G),40664,Nippon India Mutual Fund,-2.1,-1.93,3.14,7.83,NIFTY NEXT 50,21.79,15.58,,-0.63,66,71,76,36,34,7,6,,Nippon India Nifty Next 50 Junior BeES FoF-Reg(G),FoFs : Domestic,92,92,87,79,61,51,32,23,1.54,0.18,9.05,17.8,25.95,16.98,12.12,10.94,-2.19,-0.35,4.35,8.69,21.29,15.35,,-8.98
HDFC Dynamic Debt Fund(G),1274,HDFC Mutual Fund,0.36,0.62,0.49,4.01,NIFTY Composite Debt Index,6.47,5.97,6.27,0.24,8,10,9,16,15,15,7,16,HDFC Dynamic Debt Fund(G),Debt : Dynamic Bond,22,22,22,22,22,22,21,19,-0.01,0.29,0.54,0.93,4.98,6.71,5.68,6.82,,,,,,,,
UTI Nifty200 Quality 30 Index Fund-Reg(G),49144,UTI Mutual Fund,-3.08,-0.35,2.96,3.12,NIFTY200 Quality 30 - TRI,,,,-2.65,180,160,99,117,123,,,,UTI Nifty200 Quality 30 Index Fund-Reg(G),Equity : Index Funds,227,228,219,210,179,86,34,18,-1.71,-2.69,-1.24,2.6,6.66,17.61,13.34,13.56,,,,,,,,
ICICI Pru Nifty Metal ETF,33835,ICICI Prudential Mutual Fund,3.73,13.51,27.86,41.75,NIFTY METAL - TRI,,,,6.97,2,3,2,9,2,,,,ICICI Pru Nifty Metal ETF,Equity : ETFs,232,233,215,204,173,124,73,38,-1.19,-2.21,-0.08,5.13,9.63,17.32,14.32,14.76,,,,,,,,
HDFC Nifty G-Sec Sep 2032 Index Fund-Reg(G),46872,HDFC Mutual Fund,0.58,0.81,1.38,6.98,Nifty G-Sec Sep 2032 Index,8.11,,,0.59,3,4,15,14,10,3,,,HDFC Nifty G-Sec Sep 2032 Index Fund-Reg(G),Debt : Gilt,39,39,39,38,37,35,21,21,-0.09,0.31,0.64,0.67,4.6,6.73,5.09,6.97,,,,,,,,
Axis Gilt Fund-Reg(G),15652,Axis Mutual Fund,0.32,0.53,0.75,4.59,CRISIL Dynamic Gilt Index,7.15,5.47,7.11,-0.34,28,21,20,17,17,14,5,9,Axis Gilt Fund-Reg(G),Debt : Gilt,39,39,39,38,37,35,21,21,-0.09,0.31,0.64,0.67,4.6,6.73,5.09,6.97,,,,,,,,
360 ONE Dynamic Bond Fund-Reg(G),17578,360 ONE Mutual Fund,0.53,0.99,2.46,7.94,CRISIL Dynamic Bond Index,8.35,7.01,6.98,0.48,1,1,4,2,1,1,2,6,360 ONE Dynamic Bond Fund-Reg(G),Debt : Dynamic Bond,22,22,22,22,22,22,21,19,-0.01,0.29,0.54,0.93,4.98,6.71,5.68,6.82,,,,,,,,
Nippon India Income Plus Arbitrage Active FoF-Reg(G),49936,Nippon India Mutual Fund,0.42,1.09,2.36,,CRISIL Short Term Bond Index,,,,0.45,34,33,42,51,,,,,Nippon India Income Plus Arbitrage Active FoF-Reg(G),FoFs : Domestic,92,92,87,79,61,51,32,23,1.54,0.18,9.05,17.8,25.95,16.98,12.12,10.94,,,,,,,,
Helios Small Cap Fund-Reg(G),50211,Helios Mutual Fund,-4.55,,,,Nifty Smallcap 250 - TRI,,,,-4.48,32,29,,,,,,,Helios Small Cap Fund-Reg(G),Equity : Small Cap,33,33,31,31,30,24,22,13,-2.82,-3.77,-6.01,-3.42,1.25,18.8,20.61,17.1,,,,,,,,
LIC MF Nifty Midcap 100 ETF,48473,LIC Mutual Fund,-2.84,-0.81,4.14,10.22,Nifty Midcap 100 - TRI,,,,-1.59,131,160,137,109,56,,,,LIC MF Nifty Midcap 100 ETF,Equity : ETFs,232,233,215,204,173,124,73,38,-1.19,-2.21,-0.08,5.13,9.63,17.32,14.32,14.76,,,,,,,,
ICICI Pru Nifty IT Index Fund-Reg(G),46707,ICICI Prudential Mutual Fund,-3.89,2.76,4.0,-14.36,NIFTY IT - TRI,7.01,,,-5.6,217,187,20,70,176,86,,,ICICI Pru Nifty IT Index Fund-Reg(G),Equity : Index Funds,227,228,219,210,179,86,34,18,-1.71,-2.69,-1.24,2.6,6.66,17.61,13.34,13.56,,,,,,,,
Aditya Birla SL ESG Integration Strategy Fund-Reg(G),44736,Aditya Birla Sun Life Mutual Fund,-2.14,0.44,4.69,6.46,NIFTY100 ESG - TRI,16.08,11.46,,-1.19,43,38,24,23,40,27,24,,Aditya Birla SL ESG Integration Strategy Fund-Reg(G),Equity : Thematic,113,112,110,105,91,41,28,9,-1.66,-2.76,-1.73,1.98,6.04,18.73,17.11,15.41,,,,,,,,
Aditya Birla SL CRISIL IBX Gilt Apr 2029 Index Fund-Reg(G),46950,Aditya Birla Sun Life Mutual Fund,0.41,1.33,2.5,7.88,CRISIL IBX Gilt Index - April 2029,8.04,,,0.52,8,17,7,9,1,4,,,Aditya Birla SL CRISIL IBX Gilt Apr 2029 Index Fund-Reg(G),Debt : Gilt,39,39,39,38,37,35,21,21,-0.09,0.31,0.64,0.67,4.6,6.73,5.09,6.97,,,,,,,,
SBI FMP-67-1467D-Reg(G),46703,SBI Mutual Fund,0.45,1.41,2.74,6.93,CRISIL Medium to Long Term Debt Index,7.27,,,0.52,32,31,29,32,34,28,,,SBI FMP-67-1467D-Reg(G),Debt : FTP/FMP,76,76,76,76,76,58,10,3,0.48,0.43,1.36,2.66,6.95,7.32,6.4,6.11,,,,,,,,
WOC Liquid Fund-Reg(G),42211,WhiteOak Capital Mutual Fund,0.48,1.43,2.85,6.24,CRISIL Liquid Debt Index,6.8,5.61,,0.57,17,24,30,31,29,28,30,,WOC Liquid Fund-Reg(G),Debt : Liquid,44,44,42,40,38,36,34,29,0.56,0.48,1.43,2.86,6.26,6.83,5.77,6.01,,,,,,,,
Invesco India Overnight Fund-Reg(G),44317,Invesco Mutual Fund,0.43,1.31,2.67,5.61,Nifty 1D Rate Index,6.31,5.39,,0.51,20,11,10,8,8,5,6,,Invesco India Overnight Fund-Reg(G),Debt : Overnight,35,35,35,35,34,31,27,3,0.51,0.43,1.29,2.65,5.55,6.27,5.36,5.42,0.43,1.33,2.7,5.67,6.39,5.5,,5.1
Invesco India - Invesco Global Consumer Trends FoF-Reg(G),45201,Invesco Mutual Fund,-8.3,-14.82,-1.38,8.09,MSCI World Consumer Discretionary Index - Net Dividend,15.74,-0.31,,-7.12,55,55,56,53,49,36,28,,Invesco India - Invesco Global Consumer Trends FoF-Reg(G),FoFs : Overseas,56,56,56,56,56,53,30,23,2.99,0.23,4.59,15.05,25.51,19.42,10.34,12.21,,,,,,,,
PGIM India Large Cap Fund(G),758,PGIM India Mutual Fund,-3.16,-1.87,1.15,5.4,NIFTY 100 - TRI,11.27,9.67,11.22,-2.49,35,32,30,34,28,34,31,27,PGIM India Large Cap Fund(G),Equity : Large Cap,39,39,39,39,38,36,33,28,-1.66,-2.46,-0.85,2.78,7.34,15.25,12.64,13.51,,,,,,,,
Kotak CRISIL-IBX AAA Financial Services Index - Sep 2027 Fund-Reg(G),49109,Kotak Mahindra Mutual Fund,0.35,1.2,2.69,7.86,CRISIL IBX AAA Financial Services Index - Sep 2027,,,,0.32,43,39,41,12,7,,,,Kotak CRISIL-IBX AAA Financial Services Index - Sep 2027 Fund-Reg(G),Debt : Medium to Long Duration,60,60,60,60,59,42,11,11,0.36,0.38,1.13,2.16,6.96,7.28,5.45,6.31,,,,,,,,
HSBC Income Plus Arbitrage Active FOF-Reg(G),28311,HSBC Mutual Fund,0.35,0.98,2.14,5.29,Nifty Short Duration Debt Index,7.32,5.72,6.43,0.31,48,45,47,58,53,49,32,23,HSBC Income Plus Arbitrage Active FOF-Reg(G),FoFs : Domestic,92,92,87,79,61,51,32,23,1.54,0.18,9.05,17.8,25.95,16.98,12.12,10.94,,,,,,,,
Union Corporate Bond Fund-Reg(G),39478,Union Mutual Fund,0.19,0.55,1.63,6.83,CRISIL Corporate Bond Index,7.14,5.72,,-0.04,21,21,20,20,13,16,15,,Union Corporate Bond Fund-Reg(G),Debt : Corporate Bond,21,21,21,21,21,21,18,13,0.2,0.32,0.78,1.97,7.0,7.31,6.01,7.06,,,,,,,,
ICICI Pru Nifty 200 Momentum 30 ETF,46682,ICICI Prudential Mutual Fund,-3.01,-2.47,1.78,1.73,Nifty200 Momentum 30 - TRI,19.1,,,-0.89,84,169,178,164,140,42,,,ICICI Pru Nifty 200 Momentum 30 ETF,Equity : ETFs,232,233,215,204,173,124,73,38,-1.19,-2.21,-0.08,5.13,9.63,17.32,14.32,14.76,,,,,,,,
UTI Nifty 500 Value 50 Index Fund-Reg(G),47577,UTI Mutual Fund,2.54,7.51,18.13,24.43,NIFTY500 Value 50 - TRI,,,,4.79,4,3,2,4,8,,,,UTI Nifty 500 Value 50 Index Fund-Reg(G),Equity : Index Funds,227,228,219,210,179,86,34,18,-1.71,-2.69,-1.24,2.6,6.66,17.61,13.34,13.56,,,,,,,,
Bandhan Multi-Factor Fund-Reg(G),50021,Bandhan Mutual Fund,-1.31,6.21,6.81,,BSE 200 - TRI,,,,0.43,10,20,2,16,,,,,Bandhan Multi-Factor Fund-Reg(G),Equity : Thematic,113,112,110,105,91,41,28,9,-1.66,-2.76,-1.73,1.98,6.04,18.73,17.11,15.41,,,,,,,,
Baroda BNP Paribas Health and Wellness Fund-Reg(G),49985,Baroda BNP Paribas Mutual Fund,-3.03,-5.39,-6.81,,BSE Health Care - TRI,,,,-2.86,9,8,9,19,,,,,Baroda BNP Paribas Health and Wellness Fund-Reg(G),Equity : Sectoral - Pharma,21,21,20,20,18,11,9,4,-3.43,-3.89,-5.37,-4.15,-1.94,21.8,13.88,11.94,,,,,,,,
LIC MF Small Cap Fund-Reg(G),36914,LIC Mutual Fund,-3.72,-6.93,-4.81,-7.05,Nifty Smallcap 250 - TRI,16.9,19.97,,-3.23,23,18,23,21,30,16,14,,LIC MF Small Cap Fund-Reg(G),Equity : Small Cap,33,33,31,31,30,24,22,13,-2.82,-3.77,-6.01,-3.42,1.25,18.8,20.61,17.1,,,,,,,,
Baroda BNP Paribas Business Cycle Fund-Reg(G),45686,Baroda BNP Paribas Mutual Fund,-3.39,-0.81,1.78,4.0,BSE 500 - TRI,15.89,,,-1.99,60,71,44,52,58,28,,,Baroda BNP Paribas Business Cycle Fund-Reg(G),Equity : Thematic,113,112,110,105,91,41,28,9,-1.66,-2.76,-1.73,1.98,6.04,18.73,17.11,15.41,,,,,,,,
Axis Nifty Midcap 50 Index Fund-Reg(G),46459,Axis Mutual Fund,-2.33,0.05,5.82,12.18,Nifty Midcap 50 - TRI,24.76,,,-1.42,84,94,68,38,32,3,,,Axis Nifty Midcap 50 Index Fund-Reg(G),Equity : Index Funds,227,228,219,210,179,86,34,18,-1.71,-2.69,-1.24,2.6,6.66,17.61,13.34,13.56,,,,,,,,
Quantum Liquid Fund-Reg(G),19756,Quantum Mutual Fund,0.46,1.38,2.74,5.93,CRISIL Liquid Debt Index,6.59,5.55,5.62,0.54,40,38,39,38,36,32,32,28,Quantum Liquid Fund-Reg(G),Debt : Liquid,44,44,42,40,38,36,34,29,0.56,0.48,1.43,2.86,6.26,6.83,5.77,6.01,,,,,,,,
Kotak Gold Silver Passive FOF-Reg(G),50159,Kotak Mahindra Mutual Fund,9.46,52.77,,,Gold-India,,,,9.71,19,17,4,,,,,,Kotak Gold Silver Passive FOF-Reg(G),Gold : MFs,22,22,20,18,17,14,10,10,12.2,10.06,34.32,61.97,90.13,38.24,24.62,17.09,,,,,,,,
Mahindra Manulife Low Duration Fund-Reg(G),36894,Mahindra Manulife Mutual Fund,0.35,1.17,2.52,6.66,CRISIL Low Duration Debt Index,6.83,5.59,,0.36,19,16,21,18,17,17,19,,Mahindra Manulife Low Duration Fund-Reg(G),Debt : Low Duration,26,26,26,25,20,20,20,19,0.39,0.37,1.21,2.61,6.93,7.07,5.91,6.39,,,,,,,,
ICICI Pru Nifty Midcap 150 ETF,44494,ICICI Prudential Mutual Fund,-2.72,-0.83,3.22,10.22,Nifty Midcap 150 - TRI,24.43,21.6,,-1.51,112,149,138,151,57,15,6,,ICICI Pru Nifty Midcap 150 ETF,Equity : ETFs,232,233,215,204,173,124,73,38,-1.19,-2.21,-0.08,5.13,9.63,17.32,14.32,14.76,,,,,,,,
Kotak Transportation & Logistics Fund-Reg(G),48943,Kotak Mahindra Mutual Fund,-2.97,1.04,7.97,17.66,Nifty Transportation & Logistics - TRI,,,,-1.4,5,2,8,10,4,,,,Kotak Transportation & Logistics Fund-Reg(G),Equity : Sectoral - Auto,10,10,10,10,10,4,1,1,-1.46,-3.51,1.92,12.04,18.14,25.95,19.34,13.97,,,,,,,,
HDFC MNC Fund-Reg(G),47648,HDFC Mutual Fund,-2.48,-2.13,1.39,4.53,NIFTY MNC - TRI,,,,-1.01,4,4,5,5,4,,,,HDFC MNC Fund-Reg(G),Equity : Thematic - MNC,7,7,7,7,6,4,4,3,-1.4,-2.45,-2.01,1.93,4.79,12.08,11.03,10.25,,,,,,,,
ITI Focused Fund-Reg(G),45722,ITI Mutual Fund,-2.95,-0.5,3.2,10.85,NIFTY 500 - TRI,,,,-2.45,43,34,11,13,4,,,,ITI Focused Fund-Reg(G),Equity : Flexi Cap,52,52,51,50,48,39,29,21,-1.8,-2.61,-1.86,1.4,5.76,16.58,14.29,14.73,,,,,,,,
Quantum Gold Fund ETF,4326,Quantum Mutual Fund,11.42,26.16,50.49,78.6,Gold-India,36.18,25.14,17.19,14.02,10,2,17,21,13,13,7,8,Quantum Gold Fund ETF,Gold : ETFs,40,40,39,36,31,18,11,11,12.24,8.95,42.76,77.39,107.44,41.8,25.15,17.25,,,,,,,,
WOC Banking & Financial Services Fund-Reg(G),48332,WhiteOak Capital Mutual Fund,-1.47,0.62,6.13,17.67,Nifty Financial Services - TRI,,,,-0.14,19,16,19,18,13,,,,WOC Banking & Financial Services Fund-Reg(G),Equity : Sectoral - Financial Services,24,24,23,23,21,14,12,11,0.13,-1.14,2.02,7.33,18.19,17.59,13.58,15.41,,,,,,,,
Mahindra Manulife Equity Savings Fund-Reg(G),36671,Mahindra Manulife Mutual Fund,-0.34,0.53,3.9,7.47,NIFTY 50 Equity Savings Index - TRI,10.39,8.92,,0.09,8,10,17,6,16,38,37,,Mahindra Manulife Equity Savings Fund-Reg(G),Hybrid : Equity Oriented,63,56,56,55,53,52,50,33,-0.79,-1.24,-0.35,1.98,6.37,12.34,10.81,10.69,,,,,,,,
HDFC NIFTY Smallcap 250 Index Fund-Reg(G),47916,HDFC Mutual Fund,-5.52,-8.18,-6.4,-1.49,Nifty Smallcap 250 - TRI,,,,-4.63,204,210,205,191,152,,,,HDFC NIFTY Smallcap 250 Index Fund-Reg(G),Equity : Index Funds,227,228,219,210,179,86,34,18,-1.71,-2.69,-1.24,2.6,6.66,17.61,13.34,13.56,,,,,,,,
Kotak Quant Fund-Reg(G),48083,Kotak Mahindra Mutual Fund,-1.87,0.01,4.18,7.58,NIFTY 200 - TRI,,,,-0.44,25,31,35,27,35,,,,Kotak Quant Fund-Reg(G),Equity : Thematic,113,112,110,105,91,41,28,9,-1.66,-2.76,-1.73,1.98,6.04,18.73,17.11,15.41,,,,,,,,
ICICI Pru Nifty Smallcap 250 Index Fund(G),45684,ICICI Prudential Mutual Fund,-5.52,-8.21,-6.41,-1.6,Nifty Smallcap 250 - TRI,19.41,,,-4.96,210,211,210,196,156,35,,,ICICI Pru Nifty Smallcap 250 Index Fund(G),Equity : Index Funds,227,228,219,210,179,86,34,18,-1.71,-2.69,-1.24,2.6,6.66,17.61,13.34,13.56,,,,,,,,
ICICI Pru Nifty 200 Momentum 30 Index Fund-Reg(G),46683,ICICI Prudential Mutual Fund,-3.06,-2.65,1.4,0.87,Nifty200 Momentum 30 - TRI,18.07,,,-0.96,68,156,170,155,136,44,,,ICICI Pru Nifty 200 Momentum 30 Index Fund-Reg(G),Equity : Index Funds,227,228,219,210,179,86,34,18,-1.71,-2.69,-1.24,2.6,6.66,17.61,13.34,13.56,,,,,,,,
Mahindra Manulife Consumption Fund-Reg(G),38749,Mahindra Manulife Mutual Fund,-4.6,-6.24,-2.48,-1.02,Nifty India Consumption - TRI,14.6,13.18,,-4.37,10,8,11,8,12,9,11,,Mahindra Manulife Consumption Fund-Reg(G),Equity : Thematic - Consumption,26,26,24,22,20,13,13,10,-4.64,-5.01,-6.51,-3.3,-1.2,14.47,13.75,14.31,,,,,,,,
Kotak Global Innovation Overseas Equity Omni FOF-Reg(G),45334,Kotak Mahindra Mutual Fund,-4.19,-0.56,7.84,11.84,MSCI AC World Index,17.35,,,-0.35,38,47,37,42,43,30,,,Kotak Global Innovation Overseas Equity Omni FOF-Reg(G),FoFs : Overseas,56,56,56,56,56,53,30,23,2.99,0.23,4.59,15.05,25.51,19.42,10.34,12.21,,,,,,,,
Invesco India Consumption Fund-Reg(G),50227,Invesco Mutual Fund,-4.66,-5.14,,,Nifty India Consumption - TRI,,,,-3.29,3,10,5,,,,,,Invesco India Consumption Fund-Reg(G),Equity : Thematic - Consumption,26,26,24,22,20,13,13,10,-4.64,-5.01,-6.51,-3.3,-1.2,14.47,13.75,14.31,,,,,,,,
Mirae Asset Short Duration Fund-Reg(G),38870,Mirae Asset Mutual Fund,0.3,0.77,1.91,6.73,CRISIL Short Duration Debt Index,6.96,5.67,,0.29,15,28,31,31,22,17,15,,Mirae Asset Short Duration Fund-Reg(G),Debt : Short Duration,33,33,33,33,29,23,20,18,0.26,0.36,0.98,2.27,6.98,7.11,6.07,6.61,,,,,,,,
WOC Ultra Short Duration Fund-Reg(G),42221,WhiteOak Capital Mutual Fund,0.33,1.17,2.45,6.08,CRISIL Ultra Short Term Debt Index,6.46,5.52,,0.35,29,28,27,27,23,19,15,,WOC Ultra Short Duration Fund-Reg(G),Debt : Ultra Short Duration,31,31,31,30,26,24,23,13,0.43,0.38,1.29,2.69,6.46,6.74,5.71,6.04,,,,,,,,
Axis Nifty Smallcap 50 Index Fund-Reg(G),45856,Axis Mutual Fund,-4.75,-6.57,-4.11,-0.44,Nifty Smallcap 50 - TRI,23.6,,,-3.99,194,205,198,184,145,7,,,Axis Nifty Smallcap 50 Index Fund-Reg(G),Equity : Index Funds,227,228,219,210,179,86,34,18,-1.71,-2.69,-1.24,2.6,6.66,17.61,13.34,13.56,,,,,,,,
PGIM India Liquid Fund(G),818,PGIM India Mutual Fund,0.49,1.46,2.91,6.38,CRISIL Liquid Debt Index,6.92,5.83,6.13,0.58,9,17,18,12,10,12,14,5,PGIM India Liquid Fund(G),Debt : Liquid,44,44,42,40,38,36,34,29,0.56,0.48,1.43,2.86,6.26,6.83,5.77,6.01,,,,,,,,
Kotak Nifty SDL Plus AAA PSU Bond Jul 2028 60:40 Index Fund-Reg(G),46730,Kotak Mahindra Mutual Fund,0.28,1.18,2.27,7.52,Nifty SDL Plus AAA PSU Bond Jul 2028 60:40 Index,7.59,,,0.2,49,50,43,42,20,14,,,Kotak Nifty SDL Plus AAA PSU Bond Jul 2028 60:40 Index Fund-Reg(G),Debt : Medium to Long Duration,60,60,60,60,59,42,11,11,0.36,0.38,1.13,2.16,6.96,7.28,5.45,6.31,,,,,,,,
HDFC BSE Sensex ETF,34084,HDFC Mutual Fund,-2.45,-0.11,3.56,7.67,BSE SENSEX - TRI,12.33,11.7,14.32,-2.2,165,128,113,124,107,103,50,24,HDFC BSE Sensex ETF,Equity : ETFs,232,233,215,204,173,124,73,38,-1.19,-2.21,-0.08,5.13,9.63,17.32,14.32,14.76,,,,,,,,
Union Business Cycle Fund-Reg(G),48599,Union Mutual Fund,-2.26,-1.66,2.27,6.42,NIFTY 500 - TRI,,,,-0.79,34,42,56,47,42,,,,Union Business Cycle Fund-Reg(G),Equity : Thematic,113,112,110,105,91,41,28,9,-1.66,-2.76,-1.73,1.98,6.04,18.73,17.11,15.41,,,,,,,,
UTI BSE Low Volatility Index Fund-Reg(G),46409,UTI Mutual Fund,-3.01,-0.34,2.31,5.11,BSE Low Volatility Index - TRI,14.83,,,-2.25,165,148,98,139,114,50,,,UTI BSE Low Volatility Index Fund-Reg(G),Equity : Index Funds,227,228,219,210,179,86,34,18,-1.71,-2.69,-1.24,2.6,6.66,17.61,13.34,13.56,,,,,,,,
Quant PSU Fund-Reg(G),48341,Quant Mutual Fund,-3.7,-4.2,1.1,2.11,NIFTY PSE - TRI,,,,-2.21,69,76,86,59,70,,,,Quant PSU Fund-Reg(G),Equity : Thematic,113,112,110,105,91,41,28,9,-1.66,-2.76,-1.73,1.98,6.04,18.73,17.11,15.41,,,,,,,,
Mirae Asset Nifty 1D Rate Liquid ETF(IDCW),48119,Mirae Asset Mutual Fund,0.41,1.24,2.55,5.32,Nifty 1D Rate Index,,,,0.47,15,14,12,9,23,,,,Mirae Asset Nifty 1D Rate Liquid ETF(IDCW),Debt : ETFs,33,33,33,32,30,14,9,2,0.38,0.4,1.07,2.15,6.23,7.36,5.68,5.83,0.43,1.33,2.7,5.67,6.39,5.5,,5.1
Edelweiss Low Duration Fund-Reg(G),49709,Edelweiss Mutual Fund,0.33,1.18,2.41,,CRISIL Low Duration Debt Index,,,,0.37,18,22,16,24,,,,,Edelweiss Low Duration Fund-Reg(G),Debt : Low Duration,26,26,26,25,20,20,20,19,0.39,0.37,1.21,2.61,6.93,7.07,5.91,6.39,,,,,,,,
Edelweiss CRISIL PSU Plus SDL 50:50 Oct 2025 Index Fund-Reg(G),46448,Edelweiss Mutual Fund,0.48,1.37,2.95,6.58,CRISIL IBX 50:50 PSU + SDL Index - October 2025,7.01,,,0.0,25,7,10,4,19,13,,,Edelweiss CRISIL PSU Plus SDL 50:50 Oct 2025 Index Fund-Reg(G),Debt : Medium Duration,25,25,25,25,25,19,12,12,0.46,0.43,1.24,2.54,7.27,7.37,6.78,6.71,,,,,,,,
Mirae Asset Nifty SDL Jun 2027 Index Fund-Reg(G),46134,Mirae Asset Mutual Fund,0.38,1.4,2.65,7.37,Nifty SDL Jun 2027 Index,7.58,,,0.57,8,27,6,20,33,15,,,Mirae Asset Nifty SDL Jun 2027 Index Fund-Reg(G),Debt : Medium to Long Duration,60,60,60,60,59,42,11,11,0.36,0.38,1.13,2.16,6.96,7.28,5.45,6.31,,,,,,,,
ITI Large Cap Fund-Reg(G),44400,ITI Mutual Fund,-3.82,-2.07,1.79,4.39,NIFTY 100 - TRI,13.58,9.78,,-2.54,36,37,32,30,34,27,30,,ITI Large Cap Fund-Reg(G),Equity : Large Cap,39,39,39,39,38,36,33,28,-1.66,-2.46,-0.85,2.78,7.34,15.25,12.64,13.51,,,,,,,,
Bajaj Finserv Nifty 1D Rate Liquid ETF(G),48746,Bajaj Finserv Mutual Fund,0.4,1.21,2.49,5.28,Nifty 1D Rate Index,,,,0.47,13,20,15,14,25,,,,Bajaj Finserv Nifty 1D Rate Liquid ETF(G),Debt : ETFs,33,33,33,32,30,14,9,2,0.38,0.4,1.07,2.15,6.23,7.36,5.68,5.83,0.43,1.33,2.7,5.67,6.39,5.5,,5.1
ICICI Pru Nifty IT ETF,44401,ICICI Prudential Mutual Fund,-3.82,2.95,4.43,-13.84,NIFTY IT - TRI,7.78,9.34,,-5.52,223,194,41,83,169,118,66,,ICICI Pru Nifty IT ETF,Equity : ETFs,232,233,215,204,173,124,73,38,-1.19,-2.21,-0.08,5.13,9.63,17.32,14.32,14.76,,,,,,,,
UTI Gilt Fund-Reg(G),3560,UTI Mutual Fund,0.8,1.15,1.05,4.86,CRISIL Dynamic Gilt Index,6.86,5.49,7.47,0.67,1,1,12,16,16,16,4,6,UTI Gilt Fund-Reg(G),Debt : Gilt,39,39,39,38,37,35,21,21,-0.09,0.31,0.64,0.67,4.6,6.73,5.09,6.97,,,,,,,,
Kotak Nifty 200 Momentum 30 Index Fund-Reg(G),47977,Kotak Mahindra Mutual Fund,-3.05,-2.56,1.54,1.59,Nifty200 Momentum 30 - TRI,,,,-0.93,66,151,166,151,130,,,,Kotak Nifty 200 Momentum 30 Index Fund-Reg(G),Equity : Index Funds,227,228,219,210,179,86,34,18,-1.71,-2.69,-1.24,2.6,6.66,17.61,13.34,13.56,,,,,,,,
LIC MF Aggressive Hybrid Fund(G),2085,LIC Mutual Fund,-3.22,-2.14,0.83,6.58,CRISIL Hybrid 35+65 - Aggressive Index,12.95,9.86,10.4,-2.41,61,55,53,44,26,22,28,17,LIC MF Aggressive Hybrid Fund(G),Hybrid : Equity Oriented,63,56,56,55,53,52,50,33,-0.79,-1.24,-0.35,1.98,6.37,12.34,10.81,10.69,,,,,,,,
Tata Housing Opportunities Fund-Reg(G),46764,Tata Mutual Fund,-2.44,-2.83,-0.74,3.24,Nifty Housing - TRI,14.27,,,-0.45,27,51,67,75,63,30,,,Tata Housing Opportunities Fund-Reg(G),Equity : Thematic,113,112,110,105,91,41,28,9,-1.66,-2.76,-1.73,1.98,6.04,18.73,17.11,15.41,,,,,,,,
HSBC Credit Risk Fund-Reg(G),8016,HSBC Mutual Fund,0.39,1.15,2.43,19.89,NIFTY Credit Risk Bond Index,11.01,8.58,7.18,0.31,11,12,11,11,1,3,6,7,HSBC Credit Risk Fund-Reg(G),Debt : Credit Risk,15,15,15,15,15,15,15,13,0.85,0.67,1.65,3.21,10.1,8.64,8.94,6.46,,,,,,,,
Franklin India Retirement Fund(G),3396,Franklin Templeton Mutual Fund,-0.98,-0.71,0.79,4.82,CRISIL Short Term Debt Hybrid 60+40 Index,10.25,8.11,8.49,-0.62,15,11,21,28,24,28,26,15,Franklin India Retirement Fund(G),Hybrid : Solution Oriented,43,43,43,43,43,38,33,17,-1.19,-1.69,-1.08,1.4,5.78,13.02,10.9,10.77,,,,,,,,
WOC Pharma and Healthcare Fund-Reg(G),48472,WhiteOak Capital Mutual Fund,-3.95,-6.48,-3.83,0.1,BSE Health Care - TRI,,,,-3.39,12,13,17,8,7,,,,WOC Pharma and Healthcare Fund-Reg(G),Equity : Sectoral - Pharma,21,21,20,20,18,11,9,4,-3.43,-3.89,-5.37,-4.15,-1.94,21.8,13.88,11.94,,,,,,,,
Invesco India Gold ETF,8505,Invesco Mutual Fund,11.06,25.4,49.76,76.1,Gold-India,36.15,25.21,17.34,14.56,4,21,33,33,26,16,4,2,Invesco India Gold ETF,Gold : ETFs,40,40,39,36,31,18,11,11,12.24,8.95,42.76,77.39,107.44,41.8,25.15,17.25,,,,,,,,
Bandhan Nifty Alpha 50 Index Fund-Reg(G),48314,Bandhan Mutual Fund,-3.33,-4.02,-5.56,-1.98,Nifty Alpha 50 - TRI,,,,-1.18,72,174,183,186,159,,,,Bandhan Nifty Alpha 50 Index Fund-Reg(G),Equity : Index Funds,227,228,219,210,179,86,34,18,-1.71,-2.69,-1.24,2.6,6.66,17.61,13.34,13.56,,,,,,,,
Edelweiss Consumption Fund-Reg(G),49329,Edelweiss Mutual Fund,-4.65,-5.13,-0.77,,Nifty India Consumption - TRI,,,,-4.68,14,9,4,4,,,,,Edelweiss Consumption Fund-Reg(G),Equity : Thematic - Consumption,26,26,24,22,20,13,13,10,-4.64,-5.01,-6.51,-3.3,-1.2,14.47,13.75,14.31,,,,,,,,
Bank of India Business Cycle Fund-Reg(G),48964,Bank of India Mutual Fund,-3.65,-7.63,-3.33,-2.46,NIFTY 500 - TRI,,,,-2.78,86,75,107,98,83,,,,Bank of India Business Cycle Fund-Reg(G),Equity : Thematic,113,112,110,105,91,41,28,9,-1.66,-2.76,-1.73,1.98,6.04,18.73,17.11,15.41,,,,,,,,
Canara Rob Ultra Short Term Fund-Reg(G),5902,Canara Robeco Mutual Fund,0.36,1.19,2.51,6.23,CRISIL Ultra Short Term Debt Index,6.47,5.27,5.6,0.38,27,25,25,26,19,18,21,11,Canara Rob Ultra Short Term Fund-Reg(G),Debt : Ultra Short Duration,31,31,31,30,26,24,23,13,0.43,0.38,1.29,2.69,6.46,6.74,5.71,6.04,,,,,,,,
Motilal Oswal Ultra Short Term Fund-Reg(G),22532,Motilal Oswal Mutual Fund,0.32,1.11,2.31,5.23,CRISIL Ultra Short Term Debt Index,5.71,4.68,3.65,0.37,28,30,30,29,26,24,23,13,Motilal Oswal Ultra Short Term Fund-Reg(G),Debt : Ultra Short Duration,31,31,31,30,26,24,23,13,0.43,0.38,1.29,2.69,6.46,6.74,5.71,6.04,,,,,,,,
SBI FMP-42-1857D-Reg(G),45447,SBI Mutual Fund,0.45,1.39,2.73,6.59,CRISIL Medium to Long Term Debt Index,7.13,,,0.53,28,28,39,35,63,35,,,SBI FMP-42-1857D-Reg(G),Debt : FTP/FMP,76,76,76,76,76,58,10,3,0.48,0.43,1.36,2.66,6.95,7.32,6.4,6.11,,,,,,,,
LIC MF Consumption Fund-Reg(G),50393,LIC Mutual Fund,-3.72,,,,Nifty India Consumption - TRI,,,,-3.19,2,2,,,,,,,LIC MF Consumption Fund-Reg(G),Equity : Thematic - Consumption,26,26,24,22,20,13,13,10,-4.64,-5.01,-6.51,-3.3,-1.2,14.47,13.75,14.31,,,,,,,,
HDFC FMP-Sr 46-1861D-Mar 2022-Reg(G),46453,HDFC Mutual Fund,0.41,1.5,2.77,7.53,NIFTY Medium to Long Duration Debt Index,7.64,,,0.57,4,56,6,19,11,12,,,HDFC FMP-Sr 46-1861D-Mar 2022-Reg(G),Debt : FTP/FMP,76,76,76,76,76,58,10,3,0.48,0.43,1.36,2.66,6.95,7.32,6.4,6.11,,,,,,,,
Edelweiss Banking and PSU Debt Fund-Reg(G),23296,Edelweiss Mutual Fund,0.31,0.71,1.74,6.6,CRISIL Banking and PSU Debt Index,7.17,6.17,7.4,0.27,11,21,20,23,22,11,4,2,Edelweiss Banking and PSU Debt Fund-Reg(G),Debt : Banking & PSU,26,26,26,26,26,25,19,16,0.25,0.37,0.92,2.17,6.85,7.14,5.94,7.02,,,,,,,,
Motilal Oswal Innovation Opportunities Fund-Reg(G),49313,Motilal Oswal Mutual Fund,-2.74,-7.33,-2.03,,NIFTY 500 - TRI,,,,-2.17,67,60,105,87,,,,,Motilal Oswal Innovation Opportunities Fund-Reg(G),Equity : Thematic,113,112,110,105,91,41,28,9,-1.66,-2.76,-1.73,1.98,6.04,18.73,17.11,15.41,,,,,,,,
