MF Code,incept_date,schemecode,sdx_returns,sharpex_returns,sotinox_returns,betax_returns,alphax_returns,treynorx_returns,sdy_returns,sharpey_returns,sotinoy_returns,betay_returns,alphay_returns,treynory_returns,rank_sd,rank_sharpe,rank_sotino,rank_beta,rank_alpha,rank_treynor,index_name,s_name,avg_std_dev,avg_sharpe,avg_sotino,avg_beta,avg_alpha,avg_treyno,no_of_funds_total
ICICI Pru Nifty Auto Index Fund-Reg(G),2022-10-11,45995,17.1,0.31,0.57,0.99,-0.09,-1.11,1.26,0.01,0.02,1.06,0.0,0.0,8,3,3,8,6,4,NIFTY AUTO - TRI,ICICI Pru Nifty Auto Index Fund-Reg(G),15.89,-0.04,0.06,0.94,-0.07,0.06,6
TRUSTMF Banking & PSU Fund-Reg(G),2021-02-01,45242,1.42,0.38,0.52,0.86,-0.11,14.77,0.04,0.36,0.69,0.25,0.01,0.06,19,21,23,19,21,10,CRISIL Banking and PSU Debt Index,TRUSTMF Banking & PSU Fund-Reg(G),1.35,0.65,0.86,0.62,0.03,16.01,26
Nippon India Active Momentum Fund-Reg(G),2025-02-28,49115,10.12,1.32,3.58,0.93,0.11,,,,,,,,5,4,1,35,41,,NIFTY 500 - TRI,Nippon India Active Momentum Fund-Reg(G),16.52,0.07,0.22,1.0,-0.03,4.99,60
ICICI Pru Nifty Healthcare ETF,2021-05-18,45383,16.07,0.25,0.5,1.0,-0.01,24.62,1.0,0.07,0.11,0.59,0.06,0.1,103,49,45,103,53,4,Nifty Healthcare Index - TRI,ICICI Pru Nifty Healthcare ETF,16.82,0.21,0.41,1.0,0.13,5.88,148
SBI FMP-46-1850D-Reg(G),2021-07-07,45620,1.94,0.33,0.47,0.74,-0.01,11.26,0.02,0.16,0.27,0.11,0.0,0.04,65,88,85,60,79,74,CRISIL Medium to Long Term Debt Index,SBI FMP-46-1850D-Reg(G),1.25,1.1,0.85,0.59,0.07,547.36,91
Groww Liquid Fund-Reg(G),2011-10-25,15502,0.33,2.09,0.92,1.13,-0.04,153.95,0.01,0.66,0.79,0.0,0.01,0.61,37,38,33,32,35,6,CRISIL Liquid Debt Index,Groww Liquid Fund-Reg(G),0.29,2.7,0.95,0.77,0.04,99.58,37
Motilal Oswal Quant Fund-Reg(G),2024-06-06,48806,19.59,-0.26,-0.37,1.23,-0.81,,,,,,,,78,77,74,89,88,,NIFTY 200 - TRI,Motilal Oswal Quant Fund-Reg(G),16.52,0.07,0.22,1.0,-0.03,4.99,60
Union Gilt Fund-Reg(G),2022-08-08,46221,2.44,0.45,1.07,0.86,-0.02,5.77,0.17,0.1,0.16,1.36,0.0,0.02,28,18,19,30,34,27,CRISIL Dynamic Gilt Index,Union Gilt Fund-Reg(G),2.15,0.57,1.09,0.69,0.05,9.27,35
Motilal Oswal BSE Enhanced Value ETF,2022-08-22,46740,19.73,0.45,1.04,0.99,3.62,3.4,1.55,0.02,0.03,1.35,0.01,0.01,136,11,11,18,3,100,BSE Enhanced Value Index - TRI,Motilal Oswal BSE Enhanced Value ETF,16.82,0.21,0.41,1.0,0.13,5.88,148
Aditya Birla SL Nifty Next 50 ETF,2018-12-18,38262,20.03,0.17,0.31,1.0,0.0,3.91,1.37,0.02,0.03,1.24,0.02,0.02,138,83,121,74,25,92,NIFTY NEXT 50 - TRI,Aditya Birla SL Nifty Next 50 ETF,16.82,0.21,0.41,1.0,0.13,5.88,148
Edelweiss Nifty Alpha Low Volatility 30 Index Fund-Reg(G),2024-05-16,48808,16.13,-0.21,-0.32,1.0,-0.09,,,,,,,,99,144,143,165,127,,NIFTY Alpha Low-Volatility 30 - TRI,Edelweiss Nifty Alpha Low Volatility 30 Index Fund-Reg(G),17.29,0.11,0.15,1.0,-0.02,4.32,115
Kotak FMP-310-1131D(G),2023-03-27,47871,0.65,1.44,1.1,0.32,0.15,25.0,0.04,0.35,0.67,0.16,0.01,0.1,24,24,22,14,16,42,NIFTY Medium Duration Debt Index,Kotak FMP-310-1131D(G),1.25,1.1,0.85,0.59,0.07,547.36,91
LIC MF Focused Fund-Reg(G),2017-11-17,32627,14.34,0.12,0.22,0.93,-0.26,7.11,1.08,0.02,0.03,0.93,0.01,0.03,30,34,35,17,36,18,NIFTY 500 - TRI,LIC MF Focused Fund-Reg(G),13.7,0.18,0.36,0.96,0.08,5.67,37
DSP World Mining FoF-Reg(G),2009-12-29,8359,25.11,-0.06,-0.1,0.72,-0.94,-2.49,1.47,0.02,0.03,1.29,0.01,-0.01,52,54,54,37,54,48,MSCI ACWI Metals & Mining 30% Buffer 10/40 (1994) Net TRI,DSP World Mining FoF-Reg(G),18.75,0.1,0.18,0.74,0.09,9.0,57
Axis NIFTY IT Index Fund-Reg(G),2023-07-14,47983,21.39,0.13,0.25,0.99,-0.07,1.66,1.25,0.0,0.01,0.8,0.0,0.01,161,111,111,48,60,95,NIFTY IT - TRI,Axis NIFTY IT Index Fund-Reg(G),17.29,0.11,0.15,1.0,-0.02,4.32,115
Axis BSE Sensex ETF,2023-03-24,47768,11.23,0.28,0.6,1.0,-0.01,6.48,0.87,0.02,0.03,0.99,0.01,0.03,8,29,27,36,67,75,BSE SENSEX - TRI,Axis BSE Sensex ETF,16.82,0.21,0.41,1.0,0.13,5.88,148
Shriram Overnight Fund-Reg(G),2022-08-26,46777,0.1,6.88,0.77,0.98,-0.01,-176.05,0.0,0.99,0.08,0.0,0.0,-0.7,5,5,31,27,12,6,CRISIL Liquid Overnight Index,Shriram Overnight Fund-Reg(G),0.2,3.5,0.87,0.96,-0.01,-499.81,34
Canara Rob Dynamic Bond Fund-Reg(G),2009-05-29,7792,2.35,0.3,0.72,1.66,-0.55,5.17,0.15,0.08,0.13,1.22,0.0,0.02,14,20,17,21,21,21,CRISIL Dynamic Bond Index,Canara Rob Dynamic Bond Fund-Reg(G),2.21,0.44,0.92,1.04,-0.18,9.88,22
DSP FMP 268-1281D-Reg(G),2022-11-24,47124,0.76,1.27,1.15,0.35,0.16,37.07,0.04,0.39,0.93,0.1,0.01,0.15,28,29,14,17,14,16,CRISIL Medium Duration Debt Index,DSP FMP 268-1281D-Reg(G),1.25,1.1,0.85,0.59,0.07,547.36,91
ICICI Pru Quant Fund(G),2020-12-11,42805,11.46,0.26,0.5,0.77,0.26,12.45,0.81,0.05,0.08,0.82,0.03,0.05,7,27,29,9,34,7,BSE 200 - TRI,ICICI Pru Quant Fund(G),16.52,0.07,0.22,1.0,-0.03,4.99,60
HSBC Nifty Next 50 Index Fund-Reg(G),2020-04-15,33548,20.01,0.16,0.29,1.0,-0.08,2.87,1.37,0.02,0.03,1.24,0.01,0.01,138,79,105,107,103,84,NIFTY NEXT 50 - TRI,HSBC Nifty Next 50 Index Fund-Reg(G),17.29,0.11,0.15,1.0,-0.02,4.32,115
Quant Gilt Fund-Reg(G),2022-12-21,47345,1.43,0.65,1.14,0.86,-0.04,8.97,0.06,0.21,0.41,0.52,0.01,0.04,7,13,16,31,36,15,CRISIL Dynamic Gilt Index,Quant Gilt Fund-Reg(G),2.15,0.57,1.09,0.69,0.05,9.27,35
SBI FMP-78-1170D-Reg(G),2023-02-21,47638,0.69,1.44,1.11,0.31,0.17,12.6,0.02,0.18,0.3,0.09,0.0,0.05,26,23,19,11,7,67,CRISIL Medium Duration Debt Index,SBI FMP-78-1170D-Reg(G),1.25,1.1,0.85,0.59,0.07,547.36,91
SBI Magnum Childrens Benefit Fund-Savings Plan,2002-01-28,2748,4.82,0.46,1.02,0.26,0.48,9.83,0.29,0.13,0.22,0.89,0.03,0.04,8,2,1,2,2,2,NIFTY 50 Hybrid Composite Debt 15:85 Index,SBI Magnum Childrens Benefit Fund-Savings Plan,10.02,0.21,0.42,0.93,0.06,3.54,41
ICICI Pru Nifty Infrastructure ETF,2022-08-17,45998,15.01,0.33,0.68,1.0,-0.02,2.39,1.27,0.01,0.01,1.27,0.0,0.01,83,21,21,121,126,116,Nifty Infrastructure - TRI,ICICI Pru Nifty Infrastructure ETF,16.82,0.21,0.41,1.0,0.13,5.88,148
Aditya Birla SL Debt Plus Arbitrage FOF-Reg(G),2006-12-28,2277,1.28,0.59,0.9,0.46,0.1,13.13,0.14,0.11,0.19,0.41,0.01,0.05,3,4,9,15,31,8,CRISIL Composite Bond Index,Aditya Birla SL Debt Plus Arbitrage FOF-Reg(G),10.95,0.26,0.52,0.82,0.25,-3.51,56
Baroda BNP Paribas NIFTY SDL Dec 2026 Index Fund-Reg(G),2023-01-25,47387,1.0,1.01,1.21,1.8,-0.17,21.22,0.05,0.3,0.66,0.18,0.01,0.08,7,12,32,58,58,6,NIFTY SDL December 2026 Index,Baroda BNP Paribas NIFTY SDL Dec 2026 Index Fund-Reg(G),1.66,0.82,1.04,0.62,0.04,15.06,52
SBI FMP-50-1843D-Reg(G),2021-09-07,45842,2.12,0.3,0.43,0.82,-0.03,11.14,0.03,0.17,0.29,0.12,0.0,0.04,80,92,92,71,90,77,CRISIL Medium to Long Term Debt Index,SBI FMP-50-1843D-Reg(G),1.25,1.1,0.85,0.59,0.07,547.36,91
Nippon India Nifty G-Sec Oct 2028 Maturity Index Fund-Reg(G),2023-03-06,47629,1.31,0.91,1.37,0.51,0.12,13.13,0.06,0.28,0.57,0.47,0.01,0.05,25,21,14,21,24,35,Nifty G-Sec Oct 2028 Index,Nippon India Nifty G-Sec Oct 2028 Maturity Index Fund-Reg(G),1.66,0.82,1.04,0.62,0.04,15.06,52
Quantum Equity FoF-Reg(G),2009-07-20,19904,13.45,0.21,0.39,0.93,0.08,3.07,0.91,0.04,0.06,2.79,0.01,0.01,41,43,43,34,33,40,BSE 200 - TRI,Quantum Equity FoF-Reg(G),10.95,0.26,0.52,0.82,0.25,-3.51,56
Groww Largecap Fund-Reg(G),2012-02-10,15997,13.96,0.16,0.31,0.99,-0.02,1.69,0.97,0.0,0.01,1.04,-0.01,0.01,26,28,27,25,27,30,NIFTY 100 - TRI,Groww Largecap Fund-Reg(G),13.7,0.18,0.36,0.96,0.08,5.67,37
SBI Nifty 200 Quality 30 ETF,2018-12-10,41015,13.94,0.16,0.31,1.0,-0.04,5.32,0.87,0.01,0.02,0.79,0.0,0.02,67,105,118,98,157,88,NIFTY200 Quality 30 - TRI,SBI Nifty 200 Quality 30 ETF,16.82,0.21,0.41,1.0,0.13,5.88,148
Edelweiss Nifty Next 50 Index Fund-Reg(G),2022-11-30,47171,19.14,0.22,0.39,1.0,-0.08,3.05,1.37,0.02,0.03,1.23,0.01,0.01,123,46,50,87,81,81,NIFTY NEXT 50 - TRI,Edelweiss Nifty Next 50 Index Fund-Reg(G),17.29,0.11,0.15,1.0,-0.02,4.32,115
Canara Rob Income Fund-Reg(G),2002-09-19,542,2.14,0.28,0.58,0.68,-0.05,6.68,0.11,0.12,0.2,0.88,0.0,0.03,48,58,47,48,56,51,CRISIL Medium to Long Term Debt Index,Canara Rob Income Fund-Reg(G),1.66,0.82,1.04,0.62,0.04,15.06,52
Canara Rob Corp Bond Fund-Reg(G),2014-02-07,23504,1.16,0.5,0.75,0.32,0.06,11.42,0.05,0.29,0.54,0.35,0.01,0.05,6,15,15,5,17,20,CRISIL Corporate Bond Index,Canara Rob Corp Bond Fund-Reg(G),1.34,0.6,0.83,0.38,0.09,13.4,21
Groww Nifty EV & New Age Automotive ETF FOF-Reg(G),2024-08-12,48990,16.03,-0.74,-0.85,0.98,-0.19,,,,,,,,48,62,62,39,55,,Nifty EV and New Age Automotive - TRI,Groww Nifty EV & New Age Automotive ETF FOF-Reg(G),10.95,0.26,0.52,0.82,0.25,-3.51,56
Shriram Liquid Fund-Reg(G),2024-11-14,48954,0.13,6.01,0.94,0.11,0.2,,,,,,,,2,2,30,2,1,,Nifty Liquid Fund Index,Shriram Liquid Fund-Reg(G),0.29,2.7,0.95,0.77,0.04,99.58,37
SBI FMP-43-1616D-Reg(G),2021-04-29,45525,1.71,0.33,0.46,0.62,0.0,19.35,0.01,0.21,0.3,0.04,0.0,0.08,60,78,90,53,69,51,CRISIL Medium Duration Debt Index,SBI FMP-43-1616D-Reg(G),1.25,1.1,0.85,0.59,0.07,547.36,91
Bandhan Nifty200 Momentum 30 Index Fund-Reg(G),2022-09-02,46608,18.66,0.17,0.31,1.0,-0.12,-6.96,1.44,-0.02,-0.02,1.31,-0.04,-0.03,116,62,85,108,163,115,Nifty200 Momentum 30 - TRI,Bandhan Nifty200 Momentum 30 Index Fund-Reg(G),17.29,0.11,0.15,1.0,-0.02,4.32,115
Mirae Asset Dynamic Bond Fund-Reg(G),2017-03-24,36556,2.16,0.19,0.28,0.38,-0.06,15.62,0.03,0.34,0.68,0.2,0.01,0.06,12,22,22,1,9,2,CRISIL Dynamic Bond Index,Mirae Asset Dynamic Bond Fund-Reg(G),2.21,0.44,0.92,1.04,-0.18,9.88,22
ICICI Pru BSE 500 ETF FOF-Reg(G),2021-12-01,45726,14.34,0.17,0.33,0.98,-0.08,1.59,0.89,0.02,0.03,2.75,-0.01,0.01,43,50,49,37,50,47,BSE 500 - TRI,ICICI Pru BSE 500 ETF FOF-Reg(G),10.95,0.26,0.52,0.82,0.25,-3.51,56
Motilal Oswal Nifty 500 ETF,2023-10-06,48267,14.46,0.25,0.49,1.0,-0.01,5.57,0.98,0.02,0.04,1.03,0.01,0.02,72,44,48,95,71,85,NIFTY 500 - TRI,Motilal Oswal Nifty 500 ETF,16.82,0.21,0.41,1.0,0.13,5.88,148
Mirae Asset Nifty 100 ESG Sector Leaders ETF,2020-11-18,45134,13.47,0.14,0.27,1.0,-0.06,7.08,0.9,0.02,0.04,1.0,0.01,0.03,55,132,132,43,162,49,Nifty100 ESG Sector Leaders - TRI,Mirae Asset Nifty 100 ESG Sector Leaders ETF,16.82,0.21,0.41,1.0,0.13,5.88,148
PGIM India Gilt Fund(G),2008-10-27,7012,2.24,0.39,1.01,0.62,0.05,6.33,0.16,0.11,0.17,1.22,0.0,0.03,19,24,21,13,18,19,CRISIL Dynamic Gilt Index,PGIM India Gilt Fund(G),2.15,0.57,1.09,0.69,0.05,9.27,35
Navi Aggressive Hybrid Fund-Reg(G),2018-04-30,39479,10.41,0.19,0.35,1.03,-0.06,2.67,0.75,0.03,0.05,1.94,0.0,0.01,34,41,40,37,46,38,CRISIL Hybrid 35+65 - Aggressive Index,Navi Aggressive Hybrid Fund-Reg(G),8.53,0.41,0.51,0.8,0.1,1.33,55
Motilal Oswal Nifty 200 Momentum 30 ETF,2022-02-10,46325,20.77,0.12,0.22,1.0,-0.03,-6.05,1.44,-0.01,-0.02,1.31,-0.03,-0.02,145,136,137,154,141,142,Nifty200 Momentum 30 - TRI,Motilal Oswal Nifty 200 Momentum 30 ETF,16.82,0.21,0.41,1.0,0.13,5.88,148
JM Short Duration Fund-Reg(G),2022-08-29,46751,0.87,0.86,1.02,1.4,-0.12,13.71,0.04,0.32,0.61,0.3,0.01,0.05,5,12,13,32,30,16,CRISIL Short Duration Debt Index,JM Short Duration Fund-Reg(G),1.32,0.91,1.03,0.61,0.06,14.62,26
Edelweiss Emerging Markets Opp Eq. Offshore Fund-Reg(G),2014-07-07,20281,14.61,-0.03,-0.04,0.42,-0.39,1.71,0.96,0.03,0.05,1.56,0.01,0.01,10,50,48,12,47,44,MSCI Emerging Market Index,Edelweiss Emerging Markets Opp Eq. Offshore Fund-Reg(G),18.75,0.1,0.18,0.74,0.09,9.0,57
UTI Long Duration Fund-Reg(G),2023-03-17,47733,3.58,0.43,1.12,1.35,-0.16,4.89,0.19,0.08,0.13,1.5,0.0,0.02,21,22,19,19,21,24,NIFTY Long Duration Debt Index,UTI Long Duration Fund-Reg(G),2.86,0.6,1.27,1.14,-0.05,8.57,24
Bandhan Conservative Hybrid Fund-Reg(G),2010-02-25,8465,4.0,0.17,0.35,1.04,-0.16,8.37,0.22,0.07,0.11,0.7,0.01,0.03,12,16,16,16,17,4,NIFTY AAA Short Duration Bond Index,Bandhan Conservative Hybrid Fund-Reg(G),4.11,0.31,0.7,0.92,0.05,6.35,18
Aditya Birla SL CRISIL IBX Gilt June 2027 Index Fund-Reg(G),2024-06-05,48450,0.72,1.7,1.23,0.41,0.18,,,,,,,,1,1,11,5,2,,CRISIL IBX Gilt Index - June 2027,Aditya Birla SL CRISIL IBX Gilt June 2027 Index Fund-Reg(G),2.15,0.57,1.09,0.69,0.05,9.27,35
DSP Income Plus Arbitrage FoF-Reg(G),2014-08-21,14756,9.54,0.14,0.27,0.51,0.17,21.37,0.58,0.04,0.06,0.65,0.01,0.08,3,18,18,19,27,9,CRISIL Dynamic Bond Index,DSP Income Plus Arbitrage FoF-Reg(G),18.75,0.1,0.18,0.74,0.09,9.0,57
Tata Nifty500 Multicap India Manufacturing 50:30:20 Index Fund-Reg(G),2024-04-26,48782,16.22,-0.03,-0.06,1.0,-0.1,,,,,,,,101,132,132,121,133,,Nifty500 Multicap India Manufacturing 50:30:20 - TRI,Tata Nifty500 Multicap India Manufacturing 50:30:20 Index Fund-Reg(G),17.29,0.11,0.15,1.0,-0.02,4.32,115
Taurus Mid Cap Fund-Reg(G),1994-09-05,3306,17.63,0.18,0.33,0.98,-0.41,-0.88,1.31,0.0,0.01,1.1,-0.01,0.0,28,30,30,29,30,29,Nifty Midcap 150 - TRI,Taurus Mid Cap Fund-Reg(G),16.1,0.55,0.52,0.91,0.06,7.77,30
Bank of India Short Term Income Fund-Reg(G),2008-12-18,7456,6.58,0.3,1.86,0.12,0.53,19.4,0.13,0.16,0.81,0.32,0.02,0.08,34,33,4,3,1,2,CRISIL Short Duration Debt Index,Bank of India Short Term Income Fund-Reg(G),1.32,0.91,1.03,0.61,0.06,14.62,26
ICICI Pru Nifty Auto ETF,2022-01-12,46229,17.27,0.37,0.74,1.0,-0.01,-0.3,1.26,0.02,0.03,1.06,0.01,0.0,112,17,18,99,70,131,NIFTY AUTO - TRI,ICICI Pru Nifty Auto ETF,16.82,0.21,0.41,1.0,0.13,5.88,148
Nippon India FHF-XLV-4-1111D(G),2023-03-31,47822,0.64,1.5,1.12,0.32,0.16,25.53,0.04,0.36,0.69,0.16,0.01,0.1,22,21,18,12,13,37,CRISIL Medium Duration Debt Index,Nippon India FHF-XLV-4-1111D(G),1.25,1.1,0.85,0.59,0.07,547.36,91
Kotak FMP-304-3119D(G),2022-12-30,47401,2.34,0.71,1.45,1.37,-0.01,10.53,0.13,0.18,0.32,0.93,0.01,0.04,92,55,2,93,80,83,NIFTY Long Duration Debt Index,Kotak FMP-304-3119D(G),1.25,1.1,0.85,0.59,0.07,547.36,91
Bajaj Finserv Banking and PSU Fund-Reg(G),2023-11-13,48214,1.13,1.09,1.31,0.49,0.08,13.51,0.06,0.24,0.43,0.36,0.01,0.05,9,4,1,14,13,15,NIFTY Banking and PSU Debt Index,Bajaj Finserv Banking and PSU Fund-Reg(G),1.35,0.65,0.86,0.62,0.03,16.01,26
Axis CRISIL-IBX AAA Bond Financial Services - Sep 2027 Index Fund-Reg(G),2024-11-22,49254,1.24,1.09,1.46,0.07,0.5,,,,,,,,21,8,5,2,1,,CRISIL IBX AAA Financial Services Index - Sep 2027,Axis CRISIL-IBX AAA Bond Financial Services - Sep 2027 Index Fund-Reg(G),1.66,0.82,1.04,0.62,0.04,15.06,52
Bandhan CRISIL IBX 90:10 SDL Plus Gilt - Nov 2026 Index Fund-Reg(G),2022-11-17,46213,0.92,1.04,1.16,0.32,0.15,21.72,0.04,0.35,0.78,0.17,0.01,0.09,5,11,33,7,8,5,CRISIL IBX 90:10 SDL Plus Gilt Index - November 2026,Bandhan CRISIL IBX 90:10 SDL Plus Gilt - Nov 2026 Index Fund-Reg(G),1.66,0.82,1.04,0.62,0.04,15.06,52
ICICI Pru Nifty Financial Services Ex-Bank ETF,2022-11-25,47166,15.3,0.32,0.71,1.0,-0.02,15.55,1.34,0.05,0.08,1.21,0.06,0.06,86,22,20,65,98,9,Nifty Financial Services Ex-Bank - TRI,ICICI Pru Nifty Financial Services Ex-Bank ETF,16.82,0.21,0.41,1.0,0.13,5.88,148
Kotak Nifty Smallcap 50 Index Fund-Reg(G),2023-04-10,46631,21.23,0.38,0.7,0.99,-0.13,4.33,1.46,0.03,0.05,1.14,0.04,0.02,159,13,13,16,167,62,Nifty Smallcap 50 - TRI,Kotak Nifty Smallcap 50 Index Fund-Reg(G),17.29,0.11,0.15,1.0,-0.02,4.32,115
Kotak Nifty 50 Value 20 ETF,2015-12-02,31116,13.7,0.2,0.4,1.0,-0.01,3.35,0.91,0.01,0.02,0.96,0.0,0.01,60,70,64,53,78,101,Nifty50 Value 20 - TRI,Kotak Nifty 50 Value 20 ETF,16.82,0.21,0.41,1.0,0.13,5.88,148
ICICI Pru Debt Mgmt Fund(FOF)(G),2003-12-18,1707,1.15,0.86,1.13,0.43,0.17,12.25,0.06,0.29,0.5,0.44,0.01,0.05,1,2,5,14,26,9,CRISIL Composite Bond Index,ICICI Pru Debt Mgmt Fund(FOF)(G),10.95,0.26,0.52,0.82,0.25,-3.51,56
Sundaram Global Brand Fund(G),2007-08-22,3005,15.58,0.11,0.18,0.54,0.11,-4.69,0.74,0.01,0.02,0.43,0.0,-0.02,16,29,29,24,28,51,MSCI AC World Index,Sundaram Global Brand Fund(G),18.75,0.1,0.18,0.74,0.09,9.0,57
LIC MF Short Duration Fund-Reg(G),2019-02-01,34304,1.27,0.41,0.61,0.36,0.04,13.48,0.04,0.3,0.59,0.31,0.01,0.05,21,31,32,17,21,18,CRISIL Short Duration Debt Index,LIC MF Short Duration Fund-Reg(G),1.32,0.91,1.03,0.61,0.06,14.62,26
ICICI Pru Nifty 100 ETF,2013-08-20,22404,13.82,0.16,0.31,1.0,-0.04,5.54,0.94,0.02,0.03,1.03,0.01,0.02,62,121,120,96,147,86,NIFTY 100 - TRI,ICICI Pru Nifty 100 ETF,16.82,0.21,0.41,1.0,0.13,5.88,148
ICICI Pru Global Stable Equity Fund(FOF)(G),2013-09-13,16718,11.7,0.11,0.2,0.42,0.08,14.06,0.68,0.04,0.07,0.62,0.02,0.06,4,27,28,13,31,14,MSCI World,ICICI Pru Global Stable Equity Fund(FOF)(G),18.75,0.1,0.18,0.74,0.09,9.0,57
Bank of India Credit Risk Fund-Reg(G),2015-02-27,30390,41.35,0.11,4.5,-3.22,2.33,23.41,0.03,0.12,0.15,0.04,0.0,0.09,15,15,1,1,1,3,CRISIL Credit Risk Debt Index,Bank of India Credit Risk Fund-Reg(G),4.66,0.55,1.27,0.15,0.3,30.0,15
Aditya Birla SL Retirement Fund-40-Reg(G),2019-03-11,42770,10.89,0.19,0.38,1.07,-0.05,3.55,0.74,0.04,0.07,2.33,0.01,0.01,20,25,24,32,29,18,CRISIL Hybrid 35+65 - Aggressive Index,Aditya Birla SL Retirement Fund-40-Reg(G),10.02,0.21,0.42,0.93,0.06,3.54,41
Edelweiss Nifty Smallcap 250 Index Fund-Reg(G),2022-11-30,47167,19.76,0.26,0.47,1.0,-0.08,1.56,1.37,0.02,0.04,1.05,0.02,0.01,131,33,40,91,105,96,Nifty Smallcap 250 - TRI,Edelweiss Nifty Smallcap 250 Index Fund-Reg(G),17.29,0.11,0.15,1.0,-0.02,4.32,115
Nippon India CRISIL-IBX AAA Financial Services - Jan 2028 Index Fund-Reg(G),2024-10-25,49221,1.12,1.15,1.36,0.53,0.14,,,,,,,,12,4,17,27,11,,CRISIL-IBX AAA Financial Services Index - Jan 2028,Nippon India CRISIL-IBX AAA Financial Services - Jan 2028 Index Fund-Reg(G),1.66,0.82,1.04,0.62,0.04,15.06,52
Tata Floating Rate Fund-Reg(G),2021-07-07,45375,0.8,1.01,1.04,0.15,0.19,17.31,0.04,0.4,0.81,0.2,0.01,0.07,3,5,5,2,3,9,CRISIL Short Duration Debt Index,Tata Floating Rate Fund-Reg(G),0.98,0.94,1.03,0.5,0.14,26.3,12
Edelweiss Europe Dynamic Equity Off-shore Fund-Reg(G),2014-02-07,24618,16.49,0.18,0.38,0.54,0.51,7.06,0.93,0.05,0.07,2.14,0.02,0.03,20,13,9,23,11,25,MSCI Europe Index (Total Return Net),Edelweiss Europe Dynamic Equity Off-shore Fund-Reg(G),18.75,0.1,0.18,0.74,0.09,9.0,57
Quantum Small Cap Fund-Reg(G),2023-11-03,48248,14.92,0.08,0.14,0.65,-0.21,5.01,0.91,0.03,0.04,0.71,0.02,0.02,1,28,28,1,29,13,BSE 250 Small Cap - TRI,Quantum Small Cap Fund-Reg(G),18.45,0.18,0.33,0.84,0.21,5.47,27
Motilal Oswal Nifty Capital Market Index Fund-Reg(G),2024-12-16,49214,36.13,-0.5,-0.87,,,,,,,,,,187,173,179,,,,Nifty Capital Markets Index - TRI,Motilal Oswal Nifty Capital Market Index Fund-Reg(G),17.29,0.11,0.15,1.0,-0.02,4.32,115
Samco ELSS Tax Saver Fund-Reg(G),2022-12-22,46606,17.63,0.08,0.11,1.07,-0.74,-9.35,1.32,-0.03,-0.04,0.99,-0.05,-0.04,53,59,59,53,59,59,NIFTY 500 - TRI,Samco ELSS Tax Saver Fund-Reg(G),14.74,0.22,0.45,0.94,0.13,5.96,59
HDFC NIFTY Realty Index Fund-Reg(G),2024-03-26,48654,29.43,-0.1,-0.16,1.0,-0.06,-5.04,,,,,,-0.02,184,137,137,161,44,109,NIFTY REALTY - TRI,HDFC NIFTY Realty Index Fund-Reg(G),17.29,0.11,0.15,1.0,-0.02,4.32,115
ICICI Pru Retirement Fund-Pure Debt Plan(G),2019-02-27,25670,1.15,0.53,0.78,0.05,0.15,11.64,0.05,0.25,0.49,0.37,0.01,0.05,1,1,3,1,14,1,NIFTY Composite Debt Index,ICICI Pru Retirement Fund-Pure Debt Plan(G),10.02,0.21,0.42,0.93,0.06,3.54,41
Kotak Nifty SDL Jul 2026 Index Fund-Reg(G),2022-12-22,46729,0.85,1.1,1.13,0.27,0.15,27.14,0.04,0.37,0.86,0.13,0.01,0.11,2,5,35,6,6,2,Nifty SDL Jul 2026 Index,Kotak Nifty SDL Jul 2026 Index Fund-Reg(G),1.66,0.82,1.04,0.62,0.04,15.06,52
Tata Nifty India Digital ETF FoF-Reg(G),2022-04-13,46355,17.77,0.13,0.24,0.97,-0.39,2.7,1.04,0.02,0.03,1.8,0.0,0.01,50,51,55,35,59,41,Nifty India Digital  - TRI,Tata Nifty India Digital ETF FoF-Reg(G),10.95,0.26,0.52,0.82,0.25,-3.51,56
Motilal Oswal BSE Low Volatility Index Fund-Reg(G),2022-03-23,46438,12.16,0.26,0.52,0.99,1.68,0.6,0.72,-0.01,-0.02,0.7,-0.02,0.0,13,34,27,22,5,104,BSE Low Volatility Index - TRI,Motilal Oswal BSE Low Volatility Index Fund-Reg(G),17.29,0.11,0.15,1.0,-0.02,4.32,115
ICICI Pru Nifty50 Equal Weight Index Fund-Reg(G),2022-10-03,46902,12.28,0.29,0.6,1.0,-0.09,5.75,0.92,0.01,0.02,0.98,0.0,0.02,15,20,17,57,123,47,NIFTY50 Equal Weight - TRI,ICICI Pru Nifty50 Equal Weight Index Fund-Reg(G),17.29,0.11,0.15,1.0,-0.02,4.32,115
PGIM India Healthcare Fund-Reg(G),2024-12-06,48975,17.08,-0.44,-0.71,0.93,-0.08,,,,,,,,16,17,17,8,12,,BSE Health Care - TRI,PGIM India Healthcare Fund-Reg(G),15.96,0.21,0.45,0.94,0.02,25.23,16
Mahindra Manulife Arbitrage Fund-Reg(G),2020-08-24,45042,0.53,0.67,0.6,0.57,-0.03,-23.66,0.06,0.1,0.22,-0.08,0.01,-0.09,8,29,29,10,29,2,Nifty 50 Arbitrage,Mahindra Manulife Arbitrage Fund-Reg(G),0.54,1.27,0.92,0.49,0.08,-40.93,26
LIC MF Gold ETF FoF(G),2012-08-14,17242,11.99,0.32,0.85,0.92,0.87,67.96,0.93,0.11,0.18,-0.61,0.11,0.27,13,15,10,8,11,4,Gold-India,LIC MF Gold ETF FoF(G),12.91,0.48,1.08,1.05,0.81,-1289.0,16
PGIM India Dynamic Bond Fund(G),2012-01-12,15247,1.88,0.45,1.15,1.4,-0.4,7.01,0.13,0.13,0.22,1.04,0.0,0.03,8,12,5,17,17,11,CRISIL Dynamic Bond Index,PGIM India Dynamic Bond Fund(G),2.21,0.44,0.92,1.04,-0.18,9.88,22
Kotak NIFTY 100 Low Volatility 30 Index Fund-Reg(G),2024-06-07,45716,13.79,-0.08,-0.13,1.0,-0.11,,,,,,,,55,136,136,55,157,,Nifty100 Low Volatility 30 - TRI,Kotak NIFTY 100 Low Volatility 30 Index Fund-Reg(G),17.29,0.11,0.15,1.0,-0.02,4.32,115
SBI Nifty Bank Index Fund-Reg(G),2025-02-06,49104,16.55,0.65,1.64,1.03,-0.28,,,,,,,,102,7,7,181,182,,NIFTY BANK - TRI,SBI Nifty Bank Index Fund-Reg(G),17.29,0.11,0.15,1.0,-0.02,4.32,115
Edelweiss ASEAN Equity Off-Shore Fund-Reg(G),2011-07-01,13404,13.03,0.01,0.02,0.5,-0.31,7.66,0.71,0.04,0.07,1.29,0.01,0.03,6,43,43,17,43,24,MSCI AC ASEAN 10/40 Index,Edelweiss ASEAN Equity Off-Shore Fund-Reg(G),18.75,0.1,0.18,0.74,0.09,9.0,57
Invesco India Banking and PSU Fund(G),2012-12-29,17249,1.84,0.33,0.49,0.52,0.01,11.79,0.06,0.26,0.44,0.42,0.01,0.05,22,24,24,16,16,22,NIFTY Banking and PSU Debt Index,Invesco India Banking and PSU Fund(G),1.35,0.65,0.86,0.62,0.03,16.01,26
Mirae Asset Nifty India Manufacturing ETF FoF-Reg(G),2022-01-31,46053,15.98,0.24,0.47,1.0,-0.21,1.23,1.11,0.04,0.06,2.8,0.01,0.0,47,37,35,49,56,49,Nifty India Manufacturing - TRI,Mirae Asset Nifty India Manufacturing ETF FoF-Reg(G),10.95,0.26,0.52,0.82,0.25,-3.51,56
ICICI Pru Nifty50 Value 20 Index Fund-Reg(G),2024-02-02,48523,13.03,-0.02,-0.04,1.0,-0.07,2.62,0.92,0.01,0.01,0.96,0.0,0.01,44,130,130,76,69,89,Nifty50 Value 20 - TRI,ICICI Pru Nifty50 Value 20 Index Fund-Reg(G),17.29,0.11,0.15,1.0,-0.02,4.32,115
Motilal Oswal Nifty 5 Year Benchmark G-Sec ETF,2020-12-10,45196,2.33,0.36,0.6,0.94,-0.01,10.61,0.08,0.23,0.41,0.63,0.01,0.04,24,27,25,26,29,12,Nifty 5 yr Benchmark G-Sec Index TRI,Motilal Oswal Nifty 5 Year Benchmark G-Sec ETF,1.51,2.56,0.85,0.62,0.07,-67.64,25
Nippon India Strategic Debt Fund(G),2014-06-26,21911,1.69,0.42,0.75,0.46,0.06,13.51,0.05,0.33,0.63,0.4,0.01,0.05,22,20,20,17,20,18,CRISIL Medium Duration Debt Index,Nippon India Strategic Debt Fund(G),1.65,0.7,0.92,0.43,0.1,26.12,29
Sundaram Nifty 100 Equal Weight Fund(G),1999-07-27,2384,15.61,0.19,0.36,0.98,-0.07,3.7,1.05,0.01,0.02,1.04,0.0,0.01,91,52,51,9,52,69,Nifty100 Equal Weight - TRI,Sundaram Nifty 100 Equal Weight Fund(G),17.29,0.11,0.15,1.0,-0.02,4.32,115
ICICI Pru Strategic Metal and Energy Equity FoF-Reg(G),2022-02-02,46205,22.62,0.08,0.15,0.29,0.37,35.96,1.29,0.05,0.09,-0.01,0.07,0.14,47,33,32,6,18,3,NYSE Arca Gold Miners Index,ICICI Pru Strategic Metal and Energy Equity FoF-Reg(G),18.75,0.1,0.18,0.74,0.09,9.0,57
PGIM India Arbitrage Fund-Reg(G),2014-08-27,28514,0.55,1.09,0.89,0.59,0.03,126.81,0.06,0.17,0.41,0.01,0.01,0.5,11,23,24,12,25,1,Nifty 50 Arbitrage,PGIM India Arbitrage Fund-Reg(G),0.54,1.27,0.92,0.49,0.08,-40.93,26
Tata Silver ETF FoF-Reg(G),2024-01-19,48441,20.05,0.33,0.69,-2.32,2.9,9.5,1.43,0.07,0.12,0.78,0.09,0.04,57,21,22,1,1,17,Silver,Tata Silver ETF FoF-Reg(G),10.95,0.26,0.52,0.82,0.25,-3.51,56
Kotak FMP-308-1125D(G),2023-03-29,47570,0.48,2.33,1.13,0.21,0.25,31.53,0.03,0.62,1.17,0.12,0.02,0.13,17,7,15,4,3,20,NIFTY Medium Duration Debt Index,Kotak FMP-308-1125D(G),1.25,1.1,0.85,0.59,0.07,547.36,91
Kotak NIFTY Midcap 150 Momentum 50 Index Fund-Reg(G),2024-10-08,49180,26.15,-0.4,-0.6,1.0,-0.1,,,,,,,,181,168,165,146,148,,Nifty Midcap150 Momentum 50 - TRI,Kotak NIFTY Midcap 150 Momentum 50 Index Fund-Reg(G),17.29,0.11,0.15,1.0,-0.02,4.32,115
Mirae Asset Nifty 100 ESG Sector Leaders FoF-Reg(G),2020-11-18,45135,13.42,0.13,0.25,0.99,-0.1,2.42,0.89,0.02,0.03,2.61,-0.01,0.01,40,53,52,46,51,42,Nifty100 ESG Sector Leaders - TRI,Mirae Asset Nifty 100 ESG Sector Leaders FoF-Reg(G),10.95,0.26,0.52,0.82,0.25,-3.51,56
Groww Nifty Smallcap 250 Index Fund-Reg(G),2024-02-29,48617,23.01,0.03,0.05,1.0,-0.1,1.49,1.37,0.02,0.03,1.05,0.02,0.01,169,123,124,96,140,99,Nifty Smallcap 250 - TRI,Groww Nifty Smallcap 250 Index Fund-Reg(G),17.29,0.11,0.15,1.0,-0.02,4.32,115
Axis FTP-113-1228D-Reg(G),2023-03-21,47799,0.57,1.65,1.05,0.28,0.17,25.93,0.03,0.5,1.06,0.12,0.01,0.1,19,19,36,8,8,32,CRISIL Medium Duration Debt Index,Axis FTP-113-1228D-Reg(G),1.25,1.1,0.85,0.59,0.07,547.36,91
UTI NIFTY50 Equal Weight Index Fund-Reg(G),2023-06-07,47962,12.59,0.29,0.56,1.0,-0.1,5.57,0.93,0.01,0.02,0.98,0.0,0.02,17,21,20,59,134,52,NIFTY50 Equal Weight - TRI,UTI NIFTY50 Equal Weight Index Fund-Reg(G),17.29,0.11,0.15,1.0,-0.02,4.32,115
Mirae Asset Silver ETF,2023-06-09,46195,18.61,0.24,0.48,0.08,1.22,13.81,1.44,0.07,0.12,0.41,0.1,0.05,22,27,27,9,15,5,Silver,Mirae Asset Silver ETF,15.31,0.44,0.99,0.95,0.49,-176.58,28
Mirae Asset Hang Seng TECH ETF FoF-Reg(G),2021-12-08,46071,40.43,0.11,0.3,-0.5,1.62,33.57,2.4,0.12,0.25,1.53,0.28,0.13,57,25,14,2,2,4,Hang Seng TECH TRI,Mirae Asset Hang Seng TECH ETF FoF-Reg(G),18.75,0.1,0.18,0.74,0.09,9.0,57
PGIM India Emerging Markets Equity Fund(G),2007-09-11,815,17.44,0.0,0.01,0.45,-0.29,6.25,1.13,0.06,0.1,1.65,0.05,0.02,24,44,44,14,42,27,MSCI Emerging Market Index,PGIM India Emerging Markets Equity Fund(G),18.75,0.1,0.18,0.74,0.09,9.0,57
Edelweiss CRISIL IBX 50:50 Gilt Plus SDL June 2027 Index Fund-Reg(G),2022-10-18,46999,1.15,0.93,1.26,0.43,0.12,17.84,0.04,0.36,0.76,0.26,0.01,0.07,14,18,28,13,19,17,CRISIL IBX 50:50 Gilt Plus SDL Index - June 2027,Edelweiss CRISIL IBX 50:50 Gilt Plus SDL June 2027 Index Fund-Reg(G),1.66,0.82,1.04,0.62,0.04,15.06,52
Motilal Oswal Multi Asset Fund-Reg(G),2020-08-04,45017,9.69,-0.04,-0.07,0.49,-0.52,-8.52,0.69,-0.07,-0.1,1.32,-0.06,-0.03,23,28,28,10,29,24,NIFTY 500 - TRI,Motilal Oswal Multi Asset Fund-Reg(G),8.45,0.4,0.75,0.76,0.41,4.88,24
