MF Code,incept_date,schemecode,sdx_returns,sharpex_returns,sotinox_returns,betax_returns,alphax_returns,treynorx_returns,sdy_returns,sharpey_returns,sotinoy_returns,betay_returns,alphay_returns,treynory_returns,rank_sd,rank_sharpe,rank_sotino,rank_beta,rank_alpha,rank_treynor,index_name,s_name,avg_std_dev,avg_sharpe,avg_sotino,avg_beta,avg_alpha,avg_treyno,no_of_funds_total
Mirae Asset Healthcare Fund-Reg(G),2018-07-02,39122,15.67,0.25,0.5,0.96,-0.13,25.43,0.94,0.08,0.13,0.56,0.07,0.1,12,13,12,13,13,8,BSE Health Care - TRI,Mirae Asset Healthcare Fund-Reg(G),15.96,0.21,0.45,0.94,0.02,25.23,16
Franklin Build India Fund(G),2009-09-04,7864,16.51,0.37,0.75,0.59,0.74,5.24,1.25,0.03,0.04,1.15,0.02,0.02,4,3,3,1,9,4,BSE India Infrastructure Index - TRI,Franklin Build India Fund(G),18.43,0.25,0.49,0.88,1.21,2.05,19
UTI MNC Fund-Reg(G),1998-10-14,3634,12.92,0.17,0.32,0.87,-0.13,-1.08,0.81,0.01,0.01,0.67,0.0,0.0,3,2,2,3,2,4,NIFTY MNC - TRI,UTI MNC Fund-Reg(G),13.48,0.03,0.1,0.88,-0.23,-1.07,5
Invesco India ELSS Tax Saver Fund(G),2006-12-29,2270,15.55,0.17,0.31,1.02,-0.05,8.24,1.01,0.03,0.05,0.94,0.02,0.03,40,47,47,50,43,18,BSE 500 - TRI,Invesco India ELSS Tax Saver Fund(G),14.74,0.22,0.45,0.94,0.13,5.96,59
Baroda BNP Paribas Multi Cap Fund-Reg(G),2003-09-12,500,15.7,0.21,0.36,0.96,0.01,7.38,1.11,0.04,0.05,0.99,0.03,0.03,27,23,26,22,28,16,Nifty500 Multicap 50:25:25 - TRI,Baroda BNP Paribas Multi Cap Fund-Reg(G),15.04,0.18,0.38,0.94,0.09,7.2,37
Sundaram Multi Cap Fund(G),2000-10-25,2370,14.93,0.19,0.35,0.93,-0.08,7.51,0.97,0.04,0.05,0.94,0.02,0.03,19,27,27,17,34,15,Nifty500 Multicap 50:25:25 - TRI,Sundaram Multi Cap Fund(G),15.04,0.18,0.38,0.94,0.09,7.2,37
ICICI Pru Commodities Fund-Reg(G),2019-10-15,41999,18.19,0.17,0.32,0.87,0.27,-1.11,1.32,0.02,0.03,1.09,0.01,0.0,69,48,48,18,32,53,NIFTY COMMODITIES - TRI,ICICI Pru Commodities Fund-Reg(G),16.52,0.07,0.22,1.0,-0.03,4.99,60
Canara Rob Mid Cap Fund-Reg(G),2022-12-02,46001,15.47,0.28,0.52,0.91,-0.17,6.88,1.17,0.04,0.05,1.0,0.03,0.03,5,11,12,10,21,19,BSE 150 MidCap - TRI,Canara Rob Mid Cap Fund-Reg(G),16.1,0.55,0.52,0.91,0.06,7.77,30
HDFC NIFTY Bank ETF,2020-08-21,33563,15.51,0.16,0.34,1.0,-0.01,12.83,1.07,0.03,0.04,1.06,0.02,0.05,91,108,98,66,90,18,NIFTY BANK - TRI,HDFC NIFTY Bank ETF,16.82,0.21,0.41,1.0,0.13,5.88,148
ICICI Pru Thematic Advantage Fund(FOF)(G),2003-12-18,1706,10.91,0.33,0.69,0.73,0.51,7.99,0.66,0.07,0.11,1.77,0.02,0.03,34,20,20,26,9,20,NIFTY 200 - TRI,ICICI Pru Thematic Advantage Fund(FOF)(G),10.95,0.26,0.52,0.82,0.25,-3.51,56
Invesco India Flexi Cap Fund-Reg(G),2022-02-14,45945,15.73,0.25,0.44,1.01,0.31,12.07,1.07,0.05,0.07,0.98,0.04,0.05,34,16,18,32,8,5,BSE 500 - TRI,Invesco India Flexi Cap Fund-Reg(G),14.83,0.21,0.39,0.98,0.06,6.57,47
UTI Short Duration Fund-Reg(G),2007-09-18,3656,1.01,0.78,0.98,0.28,0.14,14.92,0.04,0.38,0.74,0.26,0.01,0.06,8,13,16,5,9,8,CRISIL Short Duration Debt Index,UTI Short Duration Fund-Reg(G),1.32,0.91,1.03,0.61,0.06,14.62,26
Kotak Pioneer Fund-Reg(G),2019-10-25,43927,14.82,0.23,0.42,0.92,0.22,7.59,0.87,0.04,0.07,0.77,0.03,0.03,36,34,37,33,37,18,NIFTY 500 - TRI,Kotak Pioneer Fund-Reg(G),16.52,0.07,0.22,1.0,-0.03,4.99,60
Tata Banking & Financial Services Fund-Reg(G),2015-12-28,33726,15.35,0.25,0.52,0.92,0.3,17.72,1.0,0.05,0.08,0.95,0.04,0.07,13,8,6,11,7,2,Nifty Financial Services - TRI,Tata Banking & Financial Services Fund-Reg(G),14.97,0.29,0.54,0.91,0.05,13.45,20
Franklin India Money Market Fund(G),2002-02-11,3361,0.57,1.42,1.01,0.6,0.12,64.71,0.02,0.69,1.39,0.02,0.01,0.26,19,15,3,19,13,10,Nifty Money Market Index,Franklin India Money Market Fund(G),0.53,1.58,0.97,0.53,0.12,64.21,22
Mirae Asset Flexi Cap Fund-Reg(G),2023-02-24,47596,12.83,0.33,0.64,0.96,-0.1,6.75,0.98,0.03,0.04,0.99,0.02,0.03,4,3,3,23,36,27,NIFTY 500 - TRI,Mirae Asset Flexi Cap Fund-Reg(G),14.83,0.21,0.39,0.98,0.06,6.57,47
ICICI Pru Constant Maturity Gilt Fund(G),2014-09-12,30426,2.93,0.38,0.72,0.98,0.01,8.42,0.14,0.16,0.26,1.07,0.01,0.03,5,5,5,5,4,1,Crisil 10 Yr Gilt Index,ICICI Pru Constant Maturity Gilt Fund(G),2.73,0.45,0.9,0.95,0.01,7.98,6
HSBC Money Market Fund-Reg(G),2005-08-10,621,0.58,1.25,0.91,0.61,0.09,64.89,0.02,0.66,1.32,0.02,0.01,0.26,20,20,19,20,17,7,Nifty Money Market Index,HSBC Money Market Fund-Reg(G),0.53,1.58,0.97,0.53,0.12,64.21,22
Edelweiss Multi Cap Fund-Reg(G),2023-10-25,48147,17.91,0.26,0.48,1.09,0.17,8.27,1.09,0.04,0.06,1.04,0.03,0.03,40,12,14,42,15,13,Nifty500 Multicap 50:25:25 - TRI,Edelweiss Multi Cap Fund-Reg(G),15.04,0.18,0.38,0.94,0.09,7.2,37
Nippon India ETF Nifty PSU Bank BeES,2007-10-25,3722,28.34,0.29,0.67,1.0,-0.04,-2.04,1.85,-0.02,-0.03,1.5,-0.05,-0.01,175,28,23,79,153,137,NIFTY PSU BANK - TRI,Nippon India ETF Nifty PSU Bank BeES,16.82,0.21,0.41,1.0,0.13,5.88,148
DSP Equity Savings Fund-Reg(G),2016-03-28,34871,4.18,0.37,0.91,0.66,0.23,12.78,0.23,0.13,0.22,0.57,0.02,0.05,8,3,3,15,10,2,NIFTY 50 Equity Savings Index - TRI,DSP Equity Savings Fund-Reg(G),8.53,0.41,0.51,0.8,0.1,1.33,55
SBI CRISIL IBX Gilt Index - June 2036 Fund-Reg(G),2022-10-04,46941,2.63,0.65,1.43,1.08,0.0,7.79,0.16,0.14,0.23,1.15,0.01,0.03,11,10,9,16,16,15,CRISIL IBX Gilt Index - June 2036,SBI CRISIL IBX Gilt Index - June 2036 Fund-Reg(G),2.86,0.6,1.27,1.14,-0.05,8.57,24
Motilal Oswal Nifty India Defence Index Fund-Reg(G),2024-07-03,48892,34.21,-0.21,-0.43,0.98,0.04,,,,,,,,186,145,150,8,11,,Nifty India Defence - TRI,Motilal Oswal Nifty India Defence Index Fund-Reg(G),17.29,0.11,0.15,1.0,-0.02,4.32,115
Franklin India Balanced Advantage Fund-Reg(G),2022-09-06,46625,6.4,0.4,0.9,0.49,0.36,4.03,0.44,0.05,0.08,1.3,0.01,0.02,5,5,4,6,7,10,NIFTY 50 Hybrid Composite Debt 50:50 Index,Franklin India Balanced Advantage Fund-Reg(G),8.21,0.81,0.52,0.6,0.17,2.51,32
ICICI Pru Housing Opp Fund-Reg(G),2022-04-18,46546,12.39,0.31,0.68,0.7,0.52,7.41,0.97,0.03,0.04,0.97,0.02,0.03,11,16,14,4,19,19,Nifty Housing - TRI,ICICI Pru Housing Opp Fund-Reg(G),16.52,0.07,0.22,1.0,-0.03,4.99,60
UTI Focused Fund-Reg(G),2021-08-25,45685,13.77,0.22,0.42,0.89,0.13,6.05,0.87,0.02,0.03,0.89,0.01,0.02,12,20,19,7,20,30,NIFTY 500 - TRI,UTI Focused Fund-Reg(G),14.83,0.21,0.39,0.98,0.06,6.57,47
Parag Parikh Liquid Fund-Reg(G),2018-05-11,38735,0.28,2.34,0.92,1.04,-0.04,46.39,0.0,0.57,0.21,0.0,0.0,0.18,6,23,36,18,34,36,CRISIL Liquid Debt Index,Parag Parikh Liquid Fund-Reg(G),0.29,2.7,0.95,0.77,0.04,99.58,37
Kotak Business Cycle Fund-Reg(G),2022-09-28,46472,13.19,0.26,0.48,0.93,0.02,11.62,0.96,0.05,0.08,0.91,0.04,0.05,16,29,31,34,47,9,NIFTY 500 - TRI,Kotak Business Cycle Fund-Reg(G),16.52,0.07,0.22,1.0,-0.03,4.99,60
Edelweiss Aggressive Hybrid Fund-Reg(G),2009-08-11,7922,10.46,0.3,0.6,1.05,0.28,4.01,0.76,0.05,0.07,2.17,0.01,0.02,25,15,17,27,20,13,CRISIL Hybrid 35+65 - Aggressive Index,Edelweiss Aggressive Hybrid Fund-Reg(G),8.45,0.4,0.75,0.76,0.41,4.88,24
Sundaram Multi Asset Allocation Fund-Reg(G),2024-01-25,48460,7.9,0.29,0.56,0.49,0.52,5.64,0.6,0.05,0.08,1.5,0.01,0.02,13,17,19,9,9,7,NIFTY 500 - TRI,Sundaram Multi Asset Allocation Fund-Reg(G),8.45,0.4,0.75,0.76,0.41,4.88,24
LIC MF Nifty 8-13 yr G-Sec ETF,2014-12-24,31581,2.83,0.42,0.79,0.97,-0.01,8.47,0.13,0.17,0.28,1.05,0.01,0.03,27,21,10,28,28,15,Nifty 8-13 yr G-Sec,LIC MF Nifty 8-13 yr G-Sec ETF,1.51,2.56,0.85,0.62,0.07,-67.64,25
Canara Rob Focused Equity Fund-Reg(G),2021-05-17,45510,13.87,0.24,0.46,0.92,0.2,9.35,0.94,0.05,0.07,0.97,0.03,0.04,11,18,18,13,13,11,BSE 500 - TRI,Canara Rob Focused Equity Fund-Reg(G),15.04,0.18,0.38,0.94,0.09,7.2,37
Tata Large Cap Fund-Reg(G),1998-05-07,3281,13.43,0.19,0.38,0.96,0.09,5.29,0.95,0.02,0.04,1.01,0.01,0.02,19,17,16,22,14,23,NIFTY 100 - TRI,Tata Large Cap Fund-Reg(G),13.7,0.18,0.36,0.96,0.08,5.67,37
Parag Parikh Conservative Hybrid Fund-Reg(G),2021-05-26,45338,3.4,0.58,1.35,0.79,0.3,9.7,0.2,0.12,0.19,0.64,0.02,0.04,3,1,1,5,1,3,CRISIL Hybrid 85+15 - Conservative Index,Parag Parikh Conservative Hybrid Fund-Reg(G),4.11,0.31,0.7,0.92,0.05,6.35,18
DSP Focus Fund-Reg(G),2010-06-10,8463,15.06,0.23,0.5,0.97,0.23,15.02,1.0,0.07,0.1,0.96,0.06,0.06,22,19,13,24,11,3,NIFTY 500 - TRI,DSP Focus Fund-Reg(G),15.04,0.18,0.38,0.94,0.09,7.2,37
Quant Large Cap Fund-Reg(G),2022-08-10,46678,14.8,0.18,0.36,1.06,-0.02,-6.35,0.97,-0.02,-0.02,0.9,-0.02,-0.03,33,20,19,36,26,35,NIFTY 100 - TRI,Quant Large Cap Fund-Reg(G),13.7,0.18,0.36,0.96,0.08,5.67,37
Baroda BNP Paribas Large Cap Fund-Reg(G),2004-09-23,23,13.17,0.22,0.43,0.92,0.22,3.98,0.92,0.02,0.03,0.97,0.01,0.02,17,9,9,16,8,28,NIFTY 100 - TRI,Baroda BNP Paribas Large Cap Fund-Reg(G),13.7,0.18,0.36,0.96,0.08,5.67,37
Edelweiss Flexi Cap Fund-Reg(G),2015-02-03,31778,15.17,0.22,0.41,1.01,0.12,7.86,1.06,0.04,0.06,1.08,0.03,0.03,31,21,20,33,21,20,NIFTY 500 - TRI,Edelweiss Flexi Cap Fund-Reg(G),14.83,0.21,0.39,0.98,0.06,6.57,47
Mahindra Manulife Large & Mid Cap Fund-Reg(G),2019-12-30,43915,15.54,0.17,0.31,0.99,-0.25,1.01,1.16,0.0,0.0,1.09,-0.01,0.0,20,25,24,21,29,28,NIFTY LargeMidcap 250 - TRI,Mahindra Manulife Large & Mid Cap Fund-Reg(G),15.44,0.18,0.35,0.98,0.06,7.85,29
Aditya Birla SL Nifty Bank ETF,2019-10-23,34434,15.53,0.17,0.34,1.0,-0.01,12.83,1.07,0.03,0.04,1.06,0.02,0.05,94,102,94,117,66,19,NIFTY BANK - TRI,Aditya Birla SL Nifty Bank ETF,16.82,0.21,0.41,1.0,0.13,5.88,148
Mirae Asset NYSE FANG+ ETF,2021-05-07,45379,30.03,0.22,0.42,1.0,1.86,-54.03,1.65,0.05,0.08,-0.13,0.09,-0.21,178,58,62,23,7,148,NYSE FANG+ TRI,Mirae Asset NYSE FANG+ ETF,16.82,0.21,0.41,1.0,0.13,5.88,148
Bandhan Multi Cap Fund-Reg(G),2021-12-02,45867,14.11,0.24,0.46,0.88,0.11,5.59,0.93,0.03,0.04,0.9,0.02,0.02,13,16,17,9,21,27,Nifty500 Multicap 50:25:25 - TRI,Bandhan Multi Cap Fund-Reg(G),15.04,0.18,0.38,0.94,0.09,7.2,37
Nippon India ETF Nifty 8-13 yr G-Sec Long Term Gilt,2016-07-05,35459,2.86,0.42,0.8,0.98,0.0,8.52,0.13,0.17,0.28,1.05,0.01,0.03,28,20,9,29,27,13,Nifty 8-13 yr G-Sec,Nippon India ETF Nifty 8-13 yr G-Sec Long Term Gilt,1.51,2.56,0.85,0.62,0.07,-67.64,25
Aditya Birla SL Quant Fund-Reg(G),2024-06-28,48491,15.97,-0.36,-0.5,1.12,-0.64,,,,,,,,53,81,79,75,87,,NIFTY 200 - TRI,Aditya Birla SL Quant Fund-Reg(G),16.52,0.07,0.22,1.0,-0.03,4.99,60
Edelweiss US Technology Equity FOF-Reg(G),2020-03-05,44630,28.7,0.12,0.21,0.99,0.33,4.18,1.76,0.02,0.03,1.68,0.02,0.02,54,23,25,52,20,39,Russell 1000 Equal Weighted Technology Index,Edelweiss US Technology Equity FOF-Reg(G),18.75,0.1,0.18,0.74,0.09,9.0,57
BHARAT Bond ETF FOF - April 2033 -Reg(G),2022-12-14,47284,2.38,0.54,1.16,0.71,0.07,19.4,0.4,0.04,0.07,0.18,0.01,0.08,7,7,4,25,34,4,NIFTY BHARAT Bond Index - April 2033,BHARAT Bond ETF FOF - April 2033 -Reg(G),10.95,0.26,0.52,0.82,0.25,-3.51,56
HDFC Infrastructure Fund(G),2008-03-10,4253,18.09,0.37,0.77,0.65,2.97,3.68,1.2,0.02,0.03,1.07,0.01,0.01,11,2,2,3,2,7,BSE India Infrastructure Index - TRI,HDFC Infrastructure Fund(G),18.43,0.25,0.49,0.88,1.21,2.05,19
Tata Treasury Advantage Fund-Reg(G),2005-09-06,3205,0.63,1.13,0.88,1.28,-0.19,35.43,0.02,0.65,1.21,0.06,0.01,0.14,10,7,14,18,14,8,CRISIL Low Duration Debt Index,Tata Treasury Advantage Fund-Reg(G),0.62,1.55,0.92,0.84,-0.03,35.22,20
UTI-Nifty Next 50 ETF,2017-08-04,37338,20.05,0.18,0.31,1.0,0.0,3.86,1.37,0.02,0.03,1.24,0.02,0.02,140,81,117,136,37,93,NIFTY NEXT 50,UTI-Nifty Next 50 ETF,16.82,0.21,0.41,1.0,0.13,5.88,148
Nippon India Innovation Fund-Reg(G),2023-08-28,48169,15.65,0.2,0.36,1.03,-0.03,7.13,0.92,0.02,0.04,0.8,0.01,0.03,48,40,40,63,56,21,NIFTY 500 - TRI,Nippon India Innovation Fund-Reg(G),16.52,0.07,0.22,1.0,-0.03,4.99,60
Edelweiss Nifty PSU Bond Plus SDL Apr 2027 50:50 Index Fund-Reg(G),2021-10-14,45387,2.17,0.29,0.43,0.61,-0.01,18.62,0.04,0.39,0.77,0.2,0.01,0.07,51,57,59,38,52,14,Nifty PSU Bond Plus SDL Apr 2027 50:50 Index,Edelweiss Nifty PSU Bond Plus SDL Apr 2027 50:50 Index Fund-Reg(G),1.66,0.82,1.04,0.62,0.04,15.06,52
Nippon India Index Fund-Nifty 50 Plan(G),2010-09-28,12860,13.0,0.16,0.32,1.0,-0.05,6.43,0.88,0.02,0.03,0.99,0.01,0.03,34,90,72,119,39,23,NIFTY 50 - TRI,Nippon India Index Fund-Nifty 50 Plan(G),17.29,0.11,0.15,1.0,-0.02,4.32,115
Axis Business Cycles Fund-Reg(G),2023-02-22,47580,13.55,0.36,0.66,1.0,0.06,5.17,1.02,0.03,0.04,1.0,0.02,0.02,23,9,18,53,46,30,NIFTY 500 - TRI,Axis Business Cycles Fund-Reg(G),16.52,0.07,0.22,1.0,-0.03,4.99,60
Templeton India Equity Income Fund(G),2006-05-18,3367,12.51,0.29,0.61,0.73,0.44,4.76,0.95,0.02,0.03,0.89,0.01,0.02,2,3,3,1,2,4,NIFTY 500 - TRI,Templeton India Equity Income Fund(G),14.04,0.18,0.38,0.92,0.19,5.37,9
Kotak Manufacture in India Fund-Reg(G),2022-02-22,46107,14.85,0.26,0.5,0.93,-0.09,4.03,1.15,0.03,0.04,1.03,0.02,0.02,37,25,28,36,61,36,Nifty India Manufacturing - TRI,Kotak Manufacture in India Fund-Reg(G),16.52,0.07,0.22,1.0,-0.03,4.99,60
HSBC Ultra Short Duration Fund-Reg(G),2020-01-29,44328,0.47,1.59,0.95,0.51,0.12,67.51,0.02,0.69,1.32,0.02,0.01,0.27,17,9,10,11,9,10,NIFTY Ultra Short Duration Debt Index,HSBC Ultra Short Duration Fund-Reg(G),0.44,2.42,0.92,0.7,0.03,63.74,24
SBI Credit Risk Fund-Reg(G),2004-07-14,2770,1.37,0.69,1.03,0.31,0.17,22.81,0.06,0.27,0.53,0.17,0.01,0.09,8,6,6,9,7,4,NIFTY Credit Risk Bond Index,SBI Credit Risk Fund-Reg(G),4.66,0.55,1.27,0.15,0.3,30.0,15
HSBC Arbitrage Fund-Reg(G),2014-06-30,29550,0.59,1.11,0.94,0.65,0.04,-49.8,0.06,0.18,0.4,-0.08,0.01,-0.2,25,22,18,23,24,16,Nifty 50 Arbitrage,HSBC Arbitrage Fund-Reg(G),0.54,1.27,0.92,0.49,0.08,-40.93,26
Aditya Birla SL Income Fund(G),1995-10-21,405,2.29,0.34,0.62,0.7,0.0,7.69,0.11,0.15,0.25,0.88,0.01,0.03,55,47,46,50,50,46,CRISIL Medium to Long Term Debt Index,Aditya Birla SL Income Fund(G),1.66,0.82,1.04,0.62,0.04,15.06,52
HSBC Infrastructure Fund-Reg(G),2007-09-27,594,19.09,0.27,0.5,1.02,0.19,4.36,1.51,0.03,0.05,1.28,0.04,0.02,15,14,12,18,14,5,Nifty Infrastructure - TRI,HSBC Infrastructure Fund-Reg(G),18.43,0.25,0.49,0.88,1.21,2.05,19
Axis CRISIL IBX SDL May 2027 Index Fund-Reg(G),2022-02-23,45999,2.16,0.34,0.5,0.58,0.02,18.93,0.05,0.33,0.69,0.2,0.01,0.08,50,48,51,30,42,12,CRISIL IBX SDL Index - May 2027,Axis CRISIL IBX SDL May 2027 Index Fund-Reg(G),1.66,0.82,1.04,0.62,0.04,15.06,52
ITI Small Cap Fund-Reg(G),2020-02-17,44399,18.5,0.28,0.5,0.87,0.5,8.27,1.41,0.04,0.06,1.09,0.05,0.03,19,3,4,19,5,8,Nifty Smallcap 250 - TRI,ITI Small Cap Fund-Reg(G),18.45,0.18,0.33,0.84,0.21,5.47,27
Bandhan Balanced Advantage Fund-Reg(G),2014-10-10,30671,8.04,0.18,0.32,0.56,0.05,3.65,0.49,0.05,0.07,1.47,0.0,0.01,18,26,27,14,26,12,NIFTY 50 Hybrid Composite Debt 50:50 Index,Bandhan Balanced Advantage Fund-Reg(G),8.21,0.81,0.52,0.6,0.17,2.51,32
Tata India Consumer Fund-Reg(G),2015-12-28,33728,16.02,0.23,0.41,0.98,-0.06,13.96,0.98,0.04,0.06,0.72,0.03,0.06,18,13,13,18,13,3,Nifty India Consumption - TRI,Tata India Consumer Fund-Reg(G),14.33,0.25,0.46,0.93,-0.03,9.49,17
ICICI Pru Bharat 22 FOF-(G),2018-06-29,40232,16.67,0.38,0.79,0.99,0.25,0.93,1.33,0.02,0.02,3.39,-0.02,0.0,49,13,17,47,22,51,BSE Bharat 22 Index,ICICI Pru Bharat 22 FOF-(G),10.95,0.26,0.52,0.82,0.25,-3.51,56
Aditya Birla SL Medium Term Plan-Reg(G),2009-03-25,7683,9.41,0.31,2.21,0.85,0.57,20.29,0.19,0.17,0.72,0.48,0.03,0.08,28,25,1,28,1,11,CRISIL Medium Duration Debt Index,Aditya Birla SL Medium Term Plan-Reg(G),1.65,0.7,0.92,0.43,0.1,26.12,29
Mirae Asset Money Market Fund-Reg(G),2021-08-11,45753,0.46,1.6,0.96,0.43,0.13,64.69,0.02,0.69,1.35,0.02,0.01,0.26,6,9,12,5,11,11,Nifty Money Market Index,Mirae Asset Money Market Fund-Reg(G),0.53,1.58,0.97,0.53,0.12,64.21,22
Nippon India Consumption Fund(G),2004-09-30,2644,14.07,0.29,0.55,0.9,0.13,12.55,0.84,0.03,0.04,0.65,0.01,0.05,6,4,4,7,6,5,Nifty India Consumption - TRI,Nippon India Consumption Fund(G),14.33,0.25,0.46,0.93,-0.03,9.49,17
DSP Nifty SDL Plus G-Sec Jun 2028 30:70 Index Fund-Reg(G),2022-03-21,45863,2.02,0.42,0.7,0.62,0.04,14.92,0.05,0.31,0.62,0.37,0.01,0.06,41,39,42,41,36,26,Nifty SDL Plus G-Sec Jun 2028 70:30 Index,DSP Nifty SDL Plus G-Sec Jun 2028 30:70 Index Fund-Reg(G),1.66,0.82,1.04,0.62,0.04,15.06,52
Union Flexi Cap Fund-Reg(G),2011-06-10,14559,13.85,0.19,0.34,0.93,-0.01,3.88,0.96,0.02,0.02,0.97,0.0,0.02,15,30,32,14,29,36,BSE 500 - TRI,Union Flexi Cap Fund-Reg(G),14.83,0.21,0.39,0.98,0.06,6.57,47
SBI CRISIL IBX Gilt Index - Apr 2029 Fund-Reg(G),2022-10-04,46971,1.66,0.79,1.45,0.67,0.08,11.31,0.08,0.22,0.38,0.61,0.01,0.04,32,31,6,46,32,39,CRISIL IBX Gilt Index - April 2029,SBI CRISIL IBX Gilt Index - Apr 2029 Fund-Reg(G),1.66,0.82,1.04,0.62,0.04,15.06,52
Kotak Infra & Eco Reform Fund(G),2008-02-25,4228,17.61,0.28,0.5,0.92,0.3,-0.88,1.3,0.01,0.02,1.1,0.0,0.0,8,10,11,10,13,16,Nifty Infrastructure - TRI,Kotak Infra & Eco Reform Fund(G),18.43,0.25,0.49,0.88,1.21,2.05,19
ICICI Pru BSE Liquid Rate ETF(IDCW),2018-09-25,35122,0.23,2.49,0.86,0.04,0.15,-159.79,0.01,0.48,0.58,0.0,0.0,-0.63,11,11,7,4,5,24,BSE Liquid Rate Index,ICICI Pru BSE Liquid Rate ETF(IDCW),1.51,2.56,0.85,0.62,0.07,-67.64,25
Motilal Oswal Nifty 500 Index Fund-Reg(G),2019-09-06,43809,14.55,0.17,0.33,1.0,-0.08,4.76,0.99,0.02,0.03,1.03,0.01,0.02,68,61,57,117,101,59,NIFTY 500 - TRI,Motilal Oswal Nifty 500 Index Fund-Reg(G),17.29,0.11,0.15,1.0,-0.02,4.32,115
UTI Infrastructure Fund-Reg(G),2004-04-19,3582,16.09,0.29,0.57,0.95,0.14,3.78,1.22,0.02,0.03,1.17,0.01,0.02,3,9,7,12,15,6,Nifty Infrastructure - TRI,UTI Infrastructure Fund-Reg(G),18.43,0.25,0.49,0.88,1.21,2.05,19
Kotak MNC Fund-Reg(G),2024-10-28,49046,14.98,-0.56,-0.76,1.08,-0.16,,,,,,,,6,6,6,6,3,,NIFTY MNC - TRI,Kotak MNC Fund-Reg(G),13.48,0.03,0.1,0.88,-0.23,-1.07,5
HSBC Overnight Fund-Reg(G),2019-05-22,42784,0.22,2.73,0.93,0.92,0.0,-1495.27,0.0,1.57,0.11,0.0,0.0,-5.93,15,14,3,13,11,32,Nifty 1D Rate Index,HSBC Overnight Fund-Reg(G),0.2,3.5,0.87,0.96,-0.01,-499.81,34
Templeton India Value Fund(G),2003-09-05,3379,14.08,0.27,0.58,0.93,0.36,3.75,0.92,0.02,0.02,0.94,0.0,0.01,8,8,5,8,8,16,NIFTY 500 - TRI,Templeton India Value Fund(G),14.64,0.28,0.58,0.97,0.25,5.76,22
Nippon India Gilt Securities Fund(G),2008-08-22,6291,2.5,0.38,0.88,0.75,0.03,6.12,0.15,0.12,0.19,1.24,0.0,0.02,29,28,29,27,24,21,Nifty All Duration G-Sec Index,Nippon India Gilt Securities Fund(G),2.15,0.57,1.09,0.69,0.05,9.27,35
Franklin India Equity Hybrid Fund(G),1999-12-10,999,9.96,0.27,0.54,1.0,0.18,3.23,0.66,0.04,0.06,2.02,0.0,0.01,29,15,18,34,17,31,CRISIL Hybrid 35+65 - Aggressive Index,Franklin India Equity Hybrid Fund(G),8.53,0.41,0.51,0.8,0.1,1.33,55
Nippon India ETF Nifty IT,2020-06-30,44506,21.73,0.01,0.02,1.0,-0.02,2.87,1.26,0.01,0.01,0.8,0.0,0.01,153,155,155,67,110,109,NIFTY IT - TRI,Nippon India ETF Nifty IT,16.82,0.21,0.41,1.0,0.13,5.88,148
Tata Infrastructure Fund-Reg(G),2004-12-31,3254,18.7,0.24,0.44,0.74,2.47,-6.63,1.37,0.0,0.0,1.13,-0.02,-0.03,13,16,17,5,7,18,BSE India Infrastructure Index - TRI,Tata Infrastructure Fund-Reg(G),18.43,0.25,0.49,0.88,1.21,2.05,19
Kotak Bond Fund-Reg(G),1999-11-25,1968,2.13,0.37,0.74,0.67,0.01,6.98,0.11,0.14,0.22,0.92,0.0,0.03,47,44,40,45,44,49,CRISIL Medium to Long Term Debt Index,Kotak Bond Fund-Reg(G),1.66,0.82,1.04,0.62,0.04,15.06,52
NJ Flexi Cap Fund-Reg(G),2023-09-05,48135,18.53,0.18,0.35,1.16,-0.1,-3.78,1.09,-0.01,-0.02,0.96,-0.03,-0.02,47,32,30,47,37,44,NIFTY 500 - TRI,NJ Flexi Cap Fund-Reg(G),14.83,0.21,0.39,0.98,0.06,6.57,47
Tata Retirement Sav Fund - Mod Plan(G),2011-11-04,15379,12.08,0.2,0.37,0.8,0.17,2.72,0.88,0.04,0.05,2.36,0.0,0.01,26,24,25,9,12,24,CRISIL Hybrid 25+75 - Aggressive Index,Tata Retirement Sav Fund - Mod Plan(G),10.02,0.21,0.42,0.93,0.06,3.54,41
Franklin India Liquid Fund-Super Inst(G),2005-09-02,3406,0.31,2.36,0.97,0.29,0.16,55.54,0.0,0.63,0.33,0.0,0.0,0.22,27,22,17,9,7,33,Nifty Liquid Fund Index,Franklin India Liquid Fund-Super Inst(G),0.29,2.7,0.95,0.77,0.04,99.58,37
Quant Absolute Fund(G),2001-03-20,865,13.45,0.16,0.31,0.87,0.04,-1.76,0.82,-0.02,-0.02,2.25,-0.04,-0.01,52,50,49,26,34,53,NIFTY 50 Hybrid Composite Debt 65:35 Index,Quant Absolute Fund(G),8.53,0.41,0.51,0.8,0.1,1.33,55
HSBC Multi Asset Allocation Fund-Reg(G),2024-02-28,48468,16.82,0.08,0.12,1.03,0.09,1.18,1.02,0.03,0.04,2.62,0.0,0.0,29,26,26,26,24,21,BSE 200 - TRI,HSBC Multi Asset Allocation Fund-Reg(G),8.45,0.4,0.75,0.76,0.41,4.88,24
ICICI Pru PSU Equity Fund-Reg(G),2022-09-12,46106,18.46,0.39,0.95,0.81,0.07,3.75,1.45,0.01,0.02,1.25,0.01,0.01,113,12,12,2,9,68,BSE PSU - TRI,ICICI Pru PSU Equity Fund-Reg(G),17.29,0.11,0.15,1.0,-0.02,4.32,115
Motilal Oswal Nifty Midcap 150 Index Fund-Reg(G),2019-09-06,43810,17.28,0.25,0.49,1.0,-0.07,6.68,1.21,0.03,0.05,1.02,0.03,0.03,108,37,36,142,61,12,Nifty Midcap 150 - TRI,Motilal Oswal Nifty Midcap 150 Index Fund-Reg(G),17.29,0.11,0.15,1.0,-0.02,4.32,115
DSP Nifty 50 Equal Weight Index Fund-Reg(G),2017-10-23,38179,13.91,0.22,0.44,1.0,-0.08,5.72,0.92,0.02,0.02,0.98,0.0,0.02,63,44,44,94,89,48,NIFTY50 Equal Weight - TRI,DSP Nifty 50 Equal Weight Index Fund-Reg(G),17.29,0.11,0.15,1.0,-0.02,4.32,115
Baroda BNP Paribas Mid Cap Fund-Reg(G),2006-05-02,172,15.21,0.24,0.43,0.86,-0.1,6.75,1.08,0.04,0.06,0.92,0.03,0.03,4,21,20,4,19,21,Nifty Midcap 150 - TRI,Baroda BNP Paribas Mid Cap Fund-Reg(G),16.1,0.55,0.52,0.91,0.06,7.77,30
Aditya Birla SL G-Sec Fund(G),1999-10-11,399,2.76,0.33,0.66,0.8,0.0,5.8,0.16,0.11,0.17,1.31,0.0,0.02,35,34,34,29,33,26,Nifty All Duration G-Sec Index,Aditya Birla SL G-Sec Fund(G),2.15,0.57,1.09,0.69,0.05,9.27,35
Mahindra Manulife Focused Fund-Reg(G),2020-11-17,45141,13.86,0.28,0.56,0.91,0.37,5.75,0.97,0.03,0.04,1.02,0.01,0.02,16,9,8,9,6,32,NIFTY 500 - TRI,Mahindra Manulife Focused Fund-Reg(G),14.83,0.21,0.39,0.98,0.06,6.57,47
Bank of India Flexi Cap Fund-Reg(G),2020-06-29,44987,18.19,0.21,0.38,1.17,0.18,1.41,1.39,0.02,0.03,1.22,0.02,0.01,46,22,26,48,17,43,BSE 500 - TRI,Bank of India Flexi Cap Fund-Reg(G),14.83,0.21,0.39,0.98,0.06,6.57,47
DSP Multicap Fund-Reg(G),2024-01-30,48040,17.2,0.06,0.11,1.03,0.1,7.03,1.01,0.04,0.06,0.84,0.03,0.03,39,38,38,38,24,18,Nifty500 Multicap 50:25:25 - TRI,DSP Multicap Fund-Reg(G),15.04,0.18,0.38,0.94,0.09,7.2,37
Sundaram Flexi Cap Fund-Reg(G),2022-09-06,46622,11.75,0.24,0.48,0.87,-0.02,8.16,0.87,0.03,0.04,0.93,0.02,0.03,2,18,16,5,31,18,NIFTY 500 - TRI,Sundaram Flexi Cap Fund-Reg(G),14.83,0.21,0.39,0.98,0.06,6.57,47
Nippon India ETF Nifty Midcap 150,2019-01-31,40028,17.29,0.27,0.52,1.0,-0.01,7.23,1.2,0.03,0.05,1.02,0.03,0.03,113,35,39,60,64,46,Nifty Midcap 150 - TRI,Nippon India ETF Nifty Midcap 150,16.82,0.21,0.41,1.0,0.13,5.88,148
Kotak Special Opportunities Fund-Reg(G),2024-06-29,48809,17.02,-0.35,-0.52,1.12,-0.62,,,,,,,,57,80,80,76,86,,NIFTY 500 - TRI,Kotak Special Opportunities Fund-Reg(G),16.52,0.07,0.22,1.0,-0.03,4.99,60
Nippon India Nifty Smallcap 250 Index Fund-Reg(G),2020-10-16,44504,20.47,0.18,0.31,0.99,-0.11,1.06,1.37,0.02,0.03,1.05,0.02,0.0,150,60,82,50,154,102,Nifty Smallcap 250 - TRI,Nippon India Nifty Smallcap 250 Index Fund-Reg(G),17.29,0.11,0.15,1.0,-0.02,4.32,115
Motilal Oswal Large Cap Fund-Reg(G),2024-02-06,48488,13.74,0.37,0.88,1.01,1.21,21.95,0.88,0.1,0.16,0.91,0.08,0.09,24,1,1,29,1,1,NIFTY 100 - TRI,Motilal Oswal Large Cap Fund-Reg(G),13.7,0.18,0.36,0.96,0.08,5.67,37
SBI Magnum Income Fund-Reg(G),1998-11-25,2776,1.88,0.49,0.92,0.6,0.07,8.09,0.1,0.16,0.26,0.76,0.01,0.03,35,36,38,35,34,44,CRISIL Medium to Long Term Debt Index,SBI Magnum Income Fund-Reg(G),1.66,0.82,1.04,0.62,0.04,15.06,52
Tata Retirement Sav Fund - Prog Plan(G),2011-11-04,15380,14.23,0.18,0.33,0.91,0.0,2.22,1.03,0.03,0.04,2.57,0.0,0.01,37,28,28,17,25,31,NIFTY 500 - TRI,Tata Retirement Sav Fund - Prog Plan(G),10.02,0.21,0.42,0.93,0.06,3.54,41
ICICI Pru Regular Gold Savings Fund(FOF)(G),2011-10-11,14885,11.59,0.33,0.83,0.94,0.86,39.44,0.86,0.12,0.19,-0.42,0.11,0.16,3,12,15,9,14,5,Gold-India,ICICI Pru Regular Gold Savings Fund(FOF)(G),12.91,0.48,1.08,1.05,0.81,-1289.0,16
Axis Strategic Bond Fund-Reg(G),2012-03-28,8136,1.43,0.65,1.06,0.43,0.13,12.07,0.06,0.29,0.52,0.46,0.01,0.05,13,13,12,16,13,20,NIFTY Medium Duration Debt Index,Axis Strategic Bond Fund-Reg(G),1.65,0.7,0.92,0.43,0.1,26.12,29
HSBC CRISIL IBX 50:50 Gilt Plus SDL Apr 2028 Index Fund-Reg(G),2022-03-31,46506,1.95,0.44,0.73,0.61,0.04,14.74,0.06,0.29,0.6,0.36,0.01,0.06,37,37,41,40,37,27,CRISIL IBX 50:50 Gilt Plus SDL Index - April 2028,HSBC CRISIL IBX 50:50 Gilt Plus SDL Apr 2028 Index Fund-Reg(G),1.66,0.82,1.04,0.62,0.04,15.06,52
Quant Quantamental Fund-Reg(G),2021-04-30,45480,17.38,0.26,0.51,1.07,0.47,-8.34,1.12,-0.01,-0.02,1.06,-0.03,-0.03,60,28,27,69,22,60,NIFTY 200 - TRI,Quant Quantamental Fund-Reg(G),16.52,0.07,0.22,1.0,-0.03,4.99,60
ICICI Pru FMCG Fund(G),1999-03-31,1517,12.32,0.19,0.35,0.85,-0.18,7.66,0.82,-0.01,-0.01,0.43,-0.01,0.03,4,16,16,5,19,13,NIFTY FMCG - TRI,ICICI Pru FMCG Fund(G),14.33,0.25,0.46,0.93,-0.03,9.49,17
UTI Gold ETF,2007-04-10,3564,12.86,0.31,0.75,1.28,0.82,-86.71,0.88,0.12,0.18,-0.64,0.11,-0.34,18,21,21,28,21,15,Gold-India,UTI Gold ETF,15.31,0.44,0.99,0.95,0.49,-176.58,28
Mirae Asset Multi Asset Allocation Fund-Reg(G),2024-01-31,48465,7.08,0.29,0.65,0.48,0.47,5.8,0.51,0.07,0.1,1.53,0.02,0.02,7,18,13,7,10,6,NIFTY 500 - TRI,Mirae Asset Multi Asset Allocation Fund-Reg(G),8.45,0.4,0.75,0.76,0.41,4.88,24
Mirae Asset Banking and Financial Services Fund-Reg(G),2020-12-11,45174,15.53,0.22,0.45,0.95,0.15,15.17,1.07,0.05,0.07,1.05,0.04,0.06,16,14,13,14,11,10,Nifty Financial Services - TRI,Mirae Asset Banking and Financial Services Fund-Reg(G),14.97,0.29,0.54,0.91,0.05,13.45,20
Motilal Oswal Nifty Microcap 250 Index Fund-Reg(G),2023-07-05,41176,22.79,0.27,0.49,1.0,-0.13,5.32,1.52,0.04,0.05,1.08,0.04,0.02,168,25,37,61,166,55,Nifty Microcap 250 - TRI,Motilal Oswal Nifty Microcap 250 Index Fund-Reg(G),17.29,0.11,0.15,1.0,-0.02,4.32,115
Edelweiss Gr China Equity Off-Shore Fund-Reg(G),2009-08-26,7869,24.56,-0.03,-0.07,-0.04,-0.22,16.51,1.49,0.06,0.11,0.99,0.08,0.07,51,51,51,4,38,11,MSCI Golden Dragon Index (Total Return Net),Edelweiss Gr China Equity Off-Shore Fund-Reg(G),18.75,0.1,0.18,0.74,0.09,9.0,57
SBI Magnum Constant Maturity Fund-Reg(G),2000-12-25,2756,2.88,0.38,0.76,0.9,0.01,7.99,0.13,0.15,0.25,1.05,0.01,0.03,3,3,3,2,2,3,Nifty 10 yr Benchmark G-Sec,SBI Magnum Constant Maturity Fund-Reg(G),2.73,0.45,0.9,0.95,0.01,7.98,6
